datetime,season,holiday,workingday,weather,temp,humidity,windspeed,count,datetime_parsed,hour,day,month,year,weekday,is_weekend,bad_weather_peak,humid_temp,work_hour,weekend_hour,wind_weather,temp_hour,peak_morning,peak_evening
15/7/12 7:00,3,0,0,1,28.7,79,6.0032,47,2012-07-15 07:00:00,7,15,7,2012,6,1,7,2267.2999999999997,0,7,6.0032,200.9,1,0
14/8/12 15:00,3,0,1,1,33.62,46,15.0013,283,2012-08-14 15:00:00,15,14,8,2012,1,0,15,1546.52,15,0,15.0013,504.29999999999995,0,0
6/2/11 6:00,1,0,0,1,10.66,60,15.0013,1,2011-02-06 06:00:00,6,6,2,2011,6,1,6,639.6,0,6,15.0013,63.96,0,0
6/5/12 17:00,2,0,0,2,26.42506031,61,9.512287721,531,2012-05-06 17:00:00,17,6,5,2012,6,1,34,1611.92867891,0,17,19.024575442,449.22602527,0,1
9/1/12 2:00,1,0,1,1,9.84,56,8.9981,5,2012-01-09 02:00:00,2,9,1,2012,0,0,2,551.04,2,0,8.9981,19.68,0,0
2/12/11 2:00,4,0,1,1,9.84,75,0.0,10,2011-12-02 02:00:00,2,2,12,2011,4,0,2,738.0,2,0,0.0,19.68,0,0
12/2/12 4:00,1,0,0,2,4.1,46,47.9988,1,2012-02-12 04:00:00,4,12,2,2012,6,1,8,188.6,0,4,95.9976,16.4,0,0
15/12/11 8:00,4,0,1,2,13.94,66,15.0013,457,2011-12-15 08:00:00,8,15,12,2011,3,0,16,920.04,8,0,30.0026,111.52,1,0
5/2/11 10:00,1,0,0,3,8.2,100,8.9981,34,2011-02-05 10:00:00,10,5,2,2011,5,1,30,819.9999999999999,0,10,26.994300000000003,82.0,0,0
1/5/11 11:00,2,0,0,1,18.48179919,83,7.776263559,212,2011-05-01 11:00:00,11,1,5,2011,6,1,11,1533.98933277,0,11,7.776263559,203.29979109,0,0
19/3/11 5:00,1,0,0,1,21.32,34,27.9993,2,2011-03-19 05:00:00,5,19,3,2011,5,1,5,724.88,0,5,27.9993,106.6,0,0
13/1/12 10:00,1,0,1,1,9.84,44,30.0026,103,2012-01-13 10:00:00,10,13,1,2012,4,0,10,432.96,10,0,30.0026,98.4,0,0
8/8/12 23:00,3,0,1,1,28.80642791,71,8.981757021,124,2012-08-08 23:00:00,23,8,8,2012,2,0,23,2045.25638161,23,0,8.981757021,662.54784193,0,0
6/4/11 13:00,2,0,1,1,18.86,38,32.9975,112,2011-04-06 13:00:00,13,6,4,2011,2,0,13,716.68,13,0,32.9975,245.18,0,0
4/4/11 6:00,2,0,1,1,17.22,58,19.0012,46,2011-04-04 06:00:00,6,4,4,2011,0,0,6,998.76,6,0,19.0012,103.32,0,0
12/10/11 12:00,4,0,1,3,22.14,88,22.0028,62,2011-10-12 12:00:00,12,12,10,2011,2,0,36,1948.3200000000002,12,0,66.0084,265.68,0,0
10/9/12 20:00,3,0,1,1,24.6,40,12.998,390,2012-09-10 20:00:00,20,10,9,2012,0,0,20,984.0,20,0,12.998,492.0,0,0
3/8/11 21:00,3,0,1,2,27.88,89,8.9981,88,2011-08-03 21:00:00,21,3,8,2011,2,0,42,2481.3199999999997,21,0,17.9962,585.48,0,0
18/12/11 0:00,4,0,0,1,8.2,75,8.9981,71,2011-12-18 00:00:00,0,18,12,2011,6,1,0,615.0,0,0,8.9981,0.0,0,0
11/1/11 6:00,1,0,1,2,6.56,55,8.9981,27,2011-01-11 06:00:00,6,11,1,2011,1,0,12,360.79999999999995,6,0,17.9962,39.36,0,0
1/9/12 18:00,3,0,0,2,33.62,52,0.0,442,2012-09-01 18:00:00,18,1,9,2012,5,1,36,1748.2399999999998,0,18,0.0,605.16,0,1
11/2/11 17:00,1,0,1,1,12.3,24,0.0,211,2011-02-11 17:00:00,17,11,2,2011,4,0,17,295.20000000000005,17,0,0.0,209.10000000000002,0,1
19/3/11 23:00,1,0,0,1,15.58,40,19.9995,50,2011-03-19 23:00:00,23,19,3,2011,5,1,23,623.2,0,23,19.9995,358.34,0,0
11/3/11 10:00,1,0,1,2,13.12,57,19.9995,78,2011-03-11 10:00:00,10,11,3,2011,4,0,20,747.8399999999999,10,0,39.999,131.2,0,0
17/6/11 5:00,2,0,1,1,22.14,100,0.0,13,2011-06-17 05:00:00,5,17,6,2011,4,0,5,2214.0,5,0,0.0,110.7,0,0
10/12/11 4:00,4,0,0,2,10.66,65,7.0015,3,2011-12-10 04:00:00,4,10,12,2011,5,1,8,692.9,0,4,14.003,42.64,0,0
18/5/12 6:00,2,0,1,1,17.45982002,76,9.243106152,170,2012-05-18 06:00:00,6,18,5,2012,4,0,6,1326.9463215199999,6,0,9.243106152,104.75892012,0,0
10/10/11 18:00,4,1,0,2,26.24,53,0.0,473,2011-10-10 18:00:00,18,10,10,2011,0,0,36,1390.72,0,0,0.0,472.32,0,1
4/6/12 11:00,2,0,1,1,25.23215407,40,33.42889545,237,2012-06-04 11:00:00,11,4,6,2012,0,0,11,1009.2861628,11,0,33.42889545,277.55369477,0,0
4/10/12 2:00,4,0,1,1,26.24,89,0.0,13,2012-10-04 02:00:00,2,4,10,2012,3,0,2,2335.3599999999997,2,0,0.0,52.48,0,0
10/9/11 22:00,3,0,0,1,26.24,78,0.0,175,2011-09-10 22:00:00,22,10,9,2011,5,1,22,2046.7199999999998,0,22,0.0,577.28,0,0
1/3/11 9:00,1,0,1,1,9.02,55,27.9993,124,2011-03-01 09:00:00,9,1,3,2011,1,0,9,496.09999999999997,9,0,27.9993,81.17999999999999,1,0
1/9/11 14:00,3,0,1,3,28.80689366,54,16.53356655,181,2011-09-01 14:00:00,14,1,9,2011,3,0,42,1555.57225764,14,0,49.600699649999996,403.29651124,0,0
11/9/12 5:00,3,0,1,1,18.86,72,6.0032,44,2012-09-11 05:00:00,5,11,9,2012,1,0,5,1357.92,5,0,6.0032,94.3,0,0
18/5/11 12:00,2,0,1,1,22.96,94,19.9995,54,2011-05-18 12:00:00,12,18,5,2011,2,0,12,2158.2400000000002,12,0,19.9995,275.52,0,0
4/9/12 17:00,3,0,1,1,31.85781887,69,22.31119989,875,2012-09-04 17:00:00,17,4,9,2012,1,0,17,2198.18950203,17,0,22.31119989,541.58292079,0,1
4/2/11 1:00,1,0,1,2,6.56,59,0.0,7,2011-02-04 01:00:00,1,4,2,2011,4,0,2,387.03999999999996,1,0,0.0,6.56,0,0
16/6/12 23:00,2,0,0,1,24.6,53,19.9995,183,2012-06-16 23:00:00,23,16,6,2012,5,1,23,1303.8000000000002,0,23,19.9995,565.8000000000001,0,0
9/10/11 19:00,4,0,0,1,22.96,73,6.0032,302,2011-10-09 19:00:00,19,9,10,2011,6,1,19,1676.0800000000002,0,19,6.0032,436.24,0,1
19/3/11 14:00,1,0,0,1,20.5,31,32.9975,312,2011-03-19 14:00:00,14,19,3,2011,5,1,14,635.5,0,14,32.9975,287.0,0,0
12/8/11 12:00,3,0,1,1,33.14474248,31,1.827181517,221,2011-08-12 12:00:00,12,12,8,2011,4,0,12,1027.4870168799998,12,0,1.827181517,397.73690976,0,0
12/10/12 15:00,4,0,1,1,21.32,42,30.0026,455,2012-10-12 15:00:00,15,12,10,2012,4,0,15,895.44,15,0,30.0026,319.8,0,0
13/7/12 13:00,3,0,1,2,32.47075781,36,8.755482268,344,2012-07-13 13:00:00,13,13,7,2012,4,0,26,1168.94728116,13,0,17.510964536,422.11985153,0,0
9/4/12 1:00,2,0,1,1,18.86,41,8.9981,16,2012-04-09 01:00:00,1,9,4,2012,0,0,1,773.26,1,0,8.9981,18.86,0,0
8/3/12 17:00,1,0,1,1,25.42,38,43.9989,597,2012-03-08 17:00:00,17,8,3,2012,3,0,17,965.96,17,0,43.9989,432.14000000000004,0,1
3/8/12 18:00,3,0,1,2,33.62,59,16.9979,671,2012-08-03 18:00:00,18,3,8,2012,4,0,36,1983.58,18,0,33.9958,605.16,0,1
19/2/12 18:00,1,0,0,2,12.3,49,22.0028,167,2012-02-19 18:00:00,18,19,2,2012,6,1,36,602.7,0,18,44.0056,221.4,0,1
10/9/11 9:00,3,0,0,1,26.24,78,19.9995,207,2011-09-10 09:00:00,9,10,9,2011,5,1,9,2046.7199999999998,0,9,19.9995,236.16,1,0
12/12/11 2:00,4,0,1,1,8.2,69,0.0,4,2011-12-12 02:00:00,2,12,12,2011,0,0,2,565.8,2,0,0.0,16.4,0,0
8/10/11 8:00,4,0,0,1,18.86,82,0.0,103,2011-10-08 08:00:00,8,8,10,2011,5,1,8,1546.52,0,8,0.0,150.88,1,0
9/5/11 15:00,2,0,1,1,25.42,41,15.0013,199,2011-05-09 15:00:00,15,9,5,2011,0,0,15,1042.22,15,0,15.0013,381.3,0,0
15/10/11 12:00,4,0,0,1,23.78,35,36.9974,456,2011-10-15 12:00:00,12,15,10,2011,5,1,12,832.3000000000001,0,12,36.9974,285.36,0,0
19/8/12 17:00,3,0,0,2,26.24,78,7.0015,343,2012-08-19 17:00:00,17,19,8,2012,6,1,34,2046.7199999999998,0,17,14.003,446.08,0,1
1/8/11 13:00,3,0,1,1,36.9,31,19.9995,150,2011-08-01 13:00:00,13,1,8,2011,0,0,13,1143.8999999999999,13,0,19.9995,479.7,0,0
3/1/11 10:00,1,0,1,1,7.38,43,16.9979,44,2011-01-03 10:00:00,10,3,1,2011,0,0,10,317.34,10,0,16.9979,73.8,0,0
4/3/11 22:00,1,0,1,1,11.22685213,68,12.62414478,34,2011-03-04 22:00:00,22,4,3,2011,4,0,22,763.4259448399999,22,0,12.62414478,246.99074685999997,0,0
6/1/12 20:00,1,0,1,1,17.22,41,12.998,177,2012-01-06 20:00:00,20,6,1,2012,4,0,20,706.02,20,0,12.998,344.4,0,0
12/6/12 19:00,2,0,1,1,27.88,83,12.998,491,2012-06-12 19:00:00,19,12,6,2012,1,0,19,2314.04,19,0,12.998,529.72,0,1
13/4/11 21:00,2,0,1,1,17.22,67,11.0014,117,2011-04-13 21:00:00,21,13,4,2011,2,0,21,1153.74,21,0,11.0014,361.62,0,0
8/1/12 23:00,1,0,0,1,10.66,56,16.9979,30,2012-01-08 23:00:00,23,8,1,2012,6,1,23,596.96,0,23,16.9979,245.18,0,0
11/10/12 16:00,4,0,1,1,20.5,36,8.9981,481,2012-10-11 16:00:00,16,11,10,2012,3,0,16,738.0,16,0,8.9981,328.0,0,0
16/12/11 12:00,4,0,1,2,13.94,42,23.9994,173,2011-12-16 12:00:00,12,16,12,2011,4,0,24,585.48,12,0,47.9988,167.28,0,0
13/5/12 17:00,2,0,0,1,28.7,45,27.9993,478,2012-05-13 17:00:00,17,13,5,2012,6,1,17,1291.5,0,17,27.9993,487.9,0,1
15/8/11 22:00,3,0,1,1,27.06,69,16.9979,98,2011-08-15 22:00:00,22,15,8,2011,0,0,22,1867.1399999999999,22,0,16.9979,595.3199999999999,0,0
12/7/12 7:00,3,0,1,1,25.03034985,70,8.686377014,523,2012-07-12 07:00:00,7,12,7,2012,3,0,7,1752.1244895,7,0,8.686377014,175.21244895,1,0
18/6/12 19:00,2,0,1,2,25.42,73,6.0032,463,2012-06-18 19:00:00,19,18,6,2012,0,0,38,1855.66,19,0,12.0064,482.98,0,1
4/11/12 9:00,4,0,0,1,13.12,53,0.0,217,2012-11-04 09:00:00,9,4,11,2012,6,1,9,695.36,0,9,0.0,118.08,1,0
16/4/12 15:00,2,1,0,1,32.8,33,30.0026,275,2012-04-16 15:00:00,15,16,4,2012,0,0,15,1082.3999999999999,0,0,30.0026,491.99999999999994,0,0
1/6/12 4:00,2,0,1,2,25.42,73,6.0032,6,2012-06-01 04:00:00,4,1,6,2012,4,0,8,1855.66,4,0,12.0064,101.68,0,0
12/9/12 8:00,3,0,1,1,22.96,64,7.0015,770,2012-09-12 08:00:00,8,12,9,2012,2,0,8,1469.44,8,0,7.0015,183.68,1,0
6/6/12 13:00,2,0,1,1,25.42,41,6.0032,303,2012-06-06 13:00:00,13,6,6,2012,2,0,13,1042.22,13,0,6.0032,330.46000000000004,0,0
14/6/12 21:00,2,0,1,1,24.71844623,68,10.97581307,311,2012-06-14 21:00:00,21,14,6,2012,3,0,21,1680.85434364,21,0,10.97581307,519.08737083,0,0
3/7/11 22:00,3,0,0,2,27.06,78,7.0015,162,2011-07-03 22:00:00,22,3,7,2011,6,1,44,2110.68,0,22,14.003,595.3199999999999,0,0
17/1/12 7:00,1,0,1,3,12.3,81,15.0013,126,2012-01-17 07:00:00,7,17,1,2012,1,0,21,996.3000000000001,7,0,45.0039,86.10000000000001,1,0
16/5/11 19:00,2,0,1,1,23.78,83,16.9979,308,2011-05-16 19:00:00,19,16,5,2011,0,0,19,1973.74,19,0,16.9979,451.82000000000005,0,1
11/12/11 23:00,4,0,0,1,8.2,69,0.0,35,2011-12-11 23:00:00,23,11,12,2011,6,1,23,565.8,0,23,0.0,188.6,0,0
2/7/12 4:00,3,0,1,2,29.52,54,19.9995,12,2012-07-02 04:00:00,4,2,7,2012,0,0,8,1594.08,4,0,39.999,118.08,0,0
18/6/12 16:00,2,0,1,2,24.6,73,12.998,332,2012-06-18 16:00:00,16,18,6,2012,0,0,32,1795.8000000000002,16,0,25.996,393.6,0,0
6/7/12 17:00,3,0,1,1,37.91220539,27,0.0,537,2012-07-06 17:00:00,17,6,7,2012,4,0,17,1023.6295455299999,17,0,0.0,644.50749163,0,1
16/1/11 8:00,1,0,0,1,9.02,55,19.0012,18,2011-01-16 08:00:00,8,16,1,2011,6,1,8,496.09999999999997,0,8,19.0012,72.16,1,0
12/4/11 19:00,2,0,1,2,17.22,82,19.0012,130,2011-04-12 19:00:00,19,12,4,2011,1,0,38,1412.04,19,0,38.0024,327.17999999999995,0,1
14/7/12 10:00,3,0,0,2,29.52,70,6.0032,401,2012-07-14 10:00:00,10,14,7,2012,5,1,20,2066.4,0,10,12.0064,295.2,0,0
7/11/12 16:00,4,0,1,2,13.12,53,23.9994,273,2012-11-07 16:00:00,16,7,11,2012,2,0,32,695.36,16,0,47.9988,209.92,0,0
16/3/11 18:00,1,0,1,2,17.26251466,54,15.07567074,247,2011-03-16 18:00:00,18,16,3,2011,2,0,36,932.17579164,18,0,30.15134148,310.72526388,0,1
4/6/11 3:00,2,0,0,1,22.01277154,57,6.086919889,21,2011-06-04 03:00:00,3,4,6,2011,5,1,3,1254.72797778,0,3,6.086919889,66.03831462,0,0
1/7/11 14:00,3,0,1,1,33.70866795,26,13.30024746,320,2011-07-01 14:00:00,14,1,7,2011,4,0,14,876.4253666999999,14,0,13.30024746,471.92135129999997,0,0
16/5/12 19:00,2,0,1,1,28.7,54,19.0012,590,2012-05-16 19:00:00,19,16,5,2012,2,0,19,1549.8,19,0,19.0012,545.3,0,1
4/5/11 7:00,2,0,1,3,15.37071186,94,24.47023273,2,2011-05-04 07:00:00,7,4,5,2011,2,0,21,1444.84691484,7,0,73.41069819,107.59498302,1,0
2/6/12 13:00,2,0,0,1,25.42,41,16.9979,679,2012-06-02 13:00:00,13,2,6,2012,5,1,13,1042.22,0,13,16.9979,330.46000000000004,0,0
12/3/12 22:00,1,0,1,2,22.96,56,15.0013,133,2012-03-12 22:00:00,22,12,3,2012,0,0,44,1285.76,22,0,30.0026,505.12,0,0
11/2/12 12:00,1,0,0,2,10.66,81,11.0014,221,2012-02-11 12:00:00,12,11,2,2012,5,1,24,863.46,0,12,22.0028,127.92,0,0
1/10/12 1:00,4,0,1,1,18.04,77,6.0032,18,2012-10-01 01:00:00,1,1,10,2012,0,0,1,1389.08,1,0,6.0032,18.04,0,0
12/8/11 4:00,3,0,1,1,25.42,53,8.9981,5,2011-08-12 04:00:00,4,12,8,2011,4,0,4,1347.26,4,0,8.9981,101.68,0,0
19/3/11 4:00,1,0,0,1,21.48414299,34,27.58520149,1,2011-03-19 04:00:00,4,19,3,2011,5,1,4,730.46086166,0,4,27.58520149,85.93657196,0,0
10/1/12 21:00,1,0,1,1,13.12,66,6.0032,116,2012-01-10 21:00:00,21,10,1,2012,1,0,21,865.92,21,0,6.0032,275.52,0,0
19/4/11 16:00,2,0,1,1,22.96,52,19.9995,192,2011-04-19 16:00:00,16,19,4,2011,1,0,16,1193.92,16,0,19.9995,367.36,0,0
13/10/12 9:00,4,0,0,1,14.76,50,6.0032,266,2012-10-13 09:00:00,9,13,10,2012,5,1,9,738.0,0,9,6.0032,132.84,1,0
8/2/12 12:00,1,0,1,2,10.02882827,63,19.07543688,134,2012-02-08 12:00:00,12,8,2,2012,2,0,24,631.81618101,12,0,38.15087376,120.34593924,0,0
4/4/11 9:00,2,0,1,2,20.25394978,53,25.4616773,181,2011-04-04 09:00:00,9,4,4,2011,0,0,18,1073.45933834,9,0,50.9233546,182.28554802,1,0
14/7/11 1:00,3,0,1,1,27.06,61,16.9979,25,2011-07-14 01:00:00,1,14,7,2011,3,0,1,1650.6599999999999,1,0,16.9979,27.06,0,0
8/11/12 20:00,4,0,1,1,15.58,29,31.0009,245,2012-11-08 20:00:00,20,8,11,2012,3,0,20,451.82,20,0,31.0009,311.6,0,0
3/10/11 3:00,4,0,1,1,14.76,81,0.0,7,2011-10-03 03:00:00,3,3,10,2011,0,0,3,1195.56,3,0,0.0,44.28,0,0
3/5/11 19:00,2,0,1,1,27.88,57,23.9994,365,2011-05-03 19:00:00,19,3,5,2011,1,0,19,1589.1599999999999,19,0,23.9994,529.72,0,1
5/3/12 6:00,1,0,1,1,7.38,59,8.9981,91,2012-03-05 06:00:00,6,5,3,2012,0,0,6,435.42,6,0,8.9981,44.28,0,0
3/3/11 10:00,1,0,1,1,7.26025487,32,13.93374304,62,2011-03-03 10:00:00,10,3,3,2011,3,0,10,232.32815584,10,0,13.93374304,72.6025487,0,0
1/2/11 0:00,1,0,1,2,6.56,64,7.0015,8,2011-02-01 00:00:00,0,1,2,2011,1,0,0,419.84,0,0,14.003,0.0,0,0
5/11/12 22:00,4,0,1,1,11.48,56,12.998,115,2012-11-05 22:00:00,22,5,11,2012,0,0,22,642.88,22,0,12.998,252.56,0,0
11/11/11 8:00,4,1,0,1,13.30390291,41,23.89097784,265,2011-11-11 08:00:00,8,11,11,2011,4,0,8,545.46001931,0,0,23.89097784,106.43122328,1,0
17/12/11 17:00,4,0,0,1,10.66,48,15.0013,165,2011-12-17 17:00:00,17,17,12,2011,5,1,17,511.68,0,17,15.0013,181.22,0,1
6/12/12 0:00,4,0,1,1,10.73590054,47,18.87006027,35,2012-12-06 00:00:00,0,6,12,2012,3,0,0,504.58732538,0,0,18.87006027,0.0,0,0
4/5/12 14:00,2,0,1,2,27.06,74,19.0012,242,2012-05-04 14:00:00,14,4,5,2012,4,0,28,2002.4399999999998,14,0,38.0024,378.84,0,0
11/9/11 6:00,3,0,0,1,23.78,88,7.0015,20,2011-09-11 06:00:00,6,11,9,2011,6,1,6,2092.6400000000003,0,6,7.0015,142.68,0,0
2/11/11 22:00,4,0,1,1,14.76,71,8.9981,106,2011-11-02 22:00:00,22,2,11,2011,2,0,22,1047.96,22,0,8.9981,324.71999999999997,0,0
16/9/12 7:00,3,0,0,1,20.5,77,7.0015,71,2012-09-16 07:00:00,7,16,9,2012,6,1,7,1578.5,0,7,7.0015,143.5,1,0
16/3/11 3:00,1,0,1,2,11.48,100,15.0013,3,2011-03-16 03:00:00,3,16,3,2011,2,0,6,1148.0,3,0,30.0026,34.44,0,0
4/6/12 5:00,2,0,1,1,21.32,68,0.0,35,2012-06-04 05:00:00,5,4,6,2012,0,0,5,1449.76,5,0,0.0,106.6,0,0
15/10/11 11:00,4,0,0,1,22.96,40,26.0027,374,2011-10-15 11:00:00,11,15,10,2011,5,1,11,918.4000000000001,0,11,26.0027,252.56,0,0
10/4/11 12:00,2,0,0,2,17.22,88,8.9981,230,2011-04-10 12:00:00,12,10,4,2011,6,1,24,1515.36,0,12,17.9962,206.64,0,0
17/6/12 6:00,2,0,0,1,21.32,72,7.0015,23,2012-06-17 06:00:00,6,17,6,2012,6,1,6,1535.04,0,6,7.0015,127.92,0,0
18/2/12 2:00,1,0,0,1,12.3,61,16.9979,45,2012-02-18 02:00:00,2,18,2,2012,5,1,2,750.3000000000001,0,2,16.9979,24.6,0,0
15/1/12 23:00,1,0,0,1,6.56,43,6.0032,29,2012-01-15 23:00:00,23,15,1,2012,6,1,23,282.08,0,23,6.0032,150.88,0,0
3/4/11 0:00,2,0,0,1,12.3,65,12.998,39,2011-04-03 00:00:00,0,3,4,2011,6,1,0,799.5,0,0,12.998,0.0,0,0
5/5/12 6:00,2,0,0,2,22.14,94,0.0,42,2012-05-05 06:00:00,6,5,5,2012,5,1,12,2081.16,0,6,0.0,132.84,0,0
19/10/11 21:00,4,0,1,2,23.61329649,95,9.922948013,93,2011-10-19 21:00:00,21,19,10,2011,2,0,42,2243.26316655,21,0,19.845896026,495.87922629,0,0
15/8/11 9:00,3,0,1,1,26.24,78,22.0028,222,2011-08-15 09:00:00,9,15,8,2011,0,0,9,2046.7199999999998,9,0,22.0028,236.16,1,0
2/2/12 13:00,1,0,1,2,17.22,77,0.0,137,2012-02-02 13:00:00,13,2,2,2012,3,0,26,1325.9399999999998,13,0,0.0,223.85999999999999,0,0
7/1/12 22:00,1,0,0,1,18.04,38,16.9979,109,2012-01-07 22:00:00,22,7,1,2012,5,1,22,685.52,0,22,16.9979,396.88,0,0
8/11/12 1:00,4,0,1,3,12.3,52,23.9994,12,2012-11-08 01:00:00,1,8,11,2012,3,0,3,639.6,1,0,71.9982,12.3,0,0
14/3/12 10:00,1,0,1,1,22.96,56,7.0015,188,2012-03-14 10:00:00,10,14,3,2012,2,0,10,1285.76,10,0,7.0015,229.60000000000002,0,0
9/12/11 1:00,4,0,1,1,9.84,65,0.0,14,2011-12-09 01:00:00,1,9,12,2011,4,0,1,639.6,1,0,0.0,9.84,0,0
15/6/11 7:00,2,0,1,1,21.54769106,60,9.318359755,390,2011-06-15 07:00:00,7,15,6,2011,2,0,7,1292.8614636,7,0,9.318359755,150.83383741999998,1,0
8/11/11 5:00,4,0,1,1,12.3,87,6.0032,18,2011-11-08 05:00:00,5,8,11,2011,1,0,5,1070.1000000000001,5,0,6.0032,61.5,0,0
9/9/11 21:00,3,0,1,1,27.06,89,0.0,203,2011-09-09 21:00:00,21,9,9,2011,4,0,21,2408.3399999999997,21,0,0.0,568.26,0,0
16/4/11 16:00,2,0,0,3,20.5,88,31.0009,33,2011-04-16 16:00:00,16,16,4,2011,5,1,48,1804.0,0,16,93.0027,328.0,0,0
3/7/12 5:00,3,0,1,1,28.7,61,0.0,35,2012-07-03 05:00:00,5,3,7,2012,1,0,5,1750.7,5,0,0.0,143.5,0,0
7/6/12 6:00,2,0,1,1,18.86,88,7.0015,170,2012-06-07 06:00:00,6,7,6,2012,3,0,6,1659.6799999999998,6,0,7.0015,113.16,0,0
18/4/11 14:00,2,0,1,2,23.78,49,12.998,144,2011-04-18 14:00:00,14,18,4,2011,0,0,28,1165.22,14,0,25.996,332.92,0,0
14/9/12 21:00,3,0,1,1,26.24,73,15.0013,312,2012-09-14 21:00:00,21,14,9,2012,4,0,21,1915.52,21,0,15.0013,551.04,0,0
17/10/12 6:00,4,0,1,1,15.0971996,83,0.0,165,2012-10-17 06:00:00,6,17,10,2012,2,0,6,1253.0675668,6,0,0.0,90.5831976,0,0
4/12/11 1:00,4,0,0,1,12.3,75,6.0032,74,2011-12-04 01:00:00,1,4,12,2011,6,1,1,922.5,0,1,6.0032,12.3,0,0
4/3/11 12:00,1,0,1,1,13.12,43,11.0014,97,2011-03-04 12:00:00,12,4,3,2011,4,0,12,564.16,12,0,11.0014,157.44,0,0
5/5/12 19:00,2,0,0,2,25.42,73,22.0028,405,2012-05-05 19:00:00,19,5,5,2012,5,1,38,1855.66,0,19,44.0056,482.98,0,1
19/2/11 13:00,1,0,0,1,18.04,16,40.9973,155,2011-02-19 13:00:00,13,19,2,2011,5,1,13,288.64,0,13,40.9973,234.51999999999998,0,0
18/4/12 0:00,2,0,1,1,22.14,32,11.0014,38,2012-04-18 00:00:00,0,18,4,2012,2,0,0,708.48,0,0,11.0014,0.0,0,0
8/12/12 14:00,4,0,0,2,16.4,87,19.0012,542,2012-12-08 14:00:00,14,8,12,2012,5,1,28,1426.8,0,14,38.0024,229.59999999999997,0,0
13/10/12 22:00,4,0,0,1,16.4,62,0.0,189,2012-10-13 22:00:00,22,13,10,2012,5,1,22,1016.8,0,22,0.0,360.79999999999995,0,0
2/5/12 22:00,2,0,1,1,20.5,82,15.0013,173,2012-05-02 22:00:00,22,2,5,2012,2,0,22,1681.0,22,0,15.0013,451.0,0,0
11/7/12 5:00,3,0,1,1,26.24,89,0.0,41,2012-07-11 05:00:00,5,11,7,2012,2,0,5,2335.3599999999997,5,0,0.0,131.2,0,0
7/2/12 10:00,1,0,1,1,13.94,46,11.0014,116,2012-02-07 10:00:00,10,7,2,2012,1,0,10,641.24,10,0,11.0014,139.4,0,0
1/6/12 8:00,2,0,1,2,26.24,89,12.998,694,2012-06-01 08:00:00,8,1,6,2012,4,0,16,2335.3599999999997,8,0,25.996,209.92,1,0
1/12/11 12:00,4,0,1,1,14.76,46,15.0013,148,2011-12-01 12:00:00,12,1,12,2011,3,0,12,678.96,12,0,15.0013,177.12,0,0
7/4/11 21:00,2,0,1,2,18.04,67,19.0012,108,2011-04-07 21:00:00,21,7,4,2011,3,0,42,1208.6799999999998,21,0,38.0024,378.84,0,0
16/2/12 18:00,1,0,1,3,13.94,87,8.9981,353,2012-02-16 18:00:00,18,16,2,2012,3,0,54,1212.78,18,0,26.994300000000003,250.92,0,1
10/3/11 6:00,1,0,1,3,14.76,0,22.0028,12,2011-03-10 06:00:00,6,10,3,2011,3,0,18,0.0,6,0,66.0084,88.56,0,0
15/4/11 0:00,2,1,0,1,17.42249638,65,0.452368304,1,2011-04-15 00:00:00,0,15,4,2011,4,0,0,1132.4622646999999,0,0,0.452368304,0.0,0,0
11/3/12 18:00,1,0,0,1,21.32,29,19.0012,389,2012-03-11 18:00:00,18,11,3,2012,6,1,18,618.28,0,18,19.0012,383.76,0,1
13/9/11 17:00,3,0,1,1,30.34,51,15.0013,579,2011-09-13 17:00:00,17,13,9,2011,1,0,17,1547.34,17,0,15.0013,515.78,0,1
17/7/12 16:00,3,0,1,1,38.64625182,29,11.249535,378,2012-07-17 16:00:00,16,17,7,2012,1,0,16,1120.74130278,16,0,11.249535,618.34002912,0,0
13/6/11 16:00,2,0,1,1,28.7,37,27.9993,326,2011-06-13 16:00:00,16,13,6,2011,0,0,16,1061.8999999999999,16,0,27.9993,459.2,0,0
14/4/12 14:00,2,0,0,2,26.24,27,30.0026,660,2012-04-14 14:00:00,14,14,4,2012,5,1,28,708.4799999999999,0,14,60.0052,367.35999999999996,0,0
17/1/12 17:00,1,0,1,1,18.86,63,30.0026,462,2012-01-17 17:00:00,17,17,1,2012,1,0,17,1188.18,17,0,30.0026,320.62,0,1
17/7/12 16:00,3,0,1,1,37.72,29,11.0014,381,2012-07-17 16:00:00,16,17,7,2012,1,0,16,1093.8799999999999,16,0,11.0014,603.52,0,0
2/12/12 2:00,4,0,0,2,13.12918838,86,1.148853704,71,2012-12-02 02:00:00,2,2,12,2012,6,1,4,1129.11020068,0,2,2.297707408,26.25837676,0,0
17/12/12 7:00,4,0,1,2,14.76,93,8.9981,319,2012-12-17 07:00:00,7,17,12,2012,0,0,14,1372.68,7,0,17.9962,103.32,1,0
4/7/12 0:00,3,1,0,1,27.88,79,6.0032,159,2012-07-04 00:00:00,0,4,7,2012,2,0,0,2202.52,0,0,6.0032,0.0,0,0
3/10/12 10:00,4,0,1,1,27.06,78,11.0014,175,2012-10-03 10:00:00,10,3,10,2012,2,0,10,2110.68,10,0,11.0014,270.59999999999997,0,0
12/7/11 0:00,3,0,1,1,28.7,79,8.9981,22,2011-07-12 00:00:00,0,12,7,2011,1,0,0,2267.2999999999997,0,0,8.9981,0.0,0,0
10/9/11 5:00,3,0,0,1,23.78,94,8.9981,8,2011-09-10 05:00:00,5,10,9,2011,5,1,5,2235.32,0,5,8.9981,118.9,0,0
6/10/11 12:00,4,0,1,1,22.96,49,6.0032,226,2011-10-06 12:00:00,12,6,10,2011,3,0,12,1125.04,12,0,6.0032,275.52,0,0
9/4/12 12:00,2,0,1,1,22.14,28,47.9988,280,2012-04-09 12:00:00,12,9,4,2012,0,0,12,619.9200000000001,12,0,47.9988,265.68,0,0
11/6/11 14:00,2,0,0,1,33.62,49,7.0015,380,2011-06-11 14:00:00,14,11,6,2011,5,1,14,1647.3799999999999,0,14,7.0015,470.67999999999995,0,0
10/10/11 10:00,4,1,0,1,23.05281648,71,11.76349327,249,2011-10-10 10:00:00,10,10,10,2011,0,0,10,1636.7499700800001,0,0,11.76349327,230.5281648,0,0
11/6/12 1:00,2,0,1,1,27.06,74,11.0014,24,2012-06-11 01:00:00,1,11,6,2012,0,0,1,2002.4399999999998,1,0,11.0014,27.06,0,0
11/6/11 19:00,2,0,0,1,27.06438452,66,12.51662233,288,2011-06-11 19:00:00,19,11,6,2011,5,1,19,1786.24937832,0,19,12.51662233,514.22330588,0,1
14/8/11 16:00,3,0,0,1,29.68136097,66,10.96682079,284,2011-08-14 16:00:00,16,14,8,2011,6,1,16,1958.96982402,0,16,10.96682079,474.90177552,0,0
9/7/12 21:00,3,0,1,2,30.34,55,6.0032,331,2012-07-09 21:00:00,21,9,7,2012,0,0,42,1668.7,21,0,12.0064,637.14,0,0
7/5/12 12:00,2,0,1,2,22.96,68,15.0013,263,2012-05-07 12:00:00,12,7,5,2012,0,0,24,1561.28,12,0,30.0026,275.52,0,0
2/11/12 20:00,4,0,1,2,14.13760333,45,25.87179418,222,2012-11-02 20:00:00,20,2,11,2012,4,0,40,636.19214985,20,0,51.74358836,282.7520666,0,0
4/7/12 23:00,3,1,0,2,31.98,43,6.0032,183,2012-07-04 23:00:00,23,4,7,2012,2,0,46,1375.14,0,0,12.0064,735.54,0,0
7/8/11 19:00,3,0,0,1,29.52,79,11.0014,228,2011-08-07 19:00:00,19,7,8,2011,6,1,19,2332.08,0,19,11.0014,560.88,0,1
9/5/11 4:00,2,0,1,1,17.22,82,11.0014,4,2011-05-09 04:00:00,4,9,5,2011,0,0,4,1412.04,4,0,11.0014,68.88,0,0
11/9/12 21:00,3,0,1,1,23.57139726,63,6.534099997,302,2012-09-11 21:00:00,21,11,9,2012,1,0,21,1484.9980273800002,21,0,6.534099997,494.99934246000004,0,0
4/11/12 6:00,4,0,0,1,11.48,61,8.9981,16,2012-11-04 06:00:00,6,4,11,2012,6,1,6,700.28,0,6,8.9981,68.88,0,0
18/3/12 10:00,1,0,0,2,17.22,88,7.0015,351,2012-03-18 10:00:00,10,18,3,2012,6,1,20,1515.36,0,10,14.003,172.2,0,0
1/1/11 3:00,1,0,0,1,9.84,75,0.0,13,2011-01-01 03:00:00,3,1,1,2011,5,1,3,738.0,0,3,0.0,29.52,0,0
19/1/11 20:00,1,0,1,1,13.12,49,19.9995,76,2011-01-19 20:00:00,20,19,1,2011,2,0,20,642.88,20,0,19.9995,262.4,0,0
10/5/11 5:00,2,0,1,1,16.4,66,15.0013,29,2011-05-10 05:00:00,5,10,5,2011,1,0,5,1082.3999999999999,5,0,15.0013,82.0,0,0
14/4/11 3:00,2,0,1,1,13.94,81,8.9981,2,2011-04-14 03:00:00,3,14,4,2011,3,0,3,1129.1399999999999,3,0,8.9981,41.82,0,0
4/4/12 10:00,2,0,1,2,22.14,45,8.9981,167,2012-04-04 10:00:00,10,4,4,2012,2,0,20,996.3000000000001,10,0,17.9962,221.4,0,0
9/5/11 7:00,2,0,1,1,19.68,63,16.9979,237,2011-05-09 07:00:00,7,9,5,2011,0,0,7,1239.84,7,0,16.9979,137.76,1,0
8/9/11 9:00,3,0,1,2,25.42,100,16.9979,69,2011-09-08 09:00:00,9,8,9,2011,3,0,18,2542.0,9,0,33.9958,228.78000000000003,1,0
9/10/12 20:00,4,0,1,2,20.5,72,11.0014,360,2012-10-09 20:00:00,20,9,10,2012,1,0,40,1476.0,20,0,22.0028,410.0,0,0
11/4/11 11:00,2,0,1,2,24.32922401,74,20.00858166,142,2011-04-11 11:00:00,11,11,4,2011,0,0,22,1800.3625767400001,11,0,40.01716332,267.62146411000003,0,0
19/5/12 9:00,2,0,0,1,22.96,43,11.0014,292,2012-05-19 09:00:00,9,19,5,2012,5,1,9,987.2800000000001,0,9,11.0014,206.64000000000001,1,0
10/1/11 13:00,1,0,1,2,8.2,40,19.0012,54,2011-01-10 13:00:00,13,10,1,2011,0,0,26,328.0,13,0,38.0024,106.6,0,0
5/8/12 5:00,3,0,0,1,29.52,74,16.9979,19,2012-08-05 05:00:00,5,5,8,2012,6,1,5,2184.48,0,5,16.9979,147.6,0,0
17/6/11 1:00,2,0,1,1,22.96,94,8.9981,23,2011-06-17 01:00:00,1,17,6,2011,4,0,1,2158.2400000000002,1,0,8.9981,22.96,0,0
1/10/12 18:00,4,0,1,3,22.96,64,7.0015,613,2012-10-01 18:00:00,18,1,10,2012,0,0,54,1469.44,18,0,21.0045,413.28000000000003,0,1
7/7/12 3:00,3,0,0,1,30.34,74,8.9981,31,2012-07-07 03:00:00,3,7,7,2012,5,1,3,2245.16,0,3,8.9981,91.02,0,0
12/5/11 1:00,2,0,1,1,18.86,88,15.0013,17,2011-05-12 01:00:00,1,12,5,2011,3,0,1,1659.6799999999998,1,0,15.0013,18.86,0,0
12/8/12 17:00,3,0,0,1,33.56267303,31,0.0,516,2012-08-12 17:00:00,17,12,8,2012,6,1,17,1040.44286393,0,17,0.0,570.56544151,0,1
5/1/12 2:00,1,0,1,1,8.2,51,6.0032,4,2012-01-05 02:00:00,2,5,1,2012,3,0,2,418.2,2,0,6.0032,16.4,0,0
3/9/12 4:00,3,1,0,1,27.06,89,6.0032,11,2012-09-03 04:00:00,4,3,9,2012,0,0,4,2408.3399999999997,0,0,6.0032,108.24,0,0
10/6/11 8:00,2,0,1,1,30.34,58,8.9981,452,2011-06-10 08:00:00,8,10,6,2011,4,0,8,1759.72,8,0,8.9981,242.72,1,0
9/3/12 0:00,1,0,1,2,23.78,49,31.0009,54,2012-03-09 00:00:00,0,9,3,2012,4,0,0,1165.22,0,0,62.0018,0.0,0,0
10/9/11 1:00,3,0,0,2,25.42,94,0.0,83,2011-09-10 01:00:00,1,10,9,2011,5,1,2,2389.48,0,1,0.0,25.42,0,0
7/8/11 2:00,3,0,0,2,28.7347959,84,14.36254132,76,2011-08-07 02:00:00,2,7,8,2011,6,1,4,2413.7228556,0,2,28.72508264,57.4695918,0,0
5/9/12 7:00,3,0,1,2,28.7,79,16.9979,500,2012-09-05 07:00:00,7,5,9,2012,2,0,14,2267.2999999999997,7,0,33.9958,200.9,1,0
10/6/12 13:00,2,0,0,1,34.44,28,8.9981,492,2012-06-10 13:00:00,13,10,6,2012,6,1,13,964.3199999999999,0,13,8.9981,447.71999999999997,0,0
3/1/11 8:00,1,0,1,1,5.74,50,19.0012,154,2011-01-03 08:00:00,8,3,1,2011,0,0,8,287.0,8,0,19.0012,45.92,1,0
9/6/11 0:00,2,0,1,2,30.34,79,8.9981,47,2011-06-09 00:00:00,0,9,6,2011,3,0,0,2396.86,0,0,17.9962,0.0,0,0
3/7/12 6:00,3,0,1,1,28.7,65,8.9981,154,2012-07-03 06:00:00,6,3,7,2012,1,0,6,1865.5,6,0,8.9981,172.2,0,0
1/4/11 1:00,2,0,1,3,10.66,100,11.0014,4,2011-04-01 01:00:00,1,1,4,2011,4,0,3,1066.0,1,0,33.0042,10.66,0,0
16/1/12 1:00,1,1,0,1,5.74,43,7.0015,20,2012-01-16 01:00:00,1,16,1,2012,0,0,1,246.82000000000002,0,0,7.0015,5.74,0,0
14/6/12 12:00,2,0,1,2,27.06,61,15.0013,265,2012-06-14 12:00:00,12,14,6,2012,3,0,24,1650.6599999999999,12,0,30.0026,324.71999999999997,0,0
16/4/12 19:00,2,1,0,1,31.16,35,26.0027,522,2012-04-16 19:00:00,19,16,4,2012,0,0,19,1090.6,0,0,26.0027,592.04,0,1
8/3/11 6:00,1,0,1,1,8.2,59,0.0,45,2011-03-08 06:00:00,6,8,3,2011,1,0,6,483.79999999999995,6,0,0.0,49.199999999999996,0,0
18/6/11 19:00,2,0,0,2,30.34,51,7.0015,326,2011-06-18 19:00:00,19,18,6,2011,5,1,38,1547.34,0,19,14.003,576.46,0,1
9/4/11 1:00,2,0,0,2,12.3,87,8.9981,20,2011-04-09 01:00:00,1,9,4,2011,5,1,2,1070.1000000000001,0,1,17.9962,12.3,0,0
2/7/12 0:00,3,0,1,2,31.16,58,15.0013,43,2012-07-02 00:00:00,0,2,7,2012,0,0,0,1807.28,0,0,30.0026,0.0,0,0
3/9/12 15:00,3,1,0,1,30.34,70,15.0013,449,2012-09-03 15:00:00,15,3,9,2012,0,0,15,2123.8,0,0,15.0013,455.1,0,0
15/6/11 14:00,2,0,1,1,30.34,28,0.0,178,2011-06-15 14:00:00,14,15,6,2011,2,0,14,849.52,14,0,0.0,424.76,0,0
14/8/12 5:00,3,0,1,2,27.02780494,89,12.58199706,37,2012-08-14 05:00:00,5,14,8,2012,1,0,10,2405.47463966,5,0,25.16399412,135.1390247,0,0
2/6/12 16:00,2,0,0,1,26.24,38,16.9979,644,2012-06-02 16:00:00,16,2,6,2012,5,1,16,997.1199999999999,0,16,16.9979,419.84,0,0
5/2/11 22:00,1,0,0,1,10.66,93,8.9981,45,2011-02-05 22:00:00,22,5,2,2011,5,1,22,991.38,0,22,8.9981,234.52,0,0
13/4/11 13:00,2,0,1,2,18.04,77,12.998,61,2011-04-13 13:00:00,13,13,4,2011,2,0,26,1389.08,13,0,25.996,234.51999999999998,0,0
18/10/12 16:00,4,0,1,1,24.6,56,19.0012,450,2012-10-18 16:00:00,16,18,10,2012,3,0,16,1377.6000000000001,16,0,19.0012,393.6,0,0
2/12/12 9:00,4,0,0,2,11.48,93,11.0014,172,2012-12-02 09:00:00,9,2,12,2012,6,1,18,1067.64,0,9,22.0028,103.32000000000001,1,0
14/9/11 23:00,3,0,1,2,26.24,69,7.0015,72,2011-09-14 23:00:00,23,14,9,2011,2,0,46,1810.56,23,0,14.003,603.52,0,0
11/4/11 7:00,2,0,1,2,20.5,88,15.0013,176,2011-04-11 07:00:00,7,11,4,2011,0,0,14,1804.0,7,0,30.0026,143.5,1,0
17/7/12 12:00,3,0,1,2,36.9,35,0.0,254,2012-07-17 12:00:00,12,17,7,2012,1,0,24,1291.5,12,0,0.0,442.79999999999995,0,0
5/11/12 21:00,4,0,1,1,12.3,52,19.0012,152,2012-11-05 21:00:00,21,5,11,2012,0,0,21,639.6,21,0,19.0012,258.3,0,0
3/5/11 17:00,2,0,1,1,28.7,54,31.0009,517,2011-05-03 17:00:00,17,3,5,2011,1,0,17,1549.8,17,0,31.0009,487.9,0,1
18/1/12 21:00,1,0,1,1,8.2,40,27.9993,124,2012-01-18 21:00:00,21,18,1,2012,2,0,21,328.0,21,0,27.9993,172.2,0,0
1/4/12 11:00,2,0,0,2,16.4,71,12.998,451,2012-04-01 11:00:00,11,1,4,2012,6,1,22,1164.3999999999999,0,11,25.996,180.39999999999998,0,0
15/5/12 16:00,2,0,1,1,29.01293626,62,11.09808471,370,2012-05-15 16:00:00,16,15,5,2012,1,0,16,1798.80204812,16,0,11.09808471,464.20698016,0,0
10/3/11 20:00,1,0,1,3,14.7582467,0,22.33908106,38,2011-03-10 20:00:00,20,10,3,2011,3,0,60,0.0,20,0,67.01724318000001,295.164934,0,0
4/12/11 10:00,4,0,0,1,13.12,81,8.9981,216,2011-12-04 10:00:00,10,4,12,2011,6,1,10,1062.72,0,10,8.9981,131.2,0,0
8/7/12 8:00,3,0,0,1,35.10593607,51,10.20484458,123,2012-07-08 08:00:00,8,8,7,2012,6,1,8,1790.40273957,0,8,10.20484458,280.84748856,1,0
4/6/12 12:00,2,0,1,1,26.24,41,30.0026,282,2012-06-04 12:00:00,12,4,6,2012,0,0,12,1075.84,12,0,30.0026,314.88,0,0
19/8/12 4:00,3,0,0,2,25.42,65,11.0014,26,2012-08-19 04:00:00,4,19,8,2012,6,1,8,1652.3000000000002,0,4,22.0028,101.68,0,0
19/7/11 0:00,3,0,1,1,30.34,66,7.0015,51,2011-07-19 00:00:00,0,19,7,2011,1,0,0,2002.44,0,0,7.0015,0.0,0,0
9/1/11 6:00,1,0,0,1,4.1,49,19.0012,1,2011-01-09 06:00:00,6,9,1,2011,6,1,6,200.89999999999998,0,6,19.0012,24.599999999999998,0,0
10/8/11 8:00,3,0,1,1,30.34,51,12.998,399,2011-08-10 08:00:00,8,10,8,2011,2,0,8,1547.34,8,0,12.998,242.72,1,0
4/8/11 4:00,3,0,1,2,29.39515084,90,0.0,23,2011-08-04 04:00:00,4,4,8,2011,3,0,8,2645.5635756,4,0,0.0,117.58060336,0,0
11/2/12 23:00,1,0,0,3,4.92,50,32.9975,20,2012-02-11 23:00:00,23,11,2,2012,5,1,69,246.0,0,23,98.9925,113.16,0,0
3/9/11 18:00,3,0,0,1,29.52,70,11.0014,339,2011-09-03 18:00:00,18,3,9,2011,5,1,18,2066.4,0,18,11.0014,531.36,0,1
13/3/12 17:00,1,0,1,1,28.7,37,7.0015,676,2012-03-13 17:00:00,17,13,3,2012,1,0,17,1061.8999999999999,17,0,7.0015,487.9,0,1
8/3/12 0:00,1,0,1,1,18.04,62,22.0028,46,2012-03-08 00:00:00,0,8,3,2012,3,0,0,1118.48,0,0,22.0028,0.0,0,0
10/10/12 14:00,4,0,1,1,24.85243992,39,12.43706499,292,2012-10-10 14:00:00,14,10,10,2012,2,0,14,969.24515688,14,0,12.43706499,347.93415888,0,0
4/8/12 9:00,3,0,0,1,31.62978095,67,15.65231162,256,2012-08-04 09:00:00,9,4,8,2012,5,1,9,2119.19532365,0,9,15.65231162,284.66802855000003,1,0
4/9/12 8:00,3,0,1,1,28.7,84,11.0014,632,2012-09-04 08:00:00,8,4,9,2012,1,0,8,2410.7999999999997,8,0,11.0014,229.6,1,0
17/7/11 0:00,3,0,0,1,27.06,65,15.0013,125,2011-07-17 00:00:00,0,17,7,2011,6,1,0,1758.8999999999999,0,0,15.0013,0.0,0,0
4/10/11 1:00,4,0,1,2,16.4,87,7.0015,9,2011-10-04 01:00:00,1,4,10,2011,1,0,2,1426.8,1,0,14.003,16.4,0,0
7/8/12 17:00,3,0,1,2,31.98,62,8.9981,868,2012-08-07 17:00:00,17,7,8,2012,1,0,34,1982.76,17,0,17.9962,543.66,0,1
10/5/11 22:00,2,0,1,1,21.40955179,55,6.87152364,139,2011-05-10 22:00:00,22,10,5,2011,1,0,22,1177.52534845,22,0,6.87152364,471.01013937999994,0,0
14/10/12 11:00,4,0,0,1,22.96,52,19.9995,494,2012-10-14 11:00:00,11,14,10,2012,6,1,11,1193.92,0,11,19.9995,252.56,0,0
13/9/11 2:00,3,0,1,1,24.6,78,0.0,2,2011-09-13 02:00:00,2,13,9,2011,1,0,2,1918.8000000000002,2,0,0.0,49.2,0,0
4/6/11 5:00,2,0,0,1,20.5,64,0.0,8,2011-06-04 05:00:00,5,4,6,2011,5,1,5,1312.0,0,5,0.0,102.5,0,0
4/6/12 8:00,2,0,1,1,24.6,49,15.0013,665,2012-06-04 08:00:00,8,4,6,2012,0,0,8,1205.4,8,0,15.0013,196.8,1,0
2/3/12 12:00,1,0,1,1,16.4,43,11.0014,234,2012-03-02 12:00:00,12,2,3,2012,4,0,12,705.1999999999999,12,0,11.0014,196.79999999999998,0,0
2/11/12 15:00,4,0,1,2,16.98448476,42,27.99692826,306,2012-11-02 15:00:00,15,2,11,2012,4,0,30,713.34835992,15,0,55.99385652,254.76727140000003,0,0
1/7/12 9:00,3,0,0,1,33.62,56,0.0,219,2012-07-01 09:00:00,9,1,7,2012,6,1,9,1882.7199999999998,0,9,0.0,302.58,1,0
15/6/12 13:00,2,0,1,1,28.06928146,39,17.4779078,397,2012-06-15 13:00:00,13,15,6,2012,4,0,13,1094.70197694,13,0,17.4779078,364.90065898,0,0
17/10/11 11:00,4,0,1,1,23.0841183,46,0.0,194,2011-10-17 11:00:00,11,17,10,2011,0,0,11,1061.8694418,11,0,0.0,253.9253013,0,0
14/10/12 3:00,4,0,0,1,17.22,77,19.9995,28,2012-10-14 03:00:00,3,14,10,2012,6,1,3,1325.9399999999998,0,3,19.9995,51.66,0,0
17/10/12 6:00,4,0,1,1,15.58,82,0.0,178,2012-10-17 06:00:00,6,17,10,2012,2,0,6,1277.56,6,0,0.0,93.48,0,0
3/8/11 4:00,3,0,1,2,31.16,52,11.0014,7,2011-08-03 04:00:00,4,3,8,2011,2,0,8,1620.32,4,0,22.0028,124.64,0,0
7/4/12 11:00,2,0,0,1,18.04,24,19.9995,495,2012-04-07 11:00:00,11,7,4,2012,5,1,11,432.96,0,11,19.9995,198.44,0,0
11/10/11 21:00,4,0,1,2,23.78,78,12.998,175,2011-10-11 21:00:00,21,11,10,2011,1,0,42,1854.8400000000001,21,0,25.996,499.38,0,0
16/7/12 8:00,3,0,1,1,30.34,66,7.0015,667,2012-07-16 08:00:00,8,16,7,2012,0,0,8,2002.44,8,0,7.0015,242.72,1,0
6/3/11 0:00,1,0,0,2,17.22,77,23.9994,52,2011-03-06 00:00:00,0,6,3,2011,6,1,0,1325.9399999999998,0,0,47.9988,0.0,0,0
12/7/12 10:00,3,0,1,1,30.34,48,11.0014,214,2012-07-12 10:00:00,10,12,7,2012,3,0,10,1456.32,10,0,11.0014,303.4,0,0
15/5/12 3:00,2,0,1,3,23.78,83,8.9981,6,2012-05-15 03:00:00,3,15,5,2012,1,0,9,1973.74,3,0,26.994300000000003,71.34,0,0
15/1/12 18:00,1,0,0,1,7.38,29,15.0013,120,2012-01-15 18:00:00,18,15,1,2012,6,1,18,214.02,0,18,15.0013,132.84,0,1
1/1/12 22:00,1,0,0,1,18.86,55,27.9993,66,2012-01-01 22:00:00,22,1,1,2012,6,1,22,1037.3,0,22,27.9993,414.91999999999996,0,0
12/4/11 14:00,2,0,1,2,20.5,82,19.0012,44,2011-04-12 14:00:00,14,12,4,2011,1,0,28,1681.0,14,0,38.0024,287.0,0,0
5/8/11 20:00,3,0,1,1,30.29599457,59,13.17075462,268,2011-08-05 20:00:00,20,5,8,2011,4,0,20,1787.4636796300001,20,0,13.17075462,605.9198914,0,0
4/4/12 16:00,2,0,1,2,26.24,44,19.0012,390,2012-04-04 16:00:00,16,4,4,2012,2,0,32,1154.56,16,0,38.0024,419.84,0,0
5/11/12 5:00,4,0,1,2,12.73254675,49,23.20278609,64,2012-11-05 05:00:00,5,5,11,2012,0,0,10,623.89479075,5,0,46.40557218,63.662733749999994,0,0
18/7/11 11:00,3,0,1,1,32.8,55,6.0032,141,2011-07-18 11:00:00,11,18,7,2011,0,0,11,1803.9999999999998,11,0,6.0032,360.79999999999995,0,0
9/5/11 16:00,2,0,1,1,26.24,38,15.0013,304,2011-05-09 16:00:00,16,9,5,2011,0,0,16,997.1199999999999,16,0,15.0013,419.84,0,0
5/11/11 23:00,4,0,0,1,11.48,70,0.0,85,2011-11-05 23:00:00,23,5,11,2011,5,1,23,803.6,0,23,0.0,264.04,0,0
6/4/11 14:00,2,0,1,1,20.5,34,27.9993,115,2011-04-06 14:00:00,14,6,4,2011,2,0,14,697.0,14,0,27.9993,287.0,0,0
19/4/12 18:00,2,0,1,1,24.6,43,6.0032,776,2012-04-19 18:00:00,18,19,4,2012,3,0,18,1057.8,18,0,6.0032,442.8,0,1
9/1/11 20:00,1,0,0,1,5.74,46,16.9979,38,2011-01-09 20:00:00,20,9,1,2011,6,1,20,264.04,0,20,16.9979,114.80000000000001,0,0
7/7/12 15:00,3,0,0,1,39.36,26,0.0,306,2012-07-07 15:00:00,15,7,7,2012,5,1,15,1023.36,0,15,0.0,590.4,0,0
12/12/11 10:00,4,0,1,2,9.02,69,7.0015,105,2011-12-12 10:00:00,10,12,12,2011,0,0,20,622.38,10,0,14.003,90.19999999999999,0,0
17/6/11 15:00,2,0,1,1,32.26778865,45,13.6539963,231,2011-06-17 15:00:00,15,17,6,2011,4,0,15,1452.05048925,15,0,13.6539963,484.01682975,0,0
4/7/11 18:00,3,1,0,1,32.8,46,8.9981,418,2011-07-04 18:00:00,18,4,7,2011,0,0,18,1508.8,0,0,8.9981,590.4,0,1
18/3/11 19:00,1,0,1,1,26.18189724,44,9.648038498,174,2011-03-18 19:00:00,19,18,3,2011,4,0,19,1152.00347856,19,0,9.648038498,497.45604756,0,1
16/8/12 10:00,3,0,1,1,30.34,48,8.9981,199,2012-08-16 10:00:00,10,16,8,2012,3,0,10,1456.32,10,0,8.9981,303.4,0,0
5/1/11 11:00,1,0,1,1,10.66,33,22.0028,46,2011-01-05 11:00:00,11,5,1,2011,2,0,11,351.78000000000003,11,0,22.0028,117.26,0,0
12/3/11 9:00,1,0,0,1,11.13025297,67,4.484438652,110,2011-03-12 09:00:00,9,12,3,2011,5,1,9,745.7269489900001,0,9,4.484438652,100.17227673000001,1,0
2/12/11 15:00,4,0,1,1,17.22,41,6.0032,199,2011-12-02 15:00:00,15,2,12,2011,4,0,15,706.02,15,0,6.0032,258.29999999999995,0,0
11/9/12 9:00,3,0,1,1,24.6,49,0.0,358,2012-09-11 09:00:00,9,11,9,2012,1,0,9,1205.4,9,0,0.0,221.4,1,0
14/4/12 8:00,2,0,0,1,14.76,71,8.9981,160,2012-04-14 08:00:00,8,14,4,2012,5,1,8,1047.96,0,8,8.9981,118.08,1,0
16/11/11 5:00,4,0,1,3,18.86,94,7.0015,13,2011-11-16 05:00:00,5,16,11,2011,2,0,15,1772.84,5,0,21.0045,94.3,0,0
18/5/12 17:00,2,0,1,1,26.59269983,30,9.31817159,816,2012-05-18 17:00:00,17,18,5,2012,4,0,17,797.7809949,17,0,9.31817159,452.07589711,0,1
16/5/11 0:00,2,0,1,1,21.7172918,93,7.007513947,27,2011-05-16 00:00:00,0,16,5,2011,0,0,0,2019.7081374000002,0,0,7.007513947,0.0,0,0
12/2/11 21:00,1,0,0,1,10.66,41,0.0,51,2011-02-12 21:00:00,21,12,2,2011,5,1,21,437.06,0,21,0.0,223.86,0,0
14/7/11 23:00,3,0,1,1,26.24,65,16.9979,124,2011-07-14 23:00:00,23,14,7,2011,3,0,23,1705.6,23,0,16.9979,603.52,0,0
17/12/12 17:00,4,0,1,2,16.4,94,16.9979,495,2012-12-17 17:00:00,17,17,12,2012,0,0,34,1541.6,17,0,33.9958,278.79999999999995,0,1
15/7/11 16:00,3,0,1,1,29.52,51,12.998,361,2011-07-15 16:00:00,16,15,7,2011,4,0,16,1505.52,16,0,12.998,472.32,0,0
18/6/11 14:00,2,0,0,2,32.8,46,19.0012,334,2011-06-18 14:00:00,14,18,6,2011,5,1,28,1508.8,0,14,38.0024,459.19999999999993,0,0
7/8/12 15:00,3,0,1,1,32.8,52,0.0,306,2012-08-07 15:00:00,15,7,8,2012,1,0,15,1705.6,15,0,0.0,491.99999999999994,0,0
10/5/12 19:00,2,0,1,1,22.14,37,23.9994,553,2012-05-10 19:00:00,19,10,5,2012,3,0,19,819.1800000000001,19,0,23.9994,420.66,0,1
7/10/11 19:00,4,0,1,1,22.66061134,48,0.0,291,2011-10-07 19:00:00,19,7,10,2011,4,0,19,1087.70934432,19,0,0.0,430.55161546,0,1
6/10/12 13:00,4,0,0,2,26.24,57,35.0008,710,2012-10-06 13:00:00,13,6,10,2012,5,1,26,1495.6799999999998,0,13,70.0016,341.12,0,0
4/1/12 16:00,1,0,1,2,7.38,40,19.0012,131,2012-01-04 16:00:00,16,4,1,2012,2,0,32,295.2,16,0,38.0024,118.08,0,0
3/3/11 3:00,1,0,1,1,8.2,27,31.0009,1,2011-03-03 03:00:00,3,3,3,2011,3,0,3,221.39999999999998,3,0,31.0009,24.599999999999998,0,0
1/9/12 10:00,3,0,0,2,31.98,55,12.998,417,2012-09-01 10:00:00,10,1,9,2012,5,1,20,1758.9,0,10,25.996,319.8,0,0
10/4/12 9:00,2,0,1,1,18.33832701,69,12.93155275,326,2012-04-10 09:00:00,9,10,4,2012,1,0,9,1265.34456369,9,0,12.93155275,165.04494309,1,0
3/10/12 11:00,4,0,1,1,27.06,78,11.0014,230,2012-10-03 11:00:00,11,3,10,2012,2,0,11,2110.68,11,0,11.0014,297.65999999999997,0,0
5/10/11 2:00,4,0,1,1,18.86,82,11.0014,3,2011-10-05 02:00:00,2,5,10,2011,2,0,2,1546.52,2,0,11.0014,37.72,0,0
9/6/11 10:00,2,0,1,1,35.26,50,19.0012,94,2011-06-09 10:00:00,10,9,6,2011,3,0,10,1763.0,10,0,19.0012,352.59999999999997,0,0
15/10/11 2:00,4,0,0,1,18.86,59,12.998,56,2011-10-15 02:00:00,2,15,10,2011,5,1,2,1112.74,0,2,12.998,37.72,0,0
13/8/11 8:00,3,0,0,2,28.7,65,11.0014,118,2011-08-13 08:00:00,8,13,8,2011,5,1,16,1865.5,0,8,22.0028,229.6,1,0
2/2/11 5:00,1,0,1,3,9.02,93,7.0015,3,2011-02-02 05:00:00,5,2,2,2011,2,0,15,838.86,5,0,21.0045,45.099999999999994,0,0
2/11/11 10:00,4,0,1,1,16.4,71,6.0032,133,2011-11-02 10:00:00,10,2,11,2011,2,0,10,1164.3999999999999,10,0,6.0032,164.0,0,0
2/2/12 5:00,1,0,1,3,15.3041124,81,0.0,21,2012-02-02 05:00:00,5,2,2,2012,3,0,15,1239.6331043999999,5,0,0.0,76.520562,0,0
11/11/11 20:00,4,1,0,1,13.12,39,12.998,109,2011-11-11 20:00:00,20,11,11,2011,4,0,20,511.67999999999995,0,0,12.998,262.4,0,0
18/11/11 12:00,4,0,1,1,13.12,33,0.0,165,2011-11-18 12:00:00,12,18,11,2011,4,0,12,432.96,12,0,0.0,157.44,0,0
4/9/11 21:00,3,0,0,1,29.52,74,16.9979,207,2011-09-04 21:00:00,21,4,9,2011,6,1,21,2184.48,0,21,16.9979,619.92,0,0
4/10/11 11:00,4,0,1,1,22.77847994,60,17.89132388,95,2011-10-04 11:00:00,11,4,10,2011,1,0,11,1366.7087964,11,0,17.89132388,250.56327934,0,0
15/3/12 7:00,1,0,1,1,18.04,72,6.0032,381,2012-03-15 07:00:00,7,15,3,2012,3,0,7,1298.8799999999999,7,0,6.0032,126.28,1,0
1/12/11 22:00,4,0,1,1,11.93027898,59,0.045761371,76,2011-12-01 22:00:00,22,1,12,2011,3,0,22,703.88645982,22,0,0.045761371,262.46613756,0,0
5/7/12 0:00,3,0,1,1,30.34,51,7.0015,88,2012-07-05 00:00:00,0,5,7,2012,3,0,0,1547.34,0,0,7.0015,0.0,0,0
14/9/11 22:00,3,0,1,2,27.06,65,8.9981,160,2011-09-14 22:00:00,22,14,9,2011,2,0,44,1758.8999999999999,22,0,17.9962,595.3199999999999,0,0
6/6/12 14:00,2,0,1,1,26.24,38,0.0,302,2012-06-06 14:00:00,14,6,6,2012,2,0,14,997.1199999999999,14,0,0.0,367.35999999999996,0,0
3/11/11 14:00,4,0,1,1,21.32,52,11.0014,152,2011-11-03 14:00:00,14,3,11,2011,3,0,14,1108.64,14,0,11.0014,298.48,0,0
3/3/11 15:00,1,0,1,1,9.84,23,0.0,68,2011-03-03 15:00:00,15,3,3,2011,3,0,15,226.32,15,0,0.0,147.6,0,0
13/5/12 2:00,2,0,0,2,22.14,68,11.0014,82,2012-05-13 02:00:00,2,13,5,2012,6,1,4,1505.52,0,2,22.0028,44.28,0,0
6/7/11 12:00,3,0,1,2,30.34,66,6.0032,152,2011-07-06 12:00:00,12,6,7,2011,2,0,24,2002.44,12,0,12.0064,364.08,0,0
10/4/11 6:00,2,0,0,2,14.76,93,6.0032,4,2011-04-10 06:00:00,6,10,4,2011,6,1,12,1372.68,0,6,12.0064,88.56,0,0
6/2/12 9:00,1,0,1,1,7.38,80,7.0015,277,2012-02-06 09:00:00,9,6,2,2012,0,0,9,590.4,9,0,7.0015,66.42,1,0
6/2/11 19:00,1,0,0,1,11.48,61,8.9981,21,2011-02-06 19:00:00,19,6,2,2011,6,1,19,700.28,0,19,8.9981,218.12,0,1
7/5/11 14:00,2,0,0,3,24.6,35,11.0014,378,2011-05-07 14:00:00,14,7,5,2011,5,1,42,861.0,0,14,33.0042,344.40000000000003,0,0
6/2/11 0:00,1,0,0,1,10.66,70,12.998,39,2011-02-06 00:00:00,0,6,2,2011,6,1,0,746.2,0,0,12.998,0.0,0,0
7/3/12 14:00,1,0,1,1,21.32,36,22.0028,175,2012-03-07 14:00:00,14,7,3,2012,2,0,14,767.52,14,0,22.0028,298.48,0,0
11/5/12 3:00,2,0,1,1,18.86,41,19.0012,13,2012-05-11 03:00:00,3,11,5,2012,4,0,3,773.26,3,0,19.0012,56.58,0,0
2/9/11 0:00,3,0,1,1,27.81439958,68,12.59584061,88,2011-09-02 00:00:00,0,2,9,2011,4,0,0,1891.37917144,0,0,12.59584061,0.0,0,0
9/3/12 16:00,1,0,1,1,19.68,23,27.9993,343,2012-03-09 16:00:00,16,9,3,2012,4,0,16,452.64,16,0,27.9993,314.88,0,0
18/10/11 23:00,4,0,1,2,21.32,77,12.998,70,2011-10-18 23:00:00,23,18,10,2011,1,0,46,1641.64,23,0,25.996,490.36,0,0
11/7/11 7:00,3,0,1,1,28.7,74,16.9979,317,2011-07-11 07:00:00,7,11,7,2011,0,0,7,2123.7999999999997,7,0,16.9979,200.9,1,0
5/4/11 10:00,2,0,1,3,14.35874642,79,26.90032266,39,2011-04-05 10:00:00,10,5,4,2011,1,0,30,1134.34096718,10,0,80.70096798,143.5874642,0,0
9/8/12 8:00,3,0,1,1,29.52,74,7.0015,698,2012-08-09 08:00:00,8,9,8,2012,3,0,8,2184.48,8,0,7.0015,236.16,1,0
7/7/12 21:00,3,0,0,1,36.73615079,39,12.57849506,178,2012-07-07 21:00:00,21,7,7,2012,5,1,21,1432.7098808100002,0,21,12.57849506,771.4591665900001,0,0
4/9/12 13:00,3,0,1,1,32.8,55,30.0026,275,2012-09-04 13:00:00,13,4,9,2012,1,0,13,1803.9999999999998,13,0,30.0026,426.4,0,0
3/11/11 2:00,4,0,1,1,13.94,76,8.9981,7,2011-11-03 02:00:00,2,3,11,2011,3,0,2,1059.44,2,0,8.9981,27.88,0,0
1/4/12 22:00,2,0,0,3,20.5,63,7.0015,68,2012-04-01 22:00:00,22,1,4,2012,6,1,66,1291.5,0,22,21.0045,451.0,0,0
18/12/12 17:00,4,0,1,1,16.4,47,30.0026,572,2012-12-18 17:00:00,17,18,12,2012,1,0,17,770.8,17,0,30.0026,278.79999999999995,0,1
3/2/12 4:00,1,0,1,1,11.34484493,62,16.1312414,1,2012-02-03 04:00:00,4,3,2,2012,4,0,4,703.38038566,4,0,16.1312414,45.37937972,0,0
5/5/11 10:00,2,0,1,1,20.00095641,43,19.37532807,124,2011-05-05 10:00:00,10,5,5,2011,3,0,10,860.04112563,10,0,19.37532807,200.0095641,0,0
4/8/12 8:00,3,0,0,1,30.34,72,12.998,181,2012-08-04 08:00:00,8,4,8,2012,5,1,8,2184.48,0,8,12.998,242.72,1,0
5/9/12 17:00,3,0,1,1,31.16,66,16.9979,863,2012-09-05 17:00:00,17,5,9,2012,2,0,17,2056.56,17,0,16.9979,529.72,0,1
18/3/11 5:00,1,0,1,1,15.58,66,11.0014,10,2011-03-18 05:00:00,5,18,3,2011,4,0,5,1028.28,5,0,11.0014,77.9,0,0
1/4/11 13:00,2,0,1,1,15.63331306,52,24.0612287,87,2011-04-01 13:00:00,13,1,4,2011,4,0,13,812.9322791200001,13,0,24.0612287,203.23306978000002,0,0
15/7/11 22:00,3,0,1,1,27.06,57,15.0013,223,2011-07-15 22:00:00,22,15,7,2011,4,0,22,1542.4199999999998,22,0,15.0013,595.3199999999999,0,0
4/2/12 10:00,1,0,0,1,9.84,87,7.0015,224,2012-02-04 10:00:00,10,4,2,2012,5,1,10,856.08,0,10,7.0015,98.4,0,0
9/2/12 20:00,1,0,1,1,12.46476692,36,0.0,217,2012-02-09 20:00:00,20,9,2,2012,3,0,20,448.73160912000003,20,0,0.0,249.29533840000002,0,0
13/1/12 17:00,1,0,1,1,11.48,33,27.9993,332,2012-01-13 17:00:00,17,13,1,2012,4,0,17,378.84000000000003,17,0,27.9993,195.16,0,1
18/4/12 21:00,2,0,1,2,17.22,82,6.0032,189,2012-04-18 21:00:00,21,18,4,2012,2,0,42,1412.04,21,0,12.0064,361.62,0,0
16/2/11 20:00,1,0,1,1,15.58,43,12.998,118,2011-02-16 20:00:00,20,16,2,2011,2,0,20,669.94,20,0,12.998,311.6,0,0
4/8/11 8:00,3,0,1,2,29.25006267,83,24.72932956,397,2011-08-04 08:00:00,8,4,8,2011,3,0,16,2427.75520161,8,0,49.45865912,234.00050136,1,0
8/3/12 1:00,1,0,1,1,18.86,63,22.0028,21,2012-03-08 01:00:00,1,8,3,2012,3,0,1,1188.18,1,0,22.0028,18.86,0,0
3/10/11 18:00,4,0,1,2,16.4,76,11.0014,412,2011-10-03 18:00:00,18,3,10,2011,0,0,36,1246.3999999999999,18,0,22.0028,295.2,0,1
17/10/11 7:00,4,0,1,2,19.44780702,57,12.33244497,269,2011-10-17 07:00:00,7,17,10,2011,0,0,14,1108.52500014,7,0,24.66488994,136.13464914,1,0
15/2/11 23:00,1,0,1,2,7.48218741,43,6.528657685,28,2011-02-15 23:00:00,23,15,2,2011,1,0,46,321.73405863,23,0,13.05731537,172.09031043,0,0
8/1/11 21:00,1,0,0,1,4.92,39,23.9994,37,2011-01-08 21:00:00,21,8,1,2011,5,1,21,191.88,0,21,23.9994,103.32,0,0
5/6/11 12:00,2,0,0,2,26.24,69,7.0015,335,2011-06-05 12:00:00,12,5,6,2011,6,1,24,1810.56,0,12,14.003,314.88,0,0
4/6/12 7:00,2,0,1,1,22.96,60,15.0013,517,2012-06-04 07:00:00,7,4,6,2012,0,0,7,1377.6000000000001,7,0,15.0013,160.72,1,0
6/4/12 6:00,2,0,1,1,12.3,49,26.0027,80,2012-04-06 06:00:00,6,6,4,2012,4,0,6,602.7,6,0,26.0027,73.80000000000001,0,0
17/12/12 22:00,4,0,1,2,17.38470367,95,9.716829897,37,2012-12-17 22:00:00,22,17,12,2012,0,0,44,1651.5468486500001,22,0,19.433659794,382.46348074,0,0
13/3/11 18:00,1,0,0,1,16.4,43,23.9994,147,2011-03-13 18:00:00,18,13,3,2011,6,1,18,705.1999999999999,0,18,23.9994,295.2,0,1
11/4/12 17:00,2,0,1,1,17.22,35,26.0027,579,2012-04-11 17:00:00,17,11,4,2012,2,0,17,602.6999999999999,17,0,26.0027,292.74,0,1
13/2/12 5:00,1,0,1,1,4.1,58,8.9981,17,2012-02-13 05:00:00,5,13,2,2012,0,0,5,237.79999999999998,5,0,8.9981,20.5,0,0
19/12/11 0:00,4,0,1,1,8.2,75,6.0032,17,2011-12-19 00:00:00,0,19,12,2011,0,0,0,615.0,0,0,6.0032,0.0,0,0
13/9/12 18:00,3,0,1,1,26.79098027,52,16.5675993,838,2012-09-13 18:00:00,18,13,9,2012,3,0,18,1393.13097404,18,0,16.5675993,482.23764486,0,1
19/6/11 6:00,2,0,0,2,27.06,78,11.0014,33,2011-06-19 06:00:00,6,19,6,2011,6,1,12,2110.68,0,6,22.0028,162.35999999999999,0,0
17/5/12 7:00,2,0,1,1,22.14,73,26.0027,474,2012-05-17 07:00:00,7,17,5,2012,3,0,7,1616.22,7,0,26.0027,154.98000000000002,1,0
13/8/11 9:00,3,0,0,2,28.7,74,11.0014,208,2011-08-13 09:00:00,9,13,8,2011,5,1,18,2123.7999999999997,0,9,22.0028,258.3,1,0
12/8/11 23:00,3,0,1,1,27.64676818,54,0.0,157,2011-08-12 23:00:00,23,12,8,2011,4,0,23,1492.9254817199999,23,0,0.0,635.87566814,0,0
1/11/12 4:00,4,0,1,2,13.94,66,7.0015,10,2012-11-01 04:00:00,4,1,11,2012,3,0,8,920.04,4,0,14.003,55.76,0,0
6/4/12 21:00,2,0,1,1,17.30717743,24,8.393298341,219,2012-04-06 21:00:00,21,6,4,2012,4,0,21,415.37225832,21,0,8.393298341,363.45072603,0,0
7/6/11 14:00,2,0,1,2,32.8,43,19.0012,146,2011-06-07 14:00:00,14,7,6,2011,1,0,28,1410.3999999999999,14,0,38.0024,459.19999999999993,0,0
6/3/11 19:00,1,0,0,3,12.3,100,32.9975,11,2011-03-06 19:00:00,19,6,3,2011,6,1,57,1230.0,0,19,98.9925,233.70000000000002,0,1
13/1/12 12:00,1,0,1,1,9.84,38,32.9975,154,2012-01-13 12:00:00,12,13,1,2012,4,0,12,373.92,12,0,32.9975,118.08,0,0
7/1/11 21:00,1,0,1,1,6.494156556,45,9.972009052,54,2011-01-07 21:00:00,21,7,1,2011,4,0,21,292.23704502,21,0,9.972009052,136.377287676,0,0
18/3/12 1:00,1,0,0,1,18.86,82,8.9981,113,2012-03-18 01:00:00,1,18,3,2012,6,1,1,1546.52,0,1,8.9981,18.86,0,0
5/8/12 16:00,3,0,0,1,33.62,46,16.9979,421,2012-08-05 16:00:00,16,5,8,2012,6,1,16,1546.52,0,16,16.9979,537.92,0,0
17/11/11 19:00,4,0,1,1,12.3,45,15.0013,217,2011-11-17 19:00:00,19,17,11,2011,3,0,19,553.5,19,0,15.0013,233.70000000000002,0,1
10/8/12 9:00,3,0,1,2,26.24,89,0.0,220,2012-08-10 09:00:00,9,10,8,2012,4,0,18,2335.3599999999997,9,0,0.0,236.16,1,0
17/1/12 8:00,1,0,1,3,12.3,81,19.0012,93,2012-01-17 08:00:00,8,17,1,2012,1,0,24,996.3000000000001,8,0,57.003600000000006,98.4,1,0
1/5/11 7:00,2,0,0,2,17.22,77,6.0032,33,2011-05-01 07:00:00,7,1,5,2011,6,1,14,1325.9399999999998,0,7,12.0064,120.53999999999999,1,0
19/7/11 13:00,3,0,1,1,35.26,53,7.0015,172,2011-07-19 13:00:00,13,19,7,2011,1,0,13,1868.78,13,0,7.0015,458.38,0,0
7/6/12 3:00,2,0,1,1,20.5,77,7.0015,5,2012-06-07 03:00:00,3,7,6,2012,3,0,3,1578.5,3,0,7.0015,61.5,0,0
1/4/12 8:00,2,0,0,2,14.76,76,6.0032,125,2012-04-01 08:00:00,8,1,4,2012,6,1,16,1121.76,0,8,12.0064,118.08,1,0
5/10/12 7:00,4,0,1,1,21.32,83,7.0015,428,2012-10-05 07:00:00,7,5,10,2012,4,0,7,1769.56,7,0,7.0015,149.24,1,0
13/12/11 18:00,4,0,1,1,13.94,42,15.0013,382,2011-12-13 18:00:00,18,13,12,2011,1,0,18,585.48,18,0,15.0013,250.92,0,1
6/3/12 16:00,1,0,1,1,14.76,32,19.0012,250,2012-03-06 16:00:00,16,6,3,2012,1,0,16,472.32,16,0,19.0012,236.16,0,0
11/7/12 14:00,3,0,1,1,33.18673013,39,14.52465152,240,2012-07-11 14:00:00,14,11,7,2012,2,0,14,1294.2824750700001,14,0,14.52465152,464.61422182,0,0
19/2/11 7:00,1,0,0,1,15.58,17,35.0008,22,2011-02-19 07:00:00,7,19,2,2011,5,1,7,264.86,0,7,35.0008,109.06,1,0
5/11/11 2:00,4,0,0,1,12.3,52,22.0028,31,2011-11-05 02:00:00,2,5,11,2011,5,1,2,639.6,0,2,22.0028,24.6,0,0
15/7/12 9:00,3,0,0,2,29.52,79,0.0,221,2012-07-15 09:00:00,9,15,7,2012,6,1,18,2332.08,0,9,0.0,265.68,1,0
4/2/11 13:00,1,0,1,2,10.66,50,15.0013,82,2011-02-04 13:00:00,13,4,2,2011,4,0,26,533.0,13,0,30.0026,138.58,0,0
18/9/11 17:00,3,0,0,2,22.96,64,12.998,325,2011-09-18 17:00:00,17,18,9,2011,6,1,34,1469.44,0,17,25.996,390.32,0,1
18/4/12 20:00,2,0,1,2,17.22,77,7.0015,260,2012-04-18 20:00:00,20,18,4,2012,2,0,40,1325.9399999999998,20,0,14.003,344.4,0,0
8/2/12 13:00,1,0,1,2,11.48,61,7.0015,126,2012-02-08 13:00:00,13,8,2,2012,2,0,26,700.28,13,0,14.003,149.24,0,0
17/2/12 0:00,1,0,1,2,12.15718206,87,0.0,9,2012-02-17 00:00:00,0,17,2,2012,4,0,0,1057.67483922,0,0,0.0,0.0,0,0
14/8/11 16:00,3,0,0,1,30.34,66,11.0014,292,2011-08-14 16:00:00,16,14,8,2011,6,1,16,2002.44,0,16,11.0014,485.44,0,0
19/10/11 5:00,4,0,1,3,20.5,100,7.0015,3,2011-10-19 05:00:00,5,19,10,2011,2,0,15,2050.0,5,0,21.0045,102.5,0,0
14/3/11 8:00,1,0,1,2,12.3,56,8.9981,241,2011-03-14 08:00:00,8,14,3,2011,0,0,16,688.8000000000001,8,0,17.9962,98.4,1,0
4/12/11 9:00,4,0,0,1,12.3,81,0.0,126,2011-12-04 09:00:00,9,4,12,2011,6,1,9,996.3000000000001,0,9,0.0,110.7,1,0
9/1/11 16:00,1,0,0,1,8.2,34,30.0026,92,2011-01-09 16:00:00,16,9,1,2011,6,1,16,278.79999999999995,0,16,30.0026,131.2,0,0
9/11/11 12:00,4,0,1,1,20.5,51,11.0014,180,2011-11-09 12:00:00,12,9,11,2011,2,0,12,1045.5,12,0,11.0014,246.0,0,0
17/4/11 17:00,2,0,0,1,22.96,30,30.0026,306,2011-04-17 17:00:00,17,17,4,2011,6,1,17,688.8000000000001,0,17,30.0026,390.32,0,1
15/9/11 12:00,3,0,1,2,27.06,69,19.9995,179,2011-09-15 12:00:00,12,15,9,2011,3,0,24,1867.1399999999999,12,0,39.999,324.71999999999997,0,0
8/7/11 19:00,3,0,1,1,27.06,83,6.0032,270,2011-07-08 19:00:00,19,8,7,2011,4,0,19,2245.98,19,0,6.0032,514.14,0,1
7/10/12 23:00,4,0,0,1,14.76,93,8.9981,80,2012-10-07 23:00:00,23,7,10,2012,6,1,23,1372.68,0,23,8.9981,339.48,0,0
3/11/11 21:00,4,0,1,1,16.4,76,8.9981,144,2011-11-03 21:00:00,21,3,11,2011,3,0,21,1246.3999999999999,21,0,8.9981,344.4,0,0
14/7/11 13:00,3,0,1,1,31.16,33,22.0028,177,2011-07-14 13:00:00,13,14,7,2011,3,0,13,1028.28,13,0,22.0028,405.08,0,0
7/2/12 19:00,1,0,1,1,15.58,43,15.0013,338,2012-02-07 19:00:00,19,7,2,2012,1,0,19,669.94,19,0,15.0013,296.02,0,1
17/7/12 4:00,3,0,1,1,29.52,62,0.0,7,2012-07-17 04:00:00,4,17,7,2012,1,0,4,1830.24,4,0,0.0,118.08,0,0
3/7/11 15:00,3,0,0,1,34.44,53,19.9995,376,2011-07-03 15:00:00,15,3,7,2011,6,1,15,1825.32,0,15,19.9995,516.5999999999999,0,0
11/11/12 21:00,4,0,0,1,18.04,67,15.0013,171,2012-11-11 21:00:00,21,11,11,2012,6,1,21,1208.6799999999998,0,21,15.0013,378.84,0,0
12/4/12 12:00,2,0,1,1,18.86,41,30.0026,259,2012-04-12 12:00:00,12,12,4,2012,3,0,12,773.26,12,0,30.0026,226.32,0,0
5/1/11 10:00,1,0,1,1,9.02,37,22.0028,57,2011-01-05 10:00:00,10,5,1,2011,2,0,10,333.74,10,0,22.0028,90.19999999999999,0,0
10/2/12 20:00,1,0,1,2,13.12,57,0.0,151,2012-02-10 20:00:00,20,10,2,2012,4,0,40,747.8399999999999,20,0,0.0,262.4,0,0
11/7/11 16:00,3,0,1,1,35.26,56,26.0027,239,2011-07-11 16:00:00,16,11,7,2011,0,0,16,1974.56,16,0,26.0027,564.16,0,0
16/1/11 23:00,1,0,0,2,8.2,40,7.0015,18,2011-01-16 23:00:00,23,16,1,2011,6,1,46,328.0,0,23,14.003,188.6,0,0
4/6/11 12:00,2,0,0,1,28.7,32,11.0014,420,2011-06-04 12:00:00,12,4,6,2011,5,1,12,918.4,0,12,11.0014,344.4,0,0
13/10/11 16:00,4,0,1,1,27.6362903,76,14.37653977,297,2011-10-13 16:00:00,16,13,10,2011,3,0,16,2100.3580628,16,0,14.37653977,442.1806448,0,0
10/6/12 11:00,2,0,0,1,31.16,45,6.0032,499,2012-06-10 11:00:00,11,10,6,2012,6,1,11,1402.2,0,11,6.0032,342.76,0,0
19/5/11 16:00,2,0,1,1,23.78,64,12.998,302,2011-05-19 16:00:00,16,19,5,2011,3,0,16,1521.92,16,0,12.998,380.48,0,0
17/10/11 18:00,4,0,1,1,22.96,60,0.0,518,2011-10-17 18:00:00,18,17,10,2011,0,0,18,1377.6000000000001,18,0,0.0,413.28000000000003,0,1
19/11/11 3:00,4,0,0,1,11.55025866,48,16.6770591,1,2011-11-19 03:00:00,3,19,11,2011,5,1,3,554.4124156800001,0,3,16.6770591,34.650775980000006,0,0
18/10/12 0:00,4,0,1,1,18.86,88,12.998,57,2012-10-18 00:00:00,0,18,10,2012,3,0,0,1659.6799999999998,0,0,12.998,0.0,0,0
5/5/11 23:00,2,0,1,1,19.63024014,42,12.58508497,136,2011-05-05 23:00:00,23,5,5,2011,3,0,23,824.47008588,23,0,12.58508497,451.49552322000005,0,0
17/1/11 12:00,1,1,0,2,7.38,47,8.9981,80,2011-01-17 12:00:00,12,17,1,2011,0,0,24,346.86,0,0,17.9962,88.56,0,0
13/6/11 13:00,2,0,1,1,28.7,37,0.0,227,2011-06-13 13:00:00,13,13,6,2011,0,0,13,1061.8999999999999,13,0,0.0,373.09999999999997,0,0
17/2/12 1:00,1,0,1,2,12.3,93,0.0,18,2012-02-17 01:00:00,1,17,2,2012,4,0,2,1143.9,1,0,0.0,12.3,0,0
15/3/12 13:00,1,0,1,2,27.06,41,6.0032,273,2012-03-15 13:00:00,13,15,3,2012,3,0,26,1109.46,13,0,12.0064,351.78,0,0
15/3/12 12:00,1,0,1,2,25.42,50,8.9981,265,2012-03-15 12:00:00,12,15,3,2012,3,0,24,1271.0,12,0,17.9962,305.04,0,0
16/3/11 7:00,1,0,1,2,12.3,93,12.998,111,2011-03-16 07:00:00,7,16,3,2011,2,0,14,1143.9,7,0,25.996,86.10000000000001,1,0
17/4/11 11:00,2,0,0,1,18.86,41,27.9993,304,2011-04-17 11:00:00,11,17,4,2011,6,1,11,773.26,0,11,27.9993,207.45999999999998,0,0
9/11/12 11:00,4,0,1,1,16.4,47,19.9995,251,2012-11-09 11:00:00,11,9,11,2012,4,0,11,770.8,11,0,19.9995,180.39999999999998,0,0
9/10/12 3:00,4,0,1,3,14.76,87,19.0012,3,2012-10-09 03:00:00,3,9,10,2012,1,0,9,1284.12,3,0,57.003600000000006,44.28,0,0
15/9/12 14:00,3,0,0,1,27.88,34,22.0028,715,2012-09-15 14:00:00,14,15,9,2012,5,1,14,947.92,0,14,22.0028,390.32,0,0
15/6/11 17:00,2,0,1,1,29.56238095,26,5.990954144,645,2011-06-15 17:00:00,17,15,6,2011,2,0,17,768.6219047000001,17,0,5.990954144,502.56047615,0,1
16/1/12 10:00,1,1,0,2,5.464767004,59,12.9985374,150,2012-01-16 10:00:00,10,16,1,2012,0,0,20,322.421253236,0,0,25.9970748,54.647670039999994,0,0
16/9/11 20:00,3,0,1,2,20.5,55,0.0,225,2011-09-16 20:00:00,20,16,9,2011,4,0,40,1127.5,20,0,0.0,410.0,0,0
12/4/12 18:00,2,0,1,1,20.5,27,26.0027,610,2012-04-12 18:00:00,18,12,4,2012,3,0,18,553.5,18,0,26.0027,369.0,0,1
3/11/12 10:00,4,0,0,1,14.76,46,26.0027,328,2012-11-03 10:00:00,10,3,11,2012,5,1,10,678.96,0,10,26.0027,147.6,0,0
8/6/11 15:00,2,0,1,1,37.72,40,11.0014,128,2011-06-08 15:00:00,15,8,6,2011,2,0,15,1508.8,15,0,11.0014,565.8,0,0
18/2/11 17:00,1,0,1,1,27.06,34,23.9994,327,2011-02-18 17:00:00,17,18,2,2011,4,0,17,920.04,17,0,23.9994,460.02,0,1
6/7/11 11:00,3,0,1,2,29.52,74,0.0,127,2011-07-06 11:00:00,11,6,7,2011,2,0,22,2184.48,11,0,0.0,324.71999999999997,0,0
18/6/12 18:00,2,0,1,2,25.42,69,11.0014,642,2012-06-18 18:00:00,18,18,6,2012,0,0,36,1753.98,18,0,22.0028,457.56000000000006,0,1
19/10/12 19:00,4,0,1,1,22.14,88,11.0014,232,2012-10-19 19:00:00,19,19,10,2012,4,0,19,1948.3200000000002,19,0,11.0014,420.66,0,1
12/7/11 12:00,3,0,1,1,35.26,44,19.9995,163,2011-07-12 12:00:00,12,12,7,2011,1,0,12,1551.4399999999998,12,0,19.9995,423.12,0,0
1/2/11 13:00,1,0,1,2,8.2,86,0.0,52,2011-02-01 13:00:00,13,1,2,2011,1,0,26,705.1999999999999,13,0,0.0,106.6,0,0
14/5/12 18:00,2,0,1,2,23.78,83,0.0,300,2012-05-14 18:00:00,18,14,5,2012,0,0,36,1973.74,18,0,0.0,428.04,0,1
6/11/11 18:00,4,0,0,1,17.22,71,7.0015,185,2011-11-06 18:00:00,18,6,11,2011,6,1,18,1222.62,0,18,7.0015,309.96,0,1
1/1/12 18:00,1,0,0,3,18.86,59,16.9979,106,2012-01-01 18:00:00,18,1,1,2012,6,1,54,1112.74,0,18,50.993700000000004,339.48,0,1
18/12/12 3:00,4,0,1,1,17.22,88,12.998,5,2012-12-18 03:00:00,3,18,12,2012,1,0,3,1515.36,3,0,12.998,51.66,0,0
12/3/12 0:00,1,0,1,1,15.58,54,12.998,24,2012-03-12 00:00:00,0,12,3,2012,0,0,0,841.32,0,0,12.998,0.0,0,0
10/2/12 10:00,1,0,1,2,10.66,48,8.9981,124,2012-02-10 10:00:00,10,10,2,2012,4,0,20,511.68,10,0,17.9962,106.6,0,0
12/8/12 4:00,3,0,0,1,26.24,69,6.0032,10,2012-08-12 04:00:00,4,12,8,2012,6,1,4,1810.56,0,4,6.0032,104.96,0,0
11/12/12 18:00,4,0,1,1,13.12,53,15.0013,546,2012-12-11 18:00:00,18,11,12,2012,1,0,18,695.36,18,0,15.0013,236.16,0,1
9/3/11 7:00,1,0,1,2,9.84,87,11.0014,141,2011-03-09 07:00:00,7,9,3,2011,2,0,14,856.08,7,0,22.0028,68.88,1,0
3/9/11 3:00,3,0,0,1,25.42,73,11.0014,35,2011-09-03 03:00:00,3,3,9,2011,5,1,3,1855.66,0,3,11.0014,76.26,0,0
17/2/11 17:00,1,0,1,2,23.78,32,19.9995,274,2011-02-17 17:00:00,17,17,2,2011,3,0,34,760.96,17,0,39.999,404.26,0,1
19/4/11 19:00,2,0,1,2,21.26410041,73,15.41396056,312,2011-04-19 19:00:00,19,19,4,2011,1,0,38,1552.2793299300001,19,0,30.82792112,404.01790779000004,0,1
10/5/12 13:00,2,0,1,1,22.14,39,30.0026,318,2012-05-10 13:00:00,13,10,5,2012,3,0,13,863.46,13,0,30.0026,287.82,0,0
9/10/12 11:00,4,0,1,2,20.15848089,70,12.68651799,198,2012-10-09 11:00:00,11,9,10,2012,1,0,22,1411.0936623,11,0,25.37303598,221.74328979,0,0
17/9/11 14:00,3,0,0,2,21.32,72,12.998,297,2011-09-17 14:00:00,14,17,9,2011,5,1,28,1535.04,0,14,25.996,298.48,0,0
8/8/12 0:00,3,0,1,1,28.7,84,0.0,58,2012-08-08 00:00:00,0,8,8,2012,2,0,0,2410.7999999999997,0,0,0.0,0.0,0,0
7/5/11 5:00,2,0,0,1,18.86,59,8.9981,7,2011-05-07 05:00:00,5,7,5,2011,5,1,5,1112.74,0,5,8.9981,94.3,0,0
14/2/12 5:00,1,0,1,2,10.37671081,67,6.58436345,7,2012-02-14 05:00:00,5,14,2,2012,1,0,10,695.23962427,5,0,13.1687269,51.88355405,0,0
2/8/12 22:00,3,0,1,1,30.34,70,12.998,262,2012-08-02 22:00:00,22,2,8,2012,3,0,22,2123.8,22,0,12.998,667.48,0,0
9/4/11 6:00,2,0,0,2,10.81326305,90,11.0212203,5,2011-04-09 06:00:00,6,9,4,2011,5,1,12,973.1936744999999,0,6,22.0424406,64.87957829999999,0,0
19/6/12 11:00,2,0,1,1,27.06,69,8.9981,230,2012-06-19 11:00:00,11,19,6,2012,1,0,11,1867.1399999999999,11,0,8.9981,297.65999999999997,0,0
14/5/11 9:00,2,0,0,2,21.32,94,6.0032,100,2011-05-14 09:00:00,9,14,5,2011,5,1,18,2004.08,0,9,12.0064,191.88,1,0
5/12/12 15:00,4,0,1,1,19.18013623,33,18.9226491,302,2012-12-05 15:00:00,15,5,12,2012,2,0,15,632.94449559,15,0,18.9226491,287.70204344999996,0,0
14/3/12 23:00,1,0,1,1,22.96,43,11.0014,91,2012-03-14 23:00:00,23,14,3,2012,2,0,23,987.2800000000001,23,0,11.0014,528.08,0,0
8/6/11 21:00,2,0,1,1,32.8,66,8.9981,202,2011-06-08 21:00:00,21,8,6,2011,2,0,21,2164.7999999999997,21,0,8.9981,688.8,0,0
11/1/11 18:00,1,0,1,3,6.56,93,7.0015,95,2011-01-11 18:00:00,18,11,1,2011,1,0,54,610.0799999999999,18,0,21.0045,118.08,0,1
16/3/12 21:00,1,0,1,2,18.04,94,0.0,152,2012-03-16 21:00:00,21,16,3,2012,4,0,42,1695.76,21,0,0.0,378.84,0,0
11/7/12 6:00,3,0,1,1,26.24,89,8.9981,185,2012-07-11 06:00:00,6,11,7,2012,2,0,6,2335.3599999999997,6,0,8.9981,157.44,0,0
8/10/11 6:00,4,0,0,1,17.22,94,0.0,22,2011-10-08 06:00:00,6,8,10,2011,5,1,6,1618.6799999999998,0,6,0.0,103.32,0,0
14/6/11 5:00,2,0,1,1,22.14,56,22.0028,26,2011-06-14 05:00:00,5,14,6,2011,1,0,5,1239.8400000000001,5,0,22.0028,110.7,0,0
3/2/12 3:00,1,0,1,1,11.48,56,19.9995,4,2012-02-03 03:00:00,3,3,2,2012,4,0,3,642.88,3,0,19.9995,34.44,0,0
18/8/12 22:00,3,0,0,1,27.06,61,0.0,261,2012-08-18 22:00:00,22,18,8,2012,5,1,22,1650.6599999999999,0,22,0.0,595.3199999999999,0,0
18/9/11 6:00,3,0,0,1,18.04,77,16.9979,12,2011-09-18 06:00:00,6,18,9,2011,6,1,6,1389.08,0,6,16.9979,108.24,0,0
1/12/12 0:00,4,0,0,1,10.66,81,0.0,108,2012-12-01 00:00:00,0,1,12,2012,5,1,0,863.46,0,0,0.0,0.0,0,0
2/8/11 19:00,3,0,1,2,35.26,36,15.0013,454,2011-08-02 19:00:00,19,2,8,2011,1,0,38,1269.36,19,0,30.0026,669.9399999999999,0,1
3/12/11 1:00,4,0,0,1,10.80251966,65,12.32234452,41,2011-12-03 01:00:00,1,3,12,2011,5,1,1,702.1637779,0,1,12.32234452,10.80251966,0,0
3/10/11 5:00,4,0,1,2,14.76,76,7.0015,21,2011-10-03 05:00:00,5,3,10,2011,0,0,10,1121.76,5,0,14.003,73.8,0,0
7/4/12 15:00,2,0,0,1,21.32,19,27.9993,626,2012-04-07 15:00:00,15,7,4,2012,5,1,15,405.08,0,15,27.9993,319.8,0,0
9/1/11 11:00,1,0,0,1,6.56,40,35.0008,49,2011-01-09 11:00:00,11,9,1,2011,6,1,11,262.4,0,11,35.0008,72.16,0,0
16/7/12 20:00,3,0,1,1,32.8,59,8.9981,454,2012-07-16 20:00:00,20,16,7,2012,0,0,20,1935.1999999999998,20,0,8.9981,656.0,0,0
1/7/11 7:00,3,0,1,1,27.06,54,7.0015,243,2011-07-01 07:00:00,7,1,7,2011,4,0,7,1461.24,7,0,7.0015,189.42,1,0
16/5/12 12:00,2,0,1,1,28.7,54,12.998,330,2012-05-16 12:00:00,12,16,5,2012,2,0,12,1549.8,12,0,12.998,344.4,0,0
13/10/11 8:00,4,0,1,3,22.14,100,6.0032,209,2011-10-13 08:00:00,8,13,10,2011,3,0,24,2214.0,8,0,18.0096,177.12,1,0
2/7/11 7:00,3,0,0,1,26.24,65,0.0,45,2011-07-02 07:00:00,7,2,7,2011,5,1,7,1705.6,0,7,0.0,183.67999999999998,1,0
16/8/11 4:00,3,0,1,1,26.24,69,19.9995,5,2011-08-16 04:00:00,4,16,8,2011,1,0,4,1810.56,4,0,19.9995,104.96,0,0
13/12/12 6:00,4,0,1,1,10.66,56,16.9979,114,2012-12-13 06:00:00,6,13,12,2012,3,0,6,596.96,6,0,16.9979,63.96,0,0
5/2/11 9:00,1,0,0,3,8.857561011,100,7.184049197,1,2011-02-05 09:00:00,9,5,2,2011,5,1,27,885.7561010999999,0,9,21.552147591,79.718049099,1,0
1/6/11 16:00,2,0,1,1,35.26,47,19.9995,266,2011-06-01 16:00:00,16,1,6,2011,2,0,16,1657.2199999999998,16,0,19.9995,564.16,0,0
18/4/12 9:00,2,0,1,3,19.68,44,19.9995,265,2012-04-18 09:00:00,9,18,4,2012,2,0,27,865.92,9,0,59.99850000000001,177.12,1,0
1/2/11 5:00,1,0,1,3,5.74,93,0.0,3,2011-02-01 05:00:00,5,1,2,2011,1,0,15,533.82,5,0,0.0,28.700000000000003,0,0
13/8/11 3:00,3,0,0,1,27.06,65,8.9981,27,2011-08-13 03:00:00,3,13,8,2011,5,1,3,1758.8999999999999,0,3,8.9981,81.17999999999999,0,0
4/6/12 10:00,2,0,1,1,26.24,41,31.0009,187,2012-06-04 10:00:00,10,4,6,2012,0,0,10,1075.84,10,0,31.0009,262.4,0,0
8/8/11 1:00,3,0,1,1,27.88,83,8.9981,12,2011-08-08 01:00:00,1,8,8,2011,0,0,1,2314.04,1,0,8.9981,27.88,0,0
5/11/12 0:00,4,0,1,2,12.3,56,12.998,23,2012-11-05 00:00:00,0,5,11,2012,0,0,0,688.8000000000001,0,0,25.996,0.0,0,0
18/7/11 16:00,3,0,1,1,34.44,53,19.0012,265,2011-07-18 16:00:00,16,18,7,2011,0,0,16,1825.32,16,0,19.0012,551.04,0,0
12/2/12 20:00,1,0,0,1,5.74,42,22.0028,57,2012-02-12 20:00:00,20,12,2,2012,6,1,20,241.08,0,20,22.0028,114.80000000000001,0,0
14/1/11 21:00,1,0,1,1,6.56,69,0.0,52,2011-01-14 21:00:00,21,14,1,2011,4,0,21,452.64,21,0,0.0,137.76,0,0
14/1/12 4:00,1,0,0,1,5.74,50,8.9981,3,2012-01-14 04:00:00,4,14,1,2012,5,1,4,287.0,0,4,8.9981,22.96,0,0
7/3/12 3:00,1,0,1,1,12.3,56,23.9994,3,2012-03-07 03:00:00,3,7,3,2012,2,0,3,688.8000000000001,3,0,23.9994,36.900000000000006,0,0
2/2/11 10:00,1,0,1,2,9.02,100,0.0,61,2011-02-02 10:00:00,10,2,2,2011,2,0,20,902.0,10,0,0.0,90.19999999999999,0,0
19/9/11 2:00,3,0,1,2,21.32,72,8.9981,13,2011-09-19 02:00:00,2,19,9,2011,0,0,4,1535.04,2,0,17.9962,42.64,0,0
12/7/12 23:00,3,0,1,2,28.7,51,15.0013,211,2012-07-12 23:00:00,23,12,7,2012,3,0,46,1463.7,23,0,30.0026,660.1,0,0
4/3/11 8:00,1,0,1,1,7.38,74,8.9981,228,2011-03-04 08:00:00,8,4,3,2011,4,0,8,546.12,8,0,8.9981,59.04,1,0
10/7/11 22:00,3,0,0,1,30.34,66,15.0013,143,2011-07-10 22:00:00,22,10,7,2011,6,1,22,2002.44,0,22,15.0013,667.48,0,0
10/5/12 12:00,2,0,1,1,21.32,48,27.9993,272,2012-05-10 12:00:00,12,10,5,2012,3,0,12,1023.36,12,0,27.9993,255.84,0,0
8/7/12 19:00,3,0,0,1,31.98,62,11.0014,250,2012-07-08 19:00:00,19,8,7,2012,6,1,19,1982.76,0,19,11.0014,607.62,0,1
10/9/11 12:00,3,0,0,1,29.52,62,15.0013,404,2011-09-10 12:00:00,12,10,9,2011,5,1,12,1830.24,0,12,15.0013,354.24,0,0
4/2/12 7:00,1,0,0,2,9.84,87,8.9981,28,2012-02-04 07:00:00,7,4,2,2012,5,1,14,856.08,0,7,17.9962,68.88,1,0
10/6/11 6:00,2,0,1,1,27.06,78,6.0032,104,2011-06-10 06:00:00,6,10,6,2011,4,0,6,2110.68,6,0,6.0032,162.35999999999999,0,0
8/9/12 6:00,3,0,0,2,25.248166,87,18.86764662,18,2012-09-08 06:00:00,6,8,9,2012,5,1,12,2196.590442,0,6,37.73529324,151.48899600000001,0,0
18/9/11 5:00,3,0,0,1,18.04,77,15.0013,6,2011-09-18 05:00:00,5,18,9,2011,6,1,5,1389.08,0,5,15.0013,90.19999999999999,0,0
7/1/11 21:00,1,0,1,1,7.38,47,8.9981,39,2011-01-07 21:00:00,21,7,1,2011,4,0,21,346.86,21,0,8.9981,154.98,0,0
17/2/11 7:00,1,0,1,1,13.12,57,7.0015,126,2011-02-17 07:00:00,7,17,2,2011,3,0,7,747.8399999999999,7,0,7.0015,91.83999999999999,1,0
12/4/11 11:00,2,0,1,1,21.49295988,77,23.67051229,44,2011-04-12 11:00:00,11,12,4,2011,1,0,11,1654.95791076,11,0,23.67051229,236.42255868,0,0
1/12/12 14:00,4,0,0,2,14.76,71,0.0,479,2012-12-01 14:00:00,14,1,12,2012,5,1,28,1047.96,0,14,0.0,206.64,0,0
17/2/12 13:00,1,0,1,1,16.4,43,23.9994,205,2012-02-17 13:00:00,13,17,2,2012,4,0,13,705.1999999999999,13,0,23.9994,213.2,0,0
9/12/12 15:00,4,0,0,3,14.76,93,11.0014,225,2012-12-09 15:00:00,15,9,12,2012,6,1,45,1372.68,0,15,33.0042,221.4,0,0
7/12/12 19:00,4,0,1,2,15.3044779,77,0.501686217,342,2012-12-07 19:00:00,19,7,12,2012,4,0,38,1178.4447983,19,0,1.003372434,290.7850801,0,1
7/9/12 19:00,3,0,1,1,30.34,62,19.0012,568,2012-09-07 19:00:00,19,7,9,2012,4,0,19,1881.08,19,0,19.0012,576.46,0,1
14/9/12 3:00,3,0,1,1,22.14,77,0.0,14,2012-09-14 03:00:00,3,14,9,2012,4,0,3,1704.78,3,0,0.0,66.42,0,0
10/9/12 14:00,3,0,1,1,27.06,36,19.0012,340,2012-09-10 14:00:00,14,10,9,2012,0,0,14,974.16,14,0,19.0012,378.84,0,0
6/12/12 3:00,4,0,1,1,9.02,55,12.998,2,2012-12-06 03:00:00,3,6,12,2012,3,0,3,496.09999999999997,3,0,12.998,27.06,0,0
11/4/12 14:00,2,0,1,1,14.76,57,12.998,135,2012-04-11 14:00:00,14,11,4,2012,2,0,14,841.3199999999999,14,0,12.998,206.64,0,0
13/11/12 18:00,4,0,1,1,13.94,49,19.0012,559,2012-11-13 18:00:00,18,13,11,2012,1,0,18,683.06,18,0,19.0012,250.92,0,1
15/6/11 19:00,2,0,1,1,28.7,37,19.0012,416,2011-06-15 19:00:00,19,15,6,2011,2,0,19,1061.8999999999999,19,0,19.0012,545.3,0,1
12/4/12 14:00,2,0,1,1,20.5,31,22.0028,224,2012-04-12 14:00:00,14,12,4,2012,3,0,14,635.5,14,0,22.0028,287.0,0,0
17/7/12 13:00,3,0,1,1,37.72,31,12.998,221,2012-07-17 13:00:00,13,17,7,2012,1,0,13,1169.32,13,0,12.998,490.36,0,0
19/12/11 9:00,4,0,1,1,9.02,69,15.0013,183,2011-12-19 09:00:00,9,19,12,2011,0,0,9,622.38,9,0,15.0013,81.17999999999999,1,0
12/7/11 4:00,3,0,1,1,28.7,79,11.0014,6,2011-07-12 04:00:00,4,12,7,2011,1,0,4,2267.2999999999997,4,0,11.0014,114.8,0,0
8/12/12 12:00,4,0,0,2,16.4,87,15.0013,486,2012-12-08 12:00:00,12,8,12,2012,5,1,24,1426.8,0,12,30.0026,196.79999999999998,0,0
15/7/12 18:00,3,0,0,3,29.52,79,23.9994,312,2012-07-15 18:00:00,18,15,7,2012,6,1,54,2332.08,0,18,71.9982,531.36,0,1
1/2/12 8:00,1,0,1,3,14.76,73,7.0015,520,2012-02-01 08:00:00,8,1,2,2012,2,0,24,1077.48,8,0,21.0045,118.08,1,0
2/5/11 22:00,2,0,1,2,24.6,73,0.0,125,2011-05-02 22:00:00,22,2,5,2011,0,0,44,1795.8000000000002,22,0,0.0,541.2,0,0
15/5/11 22:00,2,0,0,1,22.96,83,0.0,117,2011-05-15 22:00:00,22,15,5,2011,6,1,22,1905.68,0,22,0.0,505.12,0,0
8/12/12 8:00,4,0,0,2,15.58,94,6.0032,111,2012-12-08 08:00:00,8,8,12,2012,5,1,16,1464.52,0,8,12.0064,124.64,1,0
4/11/11 18:00,4,0,1,1,17.22,32,31.0009,374,2011-11-04 18:00:00,18,4,11,2011,4,0,18,551.04,18,0,31.0009,309.96,0,1
6/10/12 18:00,4,0,0,1,21.32,48,27.9993,495,2012-10-06 18:00:00,18,6,10,2012,5,1,18,1023.36,0,18,27.9993,383.76,0,1
3/9/11 6:00,3,0,0,1,25.42,73,11.0014,23,2011-09-03 06:00:00,6,3,9,2011,5,1,6,1855.66,0,6,11.0014,152.52,0,0
10/4/12 7:00,2,0,1,1,13.94,71,7.0015,384,2012-04-10 07:00:00,7,10,4,2012,1,0,7,989.74,7,0,7.0015,97.58,1,0
15/12/11 21:00,4,0,1,1,20.5,63,19.9995,155,2011-12-15 21:00:00,21,15,12,2011,3,0,21,1291.5,21,0,19.9995,430.5,0,0
11/4/12 23:00,2,0,1,1,13.94,57,19.9995,61,2012-04-11 23:00:00,23,11,4,2012,2,0,23,794.5799999999999,23,0,19.9995,320.62,0,0
13/4/12 20:00,2,0,1,1,20.5,29,8.9981,286,2012-04-13 20:00:00,20,13,4,2012,4,0,20,594.5,20,0,8.9981,410.0,0,0
15/5/11 18:00,2,0,0,1,22.96,78,16.9979,237,2011-05-15 18:00:00,18,15,5,2011,6,1,18,1790.88,0,18,16.9979,413.28000000000003,0,1
1/1/11 6:00,1,0,0,1,9.02,80,0.0,2,2011-01-01 06:00:00,6,1,1,2011,5,1,6,721.5999999999999,0,6,0.0,54.12,0,0
17/2/12 22:00,1,0,1,1,14.76,40,15.0013,107,2012-02-17 22:00:00,22,17,2,2012,4,0,22,590.4,22,0,15.0013,324.71999999999997,0,0
8/1/12 1:00,1,0,0,1,13.94,42,12.998,72,2012-01-08 01:00:00,1,8,1,2012,6,1,1,585.48,0,1,12.998,13.94,0,0
7/2/12 23:00,1,0,1,1,13.15092757,57,10.22539441,16,2012-02-07 23:00:00,23,7,2,2012,1,0,23,749.60287149,23,0,10.22539441,302.47133411,0,0
7/5/12 9:00,2,0,1,2,20.5,82,15.0013,350,2012-05-07 09:00:00,9,7,5,2012,0,0,18,1681.0,9,0,30.0026,184.5,1,0
2/1/12 10:00,1,1,0,1,10.66,35,19.0012,109,2012-01-02 10:00:00,10,2,1,2012,0,0,10,373.1,0,0,19.0012,106.6,0,0
9/6/12 14:00,2,0,0,1,33.62,23,12.998,593,2012-06-09 14:00:00,14,9,6,2012,5,1,14,773.26,0,14,12.998,470.67999999999995,0,0
16/1/12 16:00,1,1,0,1,10.66,44,23.9994,180,2012-01-16 16:00:00,16,16,1,2012,0,0,16,469.04,0,0,23.9994,170.56,0,0
4/11/11 15:00,4,0,1,1,18.86,44,26.0027,237,2011-11-04 15:00:00,15,4,11,2011,4,0,15,829.8399999999999,15,0,26.0027,282.9,0,0
2/12/12 10:00,4,0,0,2,12.3,87,0.0,293,2012-12-02 10:00:00,10,2,12,2012,6,1,20,1070.1000000000001,0,10,0.0,123.0,0,0
3/4/12 17:00,2,0,1,1,25.42,17,12.998,757,2012-04-03 17:00:00,17,3,4,2012,1,0,17,432.14000000000004,17,0,12.998,432.14000000000004,0,1
11/1/11 23:00,1,0,1,3,6.56,93,6.0032,19,2011-01-11 23:00:00,23,11,1,2011,1,0,69,610.0799999999999,23,0,18.0096,150.88,0,0
10/1/11 10:00,1,0,1,2,5.74,50,19.9995,31,2011-01-10 10:00:00,10,10,1,2011,0,0,20,287.0,10,0,39.999,57.400000000000006,0,0
10/12/11 13:00,4,0,0,1,14.38034433,33,28.74641928,272,2011-12-10 13:00:00,13,10,12,2011,5,1,13,474.55136289,0,13,28.74641928,186.94447629,0,0
1/8/11 9:00,3,0,1,1,34.04946599,41,2.024932889,161,2011-08-01 09:00:00,9,1,8,2011,0,0,9,1396.02810559,9,0,2.024932889,306.44519391,1,0
13/11/11 21:00,4,0,0,1,19.68,36,16.9979,95,2011-11-13 21:00:00,21,13,11,2011,6,1,21,708.48,0,21,16.9979,413.28,0,0
2/5/12 8:00,2,0,1,2,22.96,88,0.0,666,2012-05-02 08:00:00,8,2,5,2012,2,0,16,2020.48,8,0,0.0,183.68,1,0
12/3/12 10:00,1,0,1,1,16.4,50,15.0013,137,2012-03-12 10:00:00,10,12,3,2012,0,0,10,819.9999999999999,10,0,15.0013,164.0,0,0
12/9/12 17:00,3,0,1,1,28.7,41,19.9995,925,2012-09-12 17:00:00,17,12,9,2012,2,0,17,1176.7,17,0,19.9995,487.9,0,1
12/11/12 14:00,4,1,0,1,23.78,60,19.0012,444,2012-11-12 14:00:00,14,12,11,2012,0,0,14,1426.8000000000002,0,0,19.0012,332.92,0,0
12/12/12 17:00,4,0,1,2,13.12,53,15.0013,561,2012-12-12 17:00:00,17,12,12,2012,2,0,34,695.36,17,0,30.0026,223.04,0,1
6/6/12 22:00,2,0,1,1,21.08113664,78,6.402539226,247,2012-06-06 22:00:00,22,6,6,2012,2,0,22,1644.32865792,22,0,6.402539226,463.78500608,0,0
7/5/12 21:00,2,0,1,2,22.14,45,15.0013,247,2012-05-07 21:00:00,21,7,5,2012,0,0,42,996.3000000000001,21,0,30.0026,464.94,0,0
5/3/12 4:00,1,0,1,1,8.838212372,56,6.379758356,10,2012-03-05 04:00:00,4,5,3,2012,0,0,4,494.93989283199994,4,0,6.379758356,35.352849488,0,0
7/3/11 6:00,1,0,1,1,8.2,75,26.0027,34,2011-03-07 06:00:00,6,7,3,2011,0,0,6,615.0,6,0,26.0027,49.199999999999996,0,0
1/8/11 18:00,3,0,1,1,31.98,43,12.998,543,2011-08-01 18:00:00,18,1,8,2011,0,0,18,1375.14,18,0,12.998,575.64,0,1
10/4/12 21:00,2,0,1,1,18.04,30,30.0026,206,2012-04-10 21:00:00,21,10,4,2012,1,0,21,541.1999999999999,21,0,30.0026,378.84,0,0
13/8/12 3:00,3,0,1,1,26.24,69,0.0,6,2012-08-13 03:00:00,3,13,8,2012,0,0,3,1810.56,3,0,0.0,78.72,0,0
18/3/12 18:00,1,0,0,1,22.96,64,11.0014,459,2012-03-18 18:00:00,18,18,3,2012,6,1,18,1469.44,0,18,11.0014,413.28000000000003,0,1
15/10/12 22:00,4,0,1,1,20.5,59,19.0012,126,2012-10-15 22:00:00,22,15,10,2012,0,0,22,1209.5,22,0,19.0012,451.0,0,0
14/10/11 0:00,4,0,1,1,23.78,94,6.0032,39,2011-10-14 00:00:00,0,14,10,2011,4,0,0,2235.32,0,0,6.0032,0.0,0,0
10/12/12 19:00,4,0,1,1,21.32,77,19.0012,427,2012-12-10 19:00:00,19,10,12,2012,0,0,19,1641.64,19,0,19.0012,405.08,0,1
15/3/11 11:00,1,0,1,2,13.94,57,15.0013,78,2011-03-15 11:00:00,11,15,3,2011,1,0,22,794.5799999999999,11,0,30.0026,153.34,0,0
19/2/11 5:00,1,0,0,1,16.4,15,22.0028,3,2011-02-19 05:00:00,5,19,2,2011,5,1,5,245.99999999999997,0,5,22.0028,82.0,0,0
7/4/12 0:00,2,0,0,1,17.22,26,19.9995,94,2012-04-07 00:00:00,0,7,4,2012,5,1,0,447.71999999999997,0,0,19.9995,0.0,0,0
19/5/11 14:00,2,0,1,3,22.14,73,12.998,180,2011-05-19 14:00:00,14,19,5,2011,3,0,42,1616.22,14,0,38.994,309.96000000000004,0,0
6/7/12 11:00,3,0,1,1,34.44,32,6.0032,233,2012-07-06 11:00:00,11,6,7,2012,4,0,11,1102.08,11,0,6.0032,378.84,0,0
19/7/11 12:00,3,0,1,1,36.00513981,58,5.485868719,183,2011-07-19 12:00:00,12,19,7,2011,1,0,12,2088.29810898,12,0,5.485868719,432.06167772000003,0,0
5/8/11 22:00,3,0,1,1,28.7,65,15.0013,188,2011-08-05 22:00:00,22,5,8,2011,4,0,22,1865.5,22,0,15.0013,631.4,0,0
10/9/11 13:00,3,0,0,1,30.34,55,19.0012,370,2011-09-10 13:00:00,13,10,9,2011,5,1,13,1668.7,0,13,19.0012,394.42,0,0
12/8/11 7:00,3,0,1,1,26.24,44,11.0014,264,2011-08-12 07:00:00,7,12,8,2011,4,0,7,1154.56,7,0,11.0014,183.67999999999998,1,0
10/2/12 22:00,1,0,1,2,13.12,66,0.0,113,2012-02-10 22:00:00,22,10,2,2012,4,0,44,865.92,22,0,0.0,288.64,0,0
3/6/12 9:00,2,0,0,1,24.6,46,12.998,300,2012-06-03 09:00:00,9,3,6,2012,6,1,9,1131.6000000000001,0,9,12.998,221.4,1,0
15/2/12 21:00,1,0,1,1,13.55550981,57,10.63428804,156,2012-02-15 21:00:00,21,15,2,2012,2,0,21,772.66405917,21,0,10.63428804,284.66570601,0,0
13/10/11 18:00,4,0,1,3,25.42,83,16.9979,268,2011-10-13 18:00:00,18,13,10,2011,3,0,54,2109.86,18,0,50.993700000000004,457.56000000000006,0,1
1/3/12 2:00,1,0,1,2,18.86,94,19.0012,6,2012-03-01 02:00:00,2,1,3,2012,3,0,4,1772.84,2,0,38.0024,37.72,0,0
8/2/12 11:00,1,0,1,2,10.66,65,15.0013,102,2012-02-08 11:00:00,11,8,2,2012,2,0,22,692.9,11,0,30.0026,117.26,0,0
15/8/12 11:00,3,0,1,2,30.34,58,12.998,235,2012-08-15 11:00:00,11,15,8,2012,2,0,22,1759.72,11,0,25.996,333.74,0,0
11/2/12 2:00,1,0,0,3,10.66,81,12.998,26,2012-02-11 02:00:00,2,11,2,2012,5,1,6,863.46,0,2,38.994,21.32,0,0
9/4/12 23:00,2,0,1,1,18.04,44,19.9995,67,2012-04-09 23:00:00,23,9,4,2012,0,0,23,793.76,23,0,19.9995,414.91999999999996,0,0
13/11/11 6:00,4,0,0,1,13.94,66,8.9981,23,2011-11-13 06:00:00,6,13,11,2011,6,1,6,920.04,0,6,8.9981,83.64,0,0
14/11/11 11:00,4,0,1,2,22.14,60,19.0012,128,2011-11-14 11:00:00,11,14,11,2011,0,0,22,1328.4,11,0,38.0024,243.54000000000002,0,0
12/6/11 5:00,2,0,0,1,25.42,88,15.0013,10,2011-06-12 05:00:00,5,12,6,2011,6,1,5,2236.96,0,5,15.0013,127.10000000000001,0,0
5/5/11 3:00,2,0,1,1,13.94,66,16.9979,4,2011-05-05 03:00:00,3,5,5,2011,3,0,3,920.04,3,0,16.9979,41.82,0,0
6/7/12 5:00,3,0,1,1,30.34,66,12.998,35,2012-07-06 05:00:00,5,6,7,2012,4,0,5,2002.44,5,0,12.998,151.7,0,0
19/8/11 17:00,3,0,1,1,31.16,58,35.0008,527,2011-08-19 17:00:00,17,19,8,2011,4,0,17,1807.28,17,0,35.0008,529.72,0,1
14/10/11 18:00,4,0,1,1,21.113906,34,18.34542328,393,2011-10-14 18:00:00,18,14,10,2011,4,0,18,717.872804,18,0,18.34542328,380.050308,0,1
8/3/11 19:00,1,0,1,1,13.94,31,7.0015,150,2011-03-08 19:00:00,19,8,3,2011,1,0,19,432.14,19,0,7.0015,264.86,0,1
10/8/12 23:00,3,0,1,1,29.52,70,19.0012,192,2012-08-10 23:00:00,23,10,8,2012,4,0,23,2066.4,23,0,19.0012,678.96,0,0
2/11/11 17:00,4,0,1,1,18.04,62,12.998,553,2011-11-02 17:00:00,17,2,11,2011,2,0,17,1118.48,17,0,12.998,306.68,0,1
19/3/11 0:00,1,0,0,2,24.6,53,16.9979,76,2011-03-19 00:00:00,0,19,3,2011,5,1,0,1303.8000000000002,0,0,33.9958,0.0,0,0
19/11/11 10:00,4,0,0,1,13.12,45,16.9979,200,2011-11-19 10:00:00,10,19,11,2011,5,1,10,590.4,0,10,16.9979,131.2,0,0
2/10/12 14:00,4,0,1,3,25.05086941,91,8.987685275,169,2012-10-02 14:00:00,14,2,10,2012,1,0,42,2279.62911631,14,0,26.963055825,350.71217174000003,0,0
7/7/12 6:00,3,0,0,1,29.20807091,71,7.844090946,44,2012-07-07 06:00:00,6,7,7,2012,5,1,6,2073.77303461,0,6,7.844090946,175.24842546,0,0
15/12/12 3:00,4,0,0,2,9.84,81,0.0,23,2012-12-15 03:00:00,3,15,12,2012,5,1,6,797.04,0,3,0.0,29.52,0,0
3/8/12 0:00,3,0,1,1,29.52,70,12.998,71,2012-08-03 00:00:00,0,3,8,2012,4,0,0,2066.4,0,0,12.998,0.0,0,0
15/6/11 6:00,2,0,1,1,20.5,63,16.9979,121,2011-06-15 06:00:00,6,15,6,2011,2,0,6,1291.5,6,0,16.9979,123.0,0,0
3/1/11 4:00,1,0,1,1,6.56,47,26.0027,1,2011-01-03 04:00:00,4,3,1,2011,0,0,4,308.32,4,0,26.0027,26.24,0,0
5/11/11 5:00,4,0,0,1,10.66,60,22.0028,2,2011-11-05 05:00:00,5,5,11,2011,5,1,5,639.6,0,5,22.0028,53.3,0,0
7/9/12 16:00,3,0,1,1,32.8,55,19.0012,470,2012-09-07 16:00:00,16,7,9,2012,4,0,16,1803.9999999999998,16,0,19.0012,524.8,0,0
4/4/11 19:00,2,0,1,1,28.62329491,23,31.02834124,274,2011-04-04 19:00:00,19,4,4,2011,0,0,19,658.3357829299999,19,0,31.02834124,543.8426032899999,0,1
15/7/12 0:00,3,0,0,1,27.88,89,11.0014,187,2012-07-15 00:00:00,0,15,7,2012,6,1,0,2481.3199999999997,0,0,11.0014,0.0,0,0
19/7/12 18:00,3,0,1,1,35.35641314,38,12.84584078,748,2012-07-19 18:00:00,18,19,7,2012,3,0,18,1343.54369932,18,0,12.84584078,636.41543652,0,1
15/9/11 5:00,3,0,1,1,24.6,78,0.0,31,2011-09-15 05:00:00,5,15,9,2011,3,0,5,1918.8000000000002,5,0,0.0,123.0,0,0
7/5/11 19:00,2,0,0,1,22.96,43,12.998,267,2011-05-07 19:00:00,19,7,5,2011,5,1,19,987.2800000000001,0,19,12.998,436.24,0,1
4/3/12 9:00,1,0,0,1,12.3,49,30.0026,118,2012-03-04 09:00:00,9,4,3,2012,6,1,9,602.7,0,9,30.0026,110.7,1,0
5/4/12 7:00,2,0,1,1,13.94,49,12.998,354,2012-04-05 07:00:00,7,5,4,2012,3,0,7,683.06,7,0,12.998,97.58,1,0
13/3/11 3:00,1,0,0,1,13.94,76,8.9981,23,2011-03-13 03:00:00,3,13,3,2011,6,1,3,1059.44,0,3,8.9981,41.82,0,0
8/10/11 9:00,4,0,0,1,20.5,77,0.0,217,2011-10-08 09:00:00,9,8,10,2011,5,1,9,1578.5,0,9,0.0,184.5,1,0
4/1/12 6:00,1,0,1,1,0.82,41,11.0014,59,2012-01-04 06:00:00,6,4,1,2012,2,0,6,33.62,6,0,11.0014,4.92,0,0
15/4/11 23:00,2,1,0,2,14.76,81,12.998,64,2011-04-15 23:00:00,23,15,4,2011,4,0,46,1195.56,0,0,25.996,339.48,0,0
8/9/11 14:00,3,0,1,2,28.7,79,23.9994,120,2011-09-08 14:00:00,14,8,9,2011,3,0,28,2267.2999999999997,14,0,47.9988,401.8,0,0
1/3/12 10:00,1,0,1,1,21.32,55,11.0014,133,2012-03-01 10:00:00,10,1,3,2012,3,0,10,1172.6,10,0,11.0014,213.2,0,0
6/9/12 0:00,3,0,1,2,28.40905507,87,4.904747015,69,2012-09-06 00:00:00,0,6,9,2012,3,0,0,2471.58779109,0,0,9.80949403,0.0,0,0
19/12/12 14:00,4,0,1,1,17.22,50,12.998,218,2012-12-19 14:00:00,14,19,12,2012,2,0,14,861.0,14,0,12.998,241.07999999999998,0,0
19/9/11 3:00,3,0,1,2,20.5,77,8.9981,5,2011-09-19 03:00:00,3,19,9,2011,0,0,6,1578.5,3,0,17.9962,61.5,0,0
16/5/12 18:00,2,0,1,1,29.29414081,51,13.379987,850,2012-05-16 18:00:00,18,16,5,2012,2,0,18,1494.00118131,18,0,13.379987,527.29453458,0,1
1/1/12 13:00,1,0,0,1,17.22,58,19.0012,223,2012-01-01 13:00:00,13,1,1,2012,6,1,13,998.76,0,13,19.0012,223.85999999999999,0,0
5/3/12 4:00,1,0,1,1,8.2,55,6.0032,1,2012-03-05 04:00:00,4,5,3,2012,0,0,4,450.99999999999994,4,0,6.0032,32.8,0,0
19/6/11 13:00,2,0,0,2,30.34,51,0.0,363,2011-06-19 13:00:00,13,19,6,2011,6,1,26,1547.34,0,13,0.0,394.42,0,0
2/5/11 1:00,2,0,1,1,18.86,72,8.9981,114,2011-05-02 01:00:00,1,2,5,2011,0,0,1,1357.92,1,0,8.9981,18.86,0,0
6/7/11 11:00,3,0,1,2,28.51729451,76,0.0,118,2011-07-06 11:00:00,11,6,7,2011,2,0,22,2167.3143827599997,11,0,0.0,313.69023961,0,0
4/4/12 5:00,2,0,1,1,17.22,67,6.0032,27,2012-04-04 05:00:00,5,4,4,2012,2,0,5,1153.74,5,0,6.0032,86.1,0,0
5/2/11 12:00,1,0,0,3,10.2592152,100,11.03027847,78,2011-02-05 12:00:00,12,5,2,2011,5,1,36,1025.9215199999999,0,12,33.090835410000004,123.1105824,0,0
19/4/12 16:00,2,0,1,1,24.34631169,41,7.698949874,392,2012-04-19 16:00:00,16,19,4,2012,3,0,16,998.1987792900001,16,0,7.698949874,389.54098704,0,0
15/9/12 7:00,3,0,0,1,22.14,52,19.0012,73,2012-09-15 07:00:00,7,15,9,2012,5,1,7,1151.28,0,7,19.0012,154.98000000000002,1,0
3/9/11 7:00,3,0,0,1,25.42,73,12.998,38,2011-09-03 07:00:00,7,3,9,2011,5,1,7,1855.66,0,7,12.998,177.94,1,0
8/2/11 8:00,1,0,1,1,9.84,56,32.9975,243,2011-02-08 08:00:00,8,8,2,2011,1,0,8,551.04,8,0,32.9975,78.72,1,0
8/6/12 14:00,2,0,1,1,31.16,31,26.0027,373,2012-06-08 14:00:00,14,8,6,2012,4,0,14,965.96,14,0,26.0027,436.24,0,0
18/2/11 20:00,1,0,1,1,24.6,31,12.998,124,2011-02-18 20:00:00,20,18,2,2011,4,0,20,762.6,20,0,12.998,492.0,0,0
18/9/12 14:00,3,0,1,3,24.6,94,31.0009,143,2012-09-18 14:00:00,14,18,9,2012,1,0,42,2312.4,14,0,93.0027,344.40000000000003,0,0
2/2/12 14:00,1,0,1,1,16.4,76,7.0015,141,2012-02-02 14:00:00,14,2,2,2012,3,0,14,1246.3999999999999,14,0,7.0015,229.59999999999997,0,0
15/2/12 18:00,1,0,1,1,17.105341,43,14.54054322,479,2012-02-15 18:00:00,18,15,2,2012,2,0,18,735.5296629999999,18,0,14.54054322,307.896138,0,1
16/6/11 20:00,2,0,1,1,25.42,83,22.0028,201,2011-06-16 20:00:00,20,16,6,2011,3,0,20,2109.86,20,0,22.0028,508.40000000000003,0,0
8/9/11 11:00,3,0,1,2,26.24,94,15.0013,98,2011-09-08 11:00:00,11,8,9,2011,3,0,22,2466.56,11,0,30.0026,288.64,0,0
9/11/12 23:00,4,0,1,1,13.12,81,6.0032,162,2012-11-09 23:00:00,23,9,11,2012,4,0,23,1062.72,23,0,6.0032,301.76,0,0
18/11/12 0:00,4,0,0,2,12.55466303,69,11.42465938,130,2012-11-18 00:00:00,0,18,11,2012,6,1,0,866.27174907,0,0,22.84931876,0.0,0,0
12/7/12 14:00,3,0,1,1,30.73956877,34,16.64678605,209,2012-07-12 14:00:00,14,12,7,2012,3,0,14,1045.14533818,14,0,16.64678605,430.35396278,0,0
12/8/12 19:00,3,0,0,1,30.34,40,8.9981,465,2012-08-12 19:00:00,19,12,8,2012,6,1,19,1213.6,0,19,8.9981,576.46,0,1
9/7/12 2:00,3,0,1,3,28.7,89,12.998,5,2012-07-09 02:00:00,2,9,7,2012,0,0,6,2554.2999999999997,2,0,38.994,57.4,0,0
17/5/12 3:00,2,0,1,1,24.6,73,16.9979,3,2012-05-17 03:00:00,3,17,5,2012,3,0,3,1795.8000000000002,3,0,16.9979,73.80000000000001,0,0
12/10/12 8:00,4,0,1,1,17.22,71,6.0032,745,2012-10-12 08:00:00,8,12,10,2012,4,0,8,1222.62,8,0,6.0032,137.76,1,0
2/10/12 0:00,4,0,1,2,22.96,73,0.0,31,2012-10-02 00:00:00,0,2,10,2012,1,0,0,1676.0800000000002,0,0,0.0,0.0,0,0
16/10/11 4:00,4,0,0,1,17.22,54,12.998,12,2011-10-16 04:00:00,4,16,10,2011,6,1,4,929.8799999999999,0,4,12.998,68.88,0,0
13/4/12 13:00,2,0,1,1,21.32,27,19.0012,358,2012-04-13 13:00:00,13,13,4,2012,4,0,13,575.64,13,0,19.0012,277.16,0,0
1/7/12 7:00,3,0,0,1,29.66118417,70,0.024268811,31,2012-07-01 07:00:00,7,1,7,2012,6,1,7,2076.2828919,0,7,0.024268811,207.62828918999998,1,0
2/8/12 16:00,3,0,1,1,33.62,46,12.998,406,2012-08-02 16:00:00,16,2,8,2012,3,0,16,1546.52,16,0,12.998,537.92,0,0
1/5/11 20:00,2,0,0,2,18.3488289,84,0.003678178,117,2011-05-01 20:00:00,20,1,5,2011,6,1,40,1541.3016276,0,20,0.007356356,366.976578,0,0
2/3/11 23:00,1,0,1,1,10.66,30,35.0008,22,2011-03-02 23:00:00,23,2,3,2011,2,0,23,319.8,23,0,35.0008,245.18,0,0
1/4/11 15:00,2,0,1,1,13.94,46,27.9993,111,2011-04-01 15:00:00,15,1,4,2011,4,0,15,641.24,15,0,27.9993,209.1,0,0
6/9/12 19:00,3,0,1,1,27.88,74,16.9979,558,2012-09-06 19:00:00,19,6,9,2012,3,0,19,2063.12,19,0,16.9979,529.72,0,1
7/5/11 10:00,2,0,0,1,22.96,49,19.9995,298,2011-05-07 10:00:00,10,7,5,2011,5,1,10,1125.04,0,10,19.9995,229.60000000000002,0,0
19/3/12 7:00,1,0,1,1,18.86,88,12.998,354,2012-03-19 07:00:00,7,19,3,2012,0,0,7,1659.6799999999998,7,0,12.998,132.01999999999998,1,0
9/7/11 23:00,3,0,0,1,29.52,58,12.998,140,2011-07-09 23:00:00,23,9,7,2011,5,1,23,1712.16,0,23,12.998,678.96,0,0
11/7/11 5:00,3,0,1,1,27.06,74,8.9981,26,2011-07-11 05:00:00,5,11,7,2011,0,0,5,2002.4399999999998,5,0,8.9981,135.29999999999998,0,0
5/3/11 16:00,1,0,0,2,18.45833293,58,20.16325542,226,2011-03-05 16:00:00,16,5,3,2011,5,1,32,1070.5833099400002,0,16,40.32651084,295.33332688,0,0
8/4/11 7:00,2,0,1,3,13.94,87,11.0014,113,2011-04-08 07:00:00,7,8,4,2011,4,0,21,1212.78,7,0,33.0042,97.58,1,0
15/3/12 18:00,1,0,1,1,27.06,44,19.0012,746,2012-03-15 18:00:00,18,15,3,2012,3,0,18,1190.6399999999999,18,0,19.0012,487.08,0,1
6/8/12 3:00,3,0,1,3,29.52,79,6.0032,5,2012-08-06 03:00:00,3,6,8,2012,0,0,9,2332.08,3,0,18.0096,88.56,0,0
18/5/11 12:00,2,0,1,1,22.46750465,98,19.65886679,37,2011-05-18 12:00:00,12,18,5,2011,2,0,12,2201.8154557,12,0,19.65886679,269.6100558,0,0
11/10/12 11:00,4,0,1,1,18.86,36,0.0,251,2012-10-11 11:00:00,11,11,10,2012,3,0,11,678.96,11,0,0.0,207.45999999999998,0,0
8/4/12 5:00,2,0,0,1,15.58,46,0.0,12,2012-04-08 05:00:00,5,8,4,2012,6,1,5,716.68,0,5,0.0,77.9,0,0
9/4/11 10:00,2,0,0,2,13.94,87,8.9981,133,2011-04-09 10:00:00,10,9,4,2011,5,1,20,1212.78,0,10,17.9962,139.4,0,0
18/2/11 8:00,1,0,1,2,17.22,77,12.998,272,2011-02-18 08:00:00,8,18,2,2011,4,0,16,1325.9399999999998,8,0,25.996,137.76,1,0
19/3/11 4:00,1,0,0,1,21.32,34,27.9993,3,2011-03-19 04:00:00,4,19,3,2011,5,1,4,724.88,0,4,27.9993,85.28,0,0
13/6/12 8:00,2,0,1,2,26.47425943,76,36.37182951,674,2012-06-13 08:00:00,8,13,6,2012,2,0,16,2012.04371668,8,0,72.74365902,211.79407544,1,0
14/6/12 15:00,2,0,1,1,30.34,48,19.9995,324,2012-06-14 15:00:00,15,14,6,2012,3,0,15,1456.32,15,0,19.9995,455.1,0,0
14/7/11 16:00,3,0,1,1,31.16,33,8.9981,274,2011-07-14 16:00:00,16,14,7,2011,3,0,16,1028.28,16,0,8.9981,498.56,0,0
9/12/12 23:00,4,0,0,3,14.4213,100,5.058464196,62,2012-12-09 23:00:00,23,9,12,2012,6,1,69,1442.13,0,23,15.175392588000001,331.6899,0,0
8/4/11 20:00,2,0,1,2,12.3,93,22.0028,63,2011-04-08 20:00:00,20,8,4,2011,4,0,40,1143.9,20,0,44.0056,246.0,0,0
7/5/11 20:00,2,0,0,1,22.96,43,8.9981,219,2011-05-07 20:00:00,20,7,5,2011,5,1,20,987.2800000000001,0,20,8.9981,459.20000000000005,0,0
12/10/11 2:00,4,0,1,2,24.20113177,83,20.32792592,15,2011-10-12 02:00:00,2,12,10,2011,2,0,4,2008.69393691,2,0,40.65585184,48.40226354,0,0
9/2/12 21:00,1,0,1,1,12.58467644,53,5.916670764,145,2012-02-09 21:00:00,21,9,2,2012,3,0,21,666.98785132,21,0,5.916670764,264.27820524000003,0,0
8/2/11 12:00,1,0,1,1,9.84,38,32.9975,65,2011-02-08 12:00:00,12,8,2,2011,1,0,12,373.92,12,0,32.9975,118.08,0,0
11/1/12 8:00,1,0,1,1,8.2,82,7.0015,499,2012-01-11 08:00:00,8,11,1,2012,2,0,8,672.4,8,0,7.0015,65.6,1,0
14/8/11 21:00,3,0,0,3,24.6,88,32.9975,155,2011-08-14 21:00:00,21,14,8,2011,6,1,63,2164.8,0,21,98.9925,516.6,0,0
19/4/11 9:00,2,0,1,3,21.32,63,6.0032,162,2011-04-19 09:00:00,9,19,4,2011,1,0,27,1343.16,9,0,18.0096,191.88,1,0
19/2/11 10:00,1,0,0,1,17.22,16,39.0007,106,2011-02-19 10:00:00,10,19,2,2011,5,1,10,275.52,0,10,39.0007,172.2,0,0
15/3/11 14:00,1,0,1,2,15.58,46,19.9995,88,2011-03-15 14:00:00,14,15,3,2011,1,0,28,716.68,14,0,39.999,218.12,0,0
13/11/12 21:00,4,0,1,1,12.3,49,23.9994,187,2012-11-13 21:00:00,21,13,11,2012,1,0,21,602.7,21,0,23.9994,258.3,0,0
13/6/11 10:00,2,0,1,1,27.42149225,43,23.33447322,130,2011-06-13 10:00:00,10,13,6,2011,0,0,10,1179.12416675,10,0,23.33447322,274.2149225,0,0
13/12/12 15:00,4,0,1,1,14.76,34,8.9981,280,2012-12-13 15:00:00,15,13,12,2012,3,0,15,501.84,15,0,8.9981,221.4,0,0
7/12/12 1:00,4,0,1,2,9.84,70,12.998,28,2012-12-07 01:00:00,1,7,12,2012,4,0,2,688.8,1,0,25.996,9.84,0,0
2/9/11 1:00,3,0,1,3,25.42,73,7.0015,32,2011-09-02 01:00:00,1,2,9,2011,4,0,3,1855.66,1,0,21.0045,25.42,0,0
14/5/12 3:00,2,0,1,2,23.78,68,22.0028,2,2012-05-14 03:00:00,3,14,5,2012,0,0,6,1617.04,3,0,44.0056,71.34,0,0
7/12/12 0:00,4,0,1,1,9.84,70,7.0015,48,2012-12-07 00:00:00,0,7,12,2012,4,0,0,688.8,0,0,7.0015,0.0,0,0
2/11/11 23:00,4,0,1,1,14.76,76,6.0032,57,2011-11-02 23:00:00,23,2,11,2011,2,0,23,1121.76,23,0,6.0032,339.48,0,0
7/12/11 1:00,4,0,1,2,18.67625143,100,17.51487886,42,2011-12-07 01:00:00,1,7,12,2011,2,0,2,1867.625143,1,0,35.02975772,18.67625143,0,0
5/2/12 5:00,1,0,0,3,10.66,81,12.998,4,2012-02-05 05:00:00,5,5,2,2012,6,1,15,863.46,0,5,38.994,53.3,0,0
4/8/12 1:00,3,0,0,1,29.52,84,12.998,122,2012-08-04 01:00:00,1,4,8,2012,5,1,1,2479.68,0,1,12.998,29.52,0,0
13/10/12 14:00,4,0,0,1,19.68,33,12.998,597,2012-10-13 14:00:00,14,13,10,2012,5,1,14,649.4399999999999,0,14,12.998,275.52,0,0
7/12/11 2:00,4,0,1,3,18.86,100,15.0013,6,2011-12-07 02:00:00,2,7,12,2011,2,0,6,1886.0,2,0,45.0039,37.72,0,0
10/11/12 22:00,4,0,0,1,15.58,71,6.0032,193,2012-11-10 22:00:00,22,10,11,2012,5,1,22,1106.18,0,22,6.0032,342.76,0,0
1/4/12 0:00,2,0,0,2,14.76,76,16.9979,67,2012-04-01 00:00:00,0,1,4,2012,6,1,0,1121.76,0,0,33.9958,0.0,0,0
9/4/12 8:00,2,0,1,1,18.04,30,12.998,617,2012-04-09 08:00:00,8,9,4,2012,0,0,8,541.1999999999999,8,0,12.998,144.32,1,0
16/10/12 10:00,4,0,1,1,20.5,48,19.0012,222,2012-10-16 10:00:00,10,16,10,2012,1,0,10,984.0,10,0,19.0012,205.0,0,0
11/9/12 9:00,3,0,1,1,24.29439358,47,0.884368734,372,2012-09-11 09:00:00,9,11,9,2012,1,0,9,1141.83649826,9,0,0.884368734,218.64954222,1,0
12/5/12 17:00,2,0,0,2,27.06,36,12.998,576,2012-05-12 17:00:00,17,12,5,2012,5,1,34,974.16,0,17,25.996,460.02,0,1
10/12/12 14:00,4,0,1,2,20.5,94,15.0013,210,2012-12-10 14:00:00,14,10,12,2012,0,0,28,1927.0,14,0,30.0026,287.0,0,0
13/12/12 2:00,4,0,1,2,10.91867727,51,18.37481462,1,2012-12-13 02:00:00,2,13,12,2012,3,0,4,556.85254077,2,0,36.74962924,21.83735454,0,0
2/8/12 2:00,3,0,1,1,27.06,83,6.0032,11,2012-08-02 02:00:00,2,2,8,2012,3,0,2,2245.98,2,0,6.0032,54.12,0,0
12/9/11 12:00,3,0,1,1,29.52,51,12.998,184,2011-09-12 12:00:00,12,12,9,2011,0,0,12,1505.52,12,0,12.998,354.24,0,0
17/7/12 15:00,3,0,1,1,37.72,31,11.0014,244,2012-07-17 15:00:00,15,17,7,2012,1,0,15,1169.32,15,0,11.0014,565.8,0,0
17/3/11 17:00,1,0,1,1,20.5,42,12.998,313,2011-03-17 17:00:00,17,17,3,2011,3,0,17,861.0,17,0,12.998,348.5,0,1
16/1/12 20:00,1,1,0,1,10.66,60,19.0012,90,2012-01-16 20:00:00,20,16,1,2012,0,0,20,639.6,0,0,19.0012,213.2,0,0
11/9/11 23:00,3,0,0,3,23.78,78,6.0032,45,2011-09-11 23:00:00,23,11,9,2011,6,1,69,1854.8400000000001,0,23,18.0096,546.94,0,0
11/2/12 21:00,1,0,0,1,5.74,43,43.0006,48,2012-02-11 21:00:00,21,11,2,2012,5,1,21,246.82000000000002,0,21,43.0006,120.54,0,0
3/3/12 10:00,1,0,0,2,16.4,87,0.0,168,2012-03-03 10:00:00,10,3,3,2012,5,1,20,1426.8,0,10,0.0,164.0,0,0
13/9/12 19:00,3,0,1,1,26.24,65,8.9981,674,2012-09-13 19:00:00,19,13,9,2012,3,0,19,1705.6,19,0,8.9981,498.55999999999995,0,1
9/8/11 11:00,3,0,1,1,32.03092711,60,15.68871186,169,2011-08-09 11:00:00,11,9,8,2011,1,0,11,1921.8556266,11,0,15.68871186,352.34019821,0,0
11/2/11 21:00,1,0,1,1,8.2,59,8.9981,47,2011-02-11 21:00:00,21,11,2,2011,4,0,21,483.79999999999995,21,0,8.9981,172.2,0,0
2/11/12 4:00,4,0,1,1,12.55909554,69,6.54259432,1,2012-11-02 04:00:00,4,2,11,2012,4,0,4,866.57759226,4,0,6.54259432,50.23638216,0,0
13/9/11 21:00,3,0,1,1,26.24,78,11.0014,245,2011-09-13 21:00:00,21,13,9,2011,1,0,21,2046.7199999999998,21,0,11.0014,551.04,0,0
7/12/12 22:00,4,0,1,2,14.76,93,6.0032,165,2012-12-07 22:00:00,22,7,12,2012,4,0,44,1372.68,22,0,12.0064,324.71999999999997,0,0
13/4/12 6:00,2,0,1,1,13.12,57,11.0014,84,2012-04-13 06:00:00,6,13,4,2012,4,0,6,747.8399999999999,6,0,11.0014,78.72,0,0
4/1/12 11:00,1,0,1,2,3.28,42,6.0032,46,2012-01-04 11:00:00,11,4,1,2012,2,0,22,137.76,11,0,12.0064,36.08,0,0
15/8/12 19:00,3,0,1,1,29.15864426,62,8.884402848,643,2012-08-15 19:00:00,19,15,8,2012,2,0,19,1807.83594412,19,0,8.884402848,554.01424094,0,1
18/7/11 23:00,3,0,1,1,30.34,66,11.0014,91,2011-07-18 23:00:00,23,18,7,2011,0,0,23,2002.44,23,0,11.0014,697.82,0,0
3/3/11 17:00,1,0,1,1,10.66,22,0.0,202,2011-03-03 17:00:00,17,3,3,2011,3,0,17,234.52,17,0,0.0,181.22,0,1
15/12/11 13:00,4,0,1,2,20.5,55,23.9994,164,2011-12-15 13:00:00,13,15,12,2011,3,0,26,1127.5,13,0,47.9988,266.5,0,0
12/12/11 6:00,4,0,1,1,6.56,80,7.0015,64,2011-12-12 06:00:00,6,12,12,2011,0,0,6,524.8,6,0,7.0015,39.36,0,0
19/3/12 7:00,1,0,1,1,18.0558828,88,13.16816354,382,2012-03-19 07:00:00,7,19,3,2012,0,0,7,1588.9176863999999,7,0,13.16816354,126.39117959999999,1,0
3/5/12 16:00,2,0,1,1,27.88,57,11.0014,370,2012-05-03 16:00:00,16,3,5,2012,3,0,16,1589.1599999999999,16,0,11.0014,446.08,0,0
11/4/12 22:00,2,0,1,1,13.94,57,22.0028,134,2012-04-11 22:00:00,22,11,4,2012,2,0,22,794.5799999999999,22,0,22.0028,306.68,0,0
8/1/12 12:00,1,0,0,1,15.21976386,42,16.92173384,370,2012-01-08 12:00:00,12,8,1,2012,6,1,12,639.23008212,0,12,16.92173384,182.63716632,0,0
6/8/12 2:00,3,0,1,2,29.52,79,8.9981,5,2012-08-06 02:00:00,2,6,8,2012,0,0,4,2332.08,2,0,17.9962,59.04,0,0
2/11/11 3:00,4,0,1,1,11.87416017,74,0.397285568,48,2011-11-02 03:00:00,3,2,11,2011,2,0,3,878.68785258,3,0,0.397285568,35.62248051,0,0
7/3/11 9:00,1,0,1,1,9.600862171,63,29.21079266,164,2011-03-07 09:00:00,9,7,3,2011,0,0,9,604.8543167729999,9,0,29.21079266,86.407759539,1,0
6/3/12 10:00,1,0,1,1,9.84,44,0.0,129,2012-03-06 10:00:00,10,6,3,2012,1,0,10,432.96,10,0,0.0,98.4,0,0
14/4/11 16:00,2,0,1,1,24.6,26,7.0015,202,2011-04-14 16:00:00,16,14,4,2011,3,0,16,639.6,16,0,7.0015,393.6,0,0
14/2/12 11:00,1,0,1,2,12.3,45,11.0014,112,2012-02-14 11:00:00,11,14,2,2012,1,0,22,553.5,11,0,22.0028,135.3,0,0
7/3/11 20:00,1,0,1,1,12.3,33,11.0014,92,2011-03-07 20:00:00,20,7,3,2011,0,0,20,405.90000000000003,20,0,11.0014,246.0,0,0
9/8/12 22:00,3,0,1,2,27.06,69,15.0013,259,2012-08-09 22:00:00,22,9,8,2012,3,0,44,1867.1399999999999,22,0,30.0026,595.3199999999999,0,0
5/12/12 22:00,4,0,1,1,13.12,45,26.0027,105,2012-12-05 22:00:00,22,5,12,2012,2,0,22,590.4,22,0,26.0027,288.64,0,0
2/3/11 5:00,1,0,1,1,9.02,69,15.0013,5,2011-03-02 05:00:00,5,2,3,2011,2,0,5,622.38,5,0,15.0013,45.099999999999994,0,0
8/8/12 14:00,3,0,1,2,33.3209109,55,16.82201394,213,2012-08-08 14:00:00,14,8,8,2012,2,0,28,1832.6500995000001,14,0,33.64402788,466.4927526,0,0
19/5/11 0:00,2,0,1,1,21.32,94,7.0015,29,2011-05-19 00:00:00,0,19,5,2011,3,0,0,2004.08,0,0,7.0015,0.0,0,0
6/9/11 11:00,3,0,1,3,22.14,83,26.0027,89,2011-09-06 11:00:00,11,6,9,2011,1,0,33,1837.6200000000001,11,0,78.0081,243.54000000000002,0,0
2/11/12 16:00,4,0,1,1,15.58,40,22.0028,421,2012-11-02 16:00:00,16,2,11,2012,4,0,16,623.2,16,0,22.0028,249.28,0,0
5/7/11 14:00,3,0,1,1,32.8,49,11.0014,178,2011-07-05 14:00:00,14,5,7,2011,1,0,14,1607.1999999999998,14,0,11.0014,459.19999999999993,0,0
6/4/12 3:00,2,0,1,1,13.60049699,53,22.41840922,21,2012-04-06 03:00:00,3,6,4,2012,4,0,3,720.82634047,3,0,22.41840922,40.80149097,0,0
9/9/11 11:00,3,0,1,2,25.42,94,0.0,72,2011-09-09 11:00:00,11,9,9,2011,4,0,22,2389.48,11,0,0.0,279.62,0,0
8/4/12 0:00,2,0,0,1,18.04,24,15.0013,85,2012-04-08 00:00:00,0,8,4,2012,6,1,0,432.96,0,0,15.0013,0.0,0,0
17/2/12 16:00,1,0,1,1,17.22,32,19.9995,307,2012-02-17 16:00:00,16,17,2,2012,4,0,16,551.04,16,0,19.9995,275.52,0,0
6/9/12 13:00,3,0,1,2,29.52,79,7.0015,191,2012-09-06 13:00:00,13,6,9,2012,3,0,26,2332.08,13,0,14.003,383.76,0,0
2/10/12 11:00,4,0,1,3,23.78,94,8.9981,99,2012-10-02 11:00:00,11,2,10,2012,1,0,33,2235.32,11,0,26.994300000000003,261.58000000000004,0,0
9/10/12 4:00,4,0,1,3,13.87661212,87,8.778070497,1,2012-10-09 04:00:00,4,9,10,2012,1,0,12,1207.26525444,4,0,26.334211490999998,55.50644848,0,0
17/11/11 7:00,4,0,1,3,13.94,61,19.0012,168,2011-11-17 07:00:00,7,17,11,2011,3,0,21,850.3399999999999,7,0,57.003600000000006,97.58,1,0
4/7/12 10:00,3,1,0,1,32.8,46,0.0,447,2012-07-04 10:00:00,10,4,7,2012,2,0,10,1508.8,0,0,0.0,328.0,0,0
15/2/12 8:00,1,0,1,1,13.12,61,23.9994,515,2012-02-15 08:00:00,8,15,2,2012,2,0,8,800.3199999999999,8,0,23.9994,104.96,1,0
8/3/11 8:00,1,0,1,1,9.02,55,12.998,257,2011-03-08 08:00:00,8,8,3,2011,1,0,8,496.09999999999997,8,0,12.998,72.16,1,0
4/7/11 1:00,3,1,0,1,26.24,83,6.0032,119,2011-07-04 01:00:00,1,4,7,2011,0,0,1,2177.92,0,0,6.0032,26.24,0,0
7/1/11 9:00,1,0,1,1,8.2,47,19.9995,134,2011-01-07 09:00:00,9,7,1,2011,4,0,9,385.4,9,0,19.9995,73.8,1,0
12/1/11 17:00,1,0,1,1,8.2,47,23.9994,139,2011-01-12 17:00:00,17,12,1,2011,2,0,17,385.4,17,0,23.9994,139.39999999999998,0,1
10/10/12 10:00,4,0,1,1,22.96,52,19.9995,217,2012-10-10 10:00:00,10,10,10,2012,2,0,10,1193.92,10,0,19.9995,229.60000000000002,0,0
10/8/11 21:00,3,0,1,1,31.16,33,7.0015,209,2011-08-10 21:00:00,21,10,8,2011,2,0,21,1028.28,21,0,7.0015,654.36,0,0
2/3/12 3:00,1,0,1,1,13.12,57,12.998,3,2012-03-02 03:00:00,3,2,3,2012,4,0,3,747.8399999999999,3,0,12.998,39.36,0,0
14/1/12 3:00,1,0,0,1,5.74,54,7.0015,20,2012-01-14 03:00:00,3,14,1,2012,5,1,3,309.96000000000004,0,3,7.0015,17.22,0,0
13/7/11 0:00,3,0,1,1,31.16,62,0.0,46,2011-07-13 00:00:00,0,13,7,2011,2,0,0,1931.92,0,0,0.0,0.0,0,0
11/11/11 4:00,4,1,0,1,12.3,61,12.998,8,2011-11-11 04:00:00,4,11,11,2011,4,0,4,750.3000000000001,0,0,12.998,49.2,0,0
7/5/11 13:00,2,0,0,1,23.22325576,38,17.85314442,430,2011-05-07 13:00:00,13,7,5,2011,5,1,13,882.48371888,0,13,17.85314442,301.90232488000004,0,0
5/5/11 21:00,2,0,1,1,20.5,36,12.998,180,2011-05-05 21:00:00,21,5,5,2011,3,0,21,738.0,21,0,12.998,430.5,0,0
6/5/11 13:00,2,0,1,1,23.78,40,22.0028,253,2011-05-06 13:00:00,13,6,5,2011,4,0,13,951.2,13,0,22.0028,309.14,0,0
11/9/11 7:00,3,0,0,1,24.6,88,0.0,37,2011-09-11 07:00:00,7,11,9,2011,6,1,7,2164.8,0,7,0.0,172.20000000000002,1,0
4/10/11 0:00,4,0,1,2,16.4,87,6.0032,27,2011-10-04 00:00:00,0,4,10,2011,1,0,0,1426.8,0,0,12.0064,0.0,0,0
4/10/12 0:00,4,0,1,3,26.24,89,0.0,76,2012-10-04 00:00:00,0,4,10,2012,3,0,0,2335.3599999999997,0,0,0.0,0.0,0,0
19/8/11 22:00,3,0,1,1,24.6,88,8.9981,122,2011-08-19 22:00:00,22,19,8,2011,4,0,22,2164.8,22,0,8.9981,541.2,0,0
7/2/12 2:00,1,0,1,1,13.09857695,61,0.161951083,4,2012-02-07 02:00:00,2,7,2,2012,1,0,2,799.01319395,2,0,0.161951083,26.1971539,0,0
7/11/12 7:00,4,0,1,2,10.66,56,19.9995,319,2012-11-07 07:00:00,7,7,11,2012,2,0,14,596.96,7,0,39.999,74.62,1,0
1/3/12 12:00,1,0,1,1,22.96,37,15.0013,220,2012-03-01 12:00:00,12,1,3,2012,3,0,12,849.52,12,0,15.0013,275.52,0,0
11/11/12 3:00,4,0,0,1,13.94,81,0.0,48,2012-11-11 03:00:00,3,11,11,2012,6,1,3,1129.1399999999999,0,3,0.0,41.82,0,0
10/6/11 19:00,2,0,1,1,31.98,59,12.998,306,2011-06-10 19:00:00,19,10,6,2011,4,0,19,1886.82,19,0,12.998,607.62,0,1
13/7/12 7:00,3,0,1,2,28.7,54,0.0,380,2012-07-13 07:00:00,7,13,7,2012,4,0,14,1549.8,7,0,0.0,200.9,1,0
19/8/12 1:00,3,0,0,1,26.24,65,0.0,131,2012-08-19 01:00:00,1,19,8,2012,6,1,1,1705.6,0,1,0.0,26.24,0,0
4/5/12 23:00,2,0,1,1,24.6,83,6.0032,256,2012-05-04 23:00:00,23,4,5,2012,4,0,23,2041.8000000000002,23,0,6.0032,565.8000000000001,0,0
18/8/12 12:00,3,0,0,1,31.16,37,12.998,654,2012-08-18 12:00:00,12,18,8,2012,5,1,12,1152.92,0,12,12.998,373.92,0,0
4/3/12 22:00,1,0,0,1,11.46899293,42,17.07341577,49,2012-03-04 22:00:00,22,4,3,2012,6,1,22,481.69770306000004,0,22,17.07341577,252.31784446,0,0
7/5/12 19:00,2,0,1,1,23.78,56,22.0028,546,2012-05-07 19:00:00,19,7,5,2012,0,0,19,1331.68,19,0,22.0028,451.82000000000005,0,1
4/12/12 16:00,4,0,1,1,22.272693,49,19.30681351,447,2012-12-04 16:00:00,16,4,12,2012,1,0,16,1091.361957,16,0,19.30681351,356.363088,0,0
12/7/12 0:00,3,0,1,2,27.88,61,0.0,56,2012-07-12 00:00:00,0,12,7,2012,3,0,0,1700.6799999999998,0,0,0.0,0.0,0,0
19/4/11 20:00,2,0,1,2,20.5,72,15.0013,168,2011-04-19 20:00:00,20,19,4,2011,1,0,40,1476.0,20,0,30.0026,410.0,0,0
6/1/11 18:00,1,0,1,1,9.02,51,8.9981,163,2011-01-06 18:00:00,18,6,1,2011,3,0,18,460.02,18,0,8.9981,162.35999999999999,0,1
8/7/12 12:00,3,0,0,1,37.72,42,12.998,376,2012-07-08 12:00:00,12,8,7,2012,6,1,12,1584.24,0,12,12.998,452.64,0,0
7/4/11 19:00,2,0,1,1,18.86,59,19.9995,226,2011-04-07 19:00:00,19,7,4,2011,3,0,19,1112.74,19,0,19.9995,358.34,0,1
16/5/11 6:00,2,0,1,1,21.83458976,90,11.02730542,117,2011-05-16 06:00:00,6,16,5,2011,0,0,6,1965.1130784,6,0,11.02730542,131.00753856,0,0
14/3/12 17:00,1,0,1,1,28.7,28,6.0032,782,2012-03-14 17:00:00,17,14,3,2012,2,0,17,803.6,17,0,6.0032,487.9,0,1
2/7/11 5:00,3,0,0,1,23.78,73,7.0015,14,2011-07-02 05:00:00,5,2,7,2011,5,1,5,1735.94,0,5,7.0015,118.9,0,0
1/7/11 20:00,3,0,1,1,29.52,42,15.0013,269,2011-07-01 20:00:00,20,1,7,2011,4,0,20,1239.84,20,0,15.0013,590.4,0,0
18/12/12 20:00,4,0,1,1,14.76,50,16.9979,268,2012-12-18 20:00:00,20,18,12,2012,1,0,20,738.0,20,0,16.9979,295.2,0,0
9/3/11 6:00,1,0,1,2,9.84,85,7.0015,49,2011-03-09 06:00:00,6,9,3,2011,2,0,12,836.4,6,0,14.003,59.04,0,0
9/2/12 11:00,1,0,1,1,9.84,52,15.0013,99,2012-02-09 11:00:00,11,9,2,2012,3,0,11,511.68,11,0,15.0013,108.24,0,0
6/5/11 20:00,2,0,1,1,21.32,48,7.0015,190,2011-05-06 20:00:00,20,6,5,2011,4,0,20,1023.36,20,0,7.0015,426.4,0,0
19/4/12 14:00,2,0,1,1,23.78,43,0.0,237,2012-04-19 14:00:00,14,19,4,2012,3,0,14,1022.5400000000001,14,0,0.0,332.92,0,0
19/6/12 10:00,2,0,1,1,26.24,73,6.0032,180,2012-06-19 10:00:00,10,19,6,2012,1,0,10,1915.52,10,0,6.0032,262.4,0,0
4/11/12 13:00,4,0,0,1,16.4,43,15.0013,493,2012-11-04 13:00:00,13,4,11,2012,6,1,13,705.1999999999999,0,13,15.0013,213.2,0,0
19/6/11 2:00,2,0,0,1,27.88,74,6.0032,72,2011-06-19 02:00:00,2,19,6,2011,6,1,2,2063.12,0,2,6.0032,55.76,0,0
12/8/12 23:00,3,0,0,1,27.88,61,0.0,110,2012-08-12 23:00:00,23,12,8,2012,6,1,23,1700.6799999999998,0,23,0.0,641.24,0,0
13/6/12 19:00,2,0,1,1,28.7,34,26.0027,671,2012-06-13 19:00:00,19,13,6,2012,2,0,19,975.8,19,0,26.0027,545.3,0,1
11/4/11 12:00,2,0,1,2,24.6,73,22.0028,134,2011-04-11 12:00:00,12,11,4,2011,0,0,24,1795.8000000000002,12,0,44.0056,295.20000000000005,0,0
17/12/11 5:00,4,0,0,2,10.66,60,12.998,9,2011-12-17 05:00:00,5,17,12,2011,5,1,10,639.6,0,5,25.996,53.3,0,0
18/5/11 4:00,2,0,1,3,21.32,94,19.9995,3,2011-05-18 04:00:00,4,18,5,2011,2,0,12,2004.08,4,0,59.99850000000001,85.28,0,0
19/5/11 17:00,2,0,1,1,22.96,78,11.0014,547,2011-05-19 17:00:00,17,19,5,2011,3,0,17,1790.88,17,0,11.0014,390.32,0,1
4/5/11 2:00,2,0,1,3,20.5,82,19.0012,4,2011-05-04 02:00:00,2,4,5,2011,2,0,6,1681.0,2,0,57.003600000000006,41.0,0,0
12/1/11 19:00,1,0,1,1,7.801626954,49,28.16841853,58,2011-01-12 19:00:00,19,12,1,2011,2,0,19,382.27972074599995,19,0,28.16841853,148.230912126,0,1
11/10/12 20:00,4,0,1,1,16.98565657,61,10.53995012,419,2012-10-11 20:00:00,20,11,10,2012,3,0,20,1036.12505077,20,0,10.53995012,339.7131314,0,0
7/1/11 14:00,1,0,1,2,8.2,40,16.9979,50,2011-01-07 14:00:00,14,7,1,2011,4,0,28,328.0,14,0,33.9958,114.79999999999998,0,0
6/7/12 14:00,3,0,1,1,36.9,31,11.0014,275,2012-07-06 14:00:00,14,6,7,2012,4,0,14,1143.8999999999999,14,0,11.0014,516.6,0,0
4/7/12 5:00,3,1,0,1,27.06,69,0.0,19,2012-07-04 05:00:00,5,4,7,2012,2,0,5,1867.1399999999999,0,0,0.0,135.29999999999998,0,0
1/11/12 23:00,4,0,1,1,13.94,57,11.0014,120,2012-11-01 23:00:00,23,1,11,2012,3,0,23,794.5799999999999,23,0,11.0014,320.62,0,0
6/6/11 18:00,2,0,1,1,31.16,31,8.9981,556,2011-06-06 18:00:00,18,6,6,2011,0,0,18,965.96,18,0,8.9981,560.88,0,1
5/5/12 8:00,2,0,0,1,23.9449587,83,3.934585199,212,2012-05-05 08:00:00,8,5,5,2012,5,1,8,1987.4315721,0,8,3.934585199,191.5596696,1,0
1/2/11 11:00,1,0,1,2,7.38,86,0.0,51,2011-02-01 11:00:00,11,1,2,2011,1,0,22,634.68,11,0,0.0,81.17999999999999,0,0
7/6/12 4:00,2,0,1,1,18.86,88,7.0015,6,2012-06-07 04:00:00,4,7,6,2012,3,0,4,1659.6799999999998,4,0,7.0015,75.44,0,0
14/2/12 10:00,1,0,1,2,10.88353379,64,9.484018976,94,2012-02-14 10:00:00,10,14,2,2012,1,0,20,696.54616256,10,0,18.968037952,108.8353379,0,0
5/5/11 2:00,2,0,1,1,13.94,66,15.0013,5,2011-05-05 02:00:00,2,5,5,2011,3,0,2,920.04,2,0,15.0013,27.88,0,0
12/9/11 2:00,3,0,1,1,22.96,88,0.0,2,2011-09-12 02:00:00,2,12,9,2011,0,0,2,2020.48,2,0,0.0,45.92,0,0
16/5/11 12:00,2,0,1,1,27.06,54,6.0032,209,2011-05-16 12:00:00,12,16,5,2011,0,0,12,1461.24,12,0,6.0032,324.71999999999997,0,0
2/10/11 21:00,4,0,0,1,14.76,71,15.0013,88,2011-10-02 21:00:00,21,2,10,2011,6,1,21,1047.96,0,21,15.0013,309.96,0,0
14/1/12 9:00,1,0,0,1,5.74,50,7.0015,81,2012-01-14 09:00:00,9,14,1,2012,5,1,9,287.0,0,9,7.0015,51.660000000000004,1,0
16/8/11 11:00,3,0,1,1,32.19981494,49,16.39487052,166,2011-08-16 11:00:00,11,16,8,2011,1,0,11,1577.7909320600002,11,0,16.39487052,354.19796434000006,0,0
14/6/12 23:00,2,0,1,2,25.42,69,11.0014,172,2012-06-14 23:00:00,23,14,6,2012,3,0,46,1753.98,23,0,22.0028,584.6600000000001,0,0
9/10/11 15:00,4,0,0,1,27.88,51,11.0014,407,2011-10-09 15:00:00,15,9,10,2011,6,1,15,1421.8799999999999,0,15,11.0014,418.2,0,0
11/5/11 6:00,2,0,1,1,18.86,82,8.9981,99,2011-05-11 06:00:00,6,11,5,2011,2,0,6,1546.52,6,0,8.9981,113.16,0,0
9/5/11 6:00,2,0,1,1,18.04,72,16.9979,89,2011-05-09 06:00:00,6,9,5,2011,0,0,6,1298.8799999999999,6,0,16.9979,108.24,0,0
10/12/11 22:00,4,0,0,1,9.02,41,8.9981,95,2011-12-10 22:00:00,22,10,12,2011,5,1,22,369.82,0,22,8.9981,198.44,0,0
5/12/11 11:00,4,0,1,2,14.76,87,6.0032,123,2011-12-05 11:00:00,11,5,12,2011,0,0,22,1284.12,11,0,12.0064,162.35999999999999,0,0
2/9/11 0:00,3,0,1,1,26.38365098,65,12.04385808,69,2011-09-02 00:00:00,0,2,9,2011,4,0,0,1714.9373137,0,0,12.04385808,0.0,0,0
5/1/12 1:00,1,0,1,1,8.2,51,6.0032,5,2012-01-05 01:00:00,1,5,1,2012,3,0,1,418.2,1,0,6.0032,8.2,0,0
12/11/12 1:00,4,1,0,1,16.4,76,11.0014,30,2012-11-12 01:00:00,1,12,11,2012,0,0,1,1246.3999999999999,0,0,11.0014,16.4,0,0
10/7/11 7:00,3,0,0,1,27.9950111,72,6.662655887,51,2011-07-10 07:00:00,7,10,7,2011,6,1,7,2015.6407992,0,7,6.662655887,195.9650777,1,0
12/10/12 12:00,4,0,1,1,22.14,39,31.0009,387,2012-10-12 12:00:00,12,12,10,2012,4,0,12,863.46,12,0,31.0009,265.68,0,0
17/2/12 15:00,1,0,1,1,17.22,35,27.9993,221,2012-02-17 15:00:00,15,17,2,2012,4,0,15,602.6999999999999,15,0,27.9993,258.29999999999995,0,0
16/9/12 9:00,3,0,0,1,23.78,60,8.9981,296,2012-09-16 09:00:00,9,16,9,2012,6,1,9,1426.8000000000002,0,9,8.9981,214.02,1,0
17/7/12 22:00,3,0,1,1,32.8,55,15.0013,244,2012-07-17 22:00:00,22,17,7,2012,1,0,22,1803.9999999999998,22,0,15.0013,721.5999999999999,0,0
7/4/12 1:00,2,0,0,1,16.4,28,16.9979,69,2012-04-07 01:00:00,1,7,4,2012,5,1,1,459.19999999999993,0,1,16.9979,16.4,0,0
8/1/11 8:00,1,0,0,3,6.56,93,7.0015,15,2011-01-08 08:00:00,8,8,1,2011,5,1,24,610.0799999999999,0,8,21.0045,52.48,1,0
5/4/11 0:00,2,0,1,1,25.42,50,7.0015,22,2011-04-05 00:00:00,0,5,4,2011,1,0,0,1271.0,0,0,7.0015,0.0,0,0
18/4/11 3:00,2,0,1,1,17.22,62,7.0015,7,2011-04-18 03:00:00,3,18,4,2011,0,0,3,1067.6399999999999,3,0,7.0015,51.66,0,0
17/7/11 5:00,3,0,0,1,26.24,69,15.0013,12,2011-07-17 05:00:00,5,17,7,2011,6,1,5,1810.56,0,5,15.0013,131.2,0,0
11/9/12 17:00,3,0,1,1,28.7,28,0.0,970,2012-09-11 17:00:00,17,11,9,2012,1,0,17,803.6,17,0,0.0,487.9,0,1
1/4/11 0:00,2,0,1,3,10.66,100,11.0014,6,2011-04-01 00:00:00,0,1,4,2011,4,0,0,1066.0,0,0,33.0042,0.0,0,0
14/1/12 18:00,1,0,0,1,9.02,41,12.998,143,2012-01-14 18:00:00,18,14,1,2012,5,1,18,369.82,0,18,12.998,162.35999999999999,0,1
1/10/11 6:00,4,0,0,1,17.22,67,22.0028,19,2011-10-01 06:00:00,6,1,10,2011,5,1,6,1153.74,0,6,22.0028,103.32,0,0
13/4/12 23:00,2,0,1,1,17.22,62,6.0032,198,2012-04-13 23:00:00,23,13,4,2012,4,0,23,1067.6399999999999,23,0,6.0032,396.05999999999995,0,0
10/2/12 3:00,1,0,1,1,10.66,56,6.0032,5,2012-02-10 03:00:00,3,10,2,2012,4,0,3,596.96,3,0,6.0032,31.98,0,0
15/7/11 18:00,3,0,1,1,29.52,45,15.0013,496,2011-07-15 18:00:00,18,15,7,2011,4,0,18,1328.4,18,0,15.0013,531.36,0,1
8/1/12 17:00,1,0,0,1,15.58,40,15.0013,219,2012-01-08 17:00:00,17,8,1,2012,6,1,17,623.2,0,17,15.0013,264.86,0,1
8/2/12 20:00,1,0,1,3,9.239089087,85,9.200405036,132,2012-02-08 20:00:00,20,8,2,2012,2,0,60,785.322572395,20,0,27.601215107999998,184.78178173999999,0,0
18/8/11 14:00,3,0,1,1,33.62,46,22.0028,182,2011-08-18 14:00:00,14,18,8,2011,3,0,14,1546.52,14,0,22.0028,470.67999999999995,0,0
5/10/11 17:00,4,0,1,1,26.24,47,16.9979,591,2011-10-05 17:00:00,17,5,10,2011,2,0,17,1233.28,17,0,16.9979,446.08,0,1
8/5/12 7:00,2,0,1,1,21.32,72,19.0012,463,2012-05-08 07:00:00,7,8,5,2012,1,0,7,1535.04,7,0,19.0012,149.24,1,0
14/11/12 3:00,4,0,1,1,9.84,65,15.0013,5,2012-11-14 03:00:00,3,14,11,2012,2,0,3,639.6,3,0,15.0013,29.52,0,0
11/3/11 11:00,1,0,1,2,13.12,57,19.9995,81,2011-03-11 11:00:00,11,11,3,2011,4,0,22,747.8399999999999,11,0,39.999,144.32,0,0
5/1/12 0:00,1,0,1,2,9.02,47,12.998,14,2012-01-05 00:00:00,0,5,1,2012,3,0,0,423.94,0,0,25.996,0.0,0,0
10/8/11 1:00,3,0,1,1,29.52,54,12.998,17,2011-08-10 01:00:00,1,10,8,2011,2,0,1,1594.08,1,0,12.998,29.52,0,0
7/5/12 13:00,2,0,1,2,24.6,53,22.0028,272,2012-05-07 13:00:00,13,7,5,2012,0,0,26,1303.8000000000002,13,0,44.0056,319.8,0,0
4/5/12 0:00,2,0,1,1,24.6,78,22.0028,89,2012-05-04 00:00:00,0,4,5,2012,4,0,0,1918.8000000000002,0,0,22.0028,0.0,0,0
6/2/12 6:00,1,0,1,1,6.56,86,7.0015,72,2012-02-06 06:00:00,6,6,2,2012,0,0,6,564.16,6,0,7.0015,39.36,0,0
13/5/11 19:00,2,0,1,2,20.48040841,82,13.88891847,274,2011-05-13 19:00:00,19,13,5,2011,4,0,38,1679.3934896199999,19,0,27.77783694,389.12775978999997,0,1
3/10/12 19:00,4,0,1,1,28.7,65,0.0,593,2012-10-03 19:00:00,19,3,10,2012,2,0,19,1865.5,19,0,0.0,545.3,0,1
8/3/11 11:00,1,0,1,2,14.76,25,11.0014,78,2011-03-08 11:00:00,11,8,3,2011,1,0,22,369.0,11,0,22.0028,162.35999999999999,0,0
14/2/12 18:00,1,0,1,2,15.58,46,19.9995,406,2012-02-14 18:00:00,18,14,2,2012,1,0,36,716.68,18,0,39.999,280.44,0,1
14/3/12 0:00,1,0,1,1,22.14,60,7.0015,39,2012-03-14 00:00:00,0,14,3,2012,2,0,0,1328.4,0,0,7.0015,0.0,0,0
18/11/12 10:00,4,0,0,1,13.94,66,19.9995,329,2012-11-18 10:00:00,10,18,11,2012,6,1,10,920.04,0,10,19.9995,139.4,0,0
4/8/12 10:00,3,0,0,1,33.62,57,12.998,396,2012-08-04 10:00:00,10,4,8,2012,5,1,10,1916.34,0,10,12.998,336.2,0,0
6/4/12 2:00,2,0,1,1,14.76,50,26.0027,11,2012-04-06 02:00:00,2,6,4,2012,4,0,2,738.0,2,0,26.0027,29.52,0,0
19/11/11 12:00,4,0,0,1,16.4,35,19.0012,311,2011-11-19 12:00:00,12,19,11,2011,5,1,12,574.0,0,12,19.0012,196.79999999999998,0,0
9/2/12 13:00,1,0,1,1,12.3,42,22.0028,154,2012-02-09 13:00:00,13,9,2,2012,3,0,13,516.6,13,0,22.0028,159.9,0,0
3/7/12 22:00,3,0,1,1,27.88,79,12.998,177,2012-07-03 22:00:00,22,3,7,2012,1,0,22,2202.52,22,0,12.998,613.36,0,0
12/4/12 6:00,2,0,1,1,13.07647469,62,16.20849041,101,2012-04-12 06:00:00,6,12,4,2012,3,0,6,810.74143078,6,0,16.20849041,78.45884814,0,0
9/12/11 14:00,4,0,1,1,15.58,46,19.0012,187,2011-12-09 14:00:00,14,9,12,2011,4,0,14,716.68,14,0,19.0012,218.12,0,0
5/8/12 23:00,3,0,0,2,29.44600693,79,11.06747171,57,2012-08-05 23:00:00,23,5,8,2012,6,1,46,2326.23454747,0,23,22.13494342,677.25815939,0,0
10/11/12 19:00,4,0,0,1,18.86,51,6.0032,283,2012-11-10 19:00:00,19,10,11,2012,5,1,19,961.86,0,19,6.0032,358.34,0,1
12/10/12 1:00,4,0,1,1,16.4,66,6.0032,37,2012-10-12 01:00:00,1,12,10,2012,4,0,1,1082.3999999999999,1,0,6.0032,16.4,0,0
8/2/11 17:00,1,0,1,1,9.02,32,39.0007,176,2011-02-08 17:00:00,17,8,2,2011,1,0,17,288.64,17,0,39.0007,153.34,0,1
2/4/12 11:00,2,0,1,1,17.22,47,30.0026,209,2012-04-02 11:00:00,11,2,4,2012,0,0,11,809.3399999999999,11,0,30.0026,189.42,0,0
5/8/12 7:00,3,0,0,1,30.34,74,19.9995,68,2012-08-05 07:00:00,7,5,8,2012,6,1,7,2245.16,0,7,19.9995,212.38,1,0
19/12/11 3:00,4,0,1,1,6.56,86,6.0032,3,2011-12-19 03:00:00,3,19,12,2011,0,0,3,564.16,3,0,6.0032,19.68,0,0
15/9/11 18:00,3,0,1,3,19.68,67,40.9973,244,2011-09-15 18:00:00,18,15,9,2011,3,0,54,1318.56,18,0,122.99190000000002,354.24,0,1
18/5/12 3:00,2,0,1,1,18.86,72,6.0032,14,2012-05-18 03:00:00,3,18,5,2012,4,0,3,1357.92,3,0,6.0032,56.58,0,0
13/3/11 5:00,1,0,0,1,14.76,62,8.9981,3,2011-03-13 05:00:00,5,13,3,2011,6,1,5,915.12,0,5,8.9981,73.8,0,0
12/9/12 23:00,3,0,1,1,23.63940754,68,6.441333835,105,2012-09-12 23:00:00,23,12,9,2012,2,0,23,1607.47971272,23,0,6.441333835,543.70637342,0,0
14/6/11 14:00,2,0,1,2,26.24,47,12.998,159,2011-06-14 14:00:00,14,14,6,2011,1,0,28,1233.28,14,0,25.996,367.35999999999996,0,0
16/8/11 10:00,3,0,1,1,28.7,58,26.0027,111,2011-08-16 10:00:00,10,16,8,2011,1,0,10,1664.6,10,0,26.0027,287.0,0,0
10/7/12 18:00,3,0,1,3,27.34604406,72,15.086916,840,2012-07-10 18:00:00,18,10,7,2012,1,0,54,1968.91517232,18,0,45.260748,492.22879308,0,1
8/11/12 16:00,4,0,1,1,17.22,16,26.0027,339,2012-11-08 16:00:00,16,8,11,2012,3,0,16,275.52,16,0,26.0027,275.52,0,0
18/3/11 21:00,1,0,1,1,25.42,46,7.0015,113,2011-03-18 21:00:00,21,18,3,2011,4,0,21,1169.3200000000002,21,0,7.0015,533.82,0,0
6/5/12 22:00,2,0,0,1,22.96,73,11.0014,157,2012-05-06 22:00:00,22,6,5,2012,6,1,22,1676.0800000000002,0,22,11.0014,505.12,0,0
8/8/12 23:00,3,0,1,1,29.52,70,8.9981,136,2012-08-08 23:00:00,23,8,8,2012,2,0,23,2066.4,23,0,8.9981,678.96,0,0
11/9/12 20:00,3,0,1,1,23.78,56,8.9981,461,2012-09-11 20:00:00,20,11,9,2012,1,0,20,1331.68,20,0,8.9981,475.6,0,0
18/9/11 8:00,3,0,0,1,18.86,72,16.9979,69,2011-09-18 08:00:00,8,18,9,2011,6,1,8,1357.92,0,8,16.9979,150.88,1,0
15/7/12 7:00,3,0,0,1,28.49677316,77,6.197805906,40,2012-07-15 07:00:00,7,15,7,2012,6,1,7,2194.25153332,0,7,6.197805906,199.47741212,1,0
14/1/11 18:00,1,0,1,1,8.2,47,0.0,139,2011-01-14 18:00:00,18,14,1,2011,4,0,18,385.4,18,0,0.0,147.6,0,1
6/9/11 21:00,3,0,1,3,21.69765419,90,18.85896801,141,2011-09-06 21:00:00,21,6,9,2011,1,0,63,1952.7888771,21,0,56.57690403000001,455.65073799000004,0,0
11/7/12 2:00,3,0,1,1,26.24,89,0.0,5,2012-07-11 02:00:00,2,11,7,2012,2,0,2,2335.3599999999997,2,0,0.0,52.48,0,0
10/1/12 19:00,1,0,1,1,15.58,46,7.0015,281,2012-01-10 19:00:00,19,10,1,2012,1,0,19,716.68,19,0,7.0015,296.02,0,1
1/3/11 20:00,1,0,1,1,13.16484282,64,7.43360988,58,2011-03-01 20:00:00,20,1,3,2011,1,0,20,842.54994048,20,0,7.43360988,263.2968564,0,0
10/3/12 5:00,1,0,0,1,9.02,42,19.0012,10,2012-03-10 05:00:00,5,10,3,2012,5,1,5,378.84,0,5,19.0012,45.099999999999994,0,0
14/8/12 17:00,3,0,1,3,31.16,66,16.9979,812,2012-08-14 17:00:00,17,14,8,2012,1,0,51,2056.56,17,0,50.993700000000004,529.72,0,1
9/4/12 20:00,2,0,1,1,20.5,36,30.0026,276,2012-04-09 20:00:00,20,9,4,2012,0,0,20,738.0,20,0,30.0026,410.0,0,0
9/11/12 3:00,4,0,1,1,13.12,53,27.9993,9,2012-11-09 03:00:00,3,9,11,2012,4,0,3,695.36,3,0,27.9993,39.36,0,0
3/11/12 18:00,4,0,0,2,14.76,46,19.0012,297,2012-11-03 18:00:00,18,3,11,2012,5,1,36,678.96,0,18,38.0024,265.68,0,1
1/8/12 19:00,3,0,1,1,30.34,66,16.9979,652,2012-08-01 19:00:00,19,1,8,2012,2,0,19,2002.44,19,0,16.9979,576.46,0,1
6/4/12 17:00,2,0,1,1,21.32,23,27.9993,655,2012-04-06 17:00:00,17,6,4,2012,4,0,17,490.36,17,0,27.9993,362.44,0,1
3/4/12 23:00,2,0,1,1,20.43081345,59,1.749455044,65,2012-04-03 23:00:00,23,3,4,2012,1,0,23,1205.41799355,23,0,1.749455044,469.90870935,0,0
9/5/12 21:00,2,0,1,3,19.72419901,83,9.312420979,14,2012-05-09 21:00:00,21,9,5,2012,2,0,63,1637.10851783,21,0,27.937262937,414.20817920999997,0,0
15/12/12 19:00,4,0,0,1,14.76,62,8.9981,257,2012-12-15 19:00:00,19,15,12,2012,5,1,19,915.12,0,19,8.9981,280.44,0,1
14/7/12 14:00,3,0,0,1,32.8,55,7.0015,632,2012-07-14 14:00:00,14,14,7,2012,5,1,14,1803.9999999999998,0,14,7.0015,459.19999999999993,0,0
5/5/11 10:00,2,0,1,1,20.5,39,19.0012,128,2011-05-05 10:00:00,10,5,5,2011,3,0,10,799.5,10,0,19.0012,205.0,0,0
18/5/11 23:00,2,0,1,1,21.32,94,6.0032,59,2011-05-18 23:00:00,23,18,5,2011,2,0,23,2004.08,23,0,6.0032,490.36,0,0
11/3/11 19:00,1,0,1,1,12.3,56,22.0028,118,2011-03-11 19:00:00,19,11,3,2011,4,0,19,688.8000000000001,19,0,22.0028,233.70000000000002,0,1
17/11/11 21:00,4,0,1,1,12.3,42,16.9979,116,2011-11-17 21:00:00,21,17,11,2011,3,0,21,516.6,21,0,16.9979,258.3,0,0
15/4/11 7:00,2,1,0,1,16.4,71,11.0014,149,2011-04-15 07:00:00,7,15,4,2011,4,0,7,1164.3999999999999,0,0,11.0014,114.79999999999998,1,0
4/8/11 17:00,3,0,1,1,31.16,62,22.0028,555,2011-08-04 17:00:00,17,4,8,2011,3,0,17,1931.92,17,0,22.0028,529.72,0,1
11/6/11 13:00,2,0,0,1,32.8,55,12.998,387,2011-06-11 13:00:00,13,11,6,2011,5,1,13,1803.9999999999998,0,13,12.998,426.4,0,0
9/4/11 8:00,2,0,0,2,14.07192087,92,9.966458947,21,2011-04-09 08:00:00,8,9,4,2011,5,1,16,1294.61672004,0,8,19.932917894,112.57536696,1,0
11/3/11 12:00,1,0,1,2,13.94,53,16.9979,111,2011-03-11 12:00:00,12,11,3,2011,4,0,24,738.8199999999999,12,0,33.9958,167.28,0,0
2/6/12 11:00,2,0,0,1,23.78,46,19.0012,536,2012-06-02 11:00:00,11,2,6,2012,5,1,11,1093.88,0,11,19.0012,261.58000000000004,0,0
11/11/11 17:00,4,1,0,1,13.64897321,39,22.52716917,308,2011-11-11 17:00:00,17,11,11,2011,4,0,17,532.30995519,0,0,22.52716917,232.03254457,0,1
5/9/12 9:00,3,0,1,1,30.34,70,16.9979,290,2012-09-05 09:00:00,9,5,9,2012,2,0,9,2123.8,9,0,16.9979,273.06,1,0
19/9/12 6:00,3,0,1,1,21.32,63,16.9979,172,2012-09-19 06:00:00,6,19,9,2012,2,0,6,1343.16,6,0,16.9979,127.92,0,0
5/10/12 14:00,4,0,1,1,30.34,37,15.0013,400,2012-10-05 14:00:00,14,5,10,2012,4,0,14,1122.58,14,0,15.0013,424.76,0,0
18/11/12 17:00,4,0,0,2,15.58,66,16.9979,280,2012-11-18 17:00:00,17,18,11,2012,6,1,34,1028.28,0,17,33.9958,264.86,0,1
13/3/12 11:00,1,0,1,1,22.14,73,19.0012,219,2012-03-13 11:00:00,11,13,3,2012,1,0,11,1616.22,11,0,19.0012,243.54000000000002,0,0
14/11/11 5:00,4,0,1,2,18.04,67,16.9979,19,2011-11-14 05:00:00,5,14,11,2011,0,0,10,1208.6799999999998,5,0,33.9958,90.19999999999999,0,0
4/7/12 8:00,3,1,0,1,28.7,61,7.0015,153,2012-07-04 08:00:00,8,4,7,2012,2,0,8,1750.7,0,0,7.0015,229.6,1,0
6/12/12 7:00,4,0,1,1,7.474036981,48,19.57301204,382,2012-12-06 07:00:00,7,6,12,2012,3,0,7,358.753775088,7,0,19.57301204,52.318258867000004,1,0
10/5/12 18:00,2,0,1,1,22.76996615,35,35.18921531,764,2012-05-10 18:00:00,18,10,5,2012,3,0,18,796.9488152499999,18,0,35.18921531,409.85939069999995,0,1
6/11/12 21:00,4,0,1,2,12.3,56,16.9979,151,2012-11-06 21:00:00,21,6,11,2012,1,0,42,688.8000000000001,21,0,33.9958,258.3,0,0
5/4/12 17:00,2,0,1,1,20.5,31,11.0014,822,2012-04-05 17:00:00,17,5,4,2012,3,0,17,635.5,17,0,11.0014,348.5,0,1
12/5/12 6:00,2,0,0,1,17.22,67,6.0032,33,2012-05-12 06:00:00,6,12,5,2012,5,1,6,1153.74,0,6,6.0032,103.32,0,0
3/9/12 9:00,3,1,0,2,28.7,84,8.9981,229,2012-09-03 09:00:00,9,3,9,2012,0,0,18,2410.7999999999997,0,0,17.9962,258.3,1,0
9/11/12 8:00,4,0,1,1,13.02487724,59,10.41111918,693,2012-11-09 08:00:00,8,9,11,2012,4,0,8,768.46775716,8,0,10.41111918,104.19901792,1,0
19/11/12 21:00,4,0,1,2,15.58,54,15.0013,203,2012-11-19 21:00:00,21,19,11,2012,0,0,42,841.32,21,0,30.0026,327.18,0,0
18/11/11 17:00,4,0,1,1,13.12,31,8.9981,378,2011-11-18 17:00:00,17,18,11,2011,4,0,17,406.71999999999997,17,0,8.9981,223.04,0,1
18/12/11 8:00,4,0,0,1,8.2,69,0.0,32,2011-12-18 08:00:00,8,18,12,2011,6,1,8,565.8,0,8,0.0,65.6,1,0
12/8/11 13:00,3,0,1,1,31.98,29,6.0032,253,2011-08-12 13:00:00,13,12,8,2011,4,0,13,927.42,13,0,6.0032,415.74,0,0
16/4/11 19:00,2,0,0,2,20.88789993,94,28.17439184,102,2011-04-16 19:00:00,19,16,4,2011,5,1,38,1963.46259342,0,19,56.34878368,396.87009867,0,1
17/5/11 20:00,2,0,1,1,23.78,83,27.9993,283,2011-05-17 20:00:00,20,17,5,2011,1,0,20,1973.74,20,0,27.9993,475.6,0,0
16/5/11 7:00,2,0,1,1,21.32,83,19.0012,272,2011-05-16 07:00:00,7,16,5,2011,0,0,7,1769.56,7,0,19.0012,149.24,1,0
3/12/11 2:00,4,0,0,1,10.66,65,11.0014,50,2011-12-03 02:00:00,2,3,12,2011,5,1,2,692.9,0,2,11.0014,21.32,0,0
14/3/11 11:00,1,0,1,1,14.76,40,16.9979,71,2011-03-14 11:00:00,11,14,3,2011,0,0,11,590.4,11,0,16.9979,162.35999999999999,0,0
4/11/11 0:00,4,0,1,2,16.4,82,0.0,43,2011-11-04 00:00:00,0,4,11,2011,4,0,0,1344.8,0,0,0.0,0.0,0,0
9/7/11 16:00,3,0,0,1,33.62,38,0.0,416,2011-07-09 16:00:00,16,9,7,2011,5,1,16,1277.56,0,16,0.0,537.92,0,0
17/11/11 11:00,4,0,1,3,13.12,66,22.0028,97,2011-11-17 11:00:00,11,17,11,2011,3,0,33,865.92,11,0,66.0084,144.32,0,0
5/2/11 1:00,1,0,0,2,9.84,65,11.0014,18,2011-02-05 01:00:00,1,5,2,2011,5,1,2,639.6,0,1,22.0028,9.84,0,0
19/9/11 15:00,3,0,1,2,24.6,60,15.0013,187,2011-09-19 15:00:00,15,19,9,2011,0,0,30,1476.0,15,0,30.0026,369.0,0,0
12/12/12 18:00,4,0,1,2,13.12,49,15.0013,540,2012-12-12 18:00:00,18,12,12,2012,2,0,36,642.88,18,0,30.0026,236.16,0,1
2/7/11 9:00,3,0,0,1,30.34,51,6.0032,179,2011-07-02 09:00:00,9,2,7,2011,5,1,9,1547.34,0,9,6.0032,273.06,1,0
7/8/12 6:00,3,0,1,2,28.7,79,12.998,179,2012-08-07 06:00:00,6,7,8,2012,1,0,12,2267.2999999999997,6,0,25.996,172.2,0,0
4/11/12 9:00,4,0,0,1,12.73646126,55,0.780406143,246,2012-11-04 09:00:00,9,4,11,2012,6,1,9,700.5053693,0,9,0.780406143,114.62815134,1,0
11/4/11 22:00,2,0,1,2,26.24,50,19.0012,91,2011-04-11 22:00:00,22,11,4,2011,0,0,44,1312.0,22,0,38.0024,577.28,0,0
5/11/12 1:00,4,0,1,2,12.3,56,11.0014,8,2012-11-05 01:00:00,1,5,11,2012,0,0,2,688.8000000000001,1,0,22.0028,12.3,0,0
16/1/11 13:00,1,0,0,1,10.66,35,19.9995,118,2011-01-16 13:00:00,13,16,1,2011,6,1,13,373.1,0,13,19.9995,138.58,0,0
14/3/12 10:00,1,0,1,1,23.44750074,56,7.700245433,163,2012-03-14 10:00:00,10,14,3,2012,2,0,10,1313.0600414399998,10,0,7.700245433,234.47500739999998,0,0
16/3/11 14:00,1,0,1,2,16.04510769,77,15.62762193,105,2011-03-16 14:00:00,14,16,3,2011,2,0,28,1235.47329213,14,0,31.25524386,224.63150765999998,0,0
19/12/11 12:00,4,0,1,1,12.3,61,22.0028,141,2011-12-19 12:00:00,12,19,12,2011,0,0,12,750.3000000000001,12,0,22.0028,147.60000000000002,0,0
2/12/11 16:00,4,0,1,1,17.22,41,6.0032,276,2011-12-02 16:00:00,16,2,12,2011,4,0,16,706.02,16,0,6.0032,275.52,0,0
1/7/11 12:00,3,0,1,1,32.8,26,0.0,263,2011-07-01 12:00:00,12,1,7,2011,4,0,12,852.8,12,0,0.0,393.59999999999997,0,0
9/3/12 18:00,1,0,1,1,16.70414291,25,34.38949438,470,2012-03-09 18:00:00,18,9,3,2012,4,0,18,417.60357275,18,0,34.38949438,300.67457238000003,0,1
2/2/12 2:00,1,0,1,2,17.22,67,8.9981,9,2012-02-02 02:00:00,2,2,2,2012,3,0,4,1153.74,2,0,17.9962,34.44,0,0
18/6/11 13:00,2,0,0,1,31.16,55,0.0,327,2011-06-18 13:00:00,13,18,6,2011,5,1,13,1713.8,0,13,0.0,405.08,0,0
3/12/11 4:00,4,0,0,1,9.02,75,8.9981,8,2011-12-03 04:00:00,4,3,12,2011,5,1,4,676.5,0,4,8.9981,36.08,0,0
15/4/12 13:00,2,0,0,1,27.06,44,19.0012,681,2012-04-15 13:00:00,13,15,4,2012,6,1,13,1190.6399999999999,0,13,19.0012,351.78,0,0
6/12/11 16:00,4,0,1,3,18.86,100,16.9979,88,2011-12-06 16:00:00,16,6,12,2011,1,0,48,1886.0,16,0,50.993700000000004,301.76,0,0
13/4/12 14:00,2,0,1,1,21.32,27,0.0,348,2012-04-13 14:00:00,14,13,4,2012,4,0,14,575.64,14,0,0.0,298.48,0,0
17/7/11 8:00,3,0,0,1,27.88,65,15.0013,118,2011-07-17 08:00:00,8,17,7,2011,6,1,8,1812.2,0,8,15.0013,223.04,1,0
2/7/11 6:00,3,0,0,1,25.42,69,7.0015,32,2011-07-02 06:00:00,6,2,7,2011,5,1,6,1753.98,0,6,7.0015,152.52,0,0
1/6/12 13:00,2,0,1,1,28.87578426,67,19.36813983,324,2012-06-01 13:00:00,13,1,6,2012,4,0,13,1934.67754542,13,0,19.36813983,375.38519537999997,0,0
13/3/11 11:00,1,0,0,1,18.04,41,27.9993,181,2011-03-13 11:00:00,11,13,3,2011,6,1,11,739.64,0,11,27.9993,198.44,0,0
16/9/12 11:00,3,0,0,1,26.24,47,11.0014,559,2012-09-16 11:00:00,11,16,9,2012,6,1,11,1233.28,0,11,11.0014,288.64,0,0
18/2/12 12:00,1,0,0,1,14.76,43,12.998,369,2012-02-18 12:00:00,12,18,2,2012,5,1,12,634.68,0,12,12.998,177.12,0,0
7/2/12 19:00,1,0,1,1,14.37727055,40,14.79309152,320,2012-02-07 19:00:00,19,7,2,2012,1,0,19,575.090822,19,0,14.79309152,273.16814045,0,1
10/1/11 18:00,1,0,1,1,8.2,40,15.0013,155,2011-01-10 18:00:00,18,10,1,2011,0,0,18,328.0,18,0,15.0013,147.6,0,1
13/11/12 16:00,4,0,1,1,15.58,40,19.9995,310,2012-11-13 16:00:00,16,13,11,2012,1,0,16,623.2,16,0,19.9995,249.28,0,0
8/3/11 9:00,1,0,1,1,10.66,41,11.0014,151,2011-03-08 09:00:00,9,8,3,2011,1,0,9,437.06,9,0,11.0014,95.94,1,0
14/7/12 19:00,3,0,0,1,29.52,84,6.0032,431,2012-07-14 19:00:00,19,14,7,2012,5,1,19,2479.68,0,19,6.0032,560.88,0,1
18/2/12 8:00,1,0,0,1,9.02,87,0.0,102,2012-02-18 08:00:00,8,18,2,2012,5,1,8,784.74,0,8,0.0,72.16,1,0
13/11/11 11:00,4,0,0,1,18.86,40,27.9993,295,2011-11-13 11:00:00,11,13,11,2011,6,1,11,754.4,0,11,27.9993,207.45999999999998,0,0
3/8/12 19:00,3,0,1,2,31.48528788,66,15.51898258,453,2012-08-03 19:00:00,19,3,8,2012,4,0,38,2078.02900008,19,0,31.03796516,598.22046972,0,1
3/1/12 0:00,1,0,1,1,8.2,51,16.9979,13,2012-01-03 00:00:00,0,3,1,2012,1,0,0,418.2,0,0,16.9979,0.0,0,0
17/6/12 1:00,2,0,0,1,22.60308145,62,9.359201405,83,2012-06-17 01:00:00,1,17,6,2012,6,1,1,1401.3910499,0,1,9.359201405,22.60308145,0,0
7/5/11 0:00,2,0,0,1,17.22,82,8.9981,86,2011-05-07 00:00:00,0,7,5,2011,5,1,0,1412.04,0,0,8.9981,0.0,0,0
9/6/11 9:00,2,0,1,1,34.44,49,0.0,168,2011-06-09 09:00:00,9,9,6,2011,3,0,9,1687.56,9,0,0.0,309.96,1,0
3/8/12 12:00,3,0,1,2,35.26,50,19.9995,338,2012-08-03 12:00:00,12,3,8,2012,4,0,24,1763.0,12,0,39.999,423.12,0,0
3/4/12 7:00,2,0,1,1,13.12,66,6.0032,341,2012-04-03 07:00:00,7,3,4,2012,1,0,7,865.92,7,0,6.0032,91.83999999999999,1,0
4/12/12 12:00,4,0,1,1,21.32,68,12.998,312,2012-12-04 12:00:00,12,4,12,2012,1,0,12,1449.76,12,0,12.998,255.84,0,0
10/6/12 0:00,2,0,0,1,27.97799331,68,8.42234702,118,2012-06-10 00:00:00,0,10,6,2012,6,1,0,1902.5035450799999,0,0,8.42234702,0.0,0,0
10/8/11 2:00,3,0,1,1,29.52,54,11.0014,11,2011-08-10 02:00:00,2,10,8,2011,2,0,2,1594.08,2,0,11.0014,59.04,0,0
4/1/12 4:00,1,0,1,1,0.82,41,12.998,2,2012-01-04 04:00:00,4,4,1,2012,2,0,4,33.62,4,0,12.998,3.28,0,0
13/7/11 7:00,3,0,1,1,31.16,55,16.9979,313,2011-07-13 07:00:00,7,13,7,2011,2,0,7,1713.8,7,0,16.9979,218.12,1,0
8/9/12 12:00,3,0,0,1,32.8,55,32.9975,694,2012-09-08 12:00:00,12,8,9,2012,5,1,12,1803.9999999999998,0,12,32.9975,393.59999999999997,0,0
14/10/12 17:00,4,0,0,1,26.24,44,12.998,539,2012-10-14 17:00:00,17,14,10,2012,6,1,17,1154.56,0,17,12.998,446.08,0,1
1/10/11 20:00,4,0,0,3,14.76,87,7.0015,66,2011-10-01 20:00:00,20,1,10,2011,5,1,60,1284.12,0,20,21.0045,295.2,0,0
11/9/12 22:00,3,0,1,1,23.33375519,65,6.597080119,185,2012-09-11 22:00:00,22,11,9,2012,1,0,22,1516.69408735,22,0,6.597080119,513.34261418,0,0
16/10/11 18:00,4,0,0,1,22.96,49,30.0026,328,2011-10-16 18:00:00,18,16,10,2011,6,1,18,1125.04,0,18,30.0026,413.28000000000003,0,1
8/10/11 20:00,4,0,0,1,21.32,77,7.0015,202,2011-10-08 20:00:00,20,8,10,2011,5,1,20,1641.64,0,20,7.0015,426.4,0,0
16/11/12 11:00,4,0,1,1,15.58,43,15.0013,218,2012-11-16 11:00:00,11,16,11,2012,4,0,11,669.94,11,0,15.0013,171.38,0,0
1/5/11 20:00,2,0,0,2,18.86,82,0.0,121,2011-05-01 20:00:00,20,1,5,2011,6,1,40,1546.52,0,20,0.0,377.2,0,0
1/8/11 23:00,3,0,1,1,26.43324949,79,13.4845338,104,2011-08-01 23:00:00,23,1,8,2011,0,0,23,2088.2267097100003,23,0,13.4845338,607.96473827,0,0
9/7/11 12:00,3,0,0,1,32.8,46,16.9979,366,2011-07-09 12:00:00,12,9,7,2011,5,1,12,1508.8,0,12,16.9979,393.59999999999997,0,0
2/6/11 20:00,2,0,1,1,28.7,24,12.998,337,2011-06-02 20:00:00,20,2,6,2011,3,0,20,688.8,20,0,12.998,574.0,0,0
18/5/11 10:00,2,0,1,3,21.21093447,84,19.60815729,139,2011-05-18 10:00:00,10,18,5,2011,2,0,30,1781.7184954800002,10,0,58.82447187,212.1093447,0,0
16/12/12 18:00,4,0,0,3,15.58,82,7.0015,107,2012-12-16 18:00:00,18,16,12,2012,6,1,54,1277.56,0,18,21.0045,280.44,0,1
1/12/11 10:00,4,0,1,1,13.12,53,19.9995,93,2011-12-01 10:00:00,10,1,12,2011,3,0,10,695.36,10,0,19.9995,131.2,0,0
3/2/11 2:00,1,0,1,1,7.605866873,45,16.68284837,1,2011-02-03 02:00:00,2,3,2,2011,3,0,2,342.264009285,2,0,16.68284837,15.211733746,0,0
12/6/11 21:00,2,0,0,1,27.06,83,7.0015,140,2011-06-12 21:00:00,21,12,6,2011,6,1,21,2245.98,0,21,7.0015,568.26,0,0
18/4/12 0:00,2,0,1,1,19.9755008,31,10.81646895,10,2012-04-18 00:00:00,0,18,4,2012,2,0,0,619.2405248,0,0,10.81646895,0.0,0,0
4/10/11 20:00,4,0,1,1,20.53983478,69,14.80401407,229,2011-10-04 20:00:00,20,4,10,2011,1,0,20,1417.24859982,20,0,14.80401407,410.7966956,0,0
10/7/12 4:00,3,0,1,1,27.88,79,8.9981,4,2012-07-10 04:00:00,4,10,7,2012,1,0,4,2202.52,4,0,8.9981,111.52,0,0
8/12/12 19:00,4,0,0,1,16.4,87,0.0,246,2012-12-08 19:00:00,19,8,12,2012,5,1,19,1426.8,0,19,0.0,311.59999999999997,0,1
5/4/11 3:00,2,0,1,2,22.14,73,22.0028,4,2011-04-05 03:00:00,3,5,4,2011,1,0,6,1616.22,3,0,44.0056,66.42,0,0
4/12/11 23:00,4,0,0,1,13.94,87,7.0015,45,2011-12-04 23:00:00,23,4,12,2011,6,1,23,1212.78,0,23,7.0015,320.62,0,0
15/10/11 22:00,4,0,0,1,20.5,36,8.9981,166,2011-10-15 22:00:00,22,15,10,2011,5,1,22,738.0,0,22,8.9981,451.0,0,0
9/8/12 19:00,3,0,1,1,32.8,55,12.998,623,2012-08-09 19:00:00,19,9,8,2012,3,0,19,1803.9999999999998,19,0,12.998,623.1999999999999,0,1
8/9/12 1:00,3,0,0,2,27.06,89,19.0012,117,2012-09-08 01:00:00,1,8,9,2012,5,1,2,2408.3399999999997,0,1,38.0024,27.06,0,0
16/5/11 21:00,2,0,1,1,23.78,83,0.0,177,2011-05-16 21:00:00,21,16,5,2011,0,0,21,1973.74,21,0,0.0,499.38,0,0
14/10/12 18:00,4,0,0,1,23.78,60,16.9979,453,2012-10-14 18:00:00,18,14,10,2012,6,1,18,1426.8000000000002,0,18,16.9979,428.04,0,1
5/5/12 3:00,2,0,0,1,23.78,83,0.0,32,2012-05-05 03:00:00,3,5,5,2012,5,1,3,1973.74,0,3,0.0,71.34,0,0
18/2/12 16:00,1,0,0,1,18.04,44,22.0028,404,2012-02-18 16:00:00,16,18,2,2012,5,1,16,793.76,0,16,22.0028,288.64,0,0
7/2/11 18:00,1,0,1,2,13.94,66,8.9981,175,2011-02-07 18:00:00,18,7,2,2011,0,0,36,920.04,18,0,17.9962,250.92,0,1
15/11/12 11:00,4,0,1,2,13.94,61,8.9981,166,2012-11-15 11:00:00,11,15,11,2012,3,0,22,850.3399999999999,11,0,17.9962,153.34,0,0
7/5/12 4:00,2,0,1,2,18.86,88,8.9981,2,2012-05-07 04:00:00,4,7,5,2012,0,0,8,1659.6799999999998,4,0,17.9962,75.44,0,0
17/11/12 11:00,4,0,0,1,15.58,43,12.998,423,2012-11-17 11:00:00,11,17,11,2012,5,1,11,669.94,0,11,12.998,171.38,0,0
19/5/11 22:00,2,0,1,3,20.5,82,19.9995,79,2011-05-19 22:00:00,22,19,5,2011,3,0,66,1681.0,22,0,59.99850000000001,451.0,0,0
18/9/12 3:00,3,0,1,2,25.42,94,19.0012,6,2012-09-18 03:00:00,3,18,9,2012,1,0,6,2389.48,3,0,38.0024,76.26,0,0
12/2/11 15:00,1,0,0,1,13.94,29,27.9993,174,2011-02-12 15:00:00,15,12,2,2011,5,1,15,404.26,0,15,27.9993,209.1,0,0
13/6/11 0:00,2,0,1,1,26.24,78,8.9981,28,2011-06-13 00:00:00,0,13,6,2011,0,0,0,2046.7199999999998,0,0,8.9981,0.0,0,0
15/10/12 7:00,4,0,1,2,23.78,68,22.0028,476,2012-10-15 07:00:00,7,15,10,2012,0,0,14,1617.04,7,0,44.0056,166.46,1,0
8/5/12 1:00,2,0,1,2,21.32,59,15.0013,9,2012-05-08 01:00:00,1,8,5,2012,1,0,2,1257.88,1,0,30.0026,21.32,0,0
19/3/12 10:00,1,0,1,1,21.32,72,8.9981,184,2012-03-19 10:00:00,10,19,3,2012,0,0,10,1535.04,10,0,8.9981,213.2,0,0
18/5/11 3:00,2,0,1,3,21.32,94,19.9995,9,2011-05-18 03:00:00,3,18,5,2011,2,0,9,2004.08,3,0,59.99850000000001,63.96,0,0
17/1/12 10:00,1,0,1,3,12.3,87,16.9979,62,2012-01-17 10:00:00,10,17,1,2012,1,0,30,1070.1000000000001,10,0,50.993700000000004,123.0,0,0
18/4/12 14:00,2,0,1,3,18.04,72,7.0015,51,2012-04-18 14:00:00,14,18,4,2012,2,0,42,1298.8799999999999,14,0,21.0045,252.56,0,0
5/3/11 7:00,1,0,0,2,12.70824109,100,20.42840027,12,2011-03-05 07:00:00,7,5,3,2011,5,1,14,1270.824109,0,7,40.85680054,88.95768763,1,0
12/11/12 23:00,4,1,0,2,22.1200231,79,13.74560033,46,2012-11-12 23:00:00,23,12,11,2012,0,0,46,1747.4818249,0,0,27.49120066,508.7605313,0,0
18/4/11 16:00,2,0,1,1,24.6,46,19.0012,205,2011-04-18 16:00:00,16,18,4,2011,0,0,16,1131.6000000000001,16,0,19.0012,393.6,0,0
15/11/12 4:00,4,0,1,2,11.48,65,8.9981,5,2012-11-15 04:00:00,4,15,11,2012,3,0,8,746.2,4,0,17.9962,45.92,0,0
10/6/11 15:00,2,0,1,1,34.44,44,7.0015,212,2011-06-10 15:00:00,15,10,6,2011,4,0,15,1515.36,15,0,7.0015,516.5999999999999,0,0
8/2/11 18:00,1,0,1,1,8.2,32,26.0027,152,2011-02-08 18:00:00,18,8,2,2011,1,0,18,262.4,18,0,26.0027,147.6,0,1
4/6/12 6:00,2,0,1,1,21.32,68,0.0,139,2012-06-04 06:00:00,6,4,6,2012,0,0,6,1449.76,6,0,0.0,127.92,0,0
2/2/11 12:00,1,0,1,2,9.84,93,15.0013,64,2011-02-02 12:00:00,12,2,2,2011,2,0,24,915.12,12,0,30.0026,118.08,0,0
14/5/11 11:00,2,0,0,2,21.3938852,90,9.241259878,287,2011-05-14 11:00:00,11,14,5,2011,5,1,22,1925.449668,0,11,18.482519756,235.3327372,0,0
11/12/11 13:00,4,0,0,1,12.3,31,0.0,268,2011-12-11 13:00:00,13,11,12,2011,6,1,13,381.3,0,13,0.0,159.9,0,0
1/12/12 18:00,4,0,0,2,13.89399673,78,0.521810091,293,2012-12-01 18:00:00,18,1,12,2012,5,1,36,1083.73174494,0,18,1.043620182,250.09194114,0,1
13/7/12 10:00,3,0,1,2,30.34,48,0.0,268,2012-07-13 10:00:00,10,13,7,2012,4,0,20,1456.32,10,0,0.0,303.4,0,0
1/9/12 14:00,3,0,0,2,35.26,44,11.0014,514,2012-09-01 14:00:00,14,1,9,2012,5,1,28,1551.4399999999998,0,14,22.0028,493.64,0,0
15/2/12 19:00,1,0,1,1,15.58,43,11.0014,311,2012-02-15 19:00:00,19,15,2,2012,2,0,19,669.94,19,0,11.0014,296.02,0,1
7/12/12 23:00,4,0,1,2,14.76,93,6.0032,122,2012-12-07 23:00:00,23,7,12,2012,4,0,46,1372.68,23,0,12.0064,339.48,0,0
4/10/12 7:00,4,0,1,2,26.24,89,6.0032,391,2012-10-04 07:00:00,7,4,10,2012,3,0,14,2335.3599999999997,7,0,12.0064,183.67999999999998,1,0
4/11/11 3:00,4,0,1,2,15.58,87,11.0014,8,2011-11-04 03:00:00,3,4,11,2011,4,0,6,1355.46,3,0,22.0028,46.74,0,0
16/1/12 2:00,1,1,0,1,5.74,46,0.0,17,2012-01-16 02:00:00,2,16,1,2012,0,0,2,264.04,0,0,0.0,11.48,0,0
15/10/11 14:00,4,0,0,1,24.6,33,31.0009,472,2011-10-15 14:00:00,14,15,10,2011,5,1,14,811.8000000000001,0,14,31.0009,344.40000000000003,0,0
12/4/12 3:00,2,0,1,1,14.73808829,62,15.60385079,2,2012-04-12 03:00:00,3,12,4,2012,3,0,3,913.76147398,3,0,15.60385079,44.21426487,0,0
2/3/11 15:00,1,0,1,1,22.14,19,27.9993,110,2011-03-02 15:00:00,15,2,3,2011,2,0,15,420.66,15,0,27.9993,332.1,0,0
11/9/12 6:00,3,0,1,1,18.86,77,7.0015,211,2012-09-11 06:00:00,6,11,9,2012,1,0,6,1452.22,6,0,7.0015,113.16,0,0
5/3/12 17:00,1,0,1,3,12.3,45,19.9995,387,2012-03-05 17:00:00,17,5,3,2012,0,0,51,553.5,17,0,59.99850000000001,209.10000000000002,0,1
8/9/12 19:00,3,0,0,3,23.58296515,86,7.696857212,230,2012-09-08 19:00:00,19,8,9,2012,5,1,57,2028.1350029,0,19,23.090571636,448.07633785,0,1
18/3/12 7:00,1,0,0,3,17.22,88,11.0014,42,2012-03-18 07:00:00,7,18,3,2012,6,1,21,1515.36,0,7,33.0042,120.53999999999999,1,0
16/1/12 8:00,1,1,0,1,4.1,58,11.0014,78,2012-01-16 08:00:00,8,16,1,2012,0,0,8,237.79999999999998,0,0,11.0014,32.8,1,0
6/7/11 3:00,3,0,1,1,28.7,79,0.0,6,2011-07-06 03:00:00,3,6,7,2011,2,0,3,2267.2999999999997,3,0,0.0,86.1,0,0
9/12/12 21:00,4,0,0,2,14.76,100,7.0015,96,2012-12-09 21:00:00,21,9,12,2012,6,1,42,1476.0,0,21,14.003,309.96,0,0
10/2/12 11:00,1,0,1,2,11.48,45,7.0015,153,2012-02-10 11:00:00,11,10,2,2012,4,0,22,516.6,11,0,14.003,126.28,0,0
16/7/12 5:00,3,0,1,1,27.06,78,7.0015,50,2012-07-16 05:00:00,5,16,7,2012,0,0,5,2110.68,5,0,7.0015,135.29999999999998,0,0
1/12/11 13:00,4,0,1,1,17.7554624,39,14.71165188,147,2011-12-01 13:00:00,13,1,12,2011,3,0,13,692.4630336,13,0,14.71165188,230.8210112,0,0
1/11/11 14:00,4,0,1,1,20.5,48,16.9979,150,2011-11-01 14:00:00,14,1,11,2011,1,0,14,984.0,14,0,16.9979,287.0,0,0
17/12/12 0:00,4,0,1,2,15.58,87,0.0,28,2012-12-17 00:00:00,0,17,12,2012,0,0,0,1355.46,0,0,0.0,0.0,0,0
8/9/12 15:00,3,0,0,3,22.96,88,16.9979,512,2012-09-08 15:00:00,15,8,9,2012,5,1,45,2020.48,0,15,50.993700000000004,344.40000000000003,0,0
5/5/11 0:00,2,0,1,1,14.76,66,12.998,27,2011-05-05 00:00:00,0,5,5,2011,3,0,0,974.16,0,0,12.998,0.0,0,0
11/4/12 16:00,2,0,1,1,18.04,33,19.9995,307,2012-04-11 16:00:00,16,11,4,2012,2,0,16,595.3199999999999,16,0,19.9995,288.64,0,0
12/4/12 9:00,2,0,1,1,14.76,57,23.9994,287,2012-04-12 09:00:00,9,12,4,2012,3,0,9,841.3199999999999,9,0,23.9994,132.84,1,0
17/5/11 16:00,2,0,1,1,25.42,61,22.0028,290,2011-05-17 16:00:00,16,17,5,2011,1,0,16,1550.6200000000001,16,0,22.0028,406.72,0,0
9/10/11 11:00,4,0,0,1,25.42,53,6.0032,423,2011-10-09 11:00:00,11,9,10,2011,6,1,11,1347.26,0,11,6.0032,279.62,0,0
11/9/12 18:00,3,0,1,1,26.24,36,11.0014,877,2012-09-11 18:00:00,18,11,9,2012,1,0,18,944.64,18,0,11.0014,472.32,0,1
16/9/11 17:00,3,0,1,2,21.32,48,8.9981,566,2011-09-16 17:00:00,17,16,9,2011,4,0,34,1023.36,17,0,17.9962,362.44,0,1
16/2/11 3:00,1,0,1,2,7.197900227,46,14.47145584,1,2011-02-16 03:00:00,3,16,2,2011,2,0,6,331.103410442,3,0,28.94291168,21.593700681,0,0
13/2/12 13:00,1,0,1,1,12.6398097,25,13.80478244,142,2012-02-13 13:00:00,13,13,2,2012,0,0,13,315.9952425,13,0,13.80478244,164.3175261,0,0
19/9/11 6:00,3,0,1,1,19.54522497,77,15.93456833,137,2011-09-19 06:00:00,6,19,9,2011,0,0,6,1504.98232269,6,0,15.93456833,117.27134982,0,0
14/8/11 11:00,3,0,0,1,26.97479602,79,12.32478928,230,2011-08-14 11:00:00,11,14,8,2011,6,1,11,2131.00888558,0,11,12.32478928,296.72275622,0,0
11/10/11 12:00,4,0,1,2,24.6,73,11.0014,181,2011-10-11 12:00:00,12,11,10,2011,1,0,24,1795.8000000000002,12,0,22.0028,295.20000000000005,0,0
9/12/11 9:00,4,0,1,1,10.66,81,6.0032,264,2011-12-09 09:00:00,9,9,12,2011,4,0,9,863.46,9,0,6.0032,95.94,1,0
12/8/11 9:00,3,0,1,1,29.52,34,8.9981,205,2011-08-12 09:00:00,9,12,8,2011,4,0,9,1003.68,9,0,8.9981,265.68,1,0
17/8/11 10:00,3,0,1,1,29.00743656,42,7.171746612,104,2011-08-17 10:00:00,10,17,8,2011,2,0,10,1218.31233552,10,0,7.171746612,290.07436559999996,0,0
4/11/12 2:00,4,0,0,1,12.3,65,0.0,37,2012-11-04 02:00:00,2,4,11,2012,6,1,2,799.5,0,2,0.0,24.6,0,0
15/10/12 10:00,4,0,1,2,24.6,73,26.0027,168,2012-10-15 10:00:00,10,15,10,2012,0,0,20,1795.8000000000002,10,0,52.0054,246.0,0,0
18/3/12 20:00,1,0,0,1,21.32,77,8.9981,198,2012-03-18 20:00:00,20,18,3,2012,6,1,20,1641.64,0,20,8.9981,426.4,0,0
3/7/11 20:00,3,0,0,3,27.75567663,86,0.329236087,164,2011-07-03 20:00:00,20,3,7,2011,6,1,60,2386.98819018,0,20,0.9877082610000001,555.1135326,0,0
8/7/12 5:00,3,0,0,1,31.98,62,0.0,6,2012-07-08 05:00:00,5,8,7,2012,6,1,5,1982.76,0,5,0.0,159.9,0,0
17/8/11 21:00,3,0,1,1,29.52,62,15.0013,230,2011-08-17 21:00:00,21,17,8,2011,2,0,21,1830.24,21,0,15.0013,619.92,0,0
15/8/12 13:00,3,0,1,2,31.98,49,12.998,294,2012-08-15 13:00:00,13,15,8,2012,2,0,26,1567.02,13,0,25.996,415.74,0,0
5/1/11 13:00,1,0,1,1,11.48,30,19.9995,71,2011-01-05 13:00:00,13,5,1,2011,2,0,13,344.40000000000003,13,0,19.9995,149.24,0,0
1/11/11 15:00,4,0,1,1,20.5,45,8.9981,186,2011-11-01 15:00:00,15,1,11,2011,1,0,15,922.5,15,0,8.9981,307.5,0,0
5/7/11 4:00,3,0,1,1,27.06,69,11.0014,5,2011-07-05 04:00:00,4,5,7,2011,1,0,4,1867.1399999999999,4,0,11.0014,108.24,0,0
19/1/11 19:00,1,0,1,1,13.12,57,27.9993,112,2011-01-19 19:00:00,19,19,1,2011,2,0,19,747.8399999999999,19,0,27.9993,249.27999999999997,0,1
1/10/12 5:00,4,0,1,1,18.04,77,0.0,36,2012-10-01 05:00:00,5,1,10,2012,0,0,5,1389.08,5,0,0.0,90.19999999999999,0,0
2/5/11 16:00,2,0,1,1,27.06,61,15.0013,269,2011-05-02 16:00:00,16,2,5,2011,0,0,16,1650.6599999999999,16,0,15.0013,432.96,0,0
1/7/12 17:00,3,0,0,1,37.72,26,19.9995,413,2012-07-01 17:00:00,17,1,7,2012,6,1,17,980.72,0,17,19.9995,641.24,0,1
11/12/11 16:00,4,0,0,1,12.47476326,25,0.18978585,202,2011-12-11 16:00:00,16,11,12,2011,6,1,16,311.8690815,0,16,0.18978585,199.59621216,0,0
8/2/12 4:00,1,0,1,1,10.05757357,69,5.533560896,1,2012-02-08 04:00:00,4,8,2,2012,2,0,4,693.97257633,4,0,5.533560896,40.23029428,0,0
1/11/11 16:00,4,0,1,1,19.68,44,11.0014,298,2011-11-01 16:00:00,16,1,11,2011,1,0,16,865.92,16,0,11.0014,314.88,0,0
18/8/11 0:00,3,0,1,1,27.88,65,8.9981,56,2011-08-18 00:00:00,0,18,8,2011,3,0,0,1812.2,0,0,8.9981,0.0,0,0
6/1/11 1:00,1,0,1,1,6.612726669,60,0.0,1,2011-01-06 01:00:00,1,6,1,2011,3,0,1,396.76360014,1,0,0.0,6.612726669,0,0
18/1/11 21:00,1,0,1,2,8.124587381,93,6.818628926,55,2011-01-18 21:00:00,21,18,1,2011,1,0,42,755.586626433,21,0,13.637257852,170.61633500099998,0,0
12/11/11 3:00,4,0,0,1,10.27809996,70,9.047884526,19,2011-11-12 03:00:00,3,12,11,2011,5,1,3,719.4669972,0,3,9.047884526,30.834299880000003,0,0
7/3/12 11:00,1,0,1,1,17.22,38,19.9995,161,2012-03-07 11:00:00,11,7,3,2012,2,0,11,654.3599999999999,11,0,19.9995,189.42,0,0
8/8/11 16:00,3,0,1,1,35.09012065,41,19.38622718,273,2011-08-08 16:00:00,16,8,8,2011,0,0,16,1438.69494665,16,0,19.38622718,561.4419304,0,0
15/9/12 6:00,3,0,0,1,22.08295129,48,28.34260411,8,2012-09-15 06:00:00,6,15,9,2012,5,1,6,1059.98166192,0,6,28.34260411,132.49770774,0,0
5/9/12 19:00,3,0,1,1,30.34,70,11.0014,662,2012-09-05 19:00:00,19,5,9,2012,2,0,19,2123.8,19,0,11.0014,576.46,0,1
8/10/11 5:00,4,0,0,1,17.22,88,7.0015,8,2011-10-08 05:00:00,5,8,10,2011,5,1,5,1515.36,0,5,7.0015,86.1,0,0
11/7/11 1:00,3,0,1,1,28.7,61,19.0012,10,2011-07-11 01:00:00,1,11,7,2011,0,0,1,1750.7,1,0,19.0012,28.7,0,0
8/9/11 5:00,3,0,1,3,25.42,94,6.0032,14,2011-09-08 05:00:00,5,8,9,2011,3,0,15,2389.48,5,0,18.0096,127.10000000000001,0,0
6/6/11 14:00,2,0,1,1,31.98,31,8.9981,145,2011-06-06 14:00:00,14,6,6,2011,0,0,14,991.38,14,0,8.9981,447.72,0,0
9/11/11 1:00,4,0,1,1,13.94,87,0.0,10,2011-11-09 01:00:00,1,9,11,2011,2,0,1,1212.78,1,0,0.0,13.94,0,0
6/12/11 13:00,4,0,1,3,20.08746887,100,13.21345682,75,2011-12-06 13:00:00,13,6,12,2011,1,0,39,2008.7468869999998,13,0,39.64037046,261.13709531,0,0
6/3/12 19:00,1,0,1,1,13.94,46,19.9995,287,2012-03-06 19:00:00,19,6,3,2012,1,0,19,641.24,19,0,19.9995,264.86,0,1
2/12/11 20:00,4,0,1,1,15.58,40,19.0012,190,2011-12-02 20:00:00,20,2,12,2011,4,0,20,623.2,20,0,19.0012,311.6,0,0
14/9/12 22:00,3,0,1,1,25.42,83,12.998,229,2012-09-14 22:00:00,22,14,9,2012,4,0,22,2109.86,22,0,12.998,559.24,0,0
11/6/11 0:00,2,0,0,1,28.7,79,8.9981,117,2011-06-11 00:00:00,0,11,6,2011,5,1,0,2267.2999999999997,0,0,8.9981,0.0,0,0
9/8/11 7:00,3,0,1,1,29.52,74,7.0015,343,2011-08-09 07:00:00,7,9,8,2011,1,0,7,2184.48,7,0,7.0015,206.64,1,0
7/5/11 9:00,2,0,0,1,20.70448959,49,18.10549715,204,2011-05-07 09:00:00,9,7,5,2011,5,1,9,1014.51998991,0,9,18.10549715,186.34040631000002,1,0
6/3/12 22:00,1,0,1,1,11.48,56,11.0014,106,2012-03-06 22:00:00,22,6,3,2012,1,0,22,642.88,22,0,11.0014,252.56,0,0
9/1/11 14:00,1,0,0,1,9.02,32,31.0009,72,2011-01-09 14:00:00,14,9,1,2011,6,1,14,288.64,0,14,31.0009,126.28,0,0
15/5/12 12:00,2,0,1,1,26.24,73,12.998,264,2012-05-15 12:00:00,12,15,5,2012,1,0,12,1915.52,12,0,12.998,314.88,0,0
15/10/11 16:00,4,0,0,1,26.13071173,30,26.3785145,447,2011-10-15 16:00:00,16,15,10,2011,5,1,16,783.9213519,0,16,26.3785145,418.09138768,0,0
1/2/11 3:00,1,0,1,2,6.56,69,0.0,2,2011-02-01 03:00:00,3,1,2,2011,1,0,6,452.64,3,0,0.0,19.68,0,0
13/3/11 10:00,1,0,0,1,17.22,47,16.9979,122,2011-03-13 10:00:00,10,13,3,2011,6,1,10,809.3399999999999,0,10,16.9979,172.2,0,0
14/4/11 15:00,2,0,1,1,24.82824202,30,6.014141997,117,2011-04-14 15:00:00,15,14,4,2011,3,0,15,744.8472606,15,0,6.014141997,372.4236303,0,0
10/1/11 14:00,1,0,1,2,8.132244354,39,14.75375665,45,2011-01-10 14:00:00,14,10,1,2011,0,0,28,317.15752980599996,14,0,29.5075133,113.85142095599998,0,0
10/6/11 13:00,2,0,1,1,34.44,44,7.0015,189,2011-06-10 13:00:00,13,10,6,2011,4,0,13,1515.36,13,0,7.0015,447.71999999999997,0,0
6/11/11 8:00,4,0,0,2,11.48,87,6.0032,90,2011-11-06 08:00:00,8,6,11,2011,6,1,16,998.76,0,8,12.0064,91.84,1,0
5/3/11 5:00,1,0,0,2,11.68960603,97,9.780681402,1,2011-03-05 05:00:00,5,5,3,2011,5,1,10,1133.89178491,0,5,19.561362804,58.44803015,0,0
12/9/12 1:00,3,0,1,1,21.32,72,7.0015,21,2012-09-12 01:00:00,1,12,9,2012,2,0,1,1535.04,1,0,7.0015,21.32,0,0
14/4/12 13:00,2,0,0,1,25.42,33,19.9995,678,2012-04-14 13:00:00,13,14,4,2012,5,1,13,838.86,0,13,19.9995,330.46000000000004,0,0
12/5/11 11:00,2,0,1,1,23.78,60,15.0013,179,2011-05-12 11:00:00,11,12,5,2011,3,0,11,1426.8000000000002,11,0,15.0013,261.58000000000004,0,0
3/1/12 2:00,1,0,1,1,7.38,51,16.9979,3,2012-01-03 02:00:00,2,3,1,2012,1,0,2,376.38,2,0,16.9979,14.76,0,0
8/10/12 4:00,4,1,0,1,13.12,87,8.9981,7,2012-10-08 04:00:00,4,8,10,2012,0,0,4,1141.4399999999998,0,0,8.9981,52.48,0,0
11/10/11 9:00,4,0,1,2,24.6,69,0.0,235,2011-10-11 09:00:00,9,11,10,2011,1,0,18,1697.4,9,0,0.0,221.4,1,0
5/5/12 16:00,2,0,0,2,27.88,65,26.0027,540,2012-05-05 16:00:00,16,5,5,2012,5,1,32,1812.2,0,16,52.0054,446.08,0,0
9/10/12 17:00,4,0,1,2,21.32,68,11.0014,806,2012-10-09 17:00:00,17,9,10,2012,1,0,34,1449.76,17,0,22.0028,362.44,0,1
15/1/12 20:00,1,0,0,1,6.56,37,7.0015,95,2012-01-15 20:00:00,20,15,1,2012,6,1,20,242.72,0,20,7.0015,131.2,0,0
6/5/11 9:00,2,0,1,1,18.3339789,68,18.38637218,196,2011-05-06 09:00:00,9,6,5,2011,4,0,9,1246.7105652,9,0,18.38637218,165.00581010000002,1,0
17/4/12 17:00,2,0,1,1,27.06017736,24,20.43174338,778,2012-04-17 17:00:00,17,17,4,2012,1,0,17,649.44425664,17,0,20.43174338,460.02301512,0,1
7/12/11 1:00,4,0,1,2,18.69074629,100,18.34017959,1,2011-12-07 01:00:00,1,7,12,2011,2,0,2,1869.074629,1,0,36.68035918,18.69074629,0,0
9/10/12 8:00,4,0,1,2,17.22,80,12.998,713,2012-10-09 08:00:00,8,9,10,2012,1,0,16,1377.6,8,0,25.996,137.76,1,0
7/11/11 4:00,4,0,1,1,12.25440806,97,0.988465764,38,2011-11-07 04:00:00,4,7,11,2011,0,0,4,1188.67758182,4,0,0.988465764,49.01763224,0,0
9/12/11 4:00,4,0,1,1,9.02,80,0.0,2,2011-12-09 04:00:00,4,9,12,2011,4,0,4,721.5999999999999,4,0,0.0,36.08,0,0
4/7/11 13:00,3,1,0,2,31.98,49,0.0,423,2011-07-04 13:00:00,13,4,7,2011,0,0,26,1567.02,0,0,0.0,415.74,0,0
9/4/11 6:00,2,0,0,2,12.3,93,12.998,13,2011-04-09 06:00:00,6,9,4,2011,5,1,12,1143.9,0,6,25.996,73.80000000000001,0,0
8/7/12 23:00,3,0,0,3,27.88,83,6.0032,123,2012-07-08 23:00:00,23,8,7,2012,6,1,69,2314.04,0,23,18.0096,641.24,0,0
2/6/12 6:00,2,0,0,2,19.64240989,78,11.75152367,65,2012-06-02 06:00:00,6,2,6,2012,5,1,12,1532.10797142,0,6,23.50304734,117.85445934,0,0
14/9/12 22:00,3,0,1,1,26.45484516,83,11.53927108,205,2012-09-14 22:00:00,22,14,9,2012,4,0,22,2195.7521482800003,22,0,11.53927108,582.00659352,0,0
12/3/11 10:00,1,0,0,1,11.8833981,64,16.01955408,108,2011-03-12 10:00:00,10,12,3,2011,5,1,10,760.5374784,0,10,16.01955408,118.83398100000001,0,0
12/10/11 9:00,4,0,1,2,21.30497428,91,29.24305298,198,2011-10-12 09:00:00,9,12,10,2011,2,0,18,1938.75265948,9,0,58.48610596,191.74476852,1,0
11/2/11 11:00,1,0,1,1,9.02,47,8.9981,64,2011-02-11 11:00:00,11,11,2,2011,4,0,11,423.94,11,0,8.9981,99.22,0,0
5/1/12 3:00,1,0,1,1,8.524416983,60,0.66626046,14,2012-01-05 03:00:00,3,5,1,2012,3,0,3,511.46501898,3,0,0.66626046,25.573250949,0,0
6/1/11 13:00,1,0,1,1,10.66,35,7.0015,67,2011-01-06 13:00:00,13,6,1,2011,3,0,13,373.1,13,0,7.0015,138.58,0,0
8/7/11 14:00,3,0,1,2,32.8,63,23.9994,216,2011-07-08 14:00:00,14,8,7,2011,4,0,28,2066.3999999999996,14,0,47.9988,459.19999999999993,0,0
2/8/11 23:00,3,0,1,2,32.8,49,11.0014,132,2011-08-02 23:00:00,23,2,8,2011,1,0,46,1607.1999999999998,23,0,22.0028,754.4,0,0
9/2/12 10:00,1,0,1,1,9.02,51,15.0013,97,2012-02-09 10:00:00,10,9,2,2012,3,0,10,460.02,10,0,15.0013,90.19999999999999,0,0
3/9/11 13:00,3,0,0,1,28.7,65,15.0013,353,2011-09-03 13:00:00,13,3,9,2011,5,1,13,1865.5,0,13,15.0013,373.09999999999997,0,0
3/6/12 1:00,2,0,0,1,22.14,56,8.9981,121,2012-06-03 01:00:00,1,3,6,2012,6,1,1,1239.8400000000001,0,1,8.9981,22.14,0,0
12/12/12 13:00,4,0,1,2,13.94,42,0.0,238,2012-12-12 13:00:00,13,12,12,2012,2,0,26,585.48,13,0,0.0,181.22,0,0
17/3/12 19:00,1,0,0,1,23.78,64,19.0012,417,2012-03-17 19:00:00,19,17,3,2012,5,1,19,1521.92,0,19,19.0012,451.82000000000005,0,1
8/2/12 2:00,1,0,1,1,10.66,65,0.0,1,2012-02-08 02:00:00,2,8,2,2012,2,0,2,692.9,2,0,0.0,21.32,0,0
18/10/12 8:00,4,0,1,1,18.86,82,16.9979,834,2012-10-18 08:00:00,8,18,10,2012,3,0,8,1546.52,8,0,16.9979,150.88,1,0
17/3/12 1:00,1,0,0,2,18.66998724,94,0.0,30,2012-03-17 01:00:00,1,17,3,2012,5,1,2,1754.97880056,0,1,0.0,18.66998724,0,0
10/7/11 11:00,3,0,0,1,31.98,55,12.998,287,2011-07-10 11:00:00,11,10,7,2011,6,1,11,1758.9,0,11,12.998,351.78000000000003,0,0
16/8/11 2:00,3,0,1,1,25.42,73,15.0013,4,2011-08-16 02:00:00,2,16,8,2011,1,0,2,1855.66,2,0,15.0013,50.84,0,0
19/5/12 17:00,2,0,0,1,30.70606831,34,6.38715362,643,2012-05-19 17:00:00,17,19,5,2012,5,1,17,1044.00632254,0,17,6.38715362,522.00316127,0,1
12/3/11 3:00,1,0,0,1,9.84,65,16.9979,7,2011-03-12 03:00:00,3,12,3,2011,5,1,3,639.6,0,3,16.9979,29.52,0,0
4/11/11 9:00,4,0,1,2,17.22,71,31.0009,254,2011-11-04 09:00:00,9,4,11,2011,4,0,18,1222.62,9,0,62.0018,154.98,1,0
15/11/11 11:00,4,0,1,2,22.96,64,12.998,134,2011-11-15 11:00:00,11,15,11,2011,1,0,22,1469.44,11,0,25.996,252.56,0,0
15/7/11 15:00,3,0,1,1,29.52,45,11.0014,237,2011-07-15 15:00:00,15,15,7,2011,4,0,15,1328.4,15,0,11.0014,442.8,0,0
17/11/12 16:00,4,0,0,1,16.63644896,39,14.84106458,465,2012-11-17 16:00:00,16,17,11,2012,5,1,16,648.82150944,0,16,14.84106458,266.18318336,0,0
18/10/11 8:00,4,0,1,1,20.5,77,6.0032,499,2011-10-18 08:00:00,8,18,10,2011,1,0,8,1578.5,8,0,6.0032,164.0,1,0
3/4/12 8:00,2,0,1,1,13.94,57,0.0,604,2012-04-03 08:00:00,8,3,4,2012,1,0,8,794.5799999999999,8,0,0.0,111.52,1,0
8/1/12 5:00,1,0,0,2,13.12,49,7.0015,2,2012-01-08 05:00:00,5,8,1,2012,6,1,10,642.88,0,5,14.003,65.6,0,0
17/9/12 16:00,3,0,1,2,26.24,69,16.9979,453,2012-09-17 16:00:00,16,17,9,2012,0,0,32,1810.56,16,0,33.9958,419.84,0,0
8/6/12 17:00,2,0,1,1,31.16,29,12.998,793,2012-06-08 17:00:00,17,8,6,2012,4,0,17,903.64,17,0,12.998,529.72,0,1
15/7/11 7:00,3,0,1,1,26.24,65,7.0015,274,2011-07-15 07:00:00,7,15,7,2011,4,0,7,1705.6,7,0,7.0015,183.67999999999998,1,0
8/8/12 16:00,3,0,1,2,31.99559859,48,19.58270391,450,2012-08-08 16:00:00,16,8,8,2012,2,0,32,1535.78873232,16,0,39.16540782,511.92957744,0,0
9/8/11 6:00,3,0,1,1,29.52,64,0.0,101,2011-08-09 06:00:00,6,9,8,2011,1,0,6,1889.28,6,0,0.0,177.12,0,0
6/10/12 5:00,4,0,0,1,22.14,83,12.998,10,2012-10-06 05:00:00,5,6,10,2012,5,1,5,1837.6200000000001,0,5,12.998,110.7,0,0
18/12/12 13:00,4,0,1,1,20.5,42,19.0012,286,2012-12-18 13:00:00,13,18,12,2012,1,0,13,861.0,13,0,19.0012,266.5,0,0
10/7/11 21:00,3,0,0,1,30.34,62,16.9979,227,2011-07-10 21:00:00,21,10,7,2011,6,1,21,1881.08,0,21,16.9979,637.14,0,0
18/7/12 0:00,3,0,1,1,31.16,66,11.0014,53,2012-07-18 00:00:00,0,18,7,2012,2,0,0,2056.56,0,0,11.0014,0.0,0,0
17/9/12 1:00,3,0,1,1,21.32,72,6.0032,21,2012-09-17 01:00:00,1,17,9,2012,0,0,1,1535.04,1,0,6.0032,21.32,0,0
18/8/11 18:00,3,0,1,3,31.16,55,16.9979,274,2011-08-18 18:00:00,18,18,8,2011,3,0,54,1713.8,18,0,50.993700000000004,560.88,0,1
14/11/11 3:00,4,0,1,1,18.04,67,19.0012,7,2011-11-14 03:00:00,3,14,11,2011,0,0,3,1208.6799999999998,3,0,19.0012,54.12,0,0
10/12/11 2:00,4,0,0,2,11.93516058,56,6.972224808,66,2011-12-10 02:00:00,2,10,12,2011,5,1,4,668.36899248,0,2,13.944449616,23.87032116,0,0
5/1/11 19:00,1,0,1,1,8.700513189,38,7.007292311,164,2011-01-05 19:00:00,19,5,1,2011,2,0,19,330.619501182,19,0,7.007292311,165.309750591,0,1
14/7/12 23:00,3,0,0,2,28.75218836,86,7.064572179,187,2012-07-14 23:00:00,23,14,7,2012,5,1,46,2472.68819896,0,23,14.129144358,661.30033228,0,0
18/7/11 10:00,3,0,1,1,31.16,62,12.998,130,2011-07-18 10:00:00,10,18,7,2011,0,0,10,1931.92,10,0,12.998,311.6,0,0
1/8/12 14:00,3,0,1,1,34.65044113,44,12.17484197,260,2012-08-01 14:00:00,14,1,8,2012,2,0,14,1524.6194097199998,14,0,12.17484197,485.10617582,0,0
9/5/11 16:00,2,0,1,1,26.0875791,41,14.76222969,304,2011-05-09 16:00:00,16,9,5,2011,0,0,16,1069.5907431,16,0,14.76222969,417.4012656,0,0
1/6/12 6:00,2,0,1,3,25.42,88,8.9981,141,2012-06-01 06:00:00,6,1,6,2012,4,0,18,2236.96,6,0,26.994300000000003,152.52,0,0
19/6/11 19:00,2,0,0,1,29.52,62,8.9981,311,2011-06-19 19:00:00,19,19,6,2011,6,1,19,1830.24,0,19,8.9981,560.88,0,1
2/10/11 2:00,4,0,0,3,13.94,87,19.9995,30,2011-10-02 02:00:00,2,2,10,2011,6,1,6,1212.78,0,2,59.99850000000001,27.88,0,0
9/6/11 12:00,2,0,1,1,37.72,35,12.998,140,2011-06-09 12:00:00,12,9,6,2011,3,0,12,1320.2,12,0,12.998,452.64,0,0
17/6/12 15:00,2,0,0,1,27.06,50,15.0013,463,2012-06-17 15:00:00,15,17,6,2012,6,1,15,1353.0,0,15,15.0013,405.9,0,0
3/6/11 23:00,2,0,1,1,23.78,46,7.0015,171,2011-06-03 23:00:00,23,3,6,2011,4,0,23,1093.88,23,0,7.0015,546.94,0,0
8/5/11 7:00,2,0,0,2,18.27506617,83,0.53368049,48,2011-05-08 07:00:00,7,8,5,2011,6,1,14,1516.8304921099998,0,7,1.06736098,127.92546318999999,1,0
9/4/11 2:00,2,0,0,2,13.12,87,15.0013,17,2011-04-09 02:00:00,2,9,4,2011,5,1,4,1141.4399999999998,0,2,30.0026,26.24,0,0
19/12/11 20:00,4,0,1,1,17.41568443,38,11.19707024,232,2011-12-19 20:00:00,20,19,12,2011,0,0,20,661.79600834,20,0,11.19707024,348.3136886,0,0
9/4/11 11:00,2,0,0,2,14.5621227,86,0.0,154,2011-04-09 11:00:00,11,9,4,2011,5,1,22,1252.3425522,0,11,0.0,160.1833497,0,0
2/1/11 12:00,1,0,0,2,14.14773978,69,19.57962574,107,2011-01-02 12:00:00,12,2,1,2011,6,1,24,976.19404482,0,12,39.15925148,169.77287736,0,0
13/11/11 16:00,4,0,0,2,22.14,28,26.0027,319,2011-11-13 16:00:00,16,13,11,2011,6,1,32,619.9200000000001,0,16,52.0054,354.24,0,0
18/12/12 21:00,4,0,1,1,14.76,50,15.0013,168,2012-12-18 21:00:00,21,18,12,2012,1,0,21,738.0,21,0,15.0013,309.96,0,0
10/5/12 16:00,2,0,1,1,23.78,30,31.0009,421,2012-05-10 16:00:00,16,10,5,2012,3,0,16,713.4000000000001,16,0,31.0009,380.48,0,0
8/8/11 10:00,3,0,1,1,32.8,52,26.0027,124,2011-08-08 10:00:00,10,8,8,2011,0,0,10,1705.6,10,0,26.0027,328.0,0,0
18/7/11 17:00,3,0,1,1,34.44,49,22.0028,545,2011-07-18 17:00:00,17,18,7,2011,0,0,17,1687.56,17,0,22.0028,585.48,0,1
3/6/11 15:00,2,0,1,1,28.7,28,19.0012,212,2011-06-03 15:00:00,15,3,6,2011,4,0,15,803.6,15,0,19.0012,430.5,0,0
17/7/11 15:00,3,0,0,1,33.62,43,19.9995,324,2011-07-17 15:00:00,15,17,7,2011,6,1,15,1445.6599999999999,0,15,19.9995,504.29999999999995,0,0
16/12/12 20:00,4,0,0,2,15.58,82,0.0,122,2012-12-16 20:00:00,20,16,12,2012,6,1,40,1277.56,0,20,0.0,311.6,0,0
11/7/11 9:00,3,0,1,1,31.98,59,19.9995,208,2011-07-11 09:00:00,9,11,7,2011,0,0,9,1886.82,9,0,19.9995,287.82,1,0
12/12/11 22:00,4,0,1,1,10.66,70,0.0,71,2011-12-12 22:00:00,22,12,12,2011,0,0,22,746.2,22,0,0.0,234.52,0,0
15/12/12 4:00,4,0,0,2,9.84,87,7.0015,6,2012-12-15 04:00:00,4,15,12,2012,5,1,8,856.08,0,4,14.003,39.36,0,0
18/7/12 4:00,3,0,1,1,29.52,70,8.9981,6,2012-07-18 04:00:00,4,18,7,2012,2,0,4,2066.4,4,0,8.9981,118.08,0,0
2/11/11 7:00,4,0,1,1,12.3,81,0.0,251,2011-11-02 07:00:00,7,2,11,2011,2,0,7,996.3000000000001,7,0,0.0,86.10000000000001,1,0
5/1/12 12:00,1,0,1,1,12.3,49,16.9979,120,2012-01-05 12:00:00,12,5,1,2012,3,0,12,602.7,12,0,16.9979,147.60000000000002,0,0
15/4/11 17:00,2,1,0,2,20.5,63,26.0027,331,2011-04-15 17:00:00,17,15,4,2011,4,0,34,1291.5,0,0,52.0054,348.5,0,1
9/9/11 12:00,3,0,1,1,26.24,94,0.0,75,2011-09-09 12:00:00,12,9,9,2011,4,0,12,2466.56,12,0,0.0,314.88,0,0
5/3/11 1:00,1,0,0,2,12.3,81,7.0015,25,2011-03-05 01:00:00,1,5,3,2011,5,1,2,996.3000000000001,0,1,14.003,12.3,0,0
8/8/12 10:00,3,0,1,2,32.8,52,8.9981,214,2012-08-08 10:00:00,10,8,8,2012,2,0,20,1705.6,10,0,17.9962,328.0,0,0
4/4/11 16:00,2,0,1,1,31.16,22,35.0008,189,2011-04-04 16:00:00,16,4,4,2011,0,0,16,685.52,16,0,35.0008,498.56,0,0
5/11/11 12:00,4,0,0,1,14.76,46,11.0014,372,2011-11-05 12:00:00,12,5,11,2011,5,1,12,678.96,0,12,11.0014,177.12,0,0
6/5/12 20:00,2,0,0,1,24.6,64,12.998,276,2012-05-06 20:00:00,20,6,5,2012,6,1,20,1574.4,0,20,12.998,492.0,0,0
13/2/11 13:00,1,0,0,1,15.58,29,23.9994,154,2011-02-13 13:00:00,13,13,2,2011,6,1,13,451.82,0,13,23.9994,202.54,0,0
8/11/11 9:00,4,0,1,1,14.76,87,0.0,191,2011-11-08 09:00:00,9,8,11,2011,1,0,9,1284.12,9,0,0.0,132.84,1,0
9/5/11 2:00,2,0,1,1,18.04,94,0.0,8,2011-05-09 02:00:00,2,9,5,2011,0,0,2,1695.76,2,0,0.0,36.08,0,0
9/11/11 21:00,4,0,1,1,15.98056609,91,0.0,189,2011-11-09 21:00:00,21,9,11,2011,2,0,21,1454.23151419,21,0,0.0,335.59188789,0,0
6/5/12 19:00,2,0,0,2,24.6,64,11.0014,383,2012-05-06 19:00:00,19,6,5,2012,6,1,38,1574.4,0,19,22.0028,467.40000000000003,0,1
9/8/12 1:00,3,0,1,1,28.7,79,8.9981,28,2012-08-09 01:00:00,1,9,8,2012,3,0,1,2267.2999999999997,1,0,8.9981,28.7,0,0
7/6/12 0:00,2,0,1,1,21.32,77,8.9981,59,2012-06-07 00:00:00,0,7,6,2012,3,0,0,1641.64,0,0,8.9981,0.0,0,0
1/3/11 16:00,1,0,1,1,13.94,34,6.0032,102,2011-03-01 16:00:00,16,1,3,2011,1,0,16,473.96,16,0,6.0032,223.04,0,0
4/8/12 11:00,3,0,0,1,35.26,47,16.9979,470,2012-08-04 11:00:00,11,4,8,2012,5,1,11,1657.2199999999998,0,11,16.9979,387.85999999999996,0,0
13/1/11 21:00,1,0,1,1,5.74,46,19.9995,40,2011-01-13 21:00:00,21,13,1,2011,3,0,21,264.04,21,0,19.9995,120.54,0,0
15/3/11 2:00,1,0,1,1,11.73745147,60,5.768439979,15,2011-03-15 02:00:00,2,15,3,2011,1,0,2,704.2470882,2,0,5.768439979,23.47490294,0,0
18/9/11 21:00,3,0,0,2,22.14,68,6.0032,147,2011-09-18 21:00:00,21,18,9,2011,6,1,42,1505.52,0,21,12.0064,464.94,0,0
6/4/11 20:00,2,0,1,1,18.86,51,15.0013,141,2011-04-06 20:00:00,20,6,4,2011,2,0,20,961.86,20,0,15.0013,377.2,0,0
9/11/11 15:00,4,0,1,1,21.32,45,15.0013,151,2011-11-09 15:00:00,15,9,11,2011,2,0,15,959.4,15,0,15.0013,319.8,0,0
14/1/12 23:00,1,0,0,1,6.56,47,15.0013,76,2012-01-14 23:00:00,23,14,1,2012,5,1,23,308.32,0,23,15.0013,150.88,0,0
12/8/11 23:00,3,0,1,1,27.88,51,0.0,151,2011-08-12 23:00:00,23,12,8,2011,4,0,23,1421.8799999999999,23,0,0.0,641.24,0,0
11/1/11 21:00,1,0,1,3,5.919659645,89,4.330252721,24,2011-01-11 21:00:00,21,11,1,2011,1,0,63,526.849708405,21,0,12.990758162999999,124.31285254500001,0,0
10/11/12 19:00,4,0,0,1,18.69341226,54,6.870802407,282,2012-11-10 19:00:00,19,10,11,2012,5,1,19,1009.4442620399999,0,19,6.870802407,355.17483294,0,1
4/10/12 8:00,4,0,1,1,26.24,89,0.0,738,2012-10-04 08:00:00,8,4,10,2012,3,0,8,2335.3599999999997,8,0,0.0,209.92,1,0
12/6/11 15:00,2,0,0,1,32.8,59,19.9995,360,2011-06-12 15:00:00,15,12,6,2011,6,1,15,1935.1999999999998,0,15,19.9995,491.99999999999994,0,0
16/5/12 22:00,2,0,1,1,26.24,73,11.0014,286,2012-05-16 22:00:00,22,16,5,2012,2,0,22,1915.52,22,0,11.0014,577.28,0,0
4/10/12 6:00,4,0,1,3,25.43957926,92,5.873520436,139,2012-10-04 06:00:00,6,4,10,2012,3,0,18,2340.44129192,6,0,17.620561308,152.63747555999998,0,0
15/3/12 14:00,1,0,1,2,29.52,30,7.0015,258,2012-03-15 14:00:00,14,15,3,2012,3,0,28,885.6,14,0,14.003,413.28,0,0
17/5/12 11:00,2,0,1,1,23.78,49,15.0013,279,2012-05-17 11:00:00,11,17,5,2012,3,0,11,1165.22,11,0,15.0013,261.58000000000004,0,0
8/6/12 10:00,2,0,1,1,27.06,47,16.9979,249,2012-06-08 10:00:00,10,8,6,2012,4,0,10,1271.82,10,0,16.9979,270.59999999999997,0,0
8/12/11 8:00,4,0,1,1,9.02,55,19.0012,429,2011-12-08 08:00:00,8,8,12,2011,3,0,8,496.09999999999997,8,0,19.0012,72.16,1,0
6/5/11 22:00,2,0,1,1,18.86,72,15.0013,151,2011-05-06 22:00:00,22,6,5,2011,4,0,22,1357.92,22,0,15.0013,414.91999999999996,0,0
7/10/11 23:00,4,0,1,1,21.10193133,61,0.0,158,2011-10-07 23:00:00,23,7,10,2011,4,0,23,1287.21781113,23,0,0.0,485.34442058999997,0,0
15/5/12 7:00,2,0,1,3,22.39421806,94,10.01032163,80,2012-05-15 07:00:00,7,15,5,2012,1,0,21,2105.05649764,7,0,30.03096489,156.75952642,1,0
14/8/11 2:00,3,0,0,3,26.24,89,15.0013,62,2011-08-14 02:00:00,2,14,8,2011,6,1,6,2335.3599999999997,0,2,45.0039,52.48,0,0
5/4/12 8:00,2,0,1,1,14.76,46,15.0013,638,2012-04-05 08:00:00,8,5,4,2012,3,0,8,678.96,8,0,15.0013,118.08,1,0
12/11/11 9:00,4,0,0,1,12.3,61,11.0014,160,2011-11-12 09:00:00,9,12,11,2011,5,1,9,750.3000000000001,0,9,11.0014,110.7,1,0
18/9/12 4:00,3,0,1,2,25.42,94,23.9994,7,2012-09-18 04:00:00,4,18,9,2012,1,0,8,2389.48,4,0,47.9988,101.68,0,0
19/11/11 16:00,4,0,0,1,17.22,38,19.9995,287,2011-11-19 16:00:00,16,19,11,2011,5,1,16,654.3599999999999,0,16,19.9995,275.52,0,0
9/12/11 17:00,4,0,1,1,13.94,66,7.0015,362,2011-12-09 17:00:00,17,9,12,2011,4,0,17,920.04,17,0,7.0015,236.98,0,1
13/9/11 15:00,3,0,1,1,30.34,51,19.9995,180,2011-09-13 15:00:00,15,13,9,2011,1,0,15,1547.34,15,0,19.9995,455.1,0,0
18/7/12 19:00,3,0,1,2,31.16,62,7.0015,516,2012-07-18 19:00:00,19,18,7,2012,2,0,38,1931.92,19,0,14.003,592.04,0,1
16/5/12 19:00,2,0,1,1,28.81693706,56,18.55313839,584,2012-05-16 19:00:00,19,16,5,2012,2,0,19,1613.7484753600002,19,0,18.55313839,547.52180414,0,1
4/9/12 19:00,3,0,1,1,31.16,70,15.0013,552,2012-09-04 19:00:00,19,4,9,2012,1,0,19,2181.2,19,0,15.0013,592.04,0,1
11/11/12 12:00,4,0,0,1,20.5,48,6.0032,585,2012-11-11 12:00:00,12,11,11,2012,6,1,12,984.0,0,12,6.0032,246.0,0,0
2/1/11 23:00,1,0,0,1,9.02,47,11.0014,8,2011-01-02 23:00:00,23,2,1,2011,6,1,23,423.94,0,23,11.0014,207.45999999999998,0,0
14/12/12 11:00,4,0,1,1,13.12,65,12.998,211,2012-12-14 11:00:00,11,14,12,2012,4,0,11,852.8,11,0,12.998,144.32,0,0
6/3/12 13:00,1,0,1,1,12.3,39,8.9981,164,2012-03-06 13:00:00,13,6,3,2012,1,0,13,479.70000000000005,13,0,8.9981,159.9,0,0
15/11/11 10:00,4,0,1,2,22.96,64,19.0012,138,2011-11-15 10:00:00,10,15,11,2011,1,0,20,1469.44,10,0,38.0024,229.60000000000002,0,0
18/3/11 1:00,1,0,1,1,16.4,62,16.9979,16,2011-03-18 01:00:00,1,18,3,2011,4,0,1,1016.8,1,0,16.9979,16.4,0,0
11/12/12 6:00,4,0,1,2,13.94,71,19.9995,118,2012-12-11 06:00:00,6,11,12,2012,1,0,12,989.74,6,0,39.999,83.64,0,0
2/1/12 0:00,1,1,0,1,15.68872291,42,31.61052666,22,2012-01-02 00:00:00,0,2,1,2012,0,0,0,658.92636222,0,0,31.61052666,0.0,0,0
17/11/11 10:00,4,0,1,2,13.94,61,22.0028,81,2011-11-17 10:00:00,10,17,11,2011,3,0,20,850.3399999999999,10,0,44.0056,139.4,0,0
2/8/12 4:00,3,0,1,1,27.06,83,0.0,9,2012-08-02 04:00:00,4,2,8,2012,3,0,4,2245.98,4,0,0.0,108.24,0,0
17/10/11 14:00,4,0,1,1,23.36295082,52,12.37109701,178,2011-10-17 14:00:00,14,17,10,2011,0,0,14,1214.87344264,14,0,12.37109701,327.08131147999995,0,0
17/1/11 1:00,1,1,0,2,8.2,44,12.998,16,2011-01-17 01:00:00,1,17,1,2011,0,0,2,360.79999999999995,0,0,25.996,8.2,0,0
15/11/12 20:00,4,0,1,1,13.94,61,7.0015,285,2012-11-15 20:00:00,20,15,11,2012,3,0,20,850.3399999999999,20,0,7.0015,278.8,0,0
11/10/12 6:00,4,0,1,1,15.86804694,50,10.3700392,162,2012-10-11 06:00:00,6,11,10,2012,3,0,6,793.402347,6,0,10.3700392,95.20828164,0,0
3/8/12 17:00,3,0,1,2,34.44,53,19.0012,741,2012-08-03 17:00:00,17,3,8,2012,4,0,34,1825.32,17,0,38.0024,585.48,0,1
18/11/12 0:00,4,0,0,2,12.3,70,11.0014,129,2012-11-18 00:00:00,0,18,11,2012,6,1,0,861.0,0,0,22.0028,0.0,0,0
6/8/11 2:00,3,0,0,1,27.06,78,15.0013,53,2011-08-06 02:00:00,2,6,8,2011,5,1,2,2110.68,0,2,15.0013,54.12,0,0
10/7/12 0:00,3,0,1,1,28.56219857,70,6.232631056,69,2012-07-10 00:00:00,0,10,7,2012,1,0,0,1999.3538999,0,0,6.232631056,0.0,0,0
8/5/11 23:00,2,0,0,1,18.28041408,88,5.229814283,57,2011-05-08 23:00:00,23,8,5,2011,6,1,23,1608.6764390399999,0,23,5.229814283,420.44952384,0,0
4/3/12 16:00,1,0,0,1,14.11787114,28,33.44449767,268,2012-03-04 16:00:00,16,4,3,2012,6,1,16,395.30039192,0,16,33.44449767,225.88593824,0,0
2/9/12 16:00,3,0,0,1,31.26419359,69,0.383195184,475,2012-09-02 16:00:00,16,2,9,2012,6,1,16,2157.22935771,0,16,0.383195184,500.22709744,0,0
6/2/12 7:00,1,0,1,1,6.56,86,7.0015,234,2012-02-06 07:00:00,7,6,2,2012,0,0,7,564.16,7,0,7.0015,45.919999999999995,1,0
2/3/11 9:00,1,0,1,1,11.48,56,19.9995,148,2011-03-02 09:00:00,9,2,3,2011,2,0,9,642.88,9,0,19.9995,103.32000000000001,1,0
15/6/12 2:00,2,0,1,1,22.96,83,7.0015,15,2012-06-15 02:00:00,2,15,6,2012,4,0,2,1905.68,2,0,7.0015,45.92,0,0
17/8/12 18:00,3,0,1,2,33.62,38,16.9979,669,2012-08-17 18:00:00,18,17,8,2012,4,0,36,1277.56,18,0,33.9958,605.16,0,1
16/9/11 8:00,3,0,1,1,17.22,67,15.0013,409,2011-09-16 08:00:00,8,16,9,2011,4,0,8,1153.74,8,0,15.0013,137.76,1,0
19/2/11 20:00,1,0,0,1,13.12,28,35.0008,47,2011-02-19 20:00:00,20,19,2,2011,5,1,20,367.35999999999996,0,20,35.0008,262.4,0,0
9/3/11 0:00,1,0,1,1,10.66,65,6.0032,9,2011-03-09 00:00:00,0,9,3,2011,2,0,0,692.9,0,0,6.0032,0.0,0,0
6/3/12 22:00,1,0,1,1,11.59346917,59,10.06249892,116,2012-03-06 22:00:00,22,6,3,2012,1,0,22,684.01468103,22,0,10.06249892,255.05632174000002,0,0
10/3/12 9:00,1,0,0,1,9.84,41,22.0028,148,2012-03-10 09:00:00,9,10,3,2012,5,1,9,403.44,0,9,22.0028,88.56,1,0
14/10/11 5:00,4,0,1,2,22.96,94,11.0014,17,2011-10-14 05:00:00,5,14,10,2011,4,0,10,2158.2400000000002,5,0,22.0028,114.80000000000001,0,0
1/3/12 9:00,1,0,1,1,19.53248239,76,16.82899934,306,2012-03-01 09:00:00,9,1,3,2012,3,0,9,1484.46866164,9,0,16.82899934,175.79234150999997,1,0
9/5/11 11:00,2,0,1,1,24.6,46,15.0013,125,2011-05-09 11:00:00,11,9,5,2011,0,0,11,1131.6000000000001,11,0,15.0013,270.6,0,0
17/10/12 16:00,4,0,1,1,22.96,52,12.998,466,2012-10-17 16:00:00,16,17,10,2012,2,0,16,1193.92,16,0,12.998,367.36,0,0
8/9/12 21:00,3,0,0,2,24.6,83,11.0014,181,2012-09-08 21:00:00,21,8,9,2012,5,1,42,2041.8000000000002,0,21,22.0028,516.6,0,0
1/2/11 20:00,1,0,1,2,9.02,87,8.9981,74,2011-02-01 20:00:00,20,1,2,2011,1,0,40,784.74,20,0,17.9962,180.39999999999998,0,0
13/9/11 5:00,3,0,1,1,22.96,88,0.0,20,2011-09-13 05:00:00,5,13,9,2011,1,0,5,2020.48,5,0,0.0,114.80000000000001,0,0
3/2/12 8:00,1,0,1,1,10.3508307,66,14.39669526,447,2012-02-03 08:00:00,8,3,2,2012,4,0,8,683.1548262,8,0,14.39669526,82.8066456,1,0
6/12/12 4:00,4,0,1,1,9.02,55,19.9995,9,2012-12-06 04:00:00,4,6,12,2012,3,0,4,496.09999999999997,4,0,19.9995,36.08,0,0
9/12/12 14:00,4,0,0,2,15.58,87,12.998,232,2012-12-09 14:00:00,14,9,12,2012,6,1,28,1355.46,0,14,25.996,218.12,0,0
12/12/12 4:00,4,0,1,1,10.66,60,0.0,4,2012-12-12 04:00:00,4,12,12,2012,2,0,4,639.6,4,0,0.0,42.64,0,0
16/3/11 9:00,1,0,1,2,13.12,93,8.9981,154,2011-03-16 09:00:00,9,16,3,2011,2,0,18,1220.1599999999999,9,0,17.9962,118.08,1,0
12/5/11 7:00,2,0,1,1,18.86,88,8.9981,297,2011-05-12 07:00:00,7,12,5,2011,3,0,7,1659.6799999999998,7,0,8.9981,132.01999999999998,1,0
13/9/12 13:00,3,0,1,1,28.7,42,0.0,283,2012-09-13 13:00:00,13,13,9,2012,3,0,13,1205.3999999999999,13,0,0.0,373.09999999999997,0,0
12/6/12 4:00,2,0,1,3,24.6,88,11.0014,4,2012-06-12 04:00:00,4,12,6,2012,1,0,12,2164.8,4,0,33.0042,98.4,0,0
2/9/11 21:00,3,0,1,2,26.24,73,6.0032,149,2011-09-02 21:00:00,21,2,9,2011,4,0,42,1915.52,21,0,12.0064,551.04,0,0
16/10/11 13:00,4,0,0,1,23.24387146,35,21.00875436,448,2011-10-16 13:00:00,13,16,10,2011,6,1,13,813.5355011,0,13,21.00875436,302.17032898,0,0
19/7/12 13:00,3,0,1,1,34.44,47,8.9981,254,2012-07-19 13:00:00,13,19,7,2012,3,0,13,1618.6799999999998,13,0,8.9981,447.71999999999997,0,0
7/5/11 3:00,2,0,0,1,17.22,77,6.0032,18,2011-05-07 03:00:00,3,7,5,2011,5,1,3,1325.9399999999998,0,3,6.0032,51.66,0,0
14/4/11 1:00,2,0,1,1,15.58,76,15.0013,10,2011-04-14 01:00:00,1,14,4,2011,3,0,1,1184.08,1,0,15.0013,15.58,0,0
3/5/11 22:00,2,0,1,2,23.78,60,26.0027,113,2011-05-03 22:00:00,22,3,5,2011,1,0,44,1426.8000000000002,22,0,52.0054,523.1600000000001,0,0
5/10/12 12:00,4,0,1,1,29.52,42,11.0014,468,2012-10-05 12:00:00,12,5,10,2012,4,0,12,1239.84,12,0,11.0014,354.24,0,0
12/11/12 19:00,4,1,0,1,22.14,73,19.0012,353,2012-11-12 19:00:00,19,12,11,2012,0,0,19,1616.22,0,0,19.0012,420.66,0,1
12/5/11 14:00,2,0,1,2,25.42,61,15.0013,191,2011-05-12 14:00:00,14,12,5,2011,3,0,28,1550.6200000000001,14,0,30.0026,355.88,0,0
11/11/11 5:00,4,1,0,1,12.3,49,16.9979,13,2011-11-11 05:00:00,5,11,11,2011,4,0,5,602.7,0,0,16.9979,61.5,0,0
11/7/11 4:00,3,0,1,1,27.06,74,15.0013,4,2011-07-11 04:00:00,4,11,7,2011,0,0,4,2002.4399999999998,4,0,15.0013,108.24,0,0
18/4/11 13:00,2,0,1,2,22.96,49,11.0014,169,2011-04-18 13:00:00,13,18,4,2011,0,0,26,1125.04,13,0,22.0028,298.48,0,0
17/5/11 1:00,2,0,1,3,22.96,88,0.0,13,2011-05-17 01:00:00,1,17,5,2011,1,0,3,2020.48,1,0,0.0,22.96,0,0
14/3/12 15:00,1,0,1,1,28.7,24,0.0,283,2012-03-14 15:00:00,15,14,3,2012,2,0,15,688.8,15,0,0.0,430.5,0,0
3/3/12 2:00,1,0,0,3,14.76,93,6.0032,38,2012-03-03 02:00:00,2,3,3,2012,5,1,6,1372.68,0,2,18.0096,29.52,0,0
14/3/11 21:00,1,0,1,1,13.94,46,8.9981,63,2011-03-14 21:00:00,21,14,3,2011,0,0,21,641.24,21,0,8.9981,292.74,0,0
2/11/11 9:00,4,0,1,1,13.94,87,0.0,228,2011-11-02 09:00:00,9,2,11,2011,2,0,9,1212.78,9,0,0.0,125.46,1,0
13/3/12 1:00,1,0,1,2,20.60046243,58,15.22470401,1,2012-03-13 01:00:00,1,13,3,2012,1,0,2,1194.82682094,1,0,30.44940802,20.60046243,0,0
7/7/12 11:00,3,0,0,1,38.54,38,12.998,367,2012-07-07 11:00:00,11,7,7,2012,5,1,11,1464.52,0,11,12.998,423.94,0,0
7/8/11 7:00,3,0,0,1,29.68768029,84,13.59501579,44,2011-08-07 07:00:00,7,7,8,2011,6,1,7,2493.76514436,0,7,13.59501579,207.81376203,1,0
16/6/12 9:00,2,0,0,1,24.6,60,6.0032,367,2012-06-16 09:00:00,9,16,6,2012,5,1,9,1476.0,0,9,6.0032,221.4,1,0
14/8/12 1:00,3,0,1,1,27.88,79,16.9979,27,2012-08-14 01:00:00,1,14,8,2012,1,0,1,2202.52,1,0,16.9979,27.88,0,0
15/3/12 16:00,1,0,1,1,29.52,37,26.0027,426,2012-03-15 16:00:00,16,15,3,2012,3,0,16,1092.24,16,0,26.0027,472.32,0,0
4/6/11 14:00,2,0,0,1,30.34,33,15.0013,451,2011-06-04 14:00:00,14,4,6,2011,5,1,14,1001.22,0,14,15.0013,424.76,0,0
2/11/12 7:00,4,0,1,2,12.3,70,8.9981,357,2012-11-02 07:00:00,7,2,11,2012,4,0,14,861.0,7,0,17.9962,86.10000000000001,1,0
5/1/11 9:00,1,0,1,1,9.02,37,22.0028,115,2011-01-05 09:00:00,9,5,1,2011,2,0,9,333.74,9,0,22.0028,81.17999999999999,1,0
10/6/12 21:00,2,0,0,1,29.52,62,11.0014,253,2012-06-10 21:00:00,21,10,6,2012,6,1,21,1830.24,0,21,11.0014,619.92,0,0
10/1/11 21:00,1,0,1,1,5.171543374,57,14.10896401,36,2011-01-10 21:00:00,21,10,1,2011,0,0,21,294.77797231799997,21,0,14.10896401,108.602410854,0,0
15/3/11 6:00,1,0,1,1,9.02,80,12.998,35,2011-03-15 06:00:00,6,15,3,2011,1,0,6,721.5999999999999,6,0,12.998,54.12,0,0
5/2/12 6:00,1,0,0,2,9.885254867,71,15.52605146,20,2012-02-05 06:00:00,6,5,2,2012,6,1,12,701.8530955570001,0,6,31.05210292,59.311529202,0,0
5/12/12 23:00,4,0,1,1,12.3,49,26.0027,74,2012-12-05 23:00:00,23,5,12,2012,2,0,23,602.7,23,0,26.0027,282.90000000000003,0,0
14/8/11 0:00,3,0,0,3,27.06,83,19.9995,90,2011-08-14 00:00:00,0,14,8,2011,6,1,0,2245.98,0,0,59.99850000000001,0.0,0,0
9/6/12 23:00,2,0,0,1,27.88,61,11.0014,230,2012-06-09 23:00:00,23,9,6,2012,5,1,23,1700.6799999999998,0,23,11.0014,641.24,0,0
4/6/12 13:00,2,0,1,1,26.24,41,23.9994,274,2012-06-04 13:00:00,13,4,6,2012,0,0,13,1075.84,13,0,23.9994,341.12,0,0
11/1/11 21:00,1,0,1,3,6.56,86,6.0032,20,2011-01-11 21:00:00,21,11,1,2011,1,0,63,564.16,21,0,18.0096,137.76,0,0
4/5/11 13:00,2,0,1,2,18.94345185,62,30.06107526,114,2011-05-04 13:00:00,13,4,5,2011,2,0,26,1174.4940147,13,0,60.12215052,246.26487404999997,0,0
10/3/12 4:00,1,0,0,1,10.44764242,41,23.77228166,1,2012-03-10 04:00:00,4,10,3,2012,5,1,4,428.35333921999995,0,4,23.77228166,41.79056968,0,0
18/11/11 5:00,4,0,1,1,9.02,44,8.9981,22,2011-11-18 05:00:00,5,18,11,2011,4,0,5,396.88,5,0,8.9981,45.099999999999994,0,0
2/9/11 11:00,3,0,1,2,27.18345622,76,7.079555269,191,2011-09-02 11:00:00,11,2,9,2011,4,0,22,2065.94267272,11,0,14.159110538,299.01801842,0,0
3/2/11 15:00,1,0,1,1,9.02,37,22.0028,60,2011-02-03 15:00:00,15,3,2,2011,3,0,15,333.74,15,0,22.0028,135.29999999999998,0,0
9/3/11 5:00,1,0,1,2,9.84,81,8.9981,8,2011-03-09 05:00:00,5,9,3,2011,2,0,10,797.04,5,0,17.9962,49.2,0,0
7/10/12 17:00,4,0,0,3,16.4,82,15.0013,157,2012-10-07 17:00:00,17,7,10,2012,6,1,51,1344.8,0,17,45.0039,278.79999999999995,0,1
7/11/12 4:00,4,0,1,2,11.48,52,19.9995,9,2012-11-07 04:00:00,4,7,11,2012,2,0,8,596.96,4,0,39.999,45.92,0,0
13/2/12 14:00,1,0,1,1,13.94,23,7.0015,135,2012-02-13 14:00:00,14,13,2,2012,0,0,14,320.62,14,0,7.0015,195.16,0,0
5/9/11 7:00,3,1,0,1,27.06,74,11.0014,41,2011-09-05 07:00:00,7,5,9,2011,0,0,7,2002.4399999999998,0,0,11.0014,189.42,1,0
7/10/12 16:00,4,0,0,3,16.4,82,11.0014,333,2012-10-07 16:00:00,16,7,10,2012,6,1,48,1344.8,0,16,33.0042,262.4,0,0
18/12/11 20:00,4,0,0,1,9.84,60,7.0015,104,2011-12-18 20:00:00,20,18,12,2011,6,1,20,590.4,0,20,7.0015,196.8,0,0
5/12/12 7:00,4,0,1,3,18.86,59,19.9995,398,2012-12-05 07:00:00,7,5,12,2012,2,0,21,1112.74,7,0,59.99850000000001,132.01999999999998,1,0
18/8/11 22:00,3,0,1,2,28.7,74,7.0015,135,2011-08-18 22:00:00,22,18,8,2011,3,0,44,2123.7999999999997,22,0,14.003,631.4,0,0
12/10/11 3:00,4,0,1,3,22.14,94,19.9995,2,2011-10-12 03:00:00,3,12,10,2011,2,0,9,2081.16,3,0,59.99850000000001,66.42,0,0
9/7/11 4:00,3,0,0,1,26.24,83,15.0013,6,2011-07-09 04:00:00,4,9,7,2011,5,1,4,2177.92,0,4,15.0013,104.96,0,0
8/10/12 8:00,4,1,0,2,14.76,71,15.0013,397,2012-10-08 08:00:00,8,8,10,2012,0,0,16,1047.96,0,0,30.0026,118.08,1,0
4/6/11 0:00,2,0,0,1,22.96,52,0.0,93,2011-06-04 00:00:00,0,4,6,2011,5,1,0,1193.92,0,0,0.0,0.0,0,0
13/12/12 0:00,4,0,1,2,11.0113664,51,16.00816721,47,2012-12-13 00:00:00,0,13,12,2012,3,0,0,561.5796864,0,0,32.01633442,0.0,0,0
7/1/12 16:00,1,0,0,2,22.96,37,19.0012,401,2012-01-07 16:00:00,16,7,1,2012,5,1,32,849.52,0,16,38.0024,367.36,0,0
6/8/11 12:00,3,0,0,1,32.8,55,15.0013,382,2011-08-06 12:00:00,12,6,8,2011,5,1,12,1803.9999999999998,0,12,15.0013,393.59999999999997,0,0
19/9/11 1:00,3,0,1,2,21.32242205,70,6.985411897,16,2011-09-19 01:00:00,1,19,9,2011,0,0,2,1492.5695435,1,0,13.970823794,21.32242205,0,0
9/12/11 22:00,4,0,1,1,10.98906555,84,0.145828304,116,2011-12-09 22:00:00,22,9,12,2011,4,0,22,923.0815061999999,22,0,0.145828304,241.7594421,0,0
19/10/12 6:00,4,0,1,3,22.14,94,11.0014,131,2012-10-19 06:00:00,6,19,10,2012,4,0,18,2081.16,6,0,33.0042,132.84,0,0
9/9/12 14:00,3,0,0,1,29.52,30,19.0012,647,2012-09-09 14:00:00,14,9,9,2012,6,1,14,885.6,0,14,19.0012,413.28,0,0
13/5/12 3:00,2,0,0,2,22.14,64,8.9981,28,2012-05-13 03:00:00,3,13,5,2012,6,1,6,1416.96,0,3,17.9962,66.42,0,0
14/3/11 5:00,1,0,1,1,9.84,70,8.9981,8,2011-03-14 05:00:00,5,14,3,2011,0,0,5,688.8,5,0,8.9981,49.2,0,0
17/9/12 20:00,3,0,1,2,25.42,73,8.9981,340,2012-09-17 20:00:00,20,17,9,2012,0,0,40,1855.66,20,0,17.9962,508.40000000000003,0,0
14/12/11 10:00,4,0,1,2,13.12,57,0.0,142,2011-12-14 10:00:00,10,14,12,2011,2,0,20,747.8399999999999,10,0,0.0,131.2,0,0
4/5/11 14:00,2,0,1,1,20.5,51,26.0027,107,2011-05-04 14:00:00,14,4,5,2011,2,0,14,1045.5,14,0,26.0027,287.0,0,0
18/5/11 5:00,2,0,1,1,21.32,100,15.0013,9,2011-05-18 05:00:00,5,18,5,2011,2,0,5,2132.0,5,0,15.0013,106.6,0,0
4/4/11 22:00,2,0,1,2,27.88,36,31.0009,75,2011-04-04 22:00:00,22,4,4,2011,0,0,44,1003.68,22,0,62.0018,613.36,0,0
13/7/11 19:00,3,0,1,1,28.7,79,7.0015,419,2011-07-13 19:00:00,19,13,7,2011,2,0,19,2267.2999999999997,19,0,7.0015,545.3,0,1
6/3/12 12:00,1,0,1,1,11.81112455,43,9.249668396,147,2012-03-06 12:00:00,12,6,3,2012,1,0,12,507.87835565,12,0,9.249668396,141.7334946,0,0
17/4/11 3:00,2,0,0,1,17.37318726,66,7.738979663,30,2011-04-17 03:00:00,3,17,4,2011,6,1,3,1146.6303591600001,0,3,7.738979663,52.119561780000005,0,0
3/5/11 18:00,2,0,1,1,28.7,48,27.9993,544,2011-05-03 18:00:00,18,3,5,2011,1,0,18,1377.6,18,0,27.9993,516.6,0,1
17/9/11 5:00,3,0,0,1,18.86,72,11.0014,5,2011-09-17 05:00:00,5,17,9,2011,5,1,5,1357.92,0,5,11.0014,94.3,0,0
5/6/12 11:00,2,0,1,2,22.96,56,12.998,227,2012-06-05 11:00:00,11,5,6,2012,1,0,22,1285.76,11,0,25.996,252.56,0,0
10/8/11 12:00,3,0,1,1,34.59298084,39,20.0957077,266,2011-08-10 12:00:00,12,10,8,2011,2,0,12,1349.1262527600002,12,0,20.0957077,415.11577008000006,0,0
13/6/11 21:00,2,0,1,1,26.24,41,16.9979,218,2011-06-13 21:00:00,21,13,6,2011,0,0,21,1075.84,21,0,16.9979,551.04,0,0
12/2/11 19:00,1,0,0,1,11.48,38,11.0014,41,2011-02-12 19:00:00,19,12,2,2011,5,1,19,436.24,0,19,11.0014,218.12,0,1
4/4/11 12:00,2,0,1,1,26.24,36,31.0009,157,2011-04-04 12:00:00,12,4,4,2011,0,0,12,944.64,12,0,31.0009,314.88,0,0
14/3/12 5:00,1,0,1,1,18.04,82,8.9981,27,2012-03-14 05:00:00,5,14,3,2012,2,0,5,1479.28,5,0,8.9981,90.19999999999999,0,0
18/6/11 21:00,2,0,0,2,29.52,66,7.0015,183,2011-06-18 21:00:00,21,18,6,2011,5,1,42,1948.32,0,21,14.003,619.92,0,0
13/3/11 17:00,1,0,0,1,18.04,41,23.9994,241,2011-03-13 17:00:00,17,13,3,2011,6,1,17,739.64,0,17,23.9994,306.68,0,1
10/9/11 19:00,3,0,0,1,28.7,58,8.9981,315,2011-09-10 19:00:00,19,10,9,2011,5,1,19,1664.6,0,19,8.9981,545.3,0,1
4/1/11 1:00,1,0,1,1,6.314429042,59,7.820400563,1,2011-01-04 01:00:00,1,4,1,2011,1,0,1,372.551313478,1,0,7.820400563,6.314429042,0,0
5/3/11 11:00,1,0,0,2,15.13302166,79,15.64590335,140,2011-03-05 11:00:00,11,5,3,2011,5,1,22,1195.50871114,0,11,31.2918067,166.46323826,0,0
11/9/12 11:00,3,0,1,1,25.89244104,33,4.845374932,271,2012-09-11 11:00:00,11,11,9,2012,1,0,11,854.45055432,11,0,4.845374932,284.81685144,0,0
11/5/12 20:00,2,0,1,1,25.42,25,8.9981,341,2012-05-11 20:00:00,20,11,5,2012,4,0,20,635.5,20,0,8.9981,508.40000000000003,0,0
16/4/12 8:00,2,1,0,2,22.96,83,11.0014,597,2012-04-16 08:00:00,8,16,4,2012,0,0,16,1905.68,0,0,22.0028,183.68,1,0
3/5/12 6:00,2,0,1,2,18.86,88,11.0014,136,2012-05-03 06:00:00,6,3,5,2012,3,0,12,1659.6799999999998,6,0,22.0028,113.16,0,0
7/9/12 20:00,3,0,1,1,29.52,66,15.0013,391,2012-09-07 20:00:00,20,7,9,2012,4,0,20,1948.32,20,0,15.0013,590.4,0,0
9/9/11 15:00,3,0,1,1,30.34,66,0.0,188,2011-09-09 15:00:00,15,9,9,2011,4,0,15,2002.44,15,0,0.0,455.1,0,0
1/9/11 5:00,3,0,1,1,22.96,73,6.0032,23,2011-09-01 05:00:00,5,1,9,2011,3,0,5,1676.0800000000002,5,0,6.0032,114.80000000000001,0,0
2/4/12 7:00,2,0,1,1,13.94,66,26.0027,306,2012-04-02 07:00:00,7,2,4,2012,0,0,7,920.04,7,0,26.0027,97.58,1,0
11/2/12 5:00,1,0,0,3,9.680694673,91,10.48896276,1,2012-02-11 05:00:00,5,11,2,2012,5,1,15,880.9432152429999,0,5,31.46688828,48.403473364999996,0,0
6/3/12 15:00,1,0,1,1,13.94,36,19.9995,166,2012-03-06 15:00:00,15,6,3,2012,1,0,15,501.84,15,0,19.9995,209.1,0,0
16/11/12 7:00,4,0,1,2,12.3,61,11.0014,367,2012-11-16 07:00:00,7,16,11,2012,4,0,14,750.3000000000001,7,0,22.0028,86.10000000000001,1,0
5/10/12 4:00,4,0,1,1,22.14,77,0.0,11,2012-10-05 04:00:00,4,5,10,2012,4,0,4,1704.78,4,0,0.0,88.56,0,0
10/10/12 21:00,4,0,1,1,20.5,51,23.9994,269,2012-10-10 21:00:00,21,10,10,2012,2,0,21,1045.5,21,0,23.9994,430.5,0,0
7/10/12 8:00,4,0,0,3,17.22,67,8.9981,62,2012-10-07 08:00:00,8,7,10,2012,6,1,24,1153.74,0,8,26.994300000000003,137.76,1,0
15/12/12 22:00,4,0,0,1,14.76,62,12.998,156,2012-12-15 22:00:00,22,15,12,2012,5,1,22,915.12,0,22,12.998,324.71999999999997,0,0
14/2/12 8:00,1,0,1,2,9.84,70,0.0,513,2012-02-14 08:00:00,8,14,2,2012,1,0,16,688.8,8,0,0.0,78.72,1,0
10/10/11 2:00,4,1,0,1,19.68,88,0.0,19,2011-10-10 02:00:00,2,10,10,2011,0,0,2,1731.84,0,0,0.0,39.36,0,0
18/7/11 6:00,3,0,1,1,26.24,83,7.0015,105,2011-07-18 06:00:00,6,18,7,2011,0,0,6,2177.92,6,0,7.0015,157.44,0,0
8/11/11 4:00,4,0,1,1,12.3,87,0.0,4,2011-11-08 04:00:00,4,8,11,2011,1,0,4,1070.1000000000001,4,0,0.0,49.2,0,0
18/1/12 12:00,1,0,1,1,12.3,39,32.9975,161,2012-01-18 12:00:00,12,18,1,2012,2,0,12,479.70000000000005,12,0,32.9975,147.60000000000002,0,0
16/12/11 0:00,4,0,1,1,20.6845252,72,21.76101083,89,2011-12-16 00:00:00,0,16,12,2011,4,0,0,1489.2858144,0,0,21.76101083,0.0,0,0
4/12/11 0:00,4,0,0,1,12.3,70,7.0015,83,2011-12-04 00:00:00,0,4,12,2011,6,1,0,861.0,0,0,7.0015,0.0,0,0
2/6/12 17:00,2,0,0,1,26.24,36,0.0,586,2012-06-02 17:00:00,17,2,6,2012,5,1,17,944.64,0,17,0.0,446.08,0,1
3/1/11 12:00,1,0,1,1,9.02,35,19.9995,61,2011-01-03 12:00:00,12,3,1,2011,0,0,12,315.7,12,0,19.9995,108.24,0,0
4/3/12 12:00,1,0,0,1,13.94,42,23.9994,327,2012-03-04 12:00:00,12,4,3,2012,6,1,12,585.48,0,12,23.9994,167.28,0,0
6/6/11 23:00,2,0,1,1,26.24,69,6.0032,60,2011-06-06 23:00:00,23,6,6,2011,0,0,23,1810.56,23,0,6.0032,603.52,0,0
8/12/11 12:00,4,0,1,1,11.48,52,22.0028,156,2011-12-08 12:00:00,12,8,12,2011,3,0,12,596.96,12,0,22.0028,137.76,0,0
14/1/11 11:00,1,0,1,1,7.38,51,19.0012,53,2011-01-14 11:00:00,11,14,1,2011,4,0,11,376.38,11,0,19.0012,81.17999999999999,0,0
1/2/12 14:00,1,0,1,1,25.42,33,15.0013,192,2012-02-01 14:00:00,14,1,2,2012,2,0,14,838.86,14,0,15.0013,355.88,0,0
19/1/12 13:00,1,0,1,1,9.02,47,19.0012,124,2012-01-19 13:00:00,13,19,1,2012,3,0,13,423.94,13,0,19.0012,117.25999999999999,0,0
14/8/11 8:00,3,0,0,2,27.06,89,19.0012,41,2011-08-14 08:00:00,8,14,8,2011,6,1,16,2408.3399999999997,0,8,38.0024,216.48,1,0
5/6/11 9:00,2,0,0,2,24.6,78,12.998,164,2011-06-05 09:00:00,9,5,6,2011,6,1,18,1918.8000000000002,0,9,25.996,221.4,1,0
11/3/12 10:00,1,0,0,1,13.12,49,19.0012,218,2012-03-11 10:00:00,10,11,3,2012,6,1,10,642.88,0,10,19.0012,131.2,0,0
14/12/12 23:00,4,0,1,1,11.48,75,6.0032,134,2012-12-14 23:00:00,23,14,12,2012,4,0,23,861.0,23,0,6.0032,264.04,0,0
17/6/11 23:00,2,0,1,1,25.42,83,8.9981,178,2011-06-17 23:00:00,23,17,6,2011,4,0,23,2109.86,23,0,8.9981,584.6600000000001,0,0
9/9/12 20:00,3,0,0,1,25.8912288,41,18.79627924,353,2012-09-09 20:00:00,20,9,9,2012,6,1,20,1061.5403808,0,20,18.79627924,517.824576,0,0
17/7/12 21:00,3,0,1,1,33.62,52,8.9981,333,2012-07-17 21:00:00,21,17,7,2012,1,0,21,1748.2399999999998,21,0,8.9981,706.02,0,0
2/3/11 14:00,1,0,1,1,21.32,23,19.9995,96,2011-03-02 14:00:00,14,2,3,2011,2,0,14,490.36,14,0,19.9995,298.48,0,0
13/5/11 16:00,2,0,1,2,21.32,88,8.9981,300,2011-05-13 16:00:00,16,13,5,2011,4,0,32,1876.16,16,0,17.9962,341.12,0,0
9/5/12 4:00,2,0,1,3,22.96,88,15.0013,5,2012-05-09 04:00:00,4,9,5,2012,2,0,12,2020.48,4,0,45.0039,91.84,0,0
1/7/11 17:00,3,0,1,1,33.62,21,12.998,461,2011-07-01 17:00:00,17,1,7,2011,4,0,17,706.02,17,0,12.998,571.54,0,1
12/1/11 2:00,1,0,1,1,5.74,86,8.9981,1,2011-01-12 02:00:00,2,12,1,2011,2,0,2,493.64000000000004,2,0,8.9981,11.48,0,0
3/7/12 1:00,3,0,1,1,29.52,58,0.0,14,2012-07-03 01:00:00,1,3,7,2012,1,0,1,1712.16,1,0,0.0,29.52,0,0
13/4/11 5:00,2,0,1,3,16.00489352,96,16.99192672,9,2011-04-13 05:00:00,5,13,4,2011,2,0,15,1536.46977792,5,0,50.97578016,80.0244676,0,0
10/7/12 0:00,3,0,1,1,27.44923849,69,5.396639566,68,2012-07-10 00:00:00,0,10,7,2012,1,0,0,1893.99745581,0,0,5.396639566,0.0,0,0
14/5/12 6:00,2,0,1,3,21.1931537,93,20.08040486,78,2012-05-14 06:00:00,6,14,5,2012,0,0,18,1970.9632941,6,0,60.241214580000005,127.1589222,0,0
7/2/11 12:00,1,0,1,2,13.12,62,0.0,66,2011-02-07 12:00:00,12,7,2,2011,0,0,24,813.4399999999999,12,0,0.0,157.44,0,0
8/12/11 20:00,4,0,1,1,10.24960497,59,6.995746826,172,2011-12-08 20:00:00,20,8,12,2011,3,0,20,604.72669323,20,0,6.995746826,204.9920994,0,0
15/5/11 16:00,2,0,0,1,26.24,69,16.9979,440,2011-05-15 16:00:00,16,15,5,2011,6,1,16,1810.56,0,16,16.9979,419.84,0,0
7/7/11 11:00,3,0,1,1,33.62,52,8.9981,142,2011-07-07 11:00:00,11,7,7,2011,3,0,11,1748.2399999999998,11,0,8.9981,369.82,0,0
1/9/11 4:00,3,0,1,1,22.96,83,6.0032,7,2011-09-01 04:00:00,4,1,9,2011,3,0,4,1905.68,4,0,6.0032,91.84,0,0
19/12/12 15:00,4,0,1,1,17.22,50,19.0012,237,2012-12-19 15:00:00,15,19,12,2012,2,0,15,861.0,15,0,19.0012,258.29999999999995,0,0
10/12/12 16:00,4,0,1,2,20.5,88,7.0015,345,2012-12-10 16:00:00,16,10,12,2012,0,0,32,1804.0,16,0,14.003,328.0,0,0
12/1/12 18:00,1,0,1,1,18.04,67,12.998,421,2012-01-12 18:00:00,18,12,1,2012,3,0,18,1208.6799999999998,18,0,12.998,324.71999999999997,0,1
8/3/12 21:00,1,0,1,1,24.6,43,26.0027,233,2012-03-08 21:00:00,21,8,3,2012,3,0,21,1057.8,21,0,26.0027,516.6,0,0
3/11/12 19:00,4,0,0,1,14.76,50,11.0014,239,2012-11-03 19:00:00,19,3,11,2012,5,1,19,738.0,0,19,11.0014,280.44,0,1
7/6/12 18:00,2,0,1,1,28.7,34,19.0012,813,2012-06-07 18:00:00,18,7,6,2012,3,0,18,975.8,18,0,19.0012,516.6,0,1
2/11/12 21:00,4,0,1,2,14.86123601,43,24.76895266,172,2012-11-02 21:00:00,21,2,11,2012,4,0,42,639.03314843,21,0,49.53790532,312.08595621,0,0
18/8/12 6:00,3,0,0,1,24.6,83,15.0013,27,2012-08-18 06:00:00,6,18,8,2012,5,1,6,2041.8000000000002,0,6,15.0013,147.60000000000002,0,0
3/7/12 19:00,3,0,1,2,34.44,36,8.9981,497,2012-07-03 19:00:00,19,3,7,2012,1,0,38,1239.84,19,0,17.9962,654.3599999999999,0,1
19/10/12 3:00,4,0,1,2,22.96,83,0.0,5,2012-10-19 03:00:00,3,19,10,2012,4,0,6,1905.68,3,0,0.0,68.88,0,0
13/12/11 19:00,4,0,1,1,13.12,49,11.0014,267,2011-12-13 19:00:00,19,13,12,2011,1,0,19,642.88,19,0,11.0014,249.27999999999997,0,1
3/3/11 16:00,1,0,1,1,10.66,23,0.0,71,2011-03-03 16:00:00,16,3,3,2011,3,0,16,245.18,16,0,0.0,170.56,0,0
7/11/11 6:00,4,0,1,2,11.48,93,0.0,99,2011-11-07 06:00:00,6,7,11,2011,0,0,12,1067.64,6,0,0.0,68.88,0,0
19/10/11 6:00,4,0,1,3,21.32,83,16.9979,31,2011-10-19 06:00:00,6,19,10,2011,2,0,18,1769.56,6,0,50.993700000000004,127.92,0,0
2/8/11 15:00,3,0,1,1,36.9,25,19.0012,168,2011-08-02 15:00:00,15,2,8,2011,1,0,15,922.5,15,0,19.0012,553.5,0,0
8/4/12 23:00,2,0,0,1,20.5,39,16.9979,51,2012-04-08 23:00:00,23,8,4,2012,6,1,23,799.5,0,23,16.9979,471.5,0,0
3/12/12 9:00,4,0,1,1,16.4,87,6.0032,308,2012-12-03 09:00:00,9,3,12,2012,0,0,9,1426.8,9,0,6.0032,147.6,1,0
18/10/11 19:00,4,0,1,1,22.96,60,7.0015,317,2011-10-18 19:00:00,19,18,10,2011,1,0,19,1377.6000000000001,19,0,7.0015,436.24,0,1
4/12/12 23:00,4,0,1,1,19.68,67,16.9979,96,2012-12-04 23:00:00,23,4,12,2012,1,0,23,1318.56,23,0,16.9979,452.64,0,0
2/9/12 3:00,3,0,0,1,27.06,89,6.0032,42,2012-09-02 03:00:00,3,2,9,2012,6,1,3,2408.3399999999997,0,3,6.0032,81.17999999999999,0,0
2/8/12 9:00,3,0,1,1,31.17042188,71,5.773059445,339,2012-08-02 09:00:00,9,2,8,2012,3,0,9,2213.09995348,9,0,5.773059445,280.53379692,1,0
3/7/12 23:00,3,0,1,1,27.06,83,0.0,171,2012-07-03 23:00:00,23,3,7,2012,1,0,23,2245.98,23,0,0.0,622.38,0,0
17/12/11 7:00,4,0,0,2,10.66,56,15.0013,20,2011-12-17 07:00:00,7,17,12,2011,5,1,14,596.96,0,7,30.0026,74.62,1,0
6/10/12 21:00,4,0,0,1,18.84688152,57,7.948808283,205,2012-10-06 21:00:00,21,6,10,2012,5,1,21,1074.27224664,0,21,7.948808283,395.78451192,0,0
2/4/12 8:00,2,0,1,1,14.76,57,22.0028,589,2012-04-02 08:00:00,8,2,4,2012,0,0,8,841.3199999999999,8,0,22.0028,118.08,1,0
18/4/12 10:00,2,0,1,3,19.68,47,15.0013,147,2012-04-18 10:00:00,10,18,4,2012,2,0,30,924.96,10,0,45.0039,196.8,0,0
7/4/11 1:00,2,0,1,1,17.22,47,8.9981,13,2011-04-07 01:00:00,1,7,4,2011,3,0,1,809.3399999999999,1,0,8.9981,17.22,0,0
17/8/11 0:00,3,0,1,1,27.06,69,6.0032,24,2011-08-17 00:00:00,0,17,8,2011,2,0,0,1867.1399999999999,0,0,6.0032,0.0,0,0
1/12/12 7:00,4,0,0,2,9.84,87,8.9981,63,2012-12-01 07:00:00,7,1,12,2012,5,1,14,856.08,0,7,17.9962,68.88,1,0
15/6/11 23:00,2,0,1,1,25.42,53,0.0,107,2011-06-15 23:00:00,23,15,6,2011,2,0,23,1347.26,23,0,0.0,584.6600000000001,0,0
7/2/12 20:00,1,0,1,1,14.76,50,8.9981,212,2012-02-07 20:00:00,20,7,2,2012,1,0,20,738.0,20,0,8.9981,295.2,0,0
13/2/12 1:00,1,0,1,1,4.92,50,15.0013,6,2012-02-13 01:00:00,1,13,2,2012,0,0,1,246.0,1,0,15.0013,4.92,0,0
2/6/11 7:00,2,0,1,1,28.7,34,16.9979,304,2011-06-02 07:00:00,7,2,6,2011,3,0,7,975.8,7,0,16.9979,200.9,1,0
6/8/11 4:00,3,0,0,2,27.06,83,11.0014,10,2011-08-06 04:00:00,4,6,8,2011,5,1,8,2245.98,0,4,22.0028,108.24,0,0
3/7/11 0:00,3,0,0,1,28.7,58,15.0013,144,2011-07-03 00:00:00,0,3,7,2011,6,1,0,1664.6,0,0,15.0013,0.0,0,0
6/4/12 4:00,2,0,1,1,13.94,49,16.9979,5,2012-04-06 04:00:00,4,6,4,2012,4,0,4,683.06,4,0,16.9979,55.76,0,0
10/11/11 20:00,4,0,1,2,14.76,62,19.0012,168,2011-11-10 20:00:00,20,10,11,2011,3,0,40,915.12,20,0,38.0024,295.2,0,0
14/12/11 13:00,4,0,1,2,14.76,57,7.0015,133,2011-12-14 13:00:00,13,14,12,2011,2,0,26,841.3199999999999,13,0,14.003,191.88,0,0
2/3/11 12:00,1,0,1,1,16.4,43,12.998,82,2011-03-02 12:00:00,12,2,3,2011,2,0,12,705.1999999999999,12,0,12.998,196.79999999999998,0,0
6/11/12 12:00,4,0,1,1,13.12,45,8.9981,248,2012-11-06 12:00:00,12,6,11,2012,1,0,12,590.4,12,0,8.9981,157.44,0,0
2/12/12 12:00,4,0,0,2,13.94,81,11.0014,520,2012-12-02 12:00:00,12,2,12,2012,6,1,24,1129.1399999999999,0,12,22.0028,167.28,0,0
9/11/11 20:00,4,0,1,1,17.20195819,77,1.86185441,263,2011-11-09 20:00:00,20,9,11,2011,2,0,20,1324.55078063,20,0,1.86185441,344.0391638,0,0
13/2/12 12:00,1,0,1,1,11.48,28,22.0028,118,2012-02-13 12:00:00,12,13,2,2012,0,0,12,321.44,12,0,22.0028,137.76,0,0
9/12/12 5:00,4,0,0,2,16.4,87,7.0015,8,2012-12-09 05:00:00,5,9,12,2012,6,1,10,1426.8,0,5,14.003,82.0,0,0
5/5/11 20:00,2,0,1,1,20.5,34,11.0014,258,2011-05-05 20:00:00,20,5,5,2011,3,0,20,697.0,20,0,11.0014,410.0,0,0
10/7/11 6:00,3,0,0,1,26.24,78,6.0032,25,2011-07-10 06:00:00,6,10,7,2011,6,1,6,2046.7199999999998,0,6,6.0032,157.44,0,0
8/3/11 12:00,1,0,1,2,14.76,23,0.0,99,2011-03-08 12:00:00,12,8,3,2011,1,0,24,339.48,12,0,0.0,177.12,0,0
14/1/12 22:00,1,0,0,1,8.398637504,47,23.48701927,88,2012-01-14 22:00:00,22,14,1,2012,5,1,22,394.735962688,0,22,23.48701927,184.770025088,0,0
16/2/12 17:00,1,0,1,3,13.94,87,0.0,289,2012-02-16 17:00:00,17,16,2,2012,3,0,51,1212.78,17,0,0.0,236.98,0,1
4/10/12 6:00,4,0,1,3,25.42,94,6.0032,133,2012-10-04 06:00:00,6,4,10,2012,3,0,18,2389.48,6,0,18.0096,152.52,0,0
7/10/12 5:00,4,0,0,2,18.04,54,8.9981,10,2012-10-07 05:00:00,5,7,10,2012,6,1,10,974.16,0,5,17.9962,90.19999999999999,0,0
18/8/12 16:00,3,0,0,1,31.16,37,16.9979,641,2012-08-18 16:00:00,16,18,8,2012,5,1,16,1152.92,0,16,16.9979,498.56,0,0
2/1/11 16:00,1,0,0,3,13.94,71,11.0014,76,2011-01-02 16:00:00,16,2,1,2011,6,1,48,989.74,0,16,33.0042,223.04,0,0
12/11/11 6:00,4,0,0,1,9.02,75,11.0014,7,2011-11-12 06:00:00,6,12,11,2011,5,1,6,676.5,0,6,11.0014,54.12,0,0
7/8/12 14:00,3,0,1,2,33.62,46,0.0,261,2012-08-07 14:00:00,14,7,8,2012,1,0,28,1546.52,14,0,0.0,470.67999999999995,0,0
7/7/12 12:00,3,0,0,1,39.36,31,23.9994,342,2012-07-07 12:00:00,12,7,7,2012,5,1,12,1220.16,0,12,23.9994,472.32,0,0
6/9/12 22:00,3,0,1,1,27.30581738,89,9.821383545,227,2012-09-06 22:00:00,22,6,9,2012,3,0,22,2430.2177468200002,22,0,9.821383545,600.72798236,0,0
17/4/12 22:00,2,0,1,1,22.14,30,16.9979,162,2012-04-17 22:00:00,22,17,4,2012,1,0,22,664.2,22,0,16.9979,487.08000000000004,0,0
17/11/12 1:00,4,0,0,1,10.66,60,12.998,87,2012-11-17 01:00:00,1,17,11,2012,5,1,1,639.6,0,1,12.998,10.66,0,0
1/5/12 2:00,2,0,1,2,20.5,72,6.0032,8,2012-05-01 02:00:00,2,1,5,2012,1,0,4,1476.0,2,0,12.0064,41.0,0,0
11/4/11 19:00,2,0,1,1,29.52,51,30.0026,284,2011-04-11 19:00:00,19,11,4,2011,0,0,19,1505.52,19,0,30.0026,560.88,0,1
17/1/12 12:00,1,0,1,2,13.12,87,19.0012,86,2012-01-17 12:00:00,12,17,1,2012,1,0,24,1141.4399999999998,12,0,38.0024,157.44,0,0
2/8/11 21:00,3,0,1,1,32.8,52,15.0013,254,2011-08-02 21:00:00,21,2,8,2011,1,0,21,1705.6,21,0,15.0013,688.8,0,0
7/7/11 23:00,3,0,1,1,29.52,66,0.0,129,2011-07-07 23:00:00,23,7,7,2011,3,0,23,1948.32,23,0,0.0,678.96,0,0
14/10/12 7:00,4,0,0,1,17.22,82,15.0013,51,2012-10-14 07:00:00,7,14,10,2012,6,1,7,1412.04,0,7,15.0013,120.53999999999999,1,0
15/7/11 11:00,3,0,1,1,28.7,54,8.9981,210,2011-07-15 11:00:00,11,15,7,2011,4,0,11,1549.8,11,0,8.9981,315.7,0,0
18/8/12 0:00,3,0,0,2,26.6358744,82,15.55332228,127,2012-08-18 00:00:00,0,18,8,2012,5,1,0,2184.1417008,0,0,31.10664456,0.0,0,0
16/10/11 13:00,4,0,0,1,24.6,35,19.9995,438,2011-10-16 13:00:00,13,16,10,2011,6,1,13,861.0,0,13,19.9995,319.8,0,0
1/1/11 16:00,1,0,0,2,17.09953364,81,21.16359604,93,2011-01-01 16:00:00,16,1,1,2011,5,1,32,1385.06222484,0,16,42.32719208,273.59253824,0,0
11/8/11 7:00,3,0,1,1,27.06,54,8.9981,307,2011-08-11 07:00:00,7,11,8,2011,3,0,7,1461.24,7,0,8.9981,189.42,1,0
7/9/11 3:00,3,0,1,3,22.96,94,8.9981,2,2011-09-07 03:00:00,3,7,9,2011,2,0,9,2158.2400000000002,3,0,26.994300000000003,68.88,0,0
7/8/12 2:00,3,0,1,1,29.13891044,80,9.119167521,9,2012-08-07 02:00:00,2,7,8,2012,1,0,2,2331.1128352,2,0,9.119167521,58.27782088,0,0
1/2/11 8:00,1,0,1,3,6.041811185,95,0.044507494,157,2011-02-01 08:00:00,8,1,2,2011,1,0,24,573.972062575,8,0,0.133522482,48.33448948,1,0
13/8/11 18:00,3,0,0,1,29.85112452,76,14.32366563,280,2011-08-13 18:00:00,18,13,8,2011,5,1,18,2268.6854635199998,0,18,14.32366563,537.32024136,0,1
12/3/12 5:00,1,0,1,1,13.94,61,12.998,16,2012-03-12 05:00:00,5,12,3,2012,0,0,5,850.3399999999999,5,0,12.998,69.7,0,0
2/3/12 13:00,1,0,1,1,17.22,44,15.0013,222,2012-03-02 13:00:00,13,2,3,2012,4,0,13,757.68,13,0,15.0013,223.85999999999999,0,0
11/6/12 13:00,2,0,1,2,32.8,41,19.9995,248,2012-06-11 13:00:00,13,11,6,2012,0,0,26,1344.8,13,0,39.999,426.4,0,0
6/9/11 22:00,3,0,1,2,22.14,94,22.0028,84,2011-09-06 22:00:00,22,6,9,2011,1,0,44,2081.16,22,0,44.0056,487.08000000000004,0,0
3/1/11 8:00,1,0,1,1,6.410489453,50,20.46934091,137,2011-01-03 08:00:00,8,3,1,2011,0,0,8,320.52447265,8,0,20.46934091,51.283915624,1,0
13/11/11 12:00,4,0,0,2,21.32,29,27.9993,354,2011-11-13 12:00:00,12,13,11,2011,6,1,24,618.28,0,12,55.9986,255.84,0,0
13/5/11 12:00,2,0,1,2,21.32,88,12.998,223,2011-05-13 12:00:00,12,13,5,2011,4,0,24,1876.16,12,0,25.996,255.84,0,0
4/12/11 1:00,4,0,0,1,13.68015644,76,5.665934077,61,2011-12-04 01:00:00,1,4,12,2011,6,1,1,1039.6918894399998,0,1,5.665934077,13.68015644,0,0
1/10/12 15:00,4,0,1,2,25.42,43,8.9981,329,2012-10-01 15:00:00,15,1,10,2012,0,0,30,1093.0600000000002,15,0,17.9962,381.3,0,0
2/8/11 22:00,3,0,1,2,31.98,59,11.0014,191,2011-08-02 22:00:00,22,2,8,2011,1,0,44,1886.82,22,0,22.0028,703.5600000000001,0,0
14/12/12 13:00,4,0,1,1,15.49036569,50,15.38644865,343,2012-12-14 13:00:00,13,14,12,2012,4,0,13,774.5182845,13,0,15.38644865,201.37475397,0,0
11/10/11 2:00,4,0,1,2,21.32,94,8.9981,5,2011-10-11 02:00:00,2,11,10,2011,1,0,4,2004.08,2,0,17.9962,42.64,0,0
1/4/11 20:00,2,0,1,1,13.12,53,12.998,77,2011-04-01 20:00:00,20,1,4,2011,4,0,20,695.36,20,0,12.998,262.4,0,0
17/9/12 18:00,3,0,1,2,25.42,73,11.0014,774,2012-09-17 18:00:00,18,17,9,2012,0,0,36,1855.66,18,0,22.0028,457.56000000000006,0,1
17/9/11 1:00,3,0,0,1,18.86,72,7.0015,80,2011-09-17 01:00:00,1,17,9,2011,5,1,1,1357.92,0,1,7.0015,18.86,0,0
7/11/12 3:00,4,0,1,2,11.48,52,22.0028,11,2012-11-07 03:00:00,3,7,11,2012,2,0,6,596.96,3,0,44.0056,34.44,0,0
11/3/11 6:00,1,0,1,1,10.66,81,19.0012,32,2011-03-11 06:00:00,6,11,3,2011,4,0,6,863.46,6,0,19.0012,63.96,0,0
7/12/11 5:00,4,0,1,3,18.86,100,11.0014,3,2011-12-07 05:00:00,5,7,12,2011,2,0,15,1886.0,5,0,33.0042,94.3,0,0
16/11/11 9:00,4,0,1,3,18.78972577,97,0.0,103,2011-11-16 09:00:00,9,16,11,2011,2,0,27,1822.60339969,9,0,0.0,169.10753193,1,0
12/2/12 15:00,1,0,0,1,6.885277027,40,36.53710218,183,2012-02-12 15:00:00,15,12,2,2012,6,1,15,275.41108108,0,15,36.53710218,103.279155405,0,0
19/10/11 9:00,4,0,1,3,21.12962898,87,32.94360437,215,2011-10-19 09:00:00,9,19,10,2011,2,0,27,1838.27772126,9,0,98.83081311000001,190.16666082,1,0
16/2/12 1:00,1,0,1,2,12.3,70,0.0,5,2012-02-16 01:00:00,1,16,2,2012,3,0,2,861.0,1,0,0.0,12.3,0,0
7/12/11 6:00,4,0,1,3,19.68,100,27.9993,18,2011-12-07 06:00:00,6,7,12,2011,2,0,18,1968.0,6,0,83.9979,118.08,0,0
16/11/11 6:00,4,0,1,2,18.86,94,6.0032,56,2011-11-16 06:00:00,6,16,11,2011,2,0,12,1772.84,6,0,12.0064,113.16,0,0
11/3/11 9:00,1,0,1,2,12.3,61,19.0012,156,2011-03-11 09:00:00,9,11,3,2011,4,0,18,750.3000000000001,9,0,38.0024,110.7,1,0
19/5/11 23:00,2,0,1,1,19.68,94,0.0,72,2011-05-19 23:00:00,23,19,5,2011,3,0,23,1849.92,23,0,0.0,452.64,0,0
9/8/11 14:00,3,0,1,1,35.26,44,19.0012,148,2011-08-09 14:00:00,14,9,8,2011,1,0,14,1551.4399999999998,14,0,19.0012,493.64,0,0
7/7/11 0:00,3,0,1,1,26.76388993,93,8.527101749,23,2011-07-07 00:00:00,0,7,7,2011,3,0,0,2489.04176349,0,0,8.527101749,0.0,0,0
16/5/12 11:00,2,0,1,1,28.7,54,8.9981,267,2012-05-16 11:00:00,11,16,5,2012,2,0,11,1549.8,11,0,8.9981,315.7,0,0
12/11/12 10:00,4,1,0,1,19.68,77,11.0014,266,2012-11-12 10:00:00,10,12,11,2012,0,0,10,1515.36,0,0,11.0014,196.8,0,0
4/1/12 19:00,1,0,1,2,8.2,40,7.0015,184,2012-01-04 19:00:00,19,4,1,2012,2,0,38,328.0,19,0,14.003,155.79999999999998,0,1
5/11/12 19:00,4,0,1,1,13.12,49,11.0014,372,2012-11-05 19:00:00,19,5,11,2012,0,0,19,642.88,19,0,11.0014,249.27999999999997,0,1
2/2/11 7:00,1,0,1,3,9.02,93,15.0013,49,2011-02-02 07:00:00,7,2,2,2011,2,0,21,838.86,7,0,45.0039,63.14,1,0
13/3/12 14:00,1,0,1,1,26.24,53,22.0028,212,2012-03-13 14:00:00,14,13,3,2012,1,0,14,1390.72,14,0,22.0028,367.35999999999996,0,0
2/12/11 3:00,4,0,1,1,9.02,80,0.0,1,2011-12-02 03:00:00,3,2,12,2011,4,0,3,721.5999999999999,3,0,0.0,27.06,0,0
7/6/11 17:00,2,0,1,1,32.8,43,16.9979,539,2011-06-07 17:00:00,17,7,6,2011,1,0,17,1410.3999999999999,17,0,16.9979,557.5999999999999,0,1
3/12/11 23:00,4,0,0,1,12.3,70,8.9981,85,2011-12-03 23:00:00,23,3,12,2011,5,1,23,861.0,0,23,8.9981,282.90000000000003,0,0
3/5/12 4:00,2,0,1,2,18.86,88,16.9979,2,2012-05-03 04:00:00,4,3,5,2012,3,0,8,1659.6799999999998,4,0,33.9958,75.44,0,0
2/10/12 5:00,4,0,1,2,22.96,83,8.9981,43,2012-10-02 05:00:00,5,2,10,2012,1,0,10,1905.68,5,0,17.9962,114.80000000000001,0,0
17/3/11 3:00,1,0,1,1,13.94,66,11.0014,2,2011-03-17 03:00:00,3,17,3,2011,3,0,3,920.04,3,0,11.0014,41.82,0,0
1/8/11 4:00,3,0,1,1,27.06,83,8.9981,4,2011-08-01 04:00:00,4,1,8,2011,0,0,4,2245.98,4,0,8.9981,108.24,0,0
5/6/12 19:00,2,0,1,1,24.90598287,46,17.75336428,502,2012-06-05 19:00:00,19,5,6,2012,1,0,19,1145.67521202,19,0,17.75336428,473.21367453,0,1
8/1/11 15:00,1,0,0,1,8.2,32,30.0026,74,2011-01-08 15:00:00,15,8,1,2011,5,1,15,262.4,0,15,30.0026,122.99999999999999,0,0
5/3/12 15:00,1,0,1,2,12.3,53,12.998,130,2012-03-05 15:00:00,15,5,3,2012,0,0,30,651.9000000000001,15,0,25.996,184.5,0,0
13/11/11 7:00,4,0,0,1,13.94,66,15.0013,43,2011-11-13 07:00:00,7,13,11,2011,6,1,7,920.04,0,7,15.0013,97.58,1,0
3/10/12 14:00,4,0,1,2,29.52,70,11.0014,251,2012-10-03 14:00:00,14,3,10,2012,2,0,28,2066.4,14,0,22.0028,413.28,0,0
12/11/12 20:00,4,1,0,2,21.32,77,19.0012,304,2012-11-12 20:00:00,20,12,11,2012,0,0,40,1641.64,0,0,38.0024,426.4,0,0
19/1/12 18:00,1,0,1,2,10.66,44,22.0028,361,2012-01-19 18:00:00,18,19,1,2012,3,0,36,469.04,18,0,44.0056,191.88,0,1
19/8/11 8:00,3,0,1,2,27.06,83,0.0,398,2011-08-19 08:00:00,8,19,8,2011,4,0,16,2245.98,8,0,0.0,216.48,1,0
14/2/12 23:00,1,0,1,2,14.76,50,6.0032,57,2012-02-14 23:00:00,23,14,2,2012,1,0,46,738.0,23,0,12.0064,339.48,0,0
8/6/11 5:00,2,0,1,1,25.42,88,0.0,21,2011-06-08 05:00:00,5,8,6,2011,2,0,5,2236.96,5,0,0.0,127.10000000000001,0,0
16/2/12 0:00,1,0,1,2,12.3,70,8.9981,23,2012-02-16 00:00:00,0,16,2,2012,3,0,0,861.0,0,0,17.9962,0.0,0,0
6/7/12 12:00,3,0,1,1,36.08,28,7.0015,331,2012-07-06 12:00:00,12,6,7,2012,4,0,12,1010.24,12,0,7.0015,432.96,0,0
2/5/11 18:00,2,0,1,2,26.24,65,12.998,518,2011-05-02 18:00:00,18,2,5,2011,0,0,36,1705.6,18,0,25.996,472.32,0,1
14/5/12 2:00,2,0,1,1,24.6,60,19.9995,2,2012-05-14 02:00:00,2,14,5,2012,0,0,2,1476.0,2,0,19.9995,49.2,0,0
19/9/12 8:00,3,0,1,1,21.32,59,15.0013,797,2012-09-19 08:00:00,8,19,9,2012,2,0,8,1257.88,8,0,15.0013,170.56,1,0
6/2/12 22:00,1,0,1,1,13.07593227,70,8.115613327,100,2012-02-06 22:00:00,22,6,2,2012,0,0,22,915.3152588999999,22,0,8.115613327,287.67050994,0,0
10/9/11 16:00,3,0,0,1,30.34,55,12.998,431,2011-09-10 16:00:00,16,10,9,2011,5,1,16,1668.7,0,16,12.998,485.44,0,0
5/7/12 20:00,3,0,1,2,35.26,41,15.0013,321,2012-07-05 20:00:00,20,5,7,2012,3,0,40,1445.6599999999999,20,0,30.0026,705.1999999999999,0,0
2/11/12 18:00,4,0,1,2,15.58,43,22.0028,522,2012-11-02 18:00:00,18,2,11,2012,4,0,36,669.94,18,0,44.0056,280.44,0,1
1/7/11 3:00,3,0,1,1,26.24,53,0.0,11,2011-07-01 03:00:00,3,1,7,2011,4,0,3,1390.72,3,0,0.0,78.72,0,0
14/12/11 19:00,4,0,1,2,14.76,62,7.0015,268,2011-12-14 19:00:00,19,14,12,2011,2,0,38,915.12,19,0,14.003,280.44,0,1
8/7/12 13:00,3,0,0,1,38.54,38,16.9979,337,2012-07-08 13:00:00,13,8,7,2012,6,1,13,1464.52,0,13,16.9979,501.02,0,0
3/3/11 23:00,1,0,1,2,7.38,43,6.0032,23,2011-03-03 23:00:00,23,3,3,2011,3,0,46,317.34,23,0,12.0064,169.74,0,0
10/2/11 0:00,1,0,1,3,5.74,86,12.998,16,2011-02-10 00:00:00,0,10,2,2011,3,0,0,493.64000000000004,0,0,38.994,0.0,0,0
13/1/11 23:00,1,0,1,1,4.92,50,12.998,15,2011-01-13 23:00:00,23,13,1,2011,3,0,23,246.0,23,0,12.998,113.16,0,0
5/1/11 16:00,1,0,1,1,12.00687096,30,4.872729223,85,2011-01-05 16:00:00,16,5,1,2011,2,0,16,360.2061288,16,0,4.872729223,192.10993536,0,0
18/12/11 15:00,4,0,0,1,13.12,45,19.0012,207,2011-12-18 15:00:00,15,18,12,2011,6,1,15,590.4,0,15,19.0012,196.79999999999998,0,0
12/5/11 16:00,2,0,1,2,26.24,57,16.9979,288,2011-05-12 16:00:00,16,12,5,2011,3,0,32,1495.6799999999998,16,0,33.9958,419.84,0,0
17/4/12 19:00,2,0,1,1,24.6,26,16.9979,537,2012-04-17 19:00:00,19,17,4,2012,1,0,19,639.6,19,0,16.9979,467.40000000000003,0,1
13/2/11 21:00,1,0,0,1,16.4,35,23.9994,51,2011-02-13 21:00:00,21,13,2,2011,6,1,21,574.0,0,21,23.9994,344.4,0,0
6/11/12 2:00,4,0,1,1,9.84,65,6.0032,2,2012-11-06 02:00:00,2,6,11,2012,1,0,2,639.6,2,0,6.0032,19.68,0,0
17/3/12 11:00,1,0,0,2,21.32,77,8.9981,585,2012-03-17 11:00:00,11,17,3,2012,5,1,22,1641.64,0,11,17.9962,234.52,0,0
11/11/12 1:00,4,0,0,1,13.94,76,6.0032,108,2012-11-11 01:00:00,1,11,11,2012,6,1,1,1059.44,0,1,6.0032,13.94,0,0
17/12/11 4:00,4,0,0,1,9.84,65,11.0014,9,2011-12-17 04:00:00,4,17,12,2011,5,1,4,639.6,0,4,11.0014,39.36,0,0
3/8/12 10:00,3,0,1,2,32.61678026,49,12.07176677,235,2012-08-03 10:00:00,10,3,8,2012,4,0,20,1598.22223274,10,0,24.14353354,326.16780259999996,0,0
16/7/11 4:00,3,0,0,1,24.90158029,73,5.594286368,40,2011-07-16 04:00:00,4,16,7,2011,5,1,4,1817.81536117,0,4,5.594286368,99.60632116,0,0
18/11/11 16:00,4,0,1,1,13.94,29,8.9981,209,2011-11-18 16:00:00,16,18,11,2011,4,0,16,404.26,16,0,8.9981,223.04,0,0
2/7/12 1:00,3,0,1,2,31.16,58,12.998,17,2012-07-02 01:00:00,1,2,7,2012,0,0,2,1807.28,1,0,25.996,31.16,0,0
1/11/12 15:00,4,0,1,2,16.4,54,11.0014,214,2012-11-01 15:00:00,15,1,11,2012,3,0,30,885.5999999999999,15,0,22.0028,245.99999999999997,0,0
1/5/12 8:00,2,0,1,2,20.83988789,94,19.51712501,543,2012-05-01 08:00:00,8,1,5,2012,1,0,16,1958.94946166,8,0,39.03425002,166.71910312,1,0
6/10/11 4:00,4,0,1,1,18.04,62,19.0012,5,2011-10-06 04:00:00,4,6,10,2011,3,0,4,1118.48,4,0,19.0012,72.16,0,0
6/11/12 14:00,4,0,1,1,14.76,40,7.0015,240,2012-11-06 14:00:00,14,6,11,2012,1,0,14,590.4,14,0,7.0015,206.64,0,0
12/5/11 23:00,2,0,1,2,22.30429705,80,13.00324183,100,2011-05-12 23:00:00,23,12,5,2011,3,0,46,1784.343764,23,0,26.00648366,512.99883215,0,0
10/4/11 12:00,2,0,0,2,16.7283806,89,7.653488486,206,2011-04-10 12:00:00,12,10,4,2011,6,1,24,1488.8258734,0,12,15.306976972,200.74056720000002,0,0
4/6/11 16:00,2,0,0,2,29.52,30,8.9981,440,2011-06-04 16:00:00,16,4,6,2011,5,1,32,885.6,0,16,17.9962,472.32,0,0
13/12/11 23:00,4,0,1,1,10.66,70,0.0,59,2011-12-13 23:00:00,23,13,12,2011,1,0,23,746.2,23,0,0.0,245.18,0,0
6/6/12 0:00,2,0,1,1,21.32,59,6.0032,49,2012-06-06 00:00:00,0,6,6,2012,2,0,0,1257.88,0,0,6.0032,0.0,0,0
8/2/11 6:00,1,0,1,1,10.66,70,22.0028,39,2011-02-08 06:00:00,6,8,2,2011,1,0,6,746.2,6,0,22.0028,63.96,0,0
5/12/11 22:00,4,0,1,2,16.57674818,86,8.148072492,84,2011-12-05 22:00:00,22,5,12,2011,0,0,44,1425.60034348,22,0,16.296144984,364.68845996,0,0
17/3/12 3:00,1,0,0,2,18.04,88,0.0,26,2012-03-17 03:00:00,3,17,3,2012,5,1,6,1587.52,0,3,0.0,54.12,0,0
3/3/11 7:00,1,0,1,1,4.92,42,27.9993,111,2011-03-03 07:00:00,7,3,3,2011,3,0,7,206.64,7,0,27.9993,34.44,1,0
15/2/12 10:00,1,0,1,1,13.61235715,58,19.46016139,116,2012-02-15 10:00:00,10,15,2,2012,2,0,10,789.5167147,10,0,19.46016139,136.1235715,0,0
14/5/11 6:00,2,0,0,2,22.69150093,90,6.731233255,42,2011-05-14 06:00:00,6,14,5,2011,5,1,12,2042.2350837,0,6,13.46246651,136.14900558,0,0
1/12/12 21:00,4,0,0,2,12.3,87,0.0,158,2012-12-01 21:00:00,21,1,12,2012,5,1,42,1070.1000000000001,0,21,0.0,258.3,0,0
4/9/12 17:00,3,0,1,1,31.16,70,23.9994,856,2012-09-04 17:00:00,17,4,9,2012,1,0,17,2181.2,17,0,23.9994,529.72,0,1
1/8/12 21:00,3,0,1,1,29.48682448,68,9.798166779,319,2012-08-01 21:00:00,21,1,8,2012,2,0,21,2005.10406464,21,0,9.798166779,619.22331408,0,0
7/6/12 14:00,2,0,1,1,29.52,37,16.9979,265,2012-06-07 14:00:00,14,7,6,2012,3,0,14,1092.24,14,0,16.9979,413.28,0,0
7/4/12 3:00,2,0,0,1,14.76,32,16.9979,28,2012-04-07 03:00:00,3,7,4,2012,5,1,3,472.32,0,3,16.9979,44.28,0,0
7/12/12 10:00,4,0,1,2,13.12,76,11.0014,166,2012-12-07 10:00:00,10,7,12,2012,4,0,20,997.1199999999999,10,0,22.0028,131.2,0,0
14/2/11 15:00,1,0,1,1,22.96,21,43.9989,90,2011-02-14 15:00:00,15,14,2,2011,0,0,15,482.16,15,0,43.9989,344.40000000000003,0,0
6/7/12 7:00,3,0,1,1,31.98,46,8.9981,353,2012-07-06 07:00:00,7,6,7,2012,4,0,7,1471.08,7,0,8.9981,223.86,1,0
11/1/12 16:00,1,0,1,2,13.94,87,16.9979,118,2012-01-11 16:00:00,16,11,1,2012,2,0,32,1212.78,16,0,33.9958,223.04,0,0
4/2/11 7:00,1,0,1,1,5.74,59,0.0,87,2011-02-04 07:00:00,7,4,2,2011,4,0,7,338.66,7,0,0.0,40.18,1,0
11/2/11 19:00,1,0,1,1,10.66,33,0.0,101,2011-02-11 19:00:00,19,11,2,2011,4,0,19,351.78000000000003,19,0,0.0,202.54,0,1
3/7/11 1:00,3,0,0,2,28.7,61,11.0014,78,2011-07-03 01:00:00,1,3,7,2011,6,1,2,1750.7,0,1,22.0028,28.7,0,0
15/7/12 16:00,3,0,0,1,35.26,41,15.0013,495,2012-07-15 16:00:00,16,15,7,2012,6,1,16,1445.6599999999999,0,16,15.0013,564.16,0,0
3/4/11 16:00,2,0,0,2,18.86,31,12.998,303,2011-04-03 16:00:00,16,3,4,2011,6,1,32,584.66,0,16,25.996,301.76,0,0
7/8/11 8:00,3,0,0,1,29.52,79,12.998,89,2011-08-07 08:00:00,8,7,8,2011,6,1,8,2332.08,0,8,12.998,236.16,1,0
16/8/12 8:00,3,0,1,1,27.88,61,12.998,682,2012-08-16 08:00:00,8,16,8,2012,3,0,8,1700.6799999999998,8,0,12.998,223.04,1,0
3/9/11 5:00,3,0,0,1,25.42,69,12.998,12,2011-09-03 05:00:00,5,3,9,2011,5,1,5,1753.98,0,5,12.998,127.10000000000001,0,0
18/6/12 8:00,2,0,1,2,22.14,83,12.998,474,2012-06-18 08:00:00,8,18,6,2012,0,0,16,1837.6200000000001,8,0,25.996,177.12,1,0
17/10/11 2:00,4,0,1,1,22.96,54,26.0027,7,2011-10-17 02:00:00,2,17,10,2011,0,0,2,1239.8400000000001,2,0,26.0027,45.92,0,0
4/12/11 20:00,4,0,0,1,14.76,76,8.9981,124,2011-12-04 20:00:00,20,4,12,2011,6,1,20,1121.76,0,20,8.9981,295.2,0,0
16/12/12 2:00,4,0,0,2,13.94,87,6.0032,87,2012-12-16 02:00:00,2,16,12,2012,6,1,4,1212.78,0,2,12.0064,27.88,0,0
15/8/11 5:00,3,0,1,2,24.6,88,12.998,17,2011-08-15 05:00:00,5,15,8,2011,0,0,10,2164.8,5,0,25.996,123.0,0,0
19/8/11 23:00,3,0,1,2,24.6,88,6.0032,106,2011-08-19 23:00:00,23,19,8,2011,4,0,46,2164.8,23,0,12.0064,565.8000000000001,0,0
6/1/11 15:00,1,0,1,1,11.48,36,0.0,62,2011-01-06 15:00:00,15,6,1,2011,3,0,15,413.28000000000003,15,0,0.0,172.20000000000002,0,0
16/6/11 7:00,2,0,1,3,22.96,78,11.0014,188,2011-06-16 07:00:00,7,16,6,2011,3,0,21,1790.88,7,0,33.0042,160.72,1,0
17/8/12 23:00,3,0,1,3,26.24,83,15.0013,121,2012-08-17 23:00:00,23,17,8,2012,4,0,69,2177.92,23,0,45.0039,603.52,0,0
4/5/11 20:00,2,0,1,1,16.4,62,22.0028,191,2011-05-04 20:00:00,20,4,5,2011,2,0,20,1016.8,20,0,22.0028,328.0,0,0
17/12/11 8:00,4,0,0,2,10.66,56,15.0013,59,2011-12-17 08:00:00,8,17,12,2011,5,1,16,596.96,0,8,30.0026,85.28,1,0
11/12/12 7:00,4,0,1,1,13.94,66,27.9993,380,2012-12-11 07:00:00,7,11,12,2012,1,0,7,920.04,7,0,27.9993,97.58,1,0
16/2/11 23:00,1,0,1,1,15.58,40,15.0013,33,2011-02-16 23:00:00,23,16,2,2011,2,0,23,623.2,23,0,15.0013,358.34,0,0
3/10/12 3:00,4,0,1,2,24.72250938,93,0.0,1,2012-10-03 03:00:00,3,3,10,2012,2,0,6,2299.19337234,3,0,0.0,74.16752814,0,0
17/5/11 12:00,2,0,1,3,22.96,83,27.9993,153,2011-05-17 12:00:00,12,17,5,2011,1,0,36,1905.68,12,0,83.9979,275.52,0,0
12/11/12 7:00,4,1,0,1,16.4,87,0.0,264,2012-11-12 07:00:00,7,12,11,2012,0,0,7,1426.8,0,0,0.0,114.79999999999998,1,0
15/8/11 6:00,3,0,1,1,24.6,88,16.9979,90,2011-08-15 06:00:00,6,15,8,2011,0,0,6,2164.8,6,0,16.9979,147.60000000000002,0,0
2/3/11 11:00,1,0,1,1,13.94,53,22.0028,73,2011-03-02 11:00:00,11,2,3,2011,2,0,11,738.8199999999999,11,0,22.0028,153.34,0,0
11/2/12 15:00,1,0,0,2,12.3,61,19.9995,124,2012-02-11 15:00:00,15,11,2,2012,5,1,30,750.3000000000001,0,15,39.999,184.5,0,0
7/8/11 9:00,3,0,0,1,31.16,75,7.0015,184,2011-08-07 09:00:00,9,7,8,2011,6,1,9,2337.0,0,9,7.0015,280.44,1,0
7/11/11 18:00,4,0,1,1,18.86,59,7.0015,425,2011-11-07 18:00:00,18,7,11,2011,0,0,18,1112.74,18,0,7.0015,339.48,0,1
6/12/12 1:00,4,0,1,1,10.7453065,44,20.01061699,40,2012-12-06 01:00:00,1,6,12,2012,3,0,1,472.793486,1,0,20.01061699,10.7453065,0,0
8/1/12 13:00,1,0,0,1,16.4,37,19.9995,343,2012-01-08 13:00:00,13,8,1,2012,6,1,13,606.8,0,13,19.9995,213.2,0,0
7/7/12 18:00,3,0,0,1,38.54,29,6.0032,277,2012-07-07 18:00:00,18,7,7,2012,5,1,18,1117.66,0,18,6.0032,693.72,0,1
10/6/12 3:00,2,0,0,1,26.88601713,73,7.88506405,15,2012-06-10 03:00:00,3,10,6,2012,6,1,3,1962.67925049,0,3,7.88506405,80.65805139,0,0
19/6/11 8:00,2,0,0,3,27.88,74,7.0015,84,2011-06-19 08:00:00,8,19,6,2011,6,1,24,2063.12,0,8,21.0045,223.04,1,0
1/9/12 17:00,3,0,0,2,33.62,52,0.0,463,2012-09-01 17:00:00,17,1,9,2012,5,1,34,1748.2399999999998,0,17,0.0,571.54,0,1
9/10/11 4:00,4,0,0,1,18.04,88,0.0,14,2011-10-09 04:00:00,4,9,10,2011,6,1,4,1587.52,0,4,0.0,72.16,0,0
12/5/12 12:00,2,0,0,1,26.24,36,11.0014,559,2012-05-12 12:00:00,12,12,5,2012,5,1,12,944.64,0,12,11.0014,314.88,0,0
12/2/11 5:00,1,0,0,1,4.92,74,6.0032,1,2011-02-12 05:00:00,5,12,2,2011,5,1,5,364.08,0,5,6.0032,24.6,0,0
9/1/12 0:00,1,0,1,1,9.84,60,15.0013,15,2012-01-09 00:00:00,0,9,1,2012,0,0,0,590.4,0,0,15.0013,0.0,0,0
17/4/11 7:00,2,0,0,1,14.76,50,23.9994,16,2011-04-17 07:00:00,7,17,4,2011,6,1,7,738.0,0,7,23.9994,103.32,1,0
1/8/12 7:00,3,0,1,2,26.24,83,8.9981,487,2012-08-01 07:00:00,7,1,8,2012,2,0,14,2177.92,7,0,17.9962,183.67999999999998,1,0
3/11/12 11:00,4,0,0,2,14.76,46,26.0027,340,2012-11-03 11:00:00,11,3,11,2012,5,1,22,678.96,0,11,52.0054,162.35999999999999,0,0
1/4/12 23:00,2,0,0,3,17.69278885,73,0.0,43,2012-04-01 23:00:00,23,1,4,2012,6,1,69,1291.57358605,0,23,0.0,406.93414355,0,0
4/8/11 4:00,3,0,1,2,27.88,89,0.0,7,2011-08-04 04:00:00,4,4,8,2011,3,0,8,2481.3199999999997,4,0,0.0,111.52,0,0
1/9/12 22:00,3,0,0,2,27.06,89,0.0,78,2012-09-01 22:00:00,22,1,9,2012,5,1,44,2408.3399999999997,0,22,0.0,595.3199999999999,0,0
11/12/12 2:00,4,0,1,2,16.4,66,22.0028,1,2012-12-11 02:00:00,2,11,12,2012,1,0,4,1082.3999999999999,2,0,44.0056,32.8,0,0
3/12/11 17:00,4,0,0,1,14.76,62,0.0,232,2011-12-03 17:00:00,17,3,12,2011,5,1,17,915.12,0,17,0.0,250.92,0,1
1/5/12 18:00,2,0,1,1,28.7,54,8.9981,743,2012-05-01 18:00:00,18,1,5,2012,1,0,18,1549.8,18,0,8.9981,516.6,0,1
13/12/12 8:00,4,0,1,1,9.84,60,12.998,679,2012-12-13 08:00:00,8,13,12,2012,3,0,8,590.4,8,0,12.998,78.72,1,0
13/10/12 4:00,4,0,0,1,12.3,65,11.0014,11,2012-10-13 04:00:00,4,13,10,2012,5,1,4,799.5,0,4,11.0014,49.2,0,0
17/3/11 9:00,1,0,1,1,16.19620169,60,17.94654295,212,2011-03-17 09:00:00,9,17,3,2011,3,0,9,971.7721013999999,9,0,17.94654295,145.76581521,1,0
7/2/12 4:00,1,0,1,2,12.3,70,0.0,3,2012-02-07 04:00:00,4,7,2,2012,1,0,8,861.0,4,0,0.0,49.2,0,0
8/3/12 8:00,1,0,1,1,18.04,77,26.0027,585,2012-03-08 08:00:00,8,8,3,2012,3,0,8,1389.08,8,0,26.0027,144.32,1,0
1/5/12 0:00,2,0,1,2,20.5,59,12.998,35,2012-05-01 00:00:00,0,1,5,2012,1,0,0,1209.5,0,0,25.996,0.0,0,0
10/1/12 20:00,1,0,1,1,13.94,53,7.0015,200,2012-01-10 20:00:00,20,10,1,2012,1,0,20,738.8199999999999,20,0,7.0015,278.8,0,0
2/9/12 9:00,3,0,0,2,28.7,84,0.0,232,2012-09-02 09:00:00,9,2,9,2012,6,1,18,2410.7999999999997,0,9,0.0,258.3,1,0
9/1/12 9:00,1,0,1,2,9.02,64,0.0,197,2012-01-09 09:00:00,9,9,1,2012,0,0,18,577.28,9,0,0.0,81.17999999999999,1,0
9/8/11 1:00,3,0,1,1,29.52,66,0.0,14,2011-08-09 01:00:00,1,9,8,2011,1,0,1,1948.32,1,0,0.0,29.52,0,0
12/3/12 3:00,1,0,1,1,14.76,50,8.9981,2,2012-03-12 03:00:00,3,12,3,2012,0,0,3,738.0,3,0,8.9981,44.28,0,0
15/8/11 10:00,3,0,1,1,27.88,69,19.0012,141,2011-08-15 10:00:00,10,15,8,2011,0,0,10,1923.72,10,0,19.0012,278.8,0,0
13/12/12 4:00,4,0,1,2,10.66,56,12.998,8,2012-12-13 04:00:00,4,13,12,2012,3,0,8,596.96,4,0,25.996,42.64,0,0
6/8/11 18:00,3,0,0,2,29.52,79,30.0026,211,2011-08-06 18:00:00,18,6,8,2011,5,1,36,2332.08,0,18,60.0052,531.36,0,1
6/11/12 0:00,4,0,1,1,9.84,60,7.0015,19,2012-11-06 00:00:00,0,6,11,2012,1,0,0,590.4,0,0,7.0015,0.0,0,0
18/11/11 23:00,4,0,1,1,10.54639047,60,9.990094567,54,2011-11-18 23:00:00,23,18,11,2011,4,0,23,632.7834282,23,0,9.990094567,242.56698081000002,0,0
15/8/12 10:00,3,0,1,2,29.52,62,12.998,233,2012-08-15 10:00:00,10,15,8,2012,2,0,20,1830.24,10,0,25.996,295.2,0,0
10/4/12 15:00,2,0,1,1,22.96,21,19.9995,203,2012-04-10 15:00:00,15,10,4,2012,1,0,15,482.16,15,0,19.9995,344.40000000000003,0,0
2/7/12 14:00,3,0,1,1,35.26,34,15.0013,230,2012-07-02 14:00:00,14,2,7,2012,0,0,14,1198.84,14,0,15.0013,493.64,0,0
1/6/11 4:00,2,0,1,2,27.88,89,15.0013,4,2011-06-01 04:00:00,4,1,6,2011,2,0,8,2481.3199999999997,4,0,30.0026,111.52,0,0
15/9/12 9:00,3,0,0,1,24.6,43,27.9993,342,2012-09-15 09:00:00,9,15,9,2012,5,1,9,1057.8,0,9,27.9993,221.4,1,0
17/8/12 9:00,3,0,1,1,28.7,58,7.0015,378,2012-08-17 09:00:00,9,17,8,2012,4,0,9,1664.6,9,0,7.0015,258.3,1,0
3/8/12 4:00,3,0,1,1,27.06,83,16.9979,12,2012-08-03 04:00:00,4,3,8,2012,4,0,4,2245.98,4,0,16.9979,108.24,0,0
10/10/12 20:00,4,0,1,1,20.92488436,42,31.86856093,374,2012-10-10 20:00:00,20,10,10,2012,2,0,20,878.84514312,20,0,31.86856093,418.4976872,0,0
3/11/11 18:00,4,0,1,1,18.86,63,8.9981,433,2011-11-03 18:00:00,18,3,11,2011,3,0,18,1188.18,18,0,8.9981,339.48,0,1
3/6/12 2:00,2,0,0,1,21.32,59,7.0015,89,2012-06-03 02:00:00,2,3,6,2012,6,1,2,1257.88,0,2,7.0015,42.64,0,0
7/11/12 0:00,4,0,1,2,12.3,56,19.0012,283,2012-11-07 00:00:00,0,7,11,2012,2,0,0,688.8000000000001,0,0,38.0024,0.0,0,0
8/12/11 23:00,4,0,1,1,9.84,70,7.0015,61,2011-12-08 23:00:00,23,8,12,2011,3,0,23,688.8,23,0,7.0015,226.32,0,0
18/4/12 19:00,2,0,1,2,17.22,77,8.9981,368,2012-04-18 19:00:00,19,18,4,2012,2,0,38,1325.9399999999998,19,0,17.9962,327.17999999999995,0,1
16/4/11 11:00,2,0,0,3,17.22,94,30.0026,31,2011-04-16 11:00:00,11,16,4,2011,5,1,33,1618.6799999999998,0,11,90.0078,189.42,0,0
11/7/12 19:00,3,0,1,1,30.34,48,15.0013,633,2012-07-11 19:00:00,19,11,7,2012,2,0,19,1456.32,19,0,15.0013,576.46,0,1
3/8/11 7:00,3,0,1,2,30.34,51,15.0013,271,2011-08-03 07:00:00,7,3,8,2011,2,0,14,1547.34,7,0,30.0026,212.38,1,0
19/3/12 2:00,1,0,1,1,18.86,88,11.0014,8,2012-03-19 02:00:00,2,19,3,2012,0,0,2,1659.6799999999998,2,0,11.0014,37.72,0,0
10/11/12 7:00,4,0,0,1,10.66,87,7.0015,71,2012-11-10 07:00:00,7,10,11,2012,5,1,7,927.42,0,7,7.0015,74.62,1,0
7/7/11 3:00,3,0,1,1,26.24,94,7.0015,4,2011-07-07 03:00:00,3,7,7,2011,3,0,3,2466.56,3,0,7.0015,78.72,0,0
18/7/12 14:00,3,0,1,1,38.51208683,37,23.21302104,153,2012-07-18 14:00:00,14,18,7,2012,2,0,14,1424.94721271,14,0,23.21302104,539.16921562,0,0
9/10/12 9:00,4,0,1,2,17.22,77,15.0013,382,2012-10-09 09:00:00,9,9,10,2012,1,0,18,1325.9399999999998,9,0,30.0026,154.98,1,0
2/5/12 15:00,2,0,1,1,26.24,65,12.998,256,2012-05-02 15:00:00,15,2,5,2012,2,0,15,1705.6,15,0,12.998,393.59999999999997,0,0
9/3/12 5:00,1,0,1,3,16.4,66,19.0012,29,2012-03-09 05:00:00,5,9,3,2012,4,0,15,1082.3999999999999,5,0,57.003600000000006,82.0,0,0
19/11/12 0:00,4,0,1,1,14.76,66,15.0013,27,2012-11-19 00:00:00,0,19,11,2012,0,0,0,974.16,0,0,15.0013,0.0,0,0
2/4/12 19:00,2,0,1,1,20.5,27,16.9979,494,2012-04-02 19:00:00,19,2,4,2012,0,0,19,553.5,19,0,16.9979,389.5,0,1
18/2/11 18:00,1,0,1,1,26.24,33,22.0028,224,2011-02-18 18:00:00,18,18,2,2011,4,0,18,865.92,18,0,22.0028,472.32,0,1
8/9/11 7:00,3,0,1,3,25.42,94,7.0015,179,2011-09-08 07:00:00,7,8,9,2011,3,0,21,2389.48,7,0,21.0045,177.94,1,0
9/4/11 6:00,2,0,0,2,11.86251546,91,12.38882708,9,2011-04-09 06:00:00,6,9,4,2011,5,1,12,1079.4889068599998,0,6,24.77765416,71.17509276,0,0
19/10/12 8:00,4,0,1,2,22.14,94,7.0015,467,2012-10-19 08:00:00,8,19,10,2012,4,0,16,2081.16,8,0,14.003,177.12,1,0
4/11/12 10:00,4,0,0,1,13.94,49,12.998,360,2012-11-04 10:00:00,10,4,11,2012,6,1,10,683.06,0,10,12.998,139.4,0,0
19/12/11 21:00,4,0,1,2,14.76,53,8.9981,127,2011-12-19 21:00:00,21,19,12,2011,0,0,42,782.28,21,0,17.9962,309.96,0,0
18/6/12 4:00,2,0,1,2,22.14,77,12.998,9,2012-06-18 04:00:00,4,18,6,2012,0,0,8,1704.78,4,0,25.996,88.56,0,0
16/1/12 18:00,1,1,0,1,9.308461868,53,22.55254211,163,2012-01-16 18:00:00,18,16,1,2012,0,0,18,493.348479004,0,0,22.55254211,167.552313624,0,1
10/4/12 2:00,2,0,1,1,14.76,71,8.9981,2,2012-04-10 02:00:00,2,10,4,2012,1,0,2,1047.96,2,0,8.9981,29.52,0,0
15/1/11 20:00,1,0,0,2,13.12,39,16.9979,41,2011-01-15 20:00:00,20,15,1,2011,5,1,40,511.67999999999995,0,20,33.9958,262.4,0,0
15/7/11 1:00,3,0,1,1,24.93628144,74,14.61560994,42,2011-07-15 01:00:00,1,15,7,2011,4,0,1,1845.2848265599998,1,0,14.61560994,24.93628144,0,0
17/1/11 3:00,1,1,0,2,7.38,43,12.998,2,2011-01-17 03:00:00,3,17,1,2011,0,0,6,317.34,0,0,25.996,22.14,0,0
9/7/12 7:00,3,0,1,3,27.06,83,15.0013,230,2012-07-09 07:00:00,7,9,7,2012,0,0,21,2245.98,7,0,45.0039,189.42,1,0
9/6/12 1:00,2,0,0,1,26.24,53,6.0032,123,2012-06-09 01:00:00,1,9,6,2012,5,1,1,1390.72,0,1,6.0032,26.24,0,0
10/1/11 8:00,1,0,1,2,4.92,50,19.0012,188,2011-01-10 08:00:00,8,10,1,2011,0,0,16,246.0,8,0,38.0024,39.36,1,0
11/3/11 23:00,1,0,1,1,12.3,52,16.9979,37,2011-03-11 23:00:00,23,11,3,2011,4,0,23,639.6,23,0,16.9979,282.90000000000003,0,0
10/12/11 1:00,4,0,0,2,10.66,70,11.0014,66,2011-12-10 01:00:00,1,10,12,2011,5,1,2,746.2,0,1,22.0028,10.66,0,0
10/10/11 14:00,4,1,0,1,30.34,37,0.0,370,2011-10-10 14:00:00,14,10,10,2011,0,0,14,1122.58,0,0,0.0,424.76,0,0
18/10/12 12:00,4,0,1,2,24.6,53,16.9979,377,2012-10-18 12:00:00,12,18,10,2012,3,0,24,1303.8000000000002,12,0,33.9958,295.20000000000005,0,0
11/4/11 13:00,2,0,1,2,26.24,69,27.9993,139,2011-04-11 13:00:00,13,11,4,2011,0,0,26,1810.56,13,0,55.9986,341.12,0,0
5/3/11 0:00,1,0,0,2,11.48,81,7.0015,19,2011-03-05 00:00:00,0,5,3,2011,5,1,0,929.88,0,0,14.003,0.0,0,0
18/3/11 18:00,1,0,1,1,27.88,39,11.0014,331,2011-03-18 18:00:00,18,18,3,2011,4,0,18,1087.32,18,0,11.0014,501.84,0,1
18/6/11 1:00,2,0,0,1,25.42,83,7.0015,95,2011-06-18 01:00:00,1,18,6,2011,5,1,1,2109.86,0,1,7.0015,25.42,0,0
7/8/12 8:00,3,0,1,2,28.7,70,11.0014,705,2012-08-07 08:00:00,8,7,8,2012,1,0,16,2009.0,8,0,22.0028,229.6,1,0
3/4/11 23:00,2,0,0,1,16.4,50,6.0032,31,2011-04-03 23:00:00,23,3,4,2011,6,1,23,819.9999999999999,0,23,6.0032,377.2,0,0
14/8/11 9:00,3,0,0,3,27.06,89,19.0012,103,2011-08-14 09:00:00,9,14,8,2011,6,1,27,2408.3399999999997,0,9,57.003600000000006,243.54,1,0
10/3/12 21:00,1,0,0,1,12.3,39,15.0013,110,2012-03-10 21:00:00,21,10,3,2012,5,1,21,479.70000000000005,0,21,15.0013,258.3,0,0
15/3/12 8:00,1,0,1,1,18.04,77,7.0015,623,2012-03-15 08:00:00,8,15,3,2012,3,0,8,1389.08,8,0,7.0015,144.32,1,0
15/7/12 6:00,3,0,0,1,27.88,83,8.9981,15,2012-07-15 06:00:00,6,15,7,2012,6,1,6,2314.04,0,6,8.9981,167.28,0,0
19/3/12 8:00,1,0,1,1,18.86,88,7.0015,579,2012-03-19 08:00:00,8,19,3,2012,0,0,8,1659.6799999999998,8,0,7.0015,150.88,1,0
3/5/12 22:00,2,0,1,1,25.42,78,0.0,246,2012-05-03 22:00:00,22,3,5,2012,3,0,22,1982.7600000000002,22,0,0.0,559.24,0,0
7/3/11 19:00,1,0,1,1,12.3,33,15.0013,145,2011-03-07 19:00:00,19,7,3,2011,0,0,19,405.90000000000003,19,0,15.0013,233.70000000000002,0,1
4/3/12 10:00,1,0,0,1,10.71704536,49,21.48439565,168,2012-03-04 10:00:00,10,4,3,2012,6,1,10,525.13522264,0,10,21.48439565,107.1704536,0,0
5/8/11 17:00,3,0,1,1,31.3351803,48,20.2987783,520,2011-08-05 17:00:00,17,5,8,2011,4,0,17,1504.0886544,17,0,20.2987783,532.6980651,0,1
5/8/12 13:00,3,0,0,1,34.91741233,44,29.99029666,535,2012-08-05 13:00:00,13,5,8,2012,6,1,13,1536.3661425199998,0,13,29.99029666,453.92636029,0,0
16/1/11 16:00,1,0,0,1,9.84,38,15.0013,99,2011-01-16 16:00:00,16,16,1,2011,6,1,16,373.92,0,16,15.0013,157.44,0,0
10/9/12 5:00,3,0,1,1,20.5,72,16.9979,40,2012-09-10 05:00:00,5,10,9,2012,0,0,5,1476.0,5,0,16.9979,102.5,0,0
11/7/11 10:00,3,0,1,1,32.8,55,23.9994,117,2011-07-11 10:00:00,10,11,7,2011,0,0,10,1803.9999999999998,10,0,23.9994,328.0,0,0
5/12/11 20:00,4,0,1,2,18.86,82,7.0015,205,2011-12-05 20:00:00,20,5,12,2011,0,0,40,1546.52,20,0,14.003,377.2,0,0
12/11/11 16:00,4,0,0,1,21.32,32,16.9979,361,2011-11-12 16:00:00,16,12,11,2011,5,1,16,682.24,0,16,16.9979,341.12,0,0
6/9/11 7:00,3,0,1,2,22.14,83,23.9994,172,2011-09-06 07:00:00,7,6,9,2011,1,0,14,1837.6200000000001,7,0,47.9988,154.98000000000002,1,0
15/12/11 10:00,4,0,1,2,16.4,58,19.9995,109,2011-12-15 10:00:00,10,15,12,2011,3,0,20,951.1999999999999,10,0,39.999,164.0,0,0
3/5/11 6:00,2,0,1,2,21.32,94,11.0014,109,2011-05-03 06:00:00,6,3,5,2011,1,0,12,2004.08,6,0,22.0028,127.92,0,0
8/2/11 19:00,1,0,1,1,6.56,40,31.0009,101,2011-02-08 19:00:00,19,8,2,2011,1,0,19,262.4,19,0,31.0009,124.63999999999999,0,1
15/1/11 0:00,1,0,0,1,7.38,55,0.0,28,2011-01-15 00:00:00,0,15,1,2011,5,1,0,405.9,0,0,0.0,0.0,0,0
15/7/11 3:00,3,0,1,1,24.6,73,12.998,7,2011-07-15 03:00:00,3,15,7,2011,4,0,3,1795.8000000000002,3,0,12.998,73.80000000000001,0,0
13/2/12 6:00,1,0,1,1,4.1,54,15.0013,72,2012-02-13 06:00:00,6,13,2,2012,0,0,6,221.39999999999998,6,0,15.0013,24.599999999999998,0,0
5/6/11 15:00,2,0,0,1,28.7,54,0.0,417,2011-06-05 15:00:00,15,5,6,2011,6,1,15,1549.8,0,15,0.0,430.5,0,0
3/5/11 18:00,2,0,1,1,28.06128136,47,28.54356327,552,2011-05-03 18:00:00,18,3,5,2011,1,0,18,1318.88022392,18,0,28.54356327,505.10306448,0,1
3/11/11 18:00,4,0,1,1,18.41054333,63,8.851057253,423,2011-11-03 18:00:00,18,3,11,2011,3,0,18,1159.8642297899999,18,0,8.851057253,331.38977994,0,1
5/7/12 12:00,3,0,1,1,36.9,35,23.9994,276,2012-07-05 12:00:00,12,5,7,2012,3,0,12,1291.5,12,0,23.9994,442.79999999999995,0,0
2/4/11 20:00,2,0,0,1,15.14398151,56,20.32590772,98,2011-04-02 20:00:00,20,2,4,2011,5,1,20,848.06296456,0,20,20.32590772,302.8796302,0,0
3/1/12 23:00,1,0,1,1,4.1,46,26.0027,18,2012-01-03 23:00:00,23,3,1,2012,1,0,23,188.6,23,0,26.0027,94.3,0,0
16/12/11 13:00,4,0,1,2,13.94,39,23.9994,137,2011-12-16 13:00:00,13,16,12,2011,4,0,26,543.66,13,0,47.9988,181.22,0,0
9/2/12 5:00,1,0,1,1,8.2,75,19.0012,18,2012-02-09 05:00:00,5,9,2,2012,3,0,5,615.0,5,0,19.0012,41.0,0,0
5/11/12 8:00,4,0,1,2,12.3,49,15.0013,648,2012-11-05 08:00:00,8,5,11,2012,0,0,16,602.7,8,0,30.0026,98.4,1,0
18/1/12 13:00,1,0,1,1,12.3,42,31.0009,130,2012-01-18 13:00:00,13,18,1,2012,2,0,13,516.6,13,0,31.0009,159.9,0,0
16/11/11 8:00,4,0,1,3,18.86,94,0.0,232,2011-11-16 08:00:00,8,16,11,2011,2,0,24,1772.84,8,0,0.0,150.88,1,0
4/5/11 19:00,2,0,1,1,17.22,58,23.9994,296,2011-05-04 19:00:00,19,4,5,2011,2,0,19,998.76,19,0,23.9994,327.17999999999995,0,1
7/9/12 13:00,3,0,1,1,32.8,59,16.9979,354,2012-09-07 13:00:00,13,7,9,2012,4,0,13,1935.1999999999998,13,0,16.9979,426.4,0,0
6/2/11 9:00,1,0,0,1,11.48,56,7.0015,45,2011-02-06 09:00:00,9,6,2,2011,6,1,9,642.88,0,9,7.0015,103.32000000000001,1,0
6/7/11 21:00,3,0,1,1,28.7,79,12.998,241,2011-07-06 21:00:00,21,6,7,2011,2,0,21,2267.2999999999997,21,0,12.998,602.6999999999999,0,0
1/1/12 15:00,1,0,0,1,18.86,51,19.9995,265,2012-01-01 15:00:00,15,1,1,2012,6,1,15,961.86,0,15,19.9995,282.9,0,0
6/1/12 12:00,1,0,1,1,14.76,50,16.9979,191,2012-01-06 12:00:00,12,6,1,2012,4,0,12,738.0,12,0,16.9979,177.12,0,0
14/9/11 7:00,3,0,1,1,24.6,83,7.0015,370,2011-09-14 07:00:00,7,14,9,2011,2,0,7,2041.8000000000002,7,0,7.0015,172.20000000000002,1,0
2/7/12 11:00,3,0,1,1,34.44,28,19.9995,201,2012-07-02 11:00:00,11,2,7,2012,0,0,11,964.3199999999999,11,0,19.9995,378.84,0,0
18/5/11 17:00,2,0,1,1,24.18827203,66,10.06679153,554,2011-05-18 17:00:00,17,18,5,2011,2,0,17,1596.42595398,17,0,10.06679153,411.20062451,0,1
2/5/12 5:00,2,0,1,1,22.14,90,8.9981,33,2012-05-02 05:00:00,5,2,5,2012,2,0,5,1992.6000000000001,5,0,8.9981,110.7,0,0
4/6/11 6:00,2,0,0,1,22.14,60,0.0,28,2011-06-04 06:00:00,6,4,6,2011,5,1,6,1328.4,0,6,0.0,132.84,0,0
11/4/12 20:00,2,0,1,1,14.76,46,22.0028,235,2012-04-11 20:00:00,20,11,4,2012,2,0,20,678.96,20,0,22.0028,295.2,0,0
15/10/11 8:00,4,0,0,1,18.86,59,19.0012,125,2011-10-15 08:00:00,8,15,10,2011,5,1,8,1112.74,0,8,19.0012,150.88,1,0
6/9/11 13:00,3,0,1,3,22.14,88,19.9995,29,2011-09-06 13:00:00,13,6,9,2011,1,0,39,1948.3200000000002,13,0,59.99850000000001,287.82,0,0
4/12/11 0:00,4,0,0,1,11.75754012,70,7.135037549,108,2011-12-04 00:00:00,0,4,12,2011,6,1,0,823.0278084,0,0,7.135037549,0.0,0,0
19/2/12 7:00,1,0,0,2,9.84,52,19.0012,14,2012-02-19 07:00:00,7,19,2,2012,6,1,14,511.68,0,7,38.0024,68.88,1,0
11/3/11 8:00,1,0,1,1,11.48,70,16.9979,259,2011-03-11 08:00:00,8,11,3,2011,4,0,8,803.6,8,0,16.9979,91.84,1,0
9/12/12 10:00,4,0,0,2,17.05089149,92,17.19646739,203,2012-12-09 10:00:00,10,9,12,2012,6,1,20,1568.6820170800002,0,10,34.39293478,170.5089149,0,0
18/1/12 8:00,1,0,1,1,12.3,52,27.9993,489,2012-01-18 08:00:00,8,18,1,2012,2,0,8,639.6,8,0,27.9993,98.4,1,0
10/7/11 15:00,3,0,0,1,34.44,39,19.0012,361,2011-07-10 15:00:00,15,10,7,2011,6,1,15,1343.1599999999999,0,15,19.0012,516.5999999999999,0,0
8/6/12 6:00,2,0,1,1,21.32,68,6.0032,139,2012-06-08 06:00:00,6,8,6,2012,4,0,6,1449.76,6,0,6.0032,127.92,0,0
10/5/12 1:00,2,0,1,2,19.68,88,8.9981,11,2012-05-10 01:00:00,1,10,5,2012,3,0,2,1731.84,1,0,17.9962,19.68,0,0
19/1/12 0:00,1,0,1,1,5.127599264,52,11.44436892,6,2012-01-19 00:00:00,0,19,1,2012,3,0,0,266.63516172799996,0,0,11.44436892,0.0,0,0
15/2/11 22:00,1,0,1,1,9.84,44,0.0,41,2011-02-15 22:00:00,22,15,2,2011,1,0,22,432.96,22,0,0.0,216.48,0,0
1/6/12 23:00,2,0,1,3,24.6,88,8.9981,73,2012-06-01 23:00:00,23,1,6,2012,4,0,69,2164.8,23,0,26.994300000000003,565.8000000000001,0,0
6/10/12 23:00,4,0,0,1,18.12469626,60,9.059343356,201,2012-10-06 23:00:00,23,6,10,2012,5,1,23,1087.4817756,0,23,9.059343356,416.86801398,0,0
2/5/12 13:00,2,0,1,2,23.78,78,12.998,228,2012-05-02 13:00:00,13,2,5,2012,2,0,26,1854.8400000000001,13,0,25.996,309.14,0,0
3/8/12 11:00,3,0,1,2,34.44,49,19.0012,263,2012-08-03 11:00:00,11,3,8,2012,4,0,22,1687.56,11,0,38.0024,378.84,0,0
11/12/12 1:00,4,0,1,1,17.22,71,30.0026,8,2012-12-11 01:00:00,1,11,12,2012,1,0,1,1222.62,1,0,30.0026,17.22,0,0
11/5/11 12:00,2,0,1,1,24.6,56,0.0,226,2011-05-11 12:00:00,12,11,5,2011,2,0,12,1377.6000000000001,12,0,0.0,295.20000000000005,0,0
11/8/12 7:00,3,0,0,1,26.24,83,6.0032,62,2012-08-11 07:00:00,7,11,8,2012,5,1,7,2177.92,0,7,6.0032,183.67999999999998,1,0
17/1/11 2:00,1,1,0,2,7.38,43,16.9979,8,2011-01-17 02:00:00,2,17,1,2011,0,0,4,317.34,0,0,33.9958,14.76,0,0
19/11/12 22:00,4,0,1,1,14.13395909,68,7.424344808,124,2012-11-19 22:00:00,22,19,11,2012,0,0,22,961.1092181199999,22,0,7.424344808,310.94709997999996,0,0
16/7/12 17:00,3,0,1,3,31.16,66,39.0007,755,2012-07-16 17:00:00,17,16,7,2012,0,0,51,2056.56,17,0,117.00210000000001,529.72,0,1
19/8/12 10:00,3,0,0,2,27.88,69,0.0,425,2012-08-19 10:00:00,10,19,8,2012,6,1,20,1923.72,0,10,0.0,278.8,0,0
4/8/12 18:00,3,0,0,1,35.26,41,22.0028,490,2012-08-04 18:00:00,18,4,8,2012,5,1,18,1445.6599999999999,0,18,22.0028,634.68,0,1
7/12/11 23:00,4,0,1,1,9.84,93,26.0027,16,2011-12-07 23:00:00,23,7,12,2011,2,0,23,915.12,23,0,26.0027,226.32,0,0
5/5/11 1:00,2,0,1,1,13.88490131,70,12.99539202,1,2011-05-05 01:00:00,1,5,5,2011,3,0,1,971.9430917,1,0,12.99539202,13.88490131,0,0
9/1/11 22:00,1,0,0,1,5.339795693,44,19.70132005,1,2011-01-09 22:00:00,22,9,1,2011,6,1,22,234.951010492,0,22,19.70132005,117.475505246,0,0
11/9/12 2:00,3,0,1,1,19.68,77,11.0014,6,2012-09-11 02:00:00,2,11,9,2012,1,0,2,1515.36,2,0,11.0014,39.36,0,0
6/5/11 22:00,2,0,1,1,18.41302011,73,15.07234034,137,2011-05-06 22:00:00,22,6,5,2011,4,0,22,1344.1504680300002,22,0,15.07234034,405.08644242,0,0
15/12/12 5:00,4,0,0,2,10.66,75,0.0,3,2012-12-15 05:00:00,5,15,12,2012,5,1,10,799.5,0,5,0.0,53.3,0,0
5/11/12 14:00,4,0,1,1,15.58,40,11.0014,196,2012-11-05 14:00:00,14,5,11,2012,0,0,14,623.2,14,0,11.0014,218.12,0,0
5/10/12 3:00,4,0,1,1,22.14,73,0.0,16,2012-10-05 03:00:00,3,5,10,2012,4,0,3,1616.22,3,0,0.0,66.42,0,0
19/6/12 4:00,2,0,1,2,24.6,78,8.9981,10,2012-06-19 04:00:00,4,19,6,2012,1,0,8,1918.8000000000002,4,0,17.9962,98.4,0,0
1/7/12 19:00,3,0,0,1,34.44,39,8.9981,382,2012-07-01 19:00:00,19,1,7,2012,6,1,19,1343.1599999999999,0,19,8.9981,654.3599999999999,0,1
15/12/12 20:00,4,0,0,2,14.76,57,12.998,201,2012-12-15 20:00:00,20,15,12,2012,5,1,40,841.3199999999999,0,20,25.996,295.2,0,0
10/6/11 22:00,2,0,1,1,29.52,74,16.9979,185,2011-06-10 22:00:00,22,10,6,2011,4,0,22,2184.48,22,0,16.9979,649.4399999999999,0,0
11/11/12 5:00,4,0,0,1,12.3,87,8.9981,12,2012-11-11 05:00:00,5,11,11,2012,6,1,5,1070.1000000000001,0,5,8.9981,61.5,0,0
8/10/12 19:00,4,1,0,2,16.4,71,16.9979,371,2012-10-08 19:00:00,19,8,10,2012,0,0,38,1164.3999999999999,0,0,33.9958,311.59999999999997,0,1
1/10/12 11:00,4,0,1,1,23.78,46,0.0,272,2012-10-01 11:00:00,11,1,10,2012,0,0,11,1093.88,11,0,0.0,261.58000000000004,0,0
3/9/12 4:00,3,1,0,1,26.90728149,89,6.331208883,30,2012-09-03 04:00:00,4,3,9,2012,0,0,4,2394.74805261,0,0,6.331208883,107.62912596,0,0
16/11/11 22:00,4,0,1,3,17.22,88,15.0013,46,2011-11-16 22:00:00,22,16,11,2011,2,0,66,1515.36,22,0,45.0039,378.84,0,0
16/6/11 5:00,2,0,1,1,24.6,64,12.998,25,2011-06-16 05:00:00,5,16,6,2011,3,0,5,1574.4,5,0,12.998,123.0,0,0
2/11/12 2:00,4,0,1,1,13.12,66,11.0014,10,2012-11-02 02:00:00,2,2,11,2012,4,0,2,865.92,2,0,11.0014,26.24,0,0
1/7/12 11:00,3,0,0,1,36.08,39,15.0013,377,2012-07-01 11:00:00,11,1,7,2012,6,1,11,1407.12,0,11,15.0013,396.88,0,0
3/8/11 1:00,3,0,1,2,31.98,52,11.0014,16,2011-08-03 01:00:00,1,3,8,2011,2,0,2,1662.96,1,0,22.0028,31.98,0,0
19/7/12 22:00,3,0,1,3,27.06,89,16.9979,68,2012-07-19 22:00:00,22,19,7,2012,3,0,66,2408.3399999999997,22,0,50.993700000000004,595.3199999999999,0,0
13/8/11 2:00,3,0,0,1,26.52955456,57,0.0,62,2011-08-13 02:00:00,2,13,8,2011,5,1,2,1512.18460992,0,2,0.0,53.05910912,0,0
8/4/11 5:00,2,0,1,2,13.12,87,12.998,9,2011-04-08 05:00:00,5,8,4,2011,4,0,10,1141.4399999999998,5,0,25.996,65.6,0,0
13/8/11 23:00,3,0,0,2,26.60404516,83,21.13895896,95,2011-08-13 23:00:00,23,13,8,2011,5,1,46,2208.13574828,0,23,42.27791792,611.89303868,0,0
10/4/11 17:00,2,0,0,2,21.32,72,12.998,236,2011-04-10 17:00:00,17,10,4,2011,6,1,34,1535.04,0,17,25.996,362.44,0,1
14/2/12 3:00,1,0,1,2,10.66,52,0.0,3,2012-02-14 03:00:00,3,14,2,2012,1,0,6,554.32,3,0,0.0,31.98,0,0
18/8/12 0:00,3,0,0,2,26.24,83,15.0013,105,2012-08-18 00:00:00,0,18,8,2012,5,1,0,2177.92,0,0,30.0026,0.0,0,0
12/7/12 22:00,3,0,1,1,29.52,51,11.0014,318,2012-07-12 22:00:00,22,12,7,2012,3,0,22,1505.52,22,0,11.0014,649.4399999999999,0,0
19/7/11 23:00,3,0,1,3,29.52,79,11.0014,92,2011-07-19 23:00:00,23,19,7,2011,1,0,69,2332.08,23,0,33.0042,678.96,0,0
6/9/11 21:00,3,0,1,3,22.14,88,19.0012,121,2011-09-06 21:00:00,21,6,9,2011,1,0,63,1948.3200000000002,21,0,57.003600000000006,464.94,0,0
8/4/12 17:00,2,0,0,1,25.42,22,19.9995,411,2012-04-08 17:00:00,17,8,4,2012,6,1,17,559.24,0,17,19.9995,432.14000000000004,0,1
14/2/12 6:00,1,0,1,2,10.66,56,0.0,90,2012-02-14 06:00:00,6,14,2,2012,1,0,12,596.96,6,0,0.0,63.96,0,0
8/12/12 7:00,4,0,0,2,14.76,100,6.0032,39,2012-12-08 07:00:00,7,8,12,2012,5,1,14,1476.0,0,7,12.0064,103.32,1,0
9/9/12 4:00,3,0,0,1,21.32,77,16.9979,28,2012-09-09 04:00:00,4,9,9,2012,6,1,4,1641.64,0,4,16.9979,85.28,0,0
10/11/11 2:00,4,0,1,2,15.58,94,0.0,5,2011-11-10 02:00:00,2,10,11,2011,3,0,4,1464.52,2,0,0.0,31.16,0,0
8/7/11 20:00,3,0,1,1,27.06,83,11.0014,250,2011-07-08 20:00:00,20,8,7,2011,4,0,20,2245.98,20,0,11.0014,541.1999999999999,0,0
5/11/11 19:00,4,0,0,1,12.6864838,50,0.439079156,186,2011-11-05 19:00:00,19,5,11,2011,5,1,19,634.3241899999999,0,19,0.439079156,241.0431922,0,1
8/4/12 2:00,2,0,0,1,18.04,24,15.0013,32,2012-04-08 02:00:00,2,8,4,2012,6,1,2,432.96,0,2,15.0013,36.08,0,0
2/7/11 14:00,3,0,0,1,34.09677434,20,0.0,396,2011-07-02 14:00:00,14,2,7,2011,5,1,14,681.9354868,0,14,0.0,477.35484076000006,0,0
9/11/11 23:00,4,0,1,1,16.49820057,84,0.0,74,2011-11-09 23:00:00,23,9,11,2011,2,0,23,1385.8488478800002,23,0,0.0,379.45861311000004,0,0
15/8/11 23:00,3,0,1,1,26.24,69,15.0013,88,2011-08-15 23:00:00,23,15,8,2011,0,0,23,1810.56,23,0,15.0013,603.52,0,0
4/7/12 17:00,3,1,0,1,37.72,35,19.9995,414,2012-07-04 17:00:00,17,4,7,2012,2,0,17,1320.2,0,0,19.9995,641.24,0,1
18/12/11 18:00,4,0,0,1,11.48,45,12.998,138,2011-12-18 18:00:00,18,18,12,2011,6,1,18,516.6,0,18,12.998,206.64000000000001,0,1
6/2/11 2:00,1,0,0,1,10.66,60,22.0028,20,2011-02-06 02:00:00,2,6,2,2011,6,1,2,639.6,0,2,22.0028,21.32,0,0
13/10/11 19:00,4,0,1,2,24.43472075,82,10.29175808,223,2011-10-13 19:00:00,19,13,10,2011,3,0,38,2003.6471015,19,0,20.58351616,464.25969425,0,1
13/4/12 7:00,2,0,1,1,13.94,61,15.0013,296,2012-04-13 07:00:00,7,13,4,2012,4,0,7,850.3399999999999,7,0,15.0013,97.58,1,0
7/9/11 19:00,3,0,1,2,26.24,89,0.0,226,2011-09-07 19:00:00,19,7,9,2011,2,0,38,2335.3599999999997,19,0,0.0,498.55999999999995,0,1
2/2/12 22:00,1,0,1,1,13.12,49,27.9993,109,2012-02-02 22:00:00,22,2,2,2012,3,0,22,642.88,22,0,27.9993,288.64,0,0
8/11/12 22:00,4,0,1,1,13.94,42,19.9995,161,2012-11-08 22:00:00,22,8,11,2012,3,0,22,585.48,22,0,19.9995,306.68,0,0
13/5/12 12:00,2,0,0,1,26.24,57,15.0013,531,2012-05-13 12:00:00,12,13,5,2012,6,1,12,1495.6799999999998,0,12,15.0013,314.88,0,0
3/2/11 1:00,1,0,1,1,8.2,44,35.0008,5,2011-02-03 01:00:00,1,3,2,2011,3,0,1,360.79999999999995,1,0,35.0008,8.2,0,0
19/7/11 2:00,3,0,1,1,29.52,70,11.0014,13,2011-07-19 02:00:00,2,19,7,2011,1,0,2,2066.4,2,0,11.0014,59.04,0,0
4/1/12 5:00,1,0,1,1,0.82,41,12.998,14,2012-01-04 05:00:00,5,4,1,2012,2,0,5,33.62,5,0,12.998,4.1,0,0
17/1/11 5:00,1,1,0,2,6.349530194,43,10.89632711,1,2011-01-17 05:00:00,5,17,1,2011,0,0,10,273.029798342,0,0,21.79265422,31.74765097,0,0
2/3/11 1:00,1,0,1,1,9.02,69,12.998,4,2011-03-02 01:00:00,1,2,3,2011,2,0,1,622.38,1,0,12.998,9.02,0,0
14/7/12 0:00,3,0,0,2,29.52,48,6.0032,191,2012-07-14 00:00:00,0,14,7,2012,5,1,0,1416.96,0,0,12.0064,0.0,0,0
6/4/11 16:00,2,0,1,1,22.70569204,27,28.63444644,141,2011-04-06 16:00:00,16,6,4,2011,2,0,16,613.0536850799999,16,0,28.63444644,363.29107264,0,0
14/1/11 18:00,1,0,1,1,7.956987082,45,0.0,130,2011-01-14 18:00:00,18,14,1,2011,4,0,18,358.06441869,18,0,0.0,143.22576747600002,0,1
11/8/11 23:00,3,0,1,1,27.06,50,11.0014,127,2011-08-11 23:00:00,23,11,8,2011,3,0,23,1353.0,23,0,11.0014,622.38,0,0
3/4/11 5:00,2,0,0,1,11.48,65,15.0013,5,2011-04-03 05:00:00,5,3,4,2011,6,1,5,746.2,0,5,15.0013,57.400000000000006,0,0
4/6/11 20:00,2,0,0,2,28.7,48,6.0032,239,2011-06-04 20:00:00,20,4,6,2011,5,1,40,1377.6,0,20,12.0064,574.0,0,0
5/9/12 12:00,3,0,1,1,31.98,70,7.0015,266,2012-09-05 12:00:00,12,5,9,2012,2,0,12,2238.6,12,0,7.0015,383.76,0,0
2/5/12 10:00,2,0,1,2,23.78,83,7.0015,175,2012-05-02 10:00:00,10,2,5,2012,2,0,20,1973.74,10,0,14.003,237.8,0,0
6/10/12 15:00,4,0,0,1,24.6,46,27.9993,620,2012-10-06 15:00:00,15,6,10,2012,5,1,15,1131.6000000000001,0,15,27.9993,369.0,0,0
13/7/11 3:00,3,0,1,1,30.34,58,12.998,4,2011-07-13 03:00:00,3,13,7,2011,2,0,3,1759.72,3,0,12.998,91.02,0,0
17/5/11 21:00,2,0,1,1,22.14,88,16.9979,174,2011-05-17 21:00:00,21,17,5,2011,1,0,21,1948.3200000000002,21,0,16.9979,464.94,0,0
16/12/12 16:00,4,0,0,2,16.73698781,83,6.116235873,398,2012-12-16 16:00:00,16,16,12,2012,6,1,32,1389.16998823,0,16,12.232471746,267.79180496,0,0
14/10/12 10:00,4,0,0,1,22.14,56,12.998,428,2012-10-14 10:00:00,10,14,10,2012,6,1,10,1239.8400000000001,0,10,12.998,221.4,0,0
4/11/12 21:00,4,0,0,1,12.3,52,19.9995,87,2012-11-04 21:00:00,21,4,11,2012,6,1,21,639.6,0,21,19.9995,258.3,0,0
17/4/11 18:00,2,0,0,1,22.96,30,26.0027,277,2011-04-17 18:00:00,18,17,4,2011,6,1,18,688.8000000000001,0,18,26.0027,413.28000000000003,0,1
8/5/12 12:00,2,0,1,2,25.42,65,22.0028,263,2012-05-08 12:00:00,12,8,5,2012,1,0,24,1652.3000000000002,12,0,44.0056,305.04,0,0
8/4/12 15:00,2,0,0,1,25.42,17,23.9994,486,2012-04-08 15:00:00,15,8,4,2012,6,1,15,432.14000000000004,0,15,23.9994,381.3,0,0
2/4/12 9:00,2,0,1,1,15.58,54,23.9994,317,2012-04-02 09:00:00,9,2,4,2012,0,0,9,841.32,9,0,23.9994,140.22,1,0
2/10/12 6:00,4,0,1,3,23.78,83,7.0015,179,2012-10-02 06:00:00,6,2,10,2012,1,0,18,1973.74,6,0,21.0045,142.68,0,0
1/6/12 17:00,2,0,1,3,28.7,70,16.9979,227,2012-06-01 17:00:00,17,1,6,2012,4,0,51,2009.0,17,0,50.993700000000004,487.9,0,1
11/4/11 4:00,2,0,1,1,18.86,94,12.998,1,2011-04-11 04:00:00,4,11,4,2011,0,0,4,1772.84,4,0,12.998,75.44,0,0
14/8/12 20:00,3,0,1,1,30.34,74,15.0013,436,2012-08-14 20:00:00,20,14,8,2012,1,0,20,2245.16,20,0,15.0013,606.8,0,0
18/10/12 10:00,4,0,1,2,21.32,68,15.0013,218,2012-10-18 10:00:00,10,18,10,2012,3,0,20,1449.76,10,0,30.0026,213.2,0,0
17/8/11 16:00,3,0,1,1,32.84970227,42,12.5505281,281,2011-08-17 16:00:00,16,17,8,2011,2,0,16,1379.6874953400002,16,0,12.5505281,525.59523632,0,0
3/10/11 13:00,4,0,1,3,17.22,67,11.0014,118,2011-10-03 13:00:00,13,3,10,2011,0,0,39,1153.74,13,0,33.0042,223.85999999999999,0,0
18/12/12 11:00,4,0,1,1,20.20299334,65,14.75058987,247,2012-12-18 11:00:00,11,18,12,2012,1,0,11,1313.1945670999999,11,0,14.75058987,222.23292673999998,0,0
8/1/12 20:00,1,0,0,1,12.3,52,11.0014,126,2012-01-08 20:00:00,20,8,1,2012,6,1,20,639.6,0,20,11.0014,246.0,0,0
5/1/12 16:00,1,0,1,1,15.51202126,34,20.26757804,209,2012-01-05 16:00:00,16,5,1,2012,3,0,16,527.40872284,16,0,20.26757804,248.19234016,0,0
3/7/11 16:00,3,0,0,1,34.44,53,19.9995,414,2011-07-03 16:00:00,16,3,7,2011,6,1,16,1825.32,0,16,19.9995,551.04,0,0
17/4/12 4:00,2,0,1,1,27.06,44,15.0013,9,2012-04-17 04:00:00,4,17,4,2012,1,0,4,1190.6399999999999,4,0,15.0013,108.24,0,0
17/12/11 12:00,4,0,0,2,11.48,45,19.0012,244,2011-12-17 12:00:00,12,17,12,2011,5,1,24,516.6,0,12,38.0024,137.76,0,0
14/6/11 19:00,2,0,1,1,26.24,50,23.9994,386,2011-06-14 19:00:00,19,14,6,2011,1,0,19,1312.0,19,0,23.9994,498.55999999999995,0,1
4/9/11 20:00,3,0,0,1,30.34,70,19.9995,229,2011-09-04 20:00:00,20,4,9,2011,6,1,20,2123.8,0,20,19.9995,606.8,0,0
5/3/11 7:00,1,0,0,2,11.91685058,99,20.33165612,24,2011-03-05 07:00:00,7,5,3,2011,5,1,14,1179.76820742,0,7,40.66331224,83.41795406,1,0
14/5/12 1:00,2,0,1,2,24.6,60,19.0012,11,2012-05-14 01:00:00,1,14,5,2012,0,0,2,1476.0,1,0,38.0024,24.6,0,0
19/7/12 5:00,3,0,1,2,29.52,70,7.0015,40,2012-07-19 05:00:00,5,19,7,2012,3,0,10,2066.4,5,0,14.003,147.6,0,0
16/5/12 3:00,2,0,1,1,22.96,88,7.0015,6,2012-05-16 03:00:00,3,16,5,2012,2,0,3,2020.48,3,0,7.0015,68.88,0,0
17/7/12 1:00,3,0,1,1,30.34,70,0.0,25,2012-07-17 01:00:00,1,17,7,2012,1,0,1,2123.8,1,0,0.0,30.34,0,0
8/8/12 7:00,3,0,1,2,28.7,84,11.0014,482,2012-08-08 07:00:00,7,8,8,2012,2,0,14,2410.7999999999997,7,0,22.0028,200.9,1,0
16/10/11 8:00,4,0,0,1,16.28706076,61,11.93790792,85,2011-10-16 08:00:00,8,16,10,2011,6,1,8,993.51070636,0,8,11.93790792,130.29648608,1,0
6/3/11 23:00,1,0,0,2,9.02,100,27.9993,9,2011-03-06 23:00:00,23,6,3,2011,6,1,46,902.0,0,23,55.9986,207.45999999999998,0,0
12/1/12 3:00,1,0,1,3,14.76,93,16.9979,3,2012-01-12 03:00:00,3,12,1,2012,3,0,9,1372.68,3,0,50.993700000000004,44.28,0,0
13/10/12 13:00,4,0,0,1,18.86,36,12.998,670,2012-10-13 13:00:00,13,13,10,2012,5,1,13,678.96,0,13,12.998,245.18,0,0
6/1/11 9:00,1,0,1,2,7.38,51,0.0,122,2011-01-06 09:00:00,9,6,1,2011,3,0,18,376.38,9,0,0.0,66.42,1,0
12/12/11 20:00,4,0,1,1,12.3,56,6.0032,165,2011-12-12 20:00:00,20,12,12,2011,0,0,20,688.8000000000001,20,0,6.0032,246.0,0,0
3/2/12 10:00,1,0,1,1,11.48,56,19.0012,129,2012-02-03 10:00:00,10,3,2,2012,4,0,10,642.88,10,0,19.0012,114.80000000000001,0,0
16/11/12 20:00,4,0,1,1,14.58355588,45,16.32528193,229,2012-11-16 20:00:00,20,16,11,2012,4,0,20,656.2600146,20,0,16.32528193,291.6711176,0,0
17/11/11 3:00,4,0,1,2,16.99139235,77,21.45412927,1,2011-11-17 03:00:00,3,17,11,2011,3,0,6,1308.33721095,3,0,42.90825854,50.97417705000001,0,0
18/1/12 4:00,1,0,1,1,13.94,46,35.0008,1,2012-01-18 04:00:00,4,18,1,2012,2,0,4,641.24,4,0,35.0008,55.76,0,0
14/7/11 14:00,3,0,1,1,30.34,35,19.0012,178,2011-07-14 14:00:00,14,14,7,2011,3,0,14,1061.9,14,0,19.0012,424.76,0,0
13/6/12 14:00,2,0,1,2,29.7390786,36,27.73087215,285,2012-06-13 14:00:00,14,13,6,2012,2,0,28,1070.6068295999999,14,0,55.4617443,416.3471004,0,0
8/6/12 12:00,2,0,1,1,29.11755601,42,22.21440021,326,2012-06-08 12:00:00,12,8,6,2012,4,0,12,1222.93735242,12,0,22.21440021,349.41067212,0,0
2/10/11 10:00,4,0,0,2,14.76,71,19.0012,248,2011-10-02 10:00:00,10,2,10,2011,6,1,20,1047.96,0,10,38.0024,147.6,0,0
6/5/12 12:00,2,0,0,2,24.6,64,6.0032,558,2012-05-06 12:00:00,12,6,5,2012,6,1,24,1574.4,0,12,12.0064,295.20000000000005,0,0
19/8/11 14:00,3,0,1,1,31.98,55,12.998,220,2011-08-19 14:00:00,14,19,8,2011,4,0,14,1758.9,14,0,12.998,447.72,0,0
11/7/12 8:00,3,0,1,2,28.44778424,80,11.18406042,652,2012-07-11 08:00:00,8,11,7,2012,2,0,16,2275.8227392,8,0,22.36812084,227.58227392,1,0
15/4/12 5:00,2,0,0,1,19.90630075,67,10.05230023,12,2012-04-15 05:00:00,5,15,4,2012,6,1,5,1333.72215025,0,5,10.05230023,99.53150375,0,0
4/2/11 22:00,1,0,1,2,9.84,65,11.0014,46,2011-02-04 22:00:00,22,4,2,2011,4,0,44,639.6,22,0,22.0028,216.48,0,0
5/2/12 14:00,1,0,0,1,12.3,61,11.0014,243,2012-02-05 14:00:00,14,5,2,2012,6,1,14,750.3000000000001,0,14,11.0014,172.20000000000002,0,0
18/2/12 7:00,1,0,0,1,9.84,70,0.0,41,2012-02-18 07:00:00,7,18,2,2012,5,1,7,688.8,0,7,0.0,68.88,1,0
7/3/12 5:00,1,0,1,1,11.48,56,19.9995,18,2012-03-07 05:00:00,5,7,3,2012,2,0,5,642.88,5,0,19.9995,57.400000000000006,0,0
5/5/11 11:00,2,0,1,1,21.32,36,30.0026,148,2011-05-05 11:00:00,11,5,5,2011,3,0,11,767.52,11,0,30.0026,234.52,0,0
13/4/12 18:00,2,0,1,1,22.14,26,8.9981,671,2012-04-13 18:00:00,18,13,4,2012,4,0,18,575.64,18,0,8.9981,398.52,0,1
3/5/12 14:00,2,0,1,1,26.24,65,12.998,204,2012-05-03 14:00:00,14,3,5,2012,3,0,14,1705.6,14,0,12.998,367.35999999999996,0,0
1/6/12 23:00,2,0,1,3,24.8944995,90,7.754674632,106,2012-06-01 23:00:00,23,1,6,2012,4,0,69,2240.504955,23,0,23.264023896,572.5734884999999,0,0
13/12/11 1:00,4,0,1,1,8.2,80,0.0,4,2011-12-13 01:00:00,1,13,12,2011,1,0,1,656.0,1,0,0.0,8.2,0,0
8/2/12 8:00,1,0,1,2,9.473155075,69,16.58968825,474,2012-02-08 08:00:00,8,8,2,2012,2,0,16,653.647700175,8,0,33.1793765,75.7852406,1,0
18/2/12 21:00,1,0,0,1,18.04,33,19.9995,114,2012-02-18 21:00:00,21,18,2,2012,5,1,21,595.3199999999999,0,21,19.9995,378.84,0,0
14/12/11 18:00,4,0,1,2,14.76,62,11.0014,390,2011-12-14 18:00:00,18,14,12,2011,2,0,36,915.12,18,0,22.0028,265.68,0,1
9/11/12 18:00,4,0,1,1,17.22,44,7.0015,496,2012-11-09 18:00:00,18,9,11,2012,4,0,18,757.68,18,0,7.0015,309.96,0,1
4/3/11 1:00,1,0,1,2,7.38,64,12.998,4,2011-03-04 01:00:00,1,4,3,2011,4,0,2,472.32,1,0,25.996,7.38,0,0
4/2/11 3:00,1,0,1,2,5.74,63,7.0015,1,2011-02-04 03:00:00,3,4,2,2011,4,0,6,361.62,3,0,14.003,17.22,0,0
10/8/11 20:00,3,0,1,1,31.16,31,8.9981,312,2011-08-10 20:00:00,20,10,8,2011,2,0,20,965.96,20,0,8.9981,623.2,0,0
11/12/12 4:00,4,0,1,2,13.94,76,19.0012,8,2012-12-11 04:00:00,4,11,12,2012,1,0,8,1059.44,4,0,38.0024,55.76,0,0
4/6/12 19:00,2,0,1,1,25.42,38,27.9993,645,2012-06-04 19:00:00,19,4,6,2012,0,0,19,965.96,19,0,27.9993,482.98,0,1
16/11/12 9:00,4,0,1,1,13.94,53,7.0015,351,2012-11-16 09:00:00,9,16,11,2012,4,0,9,738.8199999999999,9,0,7.0015,125.46,1,0
9/12/11 23:00,4,0,1,1,11.48,81,0.0,94,2011-12-09 23:00:00,23,9,12,2011,4,0,23,929.88,23,0,0.0,264.04,0,0
15/7/11 17:00,3,0,1,1,30.34,42,16.9979,587,2011-07-15 17:00:00,17,15,7,2011,4,0,17,1274.28,17,0,16.9979,515.78,0,1
3/11/11 6:00,4,0,1,1,14.36550794,76,14.83657824,110,2011-11-03 06:00:00,6,3,11,2011,3,0,6,1091.77860344,6,0,14.83657824,86.19304764,0,0
2/2/12 9:00,1,0,1,3,15.58,87,0.0,228,2012-02-02 09:00:00,9,2,2,2012,3,0,27,1355.46,9,0,0.0,140.22,1,0
5/4/12 13:00,2,0,1,1,18.86,31,0.0,291,2012-04-05 13:00:00,13,5,4,2012,3,0,13,584.66,13,0,0.0,245.18,0,0
18/6/12 12:00,2,0,1,3,23.44861808,75,8.724529933,172,2012-06-18 12:00:00,12,18,6,2012,0,0,36,1758.646356,12,0,26.173589799,281.38341696,0,0
5/7/12 13:00,3,0,1,1,37.72,33,15.0013,310,2012-07-05 13:00:00,13,5,7,2012,3,0,13,1244.76,13,0,15.0013,490.36,0,0
10/8/12 11:00,3,0,1,3,27.88,79,8.9981,251,2012-08-10 11:00:00,11,10,8,2012,4,0,33,2202.52,11,0,26.994300000000003,306.68,0,0
10/7/12 15:00,3,0,1,1,32.8,41,15.0013,265,2012-07-10 15:00:00,15,10,7,2012,1,0,15,1344.8,15,0,15.0013,491.99999999999994,0,0
1/11/12 14:00,4,0,1,2,15.84497618,53,14.64493062,196,2012-11-01 14:00:00,14,1,11,2012,3,0,28,839.78373754,14,0,29.28986124,221.82966652,0,0
8/12/11 21:00,4,0,1,1,11.48,61,6.0032,139,2011-12-08 21:00:00,21,8,12,2011,3,0,21,700.28,21,0,6.0032,241.08,0,0
15/8/12 15:00,3,0,1,1,31.16,52,16.9979,266,2012-08-15 15:00:00,15,15,8,2012,2,0,15,1620.32,15,0,16.9979,467.4,0,0
5/6/12 1:00,2,0,1,2,21.32,77,22.0028,20,2012-06-05 01:00:00,1,5,6,2012,1,0,2,1641.64,1,0,44.0056,21.32,0,0
8/7/11 21:00,3,0,1,2,27.06,83,16.9979,204,2011-07-08 21:00:00,21,8,7,2011,4,0,42,2245.98,21,0,33.9958,568.26,0,0
14/6/12 4:00,2,0,1,2,24.6,56,16.9979,6,2012-06-14 04:00:00,4,14,6,2012,3,0,8,1377.6000000000001,4,0,33.9958,98.4,0,0
13/3/12 9:00,1,0,1,1,19.68,82,19.0012,342,2012-03-13 09:00:00,9,13,3,2012,1,0,9,1613.76,9,0,19.0012,177.12,1,0
7/10/11 2:00,4,0,1,1,17.22,88,0.0,5,2011-10-07 02:00:00,2,7,10,2011,4,0,2,1515.36,2,0,0.0,34.44,0,0
8/6/12 0:00,2,0,1,1,22.51070008,57,10.55916436,76,2012-06-08 00:00:00,0,8,6,2012,4,0,0,1283.10990456,0,0,10.55916436,0.0,0,0
1/9/12 21:00,3,0,0,3,26.24,89,0.0,104,2012-09-01 21:00:00,21,1,9,2012,5,1,63,2335.3599999999997,0,21,0.0,551.04,0,0
13/8/11 16:00,3,0,0,2,28.7,74,19.0012,281,2011-08-13 16:00:00,16,13,8,2011,5,1,32,2123.7999999999997,0,16,38.0024,459.2,0,0
17/3/11 23:00,1,0,1,1,17.22,62,19.0012,50,2011-03-17 23:00:00,23,17,3,2011,3,0,23,1067.6399999999999,23,0,19.0012,396.05999999999995,0,0
3/2/12 14:00,1,0,1,1,14.76,46,15.0013,170,2012-02-03 14:00:00,14,3,2,2012,4,0,14,678.96,14,0,15.0013,206.64,0,0
16/12/11 9:00,4,0,1,1,14.76,46,26.0027,243,2011-12-16 09:00:00,9,16,12,2011,4,0,9,678.96,9,0,26.0027,132.84,1,0
5/2/12 20:00,1,0,0,1,11.48,56,12.998,50,2012-02-05 20:00:00,20,5,2,2012,6,1,20,642.88,0,20,12.998,229.60000000000002,0,0
14/4/12 19:00,2,0,0,2,24.6,40,11.0014,459,2012-04-14 19:00:00,19,14,4,2012,5,1,38,984.0,0,19,22.0028,467.40000000000003,0,1
3/6/12 3:00,2,0,0,1,21.61707103,63,7.422251392,42,2012-06-03 03:00:00,3,3,6,2012,6,1,3,1361.87547489,0,3,7.422251392,64.85121309,0,0
12/11/11 11:00,4,0,0,1,15.51388795,54,18.66641346,299,2011-11-12 11:00:00,11,12,11,2011,5,1,11,837.7499493,0,11,18.66641346,170.65276745,0,0
15/11/11 15:00,4,0,1,2,20.64284248,61,9.41025681,185,2011-11-15 15:00:00,15,15,11,2011,1,0,30,1259.21339128,15,0,18.82051362,309.64263719999997,0,0
18/10/12 13:00,4,0,1,1,25.42,53,23.9994,332,2012-10-18 13:00:00,13,18,10,2012,3,0,13,1347.26,13,0,23.9994,330.46000000000004,0,0
9/8/12 3:00,3,0,1,1,27.88,83,6.0032,6,2012-08-09 03:00:00,3,9,8,2012,3,0,3,2314.04,3,0,6.0032,83.64,0,0
17/11/11 9:00,4,0,1,2,14.02601582,62,21.44869109,201,2011-11-17 09:00:00,9,17,11,2011,3,0,18,869.61298084,9,0,42.89738218,126.23414238,1,0
7/3/11 0:00,1,0,1,3,8.2,100,22.0028,4,2011-03-07 00:00:00,0,7,3,2011,0,0,0,819.9999999999999,0,0,66.0084,0.0,0,0
3/5/12 20:00,2,0,1,1,27.0312478,73,13.56700184,435,2012-05-03 20:00:00,20,3,5,2012,3,0,20,1973.2810894,20,0,13.56700184,540.624956,0,0
17/3/12 22:00,1,0,0,1,22.14,68,0.0,211,2012-03-17 22:00:00,22,17,3,2012,5,1,22,1505.52,0,22,0.0,487.08000000000004,0,0
14/2/11 20:00,1,0,1,1,14.76,46,31.0009,70,2011-02-14 20:00:00,20,14,2,2011,0,0,20,678.96,20,0,31.0009,295.2,0,0
10/7/12 5:00,3,0,1,1,27.6652567,84,9.211410284,59,2012-07-10 05:00:00,5,10,7,2012,1,0,5,2323.8815628,5,0,9.211410284,138.3262835,0,0
16/7/12 3:00,3,0,1,1,27.88,79,6.0032,6,2012-07-16 03:00:00,3,16,7,2012,0,0,3,2202.52,3,0,6.0032,83.64,0,0
14/2/12 13:00,1,0,1,2,14.76,40,16.9979,173,2012-02-14 13:00:00,13,14,2,2012,1,0,26,590.4,13,0,33.9958,191.88,0,0
5/7/12 10:00,3,0,1,1,35.26,44,23.9994,186,2012-07-05 10:00:00,10,5,7,2012,3,0,10,1551.4399999999998,10,0,23.9994,352.59999999999997,0,0
15/11/12 10:00,4,0,1,2,13.12,66,8.9981,153,2012-11-15 10:00:00,10,15,11,2012,3,0,20,865.92,10,0,17.9962,131.2,0,0
15/5/12 9:00,2,0,1,2,23.78,88,6.0032,355,2012-05-15 09:00:00,9,15,5,2012,1,0,18,2092.6400000000003,9,0,12.0064,214.02,1,0
3/1/12 23:00,1,0,1,1,3.800958061,46,26.46737357,1,2012-01-03 23:00:00,23,3,1,2012,1,0,23,174.84407080600002,23,0,26.46737357,87.42203540300001,0,0
4/6/12 3:00,2,0,1,2,22.96,60,11.0014,5,2012-06-04 03:00:00,3,4,6,2012,0,0,6,1377.6000000000001,3,0,22.0028,68.88,0,0
1/11/11 4:00,4,0,1,1,13.94,81,15.0013,8,2011-11-01 04:00:00,4,1,11,2011,1,0,4,1129.1399999999999,4,0,15.0013,55.76,0,0
19/1/12 8:00,1,0,1,1,4.92,54,7.0015,423,2012-01-19 08:00:00,8,19,1,2012,3,0,8,265.68,8,0,7.0015,39.36,1,0
19/8/11 19:00,3,0,1,3,25.95579061,71,31.57961017,162,2011-08-19 19:00:00,19,19,8,2011,4,0,57,1842.86113331,19,0,94.73883051,493.16002159000004,0,1
12/8/11 2:00,3,0,1,1,25.42,57,12.998,15,2011-08-12 02:00:00,2,12,8,2011,4,0,2,1448.94,2,0,12.998,50.84,0,0
6/2/11 14:00,1,0,0,1,14.77471656,48,5.430155208,146,2011-02-06 14:00:00,14,6,2,2011,6,1,14,709.18639488,0,14,5.430155208,206.84603184,0,0
11/3/12 14:00,1,0,0,1,18.86,31,19.0012,501,2012-03-11 14:00:00,14,11,3,2012,6,1,14,584.66,0,14,19.0012,264.03999999999996,0,0
1/11/11 8:00,4,0,1,1,15.76265471,67,16.58665136,434,2011-11-01 08:00:00,8,1,11,2011,1,0,8,1056.09786557,8,0,16.58665136,126.10123768,1,0
10/9/12 19:00,3,0,1,1,25.42,38,19.9995,633,2012-09-10 19:00:00,19,10,9,2012,0,0,19,965.96,19,0,19.9995,482.98,0,1
6/5/11 21:00,2,0,1,1,19.68,67,8.9981,152,2011-05-06 21:00:00,21,6,5,2011,4,0,21,1318.56,21,0,8.9981,413.28,0,0
14/3/11 6:00,1,0,1,1,9.752413723,69,9.266373912,14,2011-03-14 06:00:00,6,14,3,2011,0,0,6,672.916546887,6,0,9.266373912,58.514482338,0,0
3/4/11 10:00,2,0,0,1,15.86229028,41,26.84643507,237,2011-04-03 10:00:00,10,3,4,2011,6,1,10,650.35390148,0,10,26.84643507,158.6229028,0,0
2/4/11 5:00,2,0,0,2,9.84,75,11.0014,5,2011-04-02 05:00:00,5,2,4,2011,5,1,10,738.0,0,5,22.0028,49.2,0,0
14/6/11 8:00,2,0,1,1,23.78,49,26.0027,486,2011-06-14 08:00:00,8,14,6,2011,1,0,8,1165.22,8,0,26.0027,190.24,1,0
8/2/11 22:00,1,0,1,1,4.92,33,23.9994,29,2011-02-08 22:00:00,22,8,2,2011,1,0,22,162.35999999999999,22,0,23.9994,108.24,0,0
10/3/11 13:00,1,0,1,3,17.22,0,15.0013,12,2011-03-10 13:00:00,13,10,3,2011,3,0,39,0.0,13,0,45.0039,223.85999999999999,0,0
8/5/12 18:00,2,0,1,2,26.24,69,19.0012,710,2012-05-08 18:00:00,18,8,5,2012,1,0,36,1810.56,18,0,38.0024,472.32,0,1
17/4/11 21:00,2,0,0,1,20.5,42,12.998,83,2011-04-17 21:00:00,21,17,4,2011,6,1,21,861.0,0,21,12.998,430.5,0,0
4/6/12 20:00,2,0,1,1,24.6,40,23.9994,461,2012-06-04 20:00:00,20,4,6,2012,0,0,20,984.0,20,0,23.9994,492.0,0,0
13/12/11 15:00,4,0,1,1,16.4,35,16.9979,151,2011-12-13 15:00:00,15,13,12,2011,1,0,15,574.0,15,0,16.9979,245.99999999999997,0,0
5/10/11 3:00,4,0,1,1,18.86,82,7.0015,6,2011-10-05 03:00:00,3,5,10,2011,2,0,3,1546.52,3,0,7.0015,56.58,0,0
13/4/11 3:00,2,0,1,3,16.45291516,93,22.1066954,10,2011-04-13 03:00:00,3,13,4,2011,2,0,9,1530.12110988,3,0,66.32008619999999,49.358745479999996,0,0
12/6/11 20:00,2,0,0,1,27.06,83,11.0014,206,2011-06-12 20:00:00,20,12,6,2011,6,1,20,2245.98,0,20,11.0014,541.1999999999999,0,0
2/3/11 18:00,1,0,1,1,18.86,23,32.9975,201,2011-03-02 18:00:00,18,2,3,2011,2,0,18,433.78,18,0,32.9975,339.48,0,1
3/12/11 1:00,4,0,0,1,10.66,65,12.998,71,2011-12-03 01:00:00,1,3,12,2011,5,1,1,692.9,0,1,12.998,10.66,0,0
2/1/11 15:00,1,0,0,3,13.94,81,11.0014,74,2011-01-02 15:00:00,15,2,1,2011,6,1,45,1129.1399999999999,0,15,33.0042,209.1,0,0
17/3/12 11:00,1,0,0,2,21.00735861,77,7.650292248,561,2012-03-17 11:00:00,11,17,3,2012,5,1,22,1617.56661297,0,11,15.300584496,231.08094471,0,0
14/5/12 9:00,2,0,1,3,22.14,88,19.0012,110,2012-05-14 09:00:00,9,14,5,2012,0,0,27,1948.3200000000002,9,0,57.003600000000006,199.26,1,0
6/4/12 5:00,2,0,1,1,13.12,53,22.0028,23,2012-04-06 05:00:00,5,6,4,2012,4,0,5,695.36,5,0,22.0028,65.6,0,0
17/8/12 10:00,3,0,1,1,30.34,55,11.0014,231,2012-08-17 10:00:00,10,17,8,2012,4,0,10,1668.7,10,0,11.0014,303.4,0,0
12/8/11 12:00,3,0,1,1,32.8,27,0.0,222,2011-08-12 12:00:00,12,12,8,2011,4,0,12,885.5999999999999,12,0,0.0,393.59999999999997,0,0
7/11/12 19:00,4,0,1,2,11.85042809,55,19.74287436,322,2012-11-07 19:00:00,19,7,11,2012,2,0,38,651.77354495,19,0,39.48574872,225.15813371,0,1
13/9/12 16:00,3,0,1,1,29.52,39,6.0032,491,2012-09-13 16:00:00,16,13,9,2012,3,0,16,1151.28,16,0,6.0032,472.32,0,0
16/6/11 9:00,2,0,1,2,25.42,65,12.998,261,2011-06-16 09:00:00,9,16,6,2011,3,0,18,1652.3000000000002,9,0,25.996,228.78000000000003,1,0
19/2/12 15:00,1,0,0,2,12.3,49,12.998,253,2012-02-19 15:00:00,15,19,2,2012,6,1,30,602.7,0,15,25.996,184.5,0,0
6/3/11 18:00,1,0,0,3,13.12,100,23.9994,23,2011-03-06 18:00:00,18,6,3,2011,6,1,54,1312.0,0,18,71.9982,236.16,0,1
13/2/12 0:00,1,0,1,1,5.74,46,15.0013,9,2012-02-13 00:00:00,0,13,2,2012,0,0,0,264.04,0,0,15.0013,0.0,0,0
12/11/12 3:00,4,1,0,1,16.4,76,8.9981,4,2012-11-12 03:00:00,3,12,11,2012,0,0,3,1246.3999999999999,0,0,8.9981,49.199999999999996,0,0
7/7/11 6:00,3,0,1,2,26.24,89,8.9981,118,2011-07-07 06:00:00,6,7,7,2011,3,0,12,2335.3599999999997,6,0,17.9962,157.44,0,0
7/8/12 3:00,3,0,1,1,28.7,84,0.0,6,2012-08-07 03:00:00,3,7,8,2012,1,0,3,2410.7999999999997,3,0,0.0,86.1,0,0
6/2/12 8:00,1,0,1,1,6.56,86,8.9981,444,2012-02-06 08:00:00,8,6,2,2012,0,0,8,564.16,8,0,8.9981,52.48,1,0
12/7/11 10:00,3,0,1,1,33.62,52,11.0014,123,2011-07-12 10:00:00,10,12,7,2011,1,0,10,1748.2399999999998,10,0,11.0014,336.2,0,0
5/7/12 21:00,3,0,1,1,34.44,47,12.998,323,2012-07-05 21:00:00,21,5,7,2012,3,0,21,1618.6799999999998,21,0,12.998,723.24,0,0
12/4/11 18:00,2,0,1,3,18.04,77,15.0013,224,2011-04-12 18:00:00,18,12,4,2011,1,0,54,1389.08,18,0,45.0039,324.71999999999997,0,1
17/10/11 0:00,4,0,1,1,22.14,56,22.0028,37,2011-10-17 00:00:00,0,17,10,2011,0,0,0,1239.8400000000001,0,0,22.0028,0.0,0,0
9/9/12 10:00,3,0,0,1,26.24,57,19.9995,495,2012-09-09 10:00:00,10,9,9,2012,6,1,10,1495.6799999999998,0,10,19.9995,262.4,0,0
16/2/11 7:00,1,0,1,2,8.2,55,15.0013,108,2011-02-16 07:00:00,7,16,2,2011,2,0,14,450.99999999999994,7,0,30.0026,57.39999999999999,1,0
18/3/12 22:00,1,0,0,1,20.5,77,7.0015,100,2012-03-18 22:00:00,22,18,3,2012,6,1,22,1578.5,0,22,7.0015,451.0,0,0
18/11/11 9:00,4,0,1,1,10.66,41,12.998,213,2011-11-18 09:00:00,9,18,11,2011,4,0,9,437.06,9,0,12.998,95.94,1,0
15/3/11 18:00,1,0,1,2,14.76,62,19.9995,225,2011-03-15 18:00:00,18,15,3,2011,1,0,36,915.12,18,0,39.999,265.68,0,1
16/8/12 5:00,3,0,1,1,24.6,78,11.0014,37,2012-08-16 05:00:00,5,16,8,2012,3,0,5,1918.8000000000002,5,0,11.0014,123.0,0,0
17/1/12 16:00,1,0,1,1,18.86,63,36.9974,219,2012-01-17 16:00:00,16,17,1,2012,1,0,16,1188.18,16,0,36.9974,301.76,0,0
5/12/11 10:00,4,0,1,2,14.76,87,6.0032,87,2011-12-05 10:00:00,10,5,12,2011,0,0,20,1284.12,10,0,12.0064,147.6,0,0
19/2/11 22:00,1,0,0,1,12.3,28,32.9975,44,2011-02-19 22:00:00,22,19,2,2011,5,1,22,344.40000000000003,0,22,32.9975,270.6,0,0
4/7/12 20:00,3,1,0,1,35.26,47,15.0013,551,2012-07-04 20:00:00,20,4,7,2012,2,0,20,1657.2199999999998,0,0,15.0013,705.1999999999999,0,0
16/9/11 13:00,3,0,1,2,21.74102274,44,0.176911504,191,2011-09-16 13:00:00,13,16,9,2011,4,0,26,956.6050005599999,13,0,0.353823008,282.63329561999996,0,0
16/5/12 14:00,2,0,1,1,29.52,42,6.0032,263,2012-05-16 14:00:00,14,16,5,2012,2,0,14,1239.84,14,0,6.0032,413.28,0,0
17/10/11 7:00,4,0,1,2,20.5,55,11.0014,309,2011-10-17 07:00:00,7,17,10,2011,0,0,14,1127.5,7,0,22.0028,143.5,1,0
11/1/11 7:00,1,0,1,2,6.56,55,0.0,99,2011-01-11 07:00:00,7,11,1,2011,1,0,14,360.79999999999995,7,0,0.0,45.919999999999995,1,0
3/11/12 8:00,4,0,0,2,13.94,46,19.9995,142,2012-11-03 08:00:00,8,3,11,2012,5,1,16,641.24,0,8,39.999,111.52,1,0
13/6/11 5:00,2,0,1,1,22.14,64,26.0027,29,2011-06-13 05:00:00,5,13,6,2011,0,0,5,1416.96,5,0,26.0027,110.7,0,0
16/8/12 12:00,3,0,1,1,32.8,33,7.0015,343,2012-08-16 12:00:00,12,16,8,2012,3,0,12,1082.3999999999999,12,0,7.0015,393.59999999999997,0,0
4/11/12 5:00,4,0,0,1,10.66,65,7.0015,5,2012-11-04 05:00:00,5,4,11,2012,6,1,5,692.9,0,5,7.0015,53.3,0,0
18/2/11 9:00,1,0,1,2,17.22,77,12.998,169,2011-02-18 09:00:00,9,18,2,2011,4,0,18,1325.9399999999998,9,0,25.996,154.98,1,0
13/3/12 20:00,1,0,1,1,24.6,49,11.0014,351,2012-03-13 20:00:00,20,13,3,2012,1,0,20,1205.4,20,0,11.0014,492.0,0,0
1/7/12 5:00,3,0,0,1,27.88,79,7.0015,10,2012-07-01 05:00:00,5,1,7,2012,6,1,5,2202.52,0,5,7.0015,139.4,0,0
13/5/12 14:00,2,0,0,1,28.7,48,8.9981,552,2012-05-13 14:00:00,14,13,5,2012,6,1,14,1377.6,0,14,8.9981,401.8,0,0
2/9/12 7:00,3,0,0,1,27.01051665,94,6.571334029,31,2012-09-02 07:00:00,7,2,9,2012,6,1,7,2538.9885651,0,7,6.571334029,189.07361655,1,0
4/7/12 18:00,3,1,0,1,36.9,42,12.998,430,2012-07-04 18:00:00,18,4,7,2012,2,0,18,1549.8,0,0,12.998,664.1999999999999,0,1
12/8/11 7:00,3,0,1,1,25.87537205,44,11.04806836,271,2011-08-12 07:00:00,7,12,8,2011,4,0,7,1138.5163702,7,0,11.04806836,181.12760434999998,1,0
4/4/12 20:00,2,0,1,1,26.24,27,15.0013,372,2012-04-04 20:00:00,20,4,4,2012,2,0,20,708.4799999999999,20,0,15.0013,524.8,0,0
10/12/12 13:00,4,0,1,3,18.04,100,15.0013,220,2012-12-10 13:00:00,13,10,12,2012,0,0,39,1804.0,13,0,45.0039,234.51999999999998,0,0
9/8/12 20:00,3,0,1,1,28.7,54,19.0012,478,2012-08-09 20:00:00,20,9,8,2012,3,0,20,1549.8,20,0,19.0012,574.0,0,0
4/1/11 7:00,1,0,1,1,4.92,74,8.9981,94,2011-01-04 07:00:00,7,4,1,2011,1,0,7,364.08,7,0,8.9981,34.44,1,0
4/5/11 21:00,2,0,1,1,16.4,62,11.0014,150,2011-05-04 21:00:00,21,4,5,2011,2,0,21,1016.8,21,0,11.0014,344.4,0,0
17/9/12 7:00,3,0,1,1,21.2931386,75,0.0,478,2012-09-17 07:00:00,7,17,9,2012,0,0,7,1596.985395,7,0,0.0,149.0519702,1,0
7/11/12 21:00,4,0,1,2,13.12,49,19.9995,126,2012-11-07 21:00:00,21,7,11,2012,2,0,42,642.88,21,0,39.999,275.52,0,0
7/3/11 11:00,1,0,1,1,10.66,48,30.0026,60,2011-03-07 11:00:00,11,7,3,2011,0,0,11,511.68,11,0,30.0026,117.26,0,0
11/8/11 18:00,3,0,1,1,31.98,29,6.0032,571,2011-08-11 18:00:00,18,11,8,2011,3,0,18,927.42,18,0,6.0032,575.64,0,1
9/7/12 3:00,3,0,1,3,28.7,89,12.998,5,2012-07-09 03:00:00,3,9,7,2012,0,0,9,2554.2999999999997,3,0,38.994,86.1,0,0
15/11/11 4:00,4,0,1,1,22.96,64,19.9995,7,2011-11-15 04:00:00,4,15,11,2011,1,0,4,1469.44,4,0,19.9995,91.84,0,0
12/9/12 8:00,3,0,1,1,24.36115202,61,7.904491521,762,2012-09-12 08:00:00,8,12,9,2012,2,0,8,1486.03027322,8,0,7.904491521,194.88921616,1,0
10/4/11 0:00,2,0,0,2,15.58,87,6.0032,53,2011-04-10 00:00:00,0,10,4,2011,6,1,0,1355.46,0,0,12.0064,0.0,0,0
11/7/12 7:00,3,0,1,2,27.06,83,7.0015,497,2012-07-11 07:00:00,7,11,7,2012,2,0,14,2245.98,7,0,14.003,189.42,1,0
12/6/11 3:00,2,0,0,1,26.24,89,19.0012,28,2011-06-12 03:00:00,3,12,6,2011,6,1,3,2335.3599999999997,0,3,19.0012,78.72,0,0
5/6/12 13:00,2,0,1,2,24.6,46,11.0014,267,2012-06-05 13:00:00,13,5,6,2012,1,0,26,1131.6000000000001,13,0,22.0028,319.8,0,0
11/10/12 18:00,4,0,1,1,18.86,44,11.0014,692,2012-10-11 18:00:00,18,11,10,2012,3,0,18,829.8399999999999,18,0,11.0014,339.48,0,1
1/4/12 20:00,2,0,0,2,20.5,59,15.0013,232,2012-04-01 20:00:00,20,1,4,2012,6,1,40,1209.5,0,20,30.0026,410.0,0,0
15/4/11 4:00,2,1,0,1,15.58,82,6.0032,3,2011-04-15 04:00:00,4,15,4,2011,4,0,4,1277.56,0,0,6.0032,62.32,0,0
3/12/12 10:00,4,0,1,1,18.04,77,8.9981,136,2012-12-03 10:00:00,10,3,12,2012,0,0,10,1389.08,10,0,8.9981,180.39999999999998,0,0
11/12/12 13:00,4,0,1,2,15.58,50,15.0013,254,2012-12-11 13:00:00,13,11,12,2012,1,0,26,779.0,13,0,30.0026,202.54,0,0
13/12/11 6:00,4,0,1,1,8.2,80,0.0,92,2011-12-13 06:00:00,6,13,12,2011,1,0,6,656.0,6,0,0.0,49.199999999999996,0,0
1/9/11 22:00,3,0,1,2,27.06,57,15.0013,179,2011-09-01 22:00:00,22,1,9,2011,3,0,44,1542.4199999999998,22,0,30.0026,595.3199999999999,0,0
16/12/11 19:00,4,0,1,2,13.12,45,15.0013,214,2011-12-16 19:00:00,19,16,12,2011,4,0,38,590.4,19,0,30.0026,249.27999999999997,0,1
13/4/11 23:00,2,0,1,1,16.4,71,8.9981,62,2011-04-13 23:00:00,23,13,4,2011,2,0,23,1164.3999999999999,23,0,8.9981,377.2,0,0
2/3/12 5:00,1,0,1,1,11.78218132,68,0.324372631,51,2012-03-02 05:00:00,5,2,3,2012,4,0,5,801.18832976,5,0,0.324372631,58.9109066,0,0
14/6/12 11:00,2,0,1,1,26.84890391,57,15.73920484,234,2012-06-14 11:00:00,11,14,6,2012,3,0,11,1530.38752287,11,0,15.73920484,295.33794301,0,0
13/7/11 6:00,3,0,1,1,30.34,58,11.0014,121,2011-07-13 06:00:00,6,13,7,2011,2,0,6,1759.72,6,0,11.0014,182.04,0,0
5/7/12 1:00,3,0,1,1,30.34,51,19.0012,30,2012-07-05 01:00:00,1,5,7,2012,3,0,1,1547.34,1,0,19.0012,30.34,0,0
3/11/12 20:00,4,0,0,1,13.94,53,8.9981,181,2012-11-03 20:00:00,20,3,11,2012,5,1,20,738.8199999999999,0,20,8.9981,278.8,0,0
13/9/11 13:00,3,0,1,1,30.34,51,19.0012,184,2011-09-13 13:00:00,13,13,9,2011,1,0,13,1547.34,13,0,19.0012,394.42,0,0
19/11/11 18:00,4,0,0,1,15.58,46,8.9981,208,2011-11-19 18:00:00,18,19,11,2011,5,1,18,716.68,0,18,8.9981,280.44,0,1
10/11/12 17:00,4,0,0,1,20.5,45,12.998,501,2012-11-10 17:00:00,17,10,11,2012,5,1,17,922.5,0,17,12.998,348.5,0,1
6/11/12 4:00,4,0,1,1,6.645409706,69,7.142783384,1,2012-11-06 04:00:00,4,6,11,2012,1,0,4,458.53326971399997,4,0,7.142783384,26.581638824,0,0
19/9/12 3:00,3,0,1,2,21.32,63,16.9979,5,2012-09-19 03:00:00,3,19,9,2012,2,0,6,1343.16,3,0,33.9958,63.96,0,0
16/2/11 22:00,1,0,1,1,13.94,53,12.998,73,2011-02-16 22:00:00,22,16,2,2011,2,0,22,738.8199999999999,22,0,12.998,306.68,0,0
8/4/12 20:00,2,0,0,1,22.96,28,27.9993,211,2012-04-08 20:00:00,20,8,4,2012,6,1,20,642.88,0,20,27.9993,459.20000000000005,0,0
8/1/11 6:00,1,0,0,2,6.56,74,11.0014,2,2011-01-08 06:00:00,6,8,1,2011,5,1,12,485.44,0,6,22.0028,39.36,0,0
8/5/11 22:00,2,0,0,1,20.5,88,6.0032,115,2011-05-08 22:00:00,22,8,5,2011,6,1,22,1804.0,0,22,6.0032,451.0,0,0
1/8/12 9:00,3,0,1,2,27.88,74,6.0032,350,2012-08-01 09:00:00,9,1,8,2012,2,0,18,2063.12,9,0,12.0064,250.92,1,0
14/8/12 4:00,3,0,1,2,27.88,83,12.998,5,2012-08-14 04:00:00,4,14,8,2012,1,0,8,2314.04,4,0,25.996,111.52,0,0
13/11/12 22:00,4,0,1,1,10.66,56,22.0028,135,2012-11-13 22:00:00,22,13,11,2012,1,0,22,596.96,22,0,22.0028,234.52,0,0
12/8/12 2:00,3,0,0,1,26.24,69,8.9981,86,2012-08-12 02:00:00,2,12,8,2012,6,1,2,1810.56,0,2,8.9981,52.48,0,0
5/12/11 0:00,4,0,1,1,13.12,87,6.0032,24,2011-12-05 00:00:00,0,5,12,2011,0,0,0,1141.4399999999998,0,0,6.0032,0.0,0,0
4/4/12 14:00,2,0,1,2,25.42,46,12.998,258,2012-04-04 14:00:00,14,4,4,2012,2,0,28,1169.3200000000002,14,0,25.996,355.88,0,0
15/12/12 0:00,4,0,0,1,12.3,70,0.0,94,2012-12-15 00:00:00,0,15,12,2012,5,1,0,861.0,0,0,0.0,0.0,0,0
2/12/12 20:00,4,0,0,2,17.22,82,12.998,154,2012-12-02 20:00:00,20,2,12,2012,6,1,40,1412.04,0,20,25.996,344.4,0,0
9/10/12 22:00,4,0,1,2,19.68,77,6.0032,162,2012-10-09 22:00:00,22,9,10,2012,1,0,44,1515.36,22,0,12.0064,432.96,0,0
4/3/11 17:00,1,0,1,2,14.76,50,16.9979,228,2011-03-04 17:00:00,17,4,3,2011,4,0,34,738.0,17,0,33.9958,250.92,0,1
19/10/12 11:00,4,0,1,1,24.6,83,12.998,252,2012-10-19 11:00:00,11,19,10,2012,4,0,11,2041.8000000000002,11,0,12.998,270.6,0,0
2/3/12 16:00,1,0,1,3,16.4,58,19.9995,50,2012-03-02 16:00:00,16,2,3,2012,4,0,48,951.1999999999999,16,0,59.99850000000001,262.4,0,0
3/8/12 8:00,3,0,1,1,29.52,70,8.9981,668,2012-08-03 08:00:00,8,3,8,2012,4,0,8,2066.4,8,0,8.9981,236.16,1,0
5/2/11 11:00,1,0,0,3,9.02,100,8.9981,47,2011-02-05 11:00:00,11,5,2,2011,5,1,33,902.0,0,11,26.994300000000003,99.22,0,0
13/9/11 10:00,3,0,1,1,27.88,69,8.9981,135,2011-09-13 10:00:00,10,13,9,2011,1,0,10,1923.72,10,0,8.9981,278.8,0,0
17/12/11 18:00,4,0,0,1,10.66,48,26.0027,157,2011-12-17 18:00:00,18,17,12,2011,5,1,18,511.68,0,18,26.0027,191.88,0,1
7/6/11 11:00,2,0,1,2,29.31168254,51,16.03937652,183,2011-06-07 11:00:00,11,7,6,2011,1,0,22,1494.89580954,11,0,32.07875304,322.42850794,0,0
13/12/12 18:00,4,0,1,1,13.12,42,7.0015,466,2012-12-13 18:00:00,18,13,12,2012,3,0,18,551.04,18,0,7.0015,236.16,0,1
2/1/12 15:00,1,1,0,1,11.48,38,30.0026,168,2012-01-02 15:00:00,15,2,1,2012,0,0,15,436.24,0,0,30.0026,172.20000000000002,0,0
16/9/11 7:00,3,0,1,1,16.4,71,19.0012,299,2011-09-16 07:00:00,7,16,9,2011,4,0,7,1164.3999999999999,7,0,19.0012,114.79999999999998,1,0
4/5/12 1:00,2,0,1,1,24.6,78,7.0015,48,2012-05-04 01:00:00,1,4,5,2012,4,0,1,1918.8000000000002,1,0,7.0015,24.6,0,0
15/11/12 4:00,4,0,1,2,11.58269193,65,8.090078609,9,2012-11-15 04:00:00,4,15,11,2012,3,0,8,752.87497545,4,0,16.180157218,46.33076772,0,0
6/4/12 15:00,2,0,1,1,20.5,27,19.0012,537,2012-04-06 15:00:00,15,6,4,2012,4,0,15,553.5,15,0,19.0012,307.5,0,0
15/5/11 11:00,2,0,0,1,24.6,78,15.0013,322,2011-05-15 11:00:00,11,15,5,2011,6,1,11,1918.8000000000002,0,11,15.0013,270.6,0,0
8/2/11 4:00,1,0,1,1,10.66,93,11.0014,3,2011-02-08 04:00:00,4,8,2,2011,1,0,4,991.38,4,0,11.0014,42.64,0,0
18/3/11 22:00,1,0,1,1,25.42,50,11.0014,118,2011-03-18 22:00:00,22,18,3,2011,4,0,22,1271.0,22,0,11.0014,559.24,0,0
10/9/12 10:00,3,0,1,1,25.42,50,19.0012,210,2012-09-10 10:00:00,10,10,9,2012,0,0,10,1271.0,10,0,19.0012,254.20000000000002,0,0
5/5/12 5:00,2,0,0,1,22.96,88,6.0032,22,2012-05-05 05:00:00,5,5,5,2012,5,1,5,2020.48,0,5,6.0032,114.80000000000001,0,0
12/3/11 18:00,1,0,0,1,17.22,54,11.0014,145,2011-03-12 18:00:00,18,12,3,2011,5,1,18,929.8799999999999,0,18,11.0014,309.96,0,1
7/9/11 7:00,3,0,1,3,24.6,88,6.0032,86,2011-09-07 07:00:00,7,7,9,2011,2,0,21,2164.8,7,0,18.0096,172.20000000000002,1,0
13/1/12 9:00,1,0,1,1,9.02,47,26.0027,214,2012-01-13 09:00:00,9,13,1,2012,4,0,9,423.94,9,0,26.0027,81.17999999999999,1,0
17/9/11 7:00,3,0,0,2,18.13454573,77,13.31419298,39,2011-09-17 07:00:00,7,17,9,2011,5,1,14,1396.36002121,0,7,26.62838596,126.94182011,1,0
6/7/12 22:00,3,0,1,1,32.8,55,12.998,288,2012-07-06 22:00:00,22,6,7,2012,4,0,22,1803.9999999999998,22,0,12.998,721.5999999999999,0,0
10/8/11 9:00,3,0,1,1,31.16,48,15.0013,180,2011-08-10 09:00:00,9,10,8,2011,2,0,9,1495.68,9,0,15.0013,280.44,1,0
18/10/12 9:00,4,0,1,2,20.5,77,11.0014,387,2012-10-18 09:00:00,9,18,10,2012,3,0,18,1578.5,9,0,22.0028,184.5,1,0
2/4/11 1:00,2,0,0,1,10.66,65,8.9981,32,2011-04-02 01:00:00,1,2,4,2011,5,1,1,692.9,0,1,8.9981,10.66,0,0
14/7/11 20:00,3,0,1,1,28.7,42,15.0013,348,2011-07-14 20:00:00,20,14,7,2011,3,0,20,1205.3999999999999,20,0,15.0013,574.0,0,0
13/12/12 22:00,4,0,1,1,10.66,60,6.0032,148,2012-12-13 22:00:00,22,13,12,2012,3,0,22,639.6,22,0,6.0032,234.52,0,0
19/4/12 17:00,2,0,1,1,24.6,43,6.0032,748,2012-04-19 17:00:00,17,19,4,2012,3,0,17,1057.8,17,0,6.0032,418.20000000000005,0,1
13/5/12 22:00,2,0,0,2,25.42,61,11.0014,131,2012-05-13 22:00:00,22,13,5,2012,6,1,44,1550.6200000000001,0,22,22.0028,559.24,0,0
1/3/12 16:00,1,0,1,1,23.78,32,19.9995,361,2012-03-01 16:00:00,16,1,3,2012,3,0,16,760.96,16,0,19.9995,380.48,0,0
1/11/12 22:00,4,0,1,1,14.76,57,11.0014,202,2012-11-01 22:00:00,22,1,11,2012,3,0,22,841.3199999999999,22,0,11.0014,324.71999999999997,0,0
5/10/12 9:00,4,0,1,1,24.6,60,6.0032,384,2012-10-05 09:00:00,9,5,10,2012,4,0,9,1476.0,9,0,6.0032,221.4,1,0
15/10/11 1:00,4,0,0,1,18.86,55,16.9979,73,2011-10-15 01:00:00,1,15,10,2011,5,1,1,1037.3,0,1,16.9979,18.86,0,0
19/11/11 5:00,4,0,0,1,9.84,56,16.9979,2,2011-11-19 05:00:00,5,19,11,2011,5,1,5,551.04,0,5,16.9979,49.2,0,0
19/8/11 1:00,3,0,1,3,26.24,89,0.0,20,2011-08-19 01:00:00,1,19,8,2011,4,0,3,2335.3599999999997,1,0,0.0,26.24,0,0
10/10/12 19:00,4,0,1,2,22.96,46,39.0007,566,2012-10-10 19:00:00,19,10,10,2012,2,0,38,1056.16,19,0,78.0014,436.24,0,1
7/11/11 5:00,4,0,1,1,11.63542584,94,0.0,31,2011-11-07 05:00:00,5,7,11,2011,0,0,5,1093.73002896,5,0,0.0,58.177129199999996,0,0
2/10/11 0:00,4,0,0,3,14.76,93,19.9995,47,2011-10-02 00:00:00,0,2,10,2011,6,1,0,1372.68,0,0,59.99850000000001,0.0,0,0
5/5/12 4:00,2,0,0,1,22.96,88,7.0015,9,2012-05-05 04:00:00,4,5,5,2012,5,1,4,2020.48,0,4,7.0015,91.84,0,0
14/2/11 22:00,1,0,1,1,13.94,46,43.9989,45,2011-02-14 22:00:00,22,14,2,2011,0,0,22,641.24,22,0,43.9989,306.68,0,0
12/9/11 9:00,3,0,1,1,26.24,69,0.0,176,2011-09-12 09:00:00,9,12,9,2011,0,0,9,1810.56,9,0,0.0,236.16,1,0
4/3/12 6:00,1,0,0,2,12.3,52,19.9995,5,2012-03-04 06:00:00,6,4,3,2012,6,1,12,639.6,0,6,39.999,73.80000000000001,0,0
13/6/11 9:00,2,0,1,1,25.42,46,23.9994,224,2011-06-13 09:00:00,9,13,6,2011,0,0,9,1169.3200000000002,9,0,23.9994,228.78000000000003,1,0
10/6/11 3:00,2,0,1,1,27.88,69,11.0014,6,2011-06-10 03:00:00,3,10,6,2011,4,0,3,1923.72,3,0,11.0014,83.64,0,0
4/2/12 5:00,1,0,0,1,8.474836656,78,5.612968662,1,2012-02-04 05:00:00,5,4,2,2012,5,1,5,661.0372591680001,0,5,5.612968662,42.374183280000004,0,0
10/8/11 15:00,3,0,1,1,35.26,30,22.0028,194,2011-08-10 15:00:00,15,10,8,2011,2,0,15,1057.8,15,0,22.0028,528.9,0,0
6/9/12 20:00,3,0,1,1,27.06,78,15.0013,406,2012-09-06 20:00:00,20,6,9,2012,3,0,20,2110.68,20,0,15.0013,541.1999999999999,0,0
10/9/12 10:00,3,0,1,1,24.72071029,50,18.68614349,244,2012-09-10 10:00:00,10,10,9,2012,0,0,10,1236.0355144999999,10,0,18.68614349,247.2071029,0,0
17/12/11 17:00,4,0,0,1,12.9306599,49,14.80228945,157,2011-12-17 17:00:00,17,17,12,2011,5,1,17,633.6023351,0,17,14.80228945,219.8212183,0,1
14/10/12 12:00,4,0,0,1,25.42,46,22.0028,562,2012-10-14 12:00:00,12,14,10,2012,6,1,12,1169.3200000000002,0,12,22.0028,305.04,0,0
3/8/11 21:00,3,0,1,2,28.39531876,89,7.397889806,74,2011-08-03 21:00:00,21,3,8,2011,2,0,42,2527.18336964,21,0,14.795779612,596.30169396,0,0
4/4/12 20:00,2,0,1,1,26.38053219,27,14.32210279,407,2012-04-04 20:00:00,20,4,4,2012,2,0,20,712.27436913,20,0,14.32210279,527.6106438,0,0
7/6/12 1:00,2,0,1,1,21.32,77,11.0014,22,2012-06-07 01:00:00,1,7,6,2012,3,0,1,1641.64,1,0,11.0014,21.32,0,0
1/1/11 13:00,1,0,0,2,19.17768522,70,20.40120028,116,2011-01-01 13:00:00,13,1,1,2011,5,1,26,1342.4379654,0,13,40.80240056,249.30990786,0,0
17/5/11 17:00,2,0,1,1,25.42,65,27.9993,604,2011-05-17 17:00:00,17,17,5,2011,1,0,17,1652.3000000000002,17,0,27.9993,432.14000000000004,0,1
8/7/12 20:00,3,0,0,1,31.16,70,6.0032,285,2012-07-08 20:00:00,20,8,7,2012,6,1,20,2181.2,0,20,6.0032,623.2,0,0
11/10/12 2:00,4,0,1,1,17.22,50,8.9981,11,2012-10-11 02:00:00,2,11,10,2012,3,0,2,861.0,2,0,8.9981,34.44,0,0
8/9/11 22:00,3,0,1,3,25.42,100,6.0032,70,2011-09-08 22:00:00,22,8,9,2011,3,0,66,2542.0,22,0,18.0096,559.24,0,0
9/5/11 12:00,2,0,1,1,24.6,43,12.998,195,2011-05-09 12:00:00,12,9,5,2011,0,0,12,1057.8,12,0,12.998,295.20000000000005,0,0
8/7/12 4:00,3,0,0,1,31.98,66,7.0015,13,2012-07-08 04:00:00,4,8,7,2012,6,1,4,2110.68,0,4,7.0015,127.92,0,0
12/9/11 10:00,3,0,1,1,27.88,62,11.0014,129,2011-09-12 10:00:00,10,12,9,2011,0,0,10,1728.56,10,0,11.0014,278.8,0,0
2/7/12 10:00,3,0,1,1,33.60064902,41,16.93025589,154,2012-07-02 10:00:00,10,2,7,2012,0,0,10,1377.6266098199999,10,0,16.93025589,336.0064902,0,0
16/11/12 15:00,4,0,1,1,17.22,38,8.9981,267,2012-11-16 15:00:00,15,16,11,2012,4,0,15,654.3599999999999,15,0,8.9981,258.29999999999995,0,0
14/10/12 16:00,4,0,0,1,26.24,41,19.9995,581,2012-10-14 16:00:00,16,14,10,2012,6,1,16,1075.84,0,16,19.9995,419.84,0,0
12/8/11 14:00,3,0,1,1,32.8,29,12.998,186,2011-08-12 14:00:00,14,12,8,2011,4,0,14,951.1999999999999,14,0,12.998,459.19999999999993,0,0
2/11/12 5:00,4,0,1,2,13.12,66,11.0014,26,2012-11-02 05:00:00,5,2,11,2012,4,0,10,865.92,5,0,22.0028,65.6,0,0
11/2/11 22:00,1,0,1,1,8.2,64,6.0032,43,2011-02-11 22:00:00,22,11,2,2011,4,0,22,524.8,22,0,6.0032,180.39999999999998,0,0
3/4/12 2:00,2,0,1,1,14.76,53,11.0014,5,2012-04-03 02:00:00,2,3,4,2012,1,0,2,782.28,2,0,11.0014,29.52,0,0
12/4/12 19:00,2,0,1,1,18.86,31,19.9995,433,2012-04-12 19:00:00,19,12,4,2012,3,0,19,584.66,19,0,19.9995,358.34,0,1
2/1/11 21:00,1,0,0,1,10.66,44,22.0028,31,2011-01-02 21:00:00,21,2,1,2011,6,1,21,469.04,0,21,22.0028,223.86,0,0
12/10/11 22:00,4,0,1,3,22.14,94,6.0032,43,2011-10-12 22:00:00,22,12,10,2011,2,0,66,2081.16,22,0,18.0096,487.08000000000004,0,0
10/11/12 13:00,4,0,0,1,21.32,39,0.0,651,2012-11-10 13:00:00,13,10,11,2012,5,1,13,831.48,0,13,0.0,277.16,0,0
11/6/12 20:00,2,0,1,2,30.34,48,15.0013,394,2012-06-11 20:00:00,20,11,6,2012,0,0,40,1456.32,20,0,30.0026,606.8,0,0
13/1/12 2:00,1,0,1,1,16.4,76,23.9994,14,2012-01-13 02:00:00,2,13,1,2012,4,0,2,1246.3999999999999,2,0,23.9994,32.8,0,0
17/12/11 14:00,4,0,0,1,13.04105236,46,25.1365746,227,2011-12-17 14:00:00,14,17,12,2011,5,1,14,599.88840856,0,14,25.1365746,182.57473304,0,0
6/7/11 16:00,3,0,1,1,31.16,70,16.9979,275,2011-07-06 16:00:00,16,6,7,2011,2,0,16,2181.2,16,0,16.9979,498.56,0,0
2/12/11 17:00,4,0,1,1,17.48210981,39,1.853033654,413,2011-12-02 17:00:00,17,2,12,2011,4,0,17,681.80228259,17,0,1.853033654,297.19586677,0,1
17/8/12 16:00,3,0,1,2,34.44,32,30.0026,488,2012-08-17 16:00:00,16,17,8,2012,4,0,32,1102.08,16,0,60.0052,551.04,0,0
7/3/12 0:00,1,0,1,1,11.48,65,19.0012,15,2012-03-07 00:00:00,0,7,3,2012,2,0,0,746.2,0,0,19.0012,0.0,0,0
2/12/11 4:00,4,0,1,1,9.02,80,0.0,3,2011-12-02 04:00:00,4,2,12,2011,4,0,4,721.5999999999999,4,0,0.0,36.08,0,0
14/3/12 14:00,1,0,1,1,28.7,23,22.0028,224,2012-03-14 14:00:00,14,14,3,2012,2,0,14,660.1,14,0,22.0028,401.8,0,0
17/5/11 23:00,2,0,1,2,22.14,88,16.9979,56,2011-05-17 23:00:00,23,17,5,2011,1,0,46,1948.3200000000002,23,0,33.9958,509.22,0,0
6/10/11 12:00,4,0,1,1,22.96561545,46,5.877015532,215,2011-10-06 12:00:00,12,6,10,2011,3,0,12,1056.4183107000001,12,0,5.877015532,275.5873854,0,0
17/4/12 5:00,2,0,1,1,24.6,53,16.9979,30,2012-04-17 05:00:00,5,17,4,2012,1,0,5,1303.8000000000002,5,0,16.9979,123.0,0,0
13/11/12 6:00,4,0,1,3,13.12,81,31.0009,50,2012-11-13 06:00:00,6,13,11,2012,1,0,18,1062.72,6,0,93.0027,78.72,0,0
15/8/11 8:00,3,0,1,1,26.22106848,80,22.60809147,375,2011-08-15 08:00:00,8,15,8,2011,0,0,8,2097.6854783999997,8,0,22.60809147,209.76854784,1,0
6/3/12 3:00,1,0,1,1,7.38,51,19.0012,1,2012-03-06 03:00:00,3,6,3,2012,1,0,3,376.38,3,0,19.0012,22.14,0,0
6/7/11 6:00,3,0,1,1,28.7,79,6.0032,121,2011-07-06 06:00:00,6,6,7,2011,2,0,6,2267.2999999999997,6,0,6.0032,172.2,0,0
6/3/11 7:00,1,0,0,3,17.22,100,30.0026,5,2011-03-06 07:00:00,7,6,3,2011,6,1,21,1722.0,0,7,90.0078,120.53999999999999,1,0
17/6/12 23:00,2,0,0,1,23.78,64,12.998,108,2012-06-17 23:00:00,23,17,6,2012,6,1,23,1521.92,0,23,12.998,546.94,0,0
17/8/12 3:00,3,0,1,1,26.24,65,7.0015,6,2012-08-17 03:00:00,3,17,8,2012,4,0,3,1705.6,3,0,7.0015,78.72,0,0
9/6/12 19:00,2,0,0,1,32.8,29,11.0014,360,2012-06-09 19:00:00,19,9,6,2012,5,1,19,951.1999999999999,0,19,11.0014,623.1999999999999,0,1
9/9/12 0:00,3,0,0,2,22.96,73,12.998,124,2012-09-09 00:00:00,0,9,9,2012,6,1,0,1676.0800000000002,0,0,25.996,0.0,0,0
17/12/11 19:00,4,0,0,3,9.84,65,22.0028,106,2011-12-17 19:00:00,19,17,12,2011,5,1,57,639.6,0,19,66.0084,186.96,0,1
3/11/11 5:00,4,0,1,1,13.12,81,8.9981,28,2011-11-03 05:00:00,5,3,11,2011,3,0,5,1062.72,5,0,8.9981,65.6,0,0
15/4/11 12:00,2,1,0,1,21.32,55,19.0012,200,2011-04-15 12:00:00,12,15,4,2011,4,0,12,1172.6,0,0,19.0012,255.84,0,0
15/11/12 16:00,4,0,1,2,14.76,57,12.998,342,2012-11-15 16:00:00,16,15,11,2012,3,0,32,841.3199999999999,16,0,25.996,236.16,0,0
3/12/12 7:00,4,0,1,2,13.94,93,0.0,396,2012-12-03 07:00:00,7,3,12,2012,0,0,14,1296.4199999999998,7,0,0.0,97.58,1,0
6/11/12 10:00,4,0,1,1,12.3,49,12.998,230,2012-11-06 10:00:00,10,6,11,2012,1,0,10,602.7,10,0,12.998,123.0,0,0
1/11/11 1:00,4,0,1,1,14.76,81,8.9981,11,2011-11-01 01:00:00,1,1,11,2011,1,0,1,1195.56,1,0,8.9981,14.76,0,0
1/4/12 18:00,2,0,0,1,21.32,52,19.9995,432,2012-04-01 18:00:00,18,1,4,2012,6,1,18,1108.64,0,18,19.9995,383.76,0,1
17/10/11 14:00,4,0,1,1,23.78,49,12.998,166,2011-10-17 14:00:00,14,17,10,2011,0,0,14,1165.22,14,0,12.998,332.92,0,0
15/3/11 0:00,1,0,1,1,13.12,53,0.0,14,2011-03-15 00:00:00,0,15,3,2011,1,0,0,695.36,0,0,0.0,0.0,0,0
11/1/12 13:00,1,0,1,3,13.12,76,0.0,65,2012-01-11 13:00:00,13,11,1,2012,2,0,39,997.1199999999999,13,0,0.0,170.56,0,0
8/7/11 9:00,3,0,1,2,31.16,70,19.9995,241,2011-07-08 09:00:00,9,8,7,2011,4,0,18,2181.2,9,0,39.999,280.44,1,0
16/1/12 9:00,1,1,0,1,4.1,58,11.0014,96,2012-01-16 09:00:00,9,16,1,2012,0,0,9,237.79999999999998,0,0,11.0014,36.9,1,0
5/6/11 19:00,2,0,0,1,27.88,65,11.0014,357,2011-06-05 19:00:00,19,5,6,2011,6,1,19,1812.2,0,19,11.0014,529.72,0,1
14/4/12 18:00,2,0,0,2,25.10587218,34,13.24263431,503,2012-04-14 18:00:00,18,14,4,2012,5,1,36,853.59965412,0,18,26.48526862,451.90569924,0,1
4/5/12 5:00,2,0,1,1,22.96,88,12.998,24,2012-05-04 05:00:00,5,4,5,2012,4,0,5,2020.48,5,0,12.998,114.80000000000001,0,0
3/6/12 11:00,2,0,0,1,26.24,41,16.9979,511,2012-06-03 11:00:00,11,3,6,2012,6,1,11,1075.84,0,11,16.9979,288.64,0,0
8/8/11 5:00,3,0,1,1,28.7,79,6.0032,15,2011-08-08 05:00:00,5,8,8,2011,0,0,5,2267.2999999999997,5,0,6.0032,143.5,0,0
18/10/12 1:00,4,0,1,1,18.86,82,15.0013,14,2012-10-18 01:00:00,1,18,10,2012,3,0,1,1546.52,1,0,15.0013,18.86,0,0
10/12/11 12:00,4,0,0,1,13.12,45,27.9993,283,2011-12-10 12:00:00,12,10,12,2011,5,1,12,590.4,0,12,27.9993,157.44,0,0
10/4/11 10:00,2,0,0,2,16.4,87,0.0,150,2011-04-10 10:00:00,10,10,4,2011,6,1,20,1426.8,0,10,0.0,164.0,0,0
14/11/11 0:00,4,0,1,1,18.86,59,19.0012,30,2011-11-14 00:00:00,0,14,11,2011,0,0,0,1112.74,0,0,19.0012,0.0,0,0
6/5/12 8:00,2,0,0,2,20.5,88,8.9981,114,2012-05-06 08:00:00,8,6,5,2012,6,1,16,1804.0,0,8,17.9962,164.0,1,0
4/2/12 2:00,1,0,0,1,9.84,70,6.0032,44,2012-02-04 02:00:00,2,4,2,2012,5,1,2,688.8,0,2,6.0032,19.68,0,0
3/10/12 16:00,4,0,1,2,29.52,58,0.0,478,2012-10-03 16:00:00,16,3,10,2012,2,0,32,1712.16,16,0,0.0,472.32,0,0
5/4/12 16:00,2,0,1,1,20.5,31,12.998,402,2012-04-05 16:00:00,16,5,4,2012,3,0,16,635.5,16,0,12.998,328.0,0,0
6/5/12 4:00,2,0,0,3,21.32,83,11.0014,16,2012-05-06 04:00:00,4,6,5,2012,6,1,12,1769.56,0,4,33.0042,85.28,0,0
18/3/12 12:00,1,0,0,2,18.04,88,8.9981,503,2012-03-18 12:00:00,12,18,3,2012,6,1,24,1587.52,0,12,17.9962,216.48,0,0
8/12/11 2:00,4,0,1,1,11.48,65,15.0013,4,2011-12-08 02:00:00,2,8,12,2011,3,0,2,746.2,2,0,15.0013,22.96,0,0
11/6/11 15:00,2,0,0,1,33.62,49,7.0015,374,2011-06-11 15:00:00,15,11,6,2011,5,1,15,1647.3799999999999,0,15,7.0015,504.29999999999995,0,0
4/5/11 0:00,2,0,1,3,21.32,77,11.0014,27,2011-05-04 00:00:00,0,4,5,2011,2,0,0,1641.64,0,0,33.0042,0.0,0,0
6/6/12 3:00,2,0,1,1,18.86,82,0.0,8,2012-06-06 03:00:00,3,6,6,2012,2,0,3,1546.52,3,0,0.0,56.58,0,0
5/1/11 0:00,1,0,1,1,8.2,64,0.0,6,2011-01-05 00:00:00,0,5,1,2011,2,0,0,524.8,0,0,0.0,0.0,0,0
15/5/11 23:00,2,0,0,1,22.14,88,15.0013,69,2011-05-15 23:00:00,23,15,5,2011,6,1,23,1948.3200000000002,0,23,15.0013,509.22,0,0
7/5/11 7:00,2,0,0,1,19.68,59,0.0,40,2011-05-07 07:00:00,7,7,5,2011,5,1,7,1161.12,0,7,0.0,137.76,1,0
19/5/11 21:00,2,0,1,1,22.14,77,19.0012,209,2011-05-19 21:00:00,21,19,5,2011,3,0,21,1704.78,21,0,19.0012,464.94,0,0
1/10/11 16:00,4,0,0,2,16.4,76,19.9995,223,2011-10-01 16:00:00,16,1,10,2011,5,1,32,1246.3999999999999,0,16,39.999,262.4,0,0
15/8/11 2:00,3,0,1,2,24.6,83,0.0,3,2011-08-15 02:00:00,2,15,8,2011,0,0,4,2041.8000000000002,2,0,0.0,49.2,0,0
19/6/12 9:00,2,0,1,1,26.24,73,6.0032,328,2012-06-19 09:00:00,9,19,6,2012,1,0,9,1915.52,9,0,6.0032,236.16,1,0
8/3/11 15:00,1,0,1,2,16.09921457,20,1.007375283,107,2011-03-08 15:00:00,15,8,3,2011,1,0,30,321.9842914,15,0,2.014750566,241.48821855,0,0
14/5/11 6:00,2,0,0,2,20.5,88,7.0015,11,2011-05-14 06:00:00,6,14,5,2011,5,1,12,1804.0,0,6,14.003,123.0,0,0
11/6/12 20:00,2,0,1,2,30.26575722,49,12.11986336,407,2012-06-11 20:00:00,20,11,6,2012,0,0,40,1483.02210378,20,0,24.23972672,605.3151444,0,0
9/4/11 22:00,2,0,0,2,14.5126649,94,7.617114153,96,2011-04-09 22:00:00,22,9,4,2011,5,1,44,1364.1905006000002,0,22,15.234228306,319.27862780000004,0,0
6/5/11 6:00,2,0,1,1,14.76,81,6.0032,82,2011-05-06 06:00:00,6,6,5,2011,4,0,6,1195.56,6,0,6.0032,88.56,0,0
15/1/11 1:00,1,0,0,2,6.56,59,6.0032,20,2011-01-15 01:00:00,1,15,1,2011,5,1,2,387.03999999999996,0,1,12.0064,6.56,0,0
4/3/11 21:00,1,0,1,2,12.3,70,15.0013,70,2011-03-04 21:00:00,21,4,3,2011,4,0,42,861.0,21,0,30.0026,258.3,0,0
6/8/11 20:00,3,0,0,3,29.52,79,19.0012,137,2011-08-06 20:00:00,20,6,8,2011,5,1,60,2332.08,0,20,57.003600000000006,590.4,0,0
16/5/12 1:00,2,0,1,2,24.31169225,88,10.61872393,41,2012-05-16 01:00:00,1,16,5,2012,2,0,2,2139.428918,1,0,21.23744786,24.31169225,0,0
10/3/12 1:00,1,0,0,1,12.3,36,16.9979,51,2012-03-10 01:00:00,1,10,3,2012,5,1,1,442.8,0,1,16.9979,12.3,0,0
3/7/12 2:00,3,0,1,1,29.52,58,0.0,10,2012-07-03 02:00:00,2,3,7,2012,1,0,2,1712.16,2,0,0.0,59.04,0,0
3/8/12 7:00,3,0,1,1,28.7,74,7.0015,421,2012-08-03 07:00:00,7,3,8,2012,4,0,7,2123.7999999999997,7,0,7.0015,200.9,1,0
3/1/12 23:00,1,0,1,1,4.670677708,44,25.56721349,17,2012-01-03 23:00:00,23,3,1,2012,1,0,23,205.509819152,23,0,25.56721349,107.425587284,0,0
14/5/12 23:00,2,0,1,2,23.78,78,7.0015,75,2012-05-14 23:00:00,23,14,5,2012,0,0,46,1854.8400000000001,23,0,14.003,546.94,0,0
2/9/12 14:00,3,0,0,3,29.52,79,6.0032,457,2012-09-02 14:00:00,14,2,9,2012,6,1,42,2332.08,0,14,18.0096,413.28,0,0
14/2/12 14:00,1,0,1,1,16.4,40,15.0013,124,2012-02-14 14:00:00,14,14,2,2012,1,0,14,656.0,14,0,15.0013,229.59999999999997,0,0
6/8/11 17:00,3,0,0,3,29.30979913,78,9.720785921,183,2011-08-06 17:00:00,17,6,8,2011,5,1,51,2286.1643321399997,0,17,29.162357762999996,498.26658520999996,0,1
18/8/11 16:00,3,0,1,1,32.8,46,23.9994,245,2011-08-18 16:00:00,16,18,8,2011,3,0,16,1508.8,16,0,23.9994,524.8,0,0
18/2/11 0:00,1,0,1,1,18.04,72,19.0012,32,2011-02-18 00:00:00,0,18,2,2011,4,0,0,1298.8799999999999,0,0,19.0012,0.0,0,0
19/8/11 22:00,3,0,1,1,24.94245295,85,8.633241195,138,2011-08-19 22:00:00,22,19,8,2011,4,0,22,2120.10850075,22,0,8.633241195,548.7339649,0,0
3/12/11 11:00,4,0,0,1,13.30050032,58,5.642671883,267,2011-12-03 11:00:00,11,3,12,2011,5,1,11,771.4290185599999,0,11,5.642671883,146.30550352,0,0
1/8/11 12:00,3,0,1,1,36.9,33,16.9979,168,2011-08-01 12:00:00,12,1,8,2011,0,0,12,1217.7,12,0,16.9979,442.79999999999995,0,0
19/5/12 5:00,2,0,0,1,18.86,67,0.0,12,2012-05-19 05:00:00,5,19,5,2012,5,1,5,1263.62,0,5,0.0,94.3,0,0
7/4/12 7:00,2,0,0,1,13.12,33,19.0012,54,2012-04-07 07:00:00,7,7,4,2012,5,1,7,432.96,0,7,19.0012,91.83999999999999,1,0
10/3/11 11:00,1,0,1,3,16.4,0,16.9979,11,2011-03-10 11:00:00,11,10,3,2011,3,0,33,0.0,11,0,50.993700000000004,180.39999999999998,0,0
6/11/12 18:00,4,0,1,1,13.12,57,19.9995,497,2012-11-06 18:00:00,18,6,11,2012,1,0,18,747.8399999999999,18,0,19.9995,236.16,0,1
19/9/11 6:00,3,0,1,1,20.57338358,79,14.45237725,147,2011-09-19 06:00:00,6,19,9,2011,0,0,6,1625.2973028200001,6,0,14.45237725,123.44030148000002,0,0
8/11/11 18:00,4,0,1,1,19.68,55,8.9981,462,2011-11-08 18:00:00,18,8,11,2011,1,0,18,1082.4,18,0,8.9981,354.24,0,1
10/6/12 18:00,2,0,0,1,33.62,38,15.0013,490,2012-06-10 18:00:00,18,10,6,2012,6,1,18,1277.56,0,18,15.0013,605.16,0,1
2/12/11 1:00,4,0,1,1,9.84,75,0.0,15,2011-12-02 01:00:00,1,2,12,2011,4,0,1,738.0,1,0,0.0,9.84,0,0
19/1/11 21:00,1,0,1,1,13.12,49,27.9993,59,2011-01-19 21:00:00,21,19,1,2011,2,0,21,642.88,21,0,27.9993,275.52,0,0
13/8/12 18:00,3,0,1,1,31.16,52,19.0012,812,2012-08-13 18:00:00,18,13,8,2012,0,0,18,1620.32,18,0,19.0012,560.88,0,1
2/4/12 13:00,2,0,1,1,19.07686561,35,20.24821338,283,2012-04-02 13:00:00,13,2,4,2012,0,0,13,667.6902963499999,13,0,20.24821338,247.99925292999998,0,0
4/6/11 1:00,2,0,0,1,22.04725787,64,6.803541487,77,2011-06-04 01:00:00,1,4,6,2011,5,1,1,1411.02450368,0,1,6.803541487,22.04725787,0,0
13/7/11 16:00,3,0,1,2,27.06,89,0.0,141,2011-07-13 16:00:00,16,13,7,2011,2,0,32,2408.3399999999997,16,0,0.0,432.96,0,0
14/10/12 4:00,4,0,0,1,17.22,77,19.0012,12,2012-10-14 04:00:00,4,14,10,2012,6,1,4,1325.9399999999998,0,4,19.0012,68.88,0,0
17/8/11 2:00,3,0,1,1,27.06,69,0.0,6,2011-08-17 02:00:00,2,17,8,2011,2,0,2,1867.1399999999999,2,0,0.0,54.12,0,0
14/6/12 15:00,2,0,1,1,29.84172519,46,20.33290017,365,2012-06-14 15:00:00,15,14,6,2012,3,0,15,1372.71935874,15,0,20.33290017,447.62587785,0,0
9/4/11 13:00,2,0,0,2,14.76,81,0.0,222,2011-04-09 13:00:00,13,9,4,2011,5,1,26,1195.56,0,13,0.0,191.88,0,0
9/3/12 1:00,1,0,1,3,22.96,52,32.9975,26,2012-03-09 01:00:00,1,9,3,2012,4,0,3,1193.92,1,0,98.9925,22.96,0,0
19/7/12 21:00,3,0,1,3,27.06,89,16.9979,332,2012-07-19 21:00:00,21,19,7,2012,3,0,63,2408.3399999999997,21,0,50.993700000000004,568.26,0,0
6/1/12 6:00,1,0,1,2,9.02,73,7.0015,70,2012-01-06 06:00:00,6,6,1,2012,4,0,12,658.4599999999999,6,0,14.003,54.12,0,0
14/9/11 3:00,3,0,1,1,24.6,88,8.9981,8,2011-09-14 03:00:00,3,14,9,2011,2,0,3,2164.8,3,0,8.9981,73.80000000000001,0,0
3/5/11 14:00,2,0,1,2,28.7,58,35.0008,158,2011-05-03 14:00:00,14,3,5,2011,1,0,28,1664.6,14,0,70.0016,401.8,0,0
19/8/12 23:00,3,0,0,2,25.42,73,0.0,46,2012-08-19 23:00:00,23,19,8,2012,6,1,46,1855.66,0,23,0.0,584.6600000000001,0,0
16/12/11 7:00,4,0,1,2,15.58,46,19.9995,231,2011-12-16 07:00:00,7,16,12,2011,4,0,14,716.68,7,0,39.999,109.06,1,0
3/1/12 21:00,1,0,1,1,4.1,36,15.0013,68,2012-01-03 21:00:00,21,3,1,2012,1,0,21,147.6,21,0,15.0013,86.1,0,0
8/9/12 15:00,3,0,0,3,23.29929127,87,16.19206722,482,2012-09-08 15:00:00,15,8,9,2012,5,1,45,2027.03834049,0,15,48.576201659999995,349.48936905,0,0
10/6/12 7:00,2,0,0,1,24.6,78,7.0015,62,2012-06-10 07:00:00,7,10,6,2012,6,1,7,1918.8000000000002,0,7,7.0015,172.20000000000002,1,0
17/12/12 13:00,4,0,1,2,15.6674182,88,8.477625891,199,2012-12-17 13:00:00,13,17,12,2012,0,0,26,1378.7328016000001,13,0,16.955251782,203.6764366,0,0
4/4/12 7:00,2,0,1,2,18.04,62,0.0,366,2012-04-04 07:00:00,7,4,4,2012,2,0,14,1118.48,7,0,0.0,126.28,1,0
3/8/12 22:00,3,0,1,1,31.16,70,16.9979,202,2012-08-03 22:00:00,22,3,8,2012,4,0,22,2181.2,22,0,16.9979,685.52,0,0
7/8/12 23:00,3,0,1,1,29.52,79,0.0,138,2012-08-07 23:00:00,23,7,8,2012,1,0,23,2332.08,23,0,0.0,678.96,0,0
3/6/12 8:00,2,0,0,1,22.14,60,6.0032,140,2012-06-03 08:00:00,8,3,6,2012,6,1,8,1328.4,0,8,6.0032,177.12,1,0
18/7/11 14:00,3,0,1,1,33.62,56,22.0028,138,2011-07-18 14:00:00,14,18,7,2011,0,0,14,1882.7199999999998,14,0,22.0028,470.67999999999995,0,0
6/3/11 14:00,1,0,0,3,18.04,100,15.0013,39,2011-03-06 14:00:00,14,6,3,2011,6,1,42,1804.0,0,14,45.0039,252.56,0,0
12/3/12 4:00,1,0,1,1,13.94,61,12.998,3,2012-03-12 04:00:00,4,12,3,2012,0,0,4,850.3399999999999,4,0,12.998,55.76,0,0
19/6/11 23:00,2,0,0,1,27.06,78,12.998,92,2011-06-19 23:00:00,23,19,6,2011,6,1,23,2110.68,0,23,12.998,622.38,0,0
10/10/12 8:00,4,0,1,1,20.5,77,11.0014,839,2012-10-10 08:00:00,8,10,10,2012,2,0,8,1578.5,8,0,11.0014,164.0,1,0
9/8/12 0:00,3,0,1,1,29.52,74,12.998,67,2012-08-09 00:00:00,0,9,8,2012,3,0,0,2184.48,0,0,12.998,0.0,0,0
2/8/11 17:00,3,0,1,2,36.9,27,8.9981,556,2011-08-02 17:00:00,17,2,8,2011,1,0,34,996.3,17,0,17.9962,627.3,0,1
17/1/12 11:00,1,0,1,2,13.94,87,7.0015,75,2012-01-17 11:00:00,11,17,1,2012,1,0,22,1212.78,11,0,14.003,153.34,0,0
13/10/11 23:00,4,0,1,2,23.78,88,12.998,47,2011-10-13 23:00:00,23,13,10,2011,3,0,46,2092.6400000000003,23,0,25.996,546.94,0,0
18/10/11 12:00,4,0,1,2,25.42,43,6.0032,201,2011-10-18 12:00:00,12,18,10,2011,1,0,24,1093.0600000000002,12,0,12.0064,305.04,0,0
19/9/11 20:00,3,0,1,2,22.96,68,8.9981,231,2011-09-19 20:00:00,20,19,9,2011,0,0,40,1561.28,20,0,17.9962,459.20000000000005,0,0
5/2/11 16:00,1,0,0,3,9.02,100,8.9981,71,2011-02-05 16:00:00,16,5,2,2011,5,1,48,902.0,0,16,26.994300000000003,144.32,0,0
11/11/12 11:00,4,0,0,1,18.86,59,8.9981,504,2012-11-11 11:00:00,11,11,11,2012,6,1,11,1112.74,0,11,8.9981,207.45999999999998,0,0
15/4/12 1:00,2,0,0,2,22.14,56,11.0014,106,2012-04-15 01:00:00,1,15,4,2012,6,1,2,1239.8400000000001,0,1,22.0028,22.14,0,0
6/9/11 3:00,3,0,1,3,22.14,94,19.9995,1,2011-09-06 03:00:00,3,6,9,2011,1,0,9,2081.16,3,0,59.99850000000001,66.42,0,0
17/8/12 19:00,3,0,1,2,30.34,55,26.0027,491,2012-08-17 19:00:00,19,17,8,2012,4,0,38,1668.7,19,0,52.0054,576.46,0,1
8/11/11 2:00,4,0,1,1,13.12,87,0.0,1,2011-11-08 02:00:00,2,8,11,2011,1,0,2,1141.4399999999998,2,0,0.0,26.24,0,0
2/2/11 0:00,1,0,1,3,9.02,93,7.0015,2,2011-02-02 00:00:00,0,2,2,2011,2,0,0,838.86,0,0,21.0045,0.0,0,0
1/5/11 14:00,2,0,0,2,20.5,68,7.0015,238,2011-05-01 14:00:00,14,1,5,2011,6,1,28,1394.0,0,14,14.003,287.0,0,0
7/12/12 4:00,4,0,1,1,10.66,75,7.0015,10,2012-12-07 04:00:00,4,7,12,2012,4,0,4,799.5,4,0,7.0015,42.64,0,0
5/9/11 1:00,3,1,0,2,27.88,79,7.0015,54,2011-09-05 01:00:00,1,5,9,2011,0,0,2,2202.52,0,0,14.003,27.88,0,0
15/2/11 10:00,1,0,1,1,9.84,27,19.0012,52,2011-02-15 10:00:00,10,15,2,2011,1,0,10,265.68,10,0,19.0012,98.4,0,0
14/11/11 18:00,4,0,1,1,22.96,56,19.0012,489,2011-11-14 18:00:00,18,14,11,2011,0,0,18,1285.76,18,0,19.0012,413.28000000000003,0,1
1/7/11 13:00,3,0,1,1,32.8,24,0.0,292,2011-07-01 13:00:00,13,1,7,2011,4,0,13,787.1999999999999,13,0,0.0,426.4,0,0
11/2/11 1:00,1,0,1,1,4.1,54,6.0032,7,2011-02-11 01:00:00,1,11,2,2011,4,0,1,221.39999999999998,1,0,6.0032,4.1,0,0
17/5/12 5:00,2,0,1,1,22.86977065,69,20.56703297,63,2012-05-17 05:00:00,5,17,5,2012,3,0,5,1578.01417485,5,0,20.56703297,114.34885324999999,0,0
8/8/11 22:00,3,0,1,1,31.16,58,7.0015,147,2011-08-08 22:00:00,22,8,8,2011,0,0,22,1807.28,22,0,7.0015,685.52,0,0
5/4/11 13:00,2,0,1,2,14.76,63,27.9993,56,2011-04-05 13:00:00,13,5,4,2011,1,0,26,929.88,13,0,55.9986,191.88,0,0
9/6/12 18:00,2,0,0,1,33.62,24,15.0013,451,2012-06-09 18:00:00,18,9,6,2012,5,1,18,806.8799999999999,0,18,15.0013,605.16,0,1
16/6/11 23:00,2,0,1,3,24.6,83,16.9979,16,2011-06-16 23:00:00,23,16,6,2011,3,0,69,2041.8000000000002,23,0,50.993700000000004,565.8000000000001,0,0
19/9/12 11:00,3,0,1,1,24.6,43,16.9979,247,2012-09-19 11:00:00,11,19,9,2012,2,0,11,1057.8,11,0,16.9979,270.6,0,0
9/5/12 1:00,2,0,1,2,24.6,78,16.9979,14,2012-05-09 01:00:00,1,9,5,2012,2,0,2,1918.8000000000002,1,0,33.9958,24.6,0,0
19/6/11 15:00,2,0,0,2,30.34,55,7.0015,362,2011-06-19 15:00:00,15,19,6,2011,6,1,30,1668.7,0,15,14.003,455.1,0,0
15/2/12 13:00,1,0,1,1,16.4,43,19.0012,170,2012-02-15 13:00:00,13,15,2,2012,2,0,13,705.1999999999999,13,0,19.0012,213.2,0,0
17/8/11 17:00,3,0,1,1,32.8,49,15.0013,552,2011-08-17 17:00:00,17,17,8,2011,2,0,17,1607.1999999999998,17,0,15.0013,557.5999999999999,0,1
13/10/12 11:00,4,0,0,1,17.22,35,8.9981,527,2012-10-13 11:00:00,11,13,10,2012,5,1,11,602.6999999999999,0,11,8.9981,189.42,0,0
16/6/12 18:00,2,0,0,2,29.52,37,15.0013,571,2012-06-16 18:00:00,18,16,6,2012,5,1,36,1092.24,0,18,30.0026,531.36,0,1
6/9/12 3:00,3,0,1,1,28.7,84,7.0015,9,2012-09-06 03:00:00,3,6,9,2012,3,0,3,2410.7999999999997,3,0,7.0015,86.1,0,0
6/6/12 17:00,2,0,1,1,25.42,43,8.9981,724,2012-06-06 17:00:00,17,6,6,2012,2,0,17,1093.0600000000002,17,0,8.9981,432.14000000000004,0,1
14/11/11 21:00,4,0,1,1,24.6,53,23.9994,213,2011-11-14 21:00:00,21,14,11,2011,0,0,21,1303.8000000000002,21,0,23.9994,516.6,0,0
17/8/12 0:00,3,0,1,1,27.88,57,11.0014,88,2012-08-17 00:00:00,0,17,8,2012,4,0,0,1589.1599999999999,0,0,11.0014,0.0,0,0
1/7/12 18:00,3,0,0,1,36.08,32,23.9994,370,2012-07-01 18:00:00,18,1,7,2012,6,1,18,1154.56,0,18,23.9994,649.4399999999999,0,1
19/10/11 11:00,4,0,1,3,21.32,94,16.9979,149,2011-10-19 11:00:00,11,19,10,2011,2,0,33,2004.08,11,0,50.993700000000004,234.52,0,0
10/5/12 14:00,2,0,1,1,23.17968845,37,28.04125484,254,2012-05-10 14:00:00,14,10,5,2012,3,0,14,857.64847265,14,0,28.04125484,324.5156383,0,0
3/6/12 23:00,2,0,0,1,23.78,53,7.0015,108,2012-06-03 23:00:00,23,3,6,2012,6,1,23,1260.3400000000001,0,23,7.0015,546.94,0,0
8/8/12 9:00,3,0,1,2,31.16,66,0.0,341,2012-08-08 09:00:00,9,8,8,2012,2,0,18,2056.56,9,0,0.0,280.44,1,0
2/8/11 12:00,3,0,1,1,35.26,30,19.0012,157,2011-08-02 12:00:00,12,2,8,2011,1,0,12,1057.8,12,0,19.0012,423.12,0,0
8/1/12 0:00,1,0,0,1,15.58,40,19.0012,91,2012-01-08 00:00:00,0,8,1,2012,6,1,0,623.2,0,0,19.0012,0.0,0,0
11/6/11 3:00,2,0,0,1,27.88,83,6.0032,28,2011-06-11 03:00:00,3,11,6,2011,5,1,3,2314.04,0,3,6.0032,83.64,0,0
2/3/11 22:00,1,0,1,1,12.3,26,36.9974,48,2011-03-02 22:00:00,22,2,3,2011,2,0,22,319.8,22,0,36.9974,270.6,0,0
4/7/11 8:00,3,1,0,1,28.7,74,7.0015,86,2011-07-04 08:00:00,8,4,7,2011,0,0,8,2123.7999999999997,0,0,7.0015,229.6,1,0
13/12/12 17:00,4,0,1,1,13.12,42,7.0015,550,2012-12-13 17:00:00,17,13,12,2012,3,0,17,551.04,17,0,7.0015,223.04,0,1
4/8/11 6:00,3,0,1,2,27.88,89,19.9995,97,2011-08-04 06:00:00,6,4,8,2011,3,0,12,2481.3199999999997,6,0,39.999,167.28,0,0
8/3/11 18:00,1,0,1,1,13.94,27,12.998,235,2011-03-08 18:00:00,18,8,3,2011,1,0,18,376.38,18,0,12.998,250.92,0,1
12/6/12 16:00,2,0,1,2,27.06,89,19.0012,239,2012-06-12 16:00:00,16,12,6,2012,1,0,32,2408.3399999999997,16,0,38.0024,432.96,0,0
16/3/12 13:00,1,0,1,2,18.86,77,6.0032,260,2012-03-16 13:00:00,13,16,3,2012,4,0,26,1452.22,13,0,12.0064,245.18,0,0
7/11/11 23:00,4,0,1,1,14.76,87,6.0032,48,2011-11-07 23:00:00,23,7,11,2011,0,0,23,1284.12,23,0,6.0032,339.48,0,0
16/4/11 0:00,2,0,0,2,14.76,81,15.0013,43,2011-04-16 00:00:00,0,16,4,2011,5,1,0,1195.56,0,0,30.0026,0.0,0,0
12/10/11 4:00,4,0,1,3,22.14,94,26.0027,7,2011-10-12 04:00:00,4,12,10,2011,2,0,12,2081.16,4,0,78.0081,88.56,0,0
3/2/12 9:00,1,0,1,1,9.84,65,12.998,270,2012-02-03 09:00:00,9,3,2,2012,4,0,9,639.6,9,0,12.998,88.56,1,0
4/4/11 1:00,2,0,1,1,16.4,56,23.9994,11,2011-04-04 01:00:00,1,4,4,2011,0,0,1,918.3999999999999,1,0,23.9994,16.4,0,0
6/4/11 21:00,2,0,1,1,18.86,41,19.0012,102,2011-04-06 21:00:00,21,6,4,2011,2,0,21,773.26,21,0,19.0012,396.06,0,0
8/8/12 11:00,3,0,1,2,32.8,52,0.0,239,2012-08-08 11:00:00,11,8,8,2012,2,0,22,1705.6,11,0,0.0,360.79999999999995,0,0
15/3/11 19:00,1,0,1,2,13.94,71,19.0012,152,2011-03-15 19:00:00,19,15,3,2011,1,0,38,989.74,19,0,38.0024,264.86,0,1
11/8/12 13:00,3,0,0,1,32.8,49,23.9994,569,2012-08-11 13:00:00,13,11,8,2012,5,1,13,1607.1999999999998,0,13,23.9994,426.4,0,0
18/11/11 6:00,4,0,1,1,9.02,44,6.0032,71,2011-11-18 06:00:00,6,18,11,2011,4,0,6,396.88,6,0,6.0032,54.12,0,0
3/3/12 21:00,1,0,0,1,18.86,19,22.0028,154,2012-03-03 21:00:00,21,3,3,2012,5,1,21,358.34,0,21,22.0028,396.06,0,0
6/3/12 9:00,1,0,1,1,9.02,47,0.0,233,2012-03-06 09:00:00,9,6,3,2012,1,0,9,423.94,9,0,0.0,81.17999999999999,1,0
7/3/11 12:00,1,0,1,1,12.3,42,27.9993,96,2011-03-07 12:00:00,12,7,3,2011,0,0,12,516.6,12,0,27.9993,147.60000000000002,0,0
8/2/12 21:00,1,0,1,3,9.84,87,12.998,129,2012-02-08 21:00:00,21,8,2,2012,2,0,63,856.08,21,0,38.994,206.64,0,0
5/7/12 14:00,3,0,1,1,37.72,33,22.0028,241,2012-07-05 14:00:00,14,5,7,2012,3,0,14,1244.76,14,0,22.0028,528.0799999999999,0,0
11/10/11 15:00,4,0,1,2,24.6,78,11.0014,175,2011-10-11 15:00:00,15,11,10,2011,1,0,30,1918.8000000000002,15,0,22.0028,369.0,0,0
16/2/11 18:00,1,0,1,1,16.4,40,15.0013,222,2011-02-16 18:00:00,18,16,2,2011,2,0,18,656.0,18,0,15.0013,295.2,0,1
7/4/12 19:00,2,0,0,1,20.61218953,17,22.50336427,411,2012-04-07 19:00:00,19,7,4,2012,5,1,19,350.40722201,0,19,22.50336427,391.63160107,0,1
5/6/12 21:00,2,0,1,1,22.14,56,11.0014,283,2012-06-05 21:00:00,21,5,6,2012,1,0,21,1239.8400000000001,21,0,11.0014,464.94,0,0
13/3/11 12:00,1,0,0,1,18.86,38,26.0027,194,2011-03-13 12:00:00,12,13,3,2011,6,1,12,716.68,0,12,26.0027,226.32,0,0
18/11/11 2:00,4,0,1,1,9.84,44,15.0013,10,2011-11-18 02:00:00,2,18,11,2011,4,0,2,432.96,2,0,15.0013,19.68,0,0
2/10/12 17:00,4,0,1,3,25.42,88,7.0015,715,2012-10-02 17:00:00,17,2,10,2012,1,0,51,2236.96,17,0,21.0045,432.14000000000004,0,1
18/5/11 18:00,2,0,1,1,24.6,73,15.0013,489,2011-05-18 18:00:00,18,18,5,2011,2,0,18,1795.8000000000002,18,0,15.0013,442.8,0,1
8/1/11 1:00,1,0,0,2,7.38,55,6.0032,16,2011-01-08 01:00:00,1,8,1,2011,5,1,2,405.9,0,1,12.0064,7.38,0,0
8/6/11 18:00,2,0,1,1,36.9,37,15.0013,459,2011-06-08 18:00:00,18,8,6,2011,2,0,18,1365.3,18,0,15.0013,664.1999999999999,0,1
15/7/12 21:00,3,0,0,1,29.52,79,6.0032,223,2012-07-15 21:00:00,21,15,7,2012,6,1,21,2332.08,0,21,6.0032,619.92,0,0
2/8/12 8:00,3,0,1,1,29.46390165,75,7.754685296,758,2012-08-02 08:00:00,8,2,8,2012,3,0,8,2209.79262375,8,0,7.754685296,235.7112132,1,0
10/3/11 8:00,1,0,1,3,15.58,0,19.0012,44,2011-03-10 08:00:00,8,10,3,2011,3,0,24,0.0,8,0,57.003600000000006,124.64,1,0
6/8/12 18:00,3,0,1,1,33.62,41,8.9981,843,2012-08-06 18:00:00,18,6,8,2012,0,0,18,1378.4199999999998,18,0,8.9981,605.16,0,1
9/1/11 21:00,1,0,0,1,5.74,46,27.9993,20,2011-01-09 21:00:00,21,9,1,2011,6,1,21,264.04,0,21,27.9993,120.54,0,0
15/1/11 6:00,1,0,0,1,5.74,63,7.0015,3,2011-01-15 06:00:00,6,15,1,2011,5,1,6,361.62,0,6,7.0015,34.44,0,0
14/3/12 0:00,1,0,1,1,22.27800451,59,6.428685444,58,2012-03-14 00:00:00,0,14,3,2012,2,0,0,1314.40226609,0,0,6.428685444,0.0,0,0
4/1/11 1:00,1,0,1,1,6.56,59,7.0015,2,2011-01-04 01:00:00,1,4,1,2011,1,0,1,387.03999999999996,1,0,7.0015,6.56,0,0
18/9/11 13:00,3,0,0,1,22.96,60,8.9981,376,2011-09-18 13:00:00,13,18,9,2011,6,1,13,1377.6000000000001,0,13,8.9981,298.48,0,0
16/7/11 5:00,3,0,0,1,23.78,78,6.0032,10,2011-07-16 05:00:00,5,16,7,2011,5,1,5,1854.8400000000001,0,5,6.0032,118.9,0,0
13/4/12 21:00,2,0,1,1,20.5,36,0.0,189,2012-04-13 21:00:00,21,13,4,2012,4,0,21,738.0,21,0,0.0,430.5,0,0
2/3/11 7:00,1,0,1,1,9.02,64,16.9979,110,2011-03-02 07:00:00,7,2,3,2011,2,0,7,577.28,7,0,16.9979,63.14,1,0
13/8/12 0:00,3,0,1,1,27.06,65,7.0015,47,2012-08-13 00:00:00,0,13,8,2012,0,0,0,1758.8999999999999,0,0,7.0015,0.0,0,0
4/8/12 2:00,3,0,0,1,29.52,84,8.9981,84,2012-08-04 02:00:00,2,4,8,2012,5,1,2,2479.68,0,2,8.9981,59.04,0,0
18/11/12 16:00,4,0,0,2,16.4,62,22.0028,372,2012-11-18 16:00:00,16,18,11,2012,6,1,32,1016.8,0,16,44.0056,262.4,0,0
2/5/11 6:00,2,0,1,1,18.04,88,7.0015,62,2011-05-02 06:00:00,6,2,5,2011,0,0,6,1587.52,6,0,7.0015,108.24,0,0
15/11/12 14:00,4,0,1,2,15.58,54,11.0014,201,2012-11-15 14:00:00,14,15,11,2012,3,0,28,841.32,14,0,22.0028,218.12,0,0
14/6/12 10:00,2,0,1,1,26.24,65,27.9993,179,2012-06-14 10:00:00,10,14,6,2012,3,0,10,1705.6,10,0,27.9993,262.4,0,0
5/4/11 21:00,2,0,1,1,13.94,46,35.0008,89,2011-04-05 21:00:00,21,5,4,2011,1,0,21,641.24,21,0,35.0008,292.74,0,0
7/8/12 19:00,3,0,1,2,31.16,66,7.0015,610,2012-08-07 19:00:00,19,7,8,2012,1,0,38,2056.56,19,0,14.003,592.04,0,1
5/10/11 14:00,4,0,1,1,26.24,41,19.0012,190,2011-10-05 14:00:00,14,5,10,2011,2,0,14,1075.84,14,0,19.0012,367.35999999999996,0,0
1/8/12 5:00,3,0,1,2,26.24,78,8.9981,49,2012-08-01 05:00:00,5,1,8,2012,2,0,10,2046.7199999999998,5,0,17.9962,131.2,0,0
8/9/11 6:00,3,0,1,3,24.6540073,95,10.76046887,50,2011-09-08 06:00:00,6,8,9,2011,3,0,18,2342.1306935,6,0,32.281406610000005,147.9240438,0,0
13/7/12 0:00,3,0,1,2,28.7,54,11.0014,95,2012-07-13 00:00:00,0,13,7,2012,4,0,0,1549.8,0,0,22.0028,0.0,0,0
7/2/11 20:00,1,0,1,2,13.12,70,7.0015,88,2011-02-07 20:00:00,20,7,2,2011,0,0,40,918.4,20,0,14.003,262.4,0,0
16/8/11 22:00,3,0,1,1,28.7,61,0.0,152,2011-08-16 22:00:00,22,16,8,2011,1,0,22,1750.7,22,0,0.0,631.4,0,0
5/9/12 22:00,3,0,1,1,29.52,79,0.0,219,2012-09-05 22:00:00,22,5,9,2012,2,0,22,2332.08,22,0,0.0,649.4399999999999,0,0
18/8/12 14:00,3,0,0,1,30.41245325,37,19.34873481,569,2012-08-18 14:00:00,14,18,8,2012,5,1,14,1125.26077025,0,14,19.34873481,425.7743455,0,0
3/6/11 19:00,2,0,1,1,27.88,26,19.0012,391,2011-06-03 19:00:00,19,3,6,2011,4,0,19,724.88,19,0,19.0012,529.72,0,1
8/8/11 17:00,3,0,1,1,35.89839854,36,12.34505637,549,2011-08-08 17:00:00,17,8,8,2011,0,0,17,1292.3423474400001,17,0,12.34505637,610.27277518,0,1
13/4/12 12:00,2,0,1,1,21.77989353,29,0.0,316,2012-04-13 12:00:00,12,13,4,2012,4,0,12,631.61691237,12,0,0.0,261.35872236,0,0
12/6/12 6:00,2,0,1,2,24.6,88,8.9981,136,2012-06-12 06:00:00,6,12,6,2012,1,0,12,2164.8,6,0,17.9962,147.60000000000002,0,0
4/4/12 11:00,2,0,1,2,24.6,43,23.9994,213,2012-04-04 11:00:00,11,4,4,2012,2,0,22,1057.8,11,0,47.9988,270.6,0,0
8/12/11 16:00,4,0,1,1,13.12,45,12.998,208,2011-12-08 16:00:00,16,8,12,2011,3,0,16,590.4,16,0,12.998,209.92,0,0
3/1/11 20:00,1,0,1,1,8.2,47,7.0015,52,2011-01-03 20:00:00,20,3,1,2011,0,0,20,385.4,20,0,7.0015,164.0,0,0
11/8/11 2:00,3,0,1,1,27.06,54,8.9981,11,2011-08-11 02:00:00,2,11,8,2011,3,0,2,1461.24,2,0,8.9981,54.12,0,0
17/11/12 5:00,4,0,0,1,9.84,70,11.0014,11,2012-11-17 05:00:00,5,17,11,2012,5,1,5,688.8,0,5,11.0014,49.2,0,0
16/6/12 5:00,2,0,0,1,22.14,68,7.0015,23,2012-06-16 05:00:00,5,16,6,2012,5,1,5,1505.52,0,5,7.0015,110.7,0,0
17/12/11 13:00,4,0,0,2,11.48,48,16.9979,236,2011-12-17 13:00:00,13,17,12,2011,5,1,26,551.04,0,13,33.9958,149.24,0,0
2/2/12 6:00,1,0,1,3,14.76,90,0.0,74,2012-02-02 06:00:00,6,2,2,2012,3,0,18,1328.4,6,0,0.0,88.56,0,0
13/6/11 18:00,2,0,1,1,28.7,37,23.9994,586,2011-06-13 18:00:00,18,13,6,2011,0,0,18,1061.8999999999999,18,0,23.9994,516.6,0,1
13/6/12 18:00,2,0,1,1,29.52,32,30.0026,744,2012-06-13 18:00:00,18,13,6,2012,2,0,18,944.64,18,0,30.0026,531.36,0,1
5/9/12 3:00,3,0,1,1,29.06861014,78,18.48994454,1,2012-09-05 03:00:00,3,5,9,2012,2,0,3,2267.35159092,3,0,18.48994454,87.20583042,0,0
15/12/11 14:00,4,0,1,2,21.32,52,22.0028,132,2011-12-15 14:00:00,14,15,12,2011,3,0,28,1108.64,14,0,44.0056,298.48,0,0
13/11/11 2:00,4,0,0,1,14.76,57,7.0015,57,2011-11-13 02:00:00,2,13,11,2011,6,1,2,841.3199999999999,0,2,7.0015,29.52,0,0
10/3/11 17:00,1,0,1,2,18.04,0,26.0027,111,2011-03-10 17:00:00,17,10,3,2011,3,0,34,0.0,17,0,52.0054,306.68,0,1
19/5/11 1:00,2,0,1,1,20.5,94,0.0,6,2011-05-19 01:00:00,1,19,5,2011,3,0,1,1927.0,1,0,0.0,20.5,0,0
10/12/12 13:00,4,0,1,3,17.53856357,100,14.55288604,245,2012-12-10 13:00:00,13,10,12,2012,0,0,39,1753.8563570000001,13,0,43.65865812,228.00132641000002,0,0
17/9/11 16:00,3,0,0,1,22.14,68,16.9979,305,2011-09-17 16:00:00,16,17,9,2011,5,1,16,1505.52,0,16,16.9979,354.24,0,0
16/12/12 16:00,4,0,0,2,15.58,82,7.0015,400,2012-12-16 16:00:00,16,16,12,2012,6,1,32,1277.56,0,16,14.003,249.28,0,0
16/3/12 22:00,1,0,1,2,18.04,94,0.0,148,2012-03-16 22:00:00,22,16,3,2012,4,0,44,1695.76,22,0,0.0,396.88,0,0
14/10/12 8:00,4,0,0,1,18.04,77,12.998,132,2012-10-14 08:00:00,8,14,10,2012,6,1,8,1389.08,0,8,12.998,144.32,1,0
14/6/11 4:00,2,0,1,1,22.14,60,16.9979,3,2011-06-14 04:00:00,4,14,6,2011,1,0,4,1328.4,4,0,16.9979,88.56,0,0
18/12/12 5:00,4,0,1,1,13.51389763,87,5.817990143,38,2012-12-18 05:00:00,5,18,12,2012,1,0,5,1175.70909381,5,0,5.817990143,67.56948815,0,0
7/12/11 8:00,4,0,1,3,18.04,100,0.0,86,2011-12-07 08:00:00,8,7,12,2011,2,0,24,1804.0,8,0,0.0,144.32,1,0
8/6/12 9:00,2,0,1,1,25.42,53,11.0014,382,2012-06-08 09:00:00,9,8,6,2012,4,0,9,1347.26,9,0,11.0014,228.78000000000003,1,0
1/1/11 19:00,1,0,0,3,17.22,88,16.9979,37,2011-01-01 19:00:00,19,1,1,2011,5,1,57,1515.36,0,19,50.993700000000004,327.17999999999995,0,1
17/1/12 4:00,1,0,1,3,13.12,66,22.0028,2,2012-01-17 04:00:00,4,17,1,2012,1,0,12,865.92,4,0,66.0084,52.48,0,0
12/8/11 15:00,3,0,1,1,32.8,29,11.0014,249,2011-08-12 15:00:00,15,12,8,2011,4,0,15,951.1999999999999,15,0,11.0014,491.99999999999994,0,0
11/8/11 3:00,3,0,1,1,26.24,57,8.9981,9,2011-08-11 03:00:00,3,11,8,2011,3,0,3,1495.6799999999998,3,0,8.9981,78.72,0,0
15/2/11 5:00,1,0,1,1,9.02,32,31.0009,4,2011-02-15 05:00:00,5,15,2,2011,1,0,5,288.64,5,0,31.0009,45.099999999999994,0,0
16/9/12 15:00,3,0,0,1,26.24,41,11.0014,557,2012-09-16 15:00:00,15,16,9,2012,6,1,15,1075.84,0,15,11.0014,393.59999999999997,0,0
5/8/12 20:00,3,0,0,1,28.7,84,7.0015,193,2012-08-05 20:00:00,20,5,8,2012,6,1,20,2410.7999999999997,0,20,7.0015,574.0,0,0
15/9/12 10:00,3,0,0,1,25.42,41,26.0027,442,2012-09-15 10:00:00,10,15,9,2012,5,1,10,1042.22,0,10,26.0027,254.20000000000002,0,0
1/7/11 14:00,3,0,1,1,33.61410387,23,12.22767887,294,2011-07-01 14:00:00,14,1,7,2011,4,0,14,773.1243890100001,14,0,12.22767887,470.59745418,0,0
14/12/11 14:00,4,0,1,2,15.58,54,6.0032,151,2011-12-14 14:00:00,14,14,12,2011,2,0,28,841.32,14,0,12.0064,218.12,0,0
11/10/12 2:00,4,0,1,1,15.92033586,53,9.7852687,1,2012-10-11 02:00:00,2,11,10,2012,3,0,2,843.77780058,2,0,9.7852687,31.84067172,0,0
7/6/11 2:00,2,0,1,1,24.6,73,6.0032,5,2011-06-07 02:00:00,2,7,6,2011,1,0,2,1795.8000000000002,2,0,6.0032,49.2,0,0
18/5/12 23:00,2,0,1,1,22.11543002,53,0.791172961,211,2012-05-18 23:00:00,23,18,5,2012,4,0,23,1172.1177910600002,23,0,0.791172961,508.65489046000005,0,0
10/2/12 0:00,1,0,1,2,11.48,65,6.0032,43,2012-02-10 00:00:00,0,10,2,2012,4,0,0,746.2,0,0,12.0064,0.0,0,0
12/6/11 13:00,2,0,0,1,30.48886133,61,19.77911469,389,2011-06-12 13:00:00,13,12,6,2011,6,1,13,1859.82054113,0,13,19.77911469,396.35519729,0,0
12/12/11 18:00,4,0,1,1,12.3,56,6.0032,357,2011-12-12 18:00:00,18,12,12,2011,0,0,18,688.8000000000001,18,0,6.0032,221.4,0,1
13/11/11 9:00,4,0,0,1,16.4,54,19.0012,135,2011-11-13 09:00:00,9,13,11,2011,6,1,9,885.5999999999999,0,9,19.0012,147.6,1,0
5/8/12 18:00,3,0,0,3,28.7,74,8.9981,229,2012-08-05 18:00:00,18,5,8,2012,6,1,54,2123.7999999999997,0,18,26.994300000000003,516.6,0,1
10/1/11 14:00,1,0,1,2,8.2,40,15.0013,47,2011-01-10 14:00:00,14,10,1,2011,0,0,28,328.0,14,0,30.0026,114.79999999999998,0,0
7/10/11 15:00,4,0,1,1,27.06,41,0.0,270,2011-10-07 15:00:00,15,7,10,2011,4,0,15,1109.46,15,0,0.0,405.9,0,0
8/7/11 12:00,3,0,1,2,31.16,70,19.0012,213,2011-07-08 12:00:00,12,8,7,2011,4,0,24,2181.2,12,0,38.0024,373.92,0,0
1/6/11 13:00,2,0,1,1,36.9,37,12.998,154,2011-06-01 13:00:00,13,1,6,2011,2,0,13,1365.3,13,0,12.998,479.7,0,0
14/7/12 3:00,3,0,0,2,28.7,54,7.0015,40,2012-07-14 03:00:00,3,14,7,2012,5,1,6,1549.8,0,3,14.003,86.1,0,0
8/10/12 15:00,4,1,0,3,17.22,58,12.998,370,2012-10-08 15:00:00,15,8,10,2012,0,0,45,998.76,0,0,38.994,258.29999999999995,0,0
19/5/12 1:00,2,0,0,1,20.5,48,0.0,104,2012-05-19 01:00:00,1,19,5,2012,5,1,1,984.0,0,1,0.0,20.5,0,0
7/2/12 2:00,1,0,1,1,12.3,61,0.0,4,2012-02-07 02:00:00,2,7,2,2012,1,0,2,750.3000000000001,2,0,0.0,24.6,0,0
4/7/11 22:00,3,1,0,2,30.34,62,8.9981,326,2011-07-04 22:00:00,22,4,7,2011,0,0,44,1881.08,0,0,17.9962,667.48,0,0
16/5/11 3:00,2,0,1,1,20.5,94,11.0014,4,2011-05-16 03:00:00,3,16,5,2011,0,0,3,1927.0,3,0,11.0014,61.5,0,0
18/7/12 13:00,3,0,1,1,38.54,33,0.0,203,2012-07-18 13:00:00,13,18,7,2012,2,0,13,1271.82,13,0,0.0,501.02,0,0
19/7/12 10:00,3,0,1,1,31.16,58,12.998,198,2012-07-19 10:00:00,10,19,7,2012,3,0,10,1807.28,10,0,12.998,311.6,0,0
2/12/12 22:00,4,0,0,2,18.04,77,12.998,96,2012-12-02 22:00:00,22,2,12,2012,6,1,44,1389.08,0,22,25.996,396.88,0,0
19/10/12 5:00,4,0,1,2,22.14,88,0.0,36,2012-10-19 05:00:00,5,19,10,2012,4,0,10,1948.3200000000002,5,0,0.0,110.7,0,0
18/2/11 19:00,1,0,1,1,25.42,29,39.0007,162,2011-02-18 19:00:00,19,18,2,2011,4,0,19,737.1800000000001,19,0,39.0007,482.98,0,1
18/8/11 19:00,3,0,1,1,27.06,83,7.0015,141,2011-08-18 19:00:00,19,18,8,2011,3,0,19,2245.98,19,0,7.0015,514.14,0,1
4/12/11 19:00,4,0,0,1,15.58,76,0.0,173,2011-12-04 19:00:00,19,4,12,2011,6,1,19,1184.08,0,19,0.0,296.02,0,1
8/7/11 6:00,3,0,1,1,28.7,74,7.0015,102,2011-07-08 06:00:00,6,8,7,2011,4,0,6,2123.7999999999997,6,0,7.0015,172.2,0,0
12/6/12 1:00,2,0,1,2,27.88,65,11.0014,16,2012-06-12 01:00:00,1,12,6,2012,1,0,2,1812.2,1,0,22.0028,27.88,0,0
12/5/11 20:00,2,0,1,1,24.6,64,12.998,276,2011-05-12 20:00:00,20,12,5,2011,3,0,20,1574.4,20,0,12.998,492.0,0,0
19/4/11 23:00,2,0,1,1,18.86,88,6.0032,52,2011-04-19 23:00:00,23,19,4,2011,1,0,23,1659.6799999999998,23,0,6.0032,433.78,0,0
17/7/12 5:00,3,0,1,1,27.88,74,6.0032,38,2012-07-17 05:00:00,5,17,7,2012,1,0,5,2063.12,5,0,6.0032,139.4,0,0
11/1/12 11:00,1,0,1,2,11.69249998,89,6.169756121,98,2012-01-11 11:00:00,11,11,1,2012,2,0,22,1040.63249822,11,0,12.339512242,128.61749978,0,0
17/9/12 3:00,3,0,1,1,20.5,77,6.0032,7,2012-09-17 03:00:00,3,17,9,2012,0,0,3,1578.5,3,0,6.0032,61.5,0,0
12/11/12 4:00,4,1,0,1,16.4,76,6.0032,4,2012-11-12 04:00:00,4,12,11,2012,0,0,4,1246.3999999999999,0,0,6.0032,65.6,0,0
3/7/12 4:00,3,0,1,1,27.88,65,7.0015,6,2012-07-03 04:00:00,4,3,7,2012,1,0,4,1812.2,4,0,7.0015,111.52,0,0
17/10/11 23:00,4,0,1,2,19.68,88,0.0,62,2011-10-17 23:00:00,23,17,10,2011,0,0,46,1731.84,23,0,0.0,452.64,0,0
5/12/11 16:00,4,0,1,1,20.5,63,6.0032,248,2011-12-05 16:00:00,16,5,12,2011,0,0,16,1291.5,16,0,6.0032,328.0,0,0
7/1/11 20:00,1,0,1,1,7.38,47,7.0015,51,2011-01-07 20:00:00,20,7,1,2011,4,0,20,346.86,20,0,7.0015,147.6,0,0
19/3/11 18:00,1,0,0,1,18.86,31,22.0028,217,2011-03-19 18:00:00,18,19,3,2011,5,1,18,584.66,0,18,22.0028,339.48,0,1
12/11/12 0:00,4,1,0,1,17.22,71,7.0015,49,2012-11-12 00:00:00,0,12,11,2012,0,0,0,1222.62,0,0,7.0015,0.0,0,0
7/5/12 7:00,2,0,1,2,19.68,82,7.0015,385,2012-05-07 07:00:00,7,7,5,2012,0,0,14,1613.76,7,0,14.003,137.76,1,0
13/2/11 1:00,1,0,0,1,8.2,59,6.0032,24,2011-02-13 01:00:00,1,13,2,2011,6,1,1,483.79999999999995,0,1,6.0032,8.2,0,0
18/2/11 22:00,1,0,1,1,22.14,10,16.9979,107,2011-02-18 22:00:00,22,18,2,2011,4,0,22,221.4,22,0,16.9979,487.08000000000004,0,0
10/6/12 4:00,2,0,0,1,25.42,78,6.0032,10,2012-06-10 04:00:00,4,10,6,2012,6,1,4,1982.7600000000002,0,4,6.0032,101.68,0,0
18/9/12 0:00,3,0,1,3,24.6,94,16.9979,13,2012-09-18 00:00:00,0,18,9,2012,1,0,0,2312.4,0,0,50.993700000000004,0.0,0,0
17/6/11 20:00,2,0,1,1,26.24,78,7.0015,232,2011-06-17 20:00:00,20,17,6,2011,4,0,20,2046.7199999999998,20,0,7.0015,524.8,0,0
13/11/12 17:00,4,0,1,1,13.94,49,23.9994,608,2012-11-13 17:00:00,17,13,11,2012,1,0,17,683.06,17,0,23.9994,236.98,0,1
3/6/12 19:00,2,0,0,1,27.88,34,19.0012,453,2012-06-03 19:00:00,19,3,6,2012,6,1,19,947.92,0,19,19.0012,529.72,0,1
2/12/11 8:00,4,0,1,1,9.84,87,0.0,445,2011-12-02 08:00:00,8,2,12,2011,4,0,8,856.08,8,0,0.0,78.72,1,0
17/2/11 11:00,1,0,1,2,18.04,44,16.9979,90,2011-02-17 11:00:00,11,17,2,2011,3,0,22,793.76,11,0,33.9958,198.44,0,0
6/2/11 18:00,1,0,0,1,12.3,56,11.0014,78,2011-02-06 18:00:00,18,6,2,2011,6,1,18,688.8000000000001,0,18,11.0014,221.4,0,1
12/10/11 14:00,4,0,1,3,22.14,94,19.0012,78,2011-10-12 14:00:00,14,12,10,2011,2,0,42,2081.16,14,0,57.003600000000006,309.96000000000004,0,0
7/12/12 13:00,4,0,1,2,14.76,66,8.9981,220,2012-12-07 13:00:00,13,7,12,2012,4,0,26,974.16,13,0,17.9962,191.88,0,0
3/4/12 23:00,2,0,1,1,20.5,59,0.0,79,2012-04-03 23:00:00,23,3,4,2012,1,0,23,1209.5,23,0,0.0,471.5,0,0
5/8/11 20:00,3,0,1,1,29.52,58,15.0013,291,2011-08-05 20:00:00,20,5,8,2011,4,0,20,1712.16,20,0,15.0013,590.4,0,0
4/7/12 14:00,3,1,0,1,36.9,37,11.0014,547,2012-07-04 14:00:00,14,4,7,2012,2,0,14,1365.3,0,0,11.0014,516.6,0,0
4/8/12 7:00,3,0,0,1,29.52,77,11.0014,67,2012-08-04 07:00:00,7,4,8,2012,5,1,7,2273.04,0,7,11.0014,206.64,1,0
1/5/11 19:00,2,0,0,2,18.86,84,7.0015,178,2011-05-01 19:00:00,19,1,5,2011,6,1,38,1584.24,0,19,14.003,358.34,0,1
5/6/12 18:00,2,0,1,1,24.6,43,12.998,790,2012-06-05 18:00:00,18,5,6,2012,1,0,18,1057.8,18,0,12.998,442.8,0,1
4/9/12 18:00,3,0,1,1,31.16,75,15.0013,839,2012-09-04 18:00:00,18,4,9,2012,1,0,18,2337.0,18,0,15.0013,560.88,0,1
2/2/11 22:00,1,0,1,1,9.02,44,16.9979,40,2011-02-02 22:00:00,22,2,2,2011,2,0,22,396.88,22,0,16.9979,198.44,0,0
4/10/12 4:00,4,0,1,2,26.24,89,0.0,10,2012-10-04 04:00:00,4,4,10,2012,3,0,8,2335.3599999999997,4,0,0.0,104.96,0,0
8/1/12 21:00,1,0,0,1,11.48,56,15.0013,91,2012-01-08 21:00:00,21,8,1,2012,6,1,21,642.88,0,21,15.0013,241.08,0,0
2/12/12 23:00,4,0,0,2,17.22,82,8.9981,51,2012-12-02 23:00:00,23,2,12,2012,6,1,46,1412.04,0,23,17.9962,396.05999999999995,0,0
6/8/12 19:00,3,0,1,1,31.98,59,12.998,640,2012-08-06 19:00:00,19,6,8,2012,0,0,19,1886.82,19,0,12.998,607.62,0,1
16/8/12 16:00,3,0,1,1,33.62,32,15.0013,419,2012-08-16 16:00:00,16,16,8,2012,3,0,16,1075.84,16,0,15.0013,537.92,0,0
7/12/11 0:00,4,0,1,1,18.04,100,12.998,33,2011-12-07 00:00:00,0,7,12,2011,2,0,0,1804.0,0,0,12.998,0.0,0,0
8/6/11 10:00,2,0,1,1,33.62,43,15.0013,90,2011-06-08 10:00:00,10,8,6,2011,2,0,10,1445.6599999999999,10,0,15.0013,336.2,0,0
2/8/11 4:00,3,0,1,1,27.06,74,7.0015,10,2011-08-02 04:00:00,4,2,8,2011,1,0,4,2002.4399999999998,4,0,7.0015,108.24,0,0
13/10/12 12:00,4,0,0,1,18.04,35,0.0,573,2012-10-13 12:00:00,12,13,10,2012,5,1,12,631.4,0,12,0.0,216.48,0,0
3/7/11 10:00,3,0,0,1,29.81211079,66,10.56498145,252,2011-07-03 10:00:00,10,3,7,2011,6,1,10,1967.59931214,0,10,10.56498145,298.12110789999997,0,0
4/6/11 18:00,2,0,0,2,30.34,30,11.0014,341,2011-06-04 18:00:00,18,4,6,2011,5,1,36,910.2,0,18,22.0028,546.12,0,1
7/7/12 0:00,3,0,0,1,31.98,66,8.9981,150,2012-07-07 00:00:00,0,7,7,2012,5,1,0,2110.68,0,0,8.9981,0.0,0,0
16/12/11 17:00,4,0,1,2,13.12,45,19.0012,365,2011-12-16 17:00:00,17,16,12,2011,4,0,34,590.4,17,0,38.0024,223.04,0,1
7/8/11 14:00,3,0,0,1,35.26,47,12.998,322,2011-08-07 14:00:00,14,7,8,2011,6,1,14,1657.2199999999998,0,14,12.998,493.64,0,0
11/2/12 7:00,1,0,0,3,9.02,93,8.9981,19,2012-02-11 07:00:00,7,11,2,2012,5,1,21,838.86,0,7,26.994300000000003,63.14,1,0
10/1/11 6:00,1,0,1,1,5.118836193,50,20.03500088,60,2011-01-10 06:00:00,6,10,1,2011,0,0,6,255.94180964999998,6,0,20.03500088,30.713017158,0,0
19/12/12 2:00,4,0,1,1,11.48,65,6.0032,3,2012-12-19 02:00:00,2,19,12,2012,2,0,2,746.2,2,0,6.0032,22.96,0,0
16/4/12 6:00,2,1,0,1,21.32,83,11.0014,133,2012-04-16 06:00:00,6,16,4,2012,0,0,6,1769.56,0,0,11.0014,127.92,0,0
9/4/12 9:00,2,0,1,1,18.86,31,23.9994,286,2012-04-09 09:00:00,9,9,4,2012,0,0,9,584.66,9,0,23.9994,169.74,1,0
17/11/12 15:00,4,0,0,1,17.58013701,32,19.71186201,582,2012-11-17 15:00:00,15,17,11,2012,5,1,15,562.56438432,0,15,19.71186201,263.70205515000004,0,0
18/8/12 3:00,3,0,0,1,25.42,88,12.998,30,2012-08-18 03:00:00,3,18,8,2012,5,1,3,2236.96,0,3,12.998,76.26,0,0
18/11/12 8:00,4,0,0,1,12.3,75,16.9979,119,2012-11-18 08:00:00,8,18,11,2012,6,1,8,922.5,0,8,16.9979,98.4,1,0
4/8/12 22:00,3,0,0,1,31.16,66,19.0012,269,2012-08-04 22:00:00,22,4,8,2012,5,1,22,2056.56,0,22,19.0012,685.52,0,0
12/7/12 11:00,3,0,1,1,31.16,45,7.0015,215,2012-07-12 11:00:00,11,12,7,2012,3,0,11,1402.2,11,0,7.0015,342.76,0,0
2/11/12 21:00,4,0,1,2,14.76,46,23.9994,156,2012-11-02 21:00:00,21,2,11,2012,4,0,42,678.96,21,0,47.9988,309.96,0,0
1/6/11 8:00,2,0,1,2,29.52,79,12.998,454,2011-06-01 08:00:00,8,1,6,2011,2,0,16,2332.08,8,0,25.996,236.16,1,0
2/11/11 22:00,4,0,1,1,15.70502923,74,9.389686171,101,2011-11-02 22:00:00,22,2,11,2011,2,0,22,1162.17216302,22,0,9.389686171,345.51064306,0,0
16/10/11 7:00,4,0,0,1,16.4,62,8.9981,48,2011-10-16 07:00:00,7,16,10,2011,6,1,7,1016.8,0,7,8.9981,114.79999999999998,1,0
5/6/11 23:00,2,0,0,1,25.42,78,8.9981,86,2011-06-05 23:00:00,23,5,6,2011,6,1,23,1982.7600000000002,0,23,8.9981,584.6600000000001,0,0
16/1/11 6:00,1,0,0,2,10.66,56,11.0014,1,2011-01-16 06:00:00,6,16,1,2011,6,1,12,596.96,0,6,22.0028,63.96,0,0
5/12/11 15:00,4,0,1,2,18.86,72,6.0032,148,2011-12-05 15:00:00,15,5,12,2011,0,0,30,1357.92,15,0,12.0064,282.9,0,0
2/1/12 14:00,1,1,0,1,12.3,36,27.9993,151,2012-01-02 14:00:00,14,2,1,2012,0,0,14,442.8,0,0,27.9993,172.20000000000002,0,0
2/8/12 10:00,3,0,1,1,32.8,55,0.0,181,2012-08-02 10:00:00,10,2,8,2012,3,0,10,1803.9999999999998,10,0,0.0,328.0,0,0
7/3/12 9:00,1,0,1,1,12.3,61,22.0028,264,2012-03-07 09:00:00,9,7,3,2012,2,0,9,750.3000000000001,9,0,22.0028,110.7,1,0
5/2/11 13:00,1,0,0,3,9.02,100,11.0014,72,2011-02-05 13:00:00,13,5,2,2011,5,1,39,902.0,0,13,33.0042,117.25999999999999,0,0
15/1/12 13:00,1,0,0,1,8.2,34,19.0012,224,2012-01-15 13:00:00,13,15,1,2012,6,1,13,278.79999999999995,0,13,19.0012,106.6,0,0
7/8/12 5:00,3,0,1,1,28.7,79,7.0015,36,2012-08-07 05:00:00,5,7,8,2012,1,0,5,2267.2999999999997,5,0,7.0015,143.5,0,0
15/2/12 4:00,1,0,1,1,11.48,70,7.0015,1,2012-02-15 04:00:00,4,15,2,2012,2,0,4,803.6,4,0,7.0015,45.92,0,0
12/5/12 5:00,2,0,0,1,17.22,67,8.9981,13,2012-05-12 05:00:00,5,12,5,2012,5,1,5,1153.74,0,5,8.9981,86.1,0,0
6/11/11 2:00,4,0,0,1,10.66,81,0.0,29,2011-11-06 02:00:00,2,6,11,2011,6,1,2,863.46,0,2,0.0,21.32,0,0
18/9/12 18:00,3,0,1,2,24.6,88,11.0014,281,2012-09-18 18:00:00,18,18,9,2012,1,0,36,2164.8,18,0,22.0028,442.8,0,1
2/7/11 17:00,3,0,0,1,34.44,30,15.0013,349,2011-07-02 17:00:00,17,2,7,2011,5,1,17,1033.1999999999998,0,17,15.0013,585.48,0,1
14/3/11 12:00,1,0,1,1,15.58,37,0.0,94,2011-03-14 12:00:00,12,14,3,2011,0,0,12,576.46,12,0,0.0,186.96,0,0
11/2/12 19:00,1,0,0,2,8.2,40,36.9974,87,2012-02-11 19:00:00,19,11,2,2012,5,1,38,328.0,0,19,73.9948,155.79999999999998,0,1
16/12/11 13:00,4,0,1,2,14.83467431,39,25.04248212,116,2011-12-16 13:00:00,13,16,12,2011,4,0,26,578.55229809,13,0,50.08496424,192.85076603000002,0,0
8/4/11 23:00,2,0,1,2,12.3,93,15.0013,35,2011-04-08 23:00:00,23,8,4,2011,4,0,46,1143.9,23,0,30.0026,282.90000000000003,0,0
8/12/12 22:00,4,0,0,2,15.58,94,7.0015,160,2012-12-08 22:00:00,22,8,12,2012,5,1,44,1464.52,0,22,14.003,342.76,0,0
19/3/12 0:00,1,0,1,1,19.68,82,7.0015,23,2012-03-19 00:00:00,0,19,3,2012,0,0,0,1613.76,0,0,7.0015,0.0,0,0
14/3/11 22:00,1,0,1,1,13.56586782,49,6.309786553,46,2011-03-14 22:00:00,22,14,3,2011,0,0,22,664.7275231799999,22,0,6.309786553,298.44909204,0,0
5/6/12 6:00,2,0,1,1,19.68,82,16.9979,184,2012-06-05 06:00:00,6,5,6,2012,1,0,6,1613.76,6,0,16.9979,118.08,0,0
12/8/12 9:00,3,0,0,1,28.7,48,15.0013,217,2012-08-12 09:00:00,9,12,8,2012,6,1,9,1377.6,0,9,15.0013,258.3,1,0
19/8/11 12:00,3,0,1,2,31.30062662,62,6.226898911,202,2011-08-19 12:00:00,12,19,8,2011,4,0,24,1940.63885044,12,0,12.453797822,375.60751944,0,0
5/1/12 6:00,1,0,1,2,8.2,75,8.9981,78,2012-01-05 06:00:00,6,5,1,2012,3,0,12,615.0,6,0,17.9962,49.199999999999996,0,0
18/12/11 12:00,4,0,0,1,10.66,60,15.0013,228,2011-12-18 12:00:00,12,18,12,2011,6,1,12,639.6,0,12,15.0013,127.92,0,0
9/10/12 12:00,4,0,1,2,19.68,69,12.998,260,2012-10-09 12:00:00,12,9,10,2012,1,0,24,1357.92,12,0,25.996,236.16,0,0
18/12/12 12:00,4,0,1,3,19.68,48,16.9979,313,2012-12-18 12:00:00,12,18,12,2012,1,0,36,944.64,12,0,50.993700000000004,236.16,0,0
11/5/11 23:00,2,0,1,1,18.86,88,16.9979,81,2011-05-11 23:00:00,23,11,5,2011,2,0,23,1659.6799999999998,23,0,16.9979,433.78,0,0
1/9/11 9:00,3,0,1,1,26.24,69,7.0015,207,2011-09-01 09:00:00,9,1,9,2011,3,0,9,1810.56,9,0,7.0015,236.16,1,0
2/12/12 2:00,4,0,0,2,12.3,87,0.0,74,2012-12-02 02:00:00,2,2,12,2012,6,1,4,1070.1000000000001,0,2,0.0,24.6,0,0
4/12/12 8:00,4,0,1,2,18.04,88,11.0014,721,2012-12-04 08:00:00,8,4,12,2012,1,0,16,1587.52,8,0,22.0028,144.32,1,0
12/1/12 20:00,1,0,1,2,17.21912756,70,11.95423743,240,2012-01-12 20:00:00,20,12,1,2012,3,0,40,1205.3389292,20,0,23.90847486,344.3825512,0,0
6/9/11 16:00,3,0,1,3,22.14,94,26.0027,106,2011-09-06 16:00:00,16,6,9,2011,1,0,48,2081.16,16,0,78.0081,354.24,0,0
18/4/12 3:00,2,0,1,2,20.5,42,15.0013,6,2012-04-18 03:00:00,3,18,4,2012,2,0,6,861.0,3,0,30.0026,61.5,0,0
18/2/11 23:00,1,0,1,1,21.32,8,19.0012,77,2011-02-18 23:00:00,23,18,2,2011,4,0,23,170.56,23,0,19.0012,490.36,0,0
16/1/12 5:00,1,1,0,1,4.92,54,6.0032,6,2012-01-16 05:00:00,5,16,1,2012,0,0,5,265.68,0,0,6.0032,24.6,0,0
14/1/12 5:00,1,0,0,1,5.74,50,8.9981,4,2012-01-14 05:00:00,5,14,1,2012,5,1,5,287.0,0,5,8.9981,28.700000000000003,0,0
16/10/12 22:00,4,0,1,1,16.4,71,6.0032,181,2012-10-16 22:00:00,22,16,10,2012,1,0,22,1164.3999999999999,22,0,6.0032,360.79999999999995,0,0
14/4/11 5:00,2,0,1,1,13.94,76,6.0032,14,2011-04-14 05:00:00,5,14,4,2011,3,0,5,1059.44,5,0,6.0032,69.7,0,0
5/4/11 18:00,2,0,1,1,15.58,40,32.9975,267,2011-04-05 18:00:00,18,5,4,2011,1,0,18,623.2,18,0,32.9975,280.44,0,1
14/6/12 2:00,2,0,1,2,25.42,53,16.9979,9,2012-06-14 02:00:00,2,14,6,2012,3,0,4,1347.26,2,0,33.9958,50.84,0,0
10/12/11 3:00,4,0,0,2,11.48,61,6.0032,25,2011-12-10 03:00:00,3,10,12,2011,5,1,6,700.28,0,3,12.0064,34.44,0,0
15/5/12 5:00,2,0,1,3,22.96,94,15.0013,8,2012-05-15 05:00:00,5,15,5,2012,1,0,15,2158.2400000000002,5,0,45.0039,114.80000000000001,0,0
11/11/11 14:00,4,1,0,1,15.58,37,31.0009,247,2011-11-11 14:00:00,14,11,11,2011,4,0,14,576.46,0,0,31.0009,218.12,0,0
13/5/12 19:00,2,0,0,2,27.06,50,27.9993,339,2012-05-13 19:00:00,19,13,5,2012,6,1,38,1353.0,0,19,55.9986,514.14,0,1
1/2/12 9:00,1,0,1,2,14.76,71,12.998,276,2012-02-01 09:00:00,9,1,2,2012,2,0,18,1047.96,9,0,25.996,132.84,1,0
15/8/12 8:00,3,0,1,2,28.7,65,19.0012,682,2012-08-15 08:00:00,8,15,8,2012,2,0,16,1865.5,8,0,38.0024,229.6,1,0
8/11/11 11:00,4,0,1,1,18.86,63,8.9981,147,2011-11-08 11:00:00,11,8,11,2011,1,0,11,1188.18,11,0,8.9981,207.45999999999998,0,0
4/7/11 12:00,3,1,0,2,31.98,52,0.0,447,2011-07-04 12:00:00,12,4,7,2011,0,0,24,1662.96,0,0,0.0,383.76,0,0
3/6/11 0:00,2,0,1,1,25.42,38,19.0012,68,2011-06-03 00:00:00,0,3,6,2011,4,0,0,965.96,0,0,19.0012,0.0,0,0
11/6/12 6:00,2,0,1,1,25.42,83,7.0015,144,2012-06-11 06:00:00,6,11,6,2012,0,0,6,2109.86,6,0,7.0015,152.52,0,0
6/1/11 22:00,1,0,1,2,9.02,51,19.0012,52,2011-01-06 22:00:00,22,6,1,2011,3,0,44,460.02,22,0,38.0024,198.44,0,0
2/5/11 12:00,2,0,1,1,25.42,69,15.0013,187,2011-05-02 12:00:00,12,2,5,2011,0,0,12,1753.98,12,0,15.0013,305.04,0,0
2/4/11 8:00,2,0,0,1,12.3,70,7.0015,55,2011-04-02 08:00:00,8,2,4,2011,5,1,8,861.0,0,8,7.0015,98.4,1,0
15/3/11 9:00,1,0,1,2,12.3,70,0.0,157,2011-03-15 09:00:00,9,15,3,2011,1,0,18,861.0,9,0,0.0,110.7,1,0
10/6/11 16:00,2,0,1,1,33.62,56,19.9995,285,2011-06-10 16:00:00,16,10,6,2011,4,0,16,1882.7199999999998,16,0,19.9995,537.92,0,0
15/10/12 19:00,4,0,1,3,20.58451013,80,5.871718062,213,2012-10-15 19:00:00,19,15,10,2012,0,0,57,1646.7608104,19,0,17.615154186,391.10569247,0,1
16/4/12 11:00,2,1,0,1,26.24,65,16.9979,251,2012-04-16 11:00:00,11,16,4,2012,0,0,11,1705.6,0,0,16.9979,288.64,0,0
13/7/11 23:00,3,0,1,1,27.06,83,16.9979,116,2011-07-13 23:00:00,23,13,7,2011,2,0,23,2245.98,23,0,16.9979,622.38,0,0
18/12/12 8:00,4,0,1,1,15.58,94,0.0,662,2012-12-18 08:00:00,8,18,12,2012,1,0,8,1464.52,8,0,0.0,124.64,1,0
13/5/11 11:00,2,0,1,2,21.32,83,11.0014,146,2011-05-13 11:00:00,11,13,5,2011,4,0,22,1769.56,11,0,22.0028,234.52,0,0
12/8/12 18:00,3,0,0,1,32.10627016,38,6.988373192,462,2012-08-12 18:00:00,18,12,8,2012,6,1,18,1220.03826608,0,18,6.988373192,577.91286288,0,1
12/9/11 4:00,3,0,1,1,22.14,94,7.0015,4,2011-09-12 04:00:00,4,12,9,2011,0,0,4,2081.16,4,0,7.0015,88.56,0,0
17/2/11 12:00,1,0,1,1,19.68,41,15.0013,101,2011-02-17 12:00:00,12,17,2,2011,3,0,12,806.88,12,0,15.0013,236.16,0,0
2/12/12 17:00,4,0,0,3,16.4,76,12.998,303,2012-12-02 17:00:00,17,2,12,2012,6,1,51,1246.3999999999999,0,17,38.994,278.79999999999995,0,1
16/1/11 15:00,1,0,0,1,10.66,38,16.9979,113,2011-01-16 15:00:00,15,16,1,2011,6,1,15,405.08,0,15,16.9979,159.9,0,0
18/3/11 11:00,1,0,1,1,22.14,52,19.0012,159,2011-03-18 11:00:00,11,18,3,2011,4,0,11,1151.28,11,0,19.0012,243.54000000000002,0,0
15/8/12 20:00,3,0,1,1,28.7,61,8.9981,427,2012-08-15 20:00:00,20,15,8,2012,2,0,20,1750.7,20,0,8.9981,574.0,0,0
10/9/12 16:00,3,0,1,1,27.06,34,22.0028,488,2012-09-10 16:00:00,16,10,9,2012,0,0,16,920.04,16,0,22.0028,432.96,0,0
11/1/12 6:00,1,0,1,1,9.056444976,89,9.684515047,81,2012-01-11 06:00:00,6,11,1,2012,2,0,6,806.0236028639999,6,0,9.684515047,54.338669855999996,0,0
6/2/12 4:00,1,0,1,1,7.38,80,7.0015,2,2012-02-06 04:00:00,4,6,2,2012,0,0,4,590.4,4,0,7.0015,29.52,0,0
9/10/11 0:00,4,0,0,1,18.86,88,6.0032,129,2011-10-09 00:00:00,0,9,10,2011,6,1,0,1659.6799999999998,0,0,6.0032,0.0,0,0
15/1/11 3:00,1,0,0,2,6.56,59,0.0,8,2011-01-15 03:00:00,3,15,1,2011,5,1,6,387.03999999999996,0,3,0.0,19.68,0,0
6/9/11 12:00,3,0,1,3,22.14,83,26.0027,67,2011-09-06 12:00:00,12,6,9,2011,1,0,36,1837.6200000000001,12,0,78.0081,265.68,0,0
15/2/11 14:00,1,0,1,1,13.94,19,15.0013,79,2011-02-15 14:00:00,14,15,2,2011,1,0,14,264.86,14,0,15.0013,195.16,0,0
2/10/11 9:00,4,0,0,1,14.76,76,23.9994,115,2011-10-02 09:00:00,9,2,10,2011,6,1,9,1121.76,0,9,23.9994,132.84,1,0
16/4/12 22:00,2,1,0,1,27.88,51,16.9979,214,2012-04-16 22:00:00,22,16,4,2012,0,0,22,1421.8799999999999,0,0,16.9979,613.36,0,0
11/11/12 17:00,4,0,0,1,22.14,45,11.0014,493,2012-11-11 17:00:00,17,11,11,2012,6,1,17,996.3000000000001,0,17,11.0014,376.38,0,1
16/3/12 18:00,1,0,1,3,20.16993228,81,5.181650249,431,2012-03-16 18:00:00,18,16,3,2012,4,0,54,1633.76451468,18,0,15.544950746999998,363.05878104000004,0,1
16/4/11 9:00,2,0,0,3,16.4,100,19.9995,29,2011-04-16 09:00:00,9,16,4,2011,5,1,27,1639.9999999999998,0,9,59.99850000000001,147.6,1,0
1/2/12 18:00,1,0,1,1,22.96,46,11.0014,526,2012-02-01 18:00:00,18,1,2,2012,2,0,18,1056.16,18,0,11.0014,413.28000000000003,0,1
19/7/11 17:00,3,0,1,1,32.8,66,0.0,513,2011-07-19 17:00:00,17,19,7,2011,1,0,17,2164.7999999999997,17,0,0.0,557.5999999999999,0,1
13/8/12 17:00,3,0,1,1,32.8,36,11.0014,818,2012-08-13 17:00:00,17,13,8,2012,0,0,17,1180.8,17,0,11.0014,557.5999999999999,0,1
7/3/12 20:00,1,0,1,1,20.5,51,16.9979,260,2012-03-07 20:00:00,20,7,3,2012,2,0,20,1045.5,20,0,16.9979,410.0,0,0
13/7/11 20:00,3,0,1,1,28.7,84,11.0014,342,2011-07-13 20:00:00,20,13,7,2011,2,0,20,2410.7999999999997,20,0,11.0014,574.0,0,0
8/11/12 18:00,4,0,1,1,16.4,24,27.9993,507,2012-11-08 18:00:00,18,8,11,2012,3,0,18,393.59999999999997,18,0,27.9993,295.2,0,1
6/9/11 8:00,3,0,1,3,22.14,83,26.0027,364,2011-09-06 08:00:00,8,6,9,2011,1,0,24,1837.6200000000001,8,0,78.0081,177.12,1,0
8/2/12 12:00,1,0,1,2,11.48,65,19.0012,138,2012-02-08 12:00:00,12,8,2,2012,2,0,24,746.2,12,0,38.0024,137.76,0,0
11/4/11 0:00,2,0,1,1,19.68,88,22.0028,23,2011-04-11 00:00:00,0,11,4,2011,0,0,0,1731.84,0,0,22.0028,0.0,0,0
5/10/12 17:00,4,0,1,1,28.7,42,11.0014,900,2012-10-05 17:00:00,17,5,10,2012,4,0,17,1205.3999999999999,17,0,11.0014,487.9,0,1
3/10/11 23:00,4,0,1,2,16.8493475,83,7.316085886,41,2011-10-03 23:00:00,23,3,10,2011,0,0,46,1398.4958425,23,0,14.632171772,387.5349925,0,0
7/7/11 20:00,3,0,1,1,31.16,58,23.9994,285,2011-07-07 20:00:00,20,7,7,2011,3,0,20,1807.28,20,0,23.9994,623.2,0,0
14/8/12 12:00,3,0,1,1,31.98,49,8.9981,300,2012-08-14 12:00:00,12,14,8,2012,1,0,12,1567.02,12,0,8.9981,383.76,0,0
11/11/12 10:00,4,0,0,1,16.4,69,7.0015,405,2012-11-11 10:00:00,10,11,11,2012,6,1,10,1131.6,0,10,7.0015,164.0,0,0
2/7/12 16:00,3,0,1,1,34.44,36,19.0012,365,2012-07-02 16:00:00,16,2,7,2012,0,0,16,1239.84,16,0,19.0012,551.04,0,0
2/10/11 4:00,4,0,0,2,13.94,87,16.9979,7,2011-10-02 04:00:00,4,2,10,2011,6,1,8,1212.78,0,4,33.9958,55.76,0,0
8/7/12 10:00,3,0,0,1,37.08462592,46,0.161110922,333,2012-07-08 10:00:00,10,8,7,2012,6,1,10,1705.8927923200001,0,10,0.161110922,370.8462592,0,0
8/6/12 2:00,2,0,1,1,22.96,56,0.0,19,2012-06-08 02:00:00,2,8,6,2012,4,0,2,1285.76,2,0,0.0,45.92,0,0
4/10/11 17:00,4,0,1,1,22.96,60,26.0027,585,2011-10-04 17:00:00,17,4,10,2011,1,0,17,1377.6000000000001,17,0,26.0027,390.32,0,1
18/10/11 9:00,4,0,1,2,21.32,77,6.0032,227,2011-10-18 09:00:00,9,18,10,2011,1,0,18,1641.64,9,0,12.0064,191.88,1,0
18/3/12 17:00,1,0,0,1,22.96,64,6.0032,541,2012-03-18 17:00:00,17,18,3,2012,6,1,17,1469.44,0,17,6.0032,390.32,0,1
12/7/11 17:00,3,0,1,1,36.08,44,19.0012,428,2011-07-12 17:00:00,17,12,7,2011,1,0,17,1587.52,17,0,19.0012,613.36,0,1
13/8/11 5:00,3,0,0,1,26.07683723,74,6.983314899,2,2011-08-13 05:00:00,5,13,8,2011,5,1,5,1929.68595502,0,5,6.983314899,130.38418615,0,0
18/11/11 11:00,4,0,1,1,12.3,36,8.9981,140,2011-11-18 11:00:00,11,18,11,2011,4,0,11,442.8,11,0,8.9981,135.3,0,0
18/10/12 3:00,4,0,1,1,18.04,88,15.0013,5,2012-10-18 03:00:00,3,18,10,2012,3,0,3,1587.52,3,0,15.0013,54.12,0,0
14/8/11 10:00,3,0,0,1,28.7,79,15.0013,183,2011-08-14 10:00:00,10,14,8,2011,6,1,10,2267.2999999999997,0,10,15.0013,287.0,0,0
4/10/11 9:00,4,0,1,1,18.86,67,16.9979,187,2011-10-04 09:00:00,9,4,10,2011,1,0,9,1263.62,9,0,16.9979,169.74,1,0
7/8/11 1:00,3,0,0,2,28.7,84,16.9979,73,2011-08-07 01:00:00,1,7,8,2011,6,1,2,2410.7999999999997,0,1,33.9958,28.7,0,0
17/7/11 9:00,3,0,0,1,28.59367335,58,15.00718864,202,2011-07-17 09:00:00,9,17,7,2011,6,1,9,1658.4330542999999,0,9,15.00718864,257.34306015,1,0
15/6/12 16:00,2,0,1,1,29.52,37,12.998,558,2012-06-15 16:00:00,16,15,6,2012,4,0,16,1092.24,16,0,12.998,472.32,0,0
9/5/12 10:00,2,0,1,2,25.42,65,16.9979,153,2012-05-09 10:00:00,10,9,5,2012,2,0,20,1652.3000000000002,10,0,33.9958,254.20000000000002,0,0
14/2/12 15:00,1,0,1,2,17.22,38,30.0026,145,2012-02-14 15:00:00,15,14,2,2012,1,0,30,654.3599999999999,15,0,60.0052,258.29999999999995,0,0
15/2/11 23:00,1,0,1,2,9.130373088,42,6.583134558,36,2011-02-15 23:00:00,23,15,2,2011,1,0,46,383.475669696,23,0,13.166269116,209.998581024,0,0
1/5/12 5:00,2,0,1,2,21.32,72,6.0032,17,2012-05-01 05:00:00,5,1,5,2012,1,0,10,1535.04,5,0,12.0064,106.6,0,0
3/4/11 4:00,2,0,0,1,11.48,70,6.0032,3,2011-04-03 04:00:00,4,3,4,2011,6,1,4,803.6,0,4,6.0032,45.92,0,0
1/12/12 13:00,4,0,0,2,16.32386125,75,0.0,495,2012-12-01 13:00:00,13,1,12,2012,5,1,26,1224.28959375,0,13,0.0,212.21019625,0,0
14/9/11 15:00,3,0,1,1,31.98,49,16.9979,176,2011-09-14 15:00:00,15,14,9,2011,2,0,15,1567.02,15,0,16.9979,479.7,0,0
17/6/12 3:00,2,0,0,1,22.14,64,7.0015,28,2012-06-17 03:00:00,3,17,6,2012,6,1,3,1416.96,0,3,7.0015,66.42,0,0
10/12/11 8:00,4,0,0,1,10.66,65,8.9981,73,2011-12-10 08:00:00,8,10,12,2011,5,1,8,692.9,0,8,8.9981,85.28,1,0
4/7/12 9:00,3,1,0,1,31.16,52,0.0,293,2012-07-04 09:00:00,9,4,7,2012,2,0,9,1620.32,0,0,0.0,280.44,1,0
6/12/11 23:00,4,0,1,3,18.86,100,11.0014,53,2011-12-06 23:00:00,23,6,12,2011,1,0,69,1886.0,23,0,33.0042,433.78,0,0
17/1/12 14:00,1,0,1,1,18.04,62,32.9975,132,2012-01-17 14:00:00,14,17,1,2012,1,0,14,1118.48,14,0,32.9975,252.56,0,0
7/2/11 2:00,1,0,1,1,8.2,80,0.0,3,2011-02-07 02:00:00,2,7,2,2011,0,0,2,656.0,2,0,0.0,16.4,0,0
5/10/11 1:00,4,0,1,1,19.68,77,11.0014,11,2011-10-05 01:00:00,1,5,10,2011,2,0,1,1515.36,1,0,11.0014,19.68,0,0
13/9/12 12:00,3,0,1,1,27.88,44,7.0015,297,2012-09-13 12:00:00,12,13,9,2012,3,0,12,1226.72,12,0,7.0015,334.56,0,0
12/5/11 23:00,2,0,1,2,22.14,77,12.998,103,2011-05-12 23:00:00,23,12,5,2011,3,0,46,1704.78,23,0,25.996,509.22,0,0
1/3/12 23:00,1,0,1,1,14.76,50,15.0013,85,2012-03-01 23:00:00,23,1,3,2012,3,0,23,738.0,23,0,15.0013,339.48,0,0
16/6/12 13:00,2,0,0,1,29.52,34,11.0014,617,2012-06-16 13:00:00,13,16,6,2012,5,1,13,1003.68,0,13,11.0014,383.76,0,0
14/9/12 7:00,3,0,1,2,22.20468439,87,0.0,442,2012-09-14 07:00:00,7,14,9,2012,4,0,14,1931.80754193,7,0,0.0,155.43279073,1,0
18/7/11 9:00,3,0,1,1,30.34,67,15.0013,203,2011-07-18 09:00:00,9,18,7,2011,0,0,9,2032.78,9,0,15.0013,273.06,1,0
16/1/12 19:00,1,1,0,1,10.66,56,19.0012,144,2012-01-16 19:00:00,19,16,1,2012,0,0,19,596.96,0,0,19.0012,202.54,0,1
8/9/12 20:00,3,0,0,2,23.78,88,6.0032,194,2012-09-08 20:00:00,20,8,9,2012,5,1,40,2092.6400000000003,0,20,12.0064,475.6,0,0
4/11/12 23:00,4,0,0,2,12.59299835,57,9.778885658,20,2012-11-04 23:00:00,23,4,11,2012,6,1,46,717.80090595,0,23,19.557771316,289.63896205000003,0,0
8/4/11 14:00,2,0,1,3,13.94,87,15.0013,15,2011-04-08 14:00:00,14,8,4,2011,4,0,42,1212.78,14,0,45.0039,195.16,0,0
7/2/11 16:00,1,0,1,2,14.76,57,8.9981,114,2011-02-07 16:00:00,16,7,2,2011,0,0,32,841.3199999999999,16,0,17.9962,236.16,0,0
15/7/12 23:00,3,0,0,1,29.52,79,8.9981,91,2012-07-15 23:00:00,23,15,7,2012,6,1,23,2332.08,0,23,8.9981,678.96,0,0
4/12/12 11:00,4,0,1,1,19.68,77,12.998,207,2012-12-04 11:00:00,11,4,12,2012,1,0,11,1515.36,11,0,12.998,216.48,0,0
3/3/11 5:00,1,0,1,1,5.74,33,19.9995,8,2011-03-03 05:00:00,5,3,3,2011,3,0,5,189.42000000000002,5,0,19.9995,28.700000000000003,0,0
5/10/12 9:00,4,0,1,1,23.66290815,62,5.456843056,388,2012-10-05 09:00:00,9,5,10,2012,4,0,9,1467.1003053,9,0,5.456843056,212.96617335,1,0
8/1/11 2:00,1,0,0,2,7.38,55,0.0,16,2011-01-08 02:00:00,2,8,1,2011,5,1,4,405.9,0,2,0.0,14.76,0,0
5/7/11 8:00,3,0,1,1,29.52,62,8.9981,432,2011-07-05 08:00:00,8,5,7,2011,1,0,8,1830.24,8,0,8.9981,236.16,1,0
12/8/12 18:00,3,0,0,1,31.98,35,7.0015,491,2012-08-12 18:00:00,18,12,8,2012,6,1,18,1119.3,0,18,7.0015,575.64,0,1
10/6/12 6:00,2,0,0,1,25.42,73,0.0,30,2012-06-10 06:00:00,6,10,6,2012,6,1,6,1855.66,0,6,0.0,152.52,0,0
15/7/12 14:00,3,0,0,1,36.9,37,16.9979,476,2012-07-15 14:00:00,14,15,7,2012,6,1,14,1365.3,0,14,16.9979,516.6,0,0
14/6/11 22:00,2,0,1,1,23.78,60,15.0013,188,2011-06-14 22:00:00,22,14,6,2011,1,0,22,1426.8000000000002,22,0,15.0013,523.1600000000001,0,0
11/1/12 15:00,1,0,1,2,13.94,87,6.0032,79,2012-01-11 15:00:00,15,11,1,2012,2,0,30,1212.78,15,0,12.0064,209.1,0,0
6/3/11 11:00,1,0,0,2,17.22,100,15.0013,62,2011-03-06 11:00:00,11,6,3,2011,6,1,22,1722.0,0,11,30.0026,189.42,0,0
17/3/11 9:00,1,0,1,1,16.4,62,16.9979,185,2011-03-17 09:00:00,9,17,3,2011,3,0,9,1016.8,9,0,16.9979,147.6,1,0
7/11/11 22:00,4,0,1,1,14.76,81,6.0032,108,2011-11-07 22:00:00,22,7,11,2011,0,0,22,1195.56,22,0,6.0032,324.71999999999997,0,0
18/2/11 2:00,1,0,1,1,17.4557762,70,18.9473973,1,2011-02-18 02:00:00,2,18,2,2011,4,0,2,1221.9043339999998,2,0,18.9473973,34.9115524,0,0
18/8/11 1:00,3,0,1,2,27.06,65,11.0014,24,2011-08-18 01:00:00,1,18,8,2011,3,0,2,1758.8999999999999,1,0,22.0028,27.06,0,0
1/5/12 11:00,2,0,1,2,27.06,65,19.0012,229,2012-05-01 11:00:00,11,1,5,2012,1,0,22,1758.8999999999999,11,0,38.0024,297.65999999999997,0,0
8/2/12 1:00,1,0,1,1,11.58311897,62,10.61433171,17,2012-02-08 01:00:00,1,8,2,2012,2,0,1,718.15337614,1,0,10.61433171,11.58311897,0,0
1/1/11 1:00,1,0,0,1,9.02,80,0.0,40,2011-01-01 01:00:00,1,1,1,2011,5,1,1,721.5999999999999,0,1,0.0,9.02,0,0
14/4/11 10:00,2,0,1,1,20.5,51,12.998,89,2011-04-14 10:00:00,10,14,4,2011,3,0,10,1045.5,10,0,12.998,205.0,0,0
12/1/12 13:00,1,0,1,1,17.22,77,11.0014,183,2012-01-12 13:00:00,13,12,1,2012,3,0,13,1325.9399999999998,13,0,11.0014,223.85999999999999,0,0
7/12/12 2:00,4,0,1,2,10.66,70,8.9981,11,2012-12-07 02:00:00,2,7,12,2012,4,0,4,746.2,2,0,17.9962,21.32,0,0
16/2/12 23:00,1,0,1,1,13.12,81,6.0032,73,2012-02-16 23:00:00,23,16,2,2012,3,0,23,1062.72,23,0,6.0032,301.76,0,0
4/3/11 0:00,1,0,1,2,8.2,55,12.998,12,2011-03-04 00:00:00,0,4,3,2011,4,0,0,450.99999999999994,0,0,25.996,0.0,0,0
4/9/11 5:00,3,0,0,1,26.24,83,8.9981,6,2011-09-04 05:00:00,5,4,9,2011,6,1,5,2177.92,0,5,8.9981,131.2,0,0
12/3/11 21:00,1,0,0,1,15.58,62,0.0,82,2011-03-12 21:00:00,21,12,3,2011,5,1,21,965.96,0,21,0.0,327.18,0,0
1/11/11 23:00,4,0,1,1,13.94,87,0.0,72,2011-11-01 23:00:00,23,1,11,2011,1,0,23,1212.78,23,0,0.0,320.62,0,0
12/5/11 2:00,2,0,1,1,18.04,94,12.998,15,2011-05-12 02:00:00,2,12,5,2011,3,0,2,1695.76,2,0,12.998,36.08,0,0
4/9/11 14:00,3,0,0,1,32.19605263,67,23.160589,354,2011-09-04 14:00:00,14,4,9,2011,6,1,14,2157.1355262099996,0,14,23.160589,450.74473681999996,0,0
10/1/11 5:00,1,0,1,1,4.1,54,16.9979,3,2011-01-10 05:00:00,5,10,1,2011,0,0,5,221.39999999999998,5,0,16.9979,20.5,0,0
14/11/12 6:00,4,0,1,1,9.84,65,12.998,146,2012-11-14 06:00:00,6,14,11,2012,2,0,6,639.6,6,0,12.998,59.04,0,0
11/12/11 5:00,4,0,0,1,7.38,59,7.0015,6,2011-12-11 05:00:00,5,11,12,2011,6,1,5,435.42,0,5,7.0015,36.9,0,0
14/9/12 11:00,3,0,1,2,27.88,61,7.0015,280,2012-09-14 11:00:00,11,14,9,2012,4,0,22,1700.6799999999998,11,0,14.003,306.68,0,0
19/12/12 16:00,4,0,1,1,17.22,50,23.9994,334,2012-12-19 16:00:00,16,19,12,2012,2,0,16,861.0,16,0,23.9994,275.52,0,0
4/10/11 3:00,4,0,1,1,16.4,82,7.0015,6,2011-10-04 03:00:00,3,4,10,2011,1,0,3,1344.8,3,0,7.0015,49.199999999999996,0,0
15/6/11 4:00,2,0,1,1,20.5,63,19.0012,4,2011-06-15 04:00:00,4,15,6,2011,2,0,4,1291.5,4,0,19.0012,82.0,0,0
1/7/12 15:00,3,0,0,1,36.9,37,19.0012,345,2012-07-01 15:00:00,15,1,7,2012,6,1,15,1365.3,0,15,19.0012,553.5,0,0
11/4/11 11:00,2,0,1,2,24.6,73,19.9995,104,2011-04-11 11:00:00,11,11,4,2011,0,0,22,1795.8000000000002,11,0,39.999,270.6,0,0
14/2/12 1:00,1,0,1,2,10.66,56,0.0,6,2012-02-14 01:00:00,1,14,2,2012,1,0,2,596.96,1,0,0.0,10.66,0,0
2/2/11 16:00,1,0,1,1,15.4393755,71,20.94584862,88,2011-02-02 16:00:00,16,2,2,2011,2,0,16,1096.1956605,16,0,20.94584862,247.030008,0,0
9/3/11 2:00,1,0,1,1,10.66,52,8.9981,2,2011-03-09 02:00:00,2,9,3,2011,2,0,2,554.32,2,0,8.9981,21.32,0,0
15/3/12 6:00,1,0,1,1,18.04,72,6.0032,117,2012-03-15 06:00:00,6,15,3,2012,3,0,6,1298.8799999999999,6,0,6.0032,108.24,0,0
4/8/11 14:00,3,0,1,1,32.8,55,11.0014,167,2011-08-04 14:00:00,14,4,8,2011,3,0,14,1803.9999999999998,14,0,11.0014,459.19999999999993,0,0
15/10/11 21:00,4,0,0,1,20.5,42,15.0013,168,2011-10-15 21:00:00,21,15,10,2011,5,1,21,861.0,0,21,15.0013,430.5,0,0
11/12/11 14:00,4,0,0,1,12.3,28,0.0,242,2011-12-11 14:00:00,14,11,12,2011,6,1,14,344.40000000000003,0,14,0.0,172.20000000000002,0,0
5/3/12 9:00,1,0,1,2,9.02,60,6.0032,197,2012-03-05 09:00:00,9,5,3,2012,0,0,18,541.1999999999999,9,0,12.0064,81.17999999999999,1,0
3/2/12 18:00,1,0,1,1,15.58,40,8.9981,385,2012-02-03 18:00:00,18,3,2,2012,4,0,18,623.2,18,0,8.9981,280.44,0,1
1/3/12 9:00,1,0,1,1,18.86,77,16.9979,286,2012-03-01 09:00:00,9,1,3,2012,3,0,9,1452.22,9,0,16.9979,169.74,1,0
1/3/11 0:00,1,0,1,1,12.3,70,31.0009,7,2011-03-01 00:00:00,0,1,3,2011,1,0,0,861.0,0,0,31.0009,0.0,0,0
14/7/11 7:00,3,0,1,1,25.42,53,16.9979,334,2011-07-14 07:00:00,7,14,7,2011,3,0,7,1347.26,7,0,16.9979,177.94,1,0
4/10/11 23:00,4,0,1,1,19.68,77,8.9981,66,2011-10-04 23:00:00,23,4,10,2011,1,0,23,1515.36,23,0,8.9981,452.64,0,0
6/1/11 5:00,1,0,1,2,5.74,69,6.0032,4,2011-01-06 05:00:00,5,6,1,2011,3,0,10,396.06,5,0,12.0064,28.700000000000003,0,0
13/3/11 1:00,1,0,0,1,13.82569712,68,9.173536454,13,2011-03-13 01:00:00,1,13,3,2011,6,1,1,940.14740416,0,1,9.173536454,13.82569712,0,0
19/10/11 5:00,4,0,1,3,20.80816447,100,6.403146056,21,2011-10-19 05:00:00,5,19,10,2011,2,0,15,2080.816447,5,0,19.209438168,104.04082235000001,0,0
5/3/11 10:00,1,0,0,2,13.94,93,12.998,103,2011-03-05 10:00:00,10,5,3,2011,5,1,20,1296.4199999999998,0,10,25.996,139.4,0,0
3/7/12 2:00,3,0,1,1,28.1325219,58,1.154077233,16,2012-07-03 02:00:00,2,3,7,2012,1,0,2,1631.6862702,2,0,1.154077233,56.2650438,0,0
14/1/11 19:00,1,0,1,1,6.56,59,6.0032,92,2011-01-14 19:00:00,19,14,1,2011,4,0,19,387.03999999999996,19,0,6.0032,124.63999999999999,0,1
14/6/12 3:00,2,0,1,2,25.42,53,19.0012,5,2012-06-14 03:00:00,3,14,6,2012,3,0,6,1347.26,3,0,38.0024,76.26,0,0
2/8/11 7:00,3,0,1,1,29.52,61,19.0012,335,2011-08-02 07:00:00,7,2,8,2011,1,0,7,1800.72,7,0,19.0012,206.64,1,0
4/9/11 15:00,3,0,0,1,31.98,66,19.0012,410,2011-09-04 15:00:00,15,4,9,2011,6,1,15,2110.68,0,15,19.0012,479.7,0,0
12/9/11 18:00,3,0,1,1,28.7,54,12.998,571,2011-09-12 18:00:00,18,12,9,2011,0,0,18,1549.8,18,0,12.998,516.6,0,1
11/8/11 17:00,3,0,1,1,32.8,29,16.9979,582,2011-08-11 17:00:00,17,11,8,2011,3,0,17,951.1999999999999,17,0,16.9979,557.5999999999999,0,1
5/7/12 16:00,3,0,1,1,37.72,33,16.9979,433,2012-07-05 16:00:00,16,5,7,2012,3,0,16,1244.76,16,0,16.9979,603.52,0,0
6/12/12 17:00,4,0,1,1,12.3,45,7.0015,617,2012-12-06 17:00:00,17,6,12,2012,3,0,17,553.5,17,0,7.0015,209.10000000000002,0,1
16/3/12 0:00,1,0,1,1,18.04,77,16.9979,57,2012-03-16 00:00:00,0,16,3,2012,4,0,0,1389.08,0,0,16.9979,0.0,0,0
1/1/11 13:00,1,0,0,2,18.86,72,19.9995,94,2011-01-01 13:00:00,13,1,1,2011,5,1,26,1357.92,0,13,39.999,245.18,0,0
2/5/12 11:00,2,0,1,2,23.78,81,8.9981,184,2012-05-02 11:00:00,11,2,5,2012,2,0,22,1926.18,11,0,17.9962,261.58000000000004,0,0
19/10/12 22:00,4,0,1,1,20.5,77,6.0032,190,2012-10-19 22:00:00,22,19,10,2012,4,0,22,1578.5,22,0,6.0032,451.0,0,0
15/12/11 2:00,4,0,1,2,13.12,70,8.9981,7,2011-12-15 02:00:00,2,15,12,2011,3,0,4,918.4,2,0,17.9962,26.24,0,0
11/12/12 12:00,4,0,1,2,14.76,53,30.0026,226,2012-12-11 12:00:00,12,11,12,2012,1,0,24,782.28,12,0,60.0052,177.12,0,0
3/1/11 14:00,1,0,1,1,10.66,30,19.0012,77,2011-01-03 14:00:00,14,3,1,2011,0,0,14,319.8,14,0,19.0012,149.24,0,0
4/3/12 8:00,1,0,0,1,12.3,52,22.0028,66,2012-03-04 08:00:00,8,4,3,2012,6,1,8,639.6,0,8,22.0028,98.4,1,0
13/8/11 13:00,3,0,0,2,30.34,74,22.0028,153,2011-08-13 13:00:00,13,13,8,2011,5,1,26,2245.16,0,13,44.0056,394.42,0,0
8/8/12 20:00,3,0,1,1,30.34,66,12.998,500,2012-08-08 20:00:00,20,8,8,2012,2,0,20,2002.44,20,0,12.998,606.8,0,0
12/5/12 1:00,2,0,0,1,20.5,48,0.0,93,2012-05-12 01:00:00,1,12,5,2012,5,1,1,984.0,0,1,0.0,20.5,0,0
13/9/12 15:00,3,0,1,1,29.52,42,7.0015,352,2012-09-13 15:00:00,15,13,9,2012,3,0,15,1239.84,15,0,7.0015,442.8,0,0
8/8/12 8:00,3,0,1,2,30.34,72,6.0032,737,2012-08-08 08:00:00,8,8,8,2012,2,0,16,2184.48,8,0,12.0064,242.72,1,0
3/1/11 23:00,1,0,1,1,7.38,55,7.0015,12,2011-01-03 23:00:00,23,3,1,2011,0,0,23,405.9,23,0,7.0015,169.74,0,0
15/6/11 8:00,2,0,1,1,23.78,53,8.9981,498,2011-06-15 08:00:00,8,15,6,2011,2,0,8,1260.3400000000001,8,0,8.9981,190.24,1,0
18/5/11 16:00,2,0,1,1,25.86229234,76,13.09136076,320,2011-05-18 16:00:00,16,18,5,2011,2,0,16,1965.5342178399999,16,0,13.09136076,413.79667744,0,0
2/7/11 19:00,3,0,0,1,32.8,33,15.0013,305,2011-07-02 19:00:00,19,2,7,2011,5,1,19,1082.3999999999999,0,19,15.0013,623.1999999999999,0,1
14/2/11 7:00,1,0,1,1,13.94,46,19.9995,98,2011-02-14 07:00:00,7,14,2,2011,0,0,7,641.24,7,0,19.9995,97.58,1,0
12/3/11 0:00,1,0,0,1,10.66,60,8.9981,34,2011-03-12 00:00:00,0,12,3,2011,5,1,0,639.6,0,0,8.9981,0.0,0,0
17/1/12 11:00,1,0,1,2,13.24852459,87,7.565130802,83,2012-01-17 11:00:00,11,17,1,2012,1,0,22,1152.62163933,11,0,15.130261604,145.73377049,0,0
4/4/12 15:00,2,0,1,2,26.24,44,19.0012,268,2012-04-04 15:00:00,15,4,4,2012,2,0,30,1154.56,15,0,38.0024,393.59999999999997,0,0
4/8/12 14:00,3,0,0,1,36.08,40,26.0027,472,2012-08-04 14:00:00,14,4,8,2012,5,1,14,1443.1999999999998,0,14,26.0027,505.12,0,0
11/8/11 8:00,3,0,1,1,28.7,45,11.0014,390,2011-08-11 08:00:00,8,11,8,2011,3,0,8,1291.5,8,0,11.0014,229.6,1,0
15/5/12 1:00,2,0,1,3,22.96,88,8.9981,19,2012-05-15 01:00:00,1,15,5,2012,1,0,3,2020.48,1,0,26.994300000000003,22.96,0,0
19/11/11 11:00,4,0,0,1,14.76,40,0.0,233,2011-11-19 11:00:00,11,19,11,2011,5,1,11,590.4,0,11,0.0,162.35999999999999,0,0
8/5/11 21:00,2,0,0,1,21.1609974,75,5.408320084,108,2011-05-08 21:00:00,21,8,5,2011,6,1,21,1587.074805,0,21,5.408320084,444.3809454,0,0
10/5/12 13:00,2,0,1,1,22.14855946,39,30.10658951,316,2012-05-10 13:00:00,13,10,5,2012,3,0,13,863.79381894,13,0,30.10658951,287.93127298,0,0
3/5/12 8:00,2,0,1,3,18.87350643,87,12.52020025,643,2012-05-03 08:00:00,8,3,5,2012,3,0,24,1641.9950594099998,8,0,37.56060075,150.98805144,1,0
13/5/12 20:00,2,0,0,2,27.06,50,19.0012,230,2012-05-13 20:00:00,20,13,5,2012,6,1,40,1353.0,0,20,38.0024,541.1999999999999,0,0
17/11/11 13:00,4,0,1,2,13.94,49,30.0026,124,2011-11-17 13:00:00,13,17,11,2011,3,0,26,683.06,13,0,60.0052,181.22,0,0
12/12/12 6:00,4,0,1,2,10.66,60,16.9979,128,2012-12-12 06:00:00,6,12,12,2012,2,0,12,639.6,6,0,33.9958,63.96,0,0
1/1/11 15:00,1,0,0,2,18.04,77,19.9995,110,2011-01-01 15:00:00,15,1,1,2011,5,1,30,1389.08,0,15,39.999,270.59999999999997,0,0
2/5/11 10:00,2,0,1,2,22.14,77,15.0013,108,2011-05-02 10:00:00,10,2,5,2011,0,0,20,1704.78,10,0,30.0026,221.4,0,0
4/11/11 22:00,4,0,1,1,13.94,46,22.0028,115,2011-11-04 22:00:00,22,4,11,2011,4,0,22,641.24,22,0,22.0028,306.68,0,0
11/11/12 23:00,4,0,0,1,17.22,71,12.998,109,2012-11-11 23:00:00,23,11,11,2012,6,1,23,1222.62,0,23,12.998,396.05999999999995,0,0
14/11/12 21:00,4,0,1,1,12.3,56,0.0,213,2012-11-14 21:00:00,21,14,11,2012,2,0,21,688.8000000000001,21,0,0.0,258.3,0,0
16/10/12 13:00,4,0,1,1,21.32,45,19.0012,328,2012-10-16 13:00:00,13,16,10,2012,1,0,13,959.4,13,0,19.0012,277.16,0,0
10/9/11 21:00,3,0,0,1,26.24,78,6.0032,230,2011-09-10 21:00:00,21,10,9,2011,5,1,21,2046.7199999999998,0,21,6.0032,551.04,0,0
9/1/12 16:00,1,0,1,3,9.02,87,6.0032,49,2012-01-09 16:00:00,16,9,1,2012,0,0,48,784.74,16,0,18.0096,144.32,0,0
3/3/12 1:00,1,0,0,3,14.76,93,0.0,44,2012-03-03 01:00:00,1,3,3,2012,5,1,3,1372.68,0,1,0.0,14.76,0,0
18/1/12 16:00,1,0,1,1,11.48,30,35.0008,176,2012-01-18 16:00:00,16,18,1,2012,2,0,16,344.40000000000003,16,0,35.0008,183.68,0,0
11/8/12 6:00,3,0,0,2,25.42,88,7.0015,23,2012-08-11 06:00:00,6,11,8,2012,5,1,12,2236.96,0,6,14.003,152.52,0,0
15/10/12 14:00,4,0,1,2,24.6,78,19.0012,185,2012-10-15 14:00:00,14,15,10,2012,0,0,28,1918.8000000000002,14,0,38.0024,344.40000000000003,0,0
12/8/12 1:00,3,0,0,1,25.42,78,8.9981,113,2012-08-12 01:00:00,1,12,8,2012,6,1,1,1982.7600000000002,0,1,8.9981,25.42,0,0
9/12/12 22:00,4,0,0,3,14.76,93,7.0015,78,2012-12-09 22:00:00,22,9,12,2012,6,1,66,1372.68,0,22,21.0045,324.71999999999997,0,0
4/9/12 22:00,3,0,1,1,28.71543147,70,18.67936607,176,2012-09-04 22:00:00,22,4,9,2012,1,0,22,2010.0802029,22,0,18.67936607,631.73949234,0,0
8/6/11 7:00,2,0,1,1,27.06,74,7.0015,353,2011-06-08 07:00:00,7,8,6,2011,2,0,7,2002.4399999999998,7,0,7.0015,189.42,1,0
18/7/12 15:00,3,0,1,3,37.72,35,23.9994,194,2012-07-18 15:00:00,15,18,7,2012,2,0,45,1320.2,15,0,71.9982,565.8,0,0
13/11/12 7:00,4,0,1,3,13.12,87,16.9979,107,2012-11-13 07:00:00,7,13,11,2012,1,0,21,1141.4399999999998,7,0,50.993700000000004,91.83999999999999,1,0
1/6/12 2:00,2,0,1,1,26.24,57,15.0013,16,2012-06-01 02:00:00,2,1,6,2012,4,0,2,1495.6799999999998,2,0,15.0013,52.48,0,0
17/1/12 20:00,1,0,1,1,18.86,63,23.9994,180,2012-01-17 20:00:00,20,17,1,2012,1,0,20,1188.18,20,0,23.9994,377.2,0,0
5/11/11 21:00,4,0,0,1,13.12,66,0.0,118,2011-11-05 21:00:00,21,5,11,2011,5,1,21,865.92,0,21,0.0,275.52,0,0
5/4/11 5:00,2,0,1,3,18.86,94,19.9995,5,2011-04-05 05:00:00,5,5,4,2011,1,0,15,1772.84,5,0,59.99850000000001,94.3,0,0
17/10/12 23:00,4,0,1,1,18.86,88,15.0013,99,2012-10-17 23:00:00,23,17,10,2012,2,0,23,1659.6799999999998,23,0,15.0013,433.78,0,0
3/11/12 7:00,4,0,0,2,13.12,49,16.9979,59,2012-11-03 07:00:00,7,3,11,2012,5,1,14,642.88,0,7,33.9958,91.83999999999999,1,0
16/3/12 15:00,1,0,1,3,18.86,82,7.0015,107,2012-03-16 15:00:00,15,16,3,2012,4,0,45,1546.52,15,0,21.0045,282.9,0,0
15/11/11 16:00,4,0,1,2,21.32,68,8.9981,271,2011-11-15 16:00:00,16,15,11,2011,1,0,32,1449.76,16,0,17.9962,341.12,0,0
5/3/11 11:00,1,0,0,2,16.4,76,15.0013,159,2011-03-05 11:00:00,11,5,3,2011,5,1,22,1246.3999999999999,0,11,30.0026,180.39999999999998,0,0
3/11/11 1:00,4,0,1,1,13.94,81,8.9981,15,2011-11-03 01:00:00,1,3,11,2011,3,0,1,1129.1399999999999,1,0,8.9981,13.94,0,0
16/6/12 2:00,2,0,0,1,23.78,53,0.0,67,2012-06-16 02:00:00,2,16,6,2012,5,1,2,1260.3400000000001,0,2,0.0,47.56,0,0
14/8/12 8:00,3,0,1,2,27.06,89,6.0032,618,2012-08-14 08:00:00,8,14,8,2012,1,0,16,2408.3399999999997,8,0,12.0064,216.48,1,0
10/9/12 19:00,3,0,1,1,25.05709255,37,18.89223673,654,2012-09-10 19:00:00,19,10,9,2012,0,0,19,927.11242435,19,0,18.89223673,476.08475845,0,1
7/4/11 22:00,2,0,1,2,16.4,76,12.998,81,2011-04-07 22:00:00,22,7,4,2011,3,0,44,1246.3999999999999,22,0,25.996,360.79999999999995,0,0
15/1/12 5:00,1,0,0,2,6.56,47,22.0028,5,2012-01-15 05:00:00,5,15,1,2012,6,1,10,308.32,0,5,44.0056,32.8,0,0
2/1/11 20:00,1,0,0,1,12.58477275,40,23.22986846,19,2011-01-02 20:00:00,20,2,1,2011,6,1,20,503.39091,0,20,23.22986846,251.695455,0,0
3/10/11 16:00,4,0,1,2,16.4,76,7.0015,218,2011-10-03 16:00:00,16,3,10,2011,0,0,32,1246.3999999999999,16,0,14.003,262.4,0,0
8/2/11 13:00,1,0,1,2,9.84,32,30.0026,50,2011-02-08 13:00:00,13,8,2,2011,1,0,26,314.88,13,0,60.0052,127.92,0,0
12/2/12 8:00,1,0,0,1,3.28,53,16.9979,26,2012-02-12 08:00:00,8,12,2,2012,6,1,8,173.84,0,8,16.9979,26.24,1,0
16/11/12 1:00,4,0,1,2,12.3,65,6.0032,21,2012-11-16 01:00:00,1,16,11,2012,4,0,2,799.5,1,0,12.0064,12.3,0,0
5/12/11 21:00,4,0,1,2,18.04,88,6.0032,176,2011-12-05 21:00:00,21,5,12,2011,0,0,42,1587.52,21,0,12.0064,378.84,0,0
12/6/11 10:00,2,0,0,1,31.16,58,6.0032,311,2011-06-12 10:00:00,10,12,6,2011,6,1,10,1807.28,0,10,6.0032,311.6,0,0
3/7/11 13:00,3,0,0,1,32.8,59,15.0013,421,2011-07-03 13:00:00,13,3,7,2011,6,1,13,1935.1999999999998,0,13,15.0013,426.4,0,0
2/4/11 12:00,2,0,0,3,13.12,81,8.9981,184,2011-04-02 12:00:00,12,2,4,2011,5,1,36,1062.72,0,12,26.994300000000003,157.44,0,0
7/10/11 20:00,4,0,1,1,22.14,49,0.0,197,2011-10-07 20:00:00,20,7,10,2011,4,0,20,1084.8600000000001,20,0,0.0,442.8,0,0
6/6/11 7:00,2,0,1,1,25.42,78,7.0015,299,2011-06-06 07:00:00,7,6,6,2011,0,0,7,1982.7600000000002,7,0,7.0015,177.94,1,0
10/7/11 12:00,3,0,0,1,33.62,46,19.0012,377,2011-07-10 12:00:00,12,10,7,2011,6,1,12,1546.52,0,12,19.0012,403.43999999999994,0,0
13/9/12 21:00,3,0,1,1,25.42,65,7.0015,317,2012-09-13 21:00:00,21,13,9,2012,3,0,21,1652.3000000000002,21,0,7.0015,533.82,0,0
16/7/11 13:00,3,0,0,1,30.6346813,42,20.87999316,471,2011-07-16 13:00:00,13,16,7,2011,5,1,13,1286.6566146,0,13,20.87999316,398.25085690000003,0,0
8/11/12 14:00,4,0,1,1,17.89321881,17,27.74158335,166,2012-11-08 14:00:00,14,8,11,2012,3,0,14,304.18471977,14,0,27.74158335,250.50506334,0,0
1/1/11 7:00,1,0,0,1,8.2,86,0.0,3,2011-01-01 07:00:00,7,1,1,2011,5,1,7,705.1999999999999,0,7,0.0,57.39999999999999,1,0
9/1/11 8:00,1,0,0,1,4.1,49,19.0012,10,2011-01-09 08:00:00,8,9,1,2011,6,1,8,200.89999999999998,0,8,19.0012,32.8,1,0
8/3/12 22:00,1,0,1,1,22.96,49,22.0028,153,2012-03-08 22:00:00,22,8,3,2012,3,0,22,1125.04,22,0,22.0028,505.12,0,0
12/3/12 8:00,1,0,1,1,13.94,61,8.9981,564,2012-03-12 08:00:00,8,12,3,2012,0,0,8,850.3399999999999,8,0,8.9981,111.52,1,0
14/6/11 15:00,2,0,1,1,26.24,47,11.0014,178,2011-06-14 15:00:00,15,14,6,2011,1,0,15,1233.28,15,0,11.0014,393.59999999999997,0,0
6/1/11 6:00,1,0,1,2,5.74,63,7.0015,36,2011-01-06 06:00:00,6,6,1,2011,3,0,12,361.62,6,0,14.003,34.44,0,0
12/2/12 7:00,1,0,0,1,3.28,53,12.998,18,2012-02-12 07:00:00,7,12,2,2012,6,1,7,173.84,0,7,12.998,22.959999999999997,1,0
4/2/12 1:00,1,0,0,1,10.66,70,7.0015,43,2012-02-04 01:00:00,1,4,2,2012,5,1,1,746.2,0,1,7.0015,10.66,0,0
1/8/12 20:00,3,0,1,1,30.34,66,11.0014,513,2012-08-01 20:00:00,20,1,8,2012,2,0,20,2002.44,20,0,11.0014,606.8,0,0
4/11/12 14:00,4,0,0,1,16.4,40,12.998,509,2012-11-04 14:00:00,14,4,11,2012,6,1,14,656.0,0,14,12.998,229.59999999999997,0,0
11/1/12 8:00,1,0,1,1,8.114958575,82,6.528033723,521,2012-01-11 08:00:00,8,11,1,2012,2,0,8,665.4266031499999,8,0,6.528033723,64.9196686,1,0
1/10/12 22:00,4,0,1,3,22.14,77,6.0032,207,2012-10-01 22:00:00,22,1,10,2012,0,0,66,1704.78,22,0,18.0096,487.08000000000004,0,0
13/1/12 8:00,1,0,1,1,9.84,52,23.9994,419,2012-01-13 08:00:00,8,13,1,2012,4,0,8,511.68,8,0,23.9994,78.72,1,0
12/11/11 1:00,4,0,0,1,9.84,60,8.9981,54,2011-11-12 01:00:00,1,12,11,2011,5,1,1,590.4,0,1,8.9981,9.84,0,0
2/4/12 23:00,2,0,1,1,18.04,35,11.0014,66,2012-04-02 23:00:00,23,2,4,2012,0,0,23,631.4,23,0,11.0014,414.91999999999996,0,0
16/7/11 12:00,3,0,0,1,31.16,43,19.0012,463,2011-07-16 12:00:00,12,16,7,2011,5,1,12,1339.88,0,12,19.0012,373.92,0,0
6/4/11 8:00,2,0,1,1,13.12,61,15.0013,325,2011-04-06 08:00:00,8,6,4,2011,2,0,8,800.3199999999999,8,0,15.0013,104.96,1,0
5/8/12 21:00,3,0,0,1,29.52,79,7.0015,208,2012-08-05 21:00:00,21,5,8,2012,6,1,21,2332.08,0,21,7.0015,619.92,0,0
13/12/11 5:00,4,0,1,1,7.38,86,0.0,20,2011-12-13 05:00:00,5,13,12,2011,1,0,5,634.68,5,0,0.0,36.9,0,0
2/3/12 11:00,1,0,1,1,15.58,46,12.998,194,2012-03-02 11:00:00,11,2,3,2012,4,0,11,716.68,11,0,12.998,171.38,0,0
15/12/11 12:00,4,0,1,2,18.86,59,32.9975,157,2011-12-15 12:00:00,12,15,12,2011,3,0,24,1112.74,12,0,65.995,226.32,0,0
13/5/12 23:00,2,0,0,2,25.42,57,15.0013,74,2012-05-13 23:00:00,23,13,5,2012,6,1,46,1448.94,0,23,30.0026,584.6600000000001,0,0
18/6/11 2:00,2,0,0,1,24.6,88,0.0,53,2011-06-18 02:00:00,2,18,6,2011,5,1,2,2164.8,0,2,0.0,49.2,0,0
13/1/11 1:00,1,0,1,1,5.74,50,19.0012,2,2011-01-13 01:00:00,1,13,1,2011,3,0,1,287.0,1,0,19.0012,5.74,0,0
6/3/11 20:00,1,0,0,3,10.38544404,100,27.52902763,30,2011-03-06 20:00:00,20,6,3,2011,6,1,60,1038.544404,0,20,82.58708289,207.70888079999997,0,0
11/9/12 22:00,3,0,1,1,23.15513748,65,7.531178685,222,2012-09-11 22:00:00,22,11,9,2012,1,0,22,1505.0839362,22,0,7.531178685,509.41302456,0,0
5/4/11 9:00,2,0,1,3,14.76,87,32.9975,46,2011-04-05 09:00:00,9,5,4,2011,1,0,27,1284.12,9,0,98.9925,132.84,1,0
3/3/12 13:00,1,0,0,1,18.04,51,19.0012,339,2012-03-03 13:00:00,13,3,3,2012,5,1,13,920.04,0,13,19.0012,234.51999999999998,0,0
7/12/12 19:00,4,0,1,2,15.58,76,0.0,352,2012-12-07 19:00:00,19,7,12,2012,4,0,38,1184.08,19,0,0.0,296.02,0,1
10/5/12 17:00,2,0,1,1,24.6,31,26.0027,732,2012-05-10 17:00:00,17,10,5,2012,3,0,17,762.6,17,0,26.0027,418.20000000000005,0,1
8/10/11 14:00,4,0,0,1,25.42,50,6.0032,465,2011-10-08 14:00:00,14,8,10,2011,5,1,14,1271.0,0,14,6.0032,355.88,0,0
6/5/12 21:00,2,0,0,1,22.96,73,12.998,203,2012-05-06 21:00:00,21,6,5,2012,6,1,21,1676.0800000000002,0,21,12.998,482.16,0,0
17/5/11 8:00,2,0,1,2,21.32,94,19.9995,347,2011-05-17 08:00:00,8,17,5,2011,1,0,16,2004.08,8,0,39.999,170.56,1,0
2/11/12 1:00,4,0,1,1,13.12,66,11.0014,24,2012-11-02 01:00:00,1,2,11,2012,4,0,1,865.92,1,0,11.0014,13.12,0,0
4/10/11 16:00,4,0,1,1,23.78,56,22.0028,309,2011-10-04 16:00:00,16,4,10,2011,1,0,16,1331.68,16,0,22.0028,380.48,0,0
2/2/12 18:00,1,0,1,1,16.4,43,31.0009,410,2012-02-02 18:00:00,18,2,2,2012,3,0,18,705.1999999999999,18,0,31.0009,295.2,0,1
10/12/11 6:00,4,0,0,1,9.84,65,7.0015,11,2011-12-10 06:00:00,6,10,12,2011,5,1,6,639.6,0,6,7.0015,59.04,0,0
13/4/11 14:00,2,0,1,2,17.22,77,16.9979,106,2011-04-13 14:00:00,14,13,4,2011,2,0,28,1325.9399999999998,14,0,33.9958,241.07999999999998,0,0
11/5/12 9:00,2,0,1,1,19.68,41,19.9995,322,2012-05-11 09:00:00,9,11,5,2012,4,0,9,806.88,9,0,19.9995,177.12,1,0
14/11/11 8:00,4,0,1,2,18.86,67,12.998,452,2011-11-14 08:00:00,8,14,11,2011,0,0,16,1263.62,8,0,25.996,150.88,1,0
2/11/11 5:00,4,0,1,1,12.3,81,0.0,27,2011-11-02 05:00:00,5,2,11,2011,2,0,5,996.3000000000001,5,0,0.0,61.5,0,0
9/8/12 5:00,3,0,1,2,27.06,94,0.0,41,2012-08-09 05:00:00,5,9,8,2012,3,0,10,2543.64,5,0,0.0,135.29999999999998,0,0
16/11/11 7:00,4,0,1,3,18.86,94,0.0,137,2011-11-16 07:00:00,7,16,11,2011,2,0,21,1772.84,7,0,0.0,132.01999999999998,1,0
9/4/12 15:00,2,0,1,1,23.78,28,36.9974,255,2012-04-09 15:00:00,15,9,4,2012,0,0,15,665.84,15,0,36.9974,356.70000000000005,0,0
3/5/12 15:00,2,0,1,1,27.06,61,12.998,283,2012-05-03 15:00:00,15,3,5,2012,3,0,15,1650.6599999999999,15,0,12.998,405.9,0,0
14/4/11 12:00,2,0,1,1,22.14,42,8.9981,145,2011-04-14 12:00:00,12,14,4,2011,3,0,12,929.88,12,0,8.9981,265.68,0,0
16/1/11 0:00,1,0,0,1,10.66,56,0.0,39,2011-01-16 00:00:00,0,16,1,2011,6,1,0,596.96,0,0,0.0,0.0,0,0
6/8/12 17:00,3,0,1,1,33.62,41,0.0,858,2012-08-06 17:00:00,17,6,8,2012,0,0,17,1378.4199999999998,17,0,0.0,571.54,0,1
18/2/12 23:00,1,0,0,2,13.0687455,35,25.20622638,81,2012-02-18 23:00:00,23,18,2,2012,5,1,46,457.4060925,0,23,50.41245276,300.5811465,0,0
17/3/11 2:00,1,0,1,1,13.94,71,19.9995,8,2011-03-17 02:00:00,2,17,3,2011,3,0,2,989.74,2,0,19.9995,27.88,0,0
17/4/12 13:00,2,0,1,1,25.42,29,16.9979,239,2012-04-17 13:00:00,13,17,4,2012,1,0,13,737.1800000000001,13,0,16.9979,330.46000000000004,0,0
10/2/11 14:00,1,0,1,1,7.52529516,30,19.86197129,36,2011-02-10 14:00:00,14,10,2,2011,3,0,14,225.7588548,14,0,19.86197129,105.35413224,0,0
4/1/11 19:00,1,0,1,1,9.84,48,7.0015,112,2011-01-04 19:00:00,19,4,1,2011,1,0,19,472.32,19,0,7.0015,186.96,0,1
5/5/12 9:00,2,0,0,1,25.42,78,7.0015,284,2012-05-05 09:00:00,9,5,5,2012,5,1,9,1982.7600000000002,0,9,7.0015,228.78000000000003,1,0
19/4/12 22:00,2,0,1,1,21.0369622,58,12.06869158,273,2012-04-19 22:00:00,22,19,4,2012,3,0,22,1220.1438076000002,22,0,12.06869158,462.81316840000005,0,0
13/10/12 7:00,4,0,0,1,12.3,61,11.0014,70,2012-10-13 07:00:00,7,13,10,2012,5,1,7,750.3000000000001,0,7,11.0014,86.10000000000001,1,0
10/7/12 19:00,3,0,1,3,28.7,74,15.0013,414,2012-07-10 19:00:00,19,10,7,2012,1,0,57,2123.7999999999997,19,0,45.0039,545.3,0,1
10/2/12 14:00,1,0,1,2,13.12,39,6.0032,146,2012-02-10 14:00:00,14,10,2,2012,4,0,28,511.67999999999995,14,0,12.0064,183.67999999999998,0,0
7/7/11 22:00,3,0,1,1,30.34,62,11.0014,182,2011-07-07 22:00:00,22,7,7,2011,3,0,22,1881.08,22,0,11.0014,667.48,0,0
17/2/11 22:00,1,0,1,1,20.5,59,19.0012,76,2011-02-17 22:00:00,22,17,2,2011,3,0,22,1209.5,22,0,19.0012,451.0,0,0
1/5/12 4:00,2,0,1,2,21.32,72,6.0032,8,2012-05-01 04:00:00,4,1,5,2012,1,0,8,1535.04,4,0,12.0064,85.28,0,0
12/2/11 6:00,1,0,0,1,4.704406639,93,13.60866022,1,2011-02-12 06:00:00,6,12,2,2011,5,1,6,437.50981742700003,0,6,13.60866022,28.226439834,0,0
12/5/12 13:00,2,0,0,1,26.24,36,12.998,659,2012-05-12 13:00:00,13,12,5,2012,5,1,13,944.64,0,13,12.998,341.12,0,0
8/4/11 4:00,2,0,1,2,13.94,86,8.9981,1,2011-04-08 04:00:00,4,8,4,2011,4,0,8,1198.84,4,0,17.9962,55.76,0,0
19/11/12 14:00,4,0,1,1,18.04,54,16.9979,217,2012-11-19 14:00:00,14,19,11,2012,0,0,14,974.16,14,0,16.9979,252.56,0,0
1/12/11 15:00,4,0,1,1,16.4,40,15.0013,154,2011-12-01 15:00:00,15,1,12,2011,3,0,15,656.0,15,0,15.0013,245.99999999999997,0,0
18/5/12 16:00,2,0,1,1,27.06,34,16.9979,568,2012-05-18 16:00:00,16,18,5,2012,4,0,16,920.04,16,0,16.9979,432.96,0,0
16/10/11 11:00,4,0,0,1,22.96,35,19.0012,377,2011-10-16 11:00:00,11,16,10,2011,6,1,11,803.6,0,11,19.0012,252.56,0,0
3/7/12 8:00,3,0,1,1,31.03265923,59,7.093231731,661,2012-07-03 08:00:00,8,3,7,2012,1,0,8,1830.92689457,8,0,7.093231731,248.26127384,1,0
2/11/12 20:00,4,0,1,2,14.76,46,27.9993,221,2012-11-02 20:00:00,20,2,11,2012,4,0,40,678.96,20,0,55.9986,295.2,0,0
17/7/11 11:00,3,0,0,1,31.16,55,19.0012,391,2011-07-17 11:00:00,11,17,7,2011,6,1,11,1713.8,0,11,19.0012,342.76,0,0
19/6/12 2:00,2,0,1,2,23.87616974,81,10.67347908,1,2012-06-19 02:00:00,2,19,6,2012,1,0,4,1933.96974894,2,0,21.34695816,47.75233948,0,0
17/2/11 0:00,1,0,1,1,13.94,53,12.998,17,2011-02-17 00:00:00,0,17,2,2011,3,0,0,738.8199999999999,0,0,12.998,0.0,0,0
10/5/11 3:00,2,0,1,1,18.41796525,56,13.80191422,1,2011-05-10 03:00:00,3,10,5,2011,1,0,3,1031.406054,3,0,13.80191422,55.253895750000005,0,0
8/3/11 17:00,1,0,1,1,14.76,27,15.0013,248,2011-03-08 17:00:00,17,8,3,2011,1,0,17,398.52,17,0,15.0013,250.92,0,1
3/4/11 21:00,2,0,0,2,17.43333673,45,14.52269427,51,2011-04-03 21:00:00,21,3,4,2011,6,1,42,784.5001528500001,0,21,29.04538854,366.10007133,0,0
8/5/12 13:00,2,0,1,3,26.24,65,16.9979,219,2012-05-08 13:00:00,13,8,5,2012,1,0,39,1705.6,13,0,50.993700000000004,341.12,0,0
16/6/12 14:00,2,0,0,1,29.52,37,15.0013,573,2012-06-16 14:00:00,14,16,6,2012,5,1,14,1092.24,0,14,15.0013,413.28,0,0
7/6/12 9:00,2,0,1,1,23.78,68,0.0,337,2012-06-07 09:00:00,9,7,6,2012,3,0,9,1617.04,9,0,0.0,214.02,1,0
6/8/12 8:00,3,0,1,2,28.7,79,0.0,605,2012-08-06 08:00:00,8,6,8,2012,0,0,16,2267.2999999999997,8,0,0.0,229.6,1,0
10/1/11 23:00,1,0,1,1,5.74,59,11.0014,18,2011-01-10 23:00:00,23,10,1,2011,0,0,23,338.66,23,0,11.0014,132.02,0,0
12/7/12 16:00,3,0,1,1,32.8,36,12.998,439,2012-07-12 16:00:00,16,12,7,2012,3,0,16,1180.8,16,0,12.998,524.8,0,0
14/7/12 18:00,3,0,0,1,29.52,79,8.9981,351,2012-07-14 18:00:00,18,14,7,2012,5,1,18,2332.08,0,18,8.9981,531.36,0,1
18/3/12 0:00,1,0,0,1,18.86,88,12.998,107,2012-03-18 00:00:00,0,18,3,2012,6,1,0,1659.6799999999998,0,0,12.998,0.0,0,0
10/9/12 21:00,3,0,1,1,21.74357472,48,11.34700853,297,2012-09-10 21:00:00,21,10,9,2012,0,0,21,1043.6915865600001,21,0,11.34700853,456.61506912000004,0,0
2/5/12 21:00,2,0,1,1,21.32,77,15.0013,239,2012-05-02 21:00:00,21,2,5,2012,2,0,21,1641.64,21,0,15.0013,447.72,0,0
14/12/11 11:00,4,0,1,2,13.94,55,0.0,115,2011-12-14 11:00:00,11,14,12,2011,2,0,22,766.6999999999999,11,0,0.0,153.34,0,0
1/3/12 21:00,1,0,1,1,17.22,47,31.0009,197,2012-03-01 21:00:00,21,1,3,2012,3,0,21,809.3399999999999,21,0,31.0009,361.62,0,0
15/4/11 0:00,2,1,0,1,18.04,67,0.0,27,2011-04-15 00:00:00,0,15,4,2011,4,0,0,1208.6799999999998,0,0,0.0,0.0,0,0
1/3/11 7:00,1,0,1,1,8.2,59,22.0028,107,2011-03-01 07:00:00,7,1,3,2011,1,0,7,483.79999999999995,7,0,22.0028,57.39999999999999,1,0
15/8/11 15:00,3,0,1,3,30.34,55,19.9995,182,2011-08-15 15:00:00,15,15,8,2011,0,0,45,1668.7,15,0,59.99850000000001,455.1,0,0
18/4/12 23:00,2,0,1,2,17.22,77,0.0,70,2012-04-18 23:00:00,23,18,4,2012,2,0,46,1325.9399999999998,23,0,0.0,396.05999999999995,0,0
11/8/11 21:00,3,0,1,1,28.7,48,6.0032,206,2011-08-11 21:00:00,21,11,8,2011,3,0,21,1377.6,21,0,6.0032,602.6999999999999,0,0
15/3/12 15:00,1,0,1,1,29.52,32,15.0013,287,2012-03-15 15:00:00,15,15,3,2012,3,0,15,944.64,15,0,15.0013,442.8,0,0
6/1/11 12:00,1,0,1,1,10.66,35,0.0,84,2011-01-06 12:00:00,12,6,1,2011,3,0,12,373.1,12,0,0.0,127.92,0,0
2/12/11 9:00,4,0,1,1,11.48,81,0.0,246,2011-12-02 09:00:00,9,2,12,2011,4,0,9,929.88,9,0,0.0,103.32000000000001,1,0
14/12/11 0:00,4,0,1,1,10.66,75,0.0,22,2011-12-14 00:00:00,0,14,12,2011,2,0,0,799.5,0,0,0.0,0.0,0,0
10/2/12 18:00,1,0,1,3,12.3,61,8.9981,359,2012-02-10 18:00:00,18,10,2,2012,4,0,54,750.3000000000001,18,0,26.994300000000003,221.4,0,1
5/5/12 13:00,2,0,0,1,30.34,55,8.9981,524,2012-05-05 13:00:00,13,5,5,2012,5,1,13,1668.7,0,13,8.9981,394.42,0,0
5/11/12 20:00,4,0,1,1,13.12,49,16.9979,241,2012-11-05 20:00:00,20,5,11,2012,0,0,20,642.88,20,0,16.9979,262.4,0,0
9/5/11 3:00,2,0,1,1,18.86,82,6.0032,7,2011-05-09 03:00:00,3,9,5,2011,0,0,3,1546.52,3,0,6.0032,56.58,0,0
7/8/11 18:00,3,0,0,1,29.41014801,72,4.936370471,255,2011-08-07 18:00:00,18,7,8,2011,6,1,18,2117.53065672,0,18,4.936370471,529.38266418,0,1
13/2/12 7:00,1,0,1,1,4.1,54,12.998,195,2012-02-13 07:00:00,7,13,2,2012,0,0,7,221.39999999999998,7,0,12.998,28.699999999999996,1,0
3/3/12 8:00,1,0,0,3,14.76,93,0.0,48,2012-03-03 08:00:00,8,3,3,2012,5,1,24,1372.68,0,8,0.0,118.08,1,0
16/12/12 5:00,4,0,0,2,13.94,87,0.0,9,2012-12-16 05:00:00,5,16,12,2012,6,1,10,1212.78,0,5,0.0,69.7,0,0
16/6/12 3:00,2,0,0,1,22.96,60,6.0032,27,2012-06-16 03:00:00,3,16,6,2012,5,1,3,1377.6000000000001,0,3,6.0032,68.88,0,0
7/10/12 15:00,4,0,0,3,17.47245727,77,9.516041637,287,2012-10-07 15:00:00,15,7,10,2012,6,1,45,1345.37920979,0,15,28.548124911000002,262.08685905,0,0
13/7/11 17:00,3,0,1,1,28.15597448,79,0.472803379,480,2011-07-13 17:00:00,17,13,7,2011,2,0,17,2224.32198392,17,0,0.472803379,478.65156616,0,1
17/12/12 8:00,4,0,1,2,15.58,87,7.0015,592,2012-12-17 08:00:00,8,17,12,2012,0,0,16,1355.46,8,0,14.003,124.64,1,0
8/4/11 22:00,2,0,1,2,12.3,93,19.9995,51,2011-04-08 22:00:00,22,8,4,2011,4,0,44,1143.9,22,0,39.999,270.6,0,0
8/7/12 8:00,3,0,0,1,34.44,53,8.9981,130,2012-07-08 08:00:00,8,8,7,2012,6,1,8,1825.32,0,8,8.9981,275.52,1,0
19/11/12 12:00,4,0,1,2,16.4,62,19.0012,242,2012-11-19 12:00:00,12,19,11,2012,0,0,24,1016.8,12,0,38.0024,196.79999999999998,0,0
3/11/12 15:00,4,0,0,2,14.76,46,30.0026,448,2012-11-03 15:00:00,15,3,11,2012,5,1,30,678.96,0,15,60.0052,221.4,0,0
13/4/11 18:00,2,0,1,1,18.04,62,26.0027,321,2011-04-13 18:00:00,18,13,4,2011,2,0,18,1118.48,18,0,26.0027,324.71999999999997,0,1
7/7/11 5:00,3,0,1,1,26.24,89,7.0015,32,2011-07-07 05:00:00,5,7,7,2011,3,0,5,2335.3599999999997,5,0,7.0015,131.2,0,0
2/9/12 4:00,3,0,0,1,27.06,89,0.0,22,2012-09-02 04:00:00,4,2,9,2012,6,1,4,2408.3399999999997,0,4,0.0,108.24,0,0
4/5/12 11:00,2,0,1,2,28.7,61,0.0,258,2012-05-04 11:00:00,11,4,5,2012,4,0,22,1750.7,11,0,0.0,315.7,0,0
6/8/11 21:00,3,0,0,2,28.7,84,22.0028,114,2011-08-06 21:00:00,21,6,8,2011,5,1,42,2410.7999999999997,0,21,44.0056,602.6999999999999,0,0
6/4/12 7:00,2,0,1,1,11.94078723,50,18.08827995,270,2012-04-06 07:00:00,7,6,4,2012,4,0,7,597.0393615,7,0,18.08827995,83.58551061,1,0
7/2/12 8:00,1,0,1,1,12.3,49,0.0,529,2012-02-07 08:00:00,8,7,2,2012,1,0,8,602.7,8,0,0.0,98.4,1,0
14/7/12 5:00,3,0,0,2,26.24,73,7.0015,5,2012-07-14 05:00:00,5,14,7,2012,5,1,10,1915.52,0,5,14.003,131.2,0,0
5/3/12 3:00,1,0,1,1,9.02,51,11.0014,1,2012-03-05 03:00:00,3,5,3,2012,0,0,3,460.02,3,0,11.0014,27.06,0,0
13/1/11 4:00,1,0,1,1,5.74,50,16.9979,4,2011-01-13 04:00:00,4,13,1,2011,3,0,4,287.0,4,0,16.9979,22.96,0,0
15/7/11 14:00,3,0,1,1,28.7,51,12.998,265,2011-07-15 14:00:00,14,15,7,2011,4,0,14,1463.7,14,0,12.998,401.8,0,0
4/3/11 15:00,1,0,1,1,14.76,40,19.9995,106,2011-03-04 15:00:00,15,4,3,2011,4,0,15,590.4,15,0,19.9995,221.4,0,0
11/8/11 15:00,3,0,1,1,32.8,29,19.9995,178,2011-08-11 15:00:00,15,11,8,2011,3,0,15,951.1999999999999,15,0,19.9995,491.99999999999994,0,0
10/1/12 10:00,1,0,1,2,7.38,93,11.0014,83,2012-01-10 10:00:00,10,10,1,2012,1,0,20,686.34,10,0,22.0028,73.8,0,0
8/9/11 0:00,3,0,1,3,24.6,100,12.998,14,2011-09-08 00:00:00,0,8,9,2011,3,0,0,2460.0,0,0,38.994,0.0,0,0
13/6/11 2:00,2,0,1,1,25.42,73,19.0012,10,2011-06-13 02:00:00,2,13,6,2011,0,0,2,1855.66,2,0,19.0012,50.84,0,0
15/11/11 23:00,4,0,1,2,18.86,94,7.0015,80,2011-11-15 23:00:00,23,15,11,2011,1,0,46,1772.84,23,0,14.003,433.78,0,0
5/10/12 4:00,4,0,1,1,22.19032561,78,0.0,57,2012-10-05 04:00:00,4,5,10,2012,4,0,4,1730.8453975799998,4,0,0.0,88.76130244,0,0
17/6/11 12:00,2,0,1,1,28.7,65,16.9979,243,2011-06-17 12:00:00,12,17,6,2011,4,0,12,1865.5,12,0,16.9979,344.4,0,0
8/7/11 8:00,3,0,1,2,29.52,74,16.9979,457,2011-07-08 08:00:00,8,8,7,2011,4,0,16,2184.48,8,0,33.9958,236.16,1,0
18/8/12 21:00,3,0,0,1,27.06,61,0.0,338,2012-08-18 21:00:00,21,18,8,2012,5,1,21,1650.6599999999999,0,21,0.0,568.26,0,0
5/5/11 7:00,2,0,1,1,15.58,58,16.9979,271,2011-05-05 07:00:00,7,5,5,2011,3,0,7,903.64,7,0,16.9979,109.06,1,0
11/8/11 17:00,3,0,1,1,32.8911462,27,15.52270568,606,2011-08-11 17:00:00,17,11,8,2011,3,0,17,888.0609474,17,0,15.52270568,559.1494854,0,1
8/7/12 18:00,3,0,0,1,31.93982045,64,7.852535501,261,2012-07-08 18:00:00,18,8,7,2012,6,1,18,2044.1485088,0,18,7.852535501,574.9167681,0,1
7/11/11 21:00,4,0,1,1,15.58,82,7.0015,139,2011-11-07 21:00:00,21,7,11,2011,0,0,21,1277.56,21,0,7.0015,327.18,0,0
8/5/12 17:00,2,0,1,2,26.24,69,19.0012,717,2012-05-08 17:00:00,17,8,5,2012,1,0,34,1810.56,17,0,38.0024,446.08,0,1
14/4/12 17:00,2,0,0,2,25.42,33,16.9979,560,2012-04-14 17:00:00,17,14,4,2012,5,1,34,838.86,0,17,33.9958,432.14000000000004,0,1
16/4/12 1:00,2,1,0,1,25.42,61,23.9994,28,2012-04-16 01:00:00,1,16,4,2012,0,0,1,1550.6200000000001,0,0,23.9994,25.42,0,0
10/2/11 2:00,1,0,1,3,5.74,80,8.9981,3,2011-02-10 02:00:00,2,10,2,2011,3,0,6,459.20000000000005,2,0,26.994300000000003,11.48,0,0
17/6/12 16:00,2,0,0,1,26.28150728,54,19.73506123,581,2012-06-17 16:00:00,16,17,6,2012,6,1,16,1419.20139312,0,16,19.73506123,420.50411648,0,0
1/12/12 8:00,4,0,0,2,9.69230612,85,8.718748449,125,2012-12-01 08:00:00,8,1,12,2012,5,1,16,823.8460202,0,8,17.437496898,77.53844896,1,0
4/1/11 10:00,1,0,1,2,6.56,69,22.0028,42,2011-01-04 10:00:00,10,4,1,2011,1,0,20,452.64,10,0,44.0056,65.6,0,0
3/3/11 4:00,1,0,1,1,6.56,31,32.9975,1,2011-03-03 04:00:00,4,3,3,2011,3,0,4,203.35999999999999,4,0,32.9975,26.24,0,0
10/11/12 18:00,4,0,0,1,18.04,54,8.9981,359,2012-11-10 18:00:00,18,10,11,2012,5,1,18,974.16,0,18,8.9981,324.71999999999997,0,1
17/11/12 0:00,4,0,0,1,12.3,52,11.0014,106,2012-11-17 00:00:00,0,17,11,2012,5,1,0,639.6,0,0,11.0014,0.0,0,0
14/12/12 14:00,4,0,1,1,16.4,43,12.998,299,2012-12-14 14:00:00,14,14,12,2012,4,0,14,705.1999999999999,14,0,12.998,229.59999999999997,0,0
18/12/11 5:00,4,0,0,1,7.103790188,62,6.547530586,1,2011-12-18 05:00:00,5,18,12,2011,6,1,5,440.43499165599997,0,5,6.547530586,35.518950939999996,0,0
18/8/12 18:00,3,0,0,1,30.34,37,11.0014,554,2012-08-18 18:00:00,18,18,8,2012,5,1,18,1122.58,0,18,11.0014,546.12,0,1
9/8/12 11:00,3,0,1,1,34.44,44,0.0,260,2012-08-09 11:00:00,11,9,8,2012,3,0,11,1515.36,11,0,0.0,378.84,0,0
2/11/12 23:00,4,0,1,1,13.94,53,19.9995,119,2012-11-02 23:00:00,23,2,11,2012,4,0,23,738.8199999999999,23,0,19.9995,320.62,0,0
2/10/12 15:00,4,0,1,3,25.42,83,8.9981,209,2012-10-02 15:00:00,15,2,10,2012,1,0,45,2109.86,15,0,26.994300000000003,381.3,0,0
14/4/11 8:00,2,0,1,1,17.22,58,11.0014,337,2011-04-14 08:00:00,8,14,4,2011,3,0,8,998.76,8,0,11.0014,137.76,1,0
17/2/11 15:00,1,0,1,1,24.6,28,16.9979,106,2011-02-17 15:00:00,15,17,2,2011,3,0,15,688.8000000000001,15,0,16.9979,369.0,0,0
9/5/11 20:00,2,0,1,1,22.14,49,12.998,239,2011-05-09 20:00:00,20,9,5,2011,0,0,20,1084.8600000000001,20,0,12.998,442.8,0,0
5/2/12 7:00,1,0,0,2,9.84,75,11.0014,16,2012-02-05 07:00:00,7,5,2,2012,6,1,14,738.0,0,7,22.0028,68.88,1,0
6/10/11 19:00,4,0,1,1,21.32,59,7.0015,343,2011-10-06 19:00:00,19,6,10,2011,3,0,19,1257.88,19,0,7.0015,405.08,0,1
15/6/11 0:00,2,0,1,1,22.96,64,23.9994,52,2011-06-15 00:00:00,0,15,6,2011,2,0,0,1469.44,0,0,23.9994,0.0,0,0
13/11/12 1:00,4,0,1,3,18.04,88,43.0006,5,2012-11-13 01:00:00,1,13,11,2012,1,0,3,1587.52,1,0,129.0018,18.04,0,0
5/6/12 14:00,2,0,1,2,23.35181114,45,10.22325806,283,2012-06-05 14:00:00,14,5,6,2012,1,0,28,1050.8315013,14,0,20.44651612,326.92535596,0,0
7/9/11 4:00,3,0,1,3,22.96,94,11.0014,4,2011-09-07 04:00:00,4,7,9,2011,2,0,12,2158.2400000000002,4,0,33.0042,91.84,0,0
14/12/12 18:00,4,0,1,1,14.76,46,8.9981,455,2012-12-14 18:00:00,18,14,12,2012,4,0,18,678.96,18,0,8.9981,265.68,0,1
3/9/12 7:00,3,1,0,1,27.88,85,0.0,43,2012-09-03 07:00:00,7,3,9,2012,0,0,7,2369.7999999999997,0,0,0.0,195.16,1,0
16/10/12 2:00,4,0,1,1,18.04,67,8.9981,3,2012-10-16 02:00:00,2,16,10,2012,1,0,2,1208.6799999999998,2,0,8.9981,36.08,0,0
7/6/11 7:00,2,0,1,2,26.94752532,70,12.71212952,360,2011-06-07 07:00:00,7,7,6,2011,1,0,14,1886.3267724,7,0,25.42425904,188.63267724,1,0
12/2/12 21:00,1,0,0,1,5.74,43,19.9995,36,2012-02-12 21:00:00,21,12,2,2012,6,1,21,246.82000000000002,0,21,19.9995,120.54,0,0
8/6/12 7:00,2,0,1,1,21.32,72,7.0015,428,2012-06-08 07:00:00,7,8,6,2012,4,0,7,1535.04,7,0,7.0015,149.24,1,0
12/4/11 1:00,2,0,1,2,25.42,50,6.0032,13,2011-04-12 01:00:00,1,12,4,2011,1,0,2,1271.0,1,0,12.0064,25.42,0,0
3/2/11 17:00,1,0,1,1,8.2,40,12.998,175,2011-02-03 17:00:00,17,3,2,2011,3,0,17,328.0,17,0,12.998,139.39999999999998,0,1
6/9/12 16:00,3,0,1,1,30.34,70,15.0013,416,2012-09-06 16:00:00,16,6,9,2012,3,0,16,2123.8,16,0,15.0013,485.44,0,0
17/6/11 22:00,2,0,1,1,25.42,88,8.9981,175,2011-06-17 22:00:00,22,17,6,2011,4,0,22,2236.96,22,0,8.9981,559.24,0,0
18/11/11 13:00,4,0,1,1,13.94,31,15.0013,177,2011-11-18 13:00:00,13,18,11,2011,4,0,13,432.14,13,0,15.0013,181.22,0,0
14/5/11 10:00,2,0,0,2,21.32,94,11.0014,167,2011-05-14 10:00:00,10,14,5,2011,5,1,20,2004.08,0,10,22.0028,213.2,0,0
18/11/12 18:00,4,0,0,1,14.76,66,15.0013,276,2012-11-18 18:00:00,18,18,11,2012,6,1,18,974.16,0,18,15.0013,265.68,0,1
5/1/12 5:00,1,0,1,2,8.2,59,6.0032,26,2012-01-05 05:00:00,5,5,1,2012,3,0,10,483.79999999999995,5,0,12.0064,41.0,0,0
5/2/12 10:00,1,0,0,2,10.66,65,19.0012,148,2012-02-05 10:00:00,10,5,2,2012,6,1,20,692.9,0,10,38.0024,106.6,0,0
13/2/11 8:00,1,0,0,2,9.02,64,12.998,12,2011-02-13 08:00:00,8,13,2,2011,6,1,16,577.28,0,8,25.996,72.16,1,0
15/8/12 16:00,3,0,1,1,31.16,48,12.998,431,2012-08-15 16:00:00,16,15,8,2012,2,0,16,1495.68,16,0,12.998,498.56,0,0
7/10/11 6:00,4,0,1,1,17.22,88,0.0,87,2011-10-07 06:00:00,6,7,10,2011,4,0,6,1515.36,6,0,0.0,103.32,0,0
14/6/11 17:00,2,0,1,3,25.82329694,51,18.49570407,561,2011-06-14 17:00:00,17,14,6,2011,1,0,51,1316.9881439399999,17,0,55.48711220999999,438.99604797999996,0,1
9/4/11 14:00,2,0,0,2,14.76,81,8.9981,212,2011-04-09 14:00:00,14,9,4,2011,5,1,28,1195.56,0,14,17.9962,206.64,0,0
9/2/11 6:00,1,0,1,1,2.46,45,0.0,43,2011-02-09 06:00:00,6,9,2,2011,2,0,6,110.7,6,0,0.0,14.76,0,0
16/9/11 18:00,3,0,1,2,20.19695857,52,10.29040983,460,2011-09-16 18:00:00,18,16,9,2011,4,0,36,1050.24184564,18,0,20.58081966,363.54525426,0,1
10/4/12 5:00,2,0,1,1,13.94,71,8.9981,24,2012-04-10 05:00:00,5,10,4,2012,1,0,5,989.74,5,0,8.9981,69.7,0,0
6/12/11 6:00,4,0,1,2,18.04,94,19.0012,86,2011-12-06 06:00:00,6,6,12,2011,1,0,12,1695.76,6,0,38.0024,108.24,0,0
17/5/12 5:00,2,0,1,1,22.96,68,22.0028,35,2012-05-17 05:00:00,5,17,5,2012,3,0,5,1561.28,5,0,22.0028,114.80000000000001,0,0
19/12/12 13:00,4,0,1,1,17.22,50,12.998,213,2012-12-19 13:00:00,13,19,12,2012,2,0,13,861.0,13,0,12.998,223.85999999999999,0,0
15/3/11 12:00,1,0,1,2,14.76,50,15.0013,102,2011-03-15 12:00:00,12,15,3,2011,1,0,24,738.0,12,0,30.0026,177.12,0,0
10/12/11 15:00,4,0,0,1,13.94,34,23.9994,299,2011-12-10 15:00:00,15,10,12,2011,5,1,15,473.96,0,15,23.9994,209.1,0,0
1/10/12 20:00,4,0,1,3,22.14,68,0.0,262,2012-10-01 20:00:00,20,1,10,2012,0,0,60,1505.52,20,0,0.0,442.8,0,0
10/1/11 16:00,1,0,1,1,8.2,40,8.9981,74,2011-01-10 16:00:00,16,10,1,2011,0,0,16,328.0,16,0,8.9981,131.2,0,0
12/6/11 14:00,2,0,0,1,33.62,56,16.9979,315,2011-06-12 14:00:00,14,12,6,2011,6,1,14,1882.7199999999998,0,14,16.9979,470.67999999999995,0,0
3/8/12 2:00,3,0,1,1,27.88,79,15.0013,14,2012-08-03 02:00:00,2,3,8,2012,4,0,2,2202.52,2,0,15.0013,55.76,0,0
13/1/12 15:00,1,0,1,1,10.66,33,39.0007,138,2012-01-13 15:00:00,15,13,1,2012,4,0,15,351.78000000000003,15,0,39.0007,159.9,0,0
10/7/11 0:00,3,0,0,1,28.86942065,62,11.53644334,152,2011-07-10 00:00:00,0,10,7,2011,6,1,0,1789.9040802999998,0,0,11.53644334,0.0,0,0
19/8/11 13:00,3,0,1,2,31.16,62,12.998,232,2011-08-19 13:00:00,13,19,8,2011,4,0,26,1931.92,13,0,25.996,405.08,0,0
3/9/12 12:00,3,1,0,2,31.16,62,19.9995,543,2012-09-03 12:00:00,12,3,9,2012,0,0,24,1931.92,0,0,39.999,373.92,0,0
5/9/12 20:00,3,0,1,1,29.52,84,11.0014,412,2012-09-05 20:00:00,20,5,9,2012,2,0,20,2479.68,20,0,11.0014,590.4,0,0
13/1/11 0:00,1,0,1,1,5.74,59,19.0012,7,2011-01-13 00:00:00,0,13,1,2011,3,0,0,338.66,0,0,19.0012,0.0,0,0
11/12/12 21:00,4,0,1,1,13.12,53,12.998,207,2012-12-11 21:00:00,21,11,12,2012,1,0,21,695.36,21,0,12.998,275.52,0,0
19/3/12 17:00,1,0,1,1,26.24,53,15.0013,721,2012-03-19 17:00:00,17,19,3,2012,0,0,17,1390.72,17,0,15.0013,446.08,0,1
18/7/12 14:00,3,0,1,1,38.54,38,22.0028,170,2012-07-18 14:00:00,14,18,7,2012,2,0,14,1464.52,14,0,22.0028,539.56,0,0
15/10/12 6:00,4,0,1,2,22.96,73,19.9995,147,2012-10-15 06:00:00,6,15,10,2012,0,0,12,1676.0800000000002,6,0,39.999,137.76,0,0
11/1/11 20:00,1,0,1,3,6.359350044,94,11.47753702,43,2011-01-11 20:00:00,20,11,1,2011,1,0,60,597.778904136,20,0,34.43261106,127.18700088,0,0
1/4/11 10:00,2,0,1,1,13.12,66,19.0012,75,2011-04-01 10:00:00,10,1,4,2011,4,0,10,865.92,10,0,19.0012,131.2,0,0
6/2/11 22:00,1,0,0,1,10.66,60,0.0,62,2011-02-06 22:00:00,22,6,2,2011,6,1,22,639.6,0,22,0.0,234.52,0,0
6/10/11 3:00,4,0,1,1,18.04,67,15.0013,5,2011-10-06 03:00:00,3,6,10,2011,3,0,3,1208.6799999999998,3,0,15.0013,54.12,0,0
14/1/11 22:00,1,0,1,2,6.713927752,68,0.402742937,46,2011-01-14 22:00:00,22,14,1,2011,4,0,44,456.547087136,22,0,0.805485874,147.706410544,0,0
13/4/12 2:00,2,0,1,1,13.94,49,12.998,11,2012-04-13 02:00:00,2,13,4,2012,4,0,2,683.06,2,0,12.998,27.88,0,0
9/12/11 3:00,4,0,1,1,9.02,80,0.0,6,2011-12-09 03:00:00,3,9,12,2011,4,0,3,721.5999999999999,3,0,0.0,27.06,0,0
17/7/12 3:00,3,0,1,1,29.52,66,0.0,3,2012-07-17 03:00:00,3,17,7,2012,1,0,3,1948.32,3,0,0.0,88.56,0,0
5/9/11 20:00,3,1,0,3,27.06,94,16.9979,82,2011-09-05 20:00:00,20,5,9,2011,0,0,60,2543.64,0,0,50.993700000000004,541.1999999999999,0,0
15/10/12 18:00,4,0,1,3,22.14,77,8.9981,592,2012-10-15 18:00:00,18,15,10,2012,0,0,54,1704.78,18,0,26.994300000000003,398.52,0,1
6/10/11 21:00,4,0,1,1,18.86,88,6.0032,195,2011-10-06 21:00:00,21,6,10,2011,3,0,21,1659.6799999999998,21,0,6.0032,396.06,0,0
17/3/11 14:00,1,0,1,1,20.5,45,7.0015,119,2011-03-17 14:00:00,14,17,3,2011,3,0,14,922.5,14,0,7.0015,287.0,0,0
16/11/11 17:00,4,0,1,2,19.59056973,90,13.4594009,228,2011-11-16 17:00:00,17,16,11,2011,2,0,34,1763.1512756999998,17,0,26.9188018,333.03968540999995,0,1
16/10/11 23:00,4,0,0,1,22.96,52,27.9993,62,2011-10-16 23:00:00,23,16,10,2011,6,1,23,1193.92,0,23,27.9993,528.08,0,0
11/4/12 19:00,2,0,1,1,16.4,40,23.9994,384,2012-04-11 19:00:00,19,11,4,2012,2,0,19,656.0,19,0,23.9994,311.59999999999997,0,1
11/8/11 14:00,3,0,1,1,30.99265446,30,0.84590971,129,2011-08-11 14:00:00,14,11,8,2011,3,0,14,929.7796338,14,0,0.84590971,433.89716244,0,0
7/2/11 6:00,1,0,1,1,7.38,93,0.0,30,2011-02-07 06:00:00,6,7,2,2011,0,0,6,686.34,6,0,0.0,44.28,0,0
8/12/11 17:00,4,0,1,1,12.3,49,7.0015,331,2011-12-08 17:00:00,17,8,12,2011,3,0,17,602.7,17,0,7.0015,209.10000000000002,0,1
7/11/11 5:00,4,0,1,1,12.3,93,0.0,26,2011-11-07 05:00:00,5,7,11,2011,0,0,5,1143.9,5,0,0.0,61.5,0,0
1/2/12 1:00,1,0,1,1,16.70050016,42,19.12048045,15,2012-02-01 01:00:00,1,1,2,2012,2,0,1,701.42100672,1,0,19.12048045,16.70050016,0,0
10/7/12 7:00,3,0,1,2,28.7,74,7.0015,520,2012-07-10 07:00:00,7,10,7,2012,1,0,14,2123.7999999999997,7,0,14.003,200.9,1,0
12/5/12 2:00,2,0,0,1,18.86,59,8.9981,56,2012-05-12 02:00:00,2,12,5,2012,5,1,2,1112.74,0,2,8.9981,37.72,0,0
18/5/11 7:00,2,0,1,1,22.14,88,12.998,274,2011-05-18 07:00:00,7,18,5,2011,2,0,7,1948.3200000000002,7,0,12.998,154.98000000000002,1,0
17/2/11 3:00,1,0,1,1,13.96207104,51,13.564098,47,2011-02-17 03:00:00,3,17,2,2011,3,0,3,712.06562304,3,0,13.564098,41.88621312,0,0
17/2/11 2:00,1,0,1,2,13.94,53,15.0013,6,2011-02-17 02:00:00,2,17,2,2011,3,0,4,738.8199999999999,2,0,30.0026,27.88,0,0
13/7/11 11:00,3,0,1,1,34.44,39,11.0014,165,2011-07-13 11:00:00,11,13,7,2011,2,0,11,1343.1599999999999,11,0,11.0014,378.84,0,0
2/11/11 1:00,4,0,1,1,12.41337917,85,0.0,29,2011-11-02 01:00:00,1,2,11,2011,2,0,1,1055.13722945,1,0,0.0,12.41337917,0,0
9/11/12 4:00,4,0,1,1,13.12,53,23.9994,14,2012-11-09 04:00:00,4,9,11,2012,4,0,4,695.36,4,0,23.9994,52.48,0,0
17/6/11 15:00,2,0,1,1,31.98,43,15.0013,243,2011-06-17 15:00:00,15,17,6,2011,4,0,15,1375.14,15,0,15.0013,479.7,0,0
6/8/12 11:00,3,0,1,1,31.68604503,66,6.785731037,262,2012-08-06 11:00:00,11,6,8,2012,0,0,11,2091.27897198,11,0,6.785731037,348.54649532999997,0,0
15/3/11 5:00,1,0,1,1,9.84,75,12.998,11,2011-03-15 05:00:00,5,15,3,2011,1,0,5,738.0,5,0,12.998,49.2,0,0
1/11/12 2:00,4,0,1,1,13.12,66,8.9981,20,2012-11-01 02:00:00,2,1,11,2012,3,0,2,865.92,2,0,8.9981,26.24,0,0
14/1/12 1:00,1,0,0,1,6.56,47,12.998,50,2012-01-14 01:00:00,1,14,1,2012,5,1,1,308.32,0,1,12.998,6.56,0,0
19/5/12 12:00,2,0,0,1,27.06,36,0.0,642,2012-05-19 12:00:00,12,19,5,2012,5,1,12,974.16,0,12,0.0,324.71999999999997,0,0
15/1/11 5:00,1,0,0,1,6.56,59,0.0,1,2011-01-15 05:00:00,5,15,1,2011,5,1,5,387.03999999999996,0,5,0.0,32.8,0,0
11/10/11 8:00,4,0,1,2,22.96,83,7.0015,406,2011-10-11 08:00:00,8,11,10,2011,1,0,16,1905.68,8,0,14.003,183.68,1,0
12/12/11 7:00,4,0,1,1,5.74,86,8.9981,235,2011-12-12 07:00:00,7,12,12,2011,0,0,7,493.64000000000004,7,0,8.9981,40.18,1,0
16/11/11 14:00,4,0,1,2,18.86,100,8.9981,61,2011-11-16 14:00:00,14,16,11,2011,2,0,28,1886.0,14,0,17.9962,264.03999999999996,0,0
1/6/11 17:00,2,0,1,1,35.26,47,19.9995,486,2011-06-01 17:00:00,17,1,6,2011,2,0,17,1657.2199999999998,17,0,19.9995,599.42,0,1
8/8/12 2:00,3,0,1,1,28.7,84,0.0,6,2012-08-08 02:00:00,2,8,8,2012,2,0,2,2410.7999999999997,2,0,0.0,57.4,0,0
5/6/11 20:00,2,0,0,1,27.06,69,12.998,279,2011-06-05 20:00:00,20,5,6,2011,6,1,20,1867.1399999999999,0,20,12.998,541.1999999999999,0,0
16/1/12 3:00,1,1,0,1,4.92,50,0.0,3,2012-01-16 03:00:00,3,16,1,2012,0,0,3,246.0,0,0,0.0,14.76,0,0
18/10/11 21:00,4,0,1,2,22.14,68,8.9981,206,2011-10-18 21:00:00,21,18,10,2011,1,0,42,1505.52,21,0,17.9962,464.94,0,0
12/4/12 20:00,2,0,1,1,18.04,33,16.9979,280,2012-04-12 20:00:00,20,12,4,2012,3,0,20,595.3199999999999,20,0,16.9979,360.79999999999995,0,0
9/5/11 5:00,2,0,1,1,15.83544489,77,11.3638129,5,2011-05-09 05:00:00,5,9,5,2011,0,0,5,1219.32925653,5,0,11.3638129,79.17722445,0,0
13/11/12 9:00,4,0,1,3,13.12,81,22.0028,110,2012-11-13 09:00:00,9,13,11,2012,1,0,27,1062.72,9,0,66.0084,118.08,1,0
15/4/11 2:00,2,1,0,1,16.4,76,0.0,18,2011-04-15 02:00:00,2,15,4,2011,4,0,2,1246.3999999999999,0,0,0.0,32.8,0,0
15/10/12 11:00,4,0,1,2,24.6,73,26.0027,263,2012-10-15 11:00:00,11,15,10,2012,0,0,22,1795.8000000000002,11,0,52.0054,270.6,0,0
14/6/12 12:00,2,0,1,2,27.51433394,60,15.49089373,283,2012-06-14 12:00:00,12,14,6,2012,3,0,24,1650.8600364,12,0,30.98178746,330.17200728,0,0
14/10/12 20:00,4,0,0,1,22.14,73,15.0013,246,2012-10-14 20:00:00,20,14,10,2012,6,1,20,1616.22,0,20,15.0013,442.8,0,0
7/2/12 17:00,1,0,1,1,19.30800437,31,13.37614942,509,2012-02-07 17:00:00,17,7,2,2012,1,0,17,598.5481354699999,17,0,13.37614942,328.23607429,0,1
12/5/11 12:00,2,0,1,1,23.78,60,15.0013,207,2011-05-12 12:00:00,12,12,5,2011,3,0,12,1426.8000000000002,12,0,15.0013,285.36,0,0
18/4/11 9:00,2,0,1,2,20.5,55,7.0015,169,2011-04-18 09:00:00,9,18,4,2011,0,0,18,1127.5,9,0,14.003,184.5,1,0
1/5/11 2:00,2,0,0,1,18.29813815,77,6.531861247,56,2011-05-01 02:00:00,2,1,5,2011,6,1,2,1408.9566375499999,0,2,6.531861247,36.5962763,0,0
4/1/11 13:00,1,0,1,1,9.84,56,12.998,97,2011-01-04 13:00:00,13,4,1,2011,1,0,13,551.04,13,0,12.998,127.92,0,0
15/4/12 14:00,2,0,0,1,28.7,39,19.0012,628,2012-04-15 14:00:00,14,15,4,2012,6,1,14,1119.3,0,14,19.0012,401.8,0,0
15/8/12 0:00,3,0,1,1,28.7,61,12.998,60,2012-08-15 00:00:00,0,15,8,2012,2,0,0,1750.7,0,0,12.998,0.0,0,0
9/1/11 17:00,1,0,0,1,7.38,37,26.0027,62,2011-01-09 17:00:00,17,9,1,2011,6,1,17,273.06,0,17,26.0027,125.46,0,1
16/11/11 9:00,4,0,1,3,18.86,94,0.0,82,2011-11-16 09:00:00,9,16,11,2011,2,0,27,1772.84,9,0,0.0,169.74,1,0
16/2/11 13:00,1,0,1,1,17.22,30,23.9994,93,2011-02-16 13:00:00,13,16,2,2011,2,0,13,516.5999999999999,13,0,23.9994,223.85999999999999,0,0
11/2/12 10:00,1,0,0,3,9.02,93,7.0015,166,2012-02-11 10:00:00,10,11,2,2012,5,1,30,838.86,0,10,21.0045,90.19999999999999,0,0
8/9/11 1:00,3,0,1,3,25.42,94,7.0015,4,2011-09-08 01:00:00,1,8,9,2011,3,0,3,2389.48,1,0,21.0045,25.42,0,0
19/10/12 12:00,4,0,1,1,26.24,69,15.0013,332,2012-10-19 12:00:00,12,19,10,2012,4,0,12,1810.56,12,0,15.0013,314.88,0,0
17/4/12 21:00,2,0,1,1,22.96,26,19.9995,297,2012-04-17 21:00:00,21,17,4,2012,1,0,21,596.96,21,0,19.9995,482.16,0,0
17/6/12 14:00,2,0,0,1,26.24,53,0.0,582,2012-06-17 14:00:00,14,17,6,2012,6,1,14,1390.72,0,14,0.0,367.35999999999996,0,0
4/8/12 6:00,3,0,0,1,28.1765238,83,15.4170913,16,2012-08-04 06:00:00,6,4,8,2012,5,1,6,2338.6514754,0,6,15.4170913,169.0591428,0,0
19/11/11 21:00,4,0,0,2,14.76,62,12.998,108,2011-11-19 21:00:00,21,19,11,2011,5,1,42,915.12,0,21,25.996,309.96,0,0
5/11/11 19:00,4,0,0,1,13.94,53,0.0,204,2011-11-05 19:00:00,19,5,11,2011,5,1,19,738.8199999999999,0,19,0.0,264.86,0,1
9/8/11 4:00,3,0,1,1,28.7,74,0.0,7,2011-08-09 04:00:00,4,9,8,2011,1,0,4,2123.7999999999997,4,0,0.0,114.8,0,0
19/3/12 8:00,1,0,1,1,19.32956207,89,6.364295317,554,2012-03-19 08:00:00,8,19,3,2012,0,0,8,1720.3310242300001,8,0,6.364295317,154.63649656,1,0
9/9/12 10:00,3,0,0,1,27.48994952,55,19.35584219,473,2012-09-09 10:00:00,10,9,9,2012,6,1,10,1511.9472236,0,10,19.35584219,274.8994952,0,0
2/4/11 1:00,2,0,0,1,11.549395,65,8.77188573,22,2011-04-02 01:00:00,1,2,4,2011,5,1,1,750.710675,0,1,8.77188573,11.549395,0,0
4/1/12 1:00,1,0,1,1,1.64,38,19.9995,3,2012-01-04 01:00:00,1,4,1,2012,2,0,1,62.31999999999999,1,0,19.9995,1.64,0,0
13/8/12 16:00,3,0,1,1,32.8,36,6.0032,464,2012-08-13 16:00:00,16,13,8,2012,0,0,16,1180.8,16,0,6.0032,524.8,0,0
11/5/11 11:00,2,0,1,1,22.96,64,6.0032,141,2011-05-11 11:00:00,11,11,5,2011,2,0,11,1469.44,11,0,6.0032,252.56,0,0
3/10/11 2:00,4,0,1,1,14.76,76,7.0015,4,2011-10-03 02:00:00,2,3,10,2011,0,0,2,1121.76,2,0,7.0015,29.52,0,0
15/5/12 10:00,2,0,1,1,25.85597091,81,5.42069097,176,2012-05-15 10:00:00,10,15,5,2012,1,0,10,2094.33364371,10,0,5.42069097,258.5597091,0,0
14/8/11 7:00,3,0,0,2,27.06,89,12.998,24,2011-08-14 07:00:00,7,14,8,2011,6,1,14,2408.3399999999997,0,7,25.996,189.42,1,0
15/8/11 18:00,3,0,1,1,27.49399214,64,12.85502511,484,2011-08-15 18:00:00,18,15,8,2011,0,0,18,1759.61549696,18,0,12.85502511,494.89185851999997,0,1
13/9/11 9:00,3,0,1,1,26.24,69,6.0032,214,2011-09-13 09:00:00,9,13,9,2011,1,0,9,1810.56,9,0,6.0032,236.16,1,0
6/11/11 19:00,4,0,0,1,15.58,76,12.998,151,2011-11-06 19:00:00,19,6,11,2011,6,1,19,1184.08,0,19,12.998,296.02,0,1
19/5/11 15:00,2,0,1,1,22.55772209,79,12.77320596,193,2011-05-19 15:00:00,15,19,5,2011,3,0,15,1782.06004511,15,0,12.77320596,338.36583135,0,0
6/6/12 21:00,2,0,1,1,22.14,73,11.0014,298,2012-06-06 21:00:00,21,6,6,2012,2,0,21,1616.22,21,0,11.0014,464.94,0,0
10/1/11 7:00,1,0,1,1,4.92,50,15.0013,77,2011-01-10 07:00:00,7,10,1,2011,0,0,7,246.0,7,0,15.0013,34.44,1,0
4/11/11 23:00,4,0,1,1,13.12,49,22.0028,89,2011-11-04 23:00:00,23,4,11,2011,4,0,23,642.88,23,0,22.0028,301.76,0,0
19/5/11 20:00,2,0,1,1,22.14,77,19.0012,282,2011-05-19 20:00:00,20,19,5,2011,3,0,20,1704.78,20,0,19.0012,442.8,0,0
18/6/12 7:00,2,0,1,3,21.32,94,15.0013,145,2012-06-18 07:00:00,7,18,6,2012,0,0,21,2004.08,7,0,45.0039,149.24,1,0
19/2/11 2:00,1,0,0,1,18.04,13,26.0027,17,2011-02-19 02:00:00,2,19,2,2011,5,1,2,234.51999999999998,0,2,26.0027,36.08,0,0
5/12/11 18:00,4,0,1,1,18.04,77,0.0,399,2011-12-05 18:00:00,18,5,12,2011,0,0,18,1389.08,18,0,0.0,324.71999999999997,0,1
12/5/11 7:00,2,0,1,1,18.08363148,89,10.02390791,296,2011-05-12 07:00:00,7,12,5,2011,3,0,7,1609.4432017200002,7,0,10.02390791,126.58542036,1,0
6/9/12 16:00,3,0,1,1,29.29062669,70,15.51410792,399,2012-09-06 16:00:00,16,6,9,2012,3,0,16,2050.3438683,16,0,15.51410792,468.65002704,0,0
17/8/12 18:00,3,0,1,2,33.62662724,37,16.86244228,634,2012-08-17 18:00:00,18,17,8,2012,4,0,36,1244.18520788,18,0,33.72488456,605.27929032,0,1
19/1/12 4:00,1,0,1,1,4.92,54,7.0015,1,2012-01-19 04:00:00,4,19,1,2012,3,0,4,265.68,4,0,7.0015,19.68,0,0
8/3/12 0:00,1,0,1,1,19.59638112,60,23.34336002,71,2012-03-08 00:00:00,0,8,3,2012,3,0,0,1175.7828672,0,0,23.34336002,0.0,0,0
2/12/12 18:00,4,0,0,2,18.04,72,7.0015,203,2012-12-02 18:00:00,18,2,12,2012,6,1,36,1298.8799999999999,0,18,14.003,324.71999999999997,0,1
10/7/12 6:00,3,0,1,2,27.88,79,7.0015,187,2012-07-10 06:00:00,6,10,7,2012,1,0,12,2202.52,6,0,14.003,167.28,0,0
12/2/11 14:00,1,0,0,1,13.94,31,19.0012,120,2011-02-12 14:00:00,14,12,2,2011,5,1,14,432.14,0,14,19.0012,195.16,0,0
13/1/11 11:00,1,0,1,2,8.2,44,30.0026,37,2011-01-13 11:00:00,11,13,1,2011,3,0,22,360.79999999999995,11,0,60.0052,90.19999999999999,0,0
5/1/11 7:00,1,0,1,1,7.38,43,12.998,88,2011-01-05 07:00:00,7,5,1,2011,2,0,7,317.34,7,0,12.998,51.66,1,0
19/6/12 21:00,2,0,1,1,31.16,62,11.0014,276,2012-06-19 21:00:00,21,19,6,2012,1,0,21,1931.92,21,0,11.0014,654.36,0,0
4/5/12 9:00,2,0,1,1,24.6,78,0.0,294,2012-05-04 09:00:00,9,4,5,2012,4,0,9,1918.8000000000002,9,0,0.0,221.4,1,0
14/2/12 5:00,1,0,1,2,10.66,65,7.0015,22,2012-02-14 05:00:00,5,14,2,2012,1,0,10,692.9,5,0,14.003,53.3,0,0
9/7/11 15:00,3,0,0,1,34.44,34,6.0032,402,2011-07-09 15:00:00,15,9,7,2011,5,1,15,1170.96,0,15,6.0032,516.5999999999999,0,0
13/11/11 0:00,4,0,0,2,16.4,58,12.998,73,2011-11-13 00:00:00,0,13,11,2011,6,1,0,951.1999999999999,0,0,25.996,0.0,0,0
17/9/11 14:00,3,0,0,2,23.13215222,71,12.49866032,297,2011-09-17 14:00:00,14,17,9,2011,5,1,28,1642.3828076199998,0,14,24.99732064,323.85013108,0,0
7/2/12 7:00,1,0,1,1,13.24616093,47,1.059188498,306,2012-02-07 07:00:00,7,7,2,2012,1,0,7,622.56956371,7,0,1.059188498,92.72312651,1,0
12/4/12 21:00,2,0,1,1,17.22,35,8.9981,187,2012-04-12 21:00:00,21,12,4,2012,3,0,21,602.6999999999999,21,0,8.9981,361.62,0,0
16/5/11 10:00,2,0,1,1,25.42,65,6.0032,112,2011-05-16 10:00:00,10,16,5,2011,0,0,10,1652.3000000000002,10,0,6.0032,254.20000000000002,0,0
19/9/12 23:00,3,0,1,1,19.68,67,6.0032,123,2012-09-19 23:00:00,23,19,9,2012,2,0,23,1318.56,23,0,6.0032,452.64,0,0
9/8/12 17:00,3,0,1,1,35.26,36,16.9979,810,2012-08-09 17:00:00,17,9,8,2012,3,0,17,1269.36,17,0,16.9979,599.42,0,1
11/2/12 3:00,1,0,0,3,9.84,87,15.0013,9,2012-02-11 03:00:00,3,11,2,2012,5,1,9,856.08,0,3,45.0039,29.52,0,0
12/3/11 2:00,1,0,0,1,9.84,65,12.998,14,2011-03-12 02:00:00,2,12,3,2011,5,1,2,639.6,0,2,12.998,19.68,0,0
2/8/12 17:00,3,0,1,1,33.52509437,49,18.15722803,891,2012-08-02 17:00:00,17,2,8,2012,3,0,17,1642.7296241299998,17,0,18.15722803,569.92660429,0,1
8/5/12 14:00,2,0,1,3,25.42,69,22.0028,71,2012-05-08 14:00:00,14,8,5,2012,1,0,42,1753.98,14,0,66.0084,355.88,0,0
11/2/11 18:00,1,0,1,1,11.48,28,0.0,174,2011-02-11 18:00:00,18,11,2,2011,4,0,18,321.44,18,0,0.0,206.64000000000001,0,1
8/9/12 7:00,3,0,0,1,27.06,89,19.0012,82,2012-09-08 07:00:00,7,8,9,2012,5,1,7,2408.3399999999997,0,7,19.0012,189.42,1,0
18/11/11 15:00,4,0,1,1,13.94,29,8.9981,178,2011-11-18 15:00:00,15,18,11,2011,4,0,15,404.26,15,0,8.9981,209.1,0,0
6/6/11 22:00,2,0,1,1,27.06,61,6.0032,173,2011-06-06 22:00:00,22,6,6,2011,0,0,22,1650.6599999999999,22,0,6.0032,595.3199999999999,0,0
3/5/12 23:00,2,0,1,1,24.6,83,0.0,121,2012-05-03 23:00:00,23,3,5,2012,3,0,23,2041.8000000000002,23,0,0.0,565.8000000000001,0,0
1/1/11 4:00,1,0,0,1,9.84,75,0.0,1,2011-01-01 04:00:00,4,1,1,2011,5,1,4,738.0,0,4,0.0,39.36,0,0
4/3/12 2:00,1,0,0,2,14.76,40,11.0014,80,2012-03-04 02:00:00,2,4,3,2012,6,1,4,590.4,0,2,22.0028,29.52,0,0
3/3/11 2:00,1,0,1,1,8.2,27,31.0009,3,2011-03-03 02:00:00,2,3,3,2011,3,0,2,221.39999999999998,2,0,31.0009,16.4,0,0
6/6/12 2:00,2,0,1,1,20.5,68,0.0,11,2012-06-06 02:00:00,2,6,6,2012,2,0,2,1394.0,2,0,0.0,41.0,0,0
4/6/12 20:00,2,0,1,1,24.85707847,39,23.30570741,435,2012-06-04 20:00:00,20,4,6,2012,0,0,20,969.42606033,20,0,23.30570741,497.14156940000004,0,0
9/4/12 18:00,2,0,1,1,21.83953294,31,19.89733875,646,2012-04-09 18:00:00,18,9,4,2012,0,0,18,677.02552114,18,0,19.89733875,393.11159292,0,1
5/2/11 6:00,1,0,0,3,8.2,100,0.0,4,2011-02-05 06:00:00,6,5,2,2011,5,1,18,819.9999999999999,0,6,0.0,49.199999999999996,0,0
18/1/11 19:00,1,0,1,2,9.02,80,8.9981,99,2011-01-18 19:00:00,19,18,1,2011,1,0,38,721.5999999999999,19,0,17.9962,171.38,0,1
18/11/11 14:00,4,0,1,1,13.94,31,8.9981,154,2011-11-18 14:00:00,14,18,11,2011,4,0,14,432.14,14,0,8.9981,195.16,0,0
13/8/12 12:00,3,0,1,1,31.98,40,12.998,276,2012-08-13 12:00:00,12,13,8,2012,0,0,12,1279.2,12,0,12.998,383.76,0,0
14/6/11 7:00,2,0,1,1,22.81190395,50,26.46688495,339,2011-06-14 07:00:00,7,14,6,2011,1,0,7,1140.5951975,7,0,26.46688495,159.68332765000002,1,0
6/5/12 1:00,2,0,0,2,22.14,83,15.0013,121,2012-05-06 01:00:00,1,6,5,2012,6,1,2,1837.6200000000001,0,1,30.0026,22.14,0,0
16/7/11 22:00,3,0,0,1,29.50101717,68,18.38469476,208,2011-07-16 22:00:00,22,16,7,2011,5,1,22,2006.06916756,0,22,18.38469476,649.02237774,0,0
15/11/12 8:00,4,0,1,2,12.63816265,63,15.15956204,660,2012-11-15 08:00:00,8,15,11,2012,3,0,16,796.20424695,8,0,30.31912408,101.1053012,1,0
13/12/11 13:00,4,0,1,1,16.4,37,22.0028,127,2011-12-13 13:00:00,13,13,12,2011,1,0,13,606.8,13,0,22.0028,213.2,0,0
15/2/12 8:00,1,0,1,1,14.03590651,60,24.28494066,521,2012-02-15 08:00:00,8,15,2,2012,2,0,8,842.1543906,8,0,24.28494066,112.28725208,1,0
14/4/11 7:00,2,0,1,1,15.58,66,0.0,193,2011-04-14 07:00:00,7,14,4,2011,3,0,7,1028.28,7,0,0.0,109.06,1,0
18/1/12 15:00,1,0,1,1,12.3,33,35.0008,130,2012-01-18 15:00:00,15,18,1,2012,2,0,15,405.90000000000003,15,0,35.0008,184.5,0,0
12/6/12 21:00,2,0,1,1,27.73254752,81,5.61395603,256,2012-06-12 21:00:00,21,12,6,2012,1,0,21,2246.3363491200002,21,0,5.61395603,582.38349792,0,0
12/4/11 22:00,2,0,1,2,16.4,94,19.9995,54,2011-04-12 22:00:00,22,12,4,2011,1,0,44,1541.6,22,0,39.999,360.79999999999995,0,0
5/10/11 19:00,4,0,1,1,23.78,56,8.9981,374,2011-10-05 19:00:00,19,5,10,2011,2,0,19,1331.68,19,0,8.9981,451.82000000000005,0,1
9/6/12 2:00,2,0,0,1,26.24,50,15.0013,89,2012-06-09 02:00:00,2,9,6,2012,5,1,2,1312.0,0,2,15.0013,52.48,0,0
16/7/11 23:00,3,0,0,1,27.88,61,15.0013,168,2011-07-16 23:00:00,23,16,7,2011,5,1,23,1700.6799999999998,0,23,15.0013,641.24,0,0
1/8/12 13:00,3,0,1,1,32.8,52,11.0014,280,2012-08-01 13:00:00,13,1,8,2012,2,0,13,1705.6,13,0,11.0014,426.4,0,0
6/5/11 1:00,2,0,1,1,16.4,62,11.0014,32,2011-05-06 01:00:00,1,6,5,2011,4,0,1,1016.8,1,0,11.0014,16.4,0,0
4/10/11 22:00,4,0,1,1,20.5,72,8.9981,114,2011-10-04 22:00:00,22,4,10,2011,1,0,22,1476.0,22,0,8.9981,451.0,0,0
10/1/12 18:00,1,0,1,1,16.4,40,7.0015,385,2012-01-10 18:00:00,18,10,1,2012,1,0,18,656.0,18,0,7.0015,295.2,0,1
4/4/11 1:00,2,0,1,1,15.93038579,54,22.16751596,8,2011-04-04 01:00:00,1,4,4,2011,0,0,1,860.24083266,1,0,22.16751596,15.93038579,0,0
11/3/11 1:00,1,0,1,3,13.94,100,7.0015,8,2011-03-11 01:00:00,1,11,3,2011,4,0,3,1394.0,1,0,21.0045,13.94,0,0
14/10/11 19:00,4,0,1,1,22.14,39,22.0028,248,2011-10-14 19:00:00,19,14,10,2011,4,0,19,863.46,19,0,22.0028,420.66,0,1
5/3/11 12:00,1,0,0,2,18.04,67,16.9979,167,2011-03-05 12:00:00,12,5,3,2011,5,1,24,1208.6799999999998,0,12,33.9958,216.48,0,0
18/10/11 11:00,4,0,1,2,24.6,49,7.0015,147,2011-10-18 11:00:00,11,18,10,2011,1,0,22,1205.4,11,0,14.003,270.6,0,0
9/4/11 11:00,2,0,0,2,14.96074285,78,0.0,149,2011-04-09 11:00:00,11,9,4,2011,5,1,22,1166.9379423,0,11,0.0,164.56817135,0,0
5/11/12 7:00,4,0,1,2,12.3,49,16.9979,461,2012-11-05 07:00:00,7,5,11,2012,0,0,14,602.7,7,0,33.9958,86.10000000000001,1,0
1/9/11 7:00,3,0,1,1,24.02943327,80,0.0,341,2011-09-01 07:00:00,7,1,9,2011,3,0,7,1922.3546615999999,7,0,0.0,168.20603289,1,0
10/6/11 9:00,2,0,1,1,31.16,55,0.0,213,2011-06-10 09:00:00,9,10,6,2011,4,0,9,1713.8,9,0,0.0,280.44,1,0
9/6/12 20:00,2,0,0,1,31.16,35,15.0013,363,2012-06-09 20:00:00,20,9,6,2012,5,1,20,1090.6,0,20,15.0013,623.2,0,0
5/2/11 3:00,1,0,0,2,9.84,75,11.0014,11,2011-02-05 03:00:00,3,5,2,2011,5,1,6,738.0,0,3,22.0028,29.52,0,0
7/1/11 22:00,1,0,1,2,7.38,43,11.0014,36,2011-01-07 22:00:00,22,7,1,2011,4,0,44,317.34,22,0,22.0028,162.35999999999999,0,0
15/12/11 11:00,4,0,1,2,16.4,62,27.9993,135,2011-12-15 11:00:00,11,15,12,2011,3,0,22,1016.8,11,0,55.9986,180.39999999999998,0,0
10/11/11 0:00,4,0,1,1,16.4,87,0.0,24,2011-11-10 00:00:00,0,10,11,2011,3,0,0,1426.8,0,0,0.0,0.0,0,0
12/6/12 2:00,2,0,1,2,27.88,65,12.998,6,2012-06-12 02:00:00,2,12,6,2012,1,0,4,1812.2,2,0,25.996,55.76,0,0
17/6/11 8:00,2,0,1,2,24.6,83,0.0,454,2011-06-17 08:00:00,8,17,6,2011,4,0,16,2041.8000000000002,8,0,0.0,196.8,1,0
6/9/11 2:00,3,0,1,3,22.14,94,16.9979,2,2011-09-06 02:00:00,2,6,9,2011,1,0,6,2081.16,2,0,50.993700000000004,44.28,0,0
16/11/12 13:00,4,0,1,1,17.22,38,12.998,278,2012-11-16 13:00:00,13,16,11,2012,4,0,13,654.3599999999999,13,0,12.998,223.85999999999999,0,0
3/1/12 13:00,1,0,1,1,7.38,34,43.9989,73,2012-01-03 13:00:00,13,3,1,2012,1,0,13,250.92,13,0,43.9989,95.94,0,0
19/5/11 9:00,2,0,1,2,22.14,88,6.0032,216,2011-05-19 09:00:00,9,19,5,2011,3,0,18,1948.3200000000002,9,0,12.0064,199.26,1,0
16/9/12 8:00,3,0,0,1,22.14,64,11.0014,128,2012-09-16 08:00:00,8,16,9,2012,6,1,8,1416.96,0,8,11.0014,177.12,1,0
14/4/11 23:00,2,0,1,1,18.86,59,7.0015,47,2011-04-14 23:00:00,23,14,4,2011,3,0,23,1112.74,23,0,7.0015,433.78,0,0
19/9/12 2:00,3,0,1,2,22.14,64,22.0028,3,2012-09-19 02:00:00,2,19,9,2012,2,0,4,1416.96,2,0,44.0056,44.28,0,0
10/9/11 23:00,3,0,0,2,25.42,88,0.0,139,2011-09-10 23:00:00,23,10,9,2011,5,1,46,2236.96,0,23,0.0,584.6600000000001,0,0
6/7/11 19:00,3,0,1,1,30.34,70,15.0013,394,2011-07-06 19:00:00,19,6,7,2011,2,0,19,2123.8,19,0,15.0013,576.46,0,1
5/1/12 8:00,1,0,1,2,8.2,75,0.0,388,2012-01-05 08:00:00,8,5,1,2012,3,0,16,615.0,8,0,0.0,65.6,1,0
9/12/11 7:00,4,0,1,1,9.02,75,6.0032,199,2011-12-09 07:00:00,7,9,12,2011,4,0,7,676.5,7,0,6.0032,63.14,1,0
12/7/12 9:00,3,0,1,1,29.52,58,7.0015,327,2012-07-12 09:00:00,9,12,7,2012,3,0,9,1712.16,9,0,7.0015,265.68,1,0
17/5/11 5:00,2,0,1,3,21.32,94,16.9979,22,2011-05-17 05:00:00,5,17,5,2011,1,0,15,2004.08,5,0,50.993700000000004,106.6,0,0
19/7/12 17:00,3,0,1,1,35.26,41,0.0,771,2012-07-19 17:00:00,17,19,7,2012,3,0,17,1445.6599999999999,17,0,0.0,599.42,0,1
8/8/12 16:00,3,0,1,2,32.8,49,19.0012,441,2012-08-08 16:00:00,16,8,8,2012,2,0,32,1607.1999999999998,16,0,38.0024,524.8,0,0
4/8/12 19:00,3,0,0,1,33.62,52,23.9994,397,2012-08-04 19:00:00,19,4,8,2012,5,1,19,1748.2399999999998,0,19,23.9994,638.78,0,1
3/2/12 6:00,1,0,1,1,9.84,65,11.0014,88,2012-02-03 06:00:00,6,3,2,2012,4,0,6,639.6,6,0,11.0014,59.04,0,0
16/12/11 2:00,4,0,1,1,19.30046109,74,6.124516553,1,2011-12-16 02:00:00,2,16,12,2011,4,0,2,1428.23412066,2,0,6.124516553,38.60092218,0,0
10/5/11 0:00,2,0,1,1,19.68,63,0.0,18,2011-05-10 00:00:00,0,10,5,2011,1,0,0,1239.84,0,0,0.0,0.0,0,0
10/5/11 19:00,2,0,1,1,24.6,43,15.0013,434,2011-05-10 19:00:00,19,10,5,2011,1,0,19,1057.8,19,0,15.0013,467.40000000000003,0,1
12/6/12 9:00,2,0,1,2,26.24,89,19.0012,285,2012-06-12 09:00:00,9,12,6,2012,1,0,18,2335.3599999999997,9,0,38.0024,236.16,1,0
16/6/11 15:00,2,0,1,2,28.7,61,19.9995,159,2011-06-16 15:00:00,15,16,6,2011,3,0,30,1750.7,15,0,39.999,430.5,0,0
14/10/12 19:00,4,0,0,1,22.96,64,15.0013,336,2012-10-14 19:00:00,19,14,10,2012,6,1,19,1469.44,0,19,15.0013,436.24,0,1
12/11/12 11:00,4,1,0,1,21.53568658,71,10.71659424,399,2012-11-12 11:00:00,11,12,11,2012,0,0,11,1529.03374718,0,0,10.71659424,236.89255238,0,0
1/10/11 8:00,4,0,0,2,16.4,76,22.0028,67,2011-10-01 08:00:00,8,1,10,2011,5,1,16,1246.3999999999999,0,8,44.0056,131.2,1,0
11/7/12 17:00,3,0,1,1,32.8,31,15.0013,830,2012-07-11 17:00:00,17,11,7,2012,2,0,17,1016.8,17,0,15.0013,557.5999999999999,0,1
7/6/11 10:00,2,0,1,2,31.16,48,12.998,123,2011-06-07 10:00:00,10,7,6,2011,1,0,20,1495.68,10,0,25.996,311.6,0,0
9/9/11 4:00,3,0,1,3,25.42,94,11.0014,3,2011-09-09 04:00:00,4,9,9,2011,4,0,12,2389.48,4,0,33.0042,101.68,0,0
14/12/12 19:00,4,0,1,1,13.49844045,54,6.841009126,286,2012-12-14 19:00:00,19,14,12,2012,4,0,19,728.9157843,19,0,6.841009126,256.47036855,0,1
8/8/12 19:00,3,0,1,1,31.16,66,15.0013,686,2012-08-08 19:00:00,19,8,8,2012,2,0,19,2056.56,19,0,15.0013,592.04,0,1
19/10/12 3:00,4,0,1,2,22.2774104,78,0.781183968,1,2012-10-19 03:00:00,3,19,10,2012,4,0,6,1737.6380112000002,3,0,1.562367936,66.8322312,0,0
2/1/11 13:00,1,0,0,2,14.76,66,8.9981,75,2011-01-02 13:00:00,13,2,1,2011,6,1,26,974.16,0,13,17.9962,191.88,0,0
18/10/11 20:00,4,0,1,1,22.14,64,11.0014,227,2011-10-18 20:00:00,20,18,10,2011,1,0,20,1416.96,20,0,11.0014,442.8,0,0
19/8/12 19:00,3,0,0,2,26.24,73,8.9981,341,2012-08-19 19:00:00,19,19,8,2012,6,1,38,1915.52,0,19,17.9962,498.55999999999995,0,1
8/6/12 0:00,2,0,1,1,22.96,56,11.0014,77,2012-06-08 00:00:00,0,8,6,2012,4,0,0,1285.76,0,0,11.0014,0.0,0,0
8/7/12 6:00,3,0,0,1,30.23248071,72,8.811144359,20,2012-07-08 06:00:00,6,8,7,2012,6,1,6,2176.73861112,0,6,8.811144359,181.39488426,0,0
15/4/11 8:00,2,1,0,1,18.04,62,19.9995,300,2011-04-15 08:00:00,8,15,4,2011,4,0,8,1118.48,0,0,19.9995,144.32,1,0
5/10/11 5:00,4,0,1,1,18.85772627,80,8.579307312,57,2011-10-05 05:00:00,5,5,10,2011,2,0,5,1508.6181016,5,0,8.579307312,94.28863135,0,0
6/8/11 3:00,3,0,0,2,27.06,78,11.0014,42,2011-08-06 03:00:00,3,6,8,2011,5,1,6,2110.68,0,3,22.0028,81.17999999999999,0,0
16/10/11 8:00,4,0,0,1,18.04,62,12.998,99,2011-10-16 08:00:00,8,16,10,2011,6,1,8,1118.48,0,8,12.998,144.32,1,0
6/8/11 23:00,3,0,0,3,28.7,84,19.0012,108,2011-08-06 23:00:00,23,6,8,2011,5,1,69,2410.7999999999997,0,23,57.003600000000006,660.1,0,0
3/9/12 21:00,3,1,0,1,29.52,76,7.0015,184,2012-09-03 21:00:00,21,3,9,2012,0,0,21,2243.52,0,0,7.0015,619.92,0,0
16/6/12 20:00,2,0,0,2,27.06,47,12.998,352,2012-06-16 20:00:00,20,16,6,2012,5,1,40,1271.82,0,20,25.996,541.1999999999999,0,0
11/3/12 5:00,1,0,0,1,9.84,60,11.0014,7,2012-03-11 05:00:00,5,11,3,2012,6,1,5,590.4,0,5,11.0014,49.2,0,0
12/5/12 17:00,2,0,0,2,27.12846286,37,12.73328345,595,2012-05-12 17:00:00,17,12,5,2012,5,1,34,1003.7531258199999,0,17,25.4665669,461.18386862,0,1
9/10/11 8:00,4,0,0,1,19.96057225,88,0.0,142,2011-10-09 08:00:00,8,9,10,2011,6,1,8,1756.530358,0,8,0.0,159.684578,1,0
5/7/12 18:00,3,0,1,2,36.9,39,22.0028,607,2012-07-05 18:00:00,18,5,7,2012,3,0,36,1439.1,18,0,44.0056,664.1999999999999,0,1
15/4/11 11:00,2,1,0,1,21.32,55,12.998,136,2011-04-15 11:00:00,11,15,4,2011,4,0,11,1172.6,0,0,12.998,234.52,0,0
1/10/12 6:00,4,0,1,1,18.04,77,7.0015,155,2012-10-01 06:00:00,6,1,10,2012,0,0,6,1389.08,6,0,7.0015,108.24,0,0
2/9/12 2:00,3,0,0,1,27.06,89,0.0,84,2012-09-02 02:00:00,2,2,9,2012,6,1,2,2408.3399999999997,0,2,0.0,54.12,0,0
18/5/11 18:00,2,0,1,1,23.67405615,74,14.56791333,481,2011-05-18 18:00:00,18,18,5,2011,2,0,18,1751.8801551,18,0,14.56791333,426.1330107,0,1
2/1/11 10:00,1,0,0,2,15.8585411,76,16.51262462,82,2011-01-02 10:00:00,10,2,1,2011,6,1,20,1205.2491236,0,10,33.02524924,158.585411,0,0
8/2/12 4:00,1,0,1,1,9.84,70,6.0032,1,2012-02-08 04:00:00,4,8,2,2012,2,0,4,688.8,4,0,6.0032,39.36,0,0
10/11/12 10:00,4,0,0,1,16.4,58,0.0,350,2012-11-10 10:00:00,10,10,11,2012,5,1,10,951.1999999999999,0,10,0.0,164.0,0,0
1/8/12 8:00,3,0,1,2,27.06,78,12.998,681,2012-08-01 08:00:00,8,1,8,2012,2,0,16,2110.68,8,0,25.996,216.48,1,0
2/11/11 4:00,4,0,1,1,12.58402296,90,0.0,1,2011-11-02 04:00:00,4,2,11,2011,2,0,4,1132.5620664,4,0,0.0,50.33609184,0,0
19/9/12 12:00,3,0,1,1,24.6,43,16.9979,313,2012-09-19 12:00:00,12,19,9,2012,2,0,12,1057.8,12,0,16.9979,295.20000000000005,0,0
5/3/11 3:00,1,0,0,2,12.3,87,12.998,2,2011-03-05 03:00:00,3,5,3,2011,5,1,6,1070.1000000000001,0,3,25.996,36.900000000000006,0,0
2/12/11 1:00,4,0,1,1,10.46063444,74,0.028698822,1,2011-12-02 01:00:00,1,2,12,2011,4,0,1,774.08694856,1,0,0.028698822,10.46063444,0,0
11/11/11 17:00,4,1,0,1,14.68856477,38,22.92443295,325,2011-11-11 17:00:00,17,11,11,2011,4,0,17,558.16546126,0,0,22.92443295,249.70560109,0,1
3/6/11 4:00,2,0,1,1,21.32,48,22.0028,6,2011-06-03 04:00:00,4,3,6,2011,4,0,4,1023.36,4,0,22.0028,85.28,0,0
13/11/11 17:00,4,0,0,1,21.32,27,22.0028,231,2011-11-13 17:00:00,17,13,11,2011,6,1,17,575.64,0,17,22.0028,362.44,0,1
12/1/11 9:00,1,0,1,1,6.56,59,22.0028,81,2011-01-12 09:00:00,9,12,1,2011,2,0,9,387.03999999999996,9,0,22.0028,59.04,1,0
15/11/12 7:00,4,0,1,2,11.95717963,67,13.50845362,382,2012-11-15 07:00:00,7,15,11,2012,3,0,14,801.13103521,7,0,27.01690724,83.70025741,1,0
16/1/12 21:00,1,1,0,1,11.48,52,22.0028,49,2012-01-16 21:00:00,21,16,1,2012,0,0,21,596.96,0,0,22.0028,241.08,0,0
3/8/11 14:00,3,0,1,2,29.683458,59,13.91607857,144,2011-08-03 14:00:00,14,3,8,2011,2,0,28,1751.324022,14,0,27.83215714,415.568412,0,0
11/11/11 10:00,4,1,0,1,13.12,42,36.9974,200,2011-11-11 10:00:00,10,11,11,2011,4,0,10,551.04,0,0,36.9974,131.2,0,0
7/9/11 1:00,3,0,1,3,22.14,94,16.9979,5,2011-09-07 01:00:00,1,7,9,2011,2,0,3,2081.16,1,0,50.993700000000004,22.14,0,0
8/12/12 4:00,4,0,0,2,14.76,93,0.0,12,2012-12-08 04:00:00,4,8,12,2012,5,1,8,1372.68,0,4,0.0,59.04,0,0
10/2/11 23:00,1,0,1,1,4.92,42,7.0015,34,2011-02-10 23:00:00,23,10,2,2011,3,0,23,206.64,23,0,7.0015,113.16,0,0
13/5/11 5:00,2,0,1,2,20.5,88,12.998,25,2011-05-13 05:00:00,5,13,5,2011,4,0,10,1804.0,5,0,25.996,102.5,0,0
7/12/11 18:00,4,0,1,3,16.51580414,95,19.539362,39,2011-12-07 18:00:00,18,7,12,2011,2,0,54,1569.0013933,18,0,58.618086000000005,297.28447452,0,1
9/10/11 5:00,4,0,0,1,18.04,88,0.0,15,2011-10-09 05:00:00,5,9,10,2011,6,1,5,1587.52,0,5,0.0,90.19999999999999,0,0
18/8/11 11:00,3,0,1,1,31.65882822,59,16.10006975,122,2011-08-18 11:00:00,11,18,8,2011,3,0,11,1867.87086498,11,0,16.10006975,348.24711042,0,0
16/2/12 4:00,1,0,1,3,12.3,70,6.0032,3,2012-02-16 04:00:00,4,16,2,2012,3,0,12,861.0,4,0,18.0096,49.2,0,0
7/11/12 11:00,4,0,1,2,13.12,51,23.9994,147,2012-11-07 11:00:00,11,7,11,2012,2,0,22,669.12,11,0,47.9988,144.32,0,0
9/10/11 2:00,4,0,0,1,18.86,88,0.0,55,2011-10-09 02:00:00,2,9,10,2011,6,1,2,1659.6799999999998,0,2,0.0,37.72,0,0
15/6/11 17:00,2,0,1,1,30.34,28,7.0015,638,2011-06-15 17:00:00,17,15,6,2011,2,0,17,849.52,17,0,7.0015,515.78,0,1
9/10/11 22:00,4,0,0,2,21.32,94,0.0,152,2011-10-09 22:00:00,22,9,10,2011,6,1,44,2004.08,0,22,0.0,469.04,0,0
6/12/11 0:00,4,0,1,2,20.16213525,75,21.52964199,16,2011-12-06 00:00:00,0,6,12,2011,1,0,0,1512.1601437499999,0,0,43.05928398,0.0,0,0
6/5/12 6:00,2,0,0,3,21.32,83,15.0013,17,2012-05-06 06:00:00,6,6,5,2012,6,1,18,1769.56,0,6,45.0039,127.92,0,0
16/11/11 10:00,4,0,1,3,18.86,94,0.0,36,2011-11-16 10:00:00,10,16,11,2011,2,0,30,1772.84,10,0,0.0,188.6,0,0
8/10/12 11:00,4,1,0,2,15.6429545,61,5.049115437,324,2012-10-08 11:00:00,11,8,10,2012,0,0,22,954.2202245,0,0,10.098230874,172.0724995,0,0
3/5/12 13:00,2,0,1,1,24.6,69,12.998,265,2012-05-03 13:00:00,13,3,5,2012,3,0,13,1697.4,13,0,12.998,319.8,0,0
14/1/11 9:00,1,0,1,1,5.74,69,8.9981,117,2011-01-14 09:00:00,9,14,1,2011,4,0,9,396.06,9,0,8.9981,51.660000000000004,1,0
16/11/12 17:00,4,0,1,1,14.76,46,12.998,580,2012-11-16 17:00:00,17,16,11,2012,4,0,17,678.96,17,0,12.998,250.92,0,1
5/9/12 11:00,3,0,1,2,31.98,62,11.0014,217,2012-09-05 11:00:00,11,5,9,2012,2,0,22,1982.76,11,0,22.0028,351.78000000000003,0,0
6/5/12 3:00,2,0,0,2,22.14,83,12.998,28,2012-05-06 03:00:00,3,6,5,2012,6,1,6,1837.6200000000001,0,3,25.996,66.42,0,0
17/10/11 3:00,4,0,1,1,22.96,49,12.998,2,2011-10-17 03:00:00,3,17,10,2011,0,0,3,1125.04,3,0,12.998,68.88,0,0
14/11/11 16:00,4,0,1,1,25.1953798,46,26.01751512,334,2011-11-14 16:00:00,16,14,11,2011,0,0,16,1158.9874708,16,0,26.01751512,403.1260768,0,0
16/12/12 0:00,4,0,0,2,14.76,62,0.0,110,2012-12-16 00:00:00,0,16,12,2012,6,1,0,915.12,0,0,0.0,0.0,0,0
1/12/11 13:00,4,0,1,1,16.4,40,15.0013,154,2011-12-01 13:00:00,13,1,12,2011,3,0,13,656.0,13,0,15.0013,213.2,0,0
9/10/12 1:00,4,0,1,3,14.76,87,15.0013,13,2012-10-09 01:00:00,1,9,10,2012,1,0,3,1284.12,1,0,45.0039,14.76,0,0
16/10/12 23:00,4,0,1,1,16.4,71,0.0,199,2012-10-16 23:00:00,23,16,10,2012,1,0,23,1164.3999999999999,23,0,0.0,377.2,0,0
10/9/12 9:00,3,0,1,1,24.6,53,19.9995,361,2012-09-10 09:00:00,9,10,9,2012,0,0,9,1303.8000000000002,9,0,19.9995,221.4,1,0
16/9/12 17:00,3,0,0,1,27.06,41,0.0,570,2012-09-16 17:00:00,17,16,9,2012,6,1,17,1109.46,0,17,0.0,460.02,0,1
16/3/12 4:00,1,0,1,2,16.4,87,16.9979,3,2012-03-16 04:00:00,4,16,3,2012,4,0,8,1426.8,4,0,33.9958,65.6,0,0
12/8/12 5:00,3,0,0,1,26.24,61,12.998,10,2012-08-12 05:00:00,5,12,8,2012,6,1,5,1600.6399999999999,0,5,12.998,131.2,0,0
13/12/12 16:00,4,0,1,1,13.94,39,7.0015,406,2012-12-13 16:00:00,16,13,12,2012,3,0,16,543.66,16,0,7.0015,223.04,0,0
2/10/11 5:00,4,0,0,1,13.12,87,19.0012,7,2011-10-02 05:00:00,5,2,10,2011,6,1,5,1141.4399999999998,0,5,19.0012,65.6,0,0
15/12/12 14:00,4,0,0,1,16.14118791,46,12.23254644,456,2012-12-15 14:00:00,14,15,12,2012,5,1,14,742.49464386,0,14,12.23254644,225.97663074,0,0
19/1/11 14:00,1,0,1,1,16.4,58,16.9979,75,2011-01-19 14:00:00,14,19,1,2011,2,0,14,951.1999999999999,14,0,16.9979,229.59999999999997,0,0
2/5/12 7:00,2,0,1,2,22.14,88,12.998,358,2012-05-02 07:00:00,7,2,5,2012,2,0,14,1948.3200000000002,7,0,25.996,154.98000000000002,1,0
17/2/12 8:00,1,0,1,2,10.66,100,0.0,520,2012-02-17 08:00:00,8,17,2,2012,4,0,16,1066.0,8,0,0.0,85.28,1,0
2/5/11 0:00,2,0,1,1,18.86,72,8.9981,177,2011-05-02 00:00:00,0,2,5,2011,0,0,0,1357.92,0,0,8.9981,0.0,0,0
9/6/11 20:00,2,0,1,2,32.8,43,12.998,254,2011-06-09 20:00:00,20,9,6,2011,3,0,40,1410.3999999999999,20,0,25.996,656.0,0,0
19/9/11 9:00,3,0,1,2,21.9289308,68,11.56209744,227,2011-09-19 09:00:00,9,19,9,2011,0,0,18,1491.1672944,9,0,23.12419488,197.3603772,1,0
19/7/11 14:00,3,0,1,1,35.26,50,12.998,152,2011-07-19 14:00:00,14,19,7,2011,1,0,14,1763.0,14,0,12.998,493.64,0,0
11/12/12 17:00,4,0,1,1,13.05414557,50,15.13054751,596,2012-12-11 17:00:00,17,11,12,2012,1,0,17,652.7072784999999,17,0,15.13054751,221.92047469,0,1
7/2/12 5:00,1,0,1,1,11.73822813,49,5.641676474,5,2012-02-07 05:00:00,5,7,2,2012,1,0,5,575.17317837,5,0,5.641676474,58.691140649999994,0,0
19/3/11 6:00,1,0,0,1,18.04,44,27.9993,10,2011-03-19 06:00:00,6,19,3,2011,5,1,6,793.76,0,6,27.9993,108.24,0,0
5/8/12 21:00,3,0,0,1,28.61546502,77,7.613204198,194,2012-08-05 21:00:00,21,5,8,2012,6,1,21,2203.39080654,0,21,7.613204198,600.92476542,0,0
12/2/11 13:00,1,0,0,1,12.3,39,27.9993,135,2011-02-12 13:00:00,13,12,2,2011,5,1,13,479.70000000000005,0,13,27.9993,159.9,0,0
18/4/12 11:00,2,0,1,3,18.86,47,16.9979,119,2012-04-18 11:00:00,11,18,4,2012,2,0,33,886.42,11,0,50.993700000000004,207.45999999999998,0,0
15/7/11 10:00,3,0,1,2,27.06,61,11.0014,166,2011-07-15 10:00:00,10,15,7,2011,4,0,20,1650.6599999999999,10,0,22.0028,270.59999999999997,0,0
15/4/12 10:00,2,0,0,1,23.78,53,15.0013,421,2012-04-15 10:00:00,10,15,4,2012,6,1,10,1260.3400000000001,0,10,15.0013,237.8,0,0
5/12/12 1:00,4,0,1,1,21.32,55,22.0028,11,2012-12-05 01:00:00,1,5,12,2012,2,0,1,1172.6,1,0,22.0028,21.32,0,0
6/6/12 23:00,2,0,1,1,21.32,77,0.0,123,2012-06-06 23:00:00,23,6,6,2012,2,0,23,1641.64,23,0,0.0,490.36,0,0
13/8/12 8:00,3,0,1,2,29.52,51,6.0032,673,2012-08-13 08:00:00,8,13,8,2012,0,0,16,1505.52,8,0,12.0064,236.16,1,0
7/1/12 10:00,1,0,0,1,11.48,75,6.0032,203,2012-01-07 10:00:00,10,7,1,2012,5,1,10,861.0,0,10,6.0032,114.80000000000001,0,0
3/5/11 21:00,2,0,1,2,26.24,61,30.0026,225,2011-05-03 21:00:00,21,3,5,2011,1,0,42,1600.6399999999999,21,0,60.0052,551.04,0,0
8/8/11 13:00,3,0,1,1,34.44,44,19.9995,151,2011-08-08 13:00:00,13,8,8,2011,0,0,13,1515.36,13,0,19.9995,447.71999999999997,0,0
8/7/11 21:00,3,0,1,2,24.92546815,85,16.84591403,217,2011-07-08 21:00:00,21,8,7,2011,4,0,42,2118.66479275,21,0,33.69182806,523.43483115,0,0
12/6/11 8:00,2,0,0,1,29.84817756,74,0.486105819,112,2011-06-12 08:00:00,8,12,6,2011,6,1,8,2208.76513944,0,8,0.486105819,238.78542048,1,0
6/7/11 7:00,3,0,1,2,29.52,79,0.0,312,2011-07-06 07:00:00,7,6,7,2011,2,0,14,2332.08,7,0,0.0,206.64,1,0
3/4/12 16:00,2,0,1,1,25.42,21,11.0014,485,2012-04-03 16:00:00,16,3,4,2012,1,0,16,533.82,16,0,11.0014,406.72,0,0
12/1/12 15:00,1,0,1,1,18.04,72,8.9981,188,2012-01-12 15:00:00,15,12,1,2012,3,0,15,1298.8799999999999,15,0,8.9981,270.59999999999997,0,0
3/10/12 12:00,4,0,1,2,28.7,70,7.0015,358,2012-10-03 12:00:00,12,3,10,2012,2,0,24,2009.0,12,0,14.003,344.4,0,0
2/3/11 13:00,1,0,1,1,20.5,25,0.0,125,2011-03-02 13:00:00,13,2,3,2011,2,0,13,512.5,13,0,0.0,266.5,0,0
11/3/12 11:00,1,0,0,1,14.76,43,19.0012,299,2012-03-11 11:00:00,11,11,3,2012,6,1,11,634.68,0,11,19.0012,162.35999999999999,0,0
4/1/11 6:00,1,0,1,1,4.92,74,7.0015,36,2011-01-04 06:00:00,6,4,1,2011,1,0,6,364.08,6,0,7.0015,29.52,0,0
16/6/11 8:00,2,0,1,2,24.6,69,8.9981,388,2011-06-16 08:00:00,8,16,6,2011,3,0,16,1697.4,8,0,17.9962,196.8,1,0
14/10/12 21:00,4,0,0,1,22.96,73,30.0026,196,2012-10-14 21:00:00,21,14,10,2012,6,1,21,1676.0800000000002,0,21,30.0026,482.16,0,0
2/1/11 7:00,1,0,0,2,16.4,76,12.998,1,2011-01-02 07:00:00,7,2,1,2011,6,1,14,1246.3999999999999,0,7,25.996,114.79999999999998,1,0
8/11/11 3:00,4,0,1,1,13.12,87,0.0,3,2011-11-08 03:00:00,3,8,11,2011,1,0,3,1141.4399999999998,3,0,0.0,39.36,0,0
6/8/11 6:00,3,0,0,1,26.24,89,7.0015,27,2011-08-06 06:00:00,6,6,8,2011,5,1,6,2335.3599999999997,0,6,7.0015,157.44,0,0
1/2/12 17:00,1,0,1,1,23.91294406,40,12.69576597,510,2012-02-01 17:00:00,17,1,2,2012,2,0,17,956.5177624,17,0,12.69576597,406.52004902,0,1
3/11/11 15:00,4,0,1,1,21.32,52,11.0014,162,2011-11-03 15:00:00,15,3,11,2011,3,0,15,1108.64,15,0,11.0014,319.8,0,0
7/3/11 13:00,1,0,1,1,13.12,36,26.0027,70,2011-03-07 13:00:00,13,7,3,2011,0,0,13,472.32,13,0,26.0027,170.56,0,0
19/1/12 7:00,1,0,1,1,4.92,54,6.0032,206,2012-01-19 07:00:00,7,19,1,2012,3,0,7,265.68,7,0,6.0032,34.44,1,0
5/2/11 18:00,1,0,0,2,11.48,93,30.0026,83,2011-02-05 18:00:00,18,5,2,2011,5,1,36,1067.64,0,18,60.0052,206.64000000000001,0,1
13/9/12 23:00,3,0,1,1,23.78,73,7.0015,170,2012-09-13 23:00:00,23,13,9,2012,3,0,23,1735.94,23,0,7.0015,546.94,0,0
18/11/11 19:00,4,0,1,1,11.48,41,11.0014,190,2011-11-18 19:00:00,19,18,11,2011,4,0,19,470.68,19,0,11.0014,218.12,0,1
11/10/11 13:00,4,0,1,2,24.6,73,12.998,180,2011-10-11 13:00:00,13,11,10,2011,1,0,26,1795.8000000000002,13,0,25.996,319.8,0,0
9/8/12 13:00,3,0,1,1,35.26,41,7.0015,281,2012-08-09 13:00:00,13,9,8,2012,3,0,13,1445.6599999999999,13,0,7.0015,458.38,0,0
6/8/12 3:00,3,0,1,3,28.9791557,80,6.192818598,1,2012-08-06 03:00:00,3,6,8,2012,0,0,9,2318.332456,3,0,18.578455794,86.93746709999999,0,0
1/4/11 23:00,2,0,1,1,12.3,61,6.0032,53,2011-04-01 23:00:00,23,1,4,2011,4,0,23,750.3000000000001,23,0,6.0032,282.90000000000003,0,0
12/8/12 6:00,3,0,0,1,26.24,65,11.0014,16,2012-08-12 06:00:00,6,12,8,2012,6,1,6,1705.6,0,6,11.0014,157.44,0,0
14/7/11 10:00,3,0,1,1,29.31937861,39,17.26677269,123,2011-07-14 10:00:00,10,14,7,2011,3,0,10,1143.45576579,10,0,17.26677269,293.1937861,0,0
5/3/11 6:00,1,0,0,2,12.3,100,15.0013,4,2011-03-05 06:00:00,6,5,3,2011,5,1,12,1230.0,0,6,30.0026,73.80000000000001,0,0
17/10/11 9:00,4,0,1,2,20.5,45,19.0012,206,2011-10-17 09:00:00,9,17,10,2011,0,0,18,922.5,9,0,38.0024,184.5,1,0
19/9/11 21:00,3,0,1,2,22.96,68,11.0014,200,2011-09-19 21:00:00,21,19,9,2011,0,0,42,1561.28,21,0,22.0028,482.16,0,0
2/5/12 19:00,2,0,1,1,22.14,77,16.9979,504,2012-05-02 19:00:00,19,2,5,2012,2,0,19,1704.78,19,0,16.9979,420.66,0,1
19/10/12 14:00,4,0,1,1,26.85324229,58,18.31209144,374,2012-10-19 14:00:00,14,19,10,2012,4,0,14,1557.4880528200001,14,0,18.31209144,375.94539206,0,0
1/8/12 4:00,3,0,1,2,26.24,78,8.9981,4,2012-08-01 04:00:00,4,1,8,2012,2,0,8,2046.7199999999998,4,0,17.9962,104.96,0,0
16/8/11 4:00,3,0,1,1,25.76892156,68,19.1856828,1,2011-08-16 04:00:00,4,16,8,2011,1,0,4,1752.28666608,4,0,19.1856828,103.07568624,0,0
8/8/12 1:00,3,0,1,1,29.52,79,0.0,23,2012-08-08 01:00:00,1,8,8,2012,2,0,1,2332.08,1,0,0.0,29.52,0,0
5/10/11 11:00,4,0,1,1,24.6,46,19.0012,170,2011-10-05 11:00:00,11,5,10,2011,2,0,11,1131.6000000000001,11,0,19.0012,270.6,0,0
18/3/11 8:00,1,0,1,1,17.22,67,16.9979,280,2011-03-18 08:00:00,8,18,3,2011,4,0,8,1153.74,8,0,16.9979,137.76,1,0
8/8/11 12:00,3,0,1,1,33.62,46,16.9979,182,2011-08-08 12:00:00,12,8,8,2011,0,0,12,1546.52,12,0,16.9979,403.43999999999994,0,0
17/12/11 10:00,4,0,0,2,10.66,52,19.0012,181,2011-12-17 10:00:00,10,17,12,2011,5,1,20,554.32,0,10,38.0024,106.6,0,0
6/11/12 5:00,4,0,1,2,9.02,64,12.998,41,2012-11-06 05:00:00,5,6,11,2012,1,0,10,577.28,5,0,25.996,45.099999999999994,0,0
15/1/12 22:00,1,0,0,1,7.38,37,6.0032,60,2012-01-15 22:00:00,22,15,1,2012,6,1,22,273.06,0,22,6.0032,162.35999999999999,0,0
18/8/11 13:00,3,0,1,1,32.8,52,23.9994,187,2011-08-18 13:00:00,13,18,8,2011,3,0,13,1705.6,13,0,23.9994,426.4,0,0
1/2/12 13:00,1,0,1,1,18.86,47,15.0013,186,2012-02-01 13:00:00,13,1,2,2012,2,0,13,886.42,13,0,15.0013,245.18,0,0
19/11/11 7:00,4,0,0,1,9.792457783,59,16.431475,56,2011-11-19 07:00:00,7,19,11,2011,5,1,7,577.7550091969999,0,7,16.431475,68.547204481,1,0
14/6/12 17:00,2,0,1,1,29.52,48,15.0013,867,2012-06-14 17:00:00,17,14,6,2012,3,0,17,1416.96,17,0,15.0013,501.84,0,1
8/5/11 8:00,2,0,0,1,21.32,63,8.9981,86,2011-05-08 08:00:00,8,8,5,2011,6,1,8,1343.16,0,8,8.9981,170.56,1,0
6/11/12 20:00,4,0,1,1,12.3,61,15.0013,228,2012-11-06 20:00:00,20,6,11,2012,1,0,20,750.3000000000001,20,0,15.0013,246.0,0,0
11/3/12 15:00,1,0,0,1,20.5,29,19.9995,487,2012-03-11 15:00:00,15,11,3,2012,6,1,15,594.5,0,15,19.9995,307.5,0,0
14/11/11 10:00,4,0,1,2,20.17410243,64,18.31710844,91,2011-11-14 10:00:00,10,14,11,2011,0,0,20,1291.14255552,10,0,36.63421688,201.74102430000002,0,0
3/2/12 8:00,1,0,1,1,9.84,65,15.0013,441,2012-02-03 08:00:00,8,3,2,2012,4,0,8,639.6,8,0,15.0013,78.72,1,0
17/5/12 19:00,2,0,1,1,26.24,31,12.998,537,2012-05-17 19:00:00,19,17,5,2012,3,0,19,813.4399999999999,19,0,12.998,498.55999999999995,0,1
8/6/12 3:00,2,0,1,1,22.14,60,6.0032,8,2012-06-08 03:00:00,3,8,6,2012,4,0,3,1328.4,3,0,6.0032,66.42,0,0
4/9/12 21:00,3,0,1,1,30.34,74,16.9979,268,2012-09-04 21:00:00,21,4,9,2012,1,0,21,2245.16,21,0,16.9979,637.14,0,0
6/10/12 1:00,4,0,0,1,22.96,83,16.9979,141,2012-10-06 01:00:00,1,6,10,2012,5,1,1,1905.68,0,1,16.9979,22.96,0,0
2/6/12 3:00,2,0,0,1,22.96,73,16.9979,26,2012-06-02 03:00:00,3,2,6,2012,5,1,3,1676.0800000000002,0,3,16.9979,68.88,0,0
12/5/11 20:00,2,0,1,1,24.78905846,59,11.09207395,244,2011-05-12 20:00:00,20,12,5,2011,3,0,20,1462.55444914,20,0,11.09207395,495.7811692,0,0
9/11/12 6:00,4,0,1,1,10.66,65,7.0015,131,2012-11-09 06:00:00,6,9,11,2012,4,0,6,692.9,6,0,7.0015,63.96,0,0
17/8/11 16:00,3,0,1,1,33.62,43,15.0013,300,2011-08-17 16:00:00,16,17,8,2011,2,0,16,1445.6599999999999,16,0,15.0013,537.92,0,0
6/7/11 2:00,3,0,1,1,28.7,79,6.0032,5,2011-07-06 02:00:00,2,6,7,2011,2,0,2,2267.2999999999997,2,0,6.0032,57.4,0,0
14/9/12 9:00,3,0,1,2,25.42,78,11.0014,347,2012-09-14 09:00:00,9,14,9,2012,4,0,18,1982.7600000000002,9,0,22.0028,228.78000000000003,1,0
12/2/11 0:00,1,0,0,1,6.56,69,6.0032,30,2011-02-12 00:00:00,0,12,2,2011,5,1,0,452.64,0,0,6.0032,0.0,0,0
12/7/12 14:00,3,0,1,1,31.98,33,15.0013,209,2012-07-12 14:00:00,14,12,7,2012,3,0,14,1055.34,14,0,15.0013,447.72,0,0
8/9/11 3:00,3,0,1,3,25.42,94,0.0,2,2011-09-08 03:00:00,3,8,9,2011,3,0,9,2389.48,3,0,0.0,76.26,0,0
14/10/12 5:00,4,0,0,1,16.4,82,12.998,11,2012-10-14 05:00:00,5,14,10,2012,6,1,5,1344.8,0,5,12.998,82.0,0,0
2/10/12 9:00,4,0,1,3,23.78,88,8.9981,86,2012-10-02 09:00:00,9,2,10,2012,1,0,27,2092.6400000000003,9,0,26.994300000000003,214.02,1,0
10/8/11 13:00,3,0,1,1,33.62,38,19.0012,191,2011-08-10 13:00:00,13,10,8,2011,2,0,13,1277.56,13,0,19.0012,437.05999999999995,0,0
8/3/11 23:00,1,0,1,1,11.48,61,12.998,41,2011-03-08 23:00:00,23,8,3,2011,1,0,23,700.28,23,0,12.998,264.04,0,0
18/10/11 3:00,4,0,1,1,18.04,94,6.0032,1,2011-10-18 03:00:00,3,18,10,2011,1,0,3,1695.76,3,0,6.0032,54.12,0,0
15/2/11 11:00,1,0,1,1,10.66,25,16.9979,57,2011-02-15 11:00:00,11,15,2,2011,1,0,11,266.5,11,0,16.9979,117.26,0,0
8/9/12 2:00,3,0,0,1,27.06,89,22.0028,77,2012-09-08 02:00:00,2,8,9,2012,5,1,2,2408.3399999999997,0,2,22.0028,54.12,0,0
10/7/12 3:00,3,0,1,1,27.88,79,0.0,3,2012-07-10 03:00:00,3,10,7,2012,1,0,3,2202.52,3,0,0.0,83.64,0,0
6/10/11 22:00,4,0,1,1,18.86,82,0.0,148,2011-10-06 22:00:00,22,6,10,2011,3,0,22,1546.52,22,0,0.0,414.91999999999996,0,0
12/3/11 11:00,1,0,0,1,13.94,49,22.0028,119,2011-03-12 11:00:00,11,12,3,2011,5,1,11,683.06,0,11,22.0028,153.34,0,0
1/9/12 7:00,3,0,0,2,30.34,58,8.9981,66,2012-09-01 07:00:00,7,1,9,2012,5,1,14,1759.72,0,7,17.9962,212.38,1,0
16/5/11 17:00,2,0,1,1,23.78,88,15.0013,274,2011-05-16 17:00:00,17,16,5,2011,0,0,17,2092.6400000000003,17,0,15.0013,404.26,0,1
19/1/12 12:00,1,0,1,1,8.2,51,12.998,111,2012-01-19 12:00:00,12,19,1,2012,3,0,12,418.2,12,0,12.998,98.39999999999999,0,0
18/5/11 2:00,2,0,1,3,21.32,94,15.0013,6,2011-05-18 02:00:00,2,18,5,2011,2,0,6,2004.08,2,0,45.0039,42.64,0,0
1/2/12 2:00,1,0,1,1,18.04,44,19.0012,7,2012-02-01 02:00:00,2,1,2,2012,2,0,2,793.76,2,0,19.0012,36.08,0,0
9/1/11 0:00,1,0,0,1,4.1,42,26.0027,25,2011-01-09 00:00:00,0,9,1,2011,6,1,0,172.2,0,0,26.0027,0.0,0,0
15/10/12 2:00,4,0,1,2,24.13086875,65,22.75072704,11,2012-10-15 02:00:00,2,15,10,2012,0,0,4,1568.50646875,2,0,45.50145408,48.2617375,0,0
14/7/12 7:00,3,0,0,1,26.42633531,78,18.86450595,22,2012-07-14 07:00:00,7,14,7,2012,5,1,7,2061.25415418,0,7,18.86450595,184.98434716999998,1,0
14/11/12 5:00,4,0,1,1,9.02,69,12.998,39,2012-11-14 05:00:00,5,14,11,2012,2,0,5,622.38,5,0,12.998,45.099999999999994,0,0
8/3/11 12:00,1,0,1,2,13.81690696,22,0.0,104,2011-03-08 12:00:00,12,8,3,2011,1,0,24,303.97195312,12,0,0.0,165.80288352000002,0,0
8/7/12 21:00,3,0,0,1,32.79311626,68,8.349844368,242,2012-07-08 21:00:00,21,8,7,2012,6,1,21,2229.93190568,0,21,8.349844368,688.6554414599999,0,0
10/3/12 19:00,1,0,0,1,13.31414827,24,0.503861294,174,2012-03-10 19:00:00,19,10,3,2012,5,1,19,319.53955848,0,19,0.503861294,252.96881713000002,0,1
13/12/12 7:00,4,0,1,1,9.84,60,15.0013,385,2012-12-13 07:00:00,7,13,12,2012,3,0,7,590.4,7,0,15.0013,68.88,1,0
6/1/11 21:00,1,0,1,2,9.02,55,15.0013,48,2011-01-06 21:00:00,21,6,1,2011,3,0,42,496.09999999999997,21,0,30.0026,189.42,0,0
12/10/11 19:00,4,0,1,3,22.14,94,8.9981,109,2011-10-12 19:00:00,19,12,10,2011,2,0,57,2081.16,19,0,26.994300000000003,420.66,0,1
8/10/11 15:00,4,0,0,1,27.06,39,0.0,496,2011-10-08 15:00:00,15,8,10,2011,5,1,15,1055.34,0,15,0.0,405.9,0,0
19/4/11 13:00,2,0,1,2,22.14,68,15.0013,129,2011-04-19 13:00:00,13,19,4,2011,1,0,26,1505.52,13,0,30.0026,287.82,0,0
1/5/11 13:00,2,0,0,2,20.5,63,11.0014,332,2011-05-01 13:00:00,13,1,5,2011,6,1,26,1291.5,0,13,22.0028,266.5,0,0
4/1/12 20:00,1,0,1,2,8.2,40,12.998,123,2012-01-04 20:00:00,20,4,1,2012,2,0,40,328.0,20,0,25.996,164.0,0,0
11/1/11 8:00,1,0,1,2,7.38,51,6.0032,217,2011-01-11 08:00:00,8,11,1,2011,1,0,16,376.38,8,0,12.0064,59.04,1,0
3/3/11 13:00,1,0,1,1,9.02,25,6.0032,80,2011-03-03 13:00:00,13,3,3,2011,3,0,13,225.5,13,0,6.0032,117.25999999999999,0,0
4/12/11 12:00,4,0,0,1,14.76,81,11.0014,329,2011-12-04 12:00:00,12,4,12,2011,6,1,12,1195.56,0,12,11.0014,177.12,0,0
19/4/11 2:00,2,0,1,1,18.86,67,19.0012,13,2011-04-19 02:00:00,2,19,4,2011,1,0,2,1263.62,2,0,19.0012,37.72,0,0
1/10/11 2:00,4,0,0,1,19.84000977,62,27.02812603,66,2011-10-01 02:00:00,2,1,10,2011,5,1,2,1230.08060574,0,2,27.02812603,39.68001954,0,0
8/12/12 18:00,4,0,0,1,16.4,87,7.0015,304,2012-12-08 18:00:00,18,8,12,2012,5,1,18,1426.8,0,18,7.0015,295.2,0,1
17/6/12 21:00,2,0,0,1,25.42,57,12.998,246,2012-06-17 21:00:00,21,17,6,2012,6,1,21,1448.94,0,21,12.998,533.82,0,0
14/9/12 12:00,3,0,1,2,28.7,54,12.998,409,2012-09-14 12:00:00,12,14,9,2012,4,0,24,1549.8,12,0,25.996,344.4,0,0
19/10/11 23:00,4,0,1,2,23.78,94,23.9994,69,2011-10-19 23:00:00,23,19,10,2011,2,0,46,2235.32,23,0,47.9988,546.94,0,0
10/3/12 15:00,1,0,0,1,13.94,25,0.0,406,2012-03-10 15:00:00,15,10,3,2012,5,1,15,348.5,0,15,0.0,209.1,0,0
15/9/11 0:00,3,0,1,1,26.11912663,66,9.088721176,60,2011-09-15 00:00:00,0,15,9,2011,3,0,0,1723.86235758,0,0,9.088721176,0.0,0,0
17/12/12 21:00,4,0,1,2,17.22,94,8.9981,120,2012-12-17 21:00:00,21,17,12,2012,0,0,42,1618.6799999999998,21,0,17.9962,361.62,0,0
11/5/12 14:00,2,0,1,1,25.42,23,15.0013,334,2012-05-11 14:00:00,14,11,5,2012,4,0,14,584.6600000000001,14,0,15.0013,355.88,0,0
6/2/11 1:00,1,0,0,1,10.66,65,27.9993,44,2011-02-06 01:00:00,1,6,2,2011,6,1,1,692.9,0,1,27.9993,10.66,0,0
6/1/12 7:00,1,0,1,2,9.84,65,0.0,205,2012-01-06 07:00:00,7,6,1,2012,4,0,14,639.6,7,0,0.0,68.88,1,0
2/9/11 11:00,3,0,1,2,27.06,74,7.0015,192,2011-09-02 11:00:00,11,2,9,2011,4,0,22,2002.4399999999998,11,0,14.003,297.65999999999997,0,0
15/9/11 13:00,3,0,1,2,26.24,65,19.0012,189,2011-09-15 13:00:00,13,15,9,2011,3,0,26,1705.6,13,0,38.0024,341.12,0,0
12/6/11 9:00,2,0,0,1,29.52,66,0.0,182,2011-06-12 09:00:00,9,12,6,2011,6,1,9,1948.32,0,9,0.0,265.68,1,0
12/10/11 9:00,4,0,1,2,22.14,88,30.0026,197,2011-10-12 09:00:00,9,12,10,2011,2,0,18,1948.3200000000002,9,0,60.0052,199.26,1,0
17/4/11 5:00,2,0,0,1,14.76,71,11.0014,3,2011-04-17 05:00:00,5,17,4,2011,6,1,5,1047.96,0,5,11.0014,73.8,0,0
10/7/11 3:00,3,0,0,1,27.06,74,6.0032,25,2011-07-10 03:00:00,3,10,7,2011,6,1,3,2002.4399999999998,0,3,6.0032,81.17999999999999,0,0
3/8/11 10:00,3,0,1,3,30.34,58,6.0032,68,2011-08-03 10:00:00,10,3,8,2011,2,0,30,1759.72,10,0,18.0096,303.4,0,0
3/4/11 21:00,2,0,0,2,17.22,44,15.0013,45,2011-04-03 21:00:00,21,3,4,2011,6,1,42,757.68,0,21,30.0026,361.62,0,0
19/9/11 9:00,3,0,1,2,22.14,68,11.0014,215,2011-09-19 09:00:00,9,19,9,2011,0,0,18,1505.52,9,0,22.0028,199.26,1,0
9/9/11 17:00,3,0,1,1,28.7,79,16.9979,505,2011-09-09 17:00:00,17,9,9,2011,4,0,17,2267.2999999999997,17,0,16.9979,487.9,0,1
5/9/12 0:00,3,0,1,1,29.52,74,16.9979,37,2012-09-05 00:00:00,0,5,9,2012,2,0,0,2184.48,0,0,16.9979,0.0,0,0
13/2/11 15:00,1,0,0,2,16.4,30,19.9995,162,2011-02-13 15:00:00,15,13,2,2011,6,1,30,491.99999999999994,0,15,39.999,245.99999999999997,0,0
1/1/12 19:00,1,0,0,3,17.22,67,26.0027,105,2012-01-01 19:00:00,19,1,1,2012,6,1,57,1153.74,0,19,78.0081,327.17999999999995,0,1
1/4/11 16:00,2,0,1,1,13.94,46,27.9993,167,2011-04-01 16:00:00,16,1,4,2011,4,0,16,641.24,16,0,27.9993,223.04,0,0
13/9/12 0:00,3,0,1,1,22.96,73,6.0032,57,2012-09-13 00:00:00,0,13,9,2012,3,0,0,1676.0800000000002,0,0,6.0032,0.0,0,0
16/2/11 4:00,1,0,1,1,8.2,51,12.998,1,2011-02-16 04:00:00,4,16,2,2011,2,0,4,418.2,4,0,12.998,32.8,0,0
6/10/12 6:00,4,0,0,1,22.14,88,16.9979,30,2012-10-06 06:00:00,6,6,10,2012,5,1,6,1948.3200000000002,0,6,16.9979,132.84,0,0
13/10/11 11:00,4,0,1,2,25.42,83,0.0,84,2011-10-13 11:00:00,11,13,10,2011,3,0,22,2109.86,11,0,0.0,279.62,0,0
18/3/12 6:00,1,0,0,2,16.4,94,7.0015,11,2012-03-18 06:00:00,6,18,3,2012,6,1,12,1541.6,0,6,14.003,98.39999999999999,0,0
4/2/11 11:00,1,0,1,1,9.02,51,11.0014,64,2011-02-04 11:00:00,11,4,2,2011,4,0,11,460.02,11,0,11.0014,99.22,0,0
11/3/11 13:00,1,0,1,1,14.76,53,16.9979,107,2011-03-11 13:00:00,13,11,3,2011,4,0,13,782.28,13,0,16.9979,191.88,0,0
5/1/11 1:00,1,0,1,1,8.263135392,74,5.439761272,3,2011-01-05 01:00:00,1,5,1,2011,2,0,1,611.4720190080001,1,0,5.439761272,8.263135392,0,0
19/3/11 16:00,1,0,0,1,20.5,31,26.0027,304,2011-03-19 16:00:00,16,19,3,2011,5,1,16,635.5,0,16,26.0027,328.0,0,0
10/7/12 20:00,3,0,1,3,26.24,83,15.0013,84,2012-07-10 20:00:00,20,10,7,2012,1,0,60,2177.92,20,0,45.0039,524.8,0,0
14/7/12 6:00,3,0,0,2,26.24,78,6.0032,35,2012-07-14 06:00:00,6,14,7,2012,5,1,12,2046.7199999999998,0,6,12.0064,157.44,0,0
9/8/12 4:00,3,0,1,2,28.81001863,89,8.235801003,7,2012-08-09 04:00:00,4,9,8,2012,3,0,8,2564.09165807,4,0,16.471602006,115.24007452,0,0
6/11/11 1:00,4,0,0,1,10.66,81,0.0,115,2011-11-06 01:00:00,1,6,11,2011,6,1,1,863.46,0,1,0.0,10.66,0,0
16/11/12 6:00,4,0,1,2,11.59282167,60,8.230347565,130,2012-11-16 06:00:00,6,16,11,2012,4,0,12,695.5693001999999,6,0,16.46069513,69.55693002,0,0
14/9/12 6:00,3,0,1,1,22.14,88,0.0,152,2012-09-14 06:00:00,6,14,9,2012,4,0,6,1948.3200000000002,6,0,0.0,132.84,0,0
2/6/11 5:00,2,0,1,1,27.06,39,15.0013,31,2011-06-02 05:00:00,5,2,6,2011,3,0,5,1055.34,5,0,15.0013,135.29999999999998,0,0
1/3/11 4:00,1,0,1,1,9.02,69,16.9979,1,2011-03-01 04:00:00,4,1,3,2011,1,0,4,622.38,4,0,16.9979,36.08,0,0
12/10/12 11:00,4,0,1,1,22.14,37,23.9994,313,2012-10-12 11:00:00,11,12,10,2012,4,0,11,819.1800000000001,11,0,23.9994,243.54000000000002,0,0
9/5/12 0:00,2,0,1,2,23.78,83,12.998,35,2012-05-09 00:00:00,0,9,5,2012,2,0,0,1973.74,0,0,25.996,0.0,0,0
4/9/12 9:00,3,0,1,2,29.52,79,15.0013,323,2012-09-04 09:00:00,9,4,9,2012,1,0,18,2332.08,9,0,30.0026,265.68,1,0
18/11/12 5:00,4,0,0,1,11.48,81,8.9981,12,2012-11-18 05:00:00,5,18,11,2012,6,1,5,929.88,0,5,8.9981,57.400000000000006,0,0
10/6/11 0:00,2,0,1,3,28.7,65,15.0013,69,2011-06-10 00:00:00,0,10,6,2011,4,0,0,1865.5,0,0,45.0039,0.0,0,0
2/10/12 13:00,4,0,1,2,24.6,88,8.9981,154,2012-10-02 13:00:00,13,2,10,2012,1,0,26,2164.8,13,0,17.9962,319.8,0,0
1/6/11 15:00,2,0,1,1,36.9,39,19.9995,152,2011-06-01 15:00:00,15,1,6,2011,2,0,15,1439.1,15,0,19.9995,553.5,0,0
12/3/11 8:00,1,0,0,1,10.66,65,11.0014,53,2011-03-12 08:00:00,8,12,3,2011,5,1,8,692.9,0,8,11.0014,85.28,1,0
4/5/11 13:00,2,0,1,2,18.86,59,30.0026,143,2011-05-04 13:00:00,13,4,5,2011,2,0,26,1112.74,13,0,60.0052,245.18,0,0
18/7/11 20:00,3,0,1,1,32.23734838,59,15.689394,344,2011-07-18 20:00:00,20,18,7,2011,0,0,20,1902.00355442,20,0,15.689394,644.7469676000001,0,0
17/12/12 18:00,4,0,1,2,16.4,94,6.0032,507,2012-12-17 18:00:00,18,17,12,2012,0,0,36,1541.6,18,0,12.0064,295.2,0,1
8/12/11 0:00,4,0,1,2,10.66,87,19.9995,21,2011-12-08 00:00:00,0,8,12,2011,3,0,0,927.42,0,0,39.999,0.0,0,0
17/2/11 9:00,1,0,1,1,14.76,57,12.998,179,2011-02-17 09:00:00,9,17,2,2011,3,0,9,841.3199999999999,9,0,12.998,132.84,1,0
9/2/11 3:00,1,0,1,1,2.857231385,43,10.1927996,11,2011-02-09 03:00:00,3,9,2,2011,2,0,3,122.860949555,3,0,10.1927996,8.571694155,0,0
15/6/12 17:00,2,0,1,1,30.34,37,19.0012,823,2012-06-15 17:00:00,17,15,6,2012,4,0,17,1122.58,17,0,19.0012,515.78,0,1
17/10/11 6:00,4,0,1,1,20.5,55,16.9979,114,2011-10-17 06:00:00,6,17,10,2011,0,0,6,1127.5,6,0,16.9979,123.0,0,0
9/8/12 6:00,3,0,1,1,27.06,83,11.0014,167,2012-08-09 06:00:00,6,9,8,2012,3,0,6,2245.98,6,0,11.0014,162.35999999999999,0,0
17/4/12 1:00,2,0,1,1,26.24,57,11.0014,11,2012-04-17 01:00:00,1,17,4,2012,1,0,1,1495.6799999999998,1,0,11.0014,26.24,0,0
13/4/11 22:00,2,0,1,1,17.22,67,12.998,99,2011-04-13 22:00:00,22,13,4,2011,2,0,22,1153.74,22,0,12.998,378.84,0,0
5/10/11 6:00,4,0,1,1,18.04,82,7.0015,117,2011-10-05 06:00:00,6,5,10,2011,2,0,6,1479.28,6,0,7.0015,108.24,0,0
4/1/12 5:00,1,0,1,1,0.82,40,12.17750691,47,2012-01-04 05:00:00,5,4,1,2012,2,0,5,32.8,5,0,12.17750691,4.1,0,0
8/1/12 8:00,1,0,0,1,12.3,52,8.9981,57,2012-01-08 08:00:00,8,8,1,2012,6,1,8,639.6,0,8,8.9981,98.4,1,0
7/3/11 1:00,1,0,1,3,8.2,100,22.0028,2,2011-03-07 01:00:00,1,7,3,2011,0,0,3,819.9999999999999,1,0,66.0084,8.2,0,0
9/7/12 22:00,3,0,1,2,29.52,58,7.0015,224,2012-07-09 22:00:00,22,9,7,2012,0,0,44,1712.16,22,0,14.003,649.4399999999999,0,0
12/11/11 7:00,4,0,0,1,9.02,75,12.998,27,2011-11-12 07:00:00,7,12,11,2011,5,1,7,676.5,0,7,12.998,63.14,1,0
9/9/11 18:00,3,0,1,1,28.7,79,12.998,410,2011-09-09 18:00:00,18,9,9,2011,4,0,18,2267.2999999999997,18,0,12.998,516.6,0,1
6/1/11 4:00,1,0,1,2,6.56,64,6.0032,1,2011-01-06 04:00:00,4,6,1,2011,3,0,8,419.84,4,0,12.0064,26.24,0,0
9/5/11 21:00,2,0,1,1,21.20983042,56,9.426790552,160,2011-05-09 21:00:00,21,9,5,2011,0,0,21,1187.75050352,21,0,9.426790552,445.40643882,0,0
7/3/11 11:00,1,0,1,1,9.432342045,49,29.84713761,74,2011-03-07 11:00:00,11,7,3,2011,0,0,11,462.18476020500003,11,0,29.84713761,103.755762495,0,0
5/4/12 19:00,2,0,1,1,20.58824388,31,16.94506843,494,2012-04-05 19:00:00,19,5,4,2012,3,0,19,638.23556028,19,0,16.94506843,391.17663372,0,1
3/4/11 12:00,2,0,0,1,18.04,38,19.0012,313,2011-04-03 12:00:00,12,3,4,2011,6,1,12,685.52,0,12,19.0012,216.48,0,0
18/1/12 10:00,1,0,1,1,10.81199107,46,30.66667084,81,2012-01-18 10:00:00,10,18,1,2012,2,0,10,497.35158922,10,0,30.66667084,108.11991069999999,0,0
7/10/11 11:00,4,0,1,1,22.96,63,0.0,230,2011-10-07 11:00:00,11,7,10,2011,4,0,11,1446.48,11,0,0.0,252.56,0,0
4/3/12 4:00,1,0,0,2,13.94,46,12.998,14,2012-03-04 04:00:00,4,4,3,2012,6,1,8,641.24,0,4,25.996,55.76,0,0
2/12/12 19:00,4,0,0,2,16.4,82,12.998,174,2012-12-02 19:00:00,19,2,12,2012,6,1,38,1344.8,0,19,25.996,311.59999999999997,0,1
16/9/12 10:00,3,0,0,1,25.42,50,7.0015,490,2012-09-16 10:00:00,10,16,9,2012,6,1,10,1271.0,0,10,7.0015,254.20000000000002,0,0
7/5/11 20:00,2,0,0,1,22.02688832,44,8.96230452,221,2011-05-07 20:00:00,20,7,5,2011,5,1,20,969.1830860800001,0,20,8.96230452,440.5377664,0,0
13/9/12 9:00,3,0,1,1,24.21803901,65,5.907189545,336,2012-09-13 09:00:00,9,13,9,2012,3,0,9,1574.1725356499999,9,0,5.907189545,217.96235108999997,1,0
15/7/11 6:00,3,0,1,2,24.6,73,7.0015,120,2011-07-15 06:00:00,6,15,7,2011,4,0,12,1795.8000000000002,6,0,14.003,147.60000000000002,0,0
12/11/12 12:00,4,1,0,1,22.96,64,15.0013,419,2012-11-12 12:00:00,12,12,11,2012,0,0,12,1469.44,0,0,15.0013,275.52,0,0
11/1/12 10:00,1,0,1,2,9.84,87,8.9981,97,2012-01-11 10:00:00,10,11,1,2012,2,0,20,856.08,10,0,17.9962,98.4,0,0
10/11/11 14:00,4,0,1,3,14.76,87,19.0012,64,2011-11-10 14:00:00,14,10,11,2011,3,0,42,1284.12,14,0,57.003600000000006,206.64,0,0
8/1/11 19:00,1,0,0,1,5.74,36,16.9979,30,2011-01-08 19:00:00,19,8,1,2011,5,1,19,206.64000000000001,0,19,16.9979,109.06,0,1
14/10/11 8:00,4,0,1,2,22.96,90,11.0014,209,2011-10-14 08:00:00,8,14,10,2011,4,0,16,2066.4,8,0,22.0028,183.68,1,0
13/1/11 20:00,1,0,1,1,6.56,47,15.0013,64,2011-01-13 20:00:00,20,13,1,2011,3,0,20,308.32,20,0,15.0013,131.2,0,0
2/8/12 22:00,3,0,1,1,30.81759748,71,11.8581496,295,2012-08-02 22:00:00,22,2,8,2012,3,0,22,2188.04942108,22,0,11.8581496,677.98714456,0,0
1/12/11 21:00,4,0,1,1,12.3,61,7.0015,162,2011-12-01 21:00:00,21,1,12,2011,3,0,21,750.3000000000001,21,0,7.0015,258.3,0,0
9/6/12 4:00,2,0,0,1,25.42,57,0.0,8,2012-06-09 04:00:00,4,9,6,2012,5,1,4,1448.94,0,4,0.0,101.68,0,0
6/8/12 7:00,3,0,1,3,29.52,70,12.998,407,2012-08-06 07:00:00,7,6,8,2012,0,0,21,2066.4,7,0,38.994,206.64,1,0
2/12/12 13:00,4,0,0,1,16.4,71,15.0013,431,2012-12-02 13:00:00,13,2,12,2012,6,1,13,1164.3999999999999,0,13,15.0013,213.2,0,0
2/10/11 11:00,4,0,0,2,15.58,66,16.9979,292,2011-10-02 11:00:00,11,2,10,2011,6,1,22,1028.28,0,11,33.9958,171.38,0,0
17/8/11 15:00,3,0,1,1,32.8,43,8.9981,159,2011-08-17 15:00:00,15,17,8,2011,2,0,15,1410.3999999999999,15,0,8.9981,491.99999999999994,0,0
15/3/12 5:00,1,0,1,1,18.86,67,0.0,26,2012-03-15 05:00:00,5,15,3,2012,3,0,5,1263.62,5,0,0.0,94.3,0,0
11/7/11 6:00,3,0,1,1,27.88,74,12.998,121,2011-07-11 06:00:00,6,11,7,2011,0,0,6,2063.12,6,0,12.998,167.28,0,0
1/1/11 8:00,1,0,0,1,9.84,75,0.0,8,2011-01-01 08:00:00,8,1,1,2011,5,1,8,738.0,0,8,0.0,78.72,1,0
7/12/11 9:00,4,0,1,3,17.96185217,100,16.83494651,62,2011-12-07 09:00:00,9,7,12,2011,2,0,27,1796.185217,9,0,50.504839530000005,161.65666953,1,0
1/10/12 14:00,4,0,1,2,24.6,43,7.0015,244,2012-10-01 14:00:00,14,1,10,2012,0,0,28,1057.8,14,0,14.003,344.40000000000003,0,0
4/5/12 12:00,2,0,1,3,25.42,78,23.9994,171,2012-05-04 12:00:00,12,4,5,2012,4,0,36,1982.7600000000002,12,0,71.9982,305.04,0,0
8/10/11 22:00,4,0,0,1,20.5,77,0.0,149,2011-10-08 22:00:00,22,8,10,2011,5,1,22,1578.5,0,22,0.0,451.0,0,0
16/5/11 20:00,2,0,1,1,23.78,83,0.0,198,2011-05-16 20:00:00,20,16,5,2011,0,0,20,1973.74,20,0,0.0,475.6,0,0
16/11/12 4:00,4,0,1,2,13.47224993,64,6.346120853,19,2012-11-16 04:00:00,4,16,11,2012,4,0,8,862.22399552,4,0,12.692241706,53.88899972,0,0
15/2/11 23:00,1,0,1,2,9.02,44,6.0032,20,2011-02-15 23:00:00,23,15,2,2011,1,0,46,396.88,23,0,12.0064,207.45999999999998,0,0
15/1/12 19:00,1,0,0,1,6.56,37,11.0014,110,2012-01-15 19:00:00,19,15,1,2012,6,1,19,242.72,0,19,11.0014,124.63999999999999,0,1
14/3/12 7:00,1,0,1,1,18.09263646,83,6.811647401,365,2012-03-14 07:00:00,7,14,3,2012,2,0,7,1501.6888261800002,7,0,6.811647401,126.64845522000002,1,0
4/10/11 3:00,4,0,1,1,16.59319057,82,7.684672585,1,2011-10-04 03:00:00,3,4,10,2011,1,0,3,1360.64162674,3,0,7.684672585,49.77957171,0,0
7/4/11 3:00,2,0,1,1,14.76,66,12.998,3,2011-04-07 03:00:00,3,7,4,2011,3,0,3,974.16,3,0,12.998,44.28,0,0
6/1/11 17:00,1,0,1,1,9.02,51,11.0014,172,2011-01-06 17:00:00,17,6,1,2011,3,0,17,460.02,17,0,11.0014,153.34,0,1
19/7/11 1:00,3,0,1,2,30.34,66,8.9981,13,2011-07-19 01:00:00,1,19,7,2011,1,0,2,2002.44,1,0,17.9962,30.34,0,0
4/5/12 6:00,2,0,1,1,22.14,94,7.0015,135,2012-05-04 06:00:00,6,4,5,2012,4,0,6,2081.16,6,0,7.0015,132.84,0,0
14/3/12 21:00,1,0,1,1,24.6,40,6.0032,288,2012-03-14 21:00:00,21,14,3,2012,2,0,21,984.0,21,0,6.0032,516.6,0,0
16/12/11 2:00,4,0,1,1,19.68,77,7.0015,23,2011-12-16 02:00:00,2,16,12,2011,4,0,2,1515.36,2,0,7.0015,39.36,0,0
19/3/11 11:00,1,0,0,1,18.86,36,30.0026,196,2011-03-19 11:00:00,11,19,3,2011,5,1,11,678.96,0,11,30.0026,207.45999999999998,0,0
15/7/11 13:00,3,0,1,1,28.7,54,12.998,247,2011-07-15 13:00:00,13,15,7,2011,4,0,13,1549.8,13,0,12.998,373.09999999999997,0,0
13/7/12 21:00,3,0,1,1,29.52,54,0.0,299,2012-07-13 21:00:00,21,13,7,2012,4,0,21,1594.08,21,0,0.0,619.92,0,0
7/7/11 1:00,3,0,1,1,27.06,89,12.998,16,2011-07-07 01:00:00,1,7,7,2011,3,0,1,2408.3399999999997,1,0,12.998,27.06,0,0
14/5/12 20:00,2,0,1,2,23.78,88,12.998,189,2012-05-14 20:00:00,20,14,5,2012,0,0,40,2092.6400000000003,20,0,25.996,475.6,0,0
6/4/11 0:00,2,0,1,1,12.3,49,7.0015,15,2011-04-06 00:00:00,0,6,4,2011,2,0,0,602.7,0,0,7.0015,0.0,0,0
13/3/12 8:00,1,0,1,1,18.86,82,19.0012,593,2012-03-13 08:00:00,8,13,3,2012,1,0,8,1546.52,8,0,19.0012,150.88,1,0
19/7/12 6:00,3,0,1,1,29.52,66,8.9981,152,2012-07-19 06:00:00,6,19,7,2012,3,0,6,1948.32,6,0,8.9981,177.12,0,0
2/10/11 18:00,4,0,0,2,15.26221348,81,12.37968763,193,2011-10-02 18:00:00,18,2,10,2011,6,1,36,1236.2392918799999,0,18,24.75937526,274.71984264,0,1
4/7/11 16:00,3,1,0,1,33.62,41,0.0,452,2011-07-04 16:00:00,16,4,7,2011,0,0,16,1378.4199999999998,0,0,0.0,537.92,0,0
5/11/11 18:00,4,0,0,1,14.76,50,6.0032,237,2011-11-05 18:00:00,18,5,11,2011,5,1,18,738.0,0,18,6.0032,265.68,0,1
3/12/12 6:00,4,0,1,1,14.76,93,0.0,138,2012-12-03 06:00:00,6,3,12,2012,0,0,6,1372.68,6,0,0.0,88.56,0,0
11/8/12 15:00,3,0,0,1,32.8,46,19.0012,562,2012-08-11 15:00:00,15,11,8,2012,5,1,15,1508.8,0,15,19.0012,491.99999999999994,0,0
11/4/12 11:00,2,0,1,2,15.58,43,22.0028,180,2012-04-11 11:00:00,11,11,4,2012,2,0,22,669.94,11,0,44.0056,171.38,0,0
11/6/12 11:00,2,0,1,2,31.16,48,15.0013,202,2012-06-11 11:00:00,11,11,6,2012,0,0,22,1495.68,11,0,30.0026,342.76,0,0
14/3/12 8:00,1,0,1,1,18.04,82,0.0,662,2012-03-14 08:00:00,8,14,3,2012,2,0,8,1479.28,8,0,0.0,144.32,1,0
11/8/12 20:00,3,0,0,3,27.06,89,27.9993,160,2012-08-11 20:00:00,20,11,8,2012,5,1,60,2408.3399999999997,0,20,83.9979,541.1999999999999,0,0
10/6/11 20:00,2,0,1,1,31.16,62,7.0015,250,2011-06-10 20:00:00,20,10,6,2011,4,0,20,1931.92,20,0,7.0015,623.2,0,0
18/9/12 15:00,3,0,1,3,24.6,88,16.9979,36,2012-09-18 15:00:00,15,18,9,2012,1,0,45,2164.8,15,0,50.993700000000004,369.0,0,0
7/10/12 12:00,4,0,0,2,17.22,71,0.0,392,2012-10-07 12:00:00,12,7,10,2012,6,1,24,1222.62,0,12,0.0,206.64,0,0
10/4/11 13:00,2,0,0,1,18.86,82,7.0015,263,2011-04-10 13:00:00,13,10,4,2011,6,1,13,1546.52,0,13,7.0015,245.18,0,0
14/8/11 20:00,3,0,0,1,28.7,84,11.0014,193,2011-08-14 20:00:00,20,14,8,2011,6,1,20,2410.7999999999997,0,20,11.0014,574.0,0,0
17/9/11 4:00,3,0,0,1,18.29480468,72,10.7536545,3,2011-09-17 04:00:00,4,17,9,2011,5,1,4,1317.22593696,0,4,10.7536545,73.17921872,0,0
11/7/11 8:00,3,0,1,1,30.34,66,19.0012,420,2011-07-11 08:00:00,8,11,7,2011,0,0,8,2002.44,8,0,19.0012,242.72,1,0
9/6/11 14:00,2,0,1,1,37.72,40,12.998,118,2011-06-09 14:00:00,14,9,6,2011,3,0,14,1508.8,14,0,12.998,528.0799999999999,0,0
9/12/11 18:00,4,0,1,1,13.94,61,0.0,318,2011-12-09 18:00:00,18,9,12,2011,4,0,18,850.3399999999999,18,0,0.0,250.92,0,1
8/4/11 15:00,2,0,1,3,13.94,87,15.0013,25,2011-04-08 15:00:00,15,8,4,2011,4,0,45,1212.78,15,0,45.0039,209.1,0,0
19/6/11 6:00,2,0,0,2,26.96893175,79,10.75490183,18,2011-06-19 06:00:00,6,19,6,2011,6,1,12,2130.54560825,0,6,21.50980366,161.8135905,0,0
14/10/12 14:00,4,0,0,1,27.06,39,27.9993,617,2012-10-14 14:00:00,14,14,10,2012,6,1,14,1055.34,0,14,27.9993,378.84,0,0
7/6/11 0:00,2,0,1,1,26.24,65,6.0032,20,2011-06-07 00:00:00,0,7,6,2011,1,0,0,1705.6,0,0,6.0032,0.0,0,0
8/7/12 17:00,3,0,0,1,31.98,59,0.0,270,2012-07-08 17:00:00,17,8,7,2012,6,1,17,1886.82,0,17,0.0,543.66,0,1
10/1/11 22:00,1,0,1,1,5.74,59,11.0014,24,2011-01-10 22:00:00,22,10,1,2011,0,0,22,338.66,22,0,11.0014,126.28,0,0
13/4/11 7:00,2,0,1,3,14.76,100,15.0013,70,2011-04-13 07:00:00,7,13,4,2011,2,0,21,1476.0,7,0,45.0039,103.32,1,0
10/2/11 19:00,1,0,1,1,5.74,28,7.0015,112,2011-02-10 19:00:00,19,10,2,2011,3,0,19,160.72,19,0,7.0015,109.06,0,1
19/10/11 13:00,4,0,1,2,22.14,94,19.0012,106,2011-10-19 13:00:00,13,19,10,2011,2,0,26,2081.16,13,0,38.0024,287.82,0,0
5/4/11 4:00,2,0,1,3,20.5,88,32.9975,2,2011-04-05 04:00:00,4,5,4,2011,1,0,12,1804.0,4,0,98.9925,82.0,0,0
3/9/12 6:00,3,1,0,1,27.06,94,0.0,15,2012-09-03 06:00:00,6,3,9,2012,0,0,6,2543.64,0,0,0.0,162.35999999999999,0,0
16/6/12 21:00,2,0,0,2,26.24,50,15.0013,290,2012-06-16 21:00:00,21,16,6,2012,5,1,42,1312.0,0,21,30.0026,551.04,0,0
5/11/12 17:00,4,0,1,1,16.12882188,47,16.50995114,626,2012-11-05 17:00:00,17,5,11,2012,0,0,17,758.05462836,17,0,16.50995114,274.18997196,0,1
5/12/12 4:00,4,0,1,1,20.5,63,30.0026,10,2012-12-05 04:00:00,4,5,12,2012,2,0,4,1291.5,4,0,30.0026,82.0,0,0
9/11/11 18:00,4,0,1,1,18.04,67,7.0015,408,2011-11-09 18:00:00,18,9,11,2011,2,0,18,1208.6799999999998,18,0,7.0015,324.71999999999997,0,1
3/7/12 21:00,3,0,1,2,28.7,70,19.0012,196,2012-07-03 21:00:00,21,3,7,2012,1,0,42,2009.0,21,0,38.0024,602.6999999999999,0,0
16/10/12 11:00,4,0,1,1,20.5,45,27.9993,228,2012-10-16 11:00:00,11,16,10,2012,1,0,11,922.5,11,0,27.9993,225.5,0,0
15/9/12 22:00,3,0,0,1,22.96,52,0.0,279,2012-09-15 22:00:00,22,15,9,2012,5,1,22,1193.92,0,22,0.0,505.12,0,0
10/1/11 19:00,1,0,1,1,6.56,47,11.0014,95,2011-01-10 19:00:00,19,10,1,2011,0,0,19,308.32,19,0,11.0014,124.63999999999999,0,1
6/3/11 8:00,1,0,0,2,16.4,100,19.9995,9,2011-03-06 08:00:00,8,6,3,2011,6,1,16,1639.9999999999998,0,8,39.999,131.2,1,0
12/5/12 18:00,2,0,0,2,27.06,31,12.998,546,2012-05-12 18:00:00,18,12,5,2012,5,1,36,838.86,0,18,25.996,487.08,0,1
2/10/12 16:00,4,0,1,3,25.42,88,8.9981,374,2012-10-02 16:00:00,16,2,10,2012,1,0,48,2236.96,16,0,26.994300000000003,406.72,0,0
6/12/12 10:00,4,0,1,1,9.84,52,12.998,145,2012-12-06 10:00:00,10,6,12,2012,3,0,10,511.68,10,0,12.998,98.4,0,0
7/2/12 12:00,1,0,1,1,16.4,40,22.0028,172,2012-02-07 12:00:00,12,7,2,2012,1,0,12,656.0,12,0,22.0028,196.79999999999998,0,0
18/11/12 21:00,4,0,0,1,14.76,66,16.9979,110,2012-11-18 21:00:00,21,18,11,2012,6,1,21,974.16,0,21,16.9979,309.96,0,0
13/12/12 22:00,4,0,1,1,11.18499296,58,4.219781998,152,2012-12-13 22:00:00,22,13,12,2012,3,0,22,648.72959168,22,0,4.219781998,246.06984512000002,0,0
5/5/12 1:00,2,0,0,1,24.6,83,0.0,107,2012-05-05 01:00:00,1,5,5,2012,5,1,1,2041.8000000000002,0,1,0.0,24.6,0,0
6/11/11 5:00,4,0,0,1,9.84,87,8.9981,5,2011-11-06 05:00:00,5,6,11,2011,6,1,5,856.08,0,5,8.9981,49.2,0,0
6/10/12 17:00,4,0,0,1,22.14,49,26.0027,610,2012-10-06 17:00:00,17,6,10,2012,5,1,17,1084.8600000000001,0,17,26.0027,376.38,0,1
10/10/12 16:00,4,0,1,1,24.6,40,15.0013,566,2012-10-10 16:00:00,16,10,10,2012,2,0,16,984.0,16,0,15.0013,393.6,0,0
14/9/12 0:00,3,0,1,1,22.51066019,71,4.046376135,89,2012-09-14 00:00:00,0,14,9,2012,4,0,0,1598.2568734899999,0,0,4.046376135,0.0,0,0
16/3/11 5:00,1,0,1,2,12.3,93,7.0015,3,2011-03-16 05:00:00,5,16,3,2011,2,0,10,1143.9,5,0,14.003,61.5,0,0
7/8/11 3:00,3,0,0,2,28.7,84,8.9981,32,2011-08-07 03:00:00,3,7,8,2011,6,1,6,2410.7999999999997,0,3,17.9962,86.1,0,0
14/7/11 19:00,3,0,1,1,29.52,39,15.0013,400,2011-07-14 19:00:00,19,14,7,2011,3,0,19,1151.28,19,0,15.0013,560.88,0,1
10/11/12 0:00,4,0,0,1,11.82542351,76,6.529587932,96,2012-11-10 00:00:00,0,10,11,2012,5,1,0,898.73218676,0,0,6.529587932,0.0,0,0
8/5/12 2:00,2,0,1,2,21.32,63,19.9995,16,2012-05-08 02:00:00,2,8,5,2012,1,0,4,1343.16,2,0,39.999,42.64,0,0
17/11/11 17:00,4,0,1,1,13.12,42,26.0027,399,2011-11-17 17:00:00,17,17,11,2011,3,0,17,551.04,17,0,26.0027,223.04,0,1
15/9/11 11:00,3,0,1,2,27.88,65,8.9981,159,2011-09-15 11:00:00,11,15,9,2011,3,0,22,1812.2,11,0,17.9962,306.68,0,0
19/11/11 15:00,4,0,0,1,17.22,41,12.998,382,2011-11-19 15:00:00,15,19,11,2011,5,1,15,706.02,0,15,12.998,258.29999999999995,0,0
1/12/12 5:00,4,0,0,1,9.84,87,6.0032,13,2012-12-01 05:00:00,5,1,12,2012,5,1,5,856.08,0,5,6.0032,49.2,0,0
16/10/12 18:00,4,0,1,1,20.5,42,11.0014,838,2012-10-16 18:00:00,18,16,10,2012,1,0,18,861.0,18,0,11.0014,369.0,0,1
2/6/11 21:00,2,0,1,1,27.06,31,12.998,248,2011-06-02 21:00:00,21,2,6,2011,3,0,21,838.86,21,0,12.998,568.26,0,0
10/1/12 12:00,1,0,1,1,17.22,38,19.9995,140,2012-01-10 12:00:00,12,10,1,2012,1,0,12,654.3599999999999,12,0,19.9995,206.64,0,0
3/7/12 20:00,3,0,1,3,31.16,55,32.9975,376,2012-07-03 20:00:00,20,3,7,2012,1,0,60,1713.8,20,0,98.9925,623.2,0,0
14/1/12 22:00,1,0,0,1,6.56,47,23.9994,66,2012-01-14 22:00:00,22,14,1,2012,5,1,22,308.32,0,22,23.9994,144.32,0,0
18/9/12 7:00,3,0,1,2,26.24,89,30.0026,356,2012-09-18 07:00:00,7,18,9,2012,1,0,14,2335.3599999999997,7,0,60.0052,183.67999999999998,1,0
2/7/12 10:00,3,0,1,1,32.8,43,16.9979,174,2012-07-02 10:00:00,10,2,7,2012,0,0,10,1410.3999999999999,10,0,16.9979,328.0,0,0
18/4/11 11:00,2,0,1,2,22.01005519,53,5.862680612,117,2011-04-18 11:00:00,11,18,4,2011,0,0,22,1166.53292507,11,0,11.725361224,242.11060709,0,0
19/5/12 10:00,2,0,0,1,22.96,43,0.0,452,2012-05-19 10:00:00,10,19,5,2012,5,1,10,987.2800000000001,0,10,0.0,229.60000000000002,0,0
10/11/12 21:00,4,0,0,1,16.65479268,66,0.0,210,2012-11-10 21:00:00,21,10,11,2012,5,1,21,1099.21631688,0,21,0.0,349.75064628,0,0
18/10/11 17:00,4,0,1,1,24.21570177,57,9.106975854,635,2011-10-18 17:00:00,17,18,10,2011,1,0,17,1380.29500089,17,0,9.106975854,411.66693009,0,1
9/4/12 4:00,2,0,1,1,18.04,24,12.998,5,2012-04-09 04:00:00,4,9,4,2012,0,0,4,432.96,4,0,12.998,72.16,0,0
3/9/12 3:00,3,1,0,1,27.06,89,8.9981,28,2012-09-03 03:00:00,3,3,9,2012,0,0,3,2408.3399999999997,0,0,8.9981,81.17999999999999,0,0
6/1/12 23:00,1,0,1,1,14.76,50,0.0,101,2012-01-06 23:00:00,23,6,1,2012,4,0,23,738.0,23,0,0.0,339.48,0,0
13/7/12 19:00,3,0,1,1,30.34,51,11.0014,488,2012-07-13 19:00:00,19,13,7,2012,4,0,19,1547.34,19,0,11.0014,576.46,0,1
11/9/12 4:00,3,0,1,1,19.68,72,7.0015,9,2012-09-11 04:00:00,4,11,9,2012,1,0,4,1416.96,4,0,7.0015,78.72,0,0
1/2/11 22:00,1,0,1,2,9.02,87,6.0032,36,2011-02-01 22:00:00,22,1,2,2011,1,0,44,784.74,22,0,12.0064,198.44,0,0
1/12/11 1:00,4,0,1,1,10.66,60,19.0012,10,2011-12-01 01:00:00,1,1,12,2011,3,0,1,639.6,1,0,19.0012,10.66,0,0
8/8/11 0:00,3,0,1,1,29.02850654,80,6.816228332,17,2011-08-08 00:00:00,0,8,8,2011,0,0,0,2322.2805232,0,0,6.816228332,0.0,0,0
12/4/11 5:00,2,0,1,2,21.15639804,68,9.57976623,31,2011-04-12 05:00:00,5,12,4,2011,1,0,10,1438.63506672,5,0,19.15953246,105.7819902,0,0
13/8/11 12:00,3,0,0,2,27.06,89,11.0014,421,2011-08-13 12:00:00,12,13,8,2011,5,1,24,2408.3399999999997,0,12,22.0028,324.71999999999997,0,0
2/1/12 8:00,1,1,0,1,9.84,35,16.9979,53,2012-01-02 08:00:00,8,2,1,2012,0,0,8,344.4,0,0,16.9979,78.72,1,0
2/12/11 10:00,4,0,1,1,12.3,75,15.0013,105,2011-12-02 10:00:00,10,2,12,2011,4,0,10,922.5,10,0,15.0013,123.0,0,0
18/8/12 20:00,3,0,0,1,28.7,45,7.0015,341,2012-08-18 20:00:00,20,18,8,2012,5,1,20,1291.5,0,20,7.0015,574.0,0,0
16/11/12 12:00,4,0,1,1,16.4,43,19.0012,290,2012-11-16 12:00:00,12,16,11,2012,4,0,12,705.1999999999999,12,0,19.0012,196.79999999999998,0,0
10/9/12 15:00,3,0,1,1,27.06,31,26.0027,346,2012-09-10 15:00:00,15,10,9,2012,0,0,15,838.86,15,0,26.0027,405.9,0,0
14/5/11 4:00,2,0,0,2,20.5,82,11.0014,5,2011-05-14 04:00:00,4,14,5,2011,5,1,8,1681.0,0,4,22.0028,82.0,0,0
15/7/12 15:00,3,0,0,1,35.26,47,8.9981,489,2012-07-15 15:00:00,15,15,7,2012,6,1,15,1657.2199999999998,0,15,8.9981,528.9,0,0
7/4/11 2:00,2,0,1,1,17.22,54,0.0,7,2011-04-07 02:00:00,2,7,4,2011,3,0,2,929.8799999999999,2,0,0.0,34.44,0,0
4/2/11 21:00,1,0,1,2,9.84,70,11.0014,43,2011-02-04 21:00:00,21,4,2,2011,4,0,42,688.8,21,0,22.0028,206.64,0,0
11/8/12 17:00,3,0,0,3,30.34,66,23.9994,512,2012-08-11 17:00:00,17,11,8,2012,5,1,51,2002.44,0,17,71.9982,515.78,0,1
1/5/12 22:00,2,0,1,1,26.24,65,0.0,211,2012-05-01 22:00:00,22,1,5,2012,1,0,22,1705.6,22,0,0.0,577.28,0,0
11/3/11 22:00,1,0,1,1,12.3,52,11.0014,64,2011-03-11 22:00:00,22,11,3,2011,4,0,22,639.6,22,0,11.0014,270.6,0,0
11/1/12 14:00,1,0,1,3,13.12,81,7.0015,73,2012-01-11 14:00:00,14,11,1,2012,2,0,42,1062.72,14,0,21.0045,183.67999999999998,0,0
5/1/11 1:00,1,0,1,1,5.415696393,72,8.190296644,1,2011-01-05 01:00:00,1,5,1,2011,2,0,1,389.930140296,1,0,8.190296644,5.415696393,0,0
6/9/12 11:00,3,0,1,3,28.7,84,11.0014,62,2012-09-06 11:00:00,11,6,9,2012,3,0,33,2410.7999999999997,11,0,33.0042,315.7,0,0
12/3/11 16:00,1,0,0,1,18.86,41,30.0026,244,2011-03-12 16:00:00,16,12,3,2011,5,1,16,773.26,0,16,30.0026,301.76,0,0
19/8/12 13:00,3,0,0,3,26.24,83,8.9981,162,2012-08-19 13:00:00,13,19,8,2012,6,1,39,2177.92,0,13,26.994300000000003,341.12,0,0
13/4/12 1:00,2,0,1,1,14.85884954,45,14.35667381,1,2012-04-13 01:00:00,1,13,4,2012,4,0,1,668.6482293,1,0,14.35667381,14.85884954,0,0
5/12/12 16:00,4,0,1,1,18.86,33,19.0012,377,2012-12-05 16:00:00,16,5,12,2012,2,0,16,622.38,16,0,19.0012,301.76,0,0
19/9/12 0:00,3,0,1,2,22.96,68,19.0012,26,2012-09-19 00:00:00,0,19,9,2012,2,0,0,1561.28,0,0,38.0024,0.0,0,0
12/3/11 15:00,1,0,0,1,17.22,44,32.9975,182,2011-03-12 15:00:00,15,12,3,2011,5,1,15,757.68,0,15,32.9975,258.29999999999995,0,0
17/6/12 9:00,2,0,0,1,22.96,68,11.0014,274,2012-06-17 09:00:00,9,17,6,2012,6,1,9,1561.28,0,9,11.0014,206.64000000000001,1,0
4/12/11 5:00,4,0,0,1,10.66,81,0.0,4,2011-12-04 05:00:00,5,4,12,2011,6,1,5,863.46,0,5,0.0,53.3,0,0
4/7/12 22:00,3,1,0,1,33.62,56,15.0013,502,2012-07-04 22:00:00,22,4,7,2012,2,0,22,1882.7199999999998,0,0,15.0013,739.64,0,0
9/11/12 7:00,4,0,1,1,10.66,65,8.9981,341,2012-11-09 07:00:00,7,9,11,2012,4,0,7,692.9,7,0,8.9981,74.62,1,0
3/6/11 11:00,2,0,1,1,25.54670123,32,21.61456605,193,2011-06-03 11:00:00,11,3,6,2011,4,0,11,817.49443936,11,0,21.61456605,281.01371353,0,0
14/11/11 8:00,4,0,1,2,18.72258289,65,11.89611666,439,2011-11-14 08:00:00,8,14,11,2011,0,0,16,1216.9678878500001,8,0,23.79223332,149.78066312,1,0
7/2/12 3:00,1,0,1,2,12.3,70,0.0,2,2012-02-07 03:00:00,3,7,2,2012,1,0,6,861.0,3,0,0.0,36.900000000000006,0,0
6/12/11 15:00,4,0,1,3,20.5,100,12.998,45,2011-12-06 15:00:00,15,6,12,2011,1,0,45,2050.0,15,0,38.994,307.5,0,0
1/8/11 22:00,3,0,1,1,28.7,70,6.0032,137,2011-08-01 22:00:00,22,1,8,2011,0,0,22,2009.0,22,0,6.0032,631.4,0,0
13/10/11 12:00,4,0,1,2,25.42,88,0.0,105,2011-10-13 12:00:00,12,13,10,2011,3,0,24,2236.96,12,0,0.0,305.04,0,0
10/4/12 13:00,2,0,1,1,21.32,23,11.0014,283,2012-04-10 13:00:00,13,10,4,2012,1,0,13,490.36,13,0,11.0014,277.16,0,0
11/11/11 22:00,4,1,0,1,12.78244288,41,13.08028362,57,2011-11-11 22:00:00,22,11,11,2011,4,0,22,524.0801580799999,0,0,13.08028362,281.21374335999997,0,0
12/7/12 5:00,3,0,1,1,25.42,73,7.0015,44,2012-07-12 05:00:00,5,12,7,2012,3,0,5,1855.66,5,0,7.0015,127.10000000000001,0,0
10/1/12 0:00,1,0,1,2,9.02,87,7.0015,14,2012-01-10 00:00:00,0,10,1,2012,1,0,0,784.74,0,0,14.003,0.0,0,0
10/9/12 18:00,3,0,1,1,25.42,35,19.9995,968,2012-09-10 18:00:00,18,10,9,2012,0,0,18,889.7,18,0,19.9995,457.56000000000006,0,1
5/5/11 18:00,2,0,1,1,22.96,26,19.0012,520,2011-05-05 18:00:00,18,5,5,2011,3,0,18,596.96,18,0,19.0012,413.28000000000003,0,1
12/7/12 8:00,3,0,1,1,27.88,65,8.9981,702,2012-07-12 08:00:00,8,12,7,2012,3,0,8,1812.2,8,0,8.9981,223.04,1,0
16/12/11 0:00,4,0,1,1,20.5,72,22.0028,72,2011-12-16 00:00:00,0,16,12,2011,4,0,0,1476.0,0,0,22.0028,0.0,0,0
12/11/11 0:00,4,0,0,1,9.84,60,8.9981,64,2011-11-12 00:00:00,0,12,11,2011,5,1,0,590.4,0,0,8.9981,0.0,0,0
14/10/11 17:00,4,0,1,1,23.78,46,27.9993,481,2011-10-14 17:00:00,17,14,10,2011,4,0,17,1093.88,17,0,27.9993,404.26,0,1
14/10/11 23:00,4,0,1,1,18.86,59,11.0014,95,2011-10-14 23:00:00,23,14,10,2011,4,0,23,1112.74,23,0,11.0014,433.78,0,0
16/4/11 7:00,2,0,0,2,16.4,82,27.9993,21,2011-04-16 07:00:00,7,16,4,2011,5,1,14,1344.8,0,7,55.9986,114.79999999999998,1,0
10/3/12 10:00,1,0,0,1,10.66,35,27.9993,223,2012-03-10 10:00:00,10,10,3,2012,5,1,10,373.1,0,10,27.9993,106.6,0,0
5/8/12 13:00,3,0,0,1,36.08,44,31.0009,523,2012-08-05 13:00:00,13,5,8,2012,6,1,13,1587.52,0,13,31.0009,469.03999999999996,0,0
17/10/12 3:00,4,0,1,1,14.76,87,0.0,7,2012-10-17 03:00:00,3,17,10,2012,2,0,3,1284.12,3,0,0.0,44.28,0,0
3/11/11 17:00,4,0,1,1,18.97680395,57,6.001826063,495,2011-11-03 17:00:00,17,3,11,2011,3,0,17,1081.67782515,17,0,6.001826063,322.60566715,0,1
9/12/12 4:00,4,0,0,2,16.4,94,7.0015,12,2012-12-09 04:00:00,4,9,12,2012,6,1,8,1541.6,0,4,14.003,65.6,0,0
9/2/12 17:00,1,0,1,1,13.94,34,8.9981,399,2012-02-09 17:00:00,17,9,2,2012,3,0,17,473.96,17,0,8.9981,236.98,0,1
5/1/11 14:00,1,0,1,1,12.3,28,12.998,62,2011-01-05 14:00:00,14,5,1,2011,2,0,14,344.40000000000003,14,0,12.998,172.20000000000002,0,0
11/9/11 5:00,3,0,0,1,24.6,83,8.9981,39,2011-09-11 05:00:00,5,11,9,2011,6,1,5,2041.8000000000002,0,5,8.9981,123.0,0,0
1/12/12 11:00,4,0,0,2,13.68856452,81,8.453167863,424,2012-12-01 11:00:00,11,1,12,2012,5,1,22,1108.77372612,0,11,16.906335726,150.57420972,0,0
5/4/11 17:00,2,0,1,1,17.22,38,27.9993,273,2011-04-05 17:00:00,17,5,4,2011,1,0,17,654.3599999999999,17,0,27.9993,292.74,0,1
6/10/11 7:00,4,0,1,1,17.22,62,12.998,302,2011-10-06 07:00:00,7,6,10,2011,3,0,7,1067.6399999999999,7,0,12.998,120.53999999999999,1,0
7/12/12 5:00,4,0,1,2,10.66,81,7.0015,26,2012-12-07 05:00:00,5,7,12,2012,4,0,10,863.46,5,0,14.003,53.3,0,0
7/1/12 16:00,1,0,0,2,25.18639882,37,18.90855703,404,2012-01-07 16:00:00,16,7,1,2012,5,1,32,931.89675634,0,16,37.81711406,402.98238112,0,0
6/11/11 3:00,4,0,0,1,9.84,87,0.0,9,2011-11-06 03:00:00,3,6,11,2011,6,1,3,856.08,0,3,0.0,29.52,0,0
16/6/11 21:00,2,0,1,3,25.42,83,16.9979,188,2011-06-16 21:00:00,21,16,6,2011,3,0,63,2109.86,21,0,50.993700000000004,533.82,0,0
16/1/11 7:00,1,0,0,2,9.84,56,19.9995,3,2011-01-16 07:00:00,7,16,1,2011,6,1,14,551.04,0,7,39.999,68.88,1,0
17/4/12 6:00,2,0,1,1,24.6,46,16.9979,144,2012-04-17 06:00:00,6,17,4,2012,1,0,6,1131.6000000000001,6,0,16.9979,147.60000000000002,0,0
2/4/11 19:00,2,0,0,1,14.76,53,23.9994,148,2011-04-02 19:00:00,19,2,4,2011,5,1,19,782.28,0,19,23.9994,280.44,0,1
11/8/12 11:00,3,0,0,1,30.34,66,11.0014,499,2012-08-11 11:00:00,11,11,8,2012,5,1,11,2002.44,0,11,11.0014,333.74,0,0
1/11/11 12:00,4,0,1,1,20.5,48,6.0032,176,2011-11-01 12:00:00,12,1,11,2011,1,0,12,984.0,12,0,6.0032,246.0,0,0
11/2/11 15:00,1,0,1,1,13.12,21,11.0014,74,2011-02-11 15:00:00,15,11,2,2011,4,0,15,275.52,15,0,11.0014,196.79999999999998,0,0
12/4/11 13:00,2,0,1,3,22.14,68,19.0012,106,2011-04-12 13:00:00,13,12,4,2011,1,0,39,1505.52,13,0,57.003600000000006,287.82,0,0
3/4/12 9:00,2,0,1,1,17.22,38,6.0032,408,2012-04-03 09:00:00,9,3,4,2012,1,0,9,654.3599999999999,9,0,6.0032,154.98,1,0
5/9/11 23:00,3,1,0,3,22.96,88,26.0027,20,2011-09-05 23:00:00,23,5,9,2011,0,0,69,2020.48,0,0,78.0081,528.08,0,0
7/11/12 8:00,4,0,1,2,10.66,60,19.0012,601,2012-11-07 08:00:00,8,7,11,2012,2,0,16,639.6,8,0,38.0024,85.28,1,0
1/2/11 6:00,1,0,1,3,5.74,93,0.0,22,2011-02-01 06:00:00,6,1,2,2011,1,0,18,533.82,6,0,0.0,34.44,0,0
10/10/12 22:00,4,0,1,1,18.86,55,19.9995,197,2012-10-10 22:00:00,22,10,10,2012,2,0,22,1037.3,22,0,19.9995,414.91999999999996,0,0
19/3/11 17:00,1,0,0,1,19.68,31,22.0028,278,2011-03-19 17:00:00,17,19,3,2011,5,1,17,610.08,0,17,22.0028,334.56,0,1
9/5/12 6:00,2,0,1,2,22.96,88,7.0015,126,2012-05-09 06:00:00,6,9,5,2012,2,0,12,2020.48,6,0,14.003,137.76,0,0
3/2/12 19:00,1,0,1,1,13.94,49,7.0015,267,2012-02-03 19:00:00,19,3,2,2012,4,0,19,683.06,19,0,7.0015,264.86,0,1
4/12/12 10:00,4,0,1,1,18.86,82,12.998,156,2012-12-04 10:00:00,10,4,12,2012,1,0,10,1546.52,10,0,12.998,188.6,0,0
9/7/12 9:00,3,0,1,2,27.06,83,11.0014,363,2012-07-09 09:00:00,9,9,7,2012,0,0,18,2245.98,9,0,22.0028,243.54,1,0
17/11/12 4:00,4,0,0,1,9.84,70,12.998,7,2012-11-17 04:00:00,4,17,11,2012,5,1,4,688.8,0,4,12.998,39.36,0,0
14/2/11 1:00,1,0,1,1,15.06215068,35,24.37566339,12,2011-02-14 01:00:00,1,14,2,2011,0,0,1,527.1752738,1,0,24.37566339,15.06215068,0,0
2/9/12 17:00,3,0,0,1,31.41251703,66,6.496950316,503,2012-09-02 17:00:00,17,2,9,2012,6,1,17,2073.22612398,0,17,6.496950316,534.01278951,0,1
13/2/11 10:00,1,0,0,1,12.3,45,22.0028,105,2011-02-13 10:00:00,10,13,2,2011,6,1,10,553.5,0,10,22.0028,123.0,0,0
4/12/11 21:00,4,0,0,1,14.76,81,7.0015,72,2011-12-04 21:00:00,21,4,12,2011,6,1,21,1195.56,0,21,7.0015,309.96,0,0
15/7/11 9:00,3,0,1,1,27.88,54,12.998,207,2011-07-15 09:00:00,9,15,7,2011,4,0,9,1505.52,9,0,12.998,250.92,1,0
4/2/12 13:00,1,0,0,2,12.3,70,12.998,302,2012-02-04 13:00:00,13,4,2,2012,5,1,26,861.0,0,13,25.996,159.9,0,0
1/4/11 9:00,2,0,1,1,13.12,70,23.9994,173,2011-04-01 09:00:00,9,1,4,2011,4,0,9,918.4,9,0,23.9994,118.08,1,0
18/12/12 1:00,4,0,1,2,18.04,94,8.9981,15,2012-12-18 01:00:00,1,18,12,2012,1,0,2,1695.76,1,0,17.9962,18.04,0,0
13/1/11 8:00,1,0,1,1,5.74,50,12.998,202,2011-01-13 08:00:00,8,13,1,2011,3,0,8,287.0,8,0,12.998,45.92,1,0
6/4/12 18:00,2,0,1,1,20.5,22,31.0009,484,2012-04-06 18:00:00,18,6,4,2012,4,0,18,451.0,18,0,31.0009,369.0,0,1
6/3/11 20:00,1,0,0,3,11.48,100,27.9993,11,2011-03-06 20:00:00,20,6,3,2011,6,1,60,1148.0,0,20,83.9979,229.60000000000002,0,0
18/5/12 18:00,2,0,1,1,26.24,38,15.0013,669,2012-05-18 18:00:00,18,18,5,2012,4,0,18,997.1199999999999,18,0,15.0013,472.32,0,1
4/11/11 19:00,4,0,1,1,16.4,37,23.9994,196,2011-11-04 19:00:00,19,4,11,2011,4,0,19,606.8,19,0,23.9994,311.59999999999997,0,1
2/12/11 5:00,4,0,1,1,8.796875252,80,4.519632512,1,2011-12-02 05:00:00,5,2,12,2011,4,0,5,703.75002016,5,0,4.519632512,43.98437626,0,0
3/11/11 11:00,4,0,1,1,18.04,67,12.998,120,2011-11-03 11:00:00,11,3,11,2011,3,0,11,1208.6799999999998,11,0,12.998,198.44,0,0
15/9/11 3:00,3,0,1,1,25.42,73,6.0032,8,2011-09-15 03:00:00,3,15,9,2011,3,0,3,1855.66,3,0,6.0032,76.26,0,0
4/2/12 17:00,1,0,0,3,12.3,70,12.998,67,2012-02-04 17:00:00,17,4,2,2012,5,1,51,861.0,0,17,38.994,209.10000000000002,0,1
9/8/11 23:00,3,0,1,1,31.16,48,19.0012,75,2011-08-09 23:00:00,23,9,8,2011,1,0,23,1495.68,23,0,19.0012,716.68,0,0
3/11/11 16:00,4,0,1,1,21.32,48,12.998,267,2011-11-03 16:00:00,16,3,11,2011,3,0,16,1023.36,16,0,12.998,341.12,0,0
17/1/12 0:00,1,0,1,2,10.66,70,22.0028,12,2012-01-17 00:00:00,0,17,1,2012,1,0,0,746.2,0,0,44.0056,0.0,0,0
11/12/12 3:00,4,0,1,3,14.76,76,19.0012,3,2012-12-11 03:00:00,3,11,12,2012,1,0,9,1121.76,3,0,57.003600000000006,44.28,0,0
12/8/12 8:00,3,0,0,1,27.06,54,15.0013,119,2012-08-12 08:00:00,8,12,8,2012,6,1,8,1461.24,0,8,15.0013,216.48,1,0
1/9/11 14:00,3,0,1,3,29.52,54,16.9979,198,2011-09-01 14:00:00,14,1,9,2011,3,0,42,1594.08,14,0,50.993700000000004,413.28,0,0
11/8/12 3:00,3,0,0,3,25.42,83,11.0014,21,2012-08-11 03:00:00,3,11,8,2012,5,1,9,2109.86,0,3,33.0042,76.26,0,0
18/2/11 7:00,1,0,1,2,17.22,77,15.0013,116,2011-02-18 07:00:00,7,18,2,2011,4,0,14,1325.9399999999998,7,0,30.0026,120.53999999999999,1,0
17/9/11 20:00,3,0,0,1,21.32,68,8.9981,176,2011-09-17 20:00:00,20,17,9,2011,5,1,20,1449.76,0,20,8.9981,426.4,0,0
5/8/12 6:00,3,0,0,1,29.52,79,16.9979,19,2012-08-05 06:00:00,6,5,8,2012,6,1,6,2332.08,0,6,16.9979,177.12,0,0
14/9/12 7:00,3,0,1,2,22.96,88,0.0,454,2012-09-14 07:00:00,7,14,9,2012,4,0,14,2020.48,7,0,0.0,160.72,1,0
9/6/12 6:00,2,0,0,1,22.96,64,7.0015,80,2012-06-09 06:00:00,6,9,6,2012,5,1,6,1469.44,0,6,7.0015,137.76,0,0
12/6/11 11:00,2,0,0,1,31.98,55,7.0015,367,2011-06-12 11:00:00,11,12,6,2011,6,1,11,1758.9,0,11,7.0015,351.78000000000003,0,0
11/9/12 10:00,3,0,1,1,25.42,38,0.0,196,2012-09-11 10:00:00,10,11,9,2012,1,0,10,965.96,10,0,0.0,254.20000000000002,0,0
6/8/11 5:00,3,0,0,1,26.24,89,6.0032,6,2011-08-06 05:00:00,5,6,8,2011,5,1,5,2335.3599999999997,0,5,6.0032,131.2,0,0
6/10/11 20:00,4,0,1,1,20.5,77,7.0015,260,2011-10-06 20:00:00,20,6,10,2011,3,0,20,1578.5,20,0,7.0015,410.0,0,0
11/9/11 12:00,3,0,0,1,28.7,65,0.0,411,2011-09-11 12:00:00,12,11,9,2011,6,1,12,1865.5,0,12,0.0,344.4,0,0
13/9/11 11:00,3,0,1,1,28.7,61,11.0014,153,2011-09-13 11:00:00,11,13,9,2011,1,0,11,1750.7,11,0,11.0014,315.7,0,0
17/10/11 4:00,4,0,1,1,21.32,59,11.0014,5,2011-10-17 04:00:00,4,17,10,2011,0,0,4,1257.88,4,0,11.0014,85.28,0,0
16/1/12 4:00,1,1,0,1,4.499616316,57,6.982766167,1,2012-01-16 04:00:00,4,16,1,2012,0,0,4,256.478130012,0,0,6.982766167,17.998465264,0,0
14/7/12 4:00,3,0,0,3,27.06,61,7.0015,9,2012-07-14 04:00:00,4,14,7,2012,5,1,12,1650.6599999999999,0,4,21.0045,108.24,0,0
5/10/12 6:00,4,0,1,1,21.32,83,0.0,137,2012-10-05 06:00:00,6,5,10,2012,4,0,6,1769.56,6,0,0.0,127.92,0,0
12/1/11 11:00,1,0,1,1,8.2,51,26.0027,35,2011-01-12 11:00:00,11,12,1,2011,2,0,11,418.2,11,0,26.0027,90.19999999999999,0,0
7/1/11 15:00,1,0,1,2,8.2,37,11.0014,72,2011-01-07 15:00:00,15,7,1,2011,4,0,30,303.4,15,0,22.0028,122.99999999999999,0,0
18/3/11 19:00,1,0,1,1,26.79966683,44,9.188103732,206,2011-03-18 19:00:00,19,18,3,2011,4,0,19,1179.18534052,19,0,9.188103732,509.19366977,0,1
2/12/11 18:00,4,0,1,1,16.4,50,0.0,372,2011-12-02 18:00:00,18,2,12,2011,4,0,18,819.9999999999999,18,0,0.0,295.2,0,1
11/9/11 1:00,3,0,0,2,25.42,88,0.0,88,2011-09-11 01:00:00,1,11,9,2011,6,1,2,2236.96,0,1,0.0,25.42,0,0
5/1/11 12:00,1,0,1,1,10.66,33,22.0028,79,2011-01-05 12:00:00,12,5,1,2011,2,0,12,351.78000000000003,12,0,22.0028,127.92,0,0
13/6/11 8:00,2,0,1,1,23.78,49,30.0026,476,2011-06-13 08:00:00,8,13,6,2011,0,0,8,1165.22,8,0,30.0026,190.24,1,0
4/8/12 3:00,3,0,0,1,29.52,84,8.9981,30,2012-08-04 03:00:00,3,4,8,2012,5,1,3,2479.68,0,3,8.9981,88.56,0,0
17/2/12 14:00,1,0,1,1,16.4,37,23.9994,170,2012-02-17 14:00:00,14,17,2,2012,4,0,14,606.8,14,0,23.9994,229.59999999999997,0,0
6/2/11 9:00,1,0,0,1,12.66564658,56,8.120272767,34,2011-02-06 09:00:00,9,6,2,2011,6,1,9,709.27620848,0,9,8.120272767,113.99081922,1,0
2/3/12 7:00,1,0,1,1,12.3,70,0.0,262,2012-03-02 07:00:00,7,2,3,2012,4,0,7,861.0,7,0,0.0,86.10000000000001,1,0
11/1/11 16:00,1,0,1,2,7.16973774,85,15.25556767,70,2011-01-11 16:00:00,16,11,1,2011,1,0,32,609.4277079000001,16,0,30.51113534,114.71580384,0,0
14/2/12 0:00,1,0,1,2,10.66,60,0.0,14,2012-02-14 00:00:00,0,14,2,2012,1,0,0,639.6,0,0,0.0,0.0,0,0
16/11/12 20:00,4,0,1,1,14.76,46,16.9979,227,2012-11-16 20:00:00,20,16,11,2012,4,0,20,678.96,20,0,16.9979,295.2,0,0
17/6/12 5:00,2,0,0,1,22.50450599,68,9.846043371,23,2012-06-17 05:00:00,5,17,6,2012,6,1,5,1530.3064073199998,0,5,9.846043371,112.52252994999999,0,0
7/1/12 16:00,1,0,0,2,24.6824407,39,19.42996663,406,2012-01-07 16:00:00,16,7,1,2012,5,1,32,962.6151873,0,16,38.85993326,394.9190512,0,0
2/9/11 18:00,3,0,1,2,27.88,65,12.998,355,2011-09-02 18:00:00,18,2,9,2011,4,0,36,1812.2,18,0,25.996,501.84,0,1
2/1/11 11:00,1,0,0,2,14.76,71,16.9979,70,2011-01-02 11:00:00,11,2,1,2011,6,1,22,1047.96,0,11,33.9958,162.35999999999999,0,0
7/10/12 11:00,4,0,0,2,17.22,71,7.0015,336,2012-10-07 11:00:00,11,7,10,2012,6,1,22,1222.62,0,11,14.003,189.42,0,0
12/2/11 11:00,1,0,0,1,12.3,28,22.0028,114,2011-02-12 11:00:00,11,12,2,2011,5,1,11,344.40000000000003,0,11,22.0028,135.3,0,0
15/6/11 20:00,2,0,1,1,27.06,44,11.0014,330,2011-06-15 20:00:00,20,15,6,2011,2,0,20,1190.6399999999999,20,0,11.0014,541.1999999999999,0,0
9/12/11 11:00,4,0,1,1,13.12,70,16.9979,136,2011-12-09 11:00:00,11,9,12,2011,4,0,11,918.4,11,0,16.9979,144.32,0,0
8/11/12 2:00,4,0,1,2,12.3,49,15.0013,6,2012-11-08 02:00:00,2,8,11,2012,3,0,4,602.7,2,0,30.0026,24.6,0,0
9/9/12 10:00,3,0,0,1,26.30124089,57,18.94862839,465,2012-09-09 10:00:00,10,9,9,2012,6,1,10,1499.1707307299998,0,10,18.94862839,263.01240889999997,0,0
9/10/11 6:00,4,0,0,1,18.04,88,0.0,21,2011-10-09 06:00:00,6,9,10,2011,6,1,6,1587.52,0,6,0.0,108.24,0,0
9/4/12 11:00,2,0,1,1,21.32,27,27.9993,223,2012-04-09 11:00:00,11,9,4,2012,0,0,11,575.64,11,0,27.9993,234.52,0,0
8/7/11 22:00,3,0,1,2,27.06,78,12.998,169,2011-07-08 22:00:00,22,8,7,2011,4,0,44,2110.68,22,0,25.996,595.3199999999999,0,0
16/8/12 18:00,3,0,1,1,31.92866198,34,0.022606478,849,2012-08-16 18:00:00,18,16,8,2012,3,0,18,1085.57450732,18,0,0.022606478,574.71591564,0,1
7/8/11 10:00,3,0,0,1,32.8,66,8.9981,266,2011-08-07 10:00:00,10,7,8,2011,6,1,10,2164.7999999999997,0,10,8.9981,328.0,0,0
2/5/11 15:00,2,0,1,1,28.06555435,61,11.33902056,133,2011-05-02 15:00:00,15,2,5,2011,0,0,15,1711.9988153499999,15,0,11.33902056,420.98331525,0,0
13/8/12 19:00,3,0,1,1,30.34,58,11.0014,555,2012-08-13 19:00:00,19,13,8,2012,0,0,19,1759.72,19,0,11.0014,576.46,0,1
1/7/11 6:00,3,0,1,1,25.42,61,8.9981,108,2011-07-01 06:00:00,6,1,7,2011,4,0,6,1550.6200000000001,6,0,8.9981,152.52,0,0
3/6/12 6:00,2,0,0,1,18.86,82,7.0015,22,2012-06-03 06:00:00,6,3,6,2012,6,1,6,1546.52,0,6,7.0015,113.16,0,0
14/1/11 12:00,1,0,1,1,8.2,44,16.9979,61,2011-01-14 12:00:00,12,14,1,2011,4,0,12,360.79999999999995,12,0,16.9979,98.39999999999999,0,0
7/6/11 3:00,2,0,1,1,24.6,73,6.0032,2,2011-06-07 03:00:00,3,7,6,2011,1,0,3,1795.8000000000002,3,0,6.0032,73.80000000000001,0,0
16/6/12 19:00,2,0,0,2,30.75288193,41,12.89224443,488,2012-06-16 19:00:00,19,16,6,2012,5,1,38,1260.86815913,0,19,25.78448886,584.30475667,0,1
5/11/12 2:00,4,0,1,2,12.3,56,11.0014,6,2012-11-05 02:00:00,2,5,11,2012,0,0,4,688.8000000000001,2,0,22.0028,24.6,0,0
7/6/11 18:00,2,0,1,1,31.98,46,19.0012,551,2011-06-07 18:00:00,18,7,6,2011,1,0,18,1471.08,18,0,19.0012,575.64,0,1
17/9/11 19:00,3,0,0,1,21.32,68,8.9981,256,2011-09-17 19:00:00,19,17,9,2011,5,1,19,1449.76,0,19,8.9981,405.08,0,1
1/12/12 11:00,4,0,0,2,14.5396707,79,6.831537252,386,2012-12-01 11:00:00,11,1,12,2012,5,1,22,1148.6339853,0,11,13.663074504,159.9363777,0,0
4/7/12 21:00,3,1,0,1,34.44,53,8.9981,584,2012-07-04 21:00:00,21,4,7,2012,2,0,21,1825.32,0,0,8.9981,723.24,0,0
13/7/12 11:00,3,0,1,2,31.16,45,8.9981,288,2012-07-13 11:00:00,11,13,7,2012,4,0,22,1402.2,11,0,17.9962,342.76,0,0
12/2/12 6:00,1,0,0,1,4.1,49,26.0027,2,2012-02-12 06:00:00,6,12,2,2012,6,1,6,200.89999999999998,0,6,26.0027,24.599999999999998,0,0
11/5/12 22:00,2,0,1,1,22.96,35,15.0013,234,2012-05-11 22:00:00,22,11,5,2012,4,0,22,803.6,22,0,15.0013,505.12,0,0
15/8/11 13:00,3,0,1,1,31.98,52,19.0012,193,2011-08-15 13:00:00,13,15,8,2011,0,0,13,1662.96,13,0,19.0012,415.74,0,0
9/7/11 14:00,3,0,0,1,34.44,36,8.9981,373,2011-07-09 14:00:00,14,9,7,2011,5,1,14,1239.84,0,14,8.9981,482.15999999999997,0,0
10/11/11 7:00,4,0,1,2,15.58,94,11.0014,272,2011-11-10 07:00:00,7,10,11,2011,3,0,14,1464.52,7,0,22.0028,109.06,1,0
16/8/12 4:00,3,0,1,1,25.42,73,15.0013,5,2012-08-16 04:00:00,4,16,8,2012,3,0,4,1855.66,4,0,15.0013,101.68,0,0
11/5/11 10:00,2,0,1,1,22.14,68,6.0032,154,2011-05-11 10:00:00,10,11,5,2011,2,0,10,1505.52,10,0,6.0032,221.4,0,0
8/12/12 22:00,4,0,0,2,15.45912884,93,7.442291113,160,2012-12-08 22:00:00,22,8,12,2012,5,1,44,1437.69898212,0,22,14.884582226,340.10083448,0,0
10/8/12 15:00,3,0,1,1,32.8,52,30.0026,324,2012-08-10 15:00:00,15,10,8,2012,4,0,15,1705.6,15,0,30.0026,491.99999999999994,0,0
6/2/12 0:00,1,0,1,1,9.84,65,8.9981,21,2012-02-06 00:00:00,0,6,2,2012,0,0,0,639.6,0,0,8.9981,0.0,0,0
11/4/11 16:00,2,0,1,1,30.34,48,35.0008,235,2011-04-11 16:00:00,16,11,4,2011,0,0,16,1456.32,16,0,35.0008,485.44,0,0
12/7/12 15:00,3,0,1,1,32.8,36,12.998,271,2012-07-12 15:00:00,15,12,7,2012,3,0,15,1180.8,15,0,12.998,491.99999999999994,0,0
19/4/12 10:00,2,0,1,1,19.68,63,6.0032,189,2012-04-19 10:00:00,10,19,4,2012,3,0,10,1239.84,10,0,6.0032,196.8,0,0
7/6/11 4:00,2,0,1,1,23.78,83,8.9981,5,2011-06-07 04:00:00,4,7,6,2011,1,0,4,1973.74,4,0,8.9981,95.12,0,0
16/8/12 13:00,3,0,1,1,32.8,31,15.0013,300,2012-08-16 13:00:00,13,16,8,2012,3,0,13,1016.8,13,0,15.0013,426.4,0,0
19/12/11 5:00,4,0,1,1,5.74,93,7.0015,21,2011-12-19 05:00:00,5,19,12,2011,0,0,5,533.82,5,0,7.0015,28.700000000000003,0,0
5/3/11 21:00,1,0,0,2,18.04,72,22.0028,72,2011-03-05 21:00:00,21,5,3,2011,5,1,42,1298.8799999999999,0,21,44.0056,378.84,0,0
12/9/11 8:00,3,0,1,1,24.6,78,6.0032,408,2011-09-12 08:00:00,8,12,9,2011,0,0,8,1918.8000000000002,8,0,6.0032,196.8,1,0
3/6/11 16:00,2,0,1,1,29.52,26,22.0028,349,2011-06-03 16:00:00,16,3,6,2011,4,0,16,767.52,16,0,22.0028,472.32,0,0
6/7/12 1:00,3,0,1,1,31.98,55,15.0013,29,2012-07-06 01:00:00,1,6,7,2012,4,0,1,1758.9,1,0,15.0013,31.98,0,0
19/11/11 9:00,4,0,0,1,11.48,52,19.9995,142,2011-11-19 09:00:00,9,19,11,2011,5,1,9,596.96,0,9,19.9995,103.32000000000001,1,0
14/6/11 2:00,2,0,1,1,24.6,49,19.0012,10,2011-06-14 02:00:00,2,14,6,2011,1,0,2,1205.4,2,0,19.0012,49.2,0,0
12/9/12 20:00,3,0,1,1,25.42,57,8.9981,470,2012-09-12 20:00:00,20,12,9,2012,2,0,20,1448.94,20,0,8.9981,508.40000000000003,0,0
8/1/11 3:00,1,0,0,3,7.38,55,11.0014,7,2011-01-08 03:00:00,3,8,1,2011,5,1,9,405.9,0,3,33.0042,22.14,0,0
4/6/11 1:00,2,0,0,1,22.14,64,7.0015,94,2011-06-04 01:00:00,1,4,6,2011,5,1,1,1416.96,0,1,7.0015,22.14,0,0
12/1/11 17:00,1,0,1,1,9.433275784,48,25.14788441,148,2011-01-12 17:00:00,17,12,1,2011,2,0,17,452.79723763199996,17,0,25.14788441,160.36568832799998,0,1
17/6/12 8:00,2,0,0,1,22.96,68,16.9979,119,2012-06-17 08:00:00,8,17,6,2012,6,1,8,1561.28,0,8,16.9979,183.68,1,0
11/12/12 5:00,4,0,1,3,13.94,71,22.0028,41,2012-12-11 05:00:00,5,11,12,2012,1,0,15,989.74,5,0,66.0084,69.7,0,0
19/9/11 16:00,3,0,1,2,24.6,60,11.0014,263,2011-09-19 16:00:00,16,19,9,2011,0,0,32,1476.0,16,0,22.0028,393.6,0,0
4/10/12 16:00,4,0,1,1,28.7,54,19.0012,497,2012-10-04 16:00:00,16,4,10,2012,3,0,16,1549.8,16,0,19.0012,459.2,0,0
2/7/11 18:00,3,0,0,1,33.62,30,19.0012,383,2011-07-02 18:00:00,18,2,7,2011,5,1,18,1008.5999999999999,0,18,19.0012,605.16,0,1
5/4/12 9:00,2,0,1,1,16.4,37,16.9979,351,2012-04-05 09:00:00,9,5,4,2012,3,0,9,606.8,9,0,16.9979,147.6,1,0
4/7/12 2:00,3,1,0,1,27.06,83,8.9981,93,2012-07-04 02:00:00,2,4,7,2012,2,0,2,2245.98,0,0,8.9981,54.12,0,0
5/11/11 7:00,4,0,0,1,10.66,60,19.0012,34,2011-11-05 07:00:00,7,5,11,2011,5,1,7,639.6,0,7,19.0012,74.62,1,0
19/3/12 8:00,1,0,1,1,18.91709312,89,7.225563945,575,2012-03-19 08:00:00,8,19,3,2012,0,0,8,1683.62128768,8,0,7.225563945,151.33674496,1,0
10/7/11 13:00,3,0,0,1,32.8,46,19.9995,367,2011-07-10 13:00:00,13,10,7,2011,6,1,13,1508.8,0,13,19.9995,426.4,0,0
1/5/12 15:00,2,0,1,2,30.34,45,15.0013,234,2012-05-01 15:00:00,15,1,5,2012,1,0,30,1365.3,15,0,30.0026,455.1,0,0
8/9/11 21:00,3,0,1,3,26.24,94,7.0015,82,2011-09-08 21:00:00,21,8,9,2011,3,0,63,2466.56,21,0,21.0045,551.04,0,0
3/12/12 1:00,4,0,1,1,16.4,82,8.9981,13,2012-12-03 01:00:00,1,3,12,2012,0,0,1,1344.8,1,0,8.9981,16.4,0,0
12/3/11 1:00,1,0,0,1,9.84,65,12.998,18,2011-03-12 01:00:00,1,12,3,2011,5,1,1,639.6,0,1,12.998,9.84,0,0
7/10/11 23:00,4,0,1,1,20.5,63,0.0,136,2011-10-07 23:00:00,23,7,10,2011,4,0,23,1291.5,23,0,0.0,471.5,0,0
1/12/11 16:00,4,0,1,1,16.4,40,12.998,201,2011-12-01 16:00:00,16,1,12,2011,3,0,16,656.0,16,0,12.998,262.4,0,0
18/8/11 7:00,3,0,1,1,26.24,78,19.9995,308,2011-08-18 07:00:00,7,18,8,2011,3,0,7,2046.7199999999998,7,0,19.9995,183.67999999999998,1,0
9/7/11 6:00,3,0,0,2,27.08072005,84,13.12840104,15,2011-07-09 06:00:00,6,9,7,2011,5,1,12,2274.7804842,0,6,26.25680208,162.4843203,0,0
8/6/12 21:00,2,0,1,1,28.7,37,8.9981,339,2012-06-08 21:00:00,21,8,6,2012,4,0,21,1061.8999999999999,21,0,8.9981,602.6999999999999,0,0
12/7/12 21:00,3,0,1,1,29.52,48,15.0013,373,2012-07-12 21:00:00,21,12,7,2012,3,0,21,1416.96,21,0,15.0013,619.92,0,0
2/3/11 10:00,1,0,1,1,13.12,49,19.0012,76,2011-03-02 10:00:00,10,2,3,2011,2,0,10,642.88,10,0,19.0012,131.2,0,0
1/10/11 7:00,4,0,0,3,17.22,67,16.9979,36,2011-10-01 07:00:00,7,1,10,2011,5,1,21,1153.74,0,7,50.993700000000004,120.53999999999999,1,0
4/6/12 2:00,2,0,1,1,22.96,60,15.0013,11,2012-06-04 02:00:00,2,4,6,2012,0,0,2,1377.6000000000001,2,0,15.0013,45.92,0,0
10/9/12 17:00,3,0,1,1,27.92057722,37,21.89360109,867,2012-09-10 17:00:00,17,10,9,2012,0,0,17,1033.06135714,17,0,21.89360109,474.64981273999996,0,1
17/8/12 4:00,3,0,1,1,26.60322651,71,10.49828713,1,2012-08-17 04:00:00,4,17,8,2012,4,0,4,1888.82908221,4,0,10.49828713,106.41290604,0,0
7/6/12 19:00,2,0,1,1,28.09653353,35,18.82619773,574,2012-06-07 19:00:00,19,7,6,2012,3,0,19,983.3786735499999,19,0,18.82619773,533.83413707,0,1
14/5/11 20:00,2,0,0,3,22.14,94,8.9981,157,2011-05-14 20:00:00,20,14,5,2011,5,1,60,2081.16,0,20,26.994300000000003,442.8,0,0
9/3/11 22:00,1,0,1,3,13.12,93,11.0014,21,2011-03-09 22:00:00,22,9,3,2011,2,0,66,1220.1599999999999,22,0,33.0042,288.64,0,0
11/10/11 14:00,4,0,1,3,24.6,73,7.0015,171,2011-10-11 14:00:00,14,11,10,2011,1,0,42,1795.8000000000002,14,0,21.0045,344.40000000000003,0,0
10/11/12 16:00,4,0,0,1,22.14,37,0.0,605,2012-11-10 16:00:00,16,10,11,2012,5,1,16,819.1800000000001,0,16,0.0,354.24,0,0
4/11/11 10:00,4,0,1,2,17.22,71,22.0028,134,2011-11-04 10:00:00,10,4,11,2011,4,0,20,1222.62,10,0,44.0056,172.2,0,0
3/2/11 10:00,1,0,1,1,7.126348679,42,22.17736573,41,2011-02-03 10:00:00,10,3,2,2011,3,0,10,299.30664451800004,10,0,22.17736573,71.26348679,0,0
8/1/11 20:00,1,0,0,1,4.92,36,16.9979,28,2011-01-08 20:00:00,20,8,1,2011,5,1,20,177.12,0,20,16.9979,98.4,0,0
13/6/11 14:00,2,0,1,1,28.7,34,16.9979,200,2011-06-13 14:00:00,14,13,6,2011,0,0,14,975.8,14,0,16.9979,401.8,0,0
5/1/12 19:00,1,0,1,1,13.94,34,6.0032,265,2012-01-05 19:00:00,19,5,1,2012,3,0,19,473.96,19,0,6.0032,264.86,0,1
1/4/12 21:00,2,0,0,2,20.5,59,11.0014,134,2012-04-01 21:00:00,21,1,4,2012,6,1,42,1209.5,0,21,22.0028,430.5,0,0
14/9/12 17:00,3,0,1,1,30.01183501,53,13.67005652,884,2012-09-14 17:00:00,17,14,9,2012,4,0,17,1590.62725553,17,0,13.67005652,510.20119517,0,1
5/1/12 23:00,1,0,1,1,8.867030976,69,8.321631551,58,2012-01-05 23:00:00,23,5,1,2012,3,0,23,611.825137344,23,0,8.321631551,203.941712448,0,0
4/12/11 13:00,4,0,0,1,16.4,66,15.0013,357,2011-12-04 13:00:00,13,4,12,2011,6,1,13,1082.3999999999999,0,13,15.0013,213.2,0,0
1/4/12 19:00,2,0,0,1,21.32,55,15.0013,346,2012-04-01 19:00:00,19,1,4,2012,6,1,19,1172.6,0,19,15.0013,405.08,0,1
18/3/11 13:00,1,0,1,1,26.24,41,19.0012,175,2011-03-18 13:00:00,13,18,3,2011,4,0,13,1075.84,13,0,19.0012,341.12,0,0
15/3/12 0:00,1,0,1,1,22.14,49,8.9981,60,2012-03-15 00:00:00,0,15,3,2012,3,0,0,1084.8600000000001,0,0,8.9981,0.0,0,0
19/3/12 17:00,1,0,1,1,26.61930904,53,13.29402761,746,2012-03-19 17:00:00,17,19,3,2012,0,0,17,1410.82337912,17,0,13.29402761,452.52825368000003,0,1
19/7/12 4:00,3,0,1,1,29.52,70,7.0015,8,2012-07-19 04:00:00,4,19,7,2012,3,0,4,2066.4,4,0,7.0015,118.08,0,0
14/4/12 0:00,2,0,0,1,16.4,58,8.9981,96,2012-04-14 00:00:00,0,14,4,2012,5,1,0,951.1999999999999,0,0,8.9981,0.0,0,0
5/2/12 0:00,1,0,0,2,9.84,87,8.9981,61,2012-02-05 00:00:00,0,5,2,2012,6,1,0,856.08,0,0,17.9962,0.0,0,0
13/7/12 12:00,3,0,1,2,31.16,40,7.0015,379,2012-07-13 12:00:00,12,13,7,2012,4,0,24,1246.4,12,0,14.003,373.92,0,0
5/4/11 15:00,2,0,1,1,18.19180392,50,31.25532719,78,2011-04-05 15:00:00,15,5,4,2011,1,0,15,909.5901960000001,15,0,31.25532719,272.87705880000004,0,0
5/2/11 21:00,1,0,0,1,10.66,100,12.998,56,2011-02-05 21:00:00,21,5,2,2011,5,1,21,1066.0,0,21,12.998,223.86,0,0
1/7/12 7:00,3,0,0,1,30.34,70,0.0,50,2012-07-01 07:00:00,7,1,7,2012,6,1,7,2123.8,0,7,0.0,212.38,1,0
18/8/11 21:00,3,0,1,2,27.88,79,0.0,149,2011-08-18 21:00:00,21,18,8,2011,3,0,42,2202.52,21,0,0.0,585.48,0,0
5/8/11 9:00,3,0,1,1,29.52,58,7.0015,226,2011-08-05 09:00:00,9,5,8,2011,4,0,9,1712.16,9,0,7.0015,265.68,1,0
7/7/12 9:00,3,0,0,1,34.07502191,60,12.14738016,243,2012-07-07 09:00:00,9,7,7,2012,5,1,9,2044.5013146,0,9,12.14738016,306.67519718999995,1,0
3/4/12 13:00,2,0,1,1,22.96,19,16.9979,345,2012-04-03 13:00:00,13,3,4,2012,1,0,13,436.24,13,0,16.9979,298.48,0,0
10/11/11 8:00,4,0,1,2,16.4,94,6.0032,436,2011-11-10 08:00:00,8,10,11,2011,3,0,16,1541.6,8,0,12.0064,131.2,1,0
17/9/12 12:00,3,0,1,2,25.42,69,12.998,295,2012-09-17 12:00:00,12,17,9,2012,0,0,24,1753.98,12,0,25.996,305.04,0,0
17/2/12 9:00,1,0,1,2,10.66,100,0.0,283,2012-02-17 09:00:00,9,17,2,2012,4,0,18,1066.0,9,0,0.0,95.94,1,0
18/10/11 1:00,4,0,1,2,18.55052248,89,0.377489392,9,2011-10-18 01:00:00,1,18,10,2011,1,0,2,1650.99650072,1,0,0.754978784,18.55052248,0,0
7/7/11 2:00,3,0,1,1,27.06,89,12.998,8,2011-07-07 02:00:00,2,7,7,2011,3,0,2,2408.3399999999997,2,0,12.998,54.12,0,0
17/9/11 3:00,3,0,0,1,18.86,72,8.9981,28,2011-09-17 03:00:00,3,17,9,2011,5,1,3,1357.92,0,3,8.9981,56.58,0,0
17/4/12 11:00,2,0,1,1,24.6,33,27.9993,239,2012-04-17 11:00:00,11,17,4,2012,1,0,11,811.8000000000001,11,0,27.9993,270.6,0,0
16/6/12 22:00,2,0,0,1,25.42,53,19.9995,280,2012-06-16 22:00:00,22,16,6,2012,5,1,22,1347.26,0,22,19.9995,559.24,0,0
16/7/12 21:00,3,0,1,1,31.17256738,68,9.082418739,335,2012-07-16 21:00:00,21,16,7,2012,0,0,21,2119.73458184,21,0,9.082418739,654.62391498,0,0
18/2/11 16:00,1,0,1,1,27.06,36,19.0012,232,2011-02-18 16:00:00,16,18,2,2011,4,0,16,974.16,16,0,19.0012,432.96,0,0
19/2/12 22:00,1,0,0,3,9.84,75,6.0032,55,2012-02-19 22:00:00,22,19,2,2012,6,1,66,738.0,0,22,18.0096,216.48,0,0
2/11/12 10:00,4,0,1,1,15.58,46,19.9995,204,2012-11-02 10:00:00,10,2,11,2012,4,0,10,716.68,10,0,19.9995,155.8,0,0
18/6/11 5:00,2,0,0,1,25.42,83,0.0,7,2011-06-18 05:00:00,5,18,6,2011,5,1,5,2109.86,0,5,0.0,127.10000000000001,0,0
15/8/11 20:00,3,0,1,1,27.06,74,8.9981,285,2011-08-15 20:00:00,20,15,8,2011,0,0,20,2002.4399999999998,20,0,8.9981,541.1999999999999,0,0
17/11/11 18:00,4,0,1,1,13.12,39,12.998,307,2011-11-17 18:00:00,18,17,11,2011,3,0,18,511.67999999999995,18,0,12.998,236.16,0,1
14/2/11 16:00,1,0,1,1,21.32,27,31.0009,118,2011-02-14 16:00:00,16,14,2,2011,0,0,16,575.64,16,0,31.0009,341.12,0,0
18/10/12 15:00,4,0,1,2,24.6,60,12.998,353,2012-10-18 15:00:00,15,18,10,2012,3,0,30,1476.0,15,0,25.996,369.0,0,0
18/2/12 6:00,1,0,0,1,9.84,70,0.0,9,2012-02-18 06:00:00,6,18,2,2012,5,1,6,688.8,0,6,0.0,59.04,0,0
14/9/11 4:00,3,0,1,1,23.33848564,84,4.551814643,1,2011-09-14 04:00:00,4,14,9,2011,2,0,4,1960.4327937599999,4,0,4.551814643,93.35394256,0,0
6/1/11 23:00,1,0,1,2,8.2,59,12.998,23,2011-01-06 23:00:00,23,6,1,2011,3,0,46,483.79999999999995,23,0,25.996,188.6,0,0
2/11/12 23:00,4,0,1,1,13.95031347,53,19.44250161,134,2012-11-02 23:00:00,23,2,11,2012,4,0,23,739.36661391,23,0,19.44250161,320.85720981,0,0
4/10/12 23:00,4,0,1,1,24.6,56,6.0032,155,2012-10-04 23:00:00,23,4,10,2012,3,0,23,1377.6000000000001,23,0,6.0032,565.8000000000001,0,0
9/7/11 19:00,3,0,0,1,31.16,55,11.0014,306,2011-07-09 19:00:00,19,9,7,2011,5,1,19,1713.8,0,19,11.0014,592.04,0,1
11/1/11 11:00,1,0,1,2,8.2,47,8.9981,35,2011-01-11 11:00:00,11,11,1,2011,1,0,22,385.4,11,0,17.9962,90.19999999999999,0,0
15/7/12 5:00,3,0,0,1,27.88,89,8.9981,9,2012-07-15 05:00:00,5,15,7,2012,6,1,5,2481.3199999999997,0,5,8.9981,139.4,0,0
13/5/11 18:00,2,0,1,3,21.32,88,11.0014,398,2011-05-13 18:00:00,18,13,5,2011,4,0,54,1876.16,18,0,33.0042,383.76,0,1
4/8/12 21:00,3,0,0,1,32.03156216,60,18.00488754,325,2012-08-04 21:00:00,21,4,8,2012,5,1,21,1921.8937296,0,21,18.00488754,672.66280536,0,0
8/12/12 16:00,4,0,0,1,17.22,82,11.0014,507,2012-12-08 16:00:00,16,8,12,2012,5,1,16,1412.04,0,16,11.0014,275.52,0,0
11/12/11 12:00,4,0,0,1,10.66,35,0.0,288,2011-12-11 12:00:00,12,11,12,2011,6,1,12,373.1,0,12,0.0,127.92,0,0
7/4/11 18:00,2,0,1,1,19.68,55,16.9979,333,2011-04-07 18:00:00,18,7,4,2011,3,0,18,1082.4,18,0,16.9979,354.24,0,1
10/4/11 15:00,2,0,0,1,20.5,77,15.0013,297,2011-04-10 15:00:00,15,10,4,2011,6,1,15,1578.5,0,15,15.0013,307.5,0,0
13/5/11 17:00,2,0,1,3,20.68434134,85,9.885177359,527,2011-05-13 17:00:00,17,13,5,2011,4,0,51,1758.1690139,17,0,29.655532077,351.63380278,0,1
4/7/11 7:00,3,1,0,1,27.06,83,8.9981,36,2011-07-04 07:00:00,7,4,7,2011,0,0,7,2245.98,0,0,8.9981,189.42,1,0
10/12/11 23:00,4,0,0,1,9.351814314,44,10.20381603,83,2011-12-10 23:00:00,23,10,12,2011,5,1,23,411.479829816,0,23,10.20381603,215.091729222,0,0
7/4/11 12:00,2,0,1,2,18.86,55,0.0,153,2011-04-07 12:00:00,12,7,4,2011,3,0,24,1037.3,12,0,0.0,226.32,0,0
9/12/12 15:00,4,0,0,3,15.60332423,95,11.52324674,199,2012-12-09 15:00:00,15,9,12,2012,6,1,45,1482.31580185,0,15,34.56974022,234.04986345,0,0
12/1/12 17:00,1,0,1,1,18.21269818,64,10.05745365,529,2012-01-12 17:00:00,17,12,1,2012,3,0,17,1165.61268352,17,0,10.05745365,309.61586906,0,1
2/3/11 14:00,1,0,1,1,21.36028121,18,19.82313133,96,2011-03-02 14:00:00,14,2,3,2011,2,0,14,384.48506178,14,0,19.82313133,299.04393694,0,0
2/2/12 8:00,1,0,1,3,16.4,87,0.0,445,2012-02-02 08:00:00,8,2,2,2012,3,0,24,1426.8,8,0,0.0,131.2,1,0
9/1/11 10:00,1,0,0,1,4.62803385,43,26.20550226,65,2011-01-09 10:00:00,10,9,1,2011,6,1,10,199.00545555,0,10,26.20550226,46.2803385,0,0
12/2/11 10:00,1,0,0,1,9.02,41,16.9979,84,2011-02-12 10:00:00,10,12,2,2011,5,1,10,369.82,0,10,16.9979,90.19999999999999,0,0
16/7/11 4:00,3,0,0,1,24.6,73,6.0032,16,2011-07-16 04:00:00,4,16,7,2011,5,1,4,1795.8000000000002,0,4,6.0032,98.4,0,0
13/7/12 18:00,3,0,1,1,31.98,46,12.998,631,2012-07-13 18:00:00,18,13,7,2012,4,0,18,1471.08,18,0,12.998,575.64,0,1
18/12/11 21:00,4,0,0,1,9.02,64,0.0,89,2011-12-18 21:00:00,21,18,12,2011,6,1,21,577.28,0,21,0.0,189.42,0,0
7/7/11 0:00,3,0,1,1,27.06,89,8.9981,35,2011-07-07 00:00:00,0,7,7,2011,3,0,0,2408.3399999999997,0,0,8.9981,0.0,0,0
6/11/12 1:00,4,0,1,1,9.026601598,60,11.35638398,3,2012-11-06 01:00:00,1,6,11,2012,1,0,1,541.5960958799999,1,0,11.35638398,9.026601598,0,0
12/11/11 16:00,4,0,0,1,20.7982117,33,16.77364085,332,2011-11-12 16:00:00,16,12,11,2011,5,1,16,686.3409861,0,16,16.77364085,332.7713872,0,0
10/12/12 9:00,4,0,1,2,17.22,100,15.0013,284,2012-12-10 09:00:00,9,10,12,2012,0,0,18,1722.0,9,0,30.0026,154.98,1,0
8/2/12 10:00,1,0,1,2,11.31940541,69,14.66618118,95,2012-02-08 10:00:00,10,8,2,2012,2,0,20,781.03897329,10,0,29.33236236,113.1940541,0,0
11/8/11 6:00,3,0,1,1,25.42,65,11.0014,106,2011-08-11 06:00:00,6,11,8,2011,3,0,6,1652.3000000000002,6,0,11.0014,152.52,0,0
19/5/11 8:00,2,0,1,2,21.32,88,0.0,487,2011-05-19 08:00:00,8,19,5,2011,3,0,16,1876.16,8,0,0.0,170.56,1,0
9/3/12 17:00,1,0,1,1,18.86,24,26.0027,566,2012-03-09 17:00:00,17,9,3,2012,4,0,17,452.64,17,0,26.0027,320.62,0,1
10/5/11 18:00,2,0,1,1,26.24,29,8.9981,550,2011-05-10 18:00:00,18,10,5,2011,1,0,18,760.9599999999999,18,0,8.9981,472.32,0,1
11/12/11 2:00,4,0,0,1,7.38,55,16.9979,52,2011-12-11 02:00:00,2,11,12,2011,6,1,2,405.9,0,2,16.9979,14.76,0,0
8/9/11 19:00,3,0,1,3,25.42,100,22.0028,52,2011-09-08 19:00:00,19,8,9,2011,3,0,57,2542.0,19,0,66.0084,482.98,0,1
3/10/12 12:00,4,0,1,2,27.28087852,71,7.857943037,368,2012-10-03 12:00:00,12,3,10,2012,2,0,24,1936.94237492,12,0,15.715886074,327.37054224,0,0
3/9/11 10:00,3,0,0,3,27.06,65,16.9979,258,2011-09-03 10:00:00,10,3,9,2011,5,1,30,1758.8999999999999,0,10,50.993700000000004,270.59999999999997,0,0
6/8/12 0:00,3,0,1,2,29.52,79,0.0,33,2012-08-06 00:00:00,0,6,8,2012,0,0,0,2332.08,0,0,0.0,0.0,0,0
16/5/11 22:00,2,0,1,1,22.96,88,6.0032,127,2011-05-16 22:00:00,22,16,5,2011,0,0,22,2020.48,22,0,6.0032,505.12,0,0
18/7/12 6:00,3,0,1,1,29.52,70,11.0014,162,2012-07-18 06:00:00,6,18,7,2012,2,0,6,2066.4,6,0,11.0014,177.12,0,0
11/5/12 8:00,2,0,1,1,18.86,44,16.9979,620,2012-05-11 08:00:00,8,11,5,2012,4,0,8,829.8399999999999,8,0,16.9979,150.88,1,0
19/1/11 12:00,1,0,1,2,12.3,81,6.0032,70,2011-01-19 12:00:00,12,19,1,2011,2,0,24,996.3000000000001,12,0,12.0064,147.60000000000002,0,0
15/11/12 19:00,4,0,1,2,14.08992664,60,8.166448913,378,2012-11-15 19:00:00,19,15,11,2012,3,0,38,845.3955984,19,0,16.332897826,267.70860616,0,1
9/2/11 21:00,1,0,1,2,5.74,86,11.0014,83,2011-02-09 21:00:00,21,9,2,2011,2,0,42,493.64000000000004,21,0,22.0028,120.54,0,0
17/2/12 11:00,1,0,1,1,14.76,62,27.9993,142,2012-02-17 11:00:00,11,17,2,2012,4,0,11,915.12,11,0,27.9993,162.35999999999999,0,0
9/8/11 0:00,3,0,1,1,29.52,79,8.9981,35,2011-08-09 00:00:00,0,9,8,2011,1,0,0,2332.08,0,0,8.9981,0.0,0,0
2/11/12 2:00,4,0,1,1,13.84491227,69,11.06751486,1,2012-11-02 02:00:00,2,2,11,2012,4,0,2,955.29894663,2,0,11.06751486,27.68982454,0,0
17/1/11 5:00,1,1,0,2,7.38,43,11.0014,1,2011-01-17 05:00:00,5,17,1,2011,0,0,10,317.34,0,0,22.0028,36.9,0,0
14/3/11 17:00,1,0,1,1,15.58,40,12.998,271,2011-03-14 17:00:00,17,14,3,2011,0,0,17,623.2,17,0,12.998,264.86,0,1
4/11/11 16:00,4,0,1,1,18.86,36,26.0027,290,2011-11-04 16:00:00,16,4,11,2011,4,0,16,678.96,16,0,26.0027,301.76,0,0
19/10/11 20:00,4,0,1,3,24.6,94,6.0032,145,2011-10-19 20:00:00,20,19,10,2011,2,0,60,2312.4,20,0,18.0096,492.0,0,0
9/8/11 22:00,3,0,1,1,31.98,46,19.9995,155,2011-08-09 22:00:00,22,9,8,2011,1,0,22,1471.08,22,0,19.9995,703.5600000000001,0,0
11/12/11 20:00,4,0,0,1,9.02,55,7.0015,72,2011-12-11 20:00:00,20,11,12,2011,6,1,20,496.09999999999997,0,20,7.0015,180.39999999999998,0,0
17/2/11 2:00,1,0,1,2,12.50140993,56,14.71617125,28,2011-02-17 02:00:00,2,17,2,2011,3,0,4,700.07895608,2,0,29.4323425,25.00281986,0,0
19/1/11 10:00,1,0,1,2,10.66,93,8.9981,47,2011-01-19 10:00:00,10,19,1,2011,2,0,20,991.38,10,0,17.9962,106.6,0,0
7/9/11 16:00,3,0,1,1,26.24,89,0.0,144,2011-09-07 16:00:00,16,7,9,2011,2,0,16,2335.3599999999997,16,0,0.0,419.84,0,0
4/1/11 18:00,1,0,1,1,10.66,48,12.998,182,2011-01-04 18:00:00,18,4,1,2011,1,0,18,511.68,18,0,12.998,191.88,0,1
8/12/11 9:00,4,0,1,1,9.84,52,26.0027,225,2011-12-08 09:00:00,9,8,12,2011,3,0,9,511.68,9,0,26.0027,88.56,1,0
14/10/11 2:00,4,0,1,1,22.96,94,11.0014,6,2011-10-14 02:00:00,2,14,10,2011,4,0,2,2158.2400000000002,2,0,11.0014,45.92,0,0
6/4/11 23:00,2,0,1,1,18.86,41,19.9995,40,2011-04-06 23:00:00,23,6,4,2011,2,0,23,773.26,23,0,19.9995,433.78,0,0
6/1/12 3:00,1,0,1,1,9.02,69,7.0015,4,2012-01-06 03:00:00,3,6,1,2012,4,0,3,622.38,3,0,7.0015,27.06,0,0
15/7/12 2:00,3,0,0,2,27.88,89,11.0014,115,2012-07-15 02:00:00,2,15,7,2012,6,1,4,2481.3199999999997,0,2,22.0028,55.76,0,0
12/10/12 2:00,4,0,1,1,16.4,66,6.0032,16,2012-10-12 02:00:00,2,12,10,2012,4,0,2,1082.3999999999999,2,0,6.0032,32.8,0,0
15/2/11 20:00,1,0,1,1,10.66,33,7.0015,101,2011-02-15 20:00:00,20,15,2,2011,1,0,20,351.78000000000003,20,0,7.0015,213.2,0,0
13/11/11 13:00,4,0,0,2,21.32,29,27.9993,339,2011-11-13 13:00:00,13,13,11,2011,6,1,26,618.28,0,13,55.9986,277.16,0,0
1/11/11 21:00,4,0,1,1,15.64204871,78,0.0,123,2011-11-01 21:00:00,21,1,11,2011,1,0,21,1220.07979938,21,0,0.0,328.48302291,0,0
12/1/11 17:00,1,0,1,1,8.166392076,49,24.2253144,155,2011-01-12 17:00:00,17,12,1,2011,2,0,17,400.15321172399996,17,0,24.2253144,138.82866529199998,0,1
7/7/12 1:00,3,0,0,1,31.16,70,11.0014,71,2012-07-07 01:00:00,1,7,7,2012,5,1,1,2181.2,0,1,11.0014,31.16,0,0
17/5/12 6:00,2,0,1,1,22.90372452,74,23.1882647,167,2012-05-17 06:00:00,6,17,5,2012,3,0,6,1694.87561448,6,0,23.1882647,137.42234712,0,0
14/10/11 11:00,4,0,1,3,21.32,88,11.0014,87,2011-10-14 11:00:00,11,14,10,2011,4,0,33,1876.16,11,0,33.0042,234.52,0,0
6/7/12 6:00,3,0,1,1,30.34,66,12.998,131,2012-07-06 06:00:00,6,6,7,2012,4,0,6,2002.44,6,0,12.998,182.04,0,0
17/2/11 19:00,1,0,1,1,19.68,55,22.0028,175,2011-02-17 19:00:00,19,17,2,2011,3,0,19,1082.4,19,0,22.0028,373.92,0,1
3/9/12 20:00,3,1,0,1,29.52,76,7.0015,261,2012-09-03 20:00:00,20,3,9,2012,0,0,20,2243.52,0,0,7.0015,590.4,0,0
14/12/11 5:00,4,0,1,2,10.66,81,0.0,26,2011-12-14 05:00:00,5,14,12,2011,2,0,10,863.46,5,0,0.0,53.3,0,0
17/6/11 7:00,2,0,1,1,24.6,83,0.0,250,2011-06-17 07:00:00,7,17,6,2011,4,0,7,2041.8000000000002,7,0,0.0,172.20000000000002,1,0
13/4/11 16:00,2,0,1,1,18.55329383,67,19.43184449,116,2011-04-13 16:00:00,16,13,4,2011,2,0,16,1243.0706866100002,16,0,19.43184449,296.85270128,0,0
11/2/12 0:00,1,0,0,2,12.3,70,8.9981,53,2012-02-11 00:00:00,0,11,2,2012,5,1,0,861.0,0,0,17.9962,0.0,0,0
11/12/12 20:00,4,0,1,1,13.12,53,15.0013,257,2012-12-11 20:00:00,20,11,12,2012,1,0,20,695.36,20,0,15.0013,262.4,0,0
4/4/11 13:00,2,0,1,1,27.88,34,22.0028,139,2011-04-04 13:00:00,13,4,4,2011,0,0,13,947.92,13,0,22.0028,362.44,0,0
17/6/12 20:00,2,0,0,1,25.42,57,12.998,302,2012-06-17 20:00:00,20,17,6,2012,6,1,20,1448.94,0,20,12.998,508.40000000000003,0,0
4/5/12 20:00,2,0,1,1,27.88,51,7.0015,313,2012-05-04 20:00:00,20,4,5,2012,4,0,20,1421.8799999999999,20,0,7.0015,557.6,0,0
1/8/11 16:00,3,0,1,1,36.9,27,0.0,231,2011-08-01 16:00:00,16,1,8,2011,0,0,16,996.3,16,0,0.0,590.4,0,0
11/3/12 23:00,1,0,0,1,16.4,50,11.0014,52,2012-03-11 23:00:00,23,11,3,2012,6,1,23,819.9999999999999,0,23,11.0014,377.2,0,0
5/8/12 15:00,3,0,0,1,36.9,37,35.0008,450,2012-08-05 15:00:00,15,5,8,2012,6,1,15,1365.3,0,15,35.0008,553.5,0,0
12/2/12 18:00,1,0,0,1,6.56,40,31.0009,96,2012-02-12 18:00:00,18,12,2,2012,6,1,18,262.4,0,18,31.0009,118.08,0,1
17/6/12 4:00,2,0,0,1,22.14,64,6.0032,18,2012-06-17 04:00:00,4,17,6,2012,6,1,4,1416.96,0,4,6.0032,88.56,0,0
18/6/11 3:00,2,0,0,1,24.6,88,6.0032,20,2011-06-18 03:00:00,3,18,6,2011,5,1,3,2164.8,0,3,6.0032,73.80000000000001,0,0
1/5/12 3:00,2,0,1,2,20.5,77,0.0,3,2012-05-01 03:00:00,3,1,5,2012,1,0,6,1578.5,3,0,0.0,61.5,0,0
10/11/11 4:00,4,0,1,1,15.58,94,6.0032,3,2011-11-10 04:00:00,4,10,11,2011,3,0,4,1464.52,4,0,6.0032,62.32,0,0
2/8/12 11:00,3,0,1,1,33.62,52,7.0015,226,2012-08-02 11:00:00,11,2,8,2012,3,0,11,1748.2399999999998,11,0,7.0015,369.82,0,0
2/9/12 21:00,3,0,0,1,28.7,70,11.0014,171,2012-09-02 21:00:00,21,2,9,2012,6,1,21,2009.0,0,21,11.0014,602.6999999999999,0,0
10/1/12 5:00,1,0,1,1,16.4,47,15.0013,23,2012-01-10 05:00:00,5,10,1,2012,1,0,5,770.8,5,0,15.0013,82.0,0,0
12/8/11 17:00,3,0,1,1,33.62,26,0.0,516,2011-08-12 17:00:00,17,12,8,2011,4,0,17,874.1199999999999,17,0,0.0,571.54,0,1
15/11/12 21:00,4,0,1,2,13.63763713,69,7.235684135,237,2012-11-15 21:00:00,21,15,11,2012,3,0,42,940.99696197,21,0,14.47136827,286.39037973,0,0
13/6/12 19:00,2,0,1,1,26.95855201,35,27.06968356,677,2012-06-13 19:00:00,19,13,6,2012,2,0,19,943.5493203499999,19,0,27.06968356,512.2124881899999,0,1
19/11/12 17:00,4,0,1,2,17.22,58,12.998,619,2012-11-19 17:00:00,17,19,11,2012,0,0,34,998.76,17,0,25.996,292.74,0,1
12/1/12 4:00,1,0,1,3,14.1739471,96,14.6667963,1,2012-01-12 04:00:00,4,12,1,2012,3,0,12,1360.6989216,4,0,44.0003889,56.6957884,0,0
9/1/11 12:00,1,0,0,1,7.242702012,37,30.6685571,78,2011-01-09 12:00:00,12,9,1,2011,6,1,12,267.979974444,0,12,30.6685571,86.912424144,0,0
13/4/11 19:00,2,0,1,1,18.04,62,16.9979,175,2011-04-13 19:00:00,19,13,4,2011,2,0,19,1118.48,19,0,16.9979,342.76,0,1
13/7/12 9:00,3,0,1,2,29.52,51,0.0,414,2012-07-13 09:00:00,9,13,7,2012,4,0,18,1505.52,9,0,0.0,265.68,1,0
8/6/11 6:00,2,0,1,1,26.24,89,8.9981,116,2011-06-08 06:00:00,6,8,6,2011,2,0,6,2335.3599999999997,6,0,8.9981,157.44,0,0
14/10/11 13:00,4,0,1,1,23.14992194,71,23.66865037,87,2011-10-14 13:00:00,13,14,10,2011,4,0,13,1643.64445774,13,0,23.66865037,300.94898522,0,0
1/4/12 23:00,2,0,0,3,18.86,72,0.0,63,2012-04-01 23:00:00,23,1,4,2012,6,1,69,1357.92,0,23,0.0,433.78,0,0
15/1/11 9:00,1,0,0,1,6.56,64,8.9981,33,2011-01-15 09:00:00,9,15,1,2011,5,1,9,419.84,0,9,8.9981,59.04,1,0
9/1/12 10:00,1,0,1,1,9.84,60,0.0,108,2012-01-09 10:00:00,10,9,1,2012,0,0,10,590.4,10,0,0.0,98.4,0,0
8/7/11 11:00,3,0,1,2,30.34,74,16.9979,165,2011-07-08 11:00:00,11,8,7,2011,4,0,22,2245.16,11,0,33.9958,333.74,0,0
8/10/12 1:00,4,1,0,1,14.29047765,86,10.55716574,46,2012-10-08 01:00:00,1,8,10,2012,0,0,1,1228.9810779,0,0,10.55716574,14.29047765,0,0
9/11/12 20:00,4,0,1,1,14.76,66,8.9981,255,2012-11-09 20:00:00,20,9,11,2012,4,0,20,974.16,20,0,8.9981,295.2,0,0
17/10/11 12:00,4,0,1,1,22.96,40,6.0032,205,2011-10-17 12:00:00,12,17,10,2011,0,0,12,918.4000000000001,12,0,6.0032,275.52,0,0
6/7/12 10:00,3,0,1,1,35.26,30,0.0,210,2012-07-06 10:00:00,10,6,7,2012,4,0,10,1057.8,10,0,0.0,352.59999999999997,0,0
5/5/11 5:00,2,0,1,1,13.94,66,16.9979,30,2011-05-05 05:00:00,5,5,5,2011,3,0,5,920.04,5,0,16.9979,69.7,0,0
2/3/12 10:00,1,0,1,1,14.76,50,11.0014,132,2012-03-02 10:00:00,10,2,3,2012,4,0,10,738.0,10,0,11.0014,147.6,0,0
12/2/11 4:00,1,0,0,1,4.92,74,6.0032,4,2011-02-12 04:00:00,4,12,2,2011,5,1,4,364.08,0,4,6.0032,19.68,0,0
9/4/11 6:00,2,0,0,2,12.65063765,92,14.04280606,1,2011-04-09 06:00:00,6,9,4,2011,5,1,12,1163.8586638,0,6,28.08561212,75.9038259,0,0
6/8/11 22:00,3,0,0,2,28.27770876,83,22.73112155,121,2011-08-06 22:00:00,22,6,8,2011,5,1,44,2347.04982708,0,22,45.4622431,622.10959272,0,0
6/4/12 22:00,2,0,1,1,16.4,35,15.0013,158,2012-04-06 22:00:00,22,6,4,2012,4,0,22,574.0,22,0,15.0013,360.79999999999995,0,0
11/8/11 5:00,3,0,1,1,26.24,61,12.998,25,2011-08-11 05:00:00,5,11,8,2011,3,0,5,1600.6399999999999,5,0,12.998,131.2,0,0
2/1/12 12:00,1,1,0,1,11.48,36,16.9979,202,2012-01-02 12:00:00,12,2,1,2012,0,0,12,413.28000000000003,0,0,16.9979,137.76,0,0
1/9/11 8:00,3,0,1,1,25.42,73,8.9981,498,2011-09-01 08:00:00,8,1,9,2011,3,0,8,1855.66,8,0,8.9981,203.36,1,0
14/10/11 13:00,4,0,1,1,22.96,73,23.9994,132,2011-10-14 13:00:00,13,14,10,2011,4,0,13,1676.0800000000002,13,0,23.9994,298.48,0,0
2/7/12 21:00,3,0,1,1,31.16,45,8.9981,258,2012-07-02 21:00:00,21,2,7,2012,0,0,21,1402.2,21,0,8.9981,654.36,0,0
8/5/11 1:00,2,0,0,2,21.32,55,0.0,64,2011-05-08 01:00:00,1,8,5,2011,6,1,2,1172.6,0,1,0.0,21.32,0,0
16/1/12 13:00,1,1,0,2,9.84,41,27.9993,228,2012-01-16 13:00:00,13,16,1,2012,0,0,26,403.44,0,0,55.9986,127.92,0,0
13/6/11 17:00,2,0,1,1,28.7,39,22.0028,601,2011-06-13 17:00:00,17,13,6,2011,0,0,17,1119.3,17,0,22.0028,487.9,0,1
16/3/11 17:00,1,0,1,2,18.04,54,19.9995,253,2011-03-16 17:00:00,17,16,3,2011,2,0,34,974.16,17,0,39.999,306.68,0,1
17/7/11 20:00,3,0,0,1,31.16,58,16.9979,262,2011-07-17 20:00:00,20,17,7,2011,6,1,20,1807.28,0,20,16.9979,623.2,0,0
7/10/11 7:00,4,0,1,1,17.22,94,0.0,242,2011-10-07 07:00:00,7,7,10,2011,4,0,7,1618.6799999999998,7,0,0.0,120.53999999999999,1,0
14/10/12 6:00,4,0,0,1,16.4,82,11.0014,24,2012-10-14 06:00:00,6,14,10,2012,6,1,6,1344.8,0,6,11.0014,98.39999999999999,0,0
1/6/11 1:00,2,0,1,1,28.7,84,16.9979,17,2011-06-01 01:00:00,1,1,6,2011,2,0,1,2410.7999999999997,1,0,16.9979,28.7,0,0
4/12/12 17:00,4,0,1,1,21.32,59,15.0013,743,2012-12-04 17:00:00,17,4,12,2012,1,0,17,1257.88,17,0,15.0013,362.44,0,1
12/6/12 21:00,2,0,1,1,27.88,83,7.0015,274,2012-06-12 21:00:00,21,12,6,2012,1,0,21,2314.04,21,0,7.0015,585.48,0,0
6/8/11 15:00,3,0,0,2,34.44,53,16.9979,362,2011-08-06 15:00:00,15,6,8,2011,5,1,30,1825.32,0,15,33.9958,516.5999999999999,0,0
11/6/11 9:00,2,0,0,1,30.34,62,8.9981,230,2011-06-11 09:00:00,9,11,6,2011,5,1,9,1881.08,0,9,8.9981,273.06,1,0
15/5/11 21:00,2,0,0,1,22.14,88,0.0,151,2011-05-15 21:00:00,21,15,5,2011,6,1,21,1948.3200000000002,0,21,0.0,464.94,0,0
8/7/11 2:00,3,0,1,2,28.7,74,11.0014,22,2011-07-08 02:00:00,2,8,7,2011,4,0,4,2123.7999999999997,2,0,22.0028,57.4,0,0
8/2/12 14:00,1,0,1,2,12.3,56,11.0014,108,2012-02-08 14:00:00,14,8,2,2012,2,0,28,688.8000000000001,14,0,22.0028,172.20000000000002,0,0
12/2/12 7:00,1,0,0,1,2.745611725,57,12.28791601,30,2012-02-12 07:00:00,7,12,2,2012,6,1,7,156.499868325,0,7,12.28791601,19.219282075,1,0
12/12/12 8:00,4,0,1,2,10.66,65,11.0014,688,2012-12-12 08:00:00,8,12,12,2012,2,0,16,692.9,8,0,22.0028,85.28,1,0
9/7/12 0:00,3,0,1,2,27.88,89,6.0032,39,2012-07-09 00:00:00,0,9,7,2012,0,0,0,2481.3199999999997,0,0,12.0064,0.0,0,0
11/5/11 14:00,2,0,1,1,25.42,53,6.0032,177,2011-05-11 14:00:00,14,11,5,2011,2,0,14,1347.26,14,0,6.0032,355.88,0,0
1/5/12 14:00,2,0,1,2,30.34,48,16.9979,204,2012-05-01 14:00:00,14,1,5,2012,1,0,28,1456.32,14,0,33.9958,424.76,0,0
14/7/11 18:00,3,0,1,1,29.52,42,12.998,578,2011-07-14 18:00:00,18,14,7,2011,3,0,18,1239.84,18,0,12.998,531.36,0,1
12/6/11 4:00,2,0,0,1,25.42,88,11.0014,14,2011-06-12 04:00:00,4,12,6,2011,6,1,4,2236.96,0,4,11.0014,101.68,0,0
16/5/11 13:00,2,0,1,1,27.88,51,0.0,214,2011-05-16 13:00:00,13,16,5,2011,0,0,13,1421.8799999999999,13,0,0.0,362.44,0,0
13/11/11 8:00,4,0,0,1,13.94,66,6.0032,79,2011-11-13 08:00:00,8,13,11,2011,6,1,8,920.04,0,8,6.0032,111.52,1,0
11/4/12 8:00,2,0,1,1,12.3,49,15.0013,595,2012-04-11 08:00:00,8,11,4,2012,2,0,8,602.7,8,0,15.0013,98.4,1,0
17/12/12 14:00,4,0,1,2,16.42842431,84,6.39831548,164,2012-12-17 14:00:00,14,17,12,2012,0,0,28,1379.98764204,14,0,12.79663096,229.99794034,0,0
1/11/12 0:00,4,0,1,1,14.76,57,6.0032,60,2012-11-01 00:00:00,0,1,11,2012,3,0,0,841.3199999999999,0,0,6.0032,0.0,0,0
19/6/12 5:00,2,0,1,2,24.37048411,79,13.10418042,38,2012-06-19 05:00:00,5,19,6,2012,1,0,10,1925.26824469,5,0,26.20836084,121.85242055,0,0
7/1/11 6:00,1,0,1,2,8.2,69,0.0,34,2011-01-07 06:00:00,6,7,1,2011,4,0,12,565.8,6,0,0.0,49.199999999999996,0,0
12/5/12 8:00,2,0,0,1,21.32,48,0.0,178,2012-05-12 08:00:00,8,12,5,2012,5,1,8,1023.36,0,8,0.0,170.56,1,0
4/4/11 18:00,2,0,1,2,29.52,23,32.9975,386,2011-04-04 18:00:00,18,4,4,2011,0,0,36,678.96,18,0,65.995,531.36,0,1
13/1/11 3:00,1,0,1,1,5.74,50,22.0028,3,2011-01-13 03:00:00,3,13,1,2011,3,0,3,287.0,3,0,22.0028,17.22,0,0
5/6/11 8:00,2,0,0,2,24.6,73,16.9979,98,2011-06-05 08:00:00,8,5,6,2011,6,1,16,1795.8000000000002,0,8,33.9958,196.8,1,0
15/6/11 16:00,2,0,1,1,31.16,27,8.9981,312,2011-06-15 16:00:00,16,15,6,2011,2,0,16,841.32,16,0,8.9981,498.56,0,0
17/8/11 9:00,3,0,1,1,30.34,48,6.0032,209,2011-08-17 09:00:00,9,17,8,2011,2,0,9,1456.32,9,0,6.0032,273.06,1,0
19/11/11 19:00,4,0,0,2,13.94,71,8.9981,182,2011-11-19 19:00:00,19,19,11,2011,5,1,38,989.74,0,19,17.9962,264.86,0,1
12/12/12 0:00,4,0,1,1,12.3,52,11.0014,34,2012-12-12 00:00:00,0,12,12,2012,2,0,0,639.6,0,0,11.0014,0.0,0,0
2/5/11 3:00,2,0,1,1,18.04,77,8.9981,16,2011-05-02 03:00:00,3,2,5,2011,0,0,3,1389.08,3,0,8.9981,54.12,0,0
1/10/12 1:00,4,0,1,1,17.57778716,79,5.130752178,4,2012-10-01 01:00:00,1,1,10,2012,0,0,1,1388.64518564,1,0,5.130752178,17.57778716,0,0
4/9/12 5:00,3,0,1,2,27.82922264,92,0.804414232,30,2012-09-04 05:00:00,5,4,9,2012,1,0,10,2560.28848288,5,0,1.608828464,139.1461132,0,0
10/10/11 14:00,4,1,0,1,31.39819225,39,0.0,376,2011-10-10 14:00:00,14,10,10,2011,0,0,14,1224.52949775,0,0,0.0,439.57469150000003,0,0
9/8/11 11:00,3,0,1,1,32.8,59,15.0013,149,2011-08-09 11:00:00,11,9,8,2011,1,0,11,1935.1999999999998,11,0,15.0013,360.79999999999995,0,0
15/8/11 3:00,3,0,1,1,24.6,83,12.998,7,2011-08-15 03:00:00,3,15,8,2011,0,0,3,2041.8000000000002,3,0,12.998,73.80000000000001,0,0
11/7/11 22:00,3,0,1,1,29.52,74,8.9981,90,2011-07-11 22:00:00,22,11,7,2011,0,0,22,2184.48,22,0,8.9981,649.4399999999999,0,0
1/12/12 23:00,4,0,0,2,13.12,81,0.0,126,2012-12-01 23:00:00,23,1,12,2012,5,1,46,1062.72,0,23,0.0,301.76,0,0
12/1/11 21:00,1,0,1,1,6.56,55,22.0028,57,2011-01-12 21:00:00,21,12,1,2011,2,0,21,360.79999999999995,21,0,22.0028,137.76,0,0
5/3/11 15:00,1,0,0,2,18.86,63,19.9995,205,2011-03-05 15:00:00,15,5,3,2011,5,1,30,1188.18,0,15,39.999,282.9,0,0
9/7/11 14:00,3,0,0,1,34.82655691,36,9.898470682,366,2011-07-09 14:00:00,14,9,7,2011,5,1,14,1253.75604876,0,14,9.898470682,487.57179674,0,0
13/6/11 22:00,2,0,1,1,25.42,46,15.0013,134,2011-06-13 22:00:00,22,13,6,2011,0,0,22,1169.3200000000002,22,0,15.0013,559.24,0,0
5/11/11 10:00,4,0,0,1,13.12,53,16.9979,227,2011-11-05 10:00:00,10,5,11,2011,5,1,10,695.36,0,10,16.9979,131.2,0,0
5/12/12 18:00,4,0,1,1,17.22,35,30.0026,609,2012-12-05 18:00:00,18,5,12,2012,2,0,18,602.6999999999999,18,0,30.0026,309.96,0,1
10/5/11 23:00,2,0,1,2,21.32,59,8.9981,81,2011-05-10 23:00:00,23,10,5,2011,1,0,46,1257.88,23,0,17.9962,490.36,0,0
17/3/12 8:00,1,0,0,2,17.22,94,7.0015,218,2012-03-17 08:00:00,8,17,3,2012,5,1,16,1618.6799999999998,0,8,14.003,137.76,1,0
18/6/12 9:00,2,0,1,2,21.82553757,81,13.90453612,264,2012-06-18 09:00:00,9,18,6,2012,0,0,18,1767.86854317,9,0,27.80907224,196.42983813,1,0
16/1/12 7:00,1,1,0,1,4.1,54,7.0015,33,2012-01-16 07:00:00,7,16,1,2012,0,0,7,221.39999999999998,0,0,7.0015,28.699999999999996,1,0
10/2/11 9:00,1,0,1,1,4.92,42,23.9994,122,2011-02-10 09:00:00,9,10,2,2011,3,0,9,206.64,9,0,23.9994,44.28,1,0
10/4/11 14:00,2,0,0,1,20.5,72,12.998,281,2011-04-10 14:00:00,14,10,4,2011,6,1,14,1476.0,0,14,12.998,287.0,0,0
14/4/12 10:00,2,0,0,1,18.86,51,11.0014,406,2012-04-14 10:00:00,10,14,4,2012,5,1,10,961.86,0,10,11.0014,188.6,0,0
18/7/12 1:00,3,0,1,1,31.16,66,7.0015,16,2012-07-18 01:00:00,1,18,7,2012,2,0,1,2056.56,1,0,7.0015,31.16,0,0
16/12/11 22:00,4,0,1,2,12.3,49,11.0014,106,2011-12-16 22:00:00,22,16,12,2011,4,0,44,602.7,22,0,22.0028,270.6,0,0
14/12/12 13:00,4,0,1,1,14.5577194,53,14.33452727,335,2012-12-14 13:00:00,13,14,12,2012,4,0,13,771.5591282,13,0,14.33452727,189.2503522,0,0
6/2/12 5:00,1,0,1,1,7.38,80,7.0015,17,2012-02-06 05:00:00,5,6,2,2012,0,0,5,590.4,5,0,7.0015,36.9,0,0
3/3/11 8:00,1,0,1,1,5.74,39,19.9995,220,2011-03-03 08:00:00,8,3,3,2011,3,0,8,223.86,8,0,19.9995,45.92,1,0
2/2/11 3:00,1,0,1,3,9.02,93,8.9981,1,2011-02-02 03:00:00,3,2,2,2011,2,0,9,838.86,3,0,26.994300000000003,27.06,0,0
15/12/12 12:00,4,0,0,1,15.58,50,6.0032,453,2012-12-15 12:00:00,12,15,12,2012,5,1,12,779.0,0,12,6.0032,186.96,0,0
12/9/12 9:00,3,0,1,1,24.6,64,8.9981,328,2012-09-12 09:00:00,9,12,9,2012,2,0,9,1574.4,9,0,8.9981,221.4,1,0
15/8/11 12:00,3,0,1,1,30.34,58,19.0012,178,2011-08-15 12:00:00,12,15,8,2011,0,0,12,1759.72,12,0,19.0012,364.08,0,0
6/3/12 1:00,1,0,1,1,8.2,44,16.9979,6,2012-03-06 01:00:00,1,6,3,2012,1,0,1,360.79999999999995,1,0,16.9979,8.2,0,0
16/8/12 18:00,3,0,1,1,32.8,36,0.0,832,2012-08-16 18:00:00,18,16,8,2012,3,0,18,1180.8,18,0,0.0,590.4,0,1
11/9/12 11:00,3,0,1,1,26.24,33,6.0032,247,2012-09-11 11:00:00,11,11,9,2012,1,0,11,865.92,11,0,6.0032,288.64,0,0
8/7/11 23:00,3,0,1,2,27.06,78,6.0032,151,2011-07-08 23:00:00,23,8,7,2011,4,0,46,2110.68,23,0,12.0064,622.38,0,0
5/9/11 6:00,3,1,0,2,27.06,74,8.9981,11,2011-09-05 06:00:00,6,5,9,2011,0,0,12,2002.4399999999998,0,0,17.9962,162.35999999999999,0,0
9/10/12 21:00,4,0,1,2,19.68,77,8.9981,225,2012-10-09 21:00:00,21,9,10,2012,1,0,42,1515.36,21,0,17.9962,413.28,0,0
10/3/12 19:00,1,0,0,1,13.94,25,0.0,184,2012-03-10 19:00:00,19,10,3,2012,5,1,19,348.5,0,19,0.0,264.86,0,1
16/4/11 21:00,2,0,0,2,18.04,94,0.0,14,2011-04-16 21:00:00,21,16,4,2011,5,1,42,1695.76,0,21,0.0,378.84,0,0
6/3/12 7:00,1,0,1,1,6.56,55,8.9981,275,2012-03-06 07:00:00,7,6,3,2012,1,0,7,360.79999999999995,7,0,8.9981,45.919999999999995,1,0
5/4/11 18:00,2,0,1,1,15.88638851,41,32.65446295,290,2011-04-05 18:00:00,18,5,4,2011,1,0,18,651.34192891,18,0,32.65446295,285.95499318,0,1
6/9/11 18:00,3,0,1,2,22.80790315,90,26.10125442,413,2011-09-06 18:00:00,18,6,9,2011,1,0,36,2052.7112835000003,18,0,52.20250884,410.54225670000005,0,1
10/2/12 12:00,1,0,1,2,12.3,42,8.9981,176,2012-02-10 12:00:00,12,10,2,2012,4,0,24,516.6,12,0,17.9962,147.60000000000002,0,0
3/2/12 20:00,1,0,1,1,14.7009776,48,6.974997039,158,2012-02-03 20:00:00,20,3,2,2012,4,0,20,705.6469248,20,0,6.974997039,294.019552,0,0
13/3/11 23:00,1,0,0,1,10.66,65,15.0013,28,2011-03-13 23:00:00,23,13,3,2011,6,1,23,692.9,0,23,15.0013,245.18,0,0
17/4/12 12:00,2,0,1,1,24.6,33,23.9994,244,2012-04-17 12:00:00,12,17,4,2012,1,0,12,811.8000000000001,12,0,23.9994,295.20000000000005,0,0
1/12/12 2:00,4,0,0,2,10.66,81,0.0,50,2012-12-01 02:00:00,2,1,12,2012,5,1,4,863.46,0,2,0.0,21.32,0,0
8/6/12 10:00,2,0,1,1,26.82652262,49,17.9795861,252,2012-06-08 10:00:00,10,8,6,2012,4,0,10,1314.49960838,10,0,17.9795861,268.2652262,0,0
14/11/11 9:00,4,0,1,2,19.68,67,22.0028,233,2011-11-14 09:00:00,9,14,11,2011,0,0,18,1318.56,9,0,44.0056,177.12,1,0
14/3/12 19:00,1,0,1,1,26.24,33,11.0014,472,2012-03-14 19:00:00,19,14,3,2012,2,0,19,865.92,19,0,11.0014,498.55999999999995,0,1
19/12/12 10:00,4,0,1,1,13.08494158,73,7.462707698,195,2012-12-19 10:00:00,10,19,12,2012,2,0,10,955.20073534,10,0,7.462707698,130.8494158,0,0
2/11/11 18:00,4,0,1,1,17.22,71,11.0014,479,2011-11-02 18:00:00,18,2,11,2011,2,0,18,1222.62,18,0,11.0014,309.96,0,1
8/4/11 13:00,2,0,1,3,14.76,76,19.0012,42,2011-04-08 13:00:00,13,8,4,2011,4,0,39,1121.76,13,0,57.003600000000006,191.88,0,0
11/7/11 23:00,3,0,1,1,28.7,79,8.9981,55,2011-07-11 23:00:00,23,11,7,2011,0,0,23,2267.2999999999997,23,0,8.9981,660.1,0,0
5/4/12 0:00,2,0,1,1,21.32,23,27.9993,45,2012-04-05 00:00:00,0,5,4,2012,3,0,0,490.36,0,0,27.9993,0.0,0,0
7/12/11 9:00,4,0,1,3,18.04,100,16.9979,64,2011-12-07 09:00:00,9,7,12,2011,2,0,27,1804.0,9,0,50.993700000000004,162.35999999999999,1,0
13/3/12 12:00,1,0,1,1,24.6,60,19.0012,244,2012-03-13 12:00:00,12,13,3,2012,1,0,12,1476.0,12,0,19.0012,295.20000000000005,0,0
12/10/11 16:00,4,0,1,2,22.96,88,15.0013,55,2011-10-12 16:00:00,16,12,10,2011,2,0,32,2020.48,16,0,30.0026,367.36,0,0
15/11/12 15:00,4,0,1,2,15.58,58,11.0014,217,2012-11-15 15:00:00,15,15,11,2012,3,0,30,903.64,15,0,22.0028,233.7,0,0
19/1/11 0:00,1,0,1,2,9.02,93,0.0,3,2011-01-19 00:00:00,0,19,1,2011,2,0,0,838.86,0,0,0.0,0.0,0,0
13/11/12 20:00,4,0,1,1,12.3,49,23.9994,223,2012-11-13 20:00:00,20,13,11,2012,1,0,20,602.7,20,0,23.9994,246.0,0,0
3/1/12 15:00,1,0,1,1,6.56,37,27.9993,77,2012-01-03 15:00:00,15,3,1,2012,1,0,15,242.72,15,0,27.9993,98.39999999999999,0,0
3/11/12 9:00,4,0,0,2,14.80421962,52,18.01210523,213,2012-11-03 09:00:00,9,3,11,2012,5,1,18,769.81942024,0,9,36.02421046,133.23797658,1,0
1/6/11 14:00,2,0,1,1,36.9,37,16.9979,145,2011-06-01 14:00:00,14,1,6,2011,2,0,14,1365.3,14,0,16.9979,516.6,0,0
13/5/11 13:00,2,0,1,2,21.32,88,26.0027,226,2011-05-13 13:00:00,13,13,5,2011,4,0,26,1876.16,13,0,52.0054,277.16,0,0
1/10/12 12:00,4,0,1,2,24.6,43,11.0014,323,2012-10-01 12:00:00,12,1,10,2012,0,0,24,1057.8,12,0,22.0028,295.20000000000005,0,0
3/5/12 0:00,2,0,1,2,19.68,82,15.0013,90,2012-05-03 00:00:00,0,3,5,2012,3,0,0,1613.76,0,0,30.0026,0.0,0,0
8/5/12 9:00,2,0,1,2,22.96,68,23.9994,295,2012-05-08 09:00:00,9,8,5,2012,1,0,18,1561.28,9,0,47.9988,206.64000000000001,1,0
11/2/11 9:00,1,0,1,1,4.92,74,15.0013,140,2011-02-11 09:00:00,9,11,2,2011,4,0,9,364.08,9,0,15.0013,44.28,1,0
10/12/12 1:00,4,0,1,2,14.76,100,0.0,4,2012-12-10 01:00:00,1,10,12,2012,0,0,2,1476.0,1,0,0.0,14.76,0,0
2/3/11 6:00,1,0,1,1,9.02,55,16.9979,40,2011-03-02 06:00:00,6,2,3,2011,2,0,6,496.09999999999997,6,0,16.9979,54.12,0,0
19/12/11 13:00,4,0,1,1,13.94,49,22.0028,142,2011-12-19 13:00:00,13,19,12,2011,0,0,13,683.06,13,0,22.0028,181.22,0,0
19/5/12 8:00,2,0,0,1,21.40378622,52,10.6287767,174,2012-05-19 08:00:00,8,19,5,2012,5,1,8,1112.9968834400001,0,8,10.6287767,171.23028976,1,0
13/9/12 14:00,3,0,1,1,29.52,39,8.9981,274,2012-09-13 14:00:00,14,13,9,2012,3,0,14,1151.28,14,0,8.9981,413.28,0,0
19/6/11 10:00,2,0,0,2,28.7,61,7.0015,244,2011-06-19 10:00:00,10,19,6,2011,6,1,20,1750.7,0,10,14.003,287.0,0,0
5/3/11 18:00,1,0,0,2,18.31142538,59,23.05490733,162,2011-03-05 18:00:00,18,5,3,2011,5,1,36,1080.37409742,0,18,46.10981466,329.60565684,0,1
15/9/12 23:00,3,0,0,1,22.09602341,62,0.519112111,241,2012-09-15 23:00:00,23,15,9,2012,5,1,23,1369.95345142,0,23,0.519112111,508.20853843000003,0,0
19/8/11 7:00,3,0,1,2,27.06,83,6.0032,263,2011-08-19 07:00:00,7,19,8,2011,4,0,14,2245.98,7,0,12.0064,189.42,1,0
18/4/11 2:00,2,0,1,1,17.22,67,7.0015,16,2011-04-18 02:00:00,2,18,4,2011,0,0,2,1153.74,2,0,7.0015,34.44,0,0
1/8/12 21:00,3,0,1,1,29.52,70,8.9981,320,2012-08-01 21:00:00,21,1,8,2012,2,0,21,2066.4,21,0,8.9981,619.92,0,0
5/6/12 8:00,2,0,1,2,19.68,77,15.0013,710,2012-06-05 08:00:00,8,5,6,2012,1,0,16,1515.36,8,0,30.0026,157.44,1,0
4/3/11 7:00,1,0,1,1,6.56,80,8.9981,83,2011-03-04 07:00:00,7,4,3,2011,4,0,7,524.8,7,0,8.9981,45.919999999999995,1,0
9/9/12 17:00,3,0,0,1,28.7,37,16.9979,671,2012-09-09 17:00:00,17,9,9,2012,6,1,17,1061.8999999999999,0,17,16.9979,487.9,0,1
9/8/11 9:00,3,0,1,2,31.98,62,8.9981,175,2011-08-09 09:00:00,9,9,8,2011,1,0,18,1982.76,9,0,17.9962,287.82,1,0
3/11/11 9:00,4,0,1,2,14.76,81,12.998,164,2011-11-03 09:00:00,9,3,11,2011,3,0,18,1195.56,9,0,25.996,132.84,1,0
14/1/12 2:00,1,0,0,1,6.56,47,11.0014,38,2012-01-14 02:00:00,2,14,1,2012,5,1,2,308.32,0,2,11.0014,13.12,0,0
15/8/11 6:00,3,0,1,1,26.3917455,92,16.94190967,68,2011-08-15 06:00:00,6,15,8,2011,0,0,6,2428.040586,6,0,16.94190967,158.350473,0,0
3/12/12 8:00,4,0,1,1,14.76,93,0.0,731,2012-12-03 08:00:00,8,3,12,2012,0,0,8,1372.68,8,0,0.0,118.08,1,0
5/2/11 4:00,1,0,0,3,9.518612013,91,8.377520167,42,2011-02-05 04:00:00,4,5,2,2011,5,1,12,866.193693183,0,4,25.132560501,38.074448052,0,0
11/11/11 16:00,4,1,0,1,14.76,34,22.0028,238,2011-11-11 16:00:00,16,11,11,2011,4,0,16,501.84,0,0,22.0028,236.16,0,0
16/4/11 12:00,2,0,0,2,18.86,88,39.0007,32,2011-04-16 12:00:00,12,16,4,2011,5,1,24,1659.6799999999998,0,12,78.0014,226.32,0,0
2/8/11 14:00,3,0,1,1,36.9,25,19.0012,159,2011-08-02 14:00:00,14,2,8,2011,1,0,14,922.5,14,0,19.0012,516.6,0,0
5/11/12 15:00,4,0,1,1,15.58,40,19.0012,231,2012-11-05 15:00:00,15,5,11,2012,0,0,15,623.2,15,0,19.0012,233.7,0,0
6/2/11 21:00,1,0,0,1,10.66,60,0.0,27,2011-02-06 21:00:00,21,6,2,2011,6,1,21,639.6,0,21,0.0,223.86,0,0
15/5/11 6:00,2,0,0,2,21.56999288,96,10.076231,1,2011-05-15 06:00:00,6,15,5,2011,6,1,12,2070.71931648,0,6,20.152462,129.41995728,0,0
12/10/11 7:00,4,0,1,2,22.14,88,26.0027,259,2011-10-12 07:00:00,7,12,10,2011,2,0,14,1948.3200000000002,7,0,52.0054,154.98000000000002,1,0
2/10/11 3:00,4,0,0,3,13.5621159,88,17.83118525,14,2011-10-02 03:00:00,3,2,10,2011,6,1,9,1193.4661992000001,0,3,53.49355575,40.6863477,0,0
7/3/12 2:00,1,0,1,1,12.3,56,19.0012,4,2012-03-07 02:00:00,2,7,3,2012,2,0,2,688.8000000000001,2,0,19.0012,24.6,0,0
5/1/11 22:00,1,0,1,1,7.38,55,8.9981,42,2011-01-05 22:00:00,22,5,1,2011,2,0,22,405.9,22,0,8.9981,162.35999999999999,0,0
6/4/11 9:00,2,0,1,1,14.76,46,16.9979,165,2011-04-06 09:00:00,9,6,4,2011,2,0,9,678.96,9,0,16.9979,132.84,1,0
11/11/12 14:00,4,0,0,1,24.6,33,11.0014,654,2012-11-11 14:00:00,14,11,11,2012,6,1,14,811.8000000000001,0,14,11.0014,344.40000000000003,0,0
13/4/12 3:00,2,0,1,1,13.42465109,58,11.9421335,50,2012-04-13 03:00:00,3,13,4,2012,4,0,3,778.62976322,3,0,11.9421335,40.27395327,0,0
9/12/11 8:00,4,0,1,1,9.84,81,0.0,385,2011-12-09 08:00:00,8,9,12,2011,4,0,8,797.04,8,0,0.0,78.72,1,0
9/10/11 14:00,4,0,0,1,27.99759186,43,11.99313316,468,2011-10-09 14:00:00,14,9,10,2011,6,1,14,1203.89644998,0,14,11.99313316,391.96628604,0,0
7/4/12 23:00,2,0,0,1,18.86,23,15.0013,118,2012-04-07 23:00:00,23,7,4,2012,5,1,23,433.78,0,23,15.0013,433.78,0,0
1/1/11 0:00,1,0,0,1,9.84,81,0.0,16,2011-01-01 00:00:00,0,1,1,2011,5,1,0,797.04,0,0,0.0,0.0,0,0
18/10/12 19:00,4,0,1,2,23.19673766,69,22.02056438,494,2012-10-18 19:00:00,19,18,10,2012,3,0,38,1600.57489854,19,0,44.04112876,440.73801554,0,1
17/11/12 16:00,4,0,0,1,16.4,40,15.0013,469,2012-11-17 16:00:00,16,17,11,2012,5,1,16,656.0,0,16,15.0013,262.4,0,0
10/11/12 15:00,4,0,0,1,21.32,45,0.0,567,2012-11-10 15:00:00,15,10,11,2012,5,1,15,959.4,0,15,0.0,319.8,0,0
3/11/12 2:00,4,0,0,2,13.94,49,16.9979,46,2012-11-03 02:00:00,2,3,11,2012,5,1,4,683.06,0,2,33.9958,27.88,0,0
14/3/12 4:00,1,0,1,1,19.68,67,6.0032,5,2012-03-14 04:00:00,4,14,3,2012,2,0,4,1318.56,4,0,6.0032,78.72,0,0
19/3/11 7:00,1,0,0,1,16.4,50,22.0028,13,2011-03-19 07:00:00,7,19,3,2011,5,1,7,819.9999999999999,0,7,22.0028,114.79999999999998,1,0
15/3/12 3:00,1,0,1,1,20.5,63,0.0,7,2012-03-15 03:00:00,3,15,3,2012,3,0,3,1291.5,3,0,0.0,61.5,0,0
16/10/12 21:00,4,0,1,1,18.86,63,0.0,195,2012-10-16 21:00:00,21,16,10,2012,1,0,21,1188.18,21,0,0.0,396.06,0,0
10/9/12 4:00,3,0,1,1,21.32,68,19.0012,5,2012-09-10 04:00:00,4,10,9,2012,0,0,4,1449.76,4,0,19.0012,85.28,0,0
5/6/11 18:00,2,0,0,1,28.7,58,7.0015,363,2011-06-05 18:00:00,18,5,6,2011,6,1,18,1664.6,0,18,7.0015,516.6,0,1
19/11/11 13:00,4,0,0,1,17.22,30,19.0012,363,2011-11-19 13:00:00,13,19,11,2011,5,1,13,516.5999999999999,0,13,19.0012,223.85999999999999,0,0
8/9/11 9:00,3,0,1,2,24.43871699,100,14.77981027,58,2011-09-08 09:00:00,9,8,9,2011,3,0,18,2443.871699,9,0,29.55962054,219.94845291,1,0
13/6/11 12:00,2,0,1,1,28.03177598,41,19.95364809,201,2011-06-13 12:00:00,12,13,6,2011,0,0,12,1149.30281518,12,0,19.95364809,336.38131176,0,0
3/5/12 11:00,2,0,1,1,22.14,77,0.0,201,2012-05-03 11:00:00,11,3,5,2012,3,0,11,1704.78,11,0,0.0,243.54000000000002,0,0
6/5/12 17:00,2,0,0,2,25.42,65,8.9981,511,2012-05-06 17:00:00,17,6,5,2012,6,1,34,1652.3000000000002,0,17,17.9962,432.14000000000004,0,1
13/5/11 17:00,2,0,1,3,21.32,88,11.0014,491,2011-05-13 17:00:00,17,13,5,2011,4,0,51,1876.16,17,0,33.0042,362.44,0,1
2/9/12 23:00,3,0,0,3,27.24354638,90,5.612659654,153,2012-09-02 23:00:00,23,2,9,2012,6,1,69,2451.9191742000003,0,23,16.837978962,626.6015667400001,0,0
7/4/11 5:00,2,0,1,1,13.94,76,15.0013,6,2011-04-07 05:00:00,5,7,4,2011,3,0,5,1059.44,5,0,15.0013,69.7,0,0
15/9/11 1:00,3,0,1,1,26.24,69,11.0014,20,2011-09-15 01:00:00,1,15,9,2011,3,0,1,1810.56,1,0,11.0014,26.24,0,0
17/10/12 14:00,4,0,1,2,22.96,43,11.0014,270,2012-10-17 14:00:00,14,17,10,2012,2,0,28,987.2800000000001,14,0,22.0028,321.44,0,0
16/1/12 23:00,1,1,0,3,10.20758024,71,19.40071746,22,2012-01-16 23:00:00,23,16,1,2012,0,0,69,724.73819704,0,0,58.20215238,234.77434552,0,0
15/3/12 2:00,1,0,1,1,20.5,59,0.0,19,2012-03-15 02:00:00,2,15,3,2012,3,0,2,1209.5,2,0,0.0,41.0,0,0
8/7/11 15:00,3,0,1,2,32.8,63,23.9994,141,2011-07-08 15:00:00,15,8,7,2011,4,0,30,2066.3999999999996,15,0,47.9988,491.99999999999994,0,0
7/7/12 22:00,3,0,0,1,34.44,59,12.998,220,2012-07-07 22:00:00,22,7,7,2012,5,1,22,2031.9599999999998,0,22,12.998,757.68,0,0
15/3/11 20:00,1,0,1,2,13.94,71,19.0012,88,2011-03-15 20:00:00,20,15,3,2011,1,0,40,989.74,20,0,38.0024,278.8,0,0
4/6/11 15:00,2,0,0,2,30.34,27,27.9993,404,2011-06-04 15:00:00,15,4,6,2011,5,1,30,819.18,0,15,55.9986,455.1,0,0
14/1/12 8:00,1,0,0,1,4.92,54,7.0015,92,2012-01-14 08:00:00,8,14,1,2012,5,1,8,265.68,0,8,7.0015,39.36,1,0
7/4/12 9:00,2,0,0,1,15.74951822,29,16.79595797,277,2012-04-07 09:00:00,9,7,4,2012,5,1,9,456.73602838,0,9,16.79595797,141.74566398000002,1,0
11/3/12 8:00,1,0,0,1,8.454318814,72,10.034135,78,2012-03-11 08:00:00,8,11,3,2012,6,1,8,608.7109546080001,0,8,10.034135,67.634550512,1,0
1/1/11 18:00,1,0,0,3,17.22,88,16.9979,35,2011-01-01 18:00:00,18,1,1,2011,5,1,54,1515.36,0,18,50.993700000000004,309.96,0,1
15/11/12 6:00,4,0,1,2,12.3,65,16.9979,147,2012-11-15 06:00:00,6,15,11,2012,3,0,12,799.5,6,0,33.9958,73.80000000000001,0,0
9/2/11 1:00,1,0,1,1,3.142018265,37,15.00578266,7,2011-02-09 01:00:00,1,9,2,2011,2,0,1,116.25467580499999,1,0,15.00578266,3.142018265,0,0
4/5/11 10:00,2,0,1,2,13.94,93,19.0012,31,2011-05-04 10:00:00,10,4,5,2011,2,0,20,1296.4199999999998,10,0,38.0024,139.4,0,0
8/11/11 16:00,4,0,1,1,22.96,46,8.9981,289,2011-11-08 16:00:00,16,8,11,2011,1,0,16,1056.16,16,0,8.9981,367.36,0,0
1/8/11 17:00,3,0,1,1,31.16,45,19.9995,514,2011-08-01 17:00:00,17,1,8,2011,0,0,17,1402.2,17,0,19.9995,529.72,0,1
17/11/11 22:00,4,0,1,1,10.66,52,16.9979,84,2011-11-17 22:00:00,22,17,11,2011,3,0,22,554.32,22,0,16.9979,234.52,0,0
7/5/12 14:00,2,0,1,2,25.42,50,23.9994,239,2012-05-07 14:00:00,14,7,5,2012,0,0,28,1271.0,14,0,47.9988,355.88,0,0
6/3/11 4:00,1,0,0,2,17.22,88,23.9994,3,2011-03-06 04:00:00,4,6,3,2011,6,1,8,1515.36,0,4,47.9988,68.88,0,0
2/5/11 17:00,2,0,1,1,27.06,65,12.998,537,2011-05-02 17:00:00,17,2,5,2011,0,0,17,1758.8999999999999,17,0,12.998,460.02,0,1
13/1/11 22:00,1,0,1,1,5.74,46,22.0028,30,2011-01-13 22:00:00,22,13,1,2011,3,0,22,264.04,22,0,22.0028,126.28,0,0
16/10/12 3:00,4,0,1,1,17.22,67,7.0015,2,2012-10-16 03:00:00,3,16,10,2012,1,0,3,1153.74,3,0,7.0015,51.66,0,0
14/8/11 11:00,3,0,0,1,28.7,79,12.998,198,2011-08-14 11:00:00,11,14,8,2011,6,1,11,2267.2999999999997,0,11,12.998,315.7,0,0
17/7/11 10:00,3,0,0,1,30.34,60,15.0013,304,2011-07-17 10:00:00,10,17,7,2011,6,1,10,1820.4,0,10,15.0013,303.4,0,0
2/8/11 9:00,3,0,1,1,30.64824112,47,20.98130812,216,2011-08-02 09:00:00,9,2,8,2011,1,0,9,1440.46733264,9,0,20.98130812,275.83417008000004,1,0
13/10/11 12:00,4,0,1,2,24.50012931,88,0.0,145,2011-10-13 12:00:00,12,13,10,2011,3,0,24,2156.01137928,12,0,0.0,294.00155171999995,0,0
1/10/11 18:00,4,0,0,3,15.01562202,87,16.00074178,123,2011-10-01 18:00:00,18,1,10,2011,5,1,54,1306.35911574,0,18,48.002225339999995,270.28119636,0,1
11/12/12 19:00,4,0,1,1,13.12,53,15.0013,433,2012-12-11 19:00:00,19,11,12,2012,1,0,19,695.36,19,0,15.0013,249.27999999999997,0,1
8/7/11 0:00,3,0,1,1,30.34,66,7.0015,47,2011-07-08 00:00:00,0,8,7,2011,4,0,0,2002.44,0,0,7.0015,0.0,0,0
1/8/11 10:00,3,0,1,1,35.26,36,11.0014,97,2011-08-01 10:00:00,10,1,8,2011,0,0,10,1269.36,10,0,11.0014,352.59999999999997,0,0
19/7/12 2:00,3,0,1,1,29.52,70,12.998,7,2012-07-19 02:00:00,2,19,7,2012,3,0,2,2066.4,2,0,12.998,59.04,0,0
18/2/11 4:00,1,0,1,1,18.23811164,66,16.39439002,1,2011-02-18 04:00:00,4,18,2,2011,4,0,4,1203.7153682399999,4,0,16.39439002,72.95244656,0,0
11/8/12 12:00,3,0,0,1,31.16,58,15.0013,546,2012-08-11 12:00:00,12,11,8,2012,5,1,12,1807.28,0,12,15.0013,373.92,0,0
16/12/11 14:00,4,0,1,2,13.89846859,45,14.00419886,165,2011-12-16 14:00:00,14,16,12,2011,4,0,28,625.43108655,14,0,28.00839772,194.57856026000002,0,0
15/1/11 19:00,1,0,0,2,13.12,39,16.9979,74,2011-01-15 19:00:00,19,15,1,2011,5,1,38,511.67999999999995,0,19,33.9958,249.27999999999997,0,1
3/1/12 10:00,1,0,1,1,6.56,47,31.0009,60,2012-01-03 10:00:00,10,3,1,2012,1,0,10,308.32,10,0,31.0009,65.6,0,0
1/4/12 4:00,2,0,0,2,13.94,81,6.0032,12,2012-04-01 04:00:00,4,1,4,2012,6,1,8,1129.1399999999999,0,4,12.0064,55.76,0,0
5/2/11 20:00,1,0,0,1,12.3,87,16.9979,69,2011-02-05 20:00:00,20,5,2,2011,5,1,20,1070.1000000000001,0,20,16.9979,246.0,0,0
6/11/11 15:00,4,0,0,1,19.68,51,12.998,306,2011-11-06 15:00:00,15,6,11,2011,6,1,15,1003.68,0,15,12.998,295.2,0,0
10/2/11 16:00,1,0,1,1,6.797140851,26,20.36855475,70,2011-02-10 16:00:00,16,10,2,2011,3,0,16,176.725662126,16,0,20.36855475,108.754253616,0,0
3/8/12 6:00,3,0,1,1,27.06,83,15.0013,163,2012-08-03 06:00:00,6,3,8,2012,4,0,6,2245.98,6,0,15.0013,162.35999999999999,0,0
1/11/11 20:00,4,0,1,1,16.4,71,0.0,209,2011-11-01 20:00:00,20,1,11,2011,1,0,20,1164.3999999999999,20,0,0.0,328.0,0,0
9/2/11 12:00,1,0,1,2,7.38,40,15.0013,61,2011-02-09 12:00:00,12,9,2,2011,2,0,24,295.2,12,0,30.0026,88.56,0,0
2/2/11 4:00,1,0,1,3,9.02,93,19.0012,1,2011-02-02 04:00:00,4,2,2,2011,2,0,12,838.86,4,0,57.003600000000006,36.08,0,0
18/12/11 13:00,4,0,0,1,12.3,49,19.9995,228,2011-12-18 13:00:00,13,18,12,2011,6,1,13,602.7,0,13,19.9995,159.9,0,0
11/11/12 13:00,4,0,0,1,21.49211156,42,7.354743731,667,2012-11-11 13:00:00,13,11,11,2012,6,1,13,902.66868552,0,13,7.354743731,279.39745028000004,0,0
14/12/11 1:00,4,0,1,1,10.66,75,0.0,8,2011-12-14 01:00:00,1,14,12,2011,2,0,1,799.5,1,0,0.0,10.66,0,0
15/10/12 17:00,4,0,1,1,22.96,64,16.9979,766,2012-10-15 17:00:00,17,15,10,2012,0,0,17,1469.44,17,0,16.9979,390.32,0,1
13/6/11 9:00,2,0,1,1,25.20136764,47,23.99983289,204,2011-06-13 09:00:00,9,13,6,2011,0,0,9,1184.46427908,9,0,23.99983289,226.81230876,1,0
6/3/12 14:00,1,0,1,1,12.57452324,35,13.93902476,130,2012-03-06 14:00:00,14,6,3,2012,1,0,14,440.1083134,14,0,13.93902476,176.04332535999998,0,0
5/7/12 6:00,3,0,1,1,29.52,58,0.0,133,2012-07-05 06:00:00,6,5,7,2012,3,0,6,1712.16,6,0,0.0,177.12,0,0
8/10/12 9:00,4,1,0,2,15.58,66,11.0014,332,2012-10-08 09:00:00,9,8,10,2012,0,0,18,1028.28,0,0,22.0028,140.22,1,0
17/8/12 4:00,3,0,1,1,26.24,73,11.0014,9,2012-08-17 04:00:00,4,17,8,2012,4,0,4,1915.52,4,0,11.0014,104.96,0,0
3/3/11 20:00,1,0,1,1,8.2,40,6.0032,70,2011-03-03 20:00:00,20,3,3,2011,3,0,20,328.0,20,0,6.0032,164.0,0,0
5/3/12 0:00,1,0,1,1,9.84,44,12.998,17,2012-03-05 00:00:00,0,5,3,2012,0,0,0,432.96,0,0,12.998,0.0,0,0
7/12/11 7:00,4,0,1,3,18.04,100,7.0015,46,2011-12-07 07:00:00,7,7,12,2011,2,0,21,1804.0,7,0,21.0045,126.28,1,0
8/11/11 23:00,4,0,1,1,14.76,81,0.0,48,2011-11-08 23:00:00,23,8,11,2011,1,0,23,1195.56,23,0,0.0,339.48,0,0
16/7/11 19:00,3,0,0,1,30.34,48,12.998,406,2011-07-16 19:00:00,19,16,7,2011,5,1,19,1456.32,0,19,12.998,576.46,0,1
15/7/11 23:00,3,0,1,1,26.24,61,11.0014,167,2011-07-15 23:00:00,23,15,7,2011,4,0,23,1600.6399999999999,23,0,11.0014,603.52,0,0
1/10/12 6:00,4,0,1,1,17.64465428,75,7.560720191,172,2012-10-01 06:00:00,6,1,10,2012,0,0,6,1323.349071,6,0,7.560720191,105.86792568000001,0,0
7/7/12 21:00,3,0,0,1,36.08,37,12.998,201,2012-07-07 21:00:00,21,7,7,2012,5,1,21,1334.96,0,21,12.998,757.68,0,0
10/10/12 2:00,4,0,1,2,18.86,88,0.0,8,2012-10-10 02:00:00,2,10,10,2012,2,0,4,1659.6799999999998,2,0,0.0,37.72,0,0
4/7/12 23:00,3,1,0,2,32.02167069,42,7.735876074,192,2012-07-04 23:00:00,23,4,7,2012,2,0,46,1344.91016898,0,0,15.471752148,736.49842587,0,0
14/8/12 9:00,3,0,1,2,28.7,74,0.0,402,2012-08-14 09:00:00,9,14,8,2012,1,0,18,2123.7999999999997,9,0,0.0,258.3,1,0
